{"hash": "05bbee2a0e2e78a3b92294f93e0947d2e290b6adf1165a0b6416d38f9c8bdbfd", "kind": "trial_completed", "payload": {"champion_before": "t0076", "debug_depth": 0, "delta_vs_champion_before": -0.0008577406167582513, "delta_vs_parent": -0.0008577406167582513, "finding": "t0087 improved the prior champion: val_bpb=0.969277, delta=-0.000858. Hypothesis: The value embeddings are initialised with a scale meant for a different kind of parameter, and the mismatch is large and quantifiable. init_weights computes s as sqrt(3) times n_embd to the minus one half, which is a fan-in scale appropriate for the projections c_q, c_k, c_v and c_fc, each of which sums 512 inputs. It then applies the same s to the value-embedding tables, which are embeddings with fan-in one: a single row is selected per token. The consequence is that a value embedding starts with element RMS s over sqrt(3), about 0.044, while the stream it is added to, v equals c_v of x, has element RMS 1.0, so the path begins 22.6 times weaker than what it modifies. That transformer.wte is initialised with normal of standard deviation 1.0 rather than with s shows the file already distinguishes embeddings from projections elsewhere. This matters because the value-embedding path is the most load-bearing mechanism measured in this campaign: extending it to every layer gained 0.001806 and halving its width cost 0.005427. Initialising it to match the value stream should let it contribute from the first step instead of having to grow into relevance within 300 seconds.", "measurements": [{"command": ["/data/home/zhubaiyu/.local/bin/uv", "run", "--project", "/data3/zhubaiyu/fengheguai/campaigns/h200-claude/nodes/t0087", "python", "/data3/zhubaiyu/fengheguai/fengheguai/_audit_runner.py", "--target", "/data3/zhubaiyu/fengheguai/campaigns/h200-claude/nodes/t0087", "--nonce", "61bbab831793b0cfe9638a3104868f7e628a8fd24999bf55"], "errors": [], "evidence_path": "/data3/zhubaiyu/fengheguai/campaigns/h200-claude/evidence/t0087-r0/evidence.json", "evidence_sha256": "db62086e3e50b9e6a75faa9be249d2dccd5b9a1ab41cb58b69742eb7dd69521d", "log_path": "/data3/zhubaiyu/fengheguai/campaigns/h200-claude/evidence/t0087-r0/run.log", "log_sha256": "48fe54dc497cfbd5e17a8aa884bb180280125b28ceb0949ecf8781dd5020a74d", "metric": 0.9691742944748317, "num_steps": 2875, "peak_vram_mb": 33800.4, "return_code": 0, "status": "valid", "timed_out": false, "train_sha256": "16e0410971b539ff75797a1eb31b10ab864213cc16237f05ae4c7557ca7eb35f", "training_seconds": 300.1, "wall_seconds": 485.0597940161824}, {"command": ["/data/home/zhubaiyu/.local/bin/uv", "run", "--project", "/data3/zhubaiyu/fengheguai/campaigns/h200-claude/nodes/t0087", "python", "/data3/zhubaiyu/fengheguai/fengheguai/_audit_runner.py", "--target", "/data3/zhubaiyu/fengheguai/campaigns/h200-claude/nodes/t0087", "--nonce", "d7b4cedcab9ba9a48df19db11927d8bae489b015bc7df16e"], "errors": [], "evidence_path": "/data3/zhubaiyu/fengheguai/campaigns/h200-claude/evidence/t0087-r1/evidence.json", "evidence_sha256": "4ace3eda69ca6a78f6c5bce17219dd052aba739dea17820c94654c86b49fdf0b", "log_path": "/data3/zhubaiyu/fengheguai/campaigns/h200-claude/evidence/t0087-r1/run.log", "log_sha256": "be90705a3ae8f0de73f9feeb44767b0914875b71eb07d3b4e26b0c52eb90a24a", "metric": 0.9693800466223705, "num_steps": 2873, "peak_vram_mb": 33800.4, "return_code": 0, "status": "valid", "timed_out": false, "train_sha256": "16e0410971b539ff75797a1eb31b10ab864213cc16237f05ae4c7557ca7eb35f", "training_seconds": 300.1, "wall_seconds": 479.6187136732042}], "metric": 0.9692771705486012, "parent_id": "t0076", "patch_path": "/data3/zhubaiyu/fengheguai/campaigns/h200-claude/artifacts/t0087/change.patch", "patch_sha256": "19dbb3ad8be11bcbc18dbab537f5e1204ae235f5cca41bbb57c72d7448bab50d", "promoted": true, "proposal": {"change_summary": "One initialisation changed on champion t0076: the value-embedding tables move from uniform plus or minus s, which is 0.0766, to uniform plus or minus sqrt(3), giving element RMS 1.0 and matching the measured RMS of the v stream they are added to. The projections keep s unchanged, and transformer.wte keeps its normal 1.0 init. This is safe at initialisation despite the size of the change because attn.c_proj is zero-initialised, so the attention block contributes nothing to the residual stream on the first step regardless of the value magnitude; the effect is on the gradients that flow back into the embeddings and the gate. Depth 12, width 512, HEAD_DIM 128, the SSL pattern with a uniform 256-token short span, document masking, dense value embeddings with the 128-channel gate, output softcap 13, rotary base 30000, batch 2**17, the three settled learning rates, SCALAR_LR 0.5, ADAM_BETAS 0.8 and 0.95, WEIGHT_DECAY 0.146, FINAL_LR_FRAC 0.1 and WARMDOWN_RATIO 0.5 are unchanged.", "command": ["/usr/bin/python3", "/data3/zhubaiyu/fengheguai/fengheguai/rendezvous_agent.py", "--trial", "/data3/zhubaiyu/fengheguai/campaigns/h200-claude/nodes/t0087", "--result", "/data3/zhubaiyu/fengheguai/campaigns/h200-claude/nodes/t0087/.fengheguai-agent-result.json", "--schema", "/data3/zhubaiyu/fengheguai/campaigns/h200-claude/control/agent_output.schema.json", "--campaign", "/data3/zhubaiyu/fengheguai/campaigns/h200-claude", "--inbox", "/data3/zhubaiyu/fengheguai/campaigns/h200-claude-rendezvous"], "errors": [], "expected_val_bpb_effect": "Expected between a 0.002 decrease and a 0.002 increase versus champion t0076 at 0.970135, with step count unchanged since only initial values differ. This is the largest-magnitude initialisation change in the campaign and the mechanism it targets is the one with the largest measured effects, so the range is wide in both directions. The immediately preceding results also caution against assuming bigger is better on an init: t0085 showed lm_head is hurt by removing its small asymmetry and t0086 showed it is hurt more by a tenfold increase, so inits in this recipe have sharp optima.", "hypothesis": "The value embeddings are initialised with a scale meant for a different kind of parameter, and the mismatch is large and quantifiable. init_weights computes s as sqrt(3) times n_embd to the minus one half, which is a fan-in scale appropriate for the projections c_q, c_k, c_v and c_fc, each of which sums 512 inputs. It then applies the same s to the value-embedding tables, which are embeddings with fan-in one: a single row is selected per token. The consequence is that a value embedding starts with element RMS s over sqrt(3), about 0.044, while the stream it is added to, v equals c_v of x, has element RMS 1.0, so the path begins 22.6 times weaker than what it modifies. That transformer.wte is initialised with normal of standard deviation 1.0 rather than with s shows the file already distinguishes embeddings from projections elsewhere. This matters because the value-embedding path is the most load-bearing mechanism measured in this campaign: extending it to every layer gained 0.001806 and halving its width cost 0.005427. Initialising it to match the value stream should let it contribute from the first step instead of having to grow into relevance within 300 seconds.", "log_path": "/data3/zhubaiyu/fengheguai/campaigns/h200-claude/artifacts/t0087/agent.log", "return_code": 0, "risk": "A 39-fold increase may simply be too large: the gate begins at 2*sigmoid(0), which is exactly 1.0, so from the first step the value stream carries v plus an equally large learned term, and if the useful contribution is genuinely small then the model must spend early capacity suppressing it through the gate rather than building it up. Matching RMS exactly is a principled target rather than a measured optimum, and a regression would not distinguish between the scale being wrong in principle and sqrt(3) overshooting a smaller correct value, in which case the informative follow-up is an intermediate scale such as four times s rather than abandoning the idea.", "success": true, "timed_out": false}, "secondary_parent_id": null, "selection_reason": "The current line is stalled; make a structurally different bet.", "source_sha256": "16e0410971b539ff75797a1eb31b10ab864213cc16237f05ae4c7557ca7eb35f", "stage": "explore", "status": "keep", "training_seconds": 300.1, "trial_id": "t0087", "workspace": "/data3/zhubaiyu/fengheguai/campaigns/h200-claude/nodes/t0087"}, "prev_hash": "6b977188a29b7f26fb429bf6f7b7be32613a6d6db9d764fae0d91dc46f274e06", "seq": 176, "timestamp": "2026-08-21T04:08:29.550160+00:00"}
{"hash": "ab42fa248e02e48d2d88509734cd2c013017f059d1714a1b079c32a458df3941", "kind": "trial_started", "payload": {"parent_id": "t0087", "reason": "Exploit a top-K branch selected by quality plus an under-exploration bonus.", "secondary_parent_id": null, "stage": "refine", "trial_id": "t0088"}, "prev_hash": "05bbee2a0e2e78a3b92294f93e0947d2e290b6adf1165a0b6416d38f9c8bdbfd", "seq": 177, "timestamp": "2026-08-21T04:08:29.599771+00:00"}
{"hash": "58940981303b69a87efb98b3cad0742a9343a47fe6003696974faac8cba07973", "kind": "trial_completed", "payload": {"champion_before": "t0087", "debug_depth": 0, "delta_vs_champion_before": 6.47801350424082e-05, "delta_vs_parent": 6.47801350424082e-05, "finding": "t0088 did not improve the prior champion: val_bpb=0.969342, delta=+0.000065. Hypothesis: Correcting the value-embedding initialisation was the largest single gain since the depth work, and its optimum is not yet bracketed. t0087 replaced the fan-in scale s, which gave element RMS 0.044, with plus or minus sqrt(3), giving RMS 1.0 to match the v stream, and gained 0.000858 against a repeat noise of about 0.00013. That confirms the diagnosis, that a scale meant for a 512-input projection was wrongly applied to a fan-in-one embedding table, but matching v exactly was a principled target rather than a measured optimum. The mechanism argues the useful scale could be larger: the gate multiplies the embedding by 2*sigmoid before adding, so at the zero-initialised gate the factor is exactly 1.0, and the value stream carries v plus ve; if the model wants the memory path to dominate the projected value early, an embedding larger than v would let it. Doubling to RMS 2.0 tests whether the optimum sits at parity or beyond it.", "measurements": [{"command": ["/data/home/zhubaiyu/.local/bin/uv", "run", "--project", "/data3/zhubaiyu/fengheguai/campaigns/h200-claude/nodes/t0088", "python", "/data3/zhubaiyu/fengheguai/fengheguai/_audit_runner.py", "--target", "/data3/zhubaiyu/fengheguai/campaigns/h200-claude/nodes/t0088", "--nonce", "fc61d1f6e7128a13bd3fb7fc281c1fb3e9bfdccb4aac3a98"], "errors": [], "evidence_path": "/data3/zhubaiyu/fengheguai/campaigns/h200-claude/evidence/t0088-r0/evidence.json", "evidence_sha256": "b1aa471dfda6ffe0e860cde2094486744f6093b1ad9f437ced463bd34063dd1b", "log_path": "/data3/zhubaiyu/fengheguai/campaigns/h200-claude/evidence/t0088-r0/run.log", "log_sha256": "6ccb4ea2cea1069df0237202aa76edaf55ed3c663220058d185231427d5448ca", "metric": 0.9693419506836436, "num_steps": 2874, "peak_vram_mb": 33800.4, "return_code": 0, "status": "valid", "timed_out": false, "train_sha256": "91b921da318bd9cf34b89c6810970f3d27204f7927fa1d656ba911988df6462a", "training_seconds": 300.0, "wall_seconds": 485.5678231539205}], "metric": 0.9693419506836436, "parent_id": "t0087", "patch_path": "/data3/zhubaiyu/fengheguai/campaigns/h200-claude/artifacts/t0088/change.patch", "patch_sha256": "c085cd6a5852d03e278abae18bbd36a5152015ba78d41f027f0a41128d4d3656", "promoted": false, "proposal": {"change_summary": "One initialisation changed on champion t0087: the value-embedding tables from uniform plus or minus sqrt(3) to uniform plus or minus 2*sqrt(3), doubling element RMS from 1.0 to 2.0. The projections keep the fan-in scale s and transformer.wte keeps its normal 1.0 init. This remains safe at initialisation because attn.c_proj is zero-initialised, so the attention block contributes nothing to the residual stream on the first step regardless of value magnitude. Depth 12, width 512, HEAD_DIM 128, the SSL pattern with a uniform 256-token short span, document masking, dense value embeddings with the 128-channel gate, output softcap 13, rotary base 30000, batch 2**17, EMBEDDING_LR 0.6, UNEMBEDDING_LR 0.002, MATRIX_LR 0.0163, SCALAR_LR 0.5, ADAM_BETAS 0.8 and 0.95, WEIGHT_DECAY 0.146, FINAL_LR_FRAC 0.1 and WARMDOWN_RATIO 0.5 are unchanged.", "command": ["/usr/bin/python3", "/data3/zhubaiyu/fengheguai/fengheguai/rendezvous_agent.py", "--trial", "/data3/zhubaiyu/fengheguai/campaigns/h200-claude/nodes/t0088", "--result", "/data3/zhubaiyu/fengheguai/campaigns/h200-claude/nodes/t0088/.fengheguai-agent-result.json", "--schema", "/data3/zhubaiyu/fengheguai/campaigns/h200-claude/control/agent_output.schema.json", "--campaign", "/data3/zhubaiyu/fengheguai/campaigns/h200-claude", "--inbox", "/data3/zhubaiyu/fengheguai/campaigns/h200-claude-rendezvous"], "errors": [], "expected_val_bpb_effect": "Expected between a 0.0005 decrease and a 0.001 increase versus champion t0087 at 0.969277, with step count unchanged. Together with the original 0.044 and the current 1.0 this gives three points on the scale axis and brackets it if this regresses. A gain would mean parity with v is not the right target and the memory path wants to dominate the projected value, which would be a more interesting statement about the mechanism than the correction itself was.", "hypothesis": "Correcting the value-embedding initialisation was the largest single gain since the depth work, and its optimum is not yet bracketed. t0087 replaced the fan-in scale s, which gave element RMS 0.044, with plus or minus sqrt(3), giving RMS 1.0 to match the v stream, and gained 0.000858 against a repeat noise of about 0.00013. That confirms the diagnosis, that a scale meant for a 512-input projection was wrongly applied to a fan-in-one embedding table, but matching v exactly was a principled target rather than a measured optimum. The mechanism argues the useful scale could be larger: the gate multiplies the embedding by 2*sigmoid before adding, so at the zero-initialised gate the factor is exactly 1.0, and the value stream carries v plus ve; if the model wants the memory path to dominate the projected value early, an embedding larger than v would let it. Doubling to RMS 2.0 tests whether the optimum sits at parity or beyond it.", "log_path": "/data3/zhubaiyu/fengheguai/campaigns/h200-claude/artifacts/t0088/agent.log", "return_code": 0, "risk": "Inits in this recipe have shown sharp optima twice in the last three nodes, since lm_head was hurt by both removing its asymmetry and by a tenfold increase, so overshooting is a live risk rather than a formality. There is also a specific asymmetry in how the gate can respond: 2*sigmoid saturates at 2 and bottoms at 0, so the model can suppress an over-large embedding only by driving the gate toward zero, which costs it the ability to modulate that path per token, whereas an under-large embedding can simply be grown by the optimizer. That makes errors on the high side more expensive than errors on the low side.", "success": true, "timed_out": false}, "secondary_parent_id": null, "selection_reason": "Exploit a top-K branch selected by quality plus an under-exploration bonus.", "source_sha256": "91b921da318bd9cf34b89c6810970f3d27204f7927fa1d656ba911988df6462a", "stage": "refine", "status": "discard", "training_seconds": 300.0, "trial_id": "t0088", "workspace": "/data3/zhubaiyu/fengheguai/campaigns/h200-claude/nodes/t0088"}, "prev_hash": "ab42fa248e02e48d2d88509734cd2c013017f059d1714a1b079c32a458df3941", "seq": 178, "timestamp": "2026-08-21T04:17:41.674543+00:00"}
{"hash": "564f45ab8ebf3124a61e185564f9a41da70d4195e982be535b79f1062fa61c5b", "kind": "trial_started", "payload": {"parent_id": "t0087", "reason": "Spend the configured search share on a distinct architectural or recipe direction.", "secondary_parent_id": null, "stage": "explore", "trial_id": "t0089"}, "prev_hash": "58940981303b69a87efb98b3cad0742a9343a47fe6003696974faac8cba07973", "seq": 179, "timestamp": "2026-08-21T04:17:41.724571+00:00"}
