{"hash": "afd52076be487d15d6a86baf3d0dfbfbf11e6b42db4f1bb9b7b7f1e352e90089", "kind": "trial_completed", "payload": {"champion_before": "t0076", "debug_depth": 0, "delta_vs_champion_before": 0.00014075023657245112, "delta_vs_parent": 0.00014075023657245112, "finding": "t0081 did not improve the prior champion: val_bpb=0.970276, delta=+0.000141. Hypothesis: t0080 tested whether short-layer receptive fields should grow with depth and found they should not: an ascending schedule from 128 to 384 at a held mean cost 0.000333 against the uniform 256 champion. That result cannot distinguish between grading being useless and grading being backwards, which is the ambiguity its own risk note recorded, and the descending direction is the cheap way to resolve it. There is a real argument for descending: early layers work on raw token embeddings and must disambiguate words from local context, which is exactly when a wider window helps, whereas later short layers sit above three full-context layers that have already routed document-level information and may need only a narrow local view. This node reverses the schedule to run from 384 down to 128, holding the mean span at 255.6 as before so the attention FLOP total is unchanged and only the allocation across depth differs.", "measurements": [{"command": ["/data/home/zhubaiyu/.local/bin/uv", "run", "--project", "/data3/zhubaiyu/fengheguai/campaigns/h200-claude/nodes/t0081", "python", "/data3/zhubaiyu/fengheguai/fengheguai/_audit_runner.py", "--target", "/data3/zhubaiyu/fengheguai/campaigns/h200-claude/nodes/t0081", "--nonce", "0ee03922c8dcf641322a3d6292aa9566220cf6ff9812bc7f"], "errors": [], "evidence_path": "/data3/zhubaiyu/fengheguai/campaigns/h200-claude/evidence/t0081-r0/evidence.json", "evidence_sha256": "b12703b9e53362ef79b7790537b1dbede2ba8d14a11c0aaa1801a4ed150f92a1", "log_path": "/data3/zhubaiyu/fengheguai/campaigns/h200-claude/evidence/t0081-r0/run.log", "log_sha256": "77133a10b601d6159e9406f56b8cd39a408ed20ff3602bad97b6d7c00fb724c8", "metric": 0.9702756614019319, "num_steps": 2867, "peak_vram_mb": 33800.4, "return_code": 0, "status": "valid", "timed_out": false, "train_sha256": "824a9c3f1d9610006b3eeae8e684c0caf251373b0202901c00796e2b188084f3", "training_seconds": 300.0, "wall_seconds": 564.9011254683137}], "metric": 0.9702756614019319, "parent_id": "t0076", "patch_path": "/data3/zhubaiyu/fengheguai/campaigns/h200-claude/artifacts/t0081/change.patch", "patch_sha256": "aeb975f19884c552a0db3f0b38a7046487ffaec95a5baeb57cf8cc9a465eb999", "promoted": false, "proposal": {"change_summary": "Structural change to GPT._compute_window_sizes on champion t0076, mirroring t0080 with the interpolation reversed. The eight short layers of the SSL pattern now take spans descending from short_window*3//2 to short_window//2 in stack order. The layout was verified before submission this time and is 384, 347, 2048, 310, 274, 2048, 237, 201, 2048, 164, 128, 2048, with the eight short spans being 384, 347, 310, 274, 237, 201, 164, 128 and a mean of 255.6. Long layers at indices 2, 5, 8 and 11 are untouched. Depth 12, width 512, HEAD_DIM 128, document masking, dense value embeddings with the 128-channel gate, output softcap 13, rotary base 30000, batch 2**17, the three settled learning rates, SCALAR_LR 0.5, ADAM_BETAS 0.8 and 0.95, WEIGHT_DECAY 0.146, FINAL_LR_FRAC 0.1 and WARMDOWN_RATIO 0.5 are unchanged.", "command": ["/usr/bin/python3", "/data3/zhubaiyu/fengheguai/fengheguai/rendezvous_agent.py", "--trial", "/data3/zhubaiyu/fengheguai/campaigns/h200-claude/nodes/t0081", "--result", "/data3/zhubaiyu/fengheguai/campaigns/h200-claude/nodes/t0081/.fengheguai-agent-result.json", "--schema", "/data3/zhubaiyu/fengheguai/campaigns/h200-claude/control/agent_output.schema.json", "--campaign", "/data3/zhubaiyu/fengheguai/campaigns/h200-claude", "--inbox", "/data3/zhubaiyu/fengheguai/campaigns/h200-claude-rendezvous"], "errors": [], "expected_val_bpb_effect": "Expected between a 0.001 decrease and a 0.001 increase versus champion t0076 at 0.970135, with step count essentially unchanged since the mean span and attention FLOP total are held constant by construction. If this also regresses by roughly the 0.000333 that ascending cost, the conclusion is that a uniform span is genuinely optimal and the allocation question is closed in both directions.", "hypothesis": "t0080 tested whether short-layer receptive fields should grow with depth and found they should not: an ascending schedule from 128 to 384 at a held mean cost 0.000333 against the uniform 256 champion. That result cannot distinguish between grading being useless and grading being backwards, which is the ambiguity its own risk note recorded, and the descending direction is the cheap way to resolve it. There is a real argument for descending: early layers work on raw token embeddings and must disambiguate words from local context, which is exactly when a wider window helps, whereas later short layers sit above three full-context layers that have already routed document-level information and may need only a narrow local view. This node reverses the schedule to run from 384 down to 128, holding the mean span at 255.6 as before so the attention FLOP total is unchanged and only the allocation across depth differs.", "log_path": "/data3/zhubaiyu/fengheguai/campaigns/h200-claude/artifacts/t0081/agent.log", "return_code": 0, "risk": "If this regresses too, the honest reading is that a uniform span is optimal rather than that some third schedule shape would work, and I would close the allocation question rather than try further shapes; two failed directions at a held mean are sufficient evidence that the constraint is not what limits this model. A specific limitation of both nodes is that the mean is held over the short layers only, so the total attention FLOPs are equal to the champion but the distribution of context is not comparable position by position, and a model that loses a little quality in its widest layer may not be compensated by a gain in its narrowest.", "success": true, "timed_out": false}, "secondary_parent_id": null, "selection_reason": "The current line is stalled; make a structurally different bet.", "source_sha256": "824a9c3f1d9610006b3eeae8e684c0caf251373b0202901c00796e2b188084f3", "stage": "explore", "status": "discard", "training_seconds": 300.0, "trial_id": "t0081", "workspace": "/data3/zhubaiyu/fengheguai/campaigns/h200-claude/nodes/t0081"}, "prev_hash": "852d786f67a4dc222abee400e4527abe81a6939ae1d87fe20a1daedf78a270f0", "seq": 164, "timestamp": "2026-08-21T03:02:24.835390+00:00"}
{"hash": "f873a2b0e0a88157d4f8189898bdd26fac2e825eac120fc79c51316744f4f8ab", "kind": "trial_started", "payload": {"parent_id": "t0076", "reason": "The current line is stalled; make a structurally different bet.", "secondary_parent_id": null, "stage": "explore", "trial_id": "t0082"}, "prev_hash": "afd52076be487d15d6a86baf3d0dfbfbf11e6b42db4f1bb9b7b7f1e352e90089", "seq": 165, "timestamp": "2026-08-21T03:02:24.881125+00:00"}
{"hash": "cdf33dadeb107cd2236fc98c71086b5889df483802fdc0ded39690e1d7cc207b", "kind": "trial_completed", "payload": {"champion_before": "t0076", "debug_depth": 0, "delta_vs_champion_before": 0.00011817914499800963, "delta_vs_parent": 0.00011817914499800963, "finding": "t0082 did not improve the prior champion: val_bpb=0.970253, delta=+0.000118. Hypothesis: The NorMuon variance horizon was measured at a different batch and the argument for re-testing it is the one that has paid twice in this campaign. t0041 raised beta2 from 0.95 to 0.98 at batch 2**18 and measured 0.000107, below the repeat noise, so the axis was closed as a null. The champion now trains at 2**17, where each per-step gradient carries roughly twice the noise, and this buffer estimates the squared magnitude of the orthogonalised update per row in order to rescale it. A noisier input to that estimate is exactly the condition under which a longer averaging window should help, and it is the same reasoning that made the weight-decay rescale at t0065 and the softcap shift at t0069 pay off after the batch moved. Raising beta2 to 0.98 lengthens the horizon from roughly 20 steps to 50.", "measurements": [{"command": ["/data/home/zhubaiyu/.local/bin/uv", "run", "--project", "/data3/zhubaiyu/fengheguai/campaigns/h200-claude/nodes/t0082", "python", "/data3/zhubaiyu/fengheguai/fengheguai/_audit_runner.py", "--target", "/data3/zhubaiyu/fengheguai/campaigns/h200-claude/nodes/t0082", "--nonce", "86069c5942262ae2407397c7db35bdf2d163e5d228a90578"], "errors": [], "evidence_path": "/data3/zhubaiyu/fengheguai/campaigns/h200-claude/evidence/t0082-r0/evidence.json", "evidence_sha256": "0ba22636b18747500822d4888cd47440dd187deae0a57184f8669ea11ac4143b", "log_path": "/data3/zhubaiyu/fengheguai/campaigns/h200-claude/evidence/t0082-r0/run.log", "log_sha256": "a43100ed1cbadb0e2ca1f39ca7375341d6f729030bdd4336a27864e57ed99d98", "metric": 0.9702530903103574, "num_steps": 2875, "peak_vram_mb": 33800.4, "return_code": 0, "status": "valid", "timed_out": false, "train_sha256": "f7cee20f56719c020188eb247b3017bf9dcbd27f40b121084e2a80e99c0d9eca", "training_seconds": 300.1, "wall_seconds": 485.36087613366544}], "metric": 0.9702530903103574, "parent_id": "t0076", "patch_path": "/data3/zhubaiyu/fengheguai/campaigns/h200-claude/artifacts/t0082/change.patch", "patch_sha256": "ecdc1c3ef965c303adaf04bbbb241a316d7e11cc0b668849e37fbe51e28c1026", "promoted": false, "proposal": {"change_summary": "One argument changed on champion t0076: the beta2 passed to the Muon parameter groups in setup_optimizer from 0.95 to 0.98, feeding second_momentum_buffer.lerp_ inside muon_step_fused. This is distinct from the Muon momentum of 0.95, which is bracketed and unchanged, and from ADAM_BETAS which governs the four AdamW groups. The graded-span experiments from t0080 and t0081 are not carried forward, both having regressed against the uniform 256-token span. Depth 12, width 512, HEAD_DIM 128, the SSL pattern with a uniform 256 short span, document masking, dense value embeddings with the 128-channel gate, output softcap 13, rotary base 30000, batch 2**17, the three settled learning rates, SCALAR_LR 0.5, WEIGHT_DECAY 0.146, FINAL_LR_FRAC 0.1 and WARMDOWN_RATIO 0.5 are unchanged.", "command": ["/usr/bin/python3", "/data3/zhubaiyu/fengheguai/fengheguai/rendezvous_agent.py", "--trial", "/data3/zhubaiyu/fengheguai/campaigns/h200-claude/nodes/t0082", "--result", "/data3/zhubaiyu/fengheguai/campaigns/h200-claude/nodes/t0082/.fengheguai-agent-result.json", "--schema", "/data3/zhubaiyu/fengheguai/campaigns/h200-claude/control/agent_output.schema.json", "--campaign", "/data3/zhubaiyu/fengheguai/campaigns/h200-claude", "--inbox", "/data3/zhubaiyu/fengheguai/campaigns/h200-claude-rendezvous"], "errors": [], "expected_val_bpb_effect": "Expected between a 0.0005 decrease and a 0.0005 increase versus champion t0076 at 0.970135, with step count unchanged since the buffer update is the same elementwise cost either way. The prior is weak because the identical change measured null once already; what makes it worth one node is that the null was measured under half the gradient noise, and two other constants have since proved to be operating-point dependent in exactly this way.", "hypothesis": "The NorMuon variance horizon was measured at a different batch and the argument for re-testing it is the one that has paid twice in this campaign. t0041 raised beta2 from 0.95 to 0.98 at batch 2**18 and measured 0.000107, below the repeat noise, so the axis was closed as a null. The champion now trains at 2**17, where each per-step gradient carries roughly twice the noise, and this buffer estimates the squared magnitude of the orthogonalised update per row in order to rescale it. A noisier input to that estimate is exactly the condition under which a longer averaging window should help, and it is the same reasoning that made the weight-decay rescale at t0065 and the softcap shift at t0069 pay off after the batch moved. Raising beta2 to 0.98 lengthens the horizon from roughly 20 steps to 50.", "log_path": "/data3/zhubaiyu/fengheguai/campaigns/h200-claude/artifacts/t0082/agent.log", "return_code": 0, "risk": "The specific complication I recorded at t0041 still applies and is now more relevant: muon_step_fused has no bias correction on this buffer, unlike adamw_step_fused which divides by 1 - beta2**step, so a longer horizon leaves the estimate underestimated for longer at the start and the clamp_min of 1e-10 makes those early updates effectively larger. With 2874 steps that startup transient is a smaller fraction of training than it was at 1465, which cuts both ways: the transient matters less, but so does any steady-state benefit relative to a run that is already twice as long.", "success": true, "timed_out": false}, "secondary_parent_id": null, "selection_reason": "The current line is stalled; make a structurally different bet.", "source_sha256": "f7cee20f56719c020188eb247b3017bf9dcbd27f40b121084e2a80e99c0d9eca", "stage": "explore", "status": "discard", "training_seconds": 300.1, "trial_id": "t0082", "workspace": "/data3/zhubaiyu/fengheguai/campaigns/h200-claude/nodes/t0082"}, "prev_hash": "f873a2b0e0a88157d4f8189898bdd26fac2e825eac120fc79c51316744f4f8ab", "seq": 166, "timestamp": "2026-08-21T03:11:38.748422+00:00"}
{"hash": "dbd52bdf8085198f62f42541d55056a3fcd4b01ca0f79960a52c64cee9078b0b", "kind": "trial_started", "payload": {"parent_id": "t0076", "reason": "The current line is stalled; make a structurally different bet.", "secondary_parent_id": null, "stage": "explore", "trial_id": "t0083"}, "prev_hash": "cdf33dadeb107cd2236fc98c71086b5889df483802fdc0ded39690e1d7cc207b", "seq": 167, "timestamp": "2026-08-21T03:11:38.795097+00:00"}
{"hash": "6dfcbccb9399c0f516878ac5e59781c86261519d7e77ec52ed4fbae345455f47", "kind": "trial_completed", "payload": {"champion_before": "t0076", "debug_depth": 0, "delta_vs_champion_before": 0.00048649171361203614, "delta_vs_parent": 0.00048649171361203614, "finding": "t0083 did not improve the prior champion: val_bpb=0.970621, delta=+0.000486. Hypothesis: Depth is the only axis in this campaign measured at even integers alone, and the odd value between the champion and the rejected one has never been tried. Depth 12 is the champion, 10 cost 0.000807 and 14 cost 0.001519 at batch 2**18 and 0.001801 again at 2**17, so the curve is established but only at a spacing of two. Two changes since those measurements make 13 worth one node rather than an obvious loser: the short attention span narrowed from 512 to 256, cutting per-token attention cost by roughly 3 percent, and the batch halved so the run now takes 2874 steps rather than 1465, which is the regime where a deeper stack has more updates to converge in. Verified arithmetic: ASPECT_RATIO 39 with depth 13 gives a base of 507, which build_model_config rounds up to a model_dim of exactly 512 with 4 heads of width 128, so width is held and only depth moves.", "measurements": [{"command": ["/data/home/zhubaiyu/.local/bin/uv", "run", "--project", "/data3/zhubaiyu/fengheguai/campaigns/h200-claude/nodes/t0083", "python", "/data3/zhubaiyu/fengheguai/fengheguai/_audit_runner.py", "--target", "/data3/zhubaiyu/fengheguai/campaigns/h200-claude/nodes/t0083", "--nonce", "1e1c8490ff120747a7f72fa68f479bcb8b52aa34bfc004d1"], "errors": [], "evidence_path": "/data3/zhubaiyu/fengheguai/campaigns/h200-claude/evidence/t0083-r0/evidence.json", "evidence_sha256": "83ed561239c61afbf7ddc9f46915aedc74a2a31e8eb584b262c09060d4fcfaae", "log_path": "/data3/zhubaiyu/fengheguai/campaigns/h200-claude/evidence/t0083-r0/run.log", "log_sha256": "109211402dc5ac33f51accbe80748854f35a423ca1b98d86ee14ca6f541384ef", "metric": 0.9706214028789715, "num_steps": 2671, "peak_vram_mb": 36423.4, "return_code": 0, "status": "valid", "timed_out": false, "train_sha256": "704e07d813794df4b0e737e502a078aa3dd22f18259e849b3809251957457432", "training_seconds": 300.0, "wall_seconds": 586.7800991637632}], "metric": 0.9706214028789715, "parent_id": "t0076", "patch_path": "/data3/zhubaiyu/fengheguai/campaigns/h200-claude/artifacts/t0083/change.patch", "patch_sha256": "dfc3787431efc4c3fa87a35b9ff0c2613deaf319907cbdf8b02917adff7fdf0b", "promoted": false, "proposal": {"change_summary": "Capacity change on champion t0076: DEPTH 12 to 13 with ASPECT_RATIO 42 to 39, holding model_dim at 512 and n_head at 4. This adds one transformer block and one value-embedding table, and the SSL pattern over 13 layers places full-context layers at indices 2, 5, 8, 11 and the forced final layer 12, so the global-layer count rises from 4 to 5 as a side effect of the depth change. The NorMuon beta2 from t0082 is not carried forward, having measured null. Width 512, HEAD_DIM 128, the uniform 256-token short span, document masking, dense value embeddings with the 128-channel gate, output softcap 13, rotary base 30000, batch 2**17, the three settled learning rates, SCALAR_LR 0.5, ADAM_BETAS 0.8 and 0.95, WEIGHT_DECAY 0.146, FINAL_LR_FRAC 0.1 and WARMDOWN_RATIO 0.5 are unchanged.", "command": ["/usr/bin/python3", "/data3/zhubaiyu/fengheguai/fengheguai/rendezvous_agent.py", "--trial", "/data3/zhubaiyu/fengheguai/campaigns/h200-claude/nodes/t0083", "--result", "/data3/zhubaiyu/fengheguai/campaigns/h200-claude/nodes/t0083/.fengheguai-agent-result.json", "--schema", "/data3/zhubaiyu/fengheguai/campaigns/h200-claude/control/agent_output.schema.json", "--campaign", "/data3/zhubaiyu/fengheguai/campaigns/h200-claude", "--inbox", "/data3/zhubaiyu/fengheguai/campaigns/h200-claude-rendezvous"], "errors": [], "expected_val_bpb_effect": "Expected between a 0.0005 decrease and a 0.001 increase versus champion t0076 at 0.970135, with the step count falling by roughly 7 percent from 2874 to about 2670. Interpolating the measured curve puts depth 13 near half the depth-14 penalty, so a small regression is the most likely single outcome and would close the capacity axis at integer resolution.", "hypothesis": "Depth is the only axis in this campaign measured at even integers alone, and the odd value between the champion and the rejected one has never been tried. Depth 12 is the champion, 10 cost 0.000807 and 14 cost 0.001519 at batch 2**18 and 0.001801 again at 2**17, so the curve is established but only at a spacing of two. Two changes since those measurements make 13 worth one node rather than an obvious loser: the short attention span narrowed from 512 to 256, cutting per-token attention cost by roughly 3 percent, and the batch halved so the run now takes 2874 steps rather than 1465, which is the regime where a deeper stack has more updates to converge in. Verified arithmetic: ASPECT_RATIO 39 with depth 13 gives a base of 507, which build_model_config rounds up to a model_dim of exactly 512 with 4 heads of width 128, so width is held and only depth moves.", "log_path": "/data3/zhubaiyu/fengheguai/campaigns/h200-claude/artifacts/t0083/agent.log", "return_code": 0, "risk": "There is a confound this node cannot avoid and I want it recorded: changing depth also changes how the SSL pattern lands, so 13 layers yield five full-context layers rather than four, and t0075 measured five as costing 0.000379 at the 512 span. A regression here would therefore be partly attributable to the global-layer count rather than to depth alone, and disentangling them would need a pattern that yields exactly four long layers at depth 13, which SSL does not. MATRIX_LR also still carries the sqrt(8/12) depth correction from t0017, now nominally mismatched for 13 layers, though that correction measured null when introduced.", "success": true, "timed_out": false}, "secondary_parent_id": null, "selection_reason": "The current line is stalled; make a structurally different bet.", "source_sha256": "704e07d813794df4b0e737e502a078aa3dd22f18259e849b3809251957457432", "stage": "explore", "status": "discard", "training_seconds": 300.0, "trial_id": "t0083", "workspace": "/data3/zhubaiyu/fengheguai/campaigns/h200-claude/nodes/t0083"}, "prev_hash": "dbd52bdf8085198f62f42541d55056a3fcd4b01ca0f79960a52c64cee9078b0b", "seq": 168, "timestamp": "2026-08-21T03:22:30.139170+00:00"}
{"hash": "397141693a34c800a22f952b9425a2923a3d26ceda19c94f396310ace09d8316", "kind": "trial_started", "payload": {"parent_id": "t0076", "reason": "Recombine two independently strong branches at the scheduled synthesis step.", "secondary_parent_id": "t0082", "stage": "recombine", "trial_id": "t0084"}, "prev_hash": "6dfcbccb9399c0f516878ac5e59781c86261519d7e77ec52ed4fbae345455f47", "seq": 169, "timestamp": "2026-08-21T03:22:30.186709+00:00"}
