{"hash": "14272818d218a6cae807d9d1c1dd13a4e59058893d1ad09c4b187f8180bd305a", "kind": "trial_completed", "payload": {"champion_before": "t0037", "debug_depth": 1, "delta_vs_champion_before": 5.4083506834778916e-05, "delta_vs_parent": null, "finding": "t0045 did not improve the prior champion: val_bpb=0.972759, delta=+0.000054. Hypothesis: Unchanged from t0044: with QK normalisation fixing the norms of q and k, every one of the 48 heads is locked to the same 1/sqrt(head_dim) temperature, and learned per-head scales initialised at 1.0 should let each head choose its own sharpness and lower val_bpb. t0044 never tested that hypothesis because it aborted in the attention kernel with a dtype error, FlashAttention only supports fp16, bf16, and fp8_e4m3. The cause is type promotion rather than the mechanism: under autocast q and k are bf16 while the new scales are fp32 parameters, and elementwise multiply is not an autocast-listed op, so bf16 times fp32 promotes the product to fp32 and fa3 rejects the input.", "measurements": [{"command": ["/data/home/zhubaiyu/.local/bin/uv", "run", "--project", "/data3/zhubaiyu/fengheguai/campaigns/h200-claude/nodes/t0045", "python", "/data3/zhubaiyu/fengheguai/fengheguai/_audit_runner.py", "--target", "/data3/zhubaiyu/fengheguai/campaigns/h200-claude/nodes/t0045", "--nonce", "2494ead6e3f1362cbf51d3af306c5c15ae81b069c3bc0d91"], "errors": [], "evidence_path": "/data3/zhubaiyu/fengheguai/campaigns/h200-claude/evidence/t0045-r0/evidence.json", "evidence_sha256": "a3adefece30f0b9bab4f97d16ffb61843d90e70813b1d82fb62fcf265eb43f1d", "log_path": "/data3/zhubaiyu/fengheguai/campaigns/h200-claude/evidence/t0045-r0/run.log", "log_sha256": "83fae5f8046c25e935b89c6ed55a777883d7fe42914c9958da0b7b511597e9f3", "metric": 0.972758561878882, "num_steps": 1455, "peak_vram_mb": 66795.4, "return_code": 0, "status": "valid", "timed_out": false, "train_sha256": "61dfa9da0ae10447abf80fa480ec4c0ad6ee3944a13a9532ecff6af596a97d10", "training_seconds": 300.1, "wall_seconds": 580.0688690859824}], "metric": 0.972758561878882, "parent_id": "t0044", "patch_path": "/data3/zhubaiyu/fengheguai/campaigns/h200-claude/artifacts/t0045/change.patch", "patch_sha256": "554680ae0670b72ef1e4f0bfe8176b1ccdfa40152150a453355fd6f2e0f6eea8", "promoted": false, "proposal": {"change_summary": "Debug repair of t0044 with the mechanism intact. The only change is that each scale is cast to the activation dtype at the point of use, q * q_scale.view(1, 1, -1, 1).to(q.dtype) and the same for k, so the multiply stays in bf16 and the kernel receives the dtype it requires. The parameters themselves remain fp32, so optimizer state and update precision are unaffected, and the cast is differentiable so gradients still reach them. Everything else is as in t0044: per-head q_scale and k_scale initialised to 1.0, registered as their own AdamW group at scalar_lr times 0.01, excluded from matrix_params so Muon never sees a 1-D tensor, with the parameter-count assertion updated.", "command": ["/usr/bin/python3", "/data3/zhubaiyu/fengheguai/fengheguai/rendezvous_agent.py", "--trial", "/data3/zhubaiyu/fengheguai/campaigns/h200-claude/nodes/t0045", "--result", "/data3/zhubaiyu/fengheguai/campaigns/h200-claude/nodes/t0045/.fengheguai-agent-result.json", "--schema", "/data3/zhubaiyu/fengheguai/campaigns/h200-claude/control/agent_output.schema.json", "--campaign", "/data3/zhubaiyu/fengheguai/campaigns/h200-claude", "--inbox", "/data3/zhubaiyu/fengheguai/campaigns/h200-claude-rendezvous"], "errors": [], "expected_val_bpb_effect": "Same prediction as t0044: between a 0.002 decrease and parity versus champion t0037 at 0.972704, with step count essentially unchanged. Initialising at 1.0 keeps the network mathematically identical to the champion at step 0, so the mechanism is floored near parity and departs only if per-head temperatures earn it.", "hypothesis": "Unchanged from t0044: with QK normalisation fixing the norms of q and k, every one of the 48 heads is locked to the same 1/sqrt(head_dim) temperature, and learned per-head scales initialised at 1.0 should let each head choose its own sharpness and lower val_bpb. t0044 never tested that hypothesis because it aborted in the attention kernel with a dtype error, FlashAttention only supports fp16, bf16, and fp8_e4m3. The cause is type promotion rather than the mechanism: under autocast q and k are bf16 while the new scales are fp32 parameters, and elementwise multiply is not an autocast-listed op, so bf16 times fp32 promotes the product to fp32 and fa3 rejects the input.", "log_path": "/data3/zhubaiyu/fengheguai/campaigns/h200-claude/artifacts/t0045/agent.log", "return_code": 0, "risk": "The repair addresses the reported error exactly and touches nothing else, so the residual risk is the mechanism itself rather than the plumbing. The likeliest null is redundancy: scaling a head of q is close to scaling the corresponding slice of the c_q projection, and only the RMS normalisation sitting between them makes the two different, so if that distinction is too weak the result lands at parity. A second possibility is that bf16 rounding of a scale near 1.0 quantises small updates, since consecutive bf16 values near 1.0 differ by about 0.0078 and the group learns at 0.005 per step, so early updates may be partly absorbed by rounding even though the fp32 master parameter continues to accumulate them.", "success": true, "timed_out": false}, "secondary_parent_id": null, "selection_reason": "Repair the most recent executable failure before abandoning its hypothesis.", "source_sha256": "61dfa9da0ae10447abf80fa480ec4c0ad6ee3944a13a9532ecff6af596a97d10", "stage": "debug", "status": "discard", "training_seconds": 300.1, "trial_id": "t0045", "workspace": "/data3/zhubaiyu/fengheguai/campaigns/h200-claude/nodes/t0045"}, "prev_hash": "aed1363c19401f5eca473747bdcb05915b640568e5fc6e6bdf50a80e8e896be4", "seq": 92, "timestamp": "2026-08-20T20:00:20.198635+00:00"}
{"hash": "bb3d0da076a3e525ce5c3865a65349ada392d841f56ab4127446a0b3dd34ebe8", "kind": "trial_started", "payload": {"parent_id": "t0037", "reason": "The current line is stalled; make a structurally different bet.", "secondary_parent_id": null, "stage": "explore", "trial_id": "t0046"}, "prev_hash": "14272818d218a6cae807d9d1c1dd13a4e59058893d1ad09c4b187f8180bd305a", "seq": 93, "timestamp": "2026-08-20T20:00:20.225787+00:00"}
{"hash": "37fae81a24b82359ebc8b360e3566b7cca86e8a3a4e6498f0f73fa56741fcd11", "kind": "trial_completed", "payload": {"champion_before": "t0037", "debug_depth": 0, "delta_vs_champion_before": 0.0002779296944026566, "delta_vs_parent": 0.0002779296944026566, "finding": "t0046 did not improve the prior champion: val_bpb=0.972982, delta=+0.000278. Hypothesis: Gating is the one control-path addition that has paid in this campaign, and attention output has none. The value-embedding path is gated per head by 2*sigmoid of a linear map on 128 residual channels, and widening exactly that gate from 32 to 128 channels produced the only champion improvement in twenty nodes. Attention output receives no such treatment: every head contributes to the residual stream with a fixed unit weight regardless of context, so a head that is uninformative for a given token cannot be attenuated except through c_proj, which is a fixed linear map shared across all positions. Adding an input-dependent per-head gate on the attention output, built exactly like the value-embedding gate and zero-initialised so it starts neutral at a gate value of 1.0, should let the model suppress unhelpful heads per token and lower val_bpb.", "measurements": [{"command": ["/data/home/zhubaiyu/.local/bin/uv", "run", "--project", "/data3/zhubaiyu/fengheguai/campaigns/h200-claude/nodes/t0046", "python", "/data3/zhubaiyu/fengheguai/fengheguai/_audit_runner.py", "--target", "/data3/zhubaiyu/fengheguai/campaigns/h200-claude/nodes/t0046", "--nonce", "15e3aaa07b18f2192bf2bf860f4ac59549125c779c00c607"], "errors": [], "evidence_path": "/data3/zhubaiyu/fengheguai/campaigns/h200-claude/evidence/t0046-r0/evidence.json", "evidence_sha256": "141918316d03350371c2960b336ebc314fb4d49c7077821e3be3ac2a4355c37b", "log_path": "/data3/zhubaiyu/fengheguai/campaigns/h200-claude/evidence/t0046-r0/run.log", "log_sha256": "b031f3de0cea75b4d3a6429c1e241dee33e94c152ca9b88b8ed91e4244c41fa3", "metric": 0.9729824080664499, "num_steps": 1438, "peak_vram_mb": 69891.4, "return_code": 0, "status": "valid", "timed_out": false, "train_sha256": "ac7e9fa3bab28258851d6162a2fb136d6ba9efe93078592662f34efe87c92bbd", "training_seconds": 300.1, "wall_seconds": 577.434073057957}], "metric": 0.9729824080664499, "parent_id": "t0037", "patch_path": "/data3/zhubaiyu/fengheguai/campaigns/h200-claude/artifacts/t0046/change.patch", "patch_sha256": "fb60a329f9718e836eb4d14a69ffecb5961cf6f720c2188856ee19c3c2a9b1d1", "promoted": false, "proposal": {"change_summary": "Architectural change on champion t0037: each attention module gains attn_gate, a bias-free Linear from ve_gate_channels of 128 to n_head, whose zero-initialised weights make 2*sigmoid(0) equal 1.0 so the model starts mathematically identical to the champion. In forward, the fa3 output is multiplied per head by that gate before the reshape into c_proj, with the gate cast to the activation dtype to avoid the bf16 to fp32 promotion that broke t0044. The gate is a 2-D Linear so it joins matrix_params and is optimised by Muon exactly as ve_gate already is, requiring no change to the parameter-count assertion. This adds 128 times 4 weights per layer, about 6K across the model. The per-head temperature scales from t0045 are not carried forward, since they measured a null. Output softcap 10, value-embedding gate 128, rotary base 30000, depth 12, width 512, document masking, dense value embeddings, batch 2**18, all learning rates and every schedule are unchanged.", "command": ["/usr/bin/python3", "/data3/zhubaiyu/fengheguai/fengheguai/rendezvous_agent.py", "--trial", "/data3/zhubaiyu/fengheguai/campaigns/h200-claude/nodes/t0046", "--result", "/data3/zhubaiyu/fengheguai/campaigns/h200-claude/nodes/t0046/.fengheguai-agent-result.json", "--schema", "/data3/zhubaiyu/fengheguai/campaigns/h200-claude/control/agent_output.schema.json", "--campaign", "/data3/zhubaiyu/fengheguai/campaigns/h200-claude", "--inbox", "/data3/zhubaiyu/fengheguai/campaigns/h200-claude-rendezvous"], "errors": [], "expected_val_bpb_effect": "Expected between a 0.002 decrease and a 0.001 increase versus champion t0037 at 0.972704, with step count essentially unchanged since the gate is one small matmul and one broadcast multiply per attention call. Zero initialisation floors the mechanism at parity, so it departs only if per-head attenuation earns it, the same design that made the t0045 null harmless.", "hypothesis": "Gating is the one control-path addition that has paid in this campaign, and attention output has none. The value-embedding path is gated per head by 2*sigmoid of a linear map on 128 residual channels, and widening exactly that gate from 32 to 128 channels produced the only champion improvement in twenty nodes. Attention output receives no such treatment: every head contributes to the residual stream with a fixed unit weight regardless of context, so a head that is uninformative for a given token cannot be attenuated except through c_proj, which is a fixed linear map shared across all positions. Adding an input-dependent per-head gate on the attention output, built exactly like the value-embedding gate and zero-initialised so it starts neutral at a gate value of 1.0, should let the model suppress unhelpful heads per token and lower val_bpb.", "log_path": "/data3/zhubaiyu/fengheguai/campaigns/h200-claude/artifacts/t0046/agent.log", "return_code": 0, "risk": "t0032 is the cautionary precedent: widening the value-embedding gate input from 128 to 512 cost 0.002143, which says control-path capacity on this architecture has a real optimum and more is not free. This node adds a second gate rather than widening an existing one, so it is not the same coordinate, but the lesson transfers and a regression here would say the model already has as much gating as it wants. There is also a subtler risk that gating attention output partially duplicates what the value-embedding gate already does, since both modulate what enters the residual stream from the attention block, in which case the result is a null rather than a loss.", "success": true, "timed_out": false}, "secondary_parent_id": null, "selection_reason": "The current line is stalled; make a structurally different bet.", "source_sha256": "ac7e9fa3bab28258851d6162a2fb136d6ba9efe93078592662f34efe87c92bbd", "stage": "explore", "status": "discard", "training_seconds": 300.1, "trial_id": "t0046", "workspace": "/data3/zhubaiyu/fengheguai/campaigns/h200-claude/nodes/t0046"}, "prev_hash": "bb3d0da076a3e525ce5c3865a65349ada392d841f56ab4127446a0b3dd34ebe8", "seq": 94, "timestamp": "2026-08-20T20:11:28.189559+00:00"}
{"hash": "2abea0382c2a88f09dad1d5bbb0ffda0470c5348c465097adf2ff378d61c1145", "kind": "trial_started", "payload": {"parent_id": "t0037", "reason": "The current line is stalled; make a structurally different bet.", "secondary_parent_id": null, "stage": "explore", "trial_id": "t0047"}, "prev_hash": "37fae81a24b82359ebc8b360e3566b7cca86e8a3a4e6498f0f73fa56741fcd11", "seq": 95, "timestamp": "2026-08-20T20:11:28.216802+00:00"}
{"hash": "d17ea1ec0f14c548d73a221bb1b00fdafad935178034f065ca5ba0171ca02056", "kind": "trial_completed", "payload": {"champion_before": "t0037", "debug_depth": 0, "delta_vs_champion_before": 0.0015946652712907072, "delta_vs_parent": 0.0015946652712907072, "finding": "t0047 did not improve the prior champion: val_bpb=0.974299, delta=+0.001595. Hypothesis: Capacity has been treated as closed because depth is bracketed at 12, with 10 costing 0.000807 and 14 costing 0.001519, but that bracket only ever varied how many blocks there are and never how capacity is allocated inside one. The allocation matters because the two routes have different prices. Adding two layers to reach depth 14 added about 6.3M matrix parameters but also two more value-embedding tables and two more attention stacks, and cost 13 percent of steps. Raising the MLP expansion from 4 to 5 adds the same 6.3M matrix parameters while adding no attention FLOPs and no value-embedding table, and should cost about 11 percent of steps. If capacity per step spent is what the depth bracket was really measuring, the cheaper route should land better than depth 14 did, and if MLP capacity is genuinely underprovisioned relative to attention it should beat the champion.", "measurements": [{"command": ["/data/home/zhubaiyu/.local/bin/uv", "run", "--project", "/data3/zhubaiyu/fengheguai/campaigns/h200-claude/nodes/t0047", "python", "/data3/zhubaiyu/fengheguai/fengheguai/_audit_runner.py", "--target", "/data3/zhubaiyu/fengheguai/campaigns/h200-claude/nodes/t0047", "--nonce", "608a0e6898b7761041eda2b5c588a0d00cb752c4799b0c9d"], "errors": [], "evidence_path": "/data3/zhubaiyu/fengheguai/campaigns/h200-claude/evidence/t0047-r0/evidence.json", "evidence_sha256": "2ac0ee631cf181d8ee2a485379ab9548ecb74ef09de610293b5a85ce7655b214", "log_path": "/data3/zhubaiyu/fengheguai/campaigns/h200-claude/evidence/t0047-r0/run.log", "log_sha256": "7d34ce64a12c75d28781f2afa3cb2d2f4c7ac203d5d61b27177245bf7778678d", "metric": 0.9742991436433379, "num_steps": 1347, "peak_vram_mb": 73009.9, "return_code": 0, "status": "valid", "timed_out": false, "train_sha256": "c7fa40eab2013688228b5a153bce1351ad7342da40282755b630f26cbc00cf42", "training_seconds": 300.0, "wall_seconds": 569.9264643192291}], "metric": 0.9742991436433379, "parent_id": "t0037", "patch_path": "/data3/zhubaiyu/fengheguai/campaigns/h200-claude/artifacts/t0047/change.patch", "patch_sha256": "0b126bc7fd9f2c71d2b044ef28d5370fb55c8e48840fa4d4d37f6d8a1618e6d6", "promoted": false, "proposal": {"change_summary": "Architectural change on champion t0037: the MLP expansion factor from 4 to 5 in both projections, so c_fc maps 512 to 2560 and c_proj maps 2560 back to 512, instead of 2048. Depth stays 12 and width stays 512, so the value-embedding tables, attention parameters and the rest of the model are untouched, which makes this a pure test of the attention-to-MLP allocation at fixed depth. The attention output gate from t0046 and the per-head scales from t0045 are not carried forward, both having measured at or below parity. Output softcap 10, value-embedding gate 128, rotary base 30000, document masking, dense value embeddings, batch 2**18, all learning rates, WEIGHT_DECAY 0.2 and every schedule are unchanged.", "command": ["/usr/bin/python3", "/data3/zhubaiyu/fengheguai/fengheguai/rendezvous_agent.py", "--trial", "/data3/zhubaiyu/fengheguai/campaigns/h200-claude/nodes/t0047", "--result", "/data3/zhubaiyu/fengheguai/campaigns/h200-claude/nodes/t0047/.fengheguai-agent-result.json", "--schema", "/data3/zhubaiyu/fengheguai/campaigns/h200-claude/control/agent_output.schema.json", "--campaign", "/data3/zhubaiyu/fengheguai/campaigns/h200-claude", "--inbox", "/data3/zhubaiyu/fengheguai/campaigns/h200-claude-rendezvous"], "errors": [], "expected_val_bpb_effect": "Expected between a 0.001 decrease and a 0.002 increase versus champion t0037 at 0.972704, with the step count falling to roughly 1300 from 1465. The honest prior is a regression of about 0.001, by analogy with depth 14, since the two changes add identical parameter counts for similar step costs. What makes the node worth spending is that the prior rests on an untested equivalence between two different ways of buying capacity, and the depth bracket cannot distinguish them.", "hypothesis": "Capacity has been treated as closed because depth is bracketed at 12, with 10 costing 0.000807 and 14 costing 0.001519, but that bracket only ever varied how many blocks there are and never how capacity is allocated inside one. The allocation matters because the two routes have different prices. Adding two layers to reach depth 14 added about 6.3M matrix parameters but also two more value-embedding tables and two more attention stacks, and cost 13 percent of steps. Raising the MLP expansion from 4 to 5 adds the same 6.3M matrix parameters while adding no attention FLOPs and no value-embedding table, and should cost about 11 percent of steps. If capacity per step spent is what the depth bracket was really measuring, the cheaper route should land better than depth 14 did, and if MLP capacity is genuinely underprovisioned relative to attention it should beat the champion.", "log_path": "/data3/zhubaiyu/fengheguai/campaigns/h200-claude/artifacts/t0047/agent.log", "return_code": 0, "risk": "A hidden dimension of 2560 is a less conventional shape than 2048 and may hit slower GEMM kernels despite being a multiple of 128, which would show up as a larger step-count drop than the FLOP ratio predicts and would confound the allocation question with a throughput artefact; num_steps against the predicted 1300 will separate those. The zero-initialised c_proj and the uniform init on c_fc both scale with n_embd rather than with the hidden width, so the wider layer starts with the same per-weight scale and slightly larger activations, a small departure from the tuned initialisation that this node does not correct.", "success": true, "timed_out": false}, "secondary_parent_id": null, "selection_reason": "The current line is stalled; make a structurally different bet.", "source_sha256": "c7fa40eab2013688228b5a153bce1351ad7342da40282755b630f26cbc00cf42", "stage": "explore", "status": "discard", "training_seconds": 300.0, "trial_id": "t0047", "workspace": "/data3/zhubaiyu/fengheguai/campaigns/h200-claude/nodes/t0047"}, "prev_hash": "2abea0382c2a88f09dad1d5bbb0ffda0470c5348c465097adf2ff378d61c1145", "seq": 96, "timestamp": "2026-08-20T20:22:16.634624+00:00"}
{"hash": "0634214f9aeb46051c2c5b4b5fe47aebd7f74f17858d3706dcd1a60c045de1ac", "kind": "trial_started", "payload": {"parent_id": "t0037", "reason": "The current line is stalled; make a structurally different bet.", "secondary_parent_id": null, "stage": "explore", "trial_id": "t0048"}, "prev_hash": "d17ea1ec0f14c548d73a221bb1b00fdafad935178034f065ca5ba0171ca02056", "seq": 97, "timestamp": "2026-08-20T20:22:16.661633+00:00"}
