trial	parent	stage	val_bpb	training_seconds	status	description
t0042	t0037	recombine	0.975442	300.200000	discard	Kernel-level mechanism added to champion t0037: a module-level ATTN_SOFTCAP constant of 10.0 passed to the softcap argument of both fa3 call sites, the dense flash_attn_func path and the document-masked flash_attn_varlen_func path that the champion actually uses. The cap is applied inside the kernel, so it costs no extra memory traffic and no separate elementwise pass. Everything else matches the champion: output softcap 10, value-embedding gate 128 channels, rotary base 30000, depth 12, width 512, document masking, dense value embeddings, batch 2**18, all learning rates, WEIGHT_DECAY 0.2 and every schedule.
t0043	t0037	explore	0.973143	300.000000	discard	Kernel-argument change on champion t0037: a module-level ATTN_SCALE constant of 1.5 multiplying the softmax_scale passed to both fa3 call sites, so the attention temperature becomes 1.5/sqrt(head_dim) instead of the implicit 1/sqrt(head_dim). The attention softcap from t0042 is not carried forward, since it regressed. Everything else matches the champion: output softcap 10, value-embedding gate 128 channels, rotary base 30000, depth 12, width 512, document masking, dense value embeddings, the 512-token short window, batch 2**18, all learning rates, WEIGHT_DECAY 0.2 and every schedule.
t0044	t0037	explore	-	-	failed	Architectural change on champion t0037: each attention module gains q_scale of shape n_head and k_scale of shape n_kv_head, both initialised to 1.0 and applied immediately after the existing RMS normalisation of q and k. They are registered as their own AdamW group at scalar_lr times 0.01, the conservative rate this recipe uses for resid_lambdas, and are explicitly excluded from matrix_params so the Muon path never receives a 1-D tensor. The parameter-count assertion is updated. This adds 96 scalars across the model. Output softcap 10, value-embedding gate 128, rotary base 30000, depth 12, width 512, document masking, dense value embeddings, batch 2**18, all learning rates and every schedule are unchanged, and neither the t0042 softcap nor the t0043 global rescale is carried forward.
t0045	t0044	debug	0.972759	300.100000	discard	Debug repair of t0044 with the mechanism intact. The only change is that each scale is cast to the activation dtype at the point of use, q * q_scale.view(1, 1, -1, 1).to(q.dtype) and the same for k, so the multiply stays in bf16 and the kernel receives the dtype it requires. The parameters themselves remain fp32, so optimizer state and update precision are unaffected, and the cast is differentiable so gradients still reach them. Everything else is as in t0044: per-head q_scale and k_scale initialised to 1.0, registered as their own AdamW group at scalar_lr times 0.01, excluded from matrix_params so Muon never sees a 1-D tensor, with the parameter-count assertion updated.
t0046	t0037	explore	0.972982	300.100000	discard	Architectural change on champion t0037: each attention module gains attn_gate, a bias-free Linear from ve_gate_channels of 128 to n_head, whose zero-initialised weights make 2*sigmoid(0) equal 1.0 so the model starts mathematically identical to the champion. In forward, the fa3 output is multiplied per head by that gate before the reshape into c_proj, with the gate cast to the activation dtype to avoid the bf16 to fp32 promotion that broke t0044. The gate is a 2-D Linear so it joins matrix_params and is optimised by Muon exactly as ve_gate already is, requiring no change to the parameter-count assertion. This adds 128 times 4 weights per layer, about 6K across the model. The per-head temperature scales from t0045 are not carried forward, since they measured a null. Output softcap 10, value-embedding gate 128, rotary base 30000, depth 12, width 512, document masking, dense value embeddings, batch 2**18, all learning rates and every schedule are unchanged.
t0047	t0037	explore	0.974299	300.000000	discard	Architectural change on champion t0037: the MLP expansion factor from 4 to 5 in both projections, so c_fc maps 512 to 2560 and c_proj maps 2560 back to 512, instead of 2048. Depth stays 12 and width stays 512, so the value-embedding tables, attention parameters and the rest of the model are untouched, which makes this a pure test of the attention-to-MLP allocation at fixed depth. The attention output gate from t0046 and the per-head scales from t0045 are not carried forward, both having measured at or below parity. Output softcap 10, value-embedding gate 128, rotary base 30000, document masking, dense value embeddings, batch 2**18, all learning rates, WEIGHT_DECAY 0.2 and every schedule are unchanged.
t0048	t0037	explore	0.972662	300.050000	keep	One constant changed on champion t0037: FINAL_LR_FRAC from 0.0 to 0.1, so get_lr_multiplier interpolates from full rate down to a tenth of it across the warmdown phase instead of down to zero. WARMDOWN_RATIO stays at its bracketed optimum of 0.5 and WARMUP_RATIO stays 0.0. The MLP expansion from t0047, the attention gate from t0046 and the per-head scales from t0045 are not carried forward. Output softcap 10, value-embedding gate 128, rotary base 30000, depth 12, width 512, document masking, dense value embeddings, batch 2**18, all learning rates, WEIGHT_DECAY 0.2 and the weight-decay schedule are unchanged.
t0049	t0048	recombine	0.975154	300.200000	discard	One function changed on champion t0048: get_weight_decay now returns WEIGHT_DECAY times get_lr_multiplier(progress) instead of WEIGHT_DECAY times (1 - progress). Because the rate multiplier is flat at 1.0 through the first half of the budget and then decays to the 0.1 floor, decay now holds at 0.2 during the stable phase and falls to 0.02 at the end, rather than declining linearly from 0.2 to 0 from the first step. Only the Muon matrix groups are affected since the AdamW groups run at weight_decay 0. WEIGHT_DECAY stays at its bracketed optimum of 0.2, FINAL_LR_FRAC stays 0.1, WARMDOWN_RATIO stays 0.5, and depth 12, width 512, document masking, dense value embeddings with the 128-channel gate, output softcap 10, rotary base 30000, batch 2**18 and all learning rates are unchanged.
t0050	t0048	refine	0.973772	300.100000	discard	Two coordinated edits on champion t0048 that together express one change of schedule shape at constant total decay: get_weight_decay returns WEIGHT_DECAY times get_lr_multiplier(progress) instead of WEIGHT_DECAY times (1 - progress), and WEIGHT_DECAY moves from 0.2 to 0.135, the value computed to equate the integral of lr times wd across the two schedules. Only the Muon matrix groups are affected. FINAL_LR_FRAC stays 0.1, WARMDOWN_RATIO stays 0.5, and depth 12, width 512, document masking, dense value embeddings with the 128-channel gate, output softcap 10, rotary base 30000, batch 2**18 and all learning rates are unchanged.
t0051	t0048	refine	0.971944	300.050000	keep	Coordinated move along the established batch-versus-rate scaling line on champion t0048: TOTAL_BATCH_SIZE from 2**18 to 2**17 with DEVICE_BATCH_SIZE from 128 to 64 so gradient accumulation stays at exactly 1, and EMBEDDING_LR 0.6 to 0.4243, UNEMBEDDING_LR 0.002828 to 0.002, MATRIX_LR 0.0231 to 0.0163, each divided by sqrt(2). Depth 12, width 512, document masking, dense value embeddings with the 128-channel gate, output softcap 10, rotary base 30000, WEIGHT_DECAY 0.2 with its original declining schedule, FINAL_LR_FRAC 0.1 and WARMDOWN_RATIO 0.5 are unchanged.
t0052	t0051	explore	0.975888	300.000000	discard	A second step along the same scaling line on champion t0051: TOTAL_BATCH_SIZE from 2**17 to 2**16 with DEVICE_BATCH_SIZE from 64 to 32 so gradient accumulation stays at 1, and EMBEDDING_LR 0.4243 to 0.3, UNEMBEDDING_LR 0.002 to 0.001414, MATRIX_LR 0.0163 to 0.0115, each divided by sqrt(2) again. Depth 12, width 512, document masking, dense value embeddings with the 128-channel gate, output softcap 10, rotary base 30000, WEIGHT_DECAY 0.2 with its declining schedule, FINAL_LR_FRAC 0.1 and WARMDOWN_RATIO 0.5 are unchanged.
t0053	t0051	refine	0.971630	300.050000	keep	One learning rate changed on champion t0051: EMBEDDING_LR from 0.4243 back to 0.6, affecting the AdamW group that holds transformer.wte and all twelve value-embedding tables, roughly 54M parameters and the largest block in the model. UNEMBEDDING_LR stays 0.002 and MATRIX_LR stays 0.0163, both of which keep the sqrt(2) rescale that accompanied the batch halving. TOTAL_BATCH_SIZE stays 2**17 with DEVICE_BATCH_SIZE 64, and depth 12, width 512, document masking, dense value embeddings with the 128-channel gate, output softcap 10, rotary base 30000, WEIGHT_DECAY 0.2, FINAL_LR_FRAC 0.1 and WARMDOWN_RATIO 0.5 are unchanged.
t0054	t0053	refine	0.971690	300.000000	discard	One learning rate changed on champion t0053: UNEMBEDDING_LR from 0.002 back to 0.002828, the value bracketed as optimal at batch 2**18, affecting only the lm_head AdamW group. EMBEDDING_LR stays at its twice-confirmed 0.6 and MATRIX_LR stays at 0.0163, keeping the square-root rescale for the Muon group alone. TOTAL_BATCH_SIZE stays 2**17 with DEVICE_BATCH_SIZE 64, and depth 12, width 512, document masking, dense value embeddings with the 128-channel gate, output softcap 10, rotary base 30000, WEIGHT_DECAY 0.2, FINAL_LR_FRAC 0.1 and WARMDOWN_RATIO 0.5 are unchanged.
t0055	t0053	explore	0.974787	300.000000	discard	One learning rate changed on champion t0053: MATRIX_LR from 0.0163 back to 0.0231, the value used at batch 2**18, affecting only the Muon matrix groups. EMBEDDING_LR stays at its twice-confirmed 0.6 and UNEMBEDDING_LR stays 0.002, which measured flat against 0.002828 at this batch. TOTAL_BATCH_SIZE stays 2**17 with DEVICE_BATCH_SIZE 64, and depth 12, width 512, document masking, dense value embeddings with the 128-channel gate, output softcap 10, rotary base 30000, WEIGHT_DECAY 0.2, FINAL_LR_FRAC 0.1 and WARMDOWN_RATIO 0.5 are unchanged.
t0056	t0053	recombine	0.972701	300.100000	discard	One constant changed on champion t0053: the divisor in get_muon_momentum from 300 to 850, so momentum still ramps from 0.85 to a terminal 0.95 but reaches it after 850 steps instead of 300, which is 30 percent of the current 2838-step run rather than 10.6 percent. The terminal value stays at its bracketed optimum of 0.95 and NorMuon beta2 stays 0.95. The two elite lines contribute their settled rates: EMBEDDING_LR 0.6 unscaled from the twice-confirmed decomposition, UNEMBEDDING_LR 0.002 which measured flat against 0.002828 in t0054, and MATRIX_LR 0.0163 which t0055 confirmed must carry the square-root rescale. Batch 2**17, depth 12, width 512, document masking, dense value embeddings with the 128-channel gate, output softcap 10, rotary base 30000, WEIGHT_DECAY 0.2, FINAL_LR_FRAC 0.1 and WARMDOWN_RATIO 0.5 are unchanged.
t0057	t0053	explore	0.971680	300.100000	discard	One constant changed on champion t0053: the divisor in get_muon_momentum from 300 to 150, so momentum ramps from 0.85 to its terminal 0.95 over the first 150 steps instead of 300. The terminal value stays at its bracketed optimum of 0.95, NorMuon beta2 stays 0.95, and the settled rates from the decomposition are unchanged: EMBEDDING_LR 0.6 unscaled, UNEMBEDDING_LR 0.002, MATRIX_LR 0.0163 carrying the square-root rescale that t0055 confirmed is specific to the Muon group. Batch 2**17, depth 12, width 512, document masking, dense value embeddings with the 128-channel gate, output softcap 10, rotary base 30000, WEIGHT_DECAY 0.2, FINAL_LR_FRAC 0.1 and WARMDOWN_RATIO 0.5 are unchanged.
t0058	t0053	explore	-	-	timeout	One argument added on champion t0053: torch.compile now uses mode max-autotune-no-cudagraphs instead of the default mode, with dynamic=False unchanged. The no-cudagraphs variant is chosen deliberately rather than plain max-autotune, because CUDA graph capture interacts badly with the document-mask path, which builds a cu_seqlens tensor of batch-varying length each step and is marked dynamic. No model, data, optimizer or schedule change accompanies this: batch 2**17, depth 12, width 512, document masking, dense value embeddings with the 128-channel gate, output softcap 10, rotary base 30000, all three settled learning rates, WEIGHT_DECAY 0.2, FINAL_LR_FRAC 0.1 and WARMDOWN_RATIO 0.5 are exactly as in the champion.
t0059	t0058	debug	0.971716	300.100000	discard	Debug repair of t0058 that narrows the search rather than repeating it. torch.compile returns to its default mode, and inductor_config.max_autotune_gemm is set to True before compilation, so Triton matmul candidates are still benchmarked against cuBLAS for each distinct GEMM shape while pointwise autotuning, epilogue-fusion benchmarking and coordinate-descent tuning are not run. The autotune results cached during the t0058 attempt remain available and should absorb part of the remaining GEMM search. Everything else matches champion t0053: batch 2**17 with DEVICE_BATCH_SIZE 64, depth 12, width 512, document masking, dense value embeddings with the 128-channel gate, output softcap 10, rotary base 30000, EMBEDDING_LR 0.6, UNEMBEDDING_LR 0.002, MATRIX_LR 0.0163, WEIGHT_DECAY 0.2, FINAL_LR_FRAC 0.1 and WARMDOWN_RATIO 0.5.
t0060	t0053	explore	0.973431	300.100000	discard	Capacity re-test on champion t0053 at the current operating point: DEPTH 12 to 14 with ASPECT_RATIO 42 to 36, chosen so build_model_config still rounds to model_dim 512 with 4 heads of width 128. Batch stays 2**17 with DEVICE_BATCH_SIZE 64, and the settled rates are unchanged, EMBEDDING_LR 0.6, UNEMBEDDING_LR 0.002 and MATRIX_LR 0.0163. The autotuning from t0058 and t0059 is not carried forward, having cost 162 seconds of wall clock for a step count of 2835 against the champion 2838. Document masking, dense value embeddings with the 128-channel gate, output softcap 10, rotary base 30000, WEIGHT_DECAY 0.2, FINAL_LR_FRAC 0.1 and WARMDOWN_RATIO 0.5 are unchanged.
t0061	t0053	explore	0.973505	300.100000	discard	One constant changed on champion t0053: WARMUP_RATIO from 0.0 to 0.02, so get_lr_multiplier ramps linearly from zero to full rate across the first two percent of the time budget before the flat phase begins. WARMDOWN_RATIO stays at its bracketed optimum of 0.5 and FINAL_LR_FRAC stays 0.1. The depth-14 configuration from t0060 is not carried forward, having lost 0.001801. Batch 2**17, depth 12, width 512, document masking, dense value embeddings with the 128-channel gate, output softcap 10, rotary base 30000, the three settled learning rates, WEIGHT_DECAY 0.2 and the Muon momentum warmup at 300 steps are unchanged.
t0062	t0053	explore	0.974451	300.000000	discard	One constant changed on champion t0053: SCALAR_LR from 0.5 to 0.25. This halves the rate for both scalar groups, x0_lambdas from 0.5 to 0.25 and resid_lambdas from 0.005 to 0.0025, since the latter is defined as scalar_lr times 0.01. No other group is affected: EMBEDDING_LR stays 0.6, UNEMBEDDING_LR 0.002 and MATRIX_LR 0.0163. The warmup from t0061 is not carried forward, having cost 0.001875. Batch 2**17, depth 12, width 512, document masking, dense value embeddings with the 128-channel gate, output softcap 10, rotary base 30000, WEIGHT_DECAY 0.2, FINAL_LR_FRAC 0.1, WARMDOWN_RATIO 0.5 and the 300-step Muon momentum ramp are unchanged.
t0063	t0053	recombine	0.972504	300.100000	discard	One constant changed on champion t0053: SCALAR_LR from 0.5 to 1.0, which doubles the rate for both scalar groups, x0_lambdas from 0.5 to 1.0 and resid_lambdas from 0.005 to 0.01 since the latter is defined as scalar_lr times 0.01. No other group moves: EMBEDDING_LR stays 0.6, UNEMBEDDING_LR 0.002, MATRIX_LR 0.0163. The momentum warmup stays at the inherited 300 steps that both elites support. Batch 2**17, depth 12, width 512, document masking, dense value embeddings with the 128-channel gate, output softcap 10, rotary base 30000, WEIGHT_DECAY 0.2, FINAL_LR_FRAC 0.1 and WARMDOWN_RATIO 0.5 are unchanged.
t0064	t0053	explore	0.978616	300.100000	discard	One constant changed on champion t0053: HEAD_DIM from 128 to 256, so build_model_config produces n_head = n_kv_head = 2 at an unchanged model_dim of 512. Parameter count, per-token FLOPs and the value-embedding width all stay the same, since kv_dim is n_kv_head times head_dim and remains 512. Rotary now covers 128 channel pairs per head instead of 64. Batch 2**17, depth 12, document masking, dense value embeddings with the 128-channel gate, output softcap 10, rotary base 30000, the three settled learning rates, SCALAR_LR 0.5, WEIGHT_DECAY 0.2, FINAL_LR_FRAC 0.1 and WARMDOWN_RATIO 0.5 are unchanged.
t0065	t0053	explore	0.971285	300.000000	keep	One constant changed on champion t0053: WEIGHT_DECAY from 0.2 to 0.146, chosen so the product of step count and per-step decay matches what the 2**18 configuration delivered at 0.2. The declining schedule shape is untouched, still WEIGHT_DECAY times one minus progress, since the coupled variant was tested and closed in t0049 and t0050. Only the Muon matrix groups are affected because the AdamW groups run at weight_decay 0. Batch 2**17, depth 12, HEAD_DIM 128, document masking, dense value embeddings with the 128-channel gate, output softcap 10, rotary base 30000, the three settled learning rates, SCALAR_LR 0.5, FINAL_LR_FRAC 0.1 and WARMDOWN_RATIO 0.5 are unchanged.
t0066	t0065	refine	0.971465	300.100000	discard	One constant changed on champion t0065: WEIGHT_DECAY from 0.146 to 0.11, keeping the declining schedule shape of WEIGHT_DECAY times one minus progress. Only the Muon matrix groups are affected. Batch 2**17 with DEVICE_BATCH_SIZE 64, depth 12, width 512, HEAD_DIM 128, document masking, dense value embeddings with the 128-channel gate, output softcap 10, rotary base 30000, EMBEDDING_LR 0.6, UNEMBEDDING_LR 0.002, MATRIX_LR 0.0163, SCALAR_LR 0.5, FINAL_LR_FRAC 0.1 and WARMDOWN_RATIO 0.5 are unchanged.
t0067	t0065	refine	0.971522	300.100000	discard	One constant changed on champion t0065: the first element of ADAM_BETAS from 0.8 to 0.9, leaving beta2 at 0.95. This affects the four groups that pass adam_betas through setup_optimizer, namely lm_head, wte, the twelve value embeddings and resid_lambdas. The x0_lambdas group is unaffected because it hardcodes its own betas of 0.96 and 0.95, and the Muon groups have their own separate momentum which is bracketed at 0.95. Batch 2**17, depth 12, width 512, HEAD_DIM 128, document masking, dense value embeddings with the 128-channel gate, output softcap 10, rotary base 30000, the three settled learning rates, SCALAR_LR 0.5, WEIGHT_DECAY 0.146, FINAL_LR_FRAC 0.1 and WARMDOWN_RATIO 0.5 are unchanged.
t0068	t0065	explore	0.972084	300.100000	discard	One constant changed on champion t0065: the first element of ADAM_BETAS from 0.8 to 0.7, leaving beta2 at 0.95. It affects the four groups that receive adam_betas through setup_optimizer, lm_head, wte, the twelve value embeddings and resid_lambdas; the x0_lambdas group hardcodes its own betas and the Muon groups use their own momentum schedule. Batch 2**17, depth 12, width 512, HEAD_DIM 128, document masking, dense value embeddings with the 128-channel gate, output softcap 10, rotary base 30000, the three settled learning rates, SCALAR_LR 0.5, WEIGHT_DECAY 0.146, FINAL_LR_FRAC 0.1 and WARMDOWN_RATIO 0.5 are unchanged.
t0069	t0065	explore	0.971071	300.000000	keep	One constant changed on champion t0065: the softcap in GPT.forward from 10 to 13, keeping the softcap*tanh(logits/softcap) form applied after the float32 cast. The value is chosen on the shallow side of the previously measured curve, since the steep side below 10 cost 0.005206 at 7 and is not worth probing blind. Batch 2**17, depth 12, width 512, HEAD_DIM 128, document masking, dense value embeddings with the 128-channel gate, rotary base 30000, EMBEDDING_LR 0.6, UNEMBEDDING_LR 0.002, MATRIX_LR 0.0163, SCALAR_LR 0.5, ADAM_BETAS at their bracketed 0.8 and 0.95, WEIGHT_DECAY 0.146, FINAL_LR_FRAC 0.1 and WARMDOWN_RATIO 0.5 are unchanged.
t0070	t0069	recombine	0.971571	300.100000	discard	One constant changed on champion t0069: WARMDOWN_RATIO from 0.5 to 0.4, so get_lr_multiplier holds full rate until 60 percent of the time budget and then decays to the FINAL_LR_FRAC floor of 0.1 across the final 40 percent. WARMUP_RATIO stays 0.0, which t0061 confirmed. Both elite contributions are carried: WEIGHT_DECAY 0.146 from t0065 and softcap 13 from t0069. Batch 2**17, depth 12, width 512, HEAD_DIM 128, document masking, dense value embeddings with the 128-channel gate, rotary base 30000, the three settled learning rates, SCALAR_LR 0.5 and ADAM_BETAS at 0.8 and 0.95 are unchanged.
t0071	t0069	explore	0.976498	300.000000	discard	One architectural change on champion t0069: build_model_config now passes n_kv_head as num_heads // 2, giving 2 key-value heads against 4 query heads at an unchanged model_dim of 512 and HEAD_DIM of 128. This halves c_k and c_v, halves kv_dim from 512 to 256, halves every value-embedding table, and narrows each ve_gate output from 4 to 2. The existing assertion that n_kv_head divides n_head is satisfied. Depth 12, document masking, dense value embeddings with the 128-channel gate, output softcap 13, rotary base 30000, batch 2**17, the three settled learning rates, SCALAR_LR 0.5, ADAM_BETAS 0.8 and 0.95, WEIGHT_DECAY 0.146, FINAL_LR_FRAC 0.1 and WARMDOWN_RATIO 0.5 are unchanged.
