{"hash": "5dabedb7db10a0ebf18d41b9fd9be2ceee84f813b0b251a1ff24a1df9991cd75", "kind": "trial_completed", "payload": {"champion_before": "t0017", "debug_depth": 0, "delta_vs_champion_before": 0.001569807198699702, "delta_vs_parent": 0.001569807198699702, "finding": "t0021 did not improve the prior champion: val_bpb=0.974941, delta=+0.001570. Hypothesis: The two elite lines are nested and differ only in MATRIX_LR, 0.02828 in t0016 against 0.0231 in t0017, and their runs overlap: 0.9734873 and 0.9733571 against 0.9733484 and 0.9733932. Their joint content is therefore not a rate preference but a flatness result, that the Muon matrix rate is insensitive in this neighbourhood at depth 12. That retires the specific concern which motivated t0017, namely that decaying depth returns might be rate mismatch rather than saturation. Combining the shared mechanism of both elites, that depth increments buy quality per step spent, with their joint finding that the rate axis is flat, depth 14 is the test that closes the capacity axis: with rate mismatch excluded, whatever it measures is the genuine marginal value of depth.", "measurements": [{"command": ["/data/home/zhubaiyu/.local/bin/uv", "run", "--project", "/data3/zhubaiyu/fengheguai/campaigns/h200-claude/nodes/t0021", "python", "/data3/zhubaiyu/fengheguai/fengheguai/_audit_runner.py", "--target", "/data3/zhubaiyu/fengheguai/campaigns/h200-claude/nodes/t0021", "--nonce", "683bbfff66e58be18c0f6c65395deee53055e2c43114e1d0"], "errors": [], "evidence_path": "/data3/zhubaiyu/fengheguai/campaigns/h200-claude/evidence/t0021-r0/evidence.json", "evidence_sha256": "090cbd683791c01dd3c0684d27cd0995eb933c4876667f9f441cc20a1062cfb4", "log_path": "/data3/zhubaiyu/fengheguai/campaigns/h200-claude/evidence/t0021-r0/run.log", "log_sha256": "df387ccfda1f7cb9fecaaeb57fbbf85a4daf1bd8caf57b3983cdca9f5ef89ed5", "metric": 0.9749406250455237, "num_steps": 1278, "peak_vram_mb": 77178.4, "return_code": 0, "status": "valid", "timed_out": false, "train_sha256": "51d45c13af515f7999daa23fade7cd39543e04e4611ccb707cf3b9af4915b62d", "training_seconds": 300.0, "wall_seconds": 596.6087595233694}], "metric": 0.9749406250455237, "parent_id": "t0017", "patch_path": "/data3/zhubaiyu/fengheguai/campaigns/h200-claude/artifacts/t0021/change.patch", "patch_sha256": "219e1f2bb6b7d8ec1e14be2a35d12464d900e9eee7708b0d01487fe865a45191", "promoted": false, "proposal": {"change_summary": "Capacity increase synthesising both elite lines: DEPTH 12 to 14 with ASPECT_RATIO 42 to 36, so build_model_config still rounds to model_dim 512 with 4 heads of width 128. MATRIX_LR is held at the t0017 value of 0.0231 rather than re-corrected for the new depth, which is exactly what the flatness result licenses. Width, document masking, dense value embeddings (now 14 tables), batch 2**18, the other learning rates, WEIGHT_DECAY 0.2 and every schedule are unchanged.", "command": ["/usr/bin/python3", "/data3/zhubaiyu/fengheguai/fengheguai/rendezvous_agent.py", "--trial", "/data3/zhubaiyu/fengheguai/campaigns/h200-claude/nodes/t0021", "--result", "/data3/zhubaiyu/fengheguai/campaigns/h200-claude/nodes/t0021/.fengheguai-agent-result.json", "--schema", "/data3/zhubaiyu/fengheguai/campaigns/h200-claude/control/agent_output.schema.json", "--campaign", "/data3/zhubaiyu/fengheguai/campaigns/h200-claude", "--inbox", "/data3/zhubaiyu/fengheguai/campaigns/h200-claude-rendezvous"], "errors": [], "expected_val_bpb_effect": "Expected between a 0.0005 decrease and a 0.001 increase versus champion t0017 at 0.973371, and I expect this to be near break-even. The depth increments have decayed by roughly a factor of 4.6 each time, 0.003705 then 0.000807, so extrapolation puts the next one near 0.0002, which is close to the 0.00013 repeat-noise level, while the step cost keeps compounding and should take steps from 1470 to about 1270. The value of the node is closing the axis with a third bracketing point rather than a large gain.", "hypothesis": "The two elite lines are nested and differ only in MATRIX_LR, 0.02828 in t0016 against 0.0231 in t0017, and their runs overlap: 0.9734873 and 0.9733571 against 0.9733484 and 0.9733932. Their joint content is therefore not a rate preference but a flatness result, that the Muon matrix rate is insensitive in this neighbourhood at depth 12. That retires the specific concern which motivated t0017, namely that decaying depth returns might be rate mismatch rather than saturation. Combining the shared mechanism of both elites, that depth increments buy quality per step spent, with their joint finding that the rate axis is flat, depth 14 is the test that closes the capacity axis: with rate mismatch excluded, whatever it measures is the genuine marginal value of depth.", "log_path": "/data3/zhubaiyu/fengheguai/campaigns/h200-claude/artifacts/t0021/agent.log", "return_code": 0, "risk": "This node is deliberately low-expected-value and I am recording that openly: the honest reason to spend it is that it is the combination these two elites actually license, and it converts a two-point decay trend into a bracketed verdict. If it regresses, the capacity axis is closed at depth 12 and the remaining budget should go to the schedule direction, where t0020 produced a strong signal that a longer warmdown costs 0.001467 and therefore that a shorter one is worth testing.", "success": true, "timed_out": false}, "secondary_parent_id": "t0016", "selection_reason": "Recombine two independently strong branches at the scheduled synthesis step.", "source_sha256": "51d45c13af515f7999daa23fade7cd39543e04e4611ccb707cf3b9af4915b62d", "stage": "recombine", "status": "discard", "training_seconds": 300.0, "trial_id": "t0021", "workspace": "/data3/zhubaiyu/fengheguai/campaigns/h200-claude/nodes/t0021"}, "prev_hash": "eac41ad56720a78285cc324ed3e0e78b52cea07ec0e92e36dae794aef2b392d6", "seq": 44, "timestamp": "2026-08-20T15:45:16.846721+00:00"}
{"hash": "affce8b310f9b3272f80c8cb91bf47aea3575fe02ca24fdb1f73689bdd0154b5", "kind": "trial_started", "payload": {"parent_id": "t0017", "reason": "The current line is stalled; make a structurally different bet.", "secondary_parent_id": null, "stage": "explore", "trial_id": "t0022"}, "prev_hash": "5dabedb7db10a0ebf18d41b9fd9be2ceee84f813b0b251a1ff24a1df9991cd75", "seq": 45, "timestamp": "2026-08-20T15:45:16.860717+00:00"}
{"hash": "ac8871705dee5d2864bf6d79c02398c9e6cb0998699795a5f65a671fa585cde2", "kind": "trial_completed", "payload": {"champion_before": "t0017", "debug_depth": 0, "delta_vs_champion_before": 0.0018062080867121688, "delta_vs_parent": 0.0018062080867121688, "finding": "t0022 did not improve the prior champion: val_bpb=0.975177, delta=+0.001806. Hypothesis: The t0008 result has outlived the conditions that produced it and should be retested rather than inherited. Dense value embeddings won 0.000902 at depth 8, where the run consumed 549.7M tokens and the loader reported epoch 2, so every example was seen roughly twice and token-indexed memory paid off. Depth 12 changed that: the run now consumes 385.4M tokens at epoch 1, a single pass, and the value-embedding block has grown from 8 tables to 12, about 50M parameters, which is the largest block in the model and carries AdamW moments and a gather per layer. Without repetition to memorise, that capacity should be worth less than the steps it costs, so reverting to the original alternating pattern should raise the step count enough to lower val_bpb.", "measurements": [{"command": ["/data/home/zhubaiyu/.local/bin/uv", "run", "--project", "/data3/zhubaiyu/fengheguai/campaigns/h200-claude/nodes/t0022", "python", "/data3/zhubaiyu/fengheguai/fengheguai/_audit_runner.py", "--target", "/data3/zhubaiyu/fengheguai/campaigns/h200-claude/nodes/t0022", "--nonce", "5743ab54542c614bed75c37b9b78c06875d7276bf4c9fba7"], "errors": [], "evidence_path": "/data3/zhubaiyu/fengheguai/campaigns/h200-claude/evidence/t0022-r0/evidence.json", "evidence_sha256": "6ff901304adc0472dd8229c038bbc7655623f9f41c652ea871df0cf9b19a92b6", "log_path": "/data3/zhubaiyu/fengheguai/campaigns/h200-claude/evidence/t0022-r0/run.log", "log_sha256": "51d594d453d6dbe9c24714cbae405e292191fa09023130c23d1f566cc6fa1388", "metric": 0.9751770259335362, "num_steps": 1510, "peak_vram_mb": 65103.3, "return_code": 0, "status": "valid", "timed_out": false, "train_sha256": "06351c57c8d38de41a8d834ced3b8e21c1c8e8eed9acbd6da1a210eb2e871e84", "training_seconds": 300.0, "wall_seconds": 562.6422977223992}], "metric": 0.9751770259335362, "parent_id": "t0017", "patch_path": "/data3/zhubaiyu/fengheguai/campaigns/h200-claude/artifacts/t0022/change.patch", "patch_sha256": "36d4f8325298c76d6b0531daddd93342efb4f6f42019efc554049a0b2d64a1bb", "promoted": false, "proposal": {"change_summary": "One function body reverted on champion t0017: has_ve returns to the upstream alternating rule, layer_idx modulo 2 equal to (n_layer - 1) modulo 2, instead of returning True for every layer. At depth 12 this halves the value-embedding tables from 12 to 6 and removes their ve_gate projections, cutting roughly 25M parameters and their optimizer state. Depth 12, width 512, document masking, batch 2**18, all learning rates, WEIGHT_DECAY 0.2 and every schedule are unchanged.", "command": ["/usr/bin/python3", "/data3/zhubaiyu/fengheguai/fengheguai/rendezvous_agent.py", "--trial", "/data3/zhubaiyu/fengheguai/campaigns/h200-claude/nodes/t0022", "--result", "/data3/zhubaiyu/fengheguai/campaigns/h200-claude/nodes/t0022/.fengheguai-agent-result.json", "--schema", "/data3/zhubaiyu/fengheguai/campaigns/h200-claude/control/agent_output.schema.json", "--campaign", "/data3/zhubaiyu/fengheguai/campaigns/h200-claude", "--inbox", "/data3/zhubaiyu/fengheguai/campaigns/h200-claude-rendezvous"], "errors": [], "expected_val_bpb_effect": "Genuinely two-sided, between a 0.001 decrease and a 0.001 increase versus champion t0017 at 0.973371. The step count is the diagnostic: value embeddings are excluded from the per-token FLOP model, so any gain must come from reduced optimizer and bandwidth overhead, and t0008 measured that cost as only about 2 percent of steps at depth 8. If steps rise by that little, the quality loss will likely dominate and the mechanism is confirmed to still pay at epoch 1; if steps rise substantially more at depth 12, the trade may now favour the sparse pattern.", "hypothesis": "The t0008 result has outlived the conditions that produced it and should be retested rather than inherited. Dense value embeddings won 0.000902 at depth 8, where the run consumed 549.7M tokens and the loader reported epoch 2, so every example was seen roughly twice and token-indexed memory paid off. Depth 12 changed that: the run now consumes 385.4M tokens at epoch 1, a single pass, and the value-embedding block has grown from 8 tables to 12, about 50M parameters, which is the largest block in the model and carries AdamW moments and a gather per layer. Without repetition to memorise, that capacity should be worth less than the steps it costs, so reverting to the original alternating pattern should raise the step count enough to lower val_bpb.", "log_path": "/data3/zhubaiyu/fengheguai/campaigns/h200-claude/artifacts/t0022/agent.log", "return_code": 0, "risk": "The epoch counter is an integer, so epoch 1 may mean anywhere from a fraction of a pass to just under two, and the single-epoch premise is weaker than it sounds; the corpus is roughly 250-275M tokens against 385.4M consumed, which is closer to 1.4 passes than to a clean single pass. That means some repetition remains and the memory mechanism may still earn its keep. A regression here is still a useful result because it converts an inherited assumption into a measurement at the current operating point rather than the one where it was first established.", "success": true, "timed_out": false}, "secondary_parent_id": null, "selection_reason": "The current line is stalled; make a structurally different bet.", "source_sha256": "06351c57c8d38de41a8d834ced3b8e21c1c8e8eed9acbd6da1a210eb2e871e84", "stage": "explore", "status": "discard", "training_seconds": 300.0, "trial_id": "t0022", "workspace": "/data3/zhubaiyu/fengheguai/campaigns/h200-claude/nodes/t0022"}, "prev_hash": "affce8b310f9b3272f80c8cb91bf47aea3575fe02ca24fdb1f73689bdd0154b5", "seq": 46, "timestamp": "2026-08-20T15:56:16.050734+00:00"}
{"hash": "b8a84c751944804cf1238dc203757615186f686b0c2d892c8e1ec89dce7493f8", "kind": "trial_started", "payload": {"parent_id": "t0017", "reason": "The current line is stalled; make a structurally different bet.", "secondary_parent_id": null, "stage": "explore", "trial_id": "t0023"}, "prev_hash": "ac8871705dee5d2864bf6d79c02398c9e6cb0998699795a5f65a671fa585cde2", "seq": 47, "timestamp": "2026-08-20T15:56:16.065393+00:00"}
{"hash": "d8e442104cba543fdc776c8df5962a7226bed80b727388dc1336450910347989", "kind": "trial_completed", "payload": {"champion_before": "t0017", "debug_depth": 0, "delta_vs_champion_before": 0.0001628362432327668, "delta_vs_parent": 0.0001628362432327668, "finding": "t0023 did not improve the prior champion: val_bpb=0.973534, delta=+0.000163. Hypothesis: The value-embedding path is the strongest mechanism in this recipe and it has never had its own learning rate. setup_optimizer already places value_embeds in a separate parameter group, but that group borrows embedding_lr from transformer.wte, so every rate experiment has moved both together. That makes t0014 uninterpretable in a specific way: raising the shared rate from 0.6 to 0.8 lost 0.000613, but the loss cannot be attributed, and wte is the likelier objector since it is a single bf16 table feeding a norm while the value embeddings are twelve tables injected into the attention value stream. The evidence that the mechanism is load-bearing has also grown, from 0.000902 at depth 8 to 0.001806 at depth 12 as measured by t0022. Decoupling the rates and giving the value embeddings 0.9 while wte stays at 0.6 should lower val_bpb.", "measurements": [{"command": ["/data/home/zhubaiyu/.local/bin/uv", "run", "--project", "/data3/zhubaiyu/fengheguai/campaigns/h200-claude/nodes/t0023", "python", "/data3/zhubaiyu/fengheguai/fengheguai/_audit_runner.py", "--target", "/data3/zhubaiyu/fengheguai/campaigns/h200-claude/nodes/t0023", "--nonce", "ebfd421c7e301d9875b24a8696f4e367351ea52ca79a5a5d"], "errors": [], "evidence_path": "/data3/zhubaiyu/fengheguai/campaigns/h200-claude/evidence/t0023-r0/evidence.json", "evidence_sha256": "07d4b32aafb3885a8d76b24468232bb5533c660223b769a6d8db4581800c3d5d", "log_path": "/data3/zhubaiyu/fengheguai/campaigns/h200-claude/evidence/t0023-r0/run.log", "log_sha256": "473a2576ac85c0cf5cbd9366a458b2f0259f0e89747b0e9cea83c7b2c9c7a46f", "metric": 0.9735336540900568, "num_steps": 1471, "peak_vram_mb": 66795.6, "return_code": 0, "status": "valid", "timed_out": false, "train_sha256": "18fcd3df53920fbb4007d846016dbdc4e34498b73bca4574fc256f132b91f9da", "training_seconds": 300.2, "wall_seconds": 486.1083739232272}], "metric": 0.9735336540900568, "parent_id": "t0017", "patch_path": "/data3/zhubaiyu/fengheguai/campaigns/h200-claude/artifacts/t0023/change.patch", "patch_sha256": "376d19fb237bfe35e97f8b7f91384b93e500743828df21d123f5299afc88ac4d", "promoted": false, "proposal": {"change_summary": "Optimizer change on champion t0017: setup_optimizer gains a value_embedding_lr argument that defaults to embedding_lr, so behaviour is unchanged when it is not supplied, and the existing value_embeds parameter group now uses it instead of embedding_lr. A new VALUE_EMBEDDING_LR constant is set to 0.9 and passed at the call site, while EMBEDDING_LR stays 0.6 for wte. No architecture, capacity, batching, masking or schedule changes: depth 12, width 512, document masking, dense value embeddings, batch 2**18, MATRIX_LR 0.0231, UNEMBEDDING_LR 0.002828 and WEIGHT_DECAY 0.2 all remain as in the champion.", "command": ["/usr/bin/python3", "/data3/zhubaiyu/fengheguai/fengheguai/rendezvous_agent.py", "--trial", "/data3/zhubaiyu/fengheguai/campaigns/h200-claude/nodes/t0023", "--result", "/data3/zhubaiyu/fengheguai/campaigns/h200-claude/nodes/t0023/.fengheguai-agent-result.json", "--schema", "/data3/zhubaiyu/fengheguai/campaigns/h200-claude/control/agent_output.schema.json", "--campaign", "/data3/zhubaiyu/fengheguai/campaigns/h200-claude", "--inbox", "/data3/zhubaiyu/fengheguai/campaigns/h200-claude-rendezvous"], "errors": [], "expected_val_bpb_effect": "Expected decrease of roughly 0.0005-0.002 bpb versus champion t0017 at 0.973371 if the value embeddings were being held back by a rate chosen for wte. An increase would show that 0.6 was already right for both groups and that the t0014 loss came from the value embeddings rather than wte, which is equally informative because it would close the embedding-rate question that t0014 left genuinely open.", "hypothesis": "The value-embedding path is the strongest mechanism in this recipe and it has never had its own learning rate. setup_optimizer already places value_embeds in a separate parameter group, but that group borrows embedding_lr from transformer.wte, so every rate experiment has moved both together. That makes t0014 uninterpretable in a specific way: raising the shared rate from 0.6 to 0.8 lost 0.000613, but the loss cannot be attributed, and wte is the likelier objector since it is a single bf16 table feeding a norm while the value embeddings are twelve tables injected into the attention value stream. The evidence that the mechanism is load-bearing has also grown, from 0.000902 at depth 8 to 0.001806 at depth 12 as measured by t0022. Decoupling the rates and giving the value embeddings 0.9 while wte stays at 0.6 should lower val_bpb.", "log_path": "/data3/zhubaiyu/fengheguai/campaigns/h200-claude/artifacts/t0023/agent.log", "return_code": 0, "risk": "This adds a parameter group knob rather than a new mechanism, so the upside is bounded by how much the two groups actually disagree, and they may not disagree at all. The default-preserving signature means the change is inert unless the call site passes the new argument, which it does, so a null result would be a real null rather than a plumbing failure. A rate of 0.9 is also the highest any embedding group has run at here, and instability would appear as a much higher loss or a FAIL exit rather than a small regression.", "success": true, "timed_out": false}, "secondary_parent_id": null, "selection_reason": "The current line is stalled; make a structurally different bet.", "source_sha256": "18fcd3df53920fbb4007d846016dbdc4e34498b73bca4574fc256f132b91f9da", "stage": "explore", "status": "discard", "training_seconds": 300.2, "trial_id": "t0023", "workspace": "/data3/zhubaiyu/fengheguai/campaigns/h200-claude/nodes/t0023"}, "prev_hash": "b8a84c751944804cf1238dc203757615186f686b0c2d892c8e1ec89dce7493f8", "seq": 48, "timestamp": "2026-08-20T16:05:46.819581+00:00"}
{"hash": "43b44cf78f1b925dc03c95b8f3716444f5129443b3963b3f17a3da831bda8b63", "kind": "trial_started", "payload": {"parent_id": "t0017", "reason": "The current line is stalled; make a structurally different bet.", "secondary_parent_id": null, "stage": "explore", "trial_id": "t0024"}, "prev_hash": "d8e442104cba543fdc776c8df5962a7226bed80b727388dc1336450910347989", "seq": 49, "timestamp": "2026-08-20T16:05:46.834521+00:00"}
