{"hash": "d5a167f3e04ed6921b31923e77a640cbd04d4ed92dc26cf88ae2eeb3b694e9ef", "kind": "trial_completed", "payload": {"champion_before": "t0010", "debug_depth": 0, "delta_vs_champion_before": -0.00023080404110542574, "delta_vs_parent": -0.00023080404110542574, "finding": "t0012 improved the prior champion: val_bpb=0.977934, delta=-0.000231. Hypothesis: The t0004 gain was measured on a bundle of three learning rates moved together, and its own risk note recorded that a win would not attribute the gain to any one parameter group. That debt now matters because setup_optimizer puts the value embeddings in the same group as the token embeddings, and t0008 showed the value-embedding path is the most productive mechanism in this recipe, extending it to all eight layers and doubling those parameters to 33.5M. A parameter group that large and that load-bearing may not want the square-root batch rescale that helped the matrix and unembedding groups. Restoring EMBEDDING_LR alone to its original 0.6, while leaving UNEMBEDDING_LR and MATRIX_LR at their rescaled values, decomposes the bundle and tests whether the embedding group was rescaled correctly.", "measurements": [{"command": ["/data/home/zhubaiyu/.local/bin/uv", "run", "--project", "/data3/zhubaiyu/fengheguai/campaigns/h200-claude/nodes/t0012", "python", "/data3/zhubaiyu/fengheguai/fengheguai/_audit_runner.py", "--target", "/data3/zhubaiyu/fengheguai/campaigns/h200-claude/nodes/t0012", "--nonce", "743547dbfc6772b77adcc3c6d5383cf83ff7c3b74f12af25"], "errors": [], "evidence_path": "/data3/zhubaiyu/fengheguai/campaigns/h200-claude/evidence/t0012-r0/evidence.json", "evidence_sha256": "8b306a661f5754a7d1dda54dc6caa84942ff9651a9209979f098000622a77a27", "log_path": "/data3/zhubaiyu/fengheguai/campaigns/h200-claude/evidence/t0012-r0/run.log", "log_sha256": "e7aed5702c909c56236ed9788581e570b09b431a40bc69f85adc0813d594d651", "metric": 0.9780268630631639, "num_steps": 2096, "peak_vram_mb": 46036.2, "return_code": 0, "status": "valid", "timed_out": false, "train_sha256": "5e01e4894eb6002c229efd63502528e4f4def31afb3028d68a85b56d6dce74d6", "training_seconds": 300.0, "wall_seconds": 474.6911706114188}, {"command": ["/data/home/zhubaiyu/.local/bin/uv", "run", "--project", "/data3/zhubaiyu/fengheguai/campaigns/h200-claude/nodes/t0012", "python", "/data3/zhubaiyu/fengheguai/fengheguai/_audit_runner.py", "--target", "/data3/zhubaiyu/fengheguai/campaigns/h200-claude/nodes/t0012", "--nonce", "c055342cc6f68269a7ede9b260fc93e9398db023107e3b48"], "errors": [], "evidence_path": "/data3/zhubaiyu/fengheguai/campaigns/h200-claude/evidence/t0012-r1/evidence.json", "evidence_sha256": "95ecab720e43b80ce2a51058c7e3fbbd84ea3a97e7752129afb5755d2f8be1f6", "log_path": "/data3/zhubaiyu/fengheguai/campaigns/h200-claude/evidence/t0012-r1/run.log", "log_sha256": "d2a26a8439e196d62c7ceba1280e858e84c197852ab8c22641a97aeb0b599f31", "metric": 0.9778411527499635, "num_steps": 2101, "peak_vram_mb": 46036.2, "return_code": 0, "status": "valid", "timed_out": false, "train_sha256": "5e01e4894eb6002c229efd63502528e4f4def31afb3028d68a85b56d6dce74d6", "training_seconds": 300.1, "wall_seconds": 469.7997455652803}], "metric": 0.9779340079065637, "parent_id": "t0010", "patch_path": "/data3/zhubaiyu/fengheguai/campaigns/h200-claude/artifacts/t0012/change.patch", "patch_sha256": "6af4d88e475f8be20d1848c0d8f348114a8993a17679abc3983fe5b0f399cb39", "promoted": true, "proposal": {"change_summary": "One learning rate changed on champion t0010: EMBEDDING_LR 0.4243 back to 0.6, which drives both transformer.wte and all eight value embeddings. UNEMBEDDING_LR stays 0.002828 and MATRIX_LR stays 0.02828, so the square-root rescale remains in force for the other two groups. Batch 2**18, document masking, dense value embeddings, the SSSL pattern with the 512-token short window, capacity and every schedule are unchanged.", "command": ["/usr/bin/python3", "/data3/zhubaiyu/fengheguai/fengheguai/rendezvous_agent.py", "--trial", "/data3/zhubaiyu/fengheguai/campaigns/h200-claude/nodes/t0012", "--result", "/data3/zhubaiyu/fengheguai/campaigns/h200-claude/nodes/t0012/.fengheguai-agent-result.json", "--schema", "/data3/zhubaiyu/fengheguai/campaigns/h200-claude/control/agent_output.schema.json", "--campaign", "/data3/zhubaiyu/fengheguai/campaigns/h200-claude", "--inbox", "/data3/zhubaiyu/fengheguai/campaigns/h200-claude-rendezvous"], "errors": [], "expected_val_bpb_effect": "Expected change between a 0.002 decrease and a 0.001 increase versus champion t0010 at 0.978165, and either sign is informative. A decrease means the embedding group was over-damped by the bundled rescale and that the enlarged value-embedding table wants a faster rate, which would suggest pushing it above 0.6 next. An increase confirms the square-root rescale was right for all three groups and closes the learning-rate axis for good.", "hypothesis": "The t0004 gain was measured on a bundle of three learning rates moved together, and its own risk note recorded that a win would not attribute the gain to any one parameter group. That debt now matters because setup_optimizer puts the value embeddings in the same group as the token embeddings, and t0008 showed the value-embedding path is the most productive mechanism in this recipe, extending it to all eight layers and doubling those parameters to 33.5M. A parameter group that large and that load-bearing may not want the square-root batch rescale that helped the matrix and unembedding groups. Restoring EMBEDDING_LR alone to its original 0.6, while leaving UNEMBEDDING_LR and MATRIX_LR at their rescaled values, decomposes the bundle and tests whether the embedding group was rescaled correctly.", "log_path": "/data3/zhubaiyu/fengheguai/campaigns/h200-claude/artifacts/t0012/agent.log", "return_code": 0, "risk": "A higher embedding rate can destabilise early training, since wte is bf16 and feeds a norm immediately; instability would show as a much higher loss or a FAIL exit rather than a small regression. This node also only decomposes one of the three groups, so if it regresses the unembedding group remains unattributed, though that group is 4.2M parameters against 37.7M here and is the least likely to matter.", "success": true, "timed_out": false}, "secondary_parent_id": null, "selection_reason": "Exploit a top-K branch selected by quality plus an under-exploration bonus.", "source_sha256": "5e01e4894eb6002c229efd63502528e4f4def31afb3028d68a85b56d6dce74d6", "stage": "refine", "status": "keep", "training_seconds": 300.05, "trial_id": "t0012", "workspace": "/data3/zhubaiyu/fengheguai/campaigns/h200-claude/nodes/t0012"}, "prev_hash": "97fcd00a95df4fc653fcff806412dd40f6bedb0e909ef471199f62307aff101c", "seq": 26, "timestamp": "2026-08-20T13:51:29.059820+00:00"}
{"hash": "ad5c5f66b9d707e10fe68547a6c2533f7e25613b742efe5988fd9c29ade723d8", "kind": "trial_started", "payload": {"parent_id": "t0012", "reason": "Spend the configured search share on a distinct architectural or recipe direction.", "secondary_parent_id": null, "stage": "explore", "trial_id": "t0013"}, "prev_hash": "d5a167f3e04ed6921b31923e77a640cbd04d4ed92dc26cf88ae2eeb3b694e9ef", "seq": 27, "timestamp": "2026-08-20T13:51:29.069317+00:00"}
{"hash": "cd07cf53cc8326386bc351590d227cf89a7e3fd58a8699df63f0535507311762", "kind": "trial_completed", "payload": {"champion_before": "t0012", "debug_depth": 0, "delta_vs_champion_before": -0.0037047282053126462, "delta_vs_parent": -0.0037047282053126462, "finding": "t0013 improved the prior champion: val_bpb=0.974229, delta=-0.003705. Hypothesis: Capacity is the last untested major axis, and t0011 supplies the reason to test it now. That node cut about 4 percent of modelled per-token FLOPs and returned only 0.8 percent more steps, so wall-clock per step is strongly sublinear in the FLOP model: fixed overheads such as optimizer work, embedding gathers and the per-step synchronisation dominate. If throughput is sublinear downward it should also be sublinear upward, meaning added depth costs fewer steps than the FLOP ratio predicts. Combined with the data-limited picture, where the epoch counter reads 2 and the one capacity increase already tried (dense value embeddings in t0008) paid off, two extra layers at unchanged width should lower val_bpb.", "measurements": [{"command": ["/data/home/zhubaiyu/.local/bin/uv", "run", "--project", "/data3/zhubaiyu/fengheguai/campaigns/h200-claude/nodes/t0013", "python", "/data3/zhubaiyu/fengheguai/fengheguai/_audit_runner.py", "--target", "/data3/zhubaiyu/fengheguai/campaigns/h200-claude/nodes/t0013", "--nonce", "ef613fbe8624672133a1a377f46611232dbe9844218add58"], "errors": [], "evidence_path": "/data3/zhubaiyu/fengheguai/campaigns/h200-claude/evidence/t0013-r0/evidence.json", "evidence_sha256": "79b1aa978c074e49762b36964088cd4a7cd7a152e7babbda3a28daa79eb761c9", "log_path": "/data3/zhubaiyu/fengheguai/campaigns/h200-claude/evidence/t0013-r0/run.log", "log_sha256": "fff6c9b37612ac4c25ab2d003d0fdb503b1db536a2f512592f5e1e6cd979b3d5", "metric": 0.9742225939425445, "num_steps": 1725, "peak_vram_mb": 56416.3, "return_code": 0, "status": "valid", "timed_out": false, "train_sha256": "f99912ff2656e79ace057fe3ff521ff7009d988893b71acc4d3173907bcd0b91", "training_seconds": 300.0, "wall_seconds": 558.1467398367822}, {"command": ["/data/home/zhubaiyu/.local/bin/uv", "run", "--project", "/data3/zhubaiyu/fengheguai/campaigns/h200-claude/nodes/t0013", "python", "/data3/zhubaiyu/fengheguai/fengheguai/_audit_runner.py", "--target", "/data3/zhubaiyu/fengheguai/campaigns/h200-claude/nodes/t0013", "--nonce", "187e72ce3e068085fc3d35da9a672d6c15ed7a0654e5ef4f"], "errors": [], "evidence_path": "/data3/zhubaiyu/fengheguai/campaigns/h200-claude/evidence/t0013-r1/evidence.json", "evidence_sha256": "15e14859372c556e6e57e14e55969ef759371c0a753937cd346daa69ea582bba", "log_path": "/data3/zhubaiyu/fengheguai/campaigns/h200-claude/evidence/t0013-r1/run.log", "log_sha256": "ede7814b32362b03ab21577466d3c98024e0fbd96762f47b01f1bd0c27a3a1c5", "metric": 0.9742359654599575, "num_steps": 1719, "peak_vram_mb": 56416.3, "return_code": 0, "status": "valid", "timed_out": false, "train_sha256": "f99912ff2656e79ace057fe3ff521ff7009d988893b71acc4d3173907bcd0b91", "training_seconds": 300.1, "wall_seconds": 475.9604206280783}], "metric": 0.9742292797012511, "parent_id": "t0012", "patch_path": "/data3/zhubaiyu/fengheguai/campaigns/h200-claude/artifacts/t0013/change.patch", "patch_sha256": "14f0559fc355f81be842f57ef5c626ce71ae43e8501b87f32bdadc83a6b7080b", "promoted": true, "proposal": {"change_summary": "Capacity increase on champion t0012: DEPTH 8 to 10 with ASPECT_RATIO 64 to 51, chosen so that build_model_config still rounds to a model_dim of exactly 512 with 4 heads of width 128. Width, HEAD_DIM, document masking, dense value embeddings (now on all ten layers), batch 2**18, the learning rates and every schedule are unchanged, so depth is the only variable. Matrix parameters rise about 25 percent to 31.5M and value embeddings to 41.9M.", "command": ["/usr/bin/python3", "/data3/zhubaiyu/fengheguai/fengheguai/rendezvous_agent.py", "--trial", "/data3/zhubaiyu/fengheguai/campaigns/h200-claude/nodes/t0013", "--result", "/data3/zhubaiyu/fengheguai/campaigns/h200-claude/nodes/t0013/.fengheguai-agent-result.json", "--schema", "/data3/zhubaiyu/fengheguai/campaigns/h200-claude/control/agent_output.schema.json", "--campaign", "/data3/zhubaiyu/fengheguai/campaigns/h200-claude", "--inbox", "/data3/zhubaiyu/fengheguai/campaigns/h200-claude-rendezvous"], "errors": [], "expected_val_bpb_effect": "Expected decrease of roughly 0.001-0.004 bpb versus champion t0012 at 0.977934 if the sublinear-throughput reading is right and the step count falls only about 10-15 percent rather than the 20 percent the FLOP ratio implies. If steps instead fall by 20 percent or more, expect an increase of a similar size, which would both close the capacity axis and correct the throughput model.", "hypothesis": "Capacity is the last untested major axis, and t0011 supplies the reason to test it now. That node cut about 4 percent of modelled per-token FLOPs and returned only 0.8 percent more steps, so wall-clock per step is strongly sublinear in the FLOP model: fixed overheads such as optimizer work, embedding gathers and the per-step synchronisation dominate. If throughput is sublinear downward it should also be sublinear upward, meaning added depth costs fewer steps than the FLOP ratio predicts. Combined with the data-limited picture, where the epoch counter reads 2 and the one capacity increase already tried (dense value embeddings in t0008) paid off, two extra layers at unchanged width should lower val_bpb.", "log_path": "/data3/zhubaiyu/fengheguai/campaigns/h200-claude/artifacts/t0013/agent.log", "return_code": 0, "risk": "This is the largest single change attempted so far and moves two constants, though they are one coherent quantity since ASPECT_RATIO only exists to set width from depth. Peak VRAM rises from about 46GB toward 55GB on a shared box, and a deeper stack with the same learning rates may train less stably, since the matrix rate was tuned at depth 8. The step count in the evidence will separate a genuine capacity verdict from a throughput artefact.", "success": true, "timed_out": false}, "secondary_parent_id": null, "selection_reason": "Spend the configured search share on a distinct architectural or recipe direction.", "source_sha256": "f99912ff2656e79ace057fe3ff521ff7009d988893b71acc4d3173907bcd0b91", "stage": "explore", "status": "keep", "training_seconds": 300.05, "trial_id": "t0013", "workspace": "/data3/zhubaiyu/fengheguai/campaigns/h200-claude/nodes/t0013"}, "prev_hash": "ad5c5f66b9d707e10fe68547a6c2533f7e25613b742efe5988fd9c29ade723d8", "seq": 28, "timestamp": "2026-08-20T14:10:00.117979+00:00"}
{"hash": "b12d99fa9ef95c7999eee0d28a42167983f6d83ea15b52c04f7de68d1fd8c9f9", "kind": "trial_started", "payload": {"parent_id": "t0013", "reason": "Recombine two independently strong branches at the scheduled synthesis step.", "secondary_parent_id": "t0012", "stage": "recombine", "trial_id": "t0014"}, "prev_hash": "cd07cf53cc8326386bc351590d227cf89a7e3fd58a8699df63f0535507311762", "seq": 29, "timestamp": "2026-08-20T14:10:00.128129+00:00"}
{"hash": "846b8c76f82a811d19cc45c00cb90d874d921396b6e52fdf81e50b38d21fe4d9", "kind": "trial_completed", "payload": {"champion_before": "t0013", "debug_depth": 0, "delta_vs_champion_before": 0.0006123848269422583, "delta_vs_parent": 0.0006123848269422583, "finding": "t0014 did not improve the prior champion: val_bpb=0.974842, delta=+0.000612. Hypothesis: The two elite lines are nested rather than divergent, since t0013 was built on t0012 and already carries its embedding rate, so the honest synthesis is to re-ask the t0012 question at the t0013 scale. t0012 established a principle: the embedding group, which holds both wte and every value embedding, wants a faster rate than the square-root batch rescale gave it, and restoring 0.6 beat 0.4243. t0013 then made that group substantially larger, taking value embeddings from 8 tables to 10 and the group to roughly 46M parameters, which is now the largest parameter block in the model. If the principle is real and not just a local fit, the enlarged group should want a faster rate still, so EMBEDDING_LR 0.8 should beat 0.6 at depth 10.", "measurements": [{"command": ["/data/home/zhubaiyu/.local/bin/uv", "run", "--project", "/data3/zhubaiyu/fengheguai/campaigns/h200-claude/nodes/t0014", "python", "/data3/zhubaiyu/fengheguai/fengheguai/_audit_runner.py", "--target", "/data3/zhubaiyu/fengheguai/campaigns/h200-claude/nodes/t0014", "--nonce", "4a9de1bfb21c82a75182fbce02d8b152f0fae252d6c18560"], "errors": [], "evidence_path": "/data3/zhubaiyu/fengheguai/campaigns/h200-claude/evidence/t0014-r0/evidence.json", "evidence_sha256": "13efe56584e778f5db3fc27607833f8d771858052d57b45e843474b645ca2d9b", "log_path": "/data3/zhubaiyu/fengheguai/campaigns/h200-claude/evidence/t0014-r0/run.log", "log_sha256": "44031b4c305b5b2e75f62f9dfaf1ac73f145cf47dc297ce3a34ac49b93ff42bf", "metric": 0.9748416645281933, "num_steps": 1714, "peak_vram_mb": 56416.3, "return_code": 0, "status": "valid", "timed_out": false, "train_sha256": "153fbfb410abdabadb0520280ad2d9c71ca6c78c4bf2739c6c23f098d4055e0a", "training_seconds": 300.1, "wall_seconds": 481.69137595873326}], "metric": 0.9748416645281933, "parent_id": "t0013", "patch_path": "/data3/zhubaiyu/fengheguai/campaigns/h200-claude/artifacts/t0014/change.patch", "patch_sha256": "0eedff7dbbeb4c999b26d29b272ae4e5ac9dd74c4dd290d77e0e7d23686f0ec9", "promoted": false, "proposal": {"change_summary": "One learning rate changed on champion t0013: EMBEDDING_LR 0.6 to 0.8, driving transformer.wte and all ten value embeddings. UNEMBEDDING_LR stays 0.002828 and MATRIX_LR stays 0.02828. Depth 10, width 512, document masking, dense value embeddings, batch 2**18 and every schedule are unchanged, so the embedding rate is the only variable and the result is directly comparable to the 0.4243 versus 0.6 comparison at depth 8.", "command": ["/usr/bin/python3", "/data3/zhubaiyu/fengheguai/fengheguai/rendezvous_agent.py", "--trial", "/data3/zhubaiyu/fengheguai/campaigns/h200-claude/nodes/t0014", "--result", "/data3/zhubaiyu/fengheguai/campaigns/h200-claude/nodes/t0014/.fengheguai-agent-result.json", "--schema", "/data3/zhubaiyu/fengheguai/campaigns/h200-claude/control/agent_output.schema.json", "--campaign", "/data3/zhubaiyu/fengheguai/campaigns/h200-claude", "--inbox", "/data3/zhubaiyu/fengheguai/campaigns/h200-claude-rendezvous"], "errors": [], "expected_val_bpb_effect": "Expected change between a 0.0015 decrease and a 0.001 increase versus champion t0013 at 0.974229. The prior step from 0.4243 to 0.6 bought only 0.00023, so the local gradient along this axis is shallow and this node is as much about locating the turning point as about winning. A decrease supports treating embedding rate as something to scale with embedding-table size; an increase fixes the optimum near 0.6 and closes the axis.", "hypothesis": "The two elite lines are nested rather than divergent, since t0013 was built on t0012 and already carries its embedding rate, so the honest synthesis is to re-ask the t0012 question at the t0013 scale. t0012 established a principle: the embedding group, which holds both wte and every value embedding, wants a faster rate than the square-root batch rescale gave it, and restoring 0.6 beat 0.4243. t0013 then made that group substantially larger, taking value embeddings from 8 tables to 10 and the group to roughly 46M parameters, which is now the largest parameter block in the model. If the principle is real and not just a local fit, the enlarged group should want a faster rate still, so EMBEDDING_LR 0.8 should beat 0.6 at depth 10.", "log_path": "/data3/zhubaiyu/fengheguai/campaigns/h200-claude/artifacts/t0014/agent.log", "return_code": 0, "risk": "The correction this node must carry forward is that the t0013 throughput reasoning was wrong: steps fell from 2101 to 1725, about 18 percent, which is what the FLOP ratio predicted rather than the 10-15 percent I forecast from a supposed sublinear regime. Capacity paid because capacity is worth more than the steps it costs, not because the steps were cheap, and future capacity nodes must be argued on that basis. For this node the direct risk is instability: 0.8 is above any rate the recipe has been run at, and wte is bf16 feeding a norm, so a divergence would appear as a FAIL exit rather than a mild regression.", "success": true, "timed_out": false}, "secondary_parent_id": "t0012", "selection_reason": "Recombine two independently strong branches at the scheduled synthesis step.", "source_sha256": "153fbfb410abdabadb0520280ad2d9c71ca6c78c4bf2739c6c23f098d4055e0a", "stage": "recombine", "status": "discard", "training_seconds": 300.1, "trial_id": "t0014", "workspace": "/data3/zhubaiyu/fengheguai/campaigns/h200-claude/nodes/t0014"}, "prev_hash": "b12d99fa9ef95c7999eee0d28a42167983f6d83ea15b52c04f7de68d1fd8c9f9", "seq": 30, "timestamp": "2026-08-20T14:19:24.338186+00:00"}
{"hash": "217e9bbd9b7cece7f464bfa2c2ec5f1bb85255a28a3ab53bd752d8ca3e07836d", "kind": "trial_started", "payload": {"parent_id": "t0013", "reason": "Spend the configured search share on a distinct architectural or recipe direction.", "secondary_parent_id": null, "stage": "explore", "trial_id": "t0015"}, "prev_hash": "846b8c76f82a811d19cc45c00cb90d874d921396b6e52fdf81e50b38d21fe4d9", "seq": 31, "timestamp": "2026-08-20T14:19:24.348567+00:00"}
