{"hash": "00876ffb3b2d3372b96884296818468b3f9692e4002427372841290177fd6b56", "kind": "trial_completed", "payload": {"champion_before": "t0096", "debug_depth": 0, "delta_vs_champion_before": 0.05212571450471559, "delta_vs_parent": 0.05212571450471559, "finding": "t0110 did not improve the prior champion: val_bpb=1.019412, delta=+0.052126. Hypothesis: The output softcap is the only constant in this recipe whose optimum has been observed to move, and it has moved in one direction each time the model around it changed. It was bracketed at 10 at batch 2**18, then t0069 raised it to 13 and gained 0.000214 once lm_head became less sensitive at the smaller batch. Since then three further changes have altered what reaches lm_head: the value-embedding tables were rescaled by a factor of 22.6 in t0087, their learning rate was halved in t0089, and weight averaging in t0096 changed which weights are finally scored. Each of those makes the representation feeding the head better conditioned, which is the same condition that moved the optimum upward before. The cap is also the steepest axis measured here, so being 20 percent off it has cost thousandths of a bpb in both directions historically. Testing 16 checks whether the optimum has drifted again.", "measurements": [{"command": ["/data/home/zhubaiyu/.local/bin/uv", "run", "--project", "/data3/zhubaiyu/fengheguai/campaigns/h200-claude/nodes/t0110", "python", "/data3/zhubaiyu/fengheguai/fengheguai/_audit_runner.py", "--target", "/data3/zhubaiyu/fengheguai/campaigns/h200-claude/nodes/t0110", "--nonce", "35dc1a9e8d22f99ac8516a54263c17dc9f82e88f2bd426ef"], "errors": [], "evidence_path": "/data3/zhubaiyu/fengheguai/campaigns/h200-claude/evidence/t0110-r0/evidence.json", "evidence_sha256": "c340eccbe22ca4cd2413fd24cf5d69a9bcc0d71eda058ab99ab15b642bb572e2", "log_path": "/data3/zhubaiyu/fengheguai/campaigns/h200-claude/evidence/t0110-r0/run.log", "log_sha256": "f47bf9362958588208b00e05788d8be88537b29dd23bf881a73fccc722c4a879", "metric": 1.0194116290525626, "num_steps": 1342, "peak_vram_mb": 34168.4, "return_code": 0, "status": "valid", "timed_out": false, "train_sha256": "5e58f9275633102dec7195dd6f978431cb1335ca013f5fffef043cb48df3c9e2", "training_seconds": 300.1, "wall_seconds": 587.4214673023671}], "metric": 1.0194116290525626, "parent_id": "t0096", "patch_path": "/data3/zhubaiyu/fengheguai/campaigns/h200-claude/artifacts/t0110/change.patch", "patch_sha256": "26543d75fb13a6714f93ab45b1e302ca40b99a5ca61079d935899e1b8534654e", "promoted": false, "proposal": {"change_summary": "One constant changed on champion t0096: the softcap in GPT.forward from 13 to 16, applied identically as softcap times tanh of logits over softcap after the float32 cast. The step of three is chosen to match the size of the last move that paid, 10 to 13, rather than to probe finely. The retuned wte rate from t0109 is not carried forward, having cost 0.000637, and the damped residual carry from t0108 is not either. Everything else matches the champion: the endpoint EMA at decay 0.99, the linear anneal, the corrected value-embedding init with VALUE_EMBEDDING_LR 0.3, depth 12, the SSL pattern with a 256-token short span, document masking, batch 2**17 and WEIGHT_DECAY 0.146.", "command": ["/usr/bin/python3", "/data3/zhubaiyu/fengheguai/fengheguai/rendezvous_agent.py", "--trial", "/data3/zhubaiyu/fengheguai/campaigns/h200-claude/nodes/t0110", "--result", "/data3/zhubaiyu/fengheguai/campaigns/h200-claude/nodes/t0110/.fengheguai-agent-result.json", "--schema", "/data3/zhubaiyu/fengheguai/campaigns/h200-claude/control/agent_output.schema.json", "--campaign", "/data3/zhubaiyu/fengheguai/campaigns/h200-claude", "--inbox", "/data3/zhubaiyu/fengheguai/campaigns/h200-claude-rendezvous"], "errors": [], "expected_val_bpb_effect": "Expected between a 0.0005 decrease and a 0.001 increase versus champion t0096 at 0.967286, with step count unchanged. The direction has a mechanism behind it rather than being a scan, but the evidence for drift is indirect: nothing has directly measured lm_head sensitivity since t0054, and the three changes cited affect it only through what they do to the representation feeding it.", "hypothesis": "The output softcap is the only constant in this recipe whose optimum has been observed to move, and it has moved in one direction each time the model around it changed. It was bracketed at 10 at batch 2**18, then t0069 raised it to 13 and gained 0.000214 once lm_head became less sensitive at the smaller batch. Since then three further changes have altered what reaches lm_head: the value-embedding tables were rescaled by a factor of 22.6 in t0087, their learning rate was halved in t0089, and weight averaging in t0096 changed which weights are finally scored. Each of those makes the representation feeding the head better conditioned, which is the same condition that moved the optimum upward before. The cap is also the steepest axis measured here, so being 20 percent off it has cost thousandths of a bpb in both directions historically. Testing 16 checks whether the optimum has drifted again.", "log_path": "/data3/zhubaiyu/fengheguai/campaigns/h200-claude/artifacts/t0110/agent.log", "return_code": 0, "risk": "At the previous operating point 15 measured 0.000393 worse than 10, so 16 is beyond a value already known to be suboptimal there; the case rests entirely on the optimum having moved, and if it has not this regresses by a similar amount. This is also the last constant in the recipe with any argument left behind it. If it regresses, every axis in this campaign is closed and further trials would be sampling noise rather than measuring anything, which is a conclusion worth stating plainly rather than continuing to generate marginal nodes.", "success": true, "timed_out": false}, "secondary_parent_id": null, "selection_reason": "The current line is stalled; make a structurally different bet.", "source_sha256": "5e58f9275633102dec7195dd6f978431cb1335ca013f5fffef043cb48df3c9e2", "stage": "explore", "status": "discard", "training_seconds": 300.1, "trial_id": "t0110", "workspace": "/data3/zhubaiyu/fengheguai/campaigns/h200-claude/nodes/t0110"}, "prev_hash": "07ab2255a13664ff4707784f7b2901a753e6dfc7a6cef689c24386f8f3e51ccf", "seq": 222, "timestamp": "2026-08-21T07:54:19.717090+00:00"}
{"hash": "b71f4081617a0f80ad34cf4885fa1481f6d80bd619b08442b6be7d8b160a779f", "kind": "trial_started", "payload": {"parent_id": "t0096", "reason": "The current line is stalled; make a structurally different bet.", "secondary_parent_id": null, "stage": "explore", "trial_id": "t0111"}, "prev_hash": "00876ffb3b2d3372b96884296818468b3f9692e4002427372841290177fd6b56", "seq": 223, "timestamp": "2026-08-21T07:54:19.778093+00:00"}
{"hash": "382c9bde9f07a71fd6501ff1c6dd461b04379ab8b78c6ded7dde6961f4ecb809", "kind": "trial_started", "payload": {"parent_id": "t0096", "reason": "The current line is stalled; make a structurally different bet.", "secondary_parent_id": null, "stage": "explore", "trial_id": "t0112"}, "prev_hash": "b71f4081617a0f80ad34cf4885fa1481f6d80bd619b08442b6be7d8b160a779f", "seq": 224, "timestamp": "2026-08-21T07:57:44.812086+00:00"}
{"hash": "fb4aab4022adb0f9841dd82d84e31c3d3ee2bfb15c3ed37d638a6f5b55df81c4", "kind": "trial_completed", "payload": {"champion_before": "t0096", "debug_depth": 0, "delta_vs_champion_before": 0.00400886286834401, "delta_vs_parent": 0.00400886286834401, "finding": "t0112 did not improve the prior champion: val_bpb=0.971295, delta=+0.004009. Hypothesis: This re-tests the softcap drift question that t0110 failed to answer. That node set the cap to 16 and returned 1.019412, worse than the untuned baseline, but the result is not attributable to the cap: it completed only 1342 optimizer steps against 2863 for the immediately preceding trial, and a foreign process occupying 104GB at full utilisation appeared on the pinned GPU partway through the run. A 53 percent step collapse is a contention signature, not a modelling effect, so the measurement was discarded and the campaign moved to an uncontended GPU. The underlying hypothesis stands: the output softcap is the only constant in this recipe whose optimum has been observed to move, rising from 10 to 13 in t0069 once lm_head became less sensitive, and three subsequent changes have further improved the representation feeding the head, namely the value-embedding rescale in t0087, its halved rate in t0089 and weight averaging in t0096. Testing 15 checks for further drift; 16 is not retested because that source already exists and would be rejected as a duplicate candidate.", "measurements": [{"command": ["/data/home/zhubaiyu/.local/bin/uv", "run", "--project", "/data3/zhubaiyu/fengheguai/campaigns/h200-claude/nodes/t0112", "python", "/data3/zhubaiyu/fengheguai/fengheguai/_audit_runner.py", "--target", "/data3/zhubaiyu/fengheguai/campaigns/h200-claude/nodes/t0112", "--nonce", "678bdec4ca710be598357ae773d13379fb772813bf9346e6"], "errors": [], "evidence_path": "/data3/zhubaiyu/fengheguai/campaigns/h200-claude/evidence/t0112-r0/evidence.json", "evidence_sha256": "7b8eb64ff64839ff194c9e91afdea852cd45d13aefc3bec3a5dd0ebaca8f6f35", "log_path": "/data3/zhubaiyu/fengheguai/campaigns/h200-claude/evidence/t0112-r0/run.log", "log_sha256": "33842b3594d11d1eb6d229439c1b003d4eec9c7ba0b73c4857a3508341817286", "metric": 0.971294777416191, "num_steps": 2687, "peak_vram_mb": 34168.4, "return_code": 0, "status": "valid", "timed_out": false, "train_sha256": "ac15527df271de5a9acf436f294070bea40c0b5a62c79c65c3b8f2648dbd1d47", "training_seconds": 300.0, "wall_seconds": 566.1770635368302}], "metric": 0.971294777416191, "parent_id": "t0096", "patch_path": "/data3/zhubaiyu/fengheguai/campaigns/h200-claude/artifacts/t0112/change.patch", "patch_sha256": "f61ba823e2c533c39f22f3a5922103b811d857b59a651880b0b99df67a685de9", "promoted": false, "proposal": {"change_summary": "One constant changed on champion t0096: the softcap in GPT.forward from 13 to 15. Everything else matches the champion, including the endpoint EMA at decay 0.99, the linear anneal, the corrected value-embedding init with VALUE_EMBEDDING_LR 0.3, depth 12, the SSL pattern with a 256-token short span, document masking, batch 2**17 and WEIGHT_DECAY 0.146. Note the operating change around this node: the controller was restarted on an uncontended GPU after a foreign job appeared on the previous one, so this is the first trial measured on the new device. The hardware is identical, another H200 on the same host, and the training contract is unchanged, but a systematic offset between devices cannot be excluded from a single trial and should be watched for across the next few.", "command": ["/usr/bin/python3", "/data3/zhubaiyu/fengheguai/fengheguai/rendezvous_agent.py", "--trial", "/data3/zhubaiyu/fengheguai/campaigns/h200-claude/nodes/t0112", "--result", "/data3/zhubaiyu/fengheguai/campaigns/h200-claude/nodes/t0112/.fengheguai-agent-result.json", "--schema", "/data3/zhubaiyu/fengheguai/campaigns/h200-claude/control/agent_output.schema.json", "--campaign", "/data3/zhubaiyu/fengheguai/campaigns/h200-claude", "--inbox", "/data3/zhubaiyu/fengheguai/campaigns/h200-claude-rendezvous"], "errors": [], "expected_val_bpb_effect": "Expected between a 0.0005 decrease and a 0.001 increase versus champion t0096 at 0.967286, with the step count the first thing to check: anything near 2870 confirms the new GPU is clean and the comparison is valid, while a materially lower count means contention followed us and no conclusion should be drawn about the cap.", "hypothesis": "This re-tests the softcap drift question that t0110 failed to answer. That node set the cap to 16 and returned 1.019412, worse than the untuned baseline, but the result is not attributable to the cap: it completed only 1342 optimizer steps against 2863 for the immediately preceding trial, and a foreign process occupying 104GB at full utilisation appeared on the pinned GPU partway through the run. A 53 percent step collapse is a contention signature, not a modelling effect, so the measurement was discarded and the campaign moved to an uncontended GPU. The underlying hypothesis stands: the output softcap is the only constant in this recipe whose optimum has been observed to move, rising from 10 to 13 in t0069 once lm_head became less sensitive, and three subsequent changes have further improved the representation feeding the head, namely the value-embedding rescale in t0087, its halved rate in t0089 and weight averaging in t0096. Testing 15 checks for further drift; 16 is not retested because that source already exists and would be rejected as a duplicate candidate.", "log_path": "/data3/zhubaiyu/fengheguai/campaigns/h200-claude/artifacts/t0112/agent.log", "return_code": 0, "risk": "At the earlier operating point 15 measured 0.000393 worse than 10, so this value is already known to be suboptimal under the old conditions and the case rests entirely on drift since then. The larger risk for the campaign as a whole is the device change: every previous measurement including the champion was taken on the old GPU, so if the new one differs systematically then the champion score and any new score are not strictly comparable. The step count is the diagnostic for that, since throughput is what contention and device differences both move, and it has been stable at 2869 to 2875 across the last several uncontended trials.", "success": true, "timed_out": false}, "secondary_parent_id": null, "selection_reason": "The current line is stalled; make a structurally different bet.", "source_sha256": "ac15527df271de5a9acf436f294070bea40c0b5a62c79c65c3b8f2648dbd1d47", "stage": "explore", "status": "discard", "training_seconds": 300.0, "trial_id": "t0112", "workspace": "/data3/zhubaiyu/fengheguai/campaigns/h200-claude/nodes/t0112"}, "prev_hash": "382c9bde9f07a71fd6501ff1c6dd461b04379ab8b78c6ded7dde6961f4ecb809", "seq": 225, "timestamp": "2026-08-21T08:08:23.489360+00:00"}
{"hash": "98a676c487ecca19ce4842d52542091b1151677280cc232db914066d08c84f7a", "kind": "trial_started", "payload": {"parent_id": "t0096", "reason": "Recombine two independently strong branches at the scheduled synthesis step.", "secondary_parent_id": "t0099", "stage": "recombine", "trial_id": "t0113"}, "prev_hash": "fb4aab4022adb0f9841dd82d84e31c3d3ee2bfb15c3ed37d638a6f5b55df81c4", "seq": 226, "timestamp": "2026-08-21T08:08:23.552976+00:00"}
{"hash": "d3b69308ba5f97d371847dfe4f03a3d7e4b69fad9443face820f517e2ee3f6b6", "kind": "trial_completed", "payload": {"champion_before": "t0096", "debug_depth": 0, "delta_vs_champion_before": 0.00793476104083124, "delta_vs_parent": 0.00793476104083124, "finding": "t0113 did not improve the prior champion: val_bpb=0.975221, delta=+0.007935. Hypothesis: Both elite lines concern the endpoint of training, and one parameter of that machinery has never been measured. t0096 introduced weight averaging and gained 0.001103; t0099 then showed the schedule floor is inert across a doubling because the average now absorbs endpoint noise. The averaging window has been bracketed through its decay, 0.98 and 0.995 both worse than 0.99, but EMA_START has only ever been argued about, not tested. My argument was that it cannot bind: with a decay of 0.99 the effective horizon is roughly 100 steps while the averaging phase spans about 860, so the average forgets its starting point many times over. Moving the start from 0.7 to 0.5 nearly doubles the phase to about 1430 steps and tests that argument directly. If the reasoning is right this is an exact null, which is the outcome I expect.", "measurements": [{"command": ["/data/home/zhubaiyu/.local/bin/uv", "run", "--project", "/data3/zhubaiyu/fengheguai/campaigns/h200-claude/nodes/t0113", "python", "/data3/zhubaiyu/fengheguai/fengheguai/_audit_runner.py", "--target", "/data3/zhubaiyu/fengheguai/campaigns/h200-claude/nodes/t0113", "--nonce", "06d5d3d84f8653f062097062af47e72e0b32d64669b74e06"], "errors": [], "evidence_path": "/data3/zhubaiyu/fengheguai/campaigns/h200-claude/evidence/t0113-r0/evidence.json", "evidence_sha256": "ed31ea082e3d6b2d81585eed37e2bb520e9dbf97eb7af1c2ceece9109da04940", "log_path": "/data3/zhubaiyu/fengheguai/campaigns/h200-claude/evidence/t0113-r0/run.log", "log_sha256": "fe8b00d453492d3fd873ccf00d1fa830a7c37517640ce9935fa63e32b355e4e4", "metric": 0.9752206755886782, "num_steps": 2549, "peak_vram_mb": 34168.4, "return_code": 0, "status": "valid", "timed_out": false, "train_sha256": "80b58ee523219b2cb5bc023e45dfb3095c3a436090f707cd0217913b25962d97", "training_seconds": 300.0, "wall_seconds": 493.6845177914947}], "metric": 0.9752206755886782, "parent_id": "t0096", "patch_path": "/data3/zhubaiyu/fengheguai/campaigns/h200-claude/artifacts/t0113/change.patch", "patch_sha256": "8540ae1373f0bc5b7baf80eff544fd55ee9c1730562185317edac7fc3c9e0d69", "promoted": false, "proposal": {"change_summary": "One constant changed on champion t0096: EMA_START from 0.7 to 0.5, so weight averaging begins at the midpoint of the time budget rather than at 70 percent. EMA_DECAY stays at its bracketed 0.99. Both elite contributions are retained unchanged: the averaging mechanism from t0096 and the schedule floor of 0.1 that t0099 measured as inert. Everything else matches the champion, including the corrected value-embedding init with VALUE_EMBEDDING_LR 0.3, the linear anneal, depth 12, the SSL pattern with a 256-token short span, document masking, output softcap 13, batch 2**17 and WEIGHT_DECAY 0.146.", "command": ["/usr/bin/python3", "/data3/zhubaiyu/fengheguai/fengheguai/rendezvous_agent.py", "--trial", "/data3/zhubaiyu/fengheguai/campaigns/h200-claude/nodes/t0113", "--result", "/data3/zhubaiyu/fengheguai/campaigns/h200-claude/nodes/t0113/.fengheguai-agent-result.json", "--schema", "/data3/zhubaiyu/fengheguai/campaigns/h200-claude/control/agent_output.schema.json", "--campaign", "/data3/zhubaiyu/fengheguai/campaigns/h200-claude", "--inbox", "/data3/zhubaiyu/fengheguai/campaigns/h200-claude-rendezvous"], "errors": [], "expected_val_bpb_effect": "Expected to land within noise of champion t0096 at 0.967286. This node is a check on a piece of reasoning rather than a bid for improvement, and I am recording that plainly: a null confirms the horizon argument and closes the averaging mechanism completely, while any material difference would mean the decay does not dominate the start point as claimed and the window was never properly characterised.", "hypothesis": "Both elite lines concern the endpoint of training, and one parameter of that machinery has never been measured. t0096 introduced weight averaging and gained 0.001103; t0099 then showed the schedule floor is inert across a doubling because the average now absorbs endpoint noise. The averaging window has been bracketed through its decay, 0.98 and 0.995 both worse than 0.99, but EMA_START has only ever been argued about, not tested. My argument was that it cannot bind: with a decay of 0.99 the effective horizon is roughly 100 steps while the averaging phase spans about 860, so the average forgets its starting point many times over. Moving the start from 0.7 to 0.5 nearly doubles the phase to about 1430 steps and tests that argument directly. If the reasoning is right this is an exact null, which is the outcome I expect.", "log_path": "/data3/zhubaiyu/fengheguai/campaigns/h200-claude/artifacts/t0113/agent.log", "return_code": 0, "risk": "The measurement environment has degraded and that matters more than this node does. The previous trial ran 2687 steps against 2869 for the champion, a 6.3 percent deficit that no softcap change can cause, and the host now runs seven of eight GPUs at full utilisation with four concurrent jobs from another tenant; our own GPU is exclusive but host memory bandwidth and PCIe are not. Any result within a few thousandths of the champion is therefore not cleanly attributable, and the honest use of this trial is as a coarse check on a reasoning step rather than as a measurement. Step count should be read first: near 2870 means conditions recovered, and near 2690 or below means the comparison is not valid.", "success": true, "timed_out": false}, "secondary_parent_id": "t0099", "selection_reason": "Recombine two independently strong branches at the scheduled synthesis step.", "source_sha256": "80b58ee523219b2cb5bc023e45dfb3095c3a436090f707cd0217913b25962d97", "stage": "recombine", "status": "discard", "training_seconds": 300.0, "trial_id": "t0113", "workspace": "/data3/zhubaiyu/fengheguai/campaigns/h200-claude/nodes/t0113"}, "prev_hash": "98a676c487ecca19ce4842d52542091b1151677280cc232db914066d08c84f7a", "seq": 227, "timestamp": "2026-08-21T08:18:23.871408+00:00"}
{"hash": "bc63c9b03db87b0a6a1cdb4c411458b0a4041725a94987d37a3e52db159477f0", "kind": "trial_started", "payload": {"parent_id": "t0096", "reason": "The current line is stalled; make a structurally different bet.", "secondary_parent_id": null, "stage": "explore", "trial_id": "t0114"}, "prev_hash": "d3b69308ba5f97d371847dfe4f03a3d7e4b69fad9443face820f517e2ee3f6b6", "seq": 228, "timestamp": "2026-08-21T08:18:23.934104+00:00"}
