{"hash": "1034f65425e5910d03ba67e89ac97060508337184621b6c80306ede3aa7a6ac5", "kind": "trial_completed", "payload": {"champion_before": "t0037", "debug_depth": 0, "delta_vs_champion_before": 0.0027380045566290923, "delta_vs_parent": 0.0027380045566290923, "finding": "t0042 did not improve the prior champion: val_bpb=0.975442, delta=+0.002738. Hypothesis: The two elite lines jointly say the optimizer is finished as a source of gains: t0041 moved the last untouched optimizer control, the NorMuon variance horizon, and landed at 0.972811 against the champion 0.972704, a difference below the 0.00013 repeat noise. What remains unexploited is a kernel mechanism the recipe never enables. The single inherited default that proved suboptimal in this entire campaign was the output softcap, where tightening from 15 to 10 gained 0.000393 and both 7 and 30 cost more than 0.004, and its mechanism is bounding logits before a softmax. Attention applies a softmax too, and flash-attention-3 exposes exactly the same control through its softcap argument, which this recipe leaves at the default 0.0, meaning off. Because q and k are RMS-normalised per head, attention logits are bounded near 11.3 at perfect alignment while typical values sit near 1, so a cap of 10 binds only on the sharpest matches and should temper over-confident attention without touching the bulk of the distribution.", "measurements": [{"command": ["/data/home/zhubaiyu/.local/bin/uv", "run", "--project", "/data3/zhubaiyu/fengheguai/campaigns/h200-claude/nodes/t0042", "python", "/data3/zhubaiyu/fengheguai/fengheguai/_audit_runner.py", "--target", "/data3/zhubaiyu/fengheguai/campaigns/h200-claude/nodes/t0042", "--nonce", "1f9d7a09164652336bf2649f7f5556c3bfb770cd582b8be0"], "errors": [], "evidence_path": "/data3/zhubaiyu/fengheguai/campaigns/h200-claude/evidence/t0042-r0/evidence.json", "evidence_sha256": "eb6f1e04a1293fab75c19cdd65db1111e3c1b84d470074fe80526820e45cc2f4", "log_path": "/data3/zhubaiyu/fengheguai/campaigns/h200-claude/evidence/t0042-r0/run.log", "log_sha256": "dd0c9a76909936db489f1f9f9c62862819c9afcefac89640df21eca1a29f7648", "metric": 0.9754424829286763, "num_steps": 1442, "peak_vram_mb": 66795.4, "return_code": 0, "status": "valid", "timed_out": false, "train_sha256": "03469da48f6f3febb2771df0b22276faf196afaa23cdcd38c5ceeb13edd2ab25", "training_seconds": 300.2, "wall_seconds": 566.8199167046696}], "metric": 0.9754424829286763, "parent_id": "t0037", "patch_path": "/data3/zhubaiyu/fengheguai/campaigns/h200-claude/artifacts/t0042/change.patch", "patch_sha256": "fa6b06032a7f0b9216c699774fb8ac2a03feafdf42eb2c5ed0fdf870447cfd14", "promoted": false, "proposal": {"change_summary": "Kernel-level mechanism added to champion t0037: a module-level ATTN_SOFTCAP constant of 10.0 passed to the softcap argument of both fa3 call sites, the dense flash_attn_func path and the document-masked flash_attn_varlen_func path that the champion actually uses. The cap is applied inside the kernel, so it costs no extra memory traffic and no separate elementwise pass. Everything else matches the champion: output softcap 10, value-embedding gate 128 channels, rotary base 30000, depth 12, width 512, document masking, dense value embeddings, batch 2**18, all learning rates, WEIGHT_DECAY 0.2 and every schedule.", "command": ["/usr/bin/python3", "/data3/zhubaiyu/fengheguai/fengheguai/rendezvous_agent.py", "--trial", "/data3/zhubaiyu/fengheguai/campaigns/h200-claude/nodes/t0042", "--result", "/data3/zhubaiyu/fengheguai/campaigns/h200-claude/nodes/t0042/.fengheguai-agent-result.json", "--schema", "/data3/zhubaiyu/fengheguai/campaigns/h200-claude/control/agent_output.schema.json", "--campaign", "/data3/zhubaiyu/fengheguai/campaigns/h200-claude", "--inbox", "/data3/zhubaiyu/fengheguai/campaigns/h200-claude-rendezvous"], "errors": [], "expected_val_bpb_effect": "Expected between a 0.002 decrease and a 0.002 increase versus champion t0037 at 0.972704, with step count unchanged since the cap is fused into the existing kernel. The upside case is that tempering the sharpest attention logits does for attention what the output cap does for the unembedding, damping gradients through the most confident routes. The downside case is real and specific: the sharpest attention matches are the informative ones, so capping them may blunt exactly the retrieval this model depends on, and with a 512-token window and document masking those matches are already scarce.", "hypothesis": "The two elite lines jointly say the optimizer is finished as a source of gains: t0041 moved the last untouched optimizer control, the NorMuon variance horizon, and landed at 0.972811 against the champion 0.972704, a difference below the 0.00013 repeat noise. What remains unexploited is a kernel mechanism the recipe never enables. The single inherited default that proved suboptimal in this entire campaign was the output softcap, where tightening from 15 to 10 gained 0.000393 and both 7 and 30 cost more than 0.004, and its mechanism is bounding logits before a softmax. Attention applies a softmax too, and flash-attention-3 exposes exactly the same control through its softcap argument, which this recipe leaves at the default 0.0, meaning off. Because q and k are RMS-normalised per head, attention logits are bounded near 11.3 at perfect alignment while typical values sit near 1, so a cap of 10 binds only on the sharpest matches and should temper over-confident attention without touching the bulk of the distribution.", "log_path": "/data3/zhubaiyu/fengheguai/campaigns/h200-claude/artifacts/t0042/agent.log", "return_code": 0, "risk": "The value 10 is chosen to bind only on the extreme tail, which makes a null the most likely single outcome and would leave the mechanism untested rather than refuted; a decisive test would need a tighter cap that binds on typical logits. There is also an interaction with QK normalisation, which already bounds these logits, so this may be capping a quantity that is effectively self-limiting, in which case the correct conclusion is that the recipe already has the mechanism in a different form rather than that softcapping attention does not work.", "success": true, "timed_out": false}, "secondary_parent_id": "t0041", "selection_reason": "Recombine two independently strong branches at the scheduled synthesis step.", "source_sha256": "03469da48f6f3febb2771df0b22276faf196afaa23cdcd38c5ceeb13edd2ab25", "stage": "recombine", "status": "discard", "training_seconds": 300.2, "trial_id": "t0042", "workspace": "/data3/zhubaiyu/fengheguai/campaigns/h200-claude/nodes/t0042"}, "prev_hash": "2248579b3f6a346b01c8f764a2f31dd9a35ae86eeda9e4b208e05ac39f53aa8a", "seq": 86, "timestamp": "2026-08-20T19:35:13.281290+00:00"}
{"hash": "c9b13f4a27f924349948f9ff237f34f242283aa14e833c7273313c5f26b69ba9", "kind": "trial_started", "payload": {"parent_id": "t0037", "reason": "The current line is stalled; make a structurally different bet.", "secondary_parent_id": null, "stage": "explore", "trial_id": "t0043"}, "prev_hash": "1034f65425e5910d03ba67e89ac97060508337184621b6c80306ede3aa7a6ac5", "seq": 87, "timestamp": "2026-08-20T19:35:13.306342+00:00"}
{"hash": "85eb7ba3dcc0a1401c94bfc955260d8ca2817dab5c47c3453f00d9c6c16e0721", "kind": "trial_completed", "payload": {"champion_before": "t0037", "debug_depth": 0, "delta_vs_champion_before": 0.00043866798531755347, "delta_vs_parent": 0.00043866798531755347, "finding": "t0043 did not improve the prior champion: val_bpb=0.973143, delta=+0.000439. Hypothesis: t0042 produced a sharper result than intended and it inverts into a testable prediction. Capping attention logits at 10 cost 0.002738, roughly twenty-one times the repeat noise, even though QK normalisation bounds those logits near 11.3 at perfect alignment so the cap could only bind on the most aligned query-key pairs. The only way so few affected pairs can cost that much is if the sharpest attention matches carry a disproportionate share of the useful signal. If attention sharpness is that valuable, the recipe may be under-sharpening: the kernel uses the conventional 1/sqrt(head_dim) temperature, which is calibrated for unnormalised q and k, whereas this model RMS-normalises both per head and therefore has a tightly bounded logit range that never approaches saturation. Raising the temperature multiplier to 1.5 widens the effective logit range from about 11.3 to 17 and should produce sharper retrieval and a lower val_bpb.", "measurements": [{"command": ["/data/home/zhubaiyu/.local/bin/uv", "run", "--project", "/data3/zhubaiyu/fengheguai/campaigns/h200-claude/nodes/t0043", "python", "/data3/zhubaiyu/fengheguai/fengheguai/_audit_runner.py", "--target", "/data3/zhubaiyu/fengheguai/campaigns/h200-claude/nodes/t0043", "--nonce", "bc2c5ba3b4caf834777baca96b649b313cfd7b8600a9ba9d"], "errors": [], "evidence_path": "/data3/zhubaiyu/fengheguai/campaigns/h200-claude/evidence/t0043-r0/evidence.json", "evidence_sha256": "556e400174d81e3b7680df76002f752d2582c71485a069bc8a776f569427186a", "log_path": "/data3/zhubaiyu/fengheguai/campaigns/h200-claude/evidence/t0043-r0/run.log", "log_sha256": "0985ca22e58a98cc004e9ef09897991b8d5311d5fd646960c9a63d74722729f8", "metric": 0.9731431463573648, "num_steps": 1464, "peak_vram_mb": 66795.4, "return_code": 0, "status": "valid", "timed_out": false, "train_sha256": "bc031e646e562e51fffe19a5e231a26367624797d7f2655ce08a3f47fce3c4b9", "training_seconds": 300.0, "wall_seconds": 567.9521028557792}], "metric": 0.9731431463573648, "parent_id": "t0037", "patch_path": "/data3/zhubaiyu/fengheguai/campaigns/h200-claude/artifacts/t0043/change.patch", "patch_sha256": "f34f5c51c2694d8639b2b8bc09273a383819aac4d1002d77887db0a7171fcc48", "promoted": false, "proposal": {"change_summary": "Kernel-argument change on champion t0037: a module-level ATTN_SCALE constant of 1.5 multiplying the softmax_scale passed to both fa3 call sites, so the attention temperature becomes 1.5/sqrt(head_dim) instead of the implicit 1/sqrt(head_dim). The attention softcap from t0042 is not carried forward, since it regressed. Everything else matches the champion: output softcap 10, value-embedding gate 128 channels, rotary base 30000, depth 12, width 512, document masking, dense value embeddings, the 512-token short window, batch 2**18, all learning rates, WEIGHT_DECAY 0.2 and every schedule.", "command": ["/usr/bin/python3", "/data3/zhubaiyu/fengheguai/fengheguai/rendezvous_agent.py", "--trial", "/data3/zhubaiyu/fengheguai/campaigns/h200-claude/nodes/t0043", "--result", "/data3/zhubaiyu/fengheguai/campaigns/h200-claude/nodes/t0043/.fengheguai-agent-result.json", "--schema", "/data3/zhubaiyu/fengheguai/campaigns/h200-claude/control/agent_output.schema.json", "--campaign", "/data3/zhubaiyu/fengheguai/campaigns/h200-claude", "--inbox", "/data3/zhubaiyu/fengheguai/campaigns/h200-claude-rendezvous"], "errors": [], "expected_val_bpb_effect": "Expected between a 0.002 decrease and a 0.002 increase versus champion t0037 at 0.972704, with step count unchanged since softmax_scale is a kernel argument rather than extra work. A decrease confirms that the conventional temperature is miscalibrated for QK-normalised attention and would justify testing 2.0 next; an increase means the current temperature is already at the sharpness the model wants, and taken together with t0042 would locate the optimum in a narrow band around the default rather than merely above it.", "hypothesis": "t0042 produced a sharper result than intended and it inverts into a testable prediction. Capping attention logits at 10 cost 0.002738, roughly twenty-one times the repeat noise, even though QK normalisation bounds those logits near 11.3 at perfect alignment so the cap could only bind on the most aligned query-key pairs. The only way so few affected pairs can cost that much is if the sharpest attention matches carry a disproportionate share of the useful signal. If attention sharpness is that valuable, the recipe may be under-sharpening: the kernel uses the conventional 1/sqrt(head_dim) temperature, which is calibrated for unnormalised q and k, whereas this model RMS-normalises both per head and therefore has a tightly bounded logit range that never approaches saturation. Raising the temperature multiplier to 1.5 widens the effective logit range from about 11.3 to 17 and should produce sharper retrieval and a lower val_bpb.", "log_path": "/data3/zhubaiyu/fengheguai/campaigns/h200-claude/artifacts/t0043/agent.log", "return_code": 0, "risk": "Sharper attention concentrates gradient on fewer key positions, which can slow learning early when the query and key projections are still poorly formed, and unlike the softcap this change affects every logit rather than only the extreme tail, so the blast radius is larger. The inference from t0042 is also indirect: capping the tail and rescaling every logit are different interventions, and it is possible that what hurt in t0042 was the discontinuity the tanh introduces near saturation rather than the loss of sharpness itself, in which case this node will show no benefit and the correct reading is that the tail matters for a reason unrelated to temperature.", "success": true, "timed_out": false}, "secondary_parent_id": null, "selection_reason": "The current line is stalled; make a structurally different bet.", "source_sha256": "bc031e646e562e51fffe19a5e231a26367624797d7f2655ce08a3f47fce3c4b9", "stage": "explore", "status": "discard", "training_seconds": 300.0, "trial_id": "t0043", "workspace": "/data3/zhubaiyu/fengheguai/campaigns/h200-claude/nodes/t0043"}, "prev_hash": "c9b13f4a27f924349948f9ff237f34f242283aa14e833c7273313c5f26b69ba9", "seq": 88, "timestamp": "2026-08-20T19:45:51.765605+00:00"}
{"hash": "b6d282f66bb4588ee18b6cb3f133cb83087264e0d6515674139ad10703007f83", "kind": "trial_started", "payload": {"parent_id": "t0037", "reason": "The current line is stalled; make a structurally different bet.", "secondary_parent_id": null, "stage": "explore", "trial_id": "t0044"}, "prev_hash": "85eb7ba3dcc0a1401c94bfc955260d8ca2817dab5c47c3453f00d9c6c16e0721", "seq": 89, "timestamp": "2026-08-20T19:45:51.791136+00:00"}
{"hash": "2133f37e6bbbaa53cdafabb96bd18322c2fd99067ea2f46acf53237d1c114f42", "kind": "trial_completed", "payload": {"champion_before": "t0037", "debug_depth": 0, "delta_vs_champion_before": null, "delta_vs_parent": null, "finding": "t0044 ended as failed. Hypothesis: The attention temperature is a single global constant, but the evidence says the right value is neither uniform nor far from the default. t0042 capped the logit tail and cost 0.002738; t0043 rescaled every logit by 1.5 and cost only 0.000439. Those two results together say the model tolerates a temperature change an order of magnitude better than it tolerates tanh distortion, so the tail matters for its shape rather than its scale, and a global rescale is simply the wrong instrument. What has never been available is per-head control: with QK normalisation fixing the norms of q and k, the only way any individual head can set its own sharpness is through the shared 1/sqrt(head_dim) constant, so all 48 heads across 12 layers are forced to the same temperature. Adding a learned scale per head on q and on k, initialised at 1.0 so the model starts exactly at the champion, lets each head choose its own sharpness and should lower val_bpb.. Evidence: expected one nonce-bound locked evaluation, found 0; training process exited with code 1; training_seconds is missing from output", "measurements": [{"command": ["/data/home/zhubaiyu/.local/bin/uv", "run", "--project", "/data3/zhubaiyu/fengheguai/campaigns/h200-claude/nodes/t0044", "python", "/data3/zhubaiyu/fengheguai/fengheguai/_audit_runner.py", "--target", "/data3/zhubaiyu/fengheguai/campaigns/h200-claude/nodes/t0044", "--nonce", "237446f1372513e6e08d1aec70a6a193b7e54e9f60a77c98"], "errors": ["expected one nonce-bound locked evaluation, found 0", "training process exited with code 1", "training_seconds is missing from output"], "evidence_path": "/data3/zhubaiyu/fengheguai/campaigns/h200-claude/evidence/t0044-r0/evidence.json", "evidence_sha256": "4826dc0f8c852d85edc556bc5eb6a26ef5d85a4d8870cc2ed5f70334c9d4315b", "log_path": "/data3/zhubaiyu/fengheguai/campaigns/h200-claude/evidence/t0044-r0/run.log", "log_sha256": "1a47bf694ccd43a85af89933dfd8c5d7d83e5a0652390f1f6d593a1b2918aaac", "metric": null, "num_steps": null, "peak_vram_mb": null, "return_code": 1, "status": "failed", "timed_out": false, "train_sha256": "6a35f7882372f3ed5f0ca58a1bff42f36ee38b6d217f398960f1f82655711710", "training_seconds": null, "wall_seconds": 169.312549139373}], "metric": null, "parent_id": "t0037", "patch_path": "/data3/zhubaiyu/fengheguai/campaigns/h200-claude/artifacts/t0044/change.patch", "patch_sha256": "9a041f32c343573f60b030e7edb4d1a960176ce56bae15c3d04d59a0bc680f1b", "promoted": false, "proposal": {"change_summary": "Architectural change on champion t0037: each attention module gains q_scale of shape n_head and k_scale of shape n_kv_head, both initialised to 1.0 and applied immediately after the existing RMS normalisation of q and k. They are registered as their own AdamW group at scalar_lr times 0.01, the conservative rate this recipe uses for resid_lambdas, and are explicitly excluded from matrix_params so the Muon path never receives a 1-D tensor. The parameter-count assertion is updated. This adds 96 scalars across the model. Output softcap 10, value-embedding gate 128, rotary base 30000, depth 12, width 512, document masking, dense value embeddings, batch 2**18, all learning rates and every schedule are unchanged, and neither the t0042 softcap nor the t0043 global rescale is carried forward.", "command": ["/usr/bin/python3", "/data3/zhubaiyu/fengheguai/fengheguai/rendezvous_agent.py", "--trial", "/data3/zhubaiyu/fengheguai/campaigns/h200-claude/nodes/t0044", "--result", "/data3/zhubaiyu/fengheguai/campaigns/h200-claude/nodes/t0044/.fengheguai-agent-result.json", "--schema", "/data3/zhubaiyu/fengheguai/campaigns/h200-claude/control/agent_output.schema.json", "--campaign", "/data3/zhubaiyu/fengheguai/campaigns/h200-claude", "--inbox", "/data3/zhubaiyu/fengheguai/campaigns/h200-claude-rendezvous"], "errors": [], "expected_val_bpb_effect": "Expected between a 0.002 decrease and parity versus champion t0037 at 0.972704, with step count essentially unchanged since this adds two broadcast multiplies per attention call. Initialising at 1.0 makes the model mathematically identical to the champion at step 0, so the mechanism has a floor near parity and can only depart from it if the optimizer finds per-head temperatures useful.", "hypothesis": "The attention temperature is a single global constant, but the evidence says the right value is neither uniform nor far from the default. t0042 capped the logit tail and cost 0.002738; t0043 rescaled every logit by 1.5 and cost only 0.000439. Those two results together say the model tolerates a temperature change an order of magnitude better than it tolerates tanh distortion, so the tail matters for its shape rather than its scale, and a global rescale is simply the wrong instrument. What has never been available is per-head control: with QK normalisation fixing the norms of q and k, the only way any individual head can set its own sharpness is through the shared 1/sqrt(head_dim) constant, so all 48 heads across 12 layers are forced to the same temperature. Adding a learned scale per head on q and on k, initialised at 1.0 so the model starts exactly at the champion, lets each head choose its own sharpness and should lower val_bpb.", "log_path": "/data3/zhubaiyu/fengheguai/campaigns/h200-claude/artifacts/t0044/agent.log", "return_code": 0, "risk": "The t0024 failure is the direct precedent and its lesson is applied here: a newly added scalar must be given a rate matched to its initialisation, and giving a zero-initialised parameter the aggressive 0.5 rate cost 0.009150 there. These scales start at 1.0, which is the resid_lambdas situation exactly, so they take the 0.005 rate rather than 0.5. The remaining risk is that per-head temperature is redundant with what c_q and c_k can already express, since scaling a head of q is equivalent to scaling that head slice of the query projection, and the normalisation between them is the only reason it is not exactly redundant; if that reasoning is too subtle the result will be a null at parity.", "success": true, "timed_out": false}, "secondary_parent_id": null, "selection_reason": "The current line is stalled; make a structurally different bet.", "source_sha256": "6a35f7882372f3ed5f0ca58a1bff42f36ee38b6d217f398960f1f82655711710", "stage": "explore", "status": "failed", "training_seconds": null, "trial_id": "t0044", "workspace": "/data3/zhubaiyu/fengheguai/campaigns/h200-claude/nodes/t0044"}, "prev_hash": "b6d282f66bb4588ee18b6cb3f133cb83087264e0d6515674139ad10703007f83", "seq": 90, "timestamp": "2026-08-20T19:49:49.628967+00:00"}
{"hash": "aed1363c19401f5eca473747bdcb05915b640568e5fc6e6bdf50a80e8e896be4", "kind": "trial_started", "payload": {"parent_id": "t0044", "reason": "Repair the most recent executable failure before abandoning its hypothesis.", "secondary_parent_id": null, "stage": "debug", "trial_id": "t0045"}, "prev_hash": "2133f37e6bbbaa53cdafabb96bd18322c2fd99067ea2f46acf53237d1c114f42", "seq": 91, "timestamp": "2026-08-20T19:49:49.654565+00:00"}
