{"hash": "16d8d0e0813ea4bfae6b0f36ca3f3431947b52c90260f905ef6153bb2b982acb", "kind": "trial_completed", "payload": {"champion_before": "t0096", "debug_depth": 1, "delta_vs_champion_before": 0.0003597138927242671, "delta_vs_parent": null, "finding": "t0107 did not improve the prior champion: val_bpb=0.967646, delta=+0.000360. Hypothesis: Unchanged from t0106: with document masking confining attention inside documents, the four full-context layers exploit the enclosing document rather than the full row, so halving the training context to 1024 should free about 8 percent of per-token FLOPs and convert them into optimizer steps while evaluation continues at MAX_SEQ_LEN. t0106 did not test this. It aborted before training on the assertion that TOTAL_BATCH_SIZE divides tokens_per_fwdbwd, because that quantity is computed as DEVICE_BATCH_SIZE times MAX_SEQ_LEN rather than the training length; doubling the device batch to 128 therefore produced 262144 tokens per forward-backward against a total batch of 131072. I changed the model config and the dataloader but missed the third place the sequence length is used.", "measurements": [{"command": ["/data/home/zhubaiyu/.local/bin/uv", "run", "--project", "/data3/zhubaiyu/fengheguai/campaigns/h200-claude/nodes/t0107", "python", "/data3/zhubaiyu/fengheguai/fengheguai/_audit_runner.py", "--target", "/data3/zhubaiyu/fengheguai/campaigns/h200-claude/nodes/t0107", "--nonce", "8888adb96517723227fc37589a313da0527f33ba6a8b95bb"], "errors": [], "evidence_path": "/data3/zhubaiyu/fengheguai/campaigns/h200-claude/evidence/t0107-r0/evidence.json", "evidence_sha256": "737196e900ce2e8b97d310d538ad99a8da4173c068bd1e0630e1660a52e84414", "log_path": "/data3/zhubaiyu/fengheguai/campaigns/h200-claude/evidence/t0107-r0/run.log", "log_sha256": "0dc099584ed706d7fe08609cf696813d06b8bfa89aa4cc52835ec6b7e213c682", "metric": 0.9676456284405712, "num_steps": 2925, "peak_vram_mb": 34166.6, "return_code": 0, "status": "valid", "timed_out": false, "train_sha256": "c82e9e652e2b2e3582c972c2d725d4a1c662886aef3bf80c28ff3e9f3ba9664d", "training_seconds": 300.0, "wall_seconds": 567.7583928164095}], "metric": 0.9676456284405712, "parent_id": "t0106", "patch_path": "/data3/zhubaiyu/fengheguai/campaigns/h200-claude/artifacts/t0107/change.patch", "patch_sha256": "15276bbde4e26dbed4cd3fc9567bda4731e32be20d085371576e5d83d89fd3ca", "promoted": false, "proposal": {"change_summary": "Debug repair of t0106 with the hypothesis intact. Two remaining uses of MAX_SEQ_LEN in the training path now use TRAIN_SEQ_LEN: tokens_per_fwdbwd, which restores 128 times 1024 equals exactly 131072 tokens per forward-backward and gradient accumulation of 1; and the max_seqlen argument passed to build_varlen, which should describe the rows actually being processed rather than a longer hint. I audited every occurrence of MAX_SEQ_LEN in the file before editing rather than after: the only remaining use is the import itself, which prepare.evaluate_bpb relies on to build its own loader at the full 2048, so evaluation is untouched and still scores exactly 80 batches over the same 20,971,520 validation tokens. TRAIN_SEQ_LEN stays 1024, DEVICE_BATCH_SIZE stays 128, and everything else matches champion t0096.", "command": ["/usr/bin/python3", "/data3/zhubaiyu/fengheguai/fengheguai/rendezvous_agent.py", "--trial", "/data3/zhubaiyu/fengheguai/campaigns/h200-claude/nodes/t0107", "--result", "/data3/zhubaiyu/fengheguai/campaigns/h200-claude/nodes/t0107/.fengheguai-agent-result.json", "--schema", "/data3/zhubaiyu/fengheguai/campaigns/h200-claude/control/agent_output.schema.json", "--campaign", "/data3/zhubaiyu/fengheguai/campaigns/h200-claude", "--inbox", "/data3/zhubaiyu/fengheguai/campaigns/h200-claude-rendezvous"], "errors": [], "expected_val_bpb_effect": "Same prediction as t0106: between a 0.002 decrease and a 0.003 increase versus champion t0096 at 0.967286, with the step count rising to roughly 3050 from 2870 as the four full-context layers halve in cost. The repair changes only where the sequence length is read, not what the experiment does.", "hypothesis": "Unchanged from t0106: with document masking confining attention inside documents, the four full-context layers exploit the enclosing document rather than the full row, so halving the training context to 1024 should free about 8 percent of per-token FLOPs and convert them into optimizer steps while evaluation continues at MAX_SEQ_LEN. t0106 did not test this. It aborted before training on the assertion that TOTAL_BATCH_SIZE divides tokens_per_fwdbwd, because that quantity is computed as DEVICE_BATCH_SIZE times MAX_SEQ_LEN rather than the training length; doubling the device batch to 128 therefore produced 262144 tokens per forward-backward against a total batch of 131072. I changed the model config and the dataloader but missed the third place the sequence length is used.", "log_path": "/data3/zhubaiyu/fengheguai/campaigns/h200-claude/artifacts/t0107/agent.log", "return_code": 0, "risk": "The train-evaluate mismatch remains the substantive risk and is unchanged: the model trains on 1024-token rows and is scored on 2048-token rows, so its four global layers are asked at evaluation to span twice anything they saw. Mechanically that is fine, since rotary is precomputed for ten times the configured length and the window sizes cap attention below the input, but a sharp regression would more likely reflect that mismatch than the lost training context, and the locked evaluator does not permit evaluating at 1024 to separate them. This is also my fifth implementation error of the campaign and the fourth caught by an assertion or traceback rather than by a wrong number, which is the failure mode I would rather have.", "success": true, "timed_out": false}, "secondary_parent_id": null, "selection_reason": "Repair the most recent executable failure before abandoning its hypothesis.", "source_sha256": "c82e9e652e2b2e3582c972c2d725d4a1c662886aef3bf80c28ff3e9f3ba9664d", "stage": "debug", "status": "discard", "training_seconds": 300.0, "trial_id": "t0107", "workspace": "/data3/zhubaiyu/fengheguai/campaigns/h200-claude/nodes/t0107"}, "prev_hash": "1f60b5f803ec40216ab9ed87c19a9d9ba32208355ec90a0654158985642b1f8c", "seq": 216, "timestamp": "2026-08-21T07:25:15.854195+00:00"}
{"hash": "4532e3409013a263d1ff3e236e5b26679cdc747ced77ea5beaf11e265c4e4be3", "kind": "trial_started", "payload": {"parent_id": "t0096", "reason": "The current line is stalled; make a structurally different bet.", "secondary_parent_id": null, "stage": "explore", "trial_id": "t0108"}, "prev_hash": "16d8d0e0813ea4bfae6b0f36ca3f3431947b52c90260f905ef6153bb2b982acb", "seq": 217, "timestamp": "2026-08-21T07:25:15.914224+00:00"}
{"hash": "6525183e660f825fb2d97556476d03a681e21f9e6cd1d62e955299bdeb253ed3", "kind": "trial_completed", "payload": {"champion_before": "t0096", "debug_depth": 0, "delta_vs_champion_before": 0.004301936157650621, "delta_vs_parent": 0.004301936157650621, "finding": "t0108 did not improve the prior champion: val_bpb=0.971588, delta=+0.004302. Hypothesis: The residual carry scalars are the last untested initialisation in the model. GPT.forward computes x as resid_lambdas[i] times x plus x0_lambdas[i] times x0 at every layer, so resid_lambdas sets how much of the accumulated stream each block inherits, and it is initialised to exactly 1.0, the identity. That value is correct by construction rather than by measurement, and it was chosen for a depth-8 model; the champion runs depth 12, so the stream now passes through half again as many blocks before reaching the head. This is the same class of quantity as the weight decay corrected in t0065 and the embedding skip examined in t0072: a per-layer setting whose cumulative effect changed when depth did. Damping the carry slightly to 0.95 compounds to about 0.54 across twelve layers, which is a material change to how much early-layer signal survives to the output.", "measurements": [{"command": ["/data/home/zhubaiyu/.local/bin/uv", "run", "--project", "/data3/zhubaiyu/fengheguai/campaigns/h200-claude/nodes/t0108", "python", "/data3/zhubaiyu/fengheguai/fengheguai/_audit_runner.py", "--target", "/data3/zhubaiyu/fengheguai/campaigns/h200-claude/nodes/t0108", "--nonce", "6122e09fc1696a6d19df43d4caeda79c61fc82c3dcb72175"], "errors": [], "evidence_path": "/data3/zhubaiyu/fengheguai/campaigns/h200-claude/evidence/t0108-r0/evidence.json", "evidence_sha256": "f0850982f2401f3babf1abcb22bdeb24e71a7db02768dc5de1b0e1e744c49e1a", "log_path": "/data3/zhubaiyu/fengheguai/campaigns/h200-claude/evidence/t0108-r0/run.log", "log_sha256": "e1c7d3c624e419cf9503c6220ce1d539f4d92cb816092ddb7b31d8ec73673ad1", "metric": 0.9715878507054976, "num_steps": 2861, "peak_vram_mb": 34168.4, "return_code": 0, "status": "valid", "timed_out": false, "train_sha256": "92a2dca95832ccfb5e533b627e42c3b6b65bb98572dc1f67d0bd24c769f45b89", "training_seconds": 300.1, "wall_seconds": 486.71031789761037}], "metric": 0.9715878507054976, "parent_id": "t0096", "patch_path": "/data3/zhubaiyu/fengheguai/campaigns/h200-claude/artifacts/t0108/change.patch", "patch_sha256": "cd455659f619ae9df223dc810cbd783de8b9ff78d0290c98a4f08ad53c9d8a96", "promoted": false, "proposal": {"change_summary": "One initialisation changed on champion t0096: resid_lambdas filled with 0.95 instead of 1.0 in init_weights, which is what actually sets the values since the model is built on the meta device and materialised by to_empty. x0_lambdas stays at 0.1 and SCALAR_LR stays 0.5, so the group still learns at the rate bracketed in t0062 and t0063; resid_lambdas specifically learns at scalar_lr times 0.01, or 0.005, which is slow enough that the initialisation governs a meaningful part of the run. The short training context from t0106 and t0107 is not carried forward, having cost 0.000360 for only 2 percent more steps. Everything else matches the champion.", "command": ["/usr/bin/python3", "/data3/zhubaiyu/fengheguai/fengheguai/rendezvous_agent.py", "--trial", "/data3/zhubaiyu/fengheguai/campaigns/h200-claude/nodes/t0108", "--result", "/data3/zhubaiyu/fengheguai/campaigns/h200-claude/nodes/t0108/.fengheguai-agent-result.json", "--schema", "/data3/zhubaiyu/fengheguai/campaigns/h200-claude/control/agent_output.schema.json", "--campaign", "/data3/zhubaiyu/fengheguai/campaigns/h200-claude", "--inbox", "/data3/zhubaiyu/fengheguai/campaigns/h200-claude-rendezvous"], "errors": [], "expected_val_bpb_effect": "Expected between a 0.0005 decrease and a 0.001 increase versus champion t0096 at 0.967286, with step count unchanged. The honest prior is a regression: 1.0 is the identity and the zero-initialised output projections mean nothing accumulates at step zero anyway, so the argument from depth is weaker here than it was for weight decay, where the cumulative quantity was directly computable. This is the last unmeasured initialisation rather than a promising one.", "hypothesis": "The residual carry scalars are the last untested initialisation in the model. GPT.forward computes x as resid_lambdas[i] times x plus x0_lambdas[i] times x0 at every layer, so resid_lambdas sets how much of the accumulated stream each block inherits, and it is initialised to exactly 1.0, the identity. That value is correct by construction rather than by measurement, and it was chosen for a depth-8 model; the champion runs depth 12, so the stream now passes through half again as many blocks before reaching the head. This is the same class of quantity as the weight decay corrected in t0065 and the embedding skip examined in t0072: a per-layer setting whose cumulative effect changed when depth did. Damping the carry slightly to 0.95 compounds to about 0.54 across twelve layers, which is a material change to how much early-layer signal survives to the output.", "log_path": "/data3/zhubaiyu/fengheguai/campaigns/h200-claude/artifacts/t0108/agent.log", "return_code": 0, "risk": "resid_lambdas learns at 0.005, so over 2870 steps it can travel far from any initialisation, which is exactly why t0072 measured a null on the x0 skip: fast-learning scalars forget their starting point. This group is a hundred times slower than that one, which is the only reason to expect the initialisation to matter at all, and if it measures null the correct reading is that the campaign has exhausted the initialisation family rather than that this particular value is right.", "success": true, "timed_out": false}, "secondary_parent_id": null, "selection_reason": "The current line is stalled; make a structurally different bet.", "source_sha256": "92a2dca95832ccfb5e533b627e42c3b6b65bb98572dc1f67d0bd24c769f45b89", "stage": "explore", "status": "discard", "training_seconds": 300.1, "trial_id": "t0108", "workspace": "/data3/zhubaiyu/fengheguai/campaigns/h200-claude/nodes/t0108"}, "prev_hash": "4532e3409013a263d1ff3e236e5b26679cdc747ced77ea5beaf11e265c4e4be3", "seq": 218, "timestamp": "2026-08-21T07:34:27.129645+00:00"}
{"hash": "afff2008968b4bdc4d0eff64f56df97659242ec92662b5a5aa4d1d0b22e01b44", "kind": "trial_started", "payload": {"parent_id": "t0096", "reason": "The current line is stalled; make a structurally different bet.", "secondary_parent_id": null, "stage": "explore", "trial_id": "t0109"}, "prev_hash": "6525183e660f825fb2d97556476d03a681e21f9e6cd1d62e955299bdeb253ed3", "seq": 219, "timestamp": "2026-08-21T07:34:27.189829+00:00"}
{"hash": "ace45bbca8a8d0a3cfb8a2fdcd583b345cc89e3bb24e0976d45541142531e3a8", "kind": "trial_completed", "payload": {"champion_before": "t0096", "debug_depth": 0, "delta_vs_champion_before": 0.0006368374196626947, "delta_vs_parent": 0.0006368374196626947, "finding": "t0109 did not improve the prior champion: val_bpb=0.967923, delta=+0.000637. Hypothesis: Decoupling the value embeddings changed what EMBEDDING_LR governs, and its value has not been re-measured since. Until t0089 that constant drove one AdamW group containing both transformer.wte and the twelve value-embedding tables, roughly 58M parameters, and 0.6 was confirmed optimal for that combination twice, at batch 2**18 in t0012 and again at 2**17 in t0053. t0089 then gave the value embeddings their own rate and measured their preference at 0.3, bracketed by t0090 at 0.15 and by the old shared 0.6. That is the inference: if the blended optimum over both groups was 0.6 while the larger of the two prefers 0.3, then wte alone must prefer something above 0.6, otherwise the blend could not have landed there. wte is now only 4.2M parameters and is normalised immediately in forward, so its rate is not constrained by the value stream any more. Raising it to 0.9 tests the inference.", "measurements": [{"command": ["/data/home/zhubaiyu/.local/bin/uv", "run", "--project", "/data3/zhubaiyu/fengheguai/campaigns/h200-claude/nodes/t0109", "python", "/data3/zhubaiyu/fengheguai/fengheguai/_audit_runner.py", "--target", "/data3/zhubaiyu/fengheguai/campaigns/h200-claude/nodes/t0109", "--nonce", "7523b1e4766aa0e4b15272377e5227c2d15df2fe93699a10"], "errors": [], "evidence_path": "/data3/zhubaiyu/fengheguai/campaigns/h200-claude/evidence/t0109-r0/evidence.json", "evidence_sha256": "1645ae8598be64b70b119758cff9d3b1963c0cb2c551ff46973b07c6e0342dce", "log_path": "/data3/zhubaiyu/fengheguai/campaigns/h200-claude/evidence/t0109-r0/run.log", "log_sha256": "c142300d7bcb71f516a47720836d4e6451757561e9f56220ca9681436455d9fc", "metric": 0.9679227519675097, "num_steps": 2863, "peak_vram_mb": 34168.4, "return_code": 0, "status": "valid", "timed_out": false, "train_sha256": "283c9a633dd68adc3262c87c30fa4fd09c7e76776524634aac457c53d80e4d1e", "training_seconds": 300.1, "wall_seconds": 486.1116515537724}], "metric": 0.9679227519675097, "parent_id": "t0096", "patch_path": "/data3/zhubaiyu/fengheguai/campaigns/h200-claude/artifacts/t0109/change.patch", "patch_sha256": "0a0f502265064d62301fa3ee1c2493a97337e7caee86a4a1a6cc0c1125164320", "promoted": false, "proposal": {"change_summary": "One learning rate changed on champion t0096: EMBEDDING_LR from 0.6 to 0.9, which after the t0089 decoupling affects only the transformer.wte group. VALUE_EMBEDDING_LR stays at its bracketed 0.3, UNEMBEDDING_LR stays 0.002 and MATRIX_LR stays 0.0163. The damped residual carry from t0108 is not carried forward, having cost 0.004302. Everything else matches the champion: the endpoint EMA at decay 0.99, the linear anneal, the corrected value-embedding init, depth 12, the SSL pattern with a 256-token short span, document masking, output softcap 13, batch 2**17 and WEIGHT_DECAY 0.146.", "command": ["/usr/bin/python3", "/data3/zhubaiyu/fengheguai/fengheguai/rendezvous_agent.py", "--trial", "/data3/zhubaiyu/fengheguai/campaigns/h200-claude/nodes/t0109", "--result", "/data3/zhubaiyu/fengheguai/campaigns/h200-claude/nodes/t0109/.fengheguai-agent-result.json", "--schema", "/data3/zhubaiyu/fengheguai/campaigns/h200-claude/control/agent_output.schema.json", "--campaign", "/data3/zhubaiyu/fengheguai/campaigns/h200-claude", "--inbox", "/data3/zhubaiyu/fengheguai/campaigns/h200-claude-rendezvous"], "errors": [], "expected_val_bpb_effect": "Expected between a 0.001 decrease and a 0.001 increase versus champion t0096 at 0.967286, with step count unchanged. The inference is arithmetic rather than speculative, since a blended optimum bounds the components, but it assumes the blend was near-linear in the two preferences and that both groups were individually near their own optima at 0.6, neither of which is guaranteed for a single shared coefficient.", "hypothesis": "Decoupling the value embeddings changed what EMBEDDING_LR governs, and its value has not been re-measured since. Until t0089 that constant drove one AdamW group containing both transformer.wte and the twelve value-embedding tables, roughly 58M parameters, and 0.6 was confirmed optimal for that combination twice, at batch 2**18 in t0012 and again at 2**17 in t0053. t0089 then gave the value embeddings their own rate and measured their preference at 0.3, bracketed by t0090 at 0.15 and by the old shared 0.6. That is the inference: if the blended optimum over both groups was 0.6 while the larger of the two prefers 0.3, then wte alone must prefer something above 0.6, otherwise the blend could not have landed there. wte is now only 4.2M parameters and is normalised immediately in forward, so its rate is not constrained by the value stream any more. Raising it to 0.9 tests the inference.", "log_path": "/data3/zhubaiyu/fengheguai/campaigns/h200-claude/artifacts/t0109/agent.log", "return_code": 0, "risk": "t0014 already raised the shared rate to 0.8 and lost 0.000613, which is direct evidence against the upward direction, though at that time the shared rate still governed the value embeddings and their preference for something lower is exactly what would have produced that loss. If this regresses, the honest reading is that wte itself prefers 0.6 and the blend was not the constraint, which would close the last learning rate in the model. There is also a specific instability channel: wte is bf16 and is normalised immediately in GPT.forward, so a rate this high changes direction quickly while leaving magnitude irrelevant, and the failure would show as a worse loss rather than a divergence.", "success": true, "timed_out": false}, "secondary_parent_id": null, "selection_reason": "The current line is stalled; make a structurally different bet.", "source_sha256": "283c9a633dd68adc3262c87c30fa4fd09c7e76776524634aac457c53d80e4d1e", "stage": "explore", "status": "discard", "training_seconds": 300.1, "trial_id": "t0109", "workspace": "/data3/zhubaiyu/fengheguai/campaigns/h200-claude/nodes/t0109"}, "prev_hash": "afff2008968b4bdc4d0eff64f56df97659242ec92662b5a5aa4d1d0b22e01b44", "seq": 220, "timestamp": "2026-08-21T07:43:39.761094+00:00"}
{"hash": "07ab2255a13664ff4707784f7b2901a753e6dfc7a6cef689c24386f8f3e51ccf", "kind": "trial_started", "payload": {"parent_id": "t0096", "reason": "The current line is stalled; make a structurally different bet.", "secondary_parent_id": null, "stage": "explore", "trial_id": "t0110"}, "prev_hash": "ace45bbca8a8d0a3cfb8a2fdcd583b345cc89e3bb24e0976d45541142531e3a8", "seq": 221, "timestamp": "2026-08-21T07:43:39.820977+00:00"}
