{"hash": "9496e9720a09fc788394f334855ec88d16724a35ea5519e4f1650d80d1d6cd61", "kind": "trial_completed", "payload": {"champion_before": "t0048", "debug_depth": 0, "delta_vs_champion_before": -0.0007176533118192774, "delta_vs_parent": -0.0007176533118192774, "finding": "t0051 improved the prior champion: val_bpb=0.971944, delta=-0.000718. Hypothesis: Batch size is the only major axis still mapped exclusively at the old operating point, and it produced the largest single gain of this campaign. The map was drawn at depth 8 with about 2100 steps, where 2**17 and 2**18 scored 0.981248 and 0.981147 with matched rates, a flat ridge. The champion now runs depth 12 with 1465 steps, roughly thirty percent fewer optimizer steps for a model with fifty percent more layers, which is exactly the regime where trading batch width for step count should be worth more than it was before. The square-root rate law that t0003, t0005 and t0007 established at a 4x batch range is the correct accompaniment, so this halves the batch and divides all three rates by sqrt(2). If the ridge is still flat the axis closes at the current operating point; if step count is now scarcer than gradient quality, this wins.", "measurements": [{"command": ["/data/home/zhubaiyu/.local/bin/uv", "run", "--project", "/data3/zhubaiyu/fengheguai/campaigns/h200-claude/nodes/t0051", "python", "/data3/zhubaiyu/fengheguai/fengheguai/_audit_runner.py", "--target", "/data3/zhubaiyu/fengheguai/campaigns/h200-claude/nodes/t0051", "--nonce", "9e75df2a3e7240a1c3b5cef3012910bfa683f7668ade344d"], "errors": [], "evidence_path": "/data3/zhubaiyu/fengheguai/campaigns/h200-claude/evidence/t0051-r0/evidence.json", "evidence_sha256": "a590963530f776bab708f0cf661f280e74e57eaa0967d03cf4ac845eb594b0e9", "log_path": "/data3/zhubaiyu/fengheguai/campaigns/h200-claude/evidence/t0051-r0/run.log", "log_sha256": "fcfe626634afcf52eb934c767ca49382ea6f6af353875799fb20d6868f688895", "metric": 0.972007039150296, "num_steps": 2836, "peak_vram_mb": 33800.4, "return_code": 0, "status": "valid", "timed_out": false, "train_sha256": "0b27373b0bdc9a186bd99cb76a4e8745b7d32911417eac5a4c36c2e1a838581c", "training_seconds": 300.1, "wall_seconds": 441.9959365502}, {"command": ["/data/home/zhubaiyu/.local/bin/uv", "run", "--project", "/data3/zhubaiyu/fengheguai/campaigns/h200-claude/nodes/t0051", "python", "/data3/zhubaiyu/fengheguai/fengheguai/_audit_runner.py", "--target", "/data3/zhubaiyu/fengheguai/campaigns/h200-claude/nodes/t0051", "--nonce", "af6f5ccbdad1257357cbd828ad78b930211d47f502ad7838"], "errors": [], "evidence_path": "/data3/zhubaiyu/fengheguai/campaigns/h200-claude/evidence/t0051-r1/evidence.json", "evidence_sha256": "443fcf678fb690f09d9ff92989769cb3474a09fedc8bc3710bbc7eb6b54d84fe", "log_path": "/data3/zhubaiyu/fengheguai/campaigns/h200-claude/evidence/t0051-r1/run.log", "log_sha256": "41a48990f5e70449be925d5c0f1924e7634c8601e54a3d52eb84213a7d72aaee", "metric": 0.9718815576403012, "num_steps": 2841, "peak_vram_mb": 33800.4, "return_code": 0, "status": "valid", "timed_out": false, "train_sha256": "0b27373b0bdc9a186bd99cb76a4e8745b7d32911417eac5a4c36c2e1a838581c", "training_seconds": 300.0, "wall_seconds": 479.446547890082}], "metric": 0.9719442983952986, "parent_id": "t0048", "patch_path": "/data3/zhubaiyu/fengheguai/campaigns/h200-claude/artifacts/t0051/change.patch", "patch_sha256": "ab93eacb8e79f2965641d48da8ee753da3566de7408aad63be345cbadf35fa8c", "promoted": true, "proposal": {"change_summary": "Coordinated move along the established batch-versus-rate scaling line on champion t0048: TOTAL_BATCH_SIZE from 2**18 to 2**17 with DEVICE_BATCH_SIZE from 128 to 64 so gradient accumulation stays at exactly 1, and EMBEDDING_LR 0.6 to 0.4243, UNEMBEDDING_LR 0.002828 to 0.002, MATRIX_LR 0.0231 to 0.0163, each divided by sqrt(2). Depth 12, width 512, document masking, dense value embeddings with the 128-channel gate, output softcap 10, rotary base 30000, WEIGHT_DECAY 0.2 with its original declining schedule, FINAL_LR_FRAC 0.1 and WARMDOWN_RATIO 0.5 are unchanged.", "command": ["/usr/bin/python3", "/data3/zhubaiyu/fengheguai/fengheguai/rendezvous_agent.py", "--trial", "/data3/zhubaiyu/fengheguai/campaigns/h200-claude/nodes/t0051", "--result", "/data3/zhubaiyu/fengheguai/campaigns/h200-claude/nodes/t0051/.fengheguai-agent-result.json", "--schema", "/data3/zhubaiyu/fengheguai/campaigns/h200-claude/control/agent_output.schema.json", "--campaign", "/data3/zhubaiyu/fengheguai/campaigns/h200-claude", "--inbox", "/data3/zhubaiyu/fengheguai/campaigns/h200-claude-rendezvous"], "errors": [], "expected_val_bpb_effect": "Expected between a 0.002 decrease and a 0.002 increase versus champion t0048 at 0.972662, with the step count roughly doubling to about 2900. The ridge was flat to within 0.0001 at depth 8, so a null is the single most likely outcome and would close the axis; the case for spending the node is that the step-to-capacity ratio has moved substantially since that map was drawn, and this is the largest lever in the campaign left unverified at the current configuration.", "hypothesis": "Batch size is the only major axis still mapped exclusively at the old operating point, and it produced the largest single gain of this campaign. The map was drawn at depth 8 with about 2100 steps, where 2**17 and 2**18 scored 0.981248 and 0.981147 with matched rates, a flat ridge. The champion now runs depth 12 with 1465 steps, roughly thirty percent fewer optimizer steps for a model with fifty percent more layers, which is exactly the regime where trading batch width for step count should be worth more than it was before. The square-root rate law that t0003, t0005 and t0007 established at a 4x batch range is the correct accompaniment, so this halves the batch and divides all three rates by sqrt(2). If the ridge is still flat the axis closes at the current operating point; if step count is now scarcer than gradient quality, this wins.", "log_path": "/data3/zhubaiyu/fengheguai/campaigns/h200-claude/artifacts/t0051/agent.log", "return_code": 0, "risk": "This moves four constants at once, which is defensible only because they are one quantity under the scaling law this campaign measured rather than four independent choices, but it does mean a win would not attribute cleanly between batch and rates. There is also a specific tension with later evidence: t0012 showed the embedding group prefers its unscaled 0.6 and t0039 showed the unembedding group is hurt by moving to 0.002 at batch 2**18, so applying a uniform sqrt(2) division contradicts both of those per-group findings, and a regression may reflect that rather than the batch itself. The cleaner follow-up in that case is the same halving with only MATRIX_LR rescaled.", "success": true, "timed_out": false}, "secondary_parent_id": null, "selection_reason": "Exploit a top-K branch selected by quality plus an under-exploration bonus.", "source_sha256": "0b27373b0bdc9a186bd99cb76a4e8745b7d32911417eac5a4c36c2e1a838581c", "stage": "refine", "status": "keep", "training_seconds": 300.05, "trial_id": "t0051", "workspace": "/data3/zhubaiyu/fengheguai/campaigns/h200-claude/nodes/t0051"}, "prev_hash": "f21d9072392a16e263f3d00cee8a6598eebcbfd678aceb8d89ff3c40dd728fd7", "seq": 104, "timestamp": "2026-08-20T21:15:55.336318+00:00"}
{"hash": "4ef6bba4c7ee723883bff5c81ab9154bbae19a23a61fd7adc46c079c55998822", "kind": "trial_started", "payload": {"parent_id": "t0051", "reason": "Spend the configured search share on a distinct architectural or recipe direction.", "secondary_parent_id": null, "stage": "explore", "trial_id": "t0052"}, "prev_hash": "9496e9720a09fc788394f334855ec88d16724a35ea5519e4f1650d80d1d6cd61", "seq": 105, "timestamp": "2026-08-20T21:15:55.365965+00:00"}
{"hash": "02119b141e4c22ababaf5f2005f2494ee208dc4104dbc4dbd69f96a4dc8e17f3", "kind": "trial_completed", "payload": {"champion_before": "t0051", "debug_depth": 0, "delta_vs_champion_before": 0.003944041732710568, "delta_vs_parent": 0.003944041732710568, "finding": "t0052 did not improve the prior champion: val_bpb=0.975888, delta=+0.003944. Hypothesis: The batch axis has genuinely moved with the operating point and is not yet exhausted. At depth 8 with about 2100 steps, halving the batch from 2**18 to 2**17 with matched rates was flat, 0.981248 against 0.981147. At depth 12 with 1465 steps the same halving now gains 0.000718, roughly five times the repeat noise, and takes the step count from 1465 to 2838. The mechanism is that a deeper model with fewer optimizer steps is step-starved rather than gradient-starved, so converting batch width into steps pays where it previously did not. If that reading is right the axis should still have room, since 2838 steps at depth 12 is only slightly more than the 2100 the shallower model had. Halving again to 2**16 with all three rates divided by sqrt(2) once more tests whether the gain continues or whether the critical batch size has now been crossed.", "measurements": [{"command": ["/data/home/zhubaiyu/.local/bin/uv", "run", "--project", "/data3/zhubaiyu/fengheguai/campaigns/h200-claude/nodes/t0052", "python", "/data3/zhubaiyu/fengheguai/fengheguai/_audit_runner.py", "--target", "/data3/zhubaiyu/fengheguai/campaigns/h200-claude/nodes/t0052", "--nonce", "17332063219bc353a21b0fe25f28c0cf20b97ca27d6bd23f"], "errors": [], "evidence_path": "/data3/zhubaiyu/fengheguai/campaigns/h200-claude/evidence/t0052-r0/evidence.json", "evidence_sha256": "b8e6f73cce992db626c7f98c0ee747f7970fe0f1f0250102b9cea75d66c6261e", "log_path": "/data3/zhubaiyu/fengheguai/campaigns/h200-claude/evidence/t0052-r0/run.log", "log_sha256": "50d7f7e845dca2dd3bce91b0d16bf260b40191bffe58e283e2551fc2ea7146f0", "metric": 0.9758883401280092, "num_steps": 5383, "peak_vram_mb": 17302.9, "return_code": 0, "status": "valid", "timed_out": false, "train_sha256": "fff2f9d9bbf544524af198b80f26cbf1162a14b4d1775f1d0f5be5e6ac8e46aa", "training_seconds": 300.0, "wall_seconds": 573.1632850421593}], "metric": 0.9758883401280092, "parent_id": "t0051", "patch_path": "/data3/zhubaiyu/fengheguai/campaigns/h200-claude/artifacts/t0052/change.patch", "patch_sha256": "de5ca09b2294d02d61e73fb8344a2cd12acfcbd94ef23e30f8159e281217ad54", "promoted": false, "proposal": {"change_summary": "A second step along the same scaling line on champion t0051: TOTAL_BATCH_SIZE from 2**17 to 2**16 with DEVICE_BATCH_SIZE from 64 to 32 so gradient accumulation stays at 1, and EMBEDDING_LR 0.4243 to 0.3, UNEMBEDDING_LR 0.002 to 0.001414, MATRIX_LR 0.0163 to 0.0115, each divided by sqrt(2) again. Depth 12, width 512, document masking, dense value embeddings with the 128-channel gate, output softcap 10, rotary base 30000, WEIGHT_DECAY 0.2 with its declining schedule, FINAL_LR_FRAC 0.1 and WARMDOWN_RATIO 0.5 are unchanged.", "command": ["/usr/bin/python3", "/data3/zhubaiyu/fengheguai/fengheguai/rendezvous_agent.py", "--trial", "/data3/zhubaiyu/fengheguai/campaigns/h200-claude/nodes/t0052", "--result", "/data3/zhubaiyu/fengheguai/campaigns/h200-claude/nodes/t0052/.fengheguai-agent-result.json", "--schema", "/data3/zhubaiyu/fengheguai/campaigns/h200-claude/control/agent_output.schema.json", "--campaign", "/data3/zhubaiyu/fengheguai/campaigns/h200-claude", "--inbox", "/data3/zhubaiyu/fengheguai/campaigns/h200-claude-rendezvous"], "errors": [], "expected_val_bpb_effect": "Expected between a 0.001 decrease and a 0.003 increase versus champion t0051 at 0.971944, with the step count rising to roughly 5500. The gain from the previous halving was 0.000718, and returns on this axis should diminish as the batch approaches the critical size, so the honest expectation is a smaller gain or the first regression, either of which brackets the optimum. A 32 by 2048 micro-batch may also use the GPU less efficiently, so the realised step count is worth watching against the predicted 5500.", "hypothesis": "The batch axis has genuinely moved with the operating point and is not yet exhausted. At depth 8 with about 2100 steps, halving the batch from 2**18 to 2**17 with matched rates was flat, 0.981248 against 0.981147. At depth 12 with 1465 steps the same halving now gains 0.000718, roughly five times the repeat noise, and takes the step count from 1465 to 2838. The mechanism is that a deeper model with fewer optimizer steps is step-starved rather than gradient-starved, so converting batch width into steps pays where it previously did not. If that reading is right the axis should still have room, since 2838 steps at depth 12 is only slightly more than the 2100 the shallower model had. Halving again to 2**16 with all three rates divided by sqrt(2) once more tests whether the gain continues or whether the critical batch size has now been crossed.", "log_path": "/data3/zhubaiyu/fengheguai/campaigns/h200-claude/artifacts/t0052/agent.log", "return_code": 0, "risk": "Micro-batches of 32 sequences are small enough that per-step overheads which have been negligible so far, including the per-step device synchronisation from the document-mask BOS scan and the fixed cost of the optimizer pass over 96M parameters, now amortise over half as many tokens, so throughput may fall short of the doubling the FLOP count implies. That would confound a quality verdict with a throughput one, and num_steps is the diagnostic. The rates are also now two sqrt(2) steps from where each group was individually measured, so if this regresses the correct follow-up is to check the rate level at 2**16 before concluding the batch is too small.", "success": true, "timed_out": false}, "secondary_parent_id": null, "selection_reason": "Spend the configured search share on a distinct architectural or recipe direction.", "source_sha256": "fff2f9d9bbf544524af198b80f26cbf1162a14b4d1775f1d0f5be5e6ac8e46aa", "stage": "explore", "status": "discard", "training_seconds": 300.0, "trial_id": "t0052", "workspace": "/data3/zhubaiyu/fengheguai/campaigns/h200-claude/nodes/t0052"}, "prev_hash": "4ef6bba4c7ee723883bff5c81ab9154bbae19a23a61fd7adc46c079c55998822", "seq": 106, "timestamp": "2026-08-20T21:26:29.034909+00:00"}
{"hash": "2671bdabe85b5c4529fb70482cab95a94819cad5e6354ca8522e3cb19318e135", "kind": "trial_started", "payload": {"parent_id": "t0051", "reason": "Exploit a top-K branch selected by quality plus an under-exploration bonus.", "secondary_parent_id": null, "stage": "refine", "trial_id": "t0053"}, "prev_hash": "02119b141e4c22ababaf5f2005f2494ee208dc4104dbc4dbd69f96a4dc8e17f3", "seq": 107, "timestamp": "2026-08-20T21:26:29.065204+00:00"}
{"hash": "71010864ea6a319112bb0c8ec64c40b1f4e5a5b58f39b67f72b85ba4aa040129", "kind": "trial_completed", "payload": {"champion_before": "t0051", "debug_depth": 0, "delta_vs_champion_before": -0.0003139886492231625, "delta_vs_parent": -0.0003139886492231625, "finding": "t0053 improved the prior champion: val_bpb=0.971630, delta=-0.000314. Hypothesis: The winning batch move was a bundle of four constants and one of them has already been shown, at a different batch size, to prefer the opposite treatment. t0051 halved the batch to 2**17 and divided all three rates by sqrt(2), gaining 0.000718. But t0012 established that the embedding group, which drives both wte and all twelve value-embedding tables, prefers its unscaled 0.6 over a sqrt(2)-reduced 0.4243, and that finding was itself the decomposition of an earlier bundle that had lowered it. The same logic applies again: the t0051 gain is most plausibly attributable to the batch change together with the matrix and unembedding rescaling, with the embedding group dragged along rather than helped. Restoring EMBEDDING_LR to 0.6 at the new batch should lower val_bpb further.", "measurements": [{"command": ["/data/home/zhubaiyu/.local/bin/uv", "run", "--project", "/data3/zhubaiyu/fengheguai/campaigns/h200-claude/nodes/t0053", "python", "/data3/zhubaiyu/fengheguai/fengheguai/_audit_runner.py", "--target", "/data3/zhubaiyu/fengheguai/campaigns/h200-claude/nodes/t0053", "--nonce", "9a4d1e4a225fe2a18e414458dad64df1e37460843572c2bc"], "errors": [], "evidence_path": "/data3/zhubaiyu/fengheguai/campaigns/h200-claude/evidence/t0053-r0/evidence.json", "evidence_sha256": "b0b304a4dea20f76e1c3e7d8b5388e18fd8bd11e83f0ba8b33659513636623f7", "log_path": "/data3/zhubaiyu/fengheguai/campaigns/h200-claude/evidence/t0053-r0/run.log", "log_sha256": "42892a9c55edf74628eebfdd546301464ba47adecb583558a9cb5ad5348fa412", "metric": 0.9716509735114564, "num_steps": 2838, "peak_vram_mb": 33800.4, "return_code": 0, "status": "valid", "timed_out": false, "train_sha256": "bf96b29aa5b29a93c206ff91495a1523085e03b2ef2afea76083f0959f2bc62b", "training_seconds": 300.1, "wall_seconds": 484.4462877549231}, {"command": ["/data/home/zhubaiyu/.local/bin/uv", "run", "--project", "/data3/zhubaiyu/fengheguai/campaigns/h200-claude/nodes/t0053", "python", "/data3/zhubaiyu/fengheguai/fengheguai/_audit_runner.py", "--target", "/data3/zhubaiyu/fengheguai/campaigns/h200-claude/nodes/t0053", "--nonce", "7169337d6a8d6463a8ef2477cef35e6f4e50a7c3733bbc8a"], "errors": [], "evidence_path": "/data3/zhubaiyu/fengheguai/campaigns/h200-claude/evidence/t0053-r1/evidence.json", "evidence_sha256": "f924d7c4d197cbcb7209fe2fe48b452876264e38c839316422fbb05f65accd09", "log_path": "/data3/zhubaiyu/fengheguai/campaigns/h200-claude/evidence/t0053-r1/run.log", "log_sha256": "8736d12b90863e6e89c5b07c4e18224ab51ef7ae4df96dad73b8750c83e08112", "metric": 0.9716096459806945, "num_steps": 2837, "peak_vram_mb": 33800.4, "return_code": 0, "status": "valid", "timed_out": false, "train_sha256": "bf96b29aa5b29a93c206ff91495a1523085e03b2ef2afea76083f0959f2bc62b", "training_seconds": 300.0, "wall_seconds": 479.7444488098845}], "metric": 0.9716303097460754, "parent_id": "t0051", "patch_path": "/data3/zhubaiyu/fengheguai/campaigns/h200-claude/artifacts/t0053/change.patch", "patch_sha256": "e5f9bb1c421ba0dd369bda391dc4585693e7ccb857d16688e383f421a1b5f596", "promoted": true, "proposal": {"change_summary": "One learning rate changed on champion t0051: EMBEDDING_LR from 0.4243 back to 0.6, affecting the AdamW group that holds transformer.wte and all twelve value-embedding tables, roughly 54M parameters and the largest block in the model. UNEMBEDDING_LR stays 0.002 and MATRIX_LR stays 0.0163, both of which keep the sqrt(2) rescale that accompanied the batch halving. TOTAL_BATCH_SIZE stays 2**17 with DEVICE_BATCH_SIZE 64, and depth 12, width 512, document masking, dense value embeddings with the 128-channel gate, output softcap 10, rotary base 30000, WEIGHT_DECAY 0.2, FINAL_LR_FRAC 0.1 and WARMDOWN_RATIO 0.5 are unchanged.", "command": ["/usr/bin/python3", "/data3/zhubaiyu/fengheguai/fengheguai/rendezvous_agent.py", "--trial", "/data3/zhubaiyu/fengheguai/campaigns/h200-claude/nodes/t0053", "--result", "/data3/zhubaiyu/fengheguai/campaigns/h200-claude/nodes/t0053/.fengheguai-agent-result.json", "--schema", "/data3/zhubaiyu/fengheguai/campaigns/h200-claude/control/agent_output.schema.json", "--campaign", "/data3/zhubaiyu/fengheguai/campaigns/h200-claude", "--inbox", "/data3/zhubaiyu/fengheguai/campaigns/h200-claude-rendezvous"], "errors": [], "expected_val_bpb_effect": "Expected between a 0.001 decrease and a 0.001 increase versus champion t0051 at 0.971944, with step count unchanged since no FLOPs move. The precedent is direct: the identical decomposition at batch 2**18 gained 0.000208, small but above the 0.00013 repeat noise. If it wins here the batch-rate law applies only to the matrix and unembedding groups, which would be a cleaner statement of the scaling behaviour than the uniform rule currently in the champion.", "hypothesis": "The winning batch move was a bundle of four constants and one of them has already been shown, at a different batch size, to prefer the opposite treatment. t0051 halved the batch to 2**17 and divided all three rates by sqrt(2), gaining 0.000718. But t0012 established that the embedding group, which drives both wte and all twelve value-embedding tables, prefers its unscaled 0.6 over a sqrt(2)-reduced 0.4243, and that finding was itself the decomposition of an earlier bundle that had lowered it. The same logic applies again: the t0051 gain is most plausibly attributable to the batch change together with the matrix and unembedding rescaling, with the embedding group dragged along rather than helped. Restoring EMBEDDING_LR to 0.6 at the new batch should lower val_bpb further.", "log_path": "/data3/zhubaiyu/fengheguai/campaigns/h200-claude/artifacts/t0053/agent.log", "return_code": 0, "risk": "The t0012 result was measured at batch 2**18 and at depth 8 in terms of how many value-embedding tables the group held, whereas the group is now larger and the batch smaller, so the preference may not transfer; t0014 already showed this same rate does not simply scale with table size, since raising it to 0.8 regressed. A more specific concern is that gradient noise per step is genuinely higher at 2**17, which is the condition under which a reduced rate is theoretically justified, so the two arguments point in opposite directions here in a way they did not at 2**18.", "success": true, "timed_out": false}, "secondary_parent_id": null, "selection_reason": "Exploit a top-K branch selected by quality plus an under-exploration bonus.", "source_sha256": "bf96b29aa5b29a93c206ff91495a1523085e03b2ef2afea76083f0959f2bc62b", "stage": "refine", "status": "keep", "training_seconds": 300.05, "trial_id": "t0053", "workspace": "/data3/zhubaiyu/fengheguai/campaigns/h200-claude/nodes/t0053"}, "prev_hash": "2671bdabe85b5c4529fb70482cab95a94819cad5e6354ca8522e3cb19318e135", "seq": 108, "timestamp": "2026-08-20T21:43:30.009829+00:00"}
