{"hash": "a1393534eeeeb1dde2df90e6f4ec30522eeb9f170f848a342ae34851cfae7980", "kind": "trial_completed", "payload": {"champion_before": "t0065", "debug_depth": 0, "delta_vs_champion_before": -0.00021434816105259102, "delta_vs_parent": -0.00021434816105259102, "finding": "t0069 improved the prior champion: val_bpb=0.971071, delta=-0.000214. Hypothesis: The output softcap is the steepest axis in this campaign and it was bracketed at a batch size the champion no longer uses, and a second result suggests its optimum has since moved. The bracket at batch 2**18 gave 7 costing 0.005206, 10 best, 15 costing 0.000393 and 30 costing 0.004637, and the mechanism that survived both sides was damping of the gradient into lm_head. Independent evidence says lm_head is less sensitive at the current batch: the unembedding learning rate was sharply peaked at 2**18, where moving it 30 percent cost 0.003152, but measured flat at 2**17 in t0054, moving only 0.00006 across the same span. If lm_head is genuinely less binding now, it needs less damping, so the softcap optimum should have moved upward from 10 toward the looser end where 15 sat only 0.000393 away. Testing 13 probes that shift on the gentle side of the curve rather than the steep one.", "measurements": [{"command": ["/data/home/zhubaiyu/.local/bin/uv", "run", "--project", "/data3/zhubaiyu/fengheguai/campaigns/h200-claude/nodes/t0069", "python", "/data3/zhubaiyu/fengheguai/fengheguai/_audit_runner.py", "--target", "/data3/zhubaiyu/fengheguai/campaigns/h200-claude/nodes/t0069", "--nonce", "611660dbb1f02de420dbc00a6f86fd7a45c6b95166d4a061"], "errors": [], "evidence_path": "/data3/zhubaiyu/fengheguai/campaigns/h200-claude/evidence/t0069-r0/evidence.json", "evidence_sha256": "a9960d3eaf75aeef4eecba17b27eaecf0ac500882098a239ad164e36d38b1091", "log_path": "/data3/zhubaiyu/fengheguai/campaigns/h200-claude/evidence/t0069-r0/run.log", "log_sha256": "3b24336562fbd7eb12e677fe6aa0f820cec5993304def2823a2d126a977c38ee", "metric": 0.971025232076407, "num_steps": 2841, "peak_vram_mb": 33800.4, "return_code": 0, "status": "valid", "timed_out": false, "train_sha256": "073e03a4130fe99d347242d3e51248f9106df660ffcd78f5e3fe673be954559c", "training_seconds": 300.0, "wall_seconds": 565.3339603729546}, {"command": ["/data/home/zhubaiyu/.local/bin/uv", "run", "--project", "/data3/zhubaiyu/fengheguai/campaigns/h200-claude/nodes/t0069", "python", "/data3/zhubaiyu/fengheguai/fengheguai/_audit_runner.py", "--target", "/data3/zhubaiyu/fengheguai/campaigns/h200-claude/nodes/t0069", "--nonce", "e4ff7793f07b2d21fab5e3358bd0e75d44d983deff34a4a8"], "errors": [], "evidence_path": "/data3/zhubaiyu/fengheguai/campaigns/h200-claude/evidence/t0069-r1/evidence.json", "evidence_sha256": "096c1e8ff19b761998919f89645d2fcacdd4d4a38cf633a3422e1ac35ec2bf49", "log_path": "/data3/zhubaiyu/fengheguai/campaigns/h200-claude/evidence/t0069-r1/run.log", "log_sha256": "8864100a61c2895b5802c4d54cc84272c92ee6fcce79a20321c24c10df24aeac", "metric": 0.9711169850093274, "num_steps": 2838, "peak_vram_mb": 33800.4, "return_code": 0, "status": "valid", "timed_out": false, "train_sha256": "073e03a4130fe99d347242d3e51248f9106df660ffcd78f5e3fe673be954559c", "training_seconds": 300.0, "wall_seconds": 480.73660805728287}], "metric": 0.9710711085428672, "parent_id": "t0065", "patch_path": "/data3/zhubaiyu/fengheguai/campaigns/h200-claude/artifacts/t0069/change.patch", "patch_sha256": "cb50ec791f77ae3408b1e449a63e4aaac86a0ed8b1dd40b3d68bb75a2028cf82", "promoted": true, "proposal": {"change_summary": "One constant changed on champion t0065: the softcap in GPT.forward from 10 to 13, keeping the softcap*tanh(logits/softcap) form applied after the float32 cast. The value is chosen on the shallow side of the previously measured curve, since the steep side below 10 cost 0.005206 at 7 and is not worth probing blind. Batch 2**17, depth 12, width 512, HEAD_DIM 128, document masking, dense value embeddings with the 128-channel gate, rotary base 30000, EMBEDDING_LR 0.6, UNEMBEDDING_LR 0.002, MATRIX_LR 0.0163, SCALAR_LR 0.5, ADAM_BETAS at their bracketed 0.8 and 0.95, WEIGHT_DECAY 0.146, FINAL_LR_FRAC 0.1 and WARMDOWN_RATIO 0.5 are unchanged.", "command": ["/usr/bin/python3", "/data3/zhubaiyu/fengheguai/fengheguai/rendezvous_agent.py", "--trial", "/data3/zhubaiyu/fengheguai/campaigns/h200-claude/nodes/t0069", "--result", "/data3/zhubaiyu/fengheguai/campaigns/h200-claude/nodes/t0069/.fengheguai-agent-result.json", "--schema", "/data3/zhubaiyu/fengheguai/campaigns/h200-claude/control/agent_output.schema.json", "--campaign", "/data3/zhubaiyu/fengheguai/campaigns/h200-claude", "--inbox", "/data3/zhubaiyu/fengheguai/campaigns/h200-claude-rendezvous"], "errors": [], "expected_val_bpb_effect": "Expected between a 0.0005 decrease and a 0.0005 increase versus champion t0065 at 0.971285, with step count unchanged. This is the same class of re-measurement that produced the weight-decay gain at t0065, where a constant tuned at the old batch was no longer right at the new one, and the softcap has more leverage per unit of misplacement than any other constant in the recipe.", "hypothesis": "The output softcap is the steepest axis in this campaign and it was bracketed at a batch size the champion no longer uses, and a second result suggests its optimum has since moved. The bracket at batch 2**18 gave 7 costing 0.005206, 10 best, 15 costing 0.000393 and 30 costing 0.004637, and the mechanism that survived both sides was damping of the gradient into lm_head. Independent evidence says lm_head is less sensitive at the current batch: the unembedding learning rate was sharply peaked at 2**18, where moving it 30 percent cost 0.003152, but measured flat at 2**17 in t0054, moving only 0.00006 across the same span. If lm_head is genuinely less binding now, it needs less damping, so the softcap optimum should have moved upward from 10 toward the looser end where 15 sat only 0.000393 away. Testing 13 probes that shift on the gentle side of the curve rather than the steep one.", "log_path": "/data3/zhubaiyu/fengheguai/campaigns/h200-claude/artifacts/t0069/agent.log", "return_code": 0, "risk": "Unlike the weight-decay correction, this has no quantitative law behind it: there is no cumulative-softcap integral to match, only an inference from the unembedding-rate sensitivity dropping, and those two controls act on lm_head through different channels, one selectively on large logits and the other uniformly on every row, which t0039 already showed are not interchangeable. The prediction is therefore soft, and a null would mean the softcap optimum simply did not track the sensitivity change rather than that the reasoning was wrong.", "success": true, "timed_out": false}, "secondary_parent_id": null, "selection_reason": "The current line is stalled; make a structurally different bet.", "source_sha256": "073e03a4130fe99d347242d3e51248f9106df660ffcd78f5e3fe673be954559c", "stage": "explore", "status": "keep", "training_seconds": 300.0, "trial_id": "t0069", "workspace": "/data3/zhubaiyu/fengheguai/campaigns/h200-claude/nodes/t0069"}, "prev_hash": "9118931a875e7058f5d8127f85842be3293a6ebd279e67f0c9415b0b2ab8ccdb", "seq": 140, "timestamp": "2026-08-21T00:37:19.127896+00:00"}
{"hash": "72796bb0ae964cf28fdafce98c6b4325147ec4311431b942e140a91f929cb31e", "kind": "trial_started", "payload": {"parent_id": "t0069", "reason": "Recombine two independently strong branches at the scheduled synthesis step.", "secondary_parent_id": "t0065", "stage": "recombine", "trial_id": "t0070"}, "prev_hash": "a1393534eeeeb1dde2df90e6f4ec30522eeb9f170f848a342ae34851cfae7980", "seq": 141, "timestamp": "2026-08-21T00:37:19.167038+00:00"}
{"hash": "8bf33a92778c77af919b907104ec141b48f8376f432ebdb06997b0887bac7ae7", "kind": "trial_completed", "payload": {"champion_before": "t0069", "debug_depth": 0, "delta_vs_champion_before": 0.000499667812623783, "delta_vs_parent": 0.000499667812623783, "finding": "t0070 did not improve the prior champion: val_bpb=0.971571, delta=+0.000500. Hypothesis: The two elite lines are both re-measurements of constants that the batch change displaced, and together they establish a pattern worth acting on systematically. t0065 rescaled weight decay by a derivable law, matching the cumulative product of rate and decay, and gained 0.000345; t0069 raised the output softcap from 10 to 13 by inference from lm_head becoming less sensitive, and gained 0.000214. Both were tuned at batch 2**18 and both had moved. Several constants remain that were bracketed at that batch and never re-checked, and the one with the largest measured leverage is the warmdown fraction, where 0.35 cost 0.000758 and 0.8 cost 0.001467. There is also a specific reason to expect its optimum to have moved down rather than stayed: the anneal now spans about 1420 steps instead of 730, so it has twice the steps to settle the model, while t0061 showed this recipe is unusually costly to deprive of full-rate steps, losing 0.001875 for giving up just two percent of the budget to warmup. Shortening the warmdown to 0.4 buys back ten percent of the budget at full rate while still leaving a longer anneal in absolute steps than the champion had at the previous batch.", "measurements": [{"command": ["/data/home/zhubaiyu/.local/bin/uv", "run", "--project", "/data3/zhubaiyu/fengheguai/campaigns/h200-claude/nodes/t0070", "python", "/data3/zhubaiyu/fengheguai/fengheguai/_audit_runner.py", "--target", "/data3/zhubaiyu/fengheguai/campaigns/h200-claude/nodes/t0070", "--nonce", "97ca54d5db3d2127d2f556aea515c1f2b7be000eb2582ba9"], "errors": [], "evidence_path": "/data3/zhubaiyu/fengheguai/campaigns/h200-claude/evidence/t0070-r0/evidence.json", "evidence_sha256": "c5a02b90604777d567c24ed26e8b461660e9d71369114ba1bb436e62a0cbff57", "log_path": "/data3/zhubaiyu/fengheguai/campaigns/h200-claude/evidence/t0070-r0/run.log", "log_sha256": "5c808a9bb5e3916a47a8600868e3d4718bae21504c9afffdb9c0706d85cab463", "metric": 0.9715707763554909, "num_steps": 2840, "peak_vram_mb": 33800.4, "return_code": 0, "status": "valid", "timed_out": false, "train_sha256": "065b37810294488cc236a1bc874510d9e860a8a6ede8f465bda495b4de74a764", "training_seconds": 300.1, "wall_seconds": 485.3890572702512}], "metric": 0.9715707763554909, "parent_id": "t0069", "patch_path": "/data3/zhubaiyu/fengheguai/campaigns/h200-claude/artifacts/t0070/change.patch", "patch_sha256": "fab7c5ae978eb7b2230026b561331a987876139ff69d17729d3929102b822ecd", "promoted": false, "proposal": {"change_summary": "One constant changed on champion t0069: WARMDOWN_RATIO from 0.5 to 0.4, so get_lr_multiplier holds full rate until 60 percent of the time budget and then decays to the FINAL_LR_FRAC floor of 0.1 across the final 40 percent. WARMUP_RATIO stays 0.0, which t0061 confirmed. Both elite contributions are carried: WEIGHT_DECAY 0.146 from t0065 and softcap 13 from t0069. Batch 2**17, depth 12, width 512, HEAD_DIM 128, document masking, dense value embeddings with the 128-channel gate, rotary base 30000, the three settled learning rates, SCALAR_LR 0.5 and ADAM_BETAS at 0.8 and 0.95 are unchanged.", "command": ["/usr/bin/python3", "/data3/zhubaiyu/fengheguai/fengheguai/rendezvous_agent.py", "--trial", "/data3/zhubaiyu/fengheguai/campaigns/h200-claude/nodes/t0070", "--result", "/data3/zhubaiyu/fengheguai/campaigns/h200-claude/nodes/t0070/.fengheguai-agent-result.json", "--schema", "/data3/zhubaiyu/fengheguai/campaigns/h200-claude/control/agent_output.schema.json", "--campaign", "/data3/zhubaiyu/fengheguai/campaigns/h200-claude", "--inbox", "/data3/zhubaiyu/fengheguai/campaigns/h200-claude-rendezvous"], "errors": [], "expected_val_bpb_effect": "Expected between a 0.001 decrease and a 0.001 increase versus champion t0069 at 0.971071, with step count unchanged since the schedule costs nothing to evaluate. The argument is weaker than the weight-decay law because nothing here is derivable, only the observation that the anneal is now twice as long in steps while full-rate steps have proven expensive to give up. A regression would mean the schedule shape is genuinely time-referenced rather than step-referenced, which would be a clean result given that every other schedule in this file is driven by elapsed time.", "hypothesis": "The two elite lines are both re-measurements of constants that the batch change displaced, and together they establish a pattern worth acting on systematically. t0065 rescaled weight decay by a derivable law, matching the cumulative product of rate and decay, and gained 0.000345; t0069 raised the output softcap from 10 to 13 by inference from lm_head becoming less sensitive, and gained 0.000214. Both were tuned at batch 2**18 and both had moved. Several constants remain that were bracketed at that batch and never re-checked, and the one with the largest measured leverage is the warmdown fraction, where 0.35 cost 0.000758 and 0.8 cost 0.001467. There is also a specific reason to expect its optimum to have moved down rather than stayed: the anneal now spans about 1420 steps instead of 730, so it has twice the steps to settle the model, while t0061 showed this recipe is unusually costly to deprive of full-rate steps, losing 0.001875 for giving up just two percent of the budget to warmup. Shortening the warmdown to 0.4 buys back ten percent of the budget at full rate while still leaving a longer anneal in absolute steps than the champion had at the previous batch.", "log_path": "/data3/zhubaiyu/fengheguai/campaigns/h200-claude/artifacts/t0070/agent.log", "return_code": 0, "risk": "The warmdown was already bracketed at 0.5 against 0.35 and 0.8 at the previous batch, so this is close to a coordinate already measured, and the honest possibility is that the shape is invariant precisely because it is time-indexed and this simply reproduces the earlier 0.35 result at slightly less extremity. The weight-decay coupling is also still active through get_weight_decay, which takes the same progress variable, so shortening the warmdown compresses the decay schedule too and the result is a verdict on both together rather than on the rate trajectory alone.", "success": true, "timed_out": false}, "secondary_parent_id": "t0065", "selection_reason": "Recombine two independently strong branches at the scheduled synthesis step.", "source_sha256": "065b37810294488cc236a1bc874510d9e860a8a6ede8f465bda495b4de74a764", "stage": "recombine", "status": "discard", "training_seconds": 300.1, "trial_id": "t0070", "workspace": "/data3/zhubaiyu/fengheguai/campaigns/h200-claude/nodes/t0070"}, "prev_hash": "72796bb0ae964cf28fdafce98c6b4325147ec4311431b942e140a91f929cb31e", "seq": 142, "timestamp": "2026-08-21T00:46:29.055673+00:00"}
{"hash": "6529774d39c13c29921e882e6c129460bfca40c238dad102367765ec2ac37324", "kind": "trial_started", "payload": {"parent_id": "t0069", "reason": "Spend the configured search share on a distinct architectural or recipe direction.", "secondary_parent_id": null, "stage": "explore", "trial_id": "t0071"}, "prev_hash": "8bf33a92778c77af919b907104ec141b48f8376f432ebdb06997b0887bac7ae7", "seq": 143, "timestamp": "2026-08-21T00:46:29.095504+00:00"}
{"hash": "1e38f406ff748c4a5b14131442369ce803c574e21011323177d5bdc5c540af90", "kind": "trial_completed", "payload": {"champion_before": "t0069", "debug_depth": 0, "delta_vs_champion_before": 0.005427235449193546, "delta_vs_parent": 0.005427235449193546, "finding": "t0071 did not improve the prior champion: val_bpb=0.976498, delta=+0.005427. Hypothesis: Grouped-query attention is the last untested architectural axis, and my reason for skipping it so far has been inference rather than measurement, which this campaign has repeatedly shown to be unreliable. Halving n_kv_head from 4 to 2 shrinks c_k and c_v from full width to half, saving about 3.1M matrix parameters and roughly 8 percent of matrix FLOPs, which should buy a few percent more steps. The cost is that kv_dim is n_kv_head times head_dim, so it falls from 512 to 256 and every value-embedding table halves with it, taking that block from about 50M parameters to 25M. t0022 measured that halving the number of value-embedding tables costs 0.001806, so if width behaves like count this should lose by a similar margin and the step gain will not cover it. The node is worth spending precisely because that transfer from count to width is an assumption: value embeddings may be redundant across their width in a way they are not across layers, in which case GQA is close to free and this wins.", "measurements": [{"command": ["/data/home/zhubaiyu/.local/bin/uv", "run", "--project", "/data3/zhubaiyu/fengheguai/campaigns/h200-claude/nodes/t0071", "python", "/data3/zhubaiyu/fengheguai/fengheguai/_audit_runner.py", "--target", "/data3/zhubaiyu/fengheguai/campaigns/h200-claude/nodes/t0071", "--nonce", "a453f2de0dd2f4f8ec6f7274e3ea9eeb7045a92dbd615238"], "errors": [], "evidence_path": "/data3/zhubaiyu/fengheguai/campaigns/h200-claude/evidence/t0071-r0/evidence.json", "evidence_sha256": "377a02c8d0c5bd9927589d2cde887287a6fce0e097c61997234d39fefd7bd3f5", "log_path": "/data3/zhubaiyu/fengheguai/campaigns/h200-claude/evidence/t0071-r0/run.log", "log_sha256": "c98323d23a8eb2467a30b9e6ed7bcf91c9c937291b3210042d10aec86fb61f68", "metric": 0.9764983439920607, "num_steps": 3004, "peak_vram_mb": 30536.3, "return_code": 0, "status": "valid", "timed_out": false, "train_sha256": "51b5a03846398fadb7a9f5cf3b6c81bacc006d3cfd7aa96c2bafb4bbe3b4b708", "training_seconds": 300.0, "wall_seconds": 443.6993315825239}], "metric": 0.9764983439920607, "parent_id": "t0069", "patch_path": "/data3/zhubaiyu/fengheguai/campaigns/h200-claude/artifacts/t0071/change.patch", "patch_sha256": "e3415fc83d68c33379a7f31de1c6ed45c7a3cad0b4f2432a9030b64e80b0efff", "promoted": false, "proposal": {"change_summary": "One architectural change on champion t0069: build_model_config now passes n_kv_head as num_heads // 2, giving 2 key-value heads against 4 query heads at an unchanged model_dim of 512 and HEAD_DIM of 128. This halves c_k and c_v, halves kv_dim from 512 to 256, halves every value-embedding table, and narrows each ve_gate output from 4 to 2. The existing assertion that n_kv_head divides n_head is satisfied. Depth 12, document masking, dense value embeddings with the 128-channel gate, output softcap 13, rotary base 30000, batch 2**17, the three settled learning rates, SCALAR_LR 0.5, ADAM_BETAS 0.8 and 0.95, WEIGHT_DECAY 0.146, FINAL_LR_FRAC 0.1 and WARMDOWN_RATIO 0.5 are unchanged.", "command": ["/usr/bin/python3", "/data3/zhubaiyu/fengheguai/fengheguai/rendezvous_agent.py", "--trial", "/data3/zhubaiyu/fengheguai/campaigns/h200-claude/nodes/t0071", "--result", "/data3/zhubaiyu/fengheguai/campaigns/h200-claude/nodes/t0071/.fengheguai-agent-result.json", "--schema", "/data3/zhubaiyu/fengheguai/campaigns/h200-claude/control/agent_output.schema.json", "--campaign", "/data3/zhubaiyu/fengheguai/campaigns/h200-claude", "--inbox", "/data3/zhubaiyu/fengheguai/campaigns/h200-claude-rendezvous"], "errors": [], "expected_val_bpb_effect": "Expected between a 0.001 decrease and a 0.003 increase versus champion t0069 at 0.971071, with the step count rising to roughly 2950 from 2841. I expect a regression of about 0.001 to 0.002, since the value-embedding path has been the most load-bearing mechanism in this recipe throughout and this halves its capacity. The measurement is worth having because it separates two things that have been conflated: whether that path needs many tables or wide ones.", "hypothesis": "Grouped-query attention is the last untested architectural axis, and my reason for skipping it so far has been inference rather than measurement, which this campaign has repeatedly shown to be unreliable. Halving n_kv_head from 4 to 2 shrinks c_k and c_v from full width to half, saving about 3.1M matrix parameters and roughly 8 percent of matrix FLOPs, which should buy a few percent more steps. The cost is that kv_dim is n_kv_head times head_dim, so it falls from 512 to 256 and every value-embedding table halves with it, taking that block from about 50M parameters to 25M. t0022 measured that halving the number of value-embedding tables costs 0.001806, so if width behaves like count this should lose by a similar margin and the step gain will not cover it. The node is worth spending precisely because that transfer from count to width is an assumption: value embeddings may be redundant across their width in a way they are not across layers, in which case GQA is close to free and this wins.", "log_path": "/data3/zhubaiyu/fengheguai/campaigns/h200-claude/artifacts/t0071/agent.log", "return_code": 0, "risk": "This changes several coupled quantities at once because they all derive from n_kv_head, so a regression cannot attribute cleanly between lost key-value capacity, lost value-embedding width and the narrower gate. That is inherent to the axis rather than a design flaw in the node, since GQA is defined by exactly that coupling. If it regresses roughly as predicted, the honest conclusion is that this configuration is at a genuine architectural optimum on every axis tested, and the campaign has converged.", "success": true, "timed_out": false}, "secondary_parent_id": null, "selection_reason": "Spend the configured search share on a distinct architectural or recipe direction.", "source_sha256": "51b5a03846398fadb7a9f5cf3b6c81bacc006d3cfd7aa96c2bafb4bbe3b4b708", "stage": "explore", "status": "discard", "training_seconds": 300.0, "trial_id": "t0071", "workspace": "/data3/zhubaiyu/fengheguai/campaigns/h200-claude/nodes/t0071"}, "prev_hash": "6529774d39c13c29921e882e6c129460bfca40c238dad102367765ec2ac37324", "seq": 144, "timestamp": "2026-08-21T00:55:19.341710+00:00"}
