{"hash": "34f7d78eae878031c71b3fadb597f9df0b33e6667e363cd7108be9a6bb036650", "kind": "trial_completed", "payload": {"champion_before": "t0034", "debug_depth": 0, "delta_vs_champion_before": 0.004243284812247561, "delta_vs_parent": 0.004243284812247561, "finding": "t0036 did not improve the prior champion: val_bpb=0.977341, delta=+0.004243. Hypothesis: The output softcap may be limiting the metric directly rather than only stabilising training. The head computes logits, casts to float32, then applies 15*tanh(logits/15), which asymptotically bounds every logit to plus or minus 15 and, more importantly, compresses differences once magnitudes approach that scale. val_bpb is a cross-entropy quantity, so it is exactly the size of the gap between the correct logit and its competitors that sets the achievable loss on confident predictions, and a model at 0.973 bpb makes many highly confident predictions on a small 8192-token vocabulary. If the cap binds on those, it puts a floor under the loss that no amount of better representation can pass. Doubling the cap to 30 keeps the same stabilising shape near the origin, since tanh is linear there, while relaxing the ceiling where it binds, and should lower val_bpb.", "measurements": [{"command": ["/data/home/zhubaiyu/.local/bin/uv", "run", "--project", "/data3/zhubaiyu/fengheguai/campaigns/h200-claude/nodes/t0036", "python", "/data3/zhubaiyu/fengheguai/fengheguai/_audit_runner.py", "--target", "/data3/zhubaiyu/fengheguai/campaigns/h200-claude/nodes/t0036", "--nonce", "ee0df2874fbf28c73b8552913bebb06e0d37d6cd4e88e7df"], "errors": [], "evidence_path": "/data3/zhubaiyu/fengheguai/campaigns/h200-claude/evidence/t0036-r0/evidence.json", "evidence_sha256": "dcf39cc3501a1b2246d83730b563abe2c24b47673de851e1b7a9506518eb654a", "log_path": "/data3/zhubaiyu/fengheguai/campaigns/h200-claude/evidence/t0036-r0/run.log", "log_sha256": "4ddcdc41b853855941dc5ab5f3a867ae19f4a7ac0656fc52072225538f410be5", "metric": 0.9773407847324418, "num_steps": 1472, "peak_vram_mb": 66795.4, "return_code": 0, "status": "valid", "timed_out": false, "train_sha256": "5b4c858503915010e6b7a3ced81ca2d9b797535cc3a64e0e5a08b5ac3538ca9d", "training_seconds": 300.1, "wall_seconds": 436.58470978681}], "metric": 0.9773407847324418, "parent_id": "t0034", "patch_path": "/data3/zhubaiyu/fengheguai/campaigns/h200-claude/artifacts/t0036/change.patch", "patch_sha256": "fc198a3db9604ee13bfc7cc8da93bca3a84c2f09f4315b45cbe9bf367799dc68", "promoted": false, "proposal": {"change_summary": "One constant changed on champion t0034: the softcap used in GPT.forward from 15 to 30, applied identically as softcap*tanh(logits/softcap) after the float32 cast. Nothing else moves: the value-embedding gate stays at its measured optimum of 128 channels, rotary base stays 30000, depth 12, width 512, document masking, dense value embeddings, the 512-token short window, batch 2**18, all learning rates, WEIGHT_DECAY 0.2 and every schedule are unchanged.", "command": ["/usr/bin/python3", "/data3/zhubaiyu/fengheguai/fengheguai/rendezvous_agent.py", "--trial", "/data3/zhubaiyu/fengheguai/campaigns/h200-claude/nodes/t0036", "--result", "/data3/zhubaiyu/fengheguai/campaigns/h200-claude/nodes/t0036/.fengheguai-agent-result.json", "--schema", "/data3/zhubaiyu/fengheguai/campaigns/h200-claude/control/agent_output.schema.json", "--campaign", "/data3/zhubaiyu/fengheguai/campaigns/h200-claude", "--inbox", "/data3/zhubaiyu/fengheguai/campaigns/h200-claude-rendezvous"], "errors": [], "expected_val_bpb_effect": "Expected between a 0.002 decrease and a 0.001 increase versus champion t0034 at 0.973097, with step count unchanged since tanh on the logits is a trivial elementwise cost either way. A decrease would mean the cap was binding on confident predictions and would justify testing a still looser cap or removing it; an increase would mean the compression is doing real optimisation work, most plausibly by bounding the gradient into lm_head early in training when logits are poorly calibrated.", "hypothesis": "The output softcap may be limiting the metric directly rather than only stabilising training. The head computes logits, casts to float32, then applies 15*tanh(logits/15), which asymptotically bounds every logit to plus or minus 15 and, more importantly, compresses differences once magnitudes approach that scale. val_bpb is a cross-entropy quantity, so it is exactly the size of the gap between the correct logit and its competitors that sets the achievable loss on confident predictions, and a model at 0.973 bpb makes many highly confident predictions on a small 8192-token vocabulary. If the cap binds on those, it puts a floor under the loss that no amount of better representation can pass. Doubling the cap to 30 keeps the same stabilising shape near the origin, since tanh is linear there, while relaxing the ceiling where it binds, and should lower val_bpb.", "log_path": "/data3/zhubaiyu/fengheguai/campaigns/h200-claude/artifacts/t0036/agent.log", "return_code": 0, "risk": "Softcapping is usually introduced for stability rather than for quality, so relaxing it can surface the instability it was added to prevent, which here would appear as a much worse loss or the FAIL exit that triggers when train_loss exceeds 100 or goes NaN rather than as a small regression. This is also the same evaluation path the locked scorer uses, since prepare.evaluate_bpb calls the model with reduction none and consumes these logits, so the change affects training and evaluation identically and remains a single coherent modelling choice rather than an evaluation-only edit.", "success": true, "timed_out": false}, "secondary_parent_id": null, "selection_reason": "Spend the configured search share on a distinct architectural or recipe direction.", "source_sha256": "5b4c858503915010e6b7a3ced81ca2d9b797535cc3a64e0e5a08b5ac3538ca9d", "stage": "explore", "status": "discard", "training_seconds": 300.1, "trial_id": "t0036", "workspace": "/data3/zhubaiyu/fengheguai/campaigns/h200-claude/nodes/t0036"}, "prev_hash": "c85df331e328d9109b4c867c09e82d5bc52f3e6ab67471d5265484dd9549f99d", "seq": 74, "timestamp": "2026-08-20T18:30:35.723941+00:00"}
{"hash": "70652cbf3718d81b38c6b2003c6ec43051e069230a182f3f5088f5013c1e23ef", "kind": "trial_started", "payload": {"parent_id": "t0034", "reason": "Spend the configured search share on a distinct architectural or recipe direction.", "secondary_parent_id": null, "stage": "explore", "trial_id": "t0037"}, "prev_hash": "34f7d78eae878031c71b3fadb597f9df0b33e6667e363cd7108be9a6bb036650", "seq": 75, "timestamp": "2026-08-20T18:30:35.745564+00:00"}
{"hash": "9dedd9430450abafdafa253fb250722ffd54ed3e4fe8fb62987c5e45f8ba4d04", "kind": "trial_completed", "payload": {"champion_before": "t0034", "debug_depth": 0, "delta_vs_champion_before": -0.00039302154814702117, "delta_vs_parent": -0.00039302154814702117, "finding": "t0037 improved the prior champion: val_bpb=0.972704, delta=-0.000393. Hypothesis: t0036 falsified the reading that the output softcap puts a floor under the metric: doubling it to 30 cost 0.004244, about thirty times the repeat noise, so the compression is doing optimisation work rather than limiting achievable loss. The most likely mechanism is gradient control into lm_head, since tanh saturation shrinks the gradient on logits that have grown large and prevents the unembedding from chasing overconfident predictions, which matters most in a 300-second run where lm_head starts at a standard deviation of 0.001 and must move quickly. If that is what the cap is for, then more of it should help, exactly as more cautious weight decay helped in the t0018 and t0019 pair. Tightening the cap to 10 tests that and, with the 30 measurement, brackets the axis.", "measurements": [{"command": ["/data/home/zhubaiyu/.local/bin/uv", "run", "--project", "/data3/zhubaiyu/fengheguai/campaigns/h200-claude/nodes/t0037", "python", "/data3/zhubaiyu/fengheguai/fengheguai/_audit_runner.py", "--target", "/data3/zhubaiyu/fengheguai/campaigns/h200-claude/nodes/t0037", "--nonce", "04f920b36eab3275df252007ad262db08ea9a01e6115882e"], "errors": [], "evidence_path": "/data3/zhubaiyu/fengheguai/campaigns/h200-claude/evidence/t0037-r0/evidence.json", "evidence_sha256": "838a89ba05ec204937db2259e2a921860b675bc064d0a774986a6928571633e3", "log_path": "/data3/zhubaiyu/fengheguai/campaigns/h200-claude/evidence/t0037-r0/run.log", "log_sha256": "ca68640d9672144ad1d6f0c7efb6c509600b2f4972dd6026a97e0f90c99a5793", "metric": 0.972679414764026, "num_steps": 1465, "peak_vram_mb": 66795.4, "return_code": 0, "status": "valid", "timed_out": false, "train_sha256": "c81f79dd1b0271ea5155ed4b178a2b48db9324cb5a972d9293df6b4f06c03808", "training_seconds": 300.0, "wall_seconds": 566.6362437456846}, {"command": ["/data/home/zhubaiyu/.local/bin/uv", "run", "--project", "/data3/zhubaiyu/fengheguai/campaigns/h200-claude/nodes/t0037", "python", "/data3/zhubaiyu/fengheguai/fengheguai/_audit_runner.py", "--target", "/data3/zhubaiyu/fengheguai/campaigns/h200-claude/nodes/t0037", "--nonce", "37f2d6e6d0220b87204fb2bc48012bc2a882dbd01802d7b2"], "errors": [], "evidence_path": "/data3/zhubaiyu/fengheguai/campaigns/h200-claude/evidence/t0037-r1/evidence.json", "evidence_sha256": "38a680b8b38b2b91b501686c67b0d99c437a82b1c9f8b62fdb3f43cc5af02db7", "log_path": "/data3/zhubaiyu/fengheguai/campaigns/h200-claude/evidence/t0037-r1/run.log", "log_sha256": "d5fed4d509a6f7978a8bacd7442ef06fcaeba12749ce8c672d4e7f3feab0011a", "metric": 0.9727295419800684, "num_steps": 1465, "peak_vram_mb": 66795.4, "return_code": 0, "status": "valid", "timed_out": false, "train_sha256": "c81f79dd1b0271ea5155ed4b178a2b48db9324cb5a972d9293df6b4f06c03808", "training_seconds": 300.1, "wall_seconds": 479.7827943507582}], "metric": 0.9727044783720472, "parent_id": "t0034", "patch_path": "/data3/zhubaiyu/fengheguai/campaigns/h200-claude/artifacts/t0037/change.patch", "patch_sha256": "bd75839c870ae71e07d1ae1bd53e99e705f3a2b207d179bf2c73b9993e325ee4", "promoted": true, "proposal": {"change_summary": "One constant changed on champion t0034: the softcap in GPT.forward from 15 to 10, keeping the same softcap*tanh(logits/softcap) form after the float32 cast. The value-embedding gate stays at its measured optimum of 128 channels, rotary base stays 30000, and depth 12, width 512, document masking, dense value embeddings, the 512-token short window, batch 2**18, all learning rates, WEIGHT_DECAY 0.2 and every schedule are unchanged.", "command": ["/usr/bin/python3", "/data3/zhubaiyu/fengheguai/fengheguai/rendezvous_agent.py", "--trial", "/data3/zhubaiyu/fengheguai/campaigns/h200-claude/nodes/t0037", "--result", "/data3/zhubaiyu/fengheguai/campaigns/h200-claude/nodes/t0037/.fengheguai-agent-result.json", "--schema", "/data3/zhubaiyu/fengheguai/campaigns/h200-claude/control/agent_output.schema.json", "--campaign", "/data3/zhubaiyu/fengheguai/campaigns/h200-claude", "--inbox", "/data3/zhubaiyu/fengheguai/campaigns/h200-claude-rendezvous"], "errors": [], "expected_val_bpb_effect": "Expected between a 0.001 decrease and a 0.002 increase versus champion t0034 at 0.973097, with step count unchanged. Given that thirteen inherited defaults have now each proved to sit at their own optimum, the base rate favours a regression that closes the axis with a three-point bracket at 15. A decrease would be more interesting than its size suggests, because it would mean the gradient-control reading is right and under-applied, and would point at a tighter cap still.", "hypothesis": "t0036 falsified the reading that the output softcap puts a floor under the metric: doubling it to 30 cost 0.004244, about thirty times the repeat noise, so the compression is doing optimisation work rather than limiting achievable loss. The most likely mechanism is gradient control into lm_head, since tanh saturation shrinks the gradient on logits that have grown large and prevents the unembedding from chasing overconfident predictions, which matters most in a 300-second run where lm_head starts at a standard deviation of 0.001 and must move quickly. If that is what the cap is for, then more of it should help, exactly as more cautious weight decay helped in the t0018 and t0019 pair. Tightening the cap to 10 tests that and, with the 30 measurement, brackets the axis.", "log_path": "/data3/zhubaiyu/fengheguai/campaigns/h200-claude/artifacts/t0037/agent.log", "return_code": 0, "risk": "A tighter cap compresses the logit gaps that cross-entropy depends on, so if it is tightened past the point where it only clips outliers it will start limiting confident predictions directly and cost bpb through the very mechanism t0036 ruled out at 30; the two effects run in opposite directions across this axis and a single point cannot separate them, though the sign of the result will say which dominates near 15. The measurement is otherwise clean, since the cap is applied identically in training and in the locked evaluation path.", "success": true, "timed_out": false}, "secondary_parent_id": null, "selection_reason": "Spend the configured search share on a distinct architectural or recipe direction.", "source_sha256": "c81f79dd1b0271ea5155ed4b178a2b48db9324cb5a972d9293df6b4f06c03808", "stage": "explore", "status": "keep", "training_seconds": 300.05, "trial_id": "t0037", "workspace": "/data3/zhubaiyu/fengheguai/campaigns/h200-claude/nodes/t0037"}, "prev_hash": "70652cbf3718d81b38c6b2003c6ec43051e069230a182f3f5088f5013c1e23ef", "seq": 76, "timestamp": "2026-08-20T18:48:56.958939+00:00"}
{"hash": "34ec823ae517d61729b8942a808205511b265e6db8ba7614f29fbab9a92d001c", "kind": "trial_started", "payload": {"parent_id": "t0037", "reason": "Exploit a top-K branch selected by quality plus an under-exploration bonus.", "secondary_parent_id": null, "stage": "refine", "trial_id": "t0038"}, "prev_hash": "9dedd9430450abafdafa253fb250722ffd54ed3e4fe8fb62987c5e45f8ba4d04", "seq": 77, "timestamp": "2026-08-20T18:48:56.981263+00:00"}
{"hash": "0ca678840e587da6d972da26af0a5eb896c199f2c8533c17e507d14ebc800541", "kind": "trial_completed", "payload": {"champion_before": "t0037", "debug_depth": 0, "delta_vs_champion_before": 0.005205061233777397, "delta_vs_parent": 0.005205061233777397, "finding": "t0038 did not improve the prior champion: val_bpb=0.977910, delta=+0.005205. Hypothesis: The output softcap is the first inherited default in this campaign that is not already at its optimum, and the axis is steep and one-sided so far. Loosening it to 30 cost 0.004244 while tightening it to 10 gained 0.000393 against a repeat noise of 0.00013, which supports the gradient-control reading: tanh saturation shrinks the gradient reaching lm_head once logits grow, and in a 300-second run where lm_head starts at standard deviation 0.001 that damping is worth more than the logit range it sacrifices. If more of it continues to help, the optimum lies below 10. Tightening to 7 tests that and, with the 15 and 30 measurements, brackets the axis from both sides.", "measurements": [{"command": ["/data/home/zhubaiyu/.local/bin/uv", "run", "--project", "/data3/zhubaiyu/fengheguai/campaigns/h200-claude/nodes/t0038", "python", "/data3/zhubaiyu/fengheguai/fengheguai/_audit_runner.py", "--target", "/data3/zhubaiyu/fengheguai/campaigns/h200-claude/nodes/t0038", "--nonce", "cf4fbd561c1ccac88e20d853f60938d2075ae41508a74552"], "errors": [], "evidence_path": "/data3/zhubaiyu/fengheguai/campaigns/h200-claude/evidence/t0038-r0/evidence.json", "evidence_sha256": "4adbd61f32002a4103287c209b20447a52dcaba5b44fc786eb453f9e73fa2a80", "log_path": "/data3/zhubaiyu/fengheguai/campaigns/h200-claude/evidence/t0038-r0/run.log", "log_sha256": "5945ea8afcf6e01d95c057eac6e9c0909b657ce7b36356a12aec554d7d29b997", "metric": 0.9779095396058246, "num_steps": 1466, "peak_vram_mb": 66795.4, "return_code": 0, "status": "valid", "timed_out": false, "train_sha256": "7aa3c0eace7b800e2399a781a1696a9e945722399b93b1d3330fcf45ec637ed2", "training_seconds": 300.0, "wall_seconds": 566.6291748387739}], "metric": 0.9779095396058246, "parent_id": "t0037", "patch_path": "/data3/zhubaiyu/fengheguai/campaigns/h200-claude/artifacts/t0038/change.patch", "patch_sha256": "306667bd2cc7bc337dc0d257d2eccf6700e3b67c0b4c73d08c529c2710c566dd", "promoted": false, "proposal": {"change_summary": "One constant changed on champion t0037: the softcap in GPT.forward from 10 to 7, keeping the softcap*tanh(logits/softcap) form applied after the float32 cast. The value-embedding gate stays at 128 channels, rotary base at 30000, and depth 12, width 512, document masking, dense value embeddings, the 512-token short window, batch 2**18, all learning rates, WEIGHT_DECAY 0.2 and every schedule are unchanged.", "command": ["/usr/bin/python3", "/data3/zhubaiyu/fengheguai/fengheguai/rendezvous_agent.py", "--trial", "/data3/zhubaiyu/fengheguai/campaigns/h200-claude/nodes/t0038", "--result", "/data3/zhubaiyu/fengheguai/campaigns/h200-claude/nodes/t0038/.fengheguai-agent-result.json", "--schema", "/data3/zhubaiyu/fengheguai/campaigns/h200-claude/control/agent_output.schema.json", "--campaign", "/data3/zhubaiyu/fengheguai/campaigns/h200-claude", "--inbox", "/data3/zhubaiyu/fengheguai/campaigns/h200-claude-rendezvous"], "errors": [], "expected_val_bpb_effect": "Expected between a 0.0005 decrease and a 0.001 increase versus champion t0037 at 0.972704, with step count unchanged. The two effects on this axis pull apart as the cap tightens: gradient damping keeps helping while the compression of logit gaps starts to bind on confident predictions, so the optimum is where they cross and the 15 to 10 gain of 0.000393 is small enough that the crossing may already be near. A regression closes the axis with a three-point bracket at 10.", "hypothesis": "The output softcap is the first inherited default in this campaign that is not already at its optimum, and the axis is steep and one-sided so far. Loosening it to 30 cost 0.004244 while tightening it to 10 gained 0.000393 against a repeat noise of 0.00013, which supports the gradient-control reading: tanh saturation shrinks the gradient reaching lm_head once logits grow, and in a 300-second run where lm_head starts at standard deviation 0.001 that damping is worth more than the logit range it sacrifices. If more of it continues to help, the optimum lies below 10. Tightening to 7 tests that and, with the 15 and 30 measurements, brackets the axis from both sides.", "log_path": "/data3/zhubaiyu/fengheguai/campaigns/h200-claude/artifacts/t0038/agent.log", "return_code": 0, "risk": "A cap of 7 nats is a hard ceiling on the logit of a correct token, and cross-entropy on a confident prediction is bounded below by roughly the negative log of the softmax that ceiling permits, so at some point this mechanism must start setting a floor under val_bpb directly, which is the effect t0036 ruled out at 30 but which becomes real as the cap shrinks. If this regresses, the axis is settled at 10 and the correct reading is that gradient control and logit range balance there rather than that tighter capping is simply wrong.", "success": true, "timed_out": false}, "secondary_parent_id": null, "selection_reason": "Exploit a top-K branch selected by quality plus an under-exploration bonus.", "source_sha256": "7aa3c0eace7b800e2399a781a1696a9e945722399b93b1d3330fcf45ec637ed2", "stage": "refine", "status": "discard", "training_seconds": 300.0, "trial_id": "t0038", "workspace": "/data3/zhubaiyu/fengheguai/campaigns/h200-claude/nodes/t0038"}, "prev_hash": "34ec823ae517d61729b8942a808205511b265e6db8ba7614f29fbab9a92d001c", "seq": 78, "timestamp": "2026-08-20T18:59:10.063776+00:00"}
{"hash": "216f44e21ac26f5c3aa3e97a34f3c9762e046113c1ee8372d733129615fe6493", "kind": "trial_started", "payload": {"parent_id": "t0037", "reason": "Spend the configured search share on a distinct architectural or recipe direction.", "secondary_parent_id": null, "stage": "explore", "trial_id": "t0039"}, "prev_hash": "0ca678840e587da6d972da26af0a5eb896c199f2c8533c17e507d14ebc800541", "seq": 79, "timestamp": "2026-08-20T18:59:10.090692+00:00"}
