{"hash": "7a955b5923bd5666b75f3daff5295bad57be16ba5495e92d4c5bf7418a31283a", "kind": "trial_completed", "payload": {"champion_before": "t0053", "debug_depth": 0, "delta_vs_champion_before": 4.9446180251933036e-05, "delta_vs_parent": 4.9446180251933036e-05, "finding": "t0057 did not improve the prior champion: val_bpb=0.971680, delta=+0.000049. Hypothesis: t0056 tested whether the step-indexed momentum warmup should hold a constant fraction of the run and answered no: stretching it from 300 to 850 steps, restoring the 30 percent fraction the recipe had at 1019 steps, cost 0.001071. The reading that survives is that reaching high momentum early is actively valuable rather than that the warmup should scale with run length, which also fits the terminal-value bracket where 0.92 cost 0.001053 and 0.98 cost 0.002361, both worse than 0.95. If early momentum is what matters, the warmup should be shorter than the inherited 300 steps rather than longer, and at 2838 steps a 150-step ramp reaches terminal momentum within the first 5 percent of training. Halving it should lower val_bpb, and together with the 850 measurement it brackets the axis.", "measurements": [{"command": ["/data/home/zhubaiyu/.local/bin/uv", "run", "--project", "/data3/zhubaiyu/fengheguai/campaigns/h200-claude/nodes/t0057", "python", "/data3/zhubaiyu/fengheguai/fengheguai/_audit_runner.py", "--target", "/data3/zhubaiyu/fengheguai/campaigns/h200-claude/nodes/t0057", "--nonce", "a0978ca4009f907a21297e3edccac7ee8a7c8d7475e159bf"], "errors": [], "evidence_path": "/data3/zhubaiyu/fengheguai/campaigns/h200-claude/evidence/t0057-r0/evidence.json", "evidence_sha256": "b7400b38016f3ba7c7397f16114ce8d2c36adc177e08772165ac3378e566188a", "log_path": "/data3/zhubaiyu/fengheguai/campaigns/h200-claude/evidence/t0057-r0/run.log", "log_sha256": "e9e324acce940d93e643c0ef8d98df96166aae5b9e67e58f077c27090ca0baca", "metric": 0.9716797559263274, "num_steps": 2841, "peak_vram_mb": 33800.4, "return_code": 0, "status": "valid", "timed_out": false, "train_sha256": "927bb9237ab4f4e59bd0adce48f248e296ffa3a13714eed2f3ce7b4307e2a630", "training_seconds": 300.1, "wall_seconds": 486.2954889340326}], "metric": 0.9716797559263274, "parent_id": "t0053", "patch_path": "/data3/zhubaiyu/fengheguai/campaigns/h200-claude/artifacts/t0057/change.patch", "patch_sha256": "ff23a1734370eb590a74c42e16e24693b9338947c23792efc7c8e68d252316f3", "promoted": false, "proposal": {"change_summary": "One constant changed on champion t0053: the divisor in get_muon_momentum from 300 to 150, so momentum ramps from 0.85 to its terminal 0.95 over the first 150 steps instead of 300. The terminal value stays at its bracketed optimum of 0.95, NorMuon beta2 stays 0.95, and the settled rates from the decomposition are unchanged: EMBEDDING_LR 0.6 unscaled, UNEMBEDDING_LR 0.002, MATRIX_LR 0.0163 carrying the square-root rescale that t0055 confirmed is specific to the Muon group. Batch 2**17, depth 12, width 512, document masking, dense value embeddings with the 128-channel gate, output softcap 10, rotary base 30000, WEIGHT_DECAY 0.2, FINAL_LR_FRAC 0.1 and WARMDOWN_RATIO 0.5 are unchanged.", "command": ["/usr/bin/python3", "/data3/zhubaiyu/fengheguai/fengheguai/rendezvous_agent.py", "--trial", "/data3/zhubaiyu/fengheguai/campaigns/h200-claude/nodes/t0057", "--result", "/data3/zhubaiyu/fengheguai/campaigns/h200-claude/nodes/t0057/.fengheguai-agent-result.json", "--schema", "/data3/zhubaiyu/fengheguai/campaigns/h200-claude/control/agent_output.schema.json", "--campaign", "/data3/zhubaiyu/fengheguai/campaigns/h200-claude", "--inbox", "/data3/zhubaiyu/fengheguai/campaigns/h200-claude-rendezvous"], "errors": [], "expected_val_bpb_effect": "Expected between a 0.001 decrease and a 0.001 increase versus champion t0053 at 0.971630, with step count unchanged. The direction is supported but its magnitude is not: t0056 established the sign of the gradient along this axis while saying nothing about how far the optimum lies from 300, and the inherited value may already be close enough that halving overshoots into the region where the warmup stops doing its stabilising job.", "hypothesis": "t0056 tested whether the step-indexed momentum warmup should hold a constant fraction of the run and answered no: stretching it from 300 to 850 steps, restoring the 30 percent fraction the recipe had at 1019 steps, cost 0.001071. The reading that survives is that reaching high momentum early is actively valuable rather than that the warmup should scale with run length, which also fits the terminal-value bracket where 0.92 cost 0.001053 and 0.98 cost 0.002361, both worse than 0.95. If early momentum is what matters, the warmup should be shorter than the inherited 300 steps rather than longer, and at 2838 steps a 150-step ramp reaches terminal momentum within the first 5 percent of training. Halving it should lower val_bpb, and together with the 850 measurement it brackets the axis.", "log_path": "/data3/zhubaiyu/fengheguai/campaigns/h200-claude/artifacts/t0057/agent.log", "return_code": 0, "risk": "The warmup exists because orthogonalised updates early in training are computed from a momentum buffer that has barely accumulated, so reaching 0.95 sooner means trusting a less settled buffer, and the failure mode would be worse early loss rather than instability. This is also the third node spent on Muon momentum across the campaign, and the two previous ones both closed with the inherited value winning, so if this lands within noise I will treat the axis as settled at 300 and stop rather than testing intermediate values.", "success": true, "timed_out": false}, "secondary_parent_id": null, "selection_reason": "The current line is stalled; make a structurally different bet.", "source_sha256": "927bb9237ab4f4e59bd0adce48f248e296ffa3a13714eed2f3ce7b4307e2a630", "stage": "explore", "status": "discard", "training_seconds": 300.1, "trial_id": "t0057", "workspace": "/data3/zhubaiyu/fengheguai/campaigns/h200-claude/nodes/t0057"}, "prev_hash": "12bbb33d87395e664f8fc5662a31620ac6b2b49ea136007528a6244a11947e33", "seq": 116, "timestamp": "2026-08-20T22:19:44.336975+00:00"}
{"hash": "4e77800965dff9746fd23f1476cfad667eb196b686d519a447ede4b06b813a56", "kind": "trial_started", "payload": {"parent_id": "t0053", "reason": "The current line is stalled; make a structurally different bet.", "secondary_parent_id": null, "stage": "explore", "trial_id": "t0058"}, "prev_hash": "7a955b5923bd5666b75f3daff5295bad57be16ba5495e92d4c5bf7418a31283a", "seq": 117, "timestamp": "2026-08-20T22:19:44.370098+00:00"}
{"hash": "13e688e52f37a44501b6631358fb5e446f2bd7e0fb5f976892ec0d6c1557ffc9", "kind": "trial_completed", "payload": {"champion_before": "t0053", "debug_depth": 0, "delta_vs_champion_before": null, "delta_vs_parent": null, "finding": "t0058 ended as timeout. Hypothesis: Every axis this campaign has probed is now closed except kernel selection, and the model runs at about 41 percent MFU with unusually small GEMMs: a 512-wide residual stream, a 2048-wide MLP and an 8192-row vocabulary. Those shapes are exactly where the default inductor heuristics are least likely to pick the best tile and stage configuration, and where autotuning has the most to recover. The decisive structural fact is that compilation happens lazily on the first forward pass, and the training loop only accumulates total_training_time for steps beyond the tenth, so autotuning cost lands in wall clock rather than in the 300-second budget. If autotuning finds better kernels, every step after the tenth is faster and the step count rises at identical quality per step, which converts directly into lower val_bpb.. Evidence: expected one nonce-bound locked evaluation, found 0; process exceeded the wall-clock safety timeout; training process exited with code 143", "measurements": [{"command": ["/data/home/zhubaiyu/.local/bin/uv", "run", "--project", "/data3/zhubaiyu/fengheguai/campaigns/h200-claude/nodes/t0058", "python", "/data3/zhubaiyu/fengheguai/fengheguai/_audit_runner.py", "--target", "/data3/zhubaiyu/fengheguai/campaigns/h200-claude/nodes/t0058", "--nonce", "8c93f322c130996f4def8a69b754d91a8c00fb1eebbf1d1a"], "errors": ["expected one nonce-bound locked evaluation, found 0", "process exceeded the wall-clock safety timeout", "training process exited with code 143"], "evidence_path": "/data3/zhubaiyu/fengheguai/campaigns/h200-claude/evidence/t0058-r0/evidence.json", "evidence_sha256": "d840e348150f725d1f552b1e0b90ba6d4fc039e96f53739f113bd5403e5d0006", "log_path": "/data3/zhubaiyu/fengheguai/campaigns/h200-claude/evidence/t0058-r0/run.log", "log_sha256": "9e66e4e5b0402f4206d7e8182434f6b557ec8a83e025ce922537f08ea8e72802", "metric": null, "num_steps": 2921, "peak_vram_mb": 33800.4, "return_code": 143, "status": "timeout", "timed_out": true, "train_sha256": "8ad22b0ad57441e38b75fed261eac0cd38b09449cbc8b0765a1d89505eb50c13", "training_seconds": 300.1, "wall_seconds": 660.6655500289053}], "metric": null, "parent_id": "t0053", "patch_path": "/data3/zhubaiyu/fengheguai/campaigns/h200-claude/artifacts/t0058/change.patch", "patch_sha256": "a379c5c36280c947b5292e7a2e9b0e5e1743fe4d9e3555dda7e0828d4b36174a", "promoted": false, "proposal": {"change_summary": "One argument added on champion t0053: torch.compile now uses mode max-autotune-no-cudagraphs instead of the default mode, with dynamic=False unchanged. The no-cudagraphs variant is chosen deliberately rather than plain max-autotune, because CUDA graph capture interacts badly with the document-mask path, which builds a cu_seqlens tensor of batch-varying length each step and is marked dynamic. No model, data, optimizer or schedule change accompanies this: batch 2**17, depth 12, width 512, document masking, dense value embeddings with the 128-channel gate, output softcap 10, rotary base 30000, all three settled learning rates, WEIGHT_DECAY 0.2, FINAL_LR_FRAC 0.1 and WARMDOWN_RATIO 0.5 are exactly as in the champion.", "command": ["/usr/bin/python3", "/data3/zhubaiyu/fengheguai/fengheguai/rendezvous_agent.py", "--trial", "/data3/zhubaiyu/fengheguai/campaigns/h200-claude/nodes/t0058", "--result", "/data3/zhubaiyu/fengheguai/campaigns/h200-claude/nodes/t0058/.fengheguai-agent-result.json", "--schema", "/data3/zhubaiyu/fengheguai/campaigns/h200-claude/control/agent_output.schema.json", "--campaign", "/data3/zhubaiyu/fengheguai/campaigns/h200-claude", "--inbox", "/data3/zhubaiyu/fengheguai/campaigns/h200-claude-rendezvous"], "errors": [], "expected_val_bpb_effect": "Expected between a 0.003 decrease and parity versus champion t0053 at 0.971630. This is a pure throughput bet, so the diagnostic is num_steps against the champion baseline of 2838: a five percent gain would be about 2980 steps and should be worth roughly 0.001 given how the batch halving converted extra steps into loss. Quality per step should be unchanged since autotuning selects among numerically equivalent kernels, so any measured difference beyond noise is attributable to step count alone.", "hypothesis": "Every axis this campaign has probed is now closed except kernel selection, and the model runs at about 41 percent MFU with unusually small GEMMs: a 512-wide residual stream, a 2048-wide MLP and an 8192-row vocabulary. Those shapes are exactly where the default inductor heuristics are least likely to pick the best tile and stage configuration, and where autotuning has the most to recover. The decisive structural fact is that compilation happens lazily on the first forward pass, and the training loop only accumulates total_training_time for steps beyond the tenth, so autotuning cost lands in wall clock rather than in the 300-second budget. If autotuning finds better kernels, every step after the tenth is faster and the step count rises at identical quality per step, which converts directly into lower val_bpb.", "log_path": "/data3/zhubaiyu/fengheguai/campaigns/h200-claude/artifacts/t0058/agent.log", "return_code": 0, "risk": "The real risk is the wall clock rather than correctness. Recent runs take 442 to 486 seconds against a 660-second process timeout, leaving roughly 175 seconds of headroom, and autotuning benchmarks many candidate configurations per distinct GEMM shape at first compile. If that exceeds the headroom the node fails on timeout rather than regressing, which costs this trial and a debug node to revert. I judged that acceptable because the alternative is another low-leverage knob on an axis already bracketed, and because a timeout failure is unambiguous and cheap to diagnose. A secondary risk is that autotuning selects kernels that are faster in isolation but interact worse with the varlen attention path, which would show as a step count at or below 2838.", "success": true, "timed_out": false}, "secondary_parent_id": null, "selection_reason": "The current line is stalled; make a structurally different bet.", "source_sha256": "8ad22b0ad57441e38b75fed261eac0cd38b09449cbc8b0765a1d89505eb50c13", "stage": "explore", "status": "timeout", "training_seconds": null, "trial_id": "t0058", "workspace": "/data3/zhubaiyu/fengheguai/campaigns/h200-claude/nodes/t0058"}, "prev_hash": "4e77800965dff9746fd23f1476cfad667eb196b686d519a447ede4b06b813a56", "seq": 118, "timestamp": "2026-08-20T22:32:15.579526+00:00"}
{"hash": "7bcacbf0c837aebe6e565dbbdc7127a54d547b06c407bb292be6169f2c0024a5", "kind": "trial_started", "payload": {"parent_id": "t0058", "reason": "Repair the most recent executable failure before abandoning its hypothesis.", "secondary_parent_id": null, "stage": "debug", "trial_id": "t0059"}, "prev_hash": "13e688e52f37a44501b6631358fb5e446f2bd7e0fb5f976892ec0d6c1557ffc9", "seq": 119, "timestamp": "2026-08-20T22:32:15.612686+00:00"}
{"hash": "a0966b7f04f36d7d40085df19e0a65c04ff1981e37e7419f912acea764642518", "kind": "trial_completed", "payload": {"champion_before": "t0053", "debug_depth": 1, "delta_vs_champion_before": 8.616354066648402e-05, "delta_vs_parent": null, "finding": "t0059 did not improve the prior champion: val_bpb=0.971716, delta=+0.000086. Hypothesis: Unchanged from t0058: autotuned kernel selection should raise the step count at identical quality per step, since this model runs near 41 percent MFU on small GEMMs where the default inductor heuristics are weakest. t0058 did not test that hypothesis, it aborted at 661 seconds against the 660-second process timeout while still benchmarking Triton matmul candidates past number 1750. The diagnosis is that mode max-autotune-no-cudagraphs enables far more than GEMM tuning: it also autotunes pointwise kernels, benchmarks epilogue fusions and runs coordinate-descent tuning, and the combined first-compile search does not fit the wall budget. Enabling only max_autotune_gemm keeps the part of the search aimed at where this model actually spends its time and drops the rest.", "measurements": [{"command": ["/data/home/zhubaiyu/.local/bin/uv", "run", "--project", "/data3/zhubaiyu/fengheguai/campaigns/h200-claude/nodes/t0059", "python", "/data3/zhubaiyu/fengheguai/fengheguai/_audit_runner.py", "--target", "/data3/zhubaiyu/fengheguai/campaigns/h200-claude/nodes/t0059", "--nonce", "ec58129a2f3f3441d025d54f4d8d80a8d596036eb79bbb70"], "errors": [], "evidence_path": "/data3/zhubaiyu/fengheguai/campaigns/h200-claude/evidence/t0059-r0/evidence.json", "evidence_sha256": "ed662a6de50e4fa5b9e668f7968c5fe3e8a7ba156d018994af5f7db5f67d0b0a", "log_path": "/data3/zhubaiyu/fengheguai/campaigns/h200-claude/evidence/t0059-r0/run.log", "log_sha256": "a90fb46616f79635fb2aee50c05cce8a17eb2909515719e4bcaa34496b2beee6", "metric": 0.9717164732867419, "num_steps": 2835, "peak_vram_mb": 33800.4, "return_code": 0, "status": "valid", "timed_out": false, "train_sha256": "81da6a6eb778bb0709aa2451b115d890f3fb58163e858da423c9ed8600655ebc", "training_seconds": 300.1, "wall_seconds": 646.0513359680772}], "metric": 0.9717164732867419, "parent_id": "t0058", "patch_path": "/data3/zhubaiyu/fengheguai/campaigns/h200-claude/artifacts/t0059/change.patch", "patch_sha256": "767e4d744033f68fbb43e93d0ad8b9aa523b480cc06956c1b16f143dbc0cc19d", "promoted": false, "proposal": {"change_summary": "Debug repair of t0058 that narrows the search rather than repeating it. torch.compile returns to its default mode, and inductor_config.max_autotune_gemm is set to True before compilation, so Triton matmul candidates are still benchmarked against cuBLAS for each distinct GEMM shape while pointwise autotuning, epilogue-fusion benchmarking and coordinate-descent tuning are not run. The autotune results cached during the t0058 attempt remain available and should absorb part of the remaining GEMM search. Everything else matches champion t0053: batch 2**17 with DEVICE_BATCH_SIZE 64, depth 12, width 512, document masking, dense value embeddings with the 128-channel gate, output softcap 10, rotary base 30000, EMBEDDING_LR 0.6, UNEMBEDDING_LR 0.002, MATRIX_LR 0.0163, WEIGHT_DECAY 0.2, FINAL_LR_FRAC 0.1 and WARMDOWN_RATIO 0.5.", "command": ["/usr/bin/python3", "/data3/zhubaiyu/fengheguai/fengheguai/rendezvous_agent.py", "--trial", "/data3/zhubaiyu/fengheguai/campaigns/h200-claude/nodes/t0059", "--result", "/data3/zhubaiyu/fengheguai/campaigns/h200-claude/nodes/t0059/.fengheguai-agent-result.json", "--schema", "/data3/zhubaiyu/fengheguai/campaigns/h200-claude/control/agent_output.schema.json", "--campaign", "/data3/zhubaiyu/fengheguai/campaigns/h200-claude", "--inbox", "/data3/zhubaiyu/fengheguai/campaigns/h200-claude-rendezvous"], "errors": [], "expected_val_bpb_effect": "Expected between a 0.002 decrease and parity versus champion t0053 at 0.971630, judged by num_steps against the champion baseline of 2838, since autotuning selects among numerically equivalent kernels and cannot change quality per step. The upside is smaller than t0058 aimed at, because dropping pointwise and epilogue tuning gives up part of the potential gain in exchange for fitting the budget. Wall clock is the gating quantity and must land under 660 seconds against the champion baseline of about 483.", "hypothesis": "Unchanged from t0058: autotuned kernel selection should raise the step count at identical quality per step, since this model runs near 41 percent MFU on small GEMMs where the default inductor heuristics are weakest. t0058 did not test that hypothesis, it aborted at 661 seconds against the 660-second process timeout while still benchmarking Triton matmul candidates past number 1750. The diagnosis is that mode max-autotune-no-cudagraphs enables far more than GEMM tuning: it also autotunes pointwise kernels, benchmarks epilogue fusions and runs coordinate-descent tuning, and the combined first-compile search does not fit the wall budget. Enabling only max_autotune_gemm keeps the part of the search aimed at where this model actually spends its time and drops the rest.", "log_path": "/data3/zhubaiyu/fengheguai/campaigns/h200-claude/artifacts/t0059/agent.log", "return_code": 0, "risk": "The narrowed search may still not fit from a partially cold cache, in which case this times out like its parent. I pre-committed after t0058 to abandon autotuning on a second timeout rather than spend a third node, and that still holds. There is also a subtler risk worth recording: if this node succeeds partly because the cache is warm from t0058, its wall-clock margin is not reproducible from a cold start, and a later node that changes a tensor shape would invalidate those entries and could time out. Any promotion here should be read with that caveat attached, since it makes the configuration dependent on machine state the campaign does not control.", "success": true, "timed_out": false}, "secondary_parent_id": null, "selection_reason": "Repair the most recent executable failure before abandoning its hypothesis.", "source_sha256": "81da6a6eb778bb0709aa2451b115d890f3fb58163e858da423c9ed8600655ebc", "stage": "debug", "status": "discard", "training_seconds": 300.1, "trial_id": "t0059", "workspace": "/data3/zhubaiyu/fengheguai/campaigns/h200-claude/nodes/t0059"}, "prev_hash": "7bcacbf0c837aebe6e565dbbdc7127a54d547b06c407bb292be6169f2c0024a5", "seq": 120, "timestamp": "2026-08-20T22:45:24.314167+00:00"}
{"hash": "6d2859138929df855a8205d08f71141e18e32f41a74364b261b5c31490407ae0", "kind": "trial_started", "payload": {"parent_id": "t0053", "reason": "The current line is stalled; make a structurally different bet.", "secondary_parent_id": null, "stage": "explore", "trial_id": "t0060"}, "prev_hash": "a0966b7f04f36d7d40085df19e0a65c04ff1981e37e7419f912acea764642518", "seq": 121, "timestamp": "2026-08-20T22:45:24.348370+00:00"}
