{"hash": "a9cc40edc66bb14f0e8d71c73ead734285699e7ab6c12ed8fc0287c92c3c0676", "kind": "trial_completed", "payload": {"champion_before": "t0096", "debug_depth": 0, "delta_vs_champion_before": 0.0013030602823690396, "delta_vs_parent": 0.0013030602823690396, "finding": "t0101 did not improve the prior champion: val_bpb=0.968589, delta=+0.001303. Hypothesis: The warmdown fraction was measured before weight averaging existed, and averaging is exactly what made its cost avoidable. t0026 shortened the anneal from 0.5 to 0.35 and lost 0.000758, and t0020 lengthened it to 0.8 and lost 0.001467, so 0.5 was bracketed. But the reason a short anneal costs is that the model reaches the end of training less settled, and t0096 introduced an EMA that settles it, with t0099 then showing the schedule endpoint no longer influences the locked score across a doubling of the floor. If the endpoint is now handled by the average, the anneal is buying less than it did and the budget it consumes is better spent at full rate: shortening to 0.35 returns 15 percent of the run, roughly 430 steps, to the flat phase. This recipe has also shown repeatedly that it is expensive to deprive of full-rate steps, since a 2 percent warmup cost 0.001875 in t0061, which is the same quantity being bought back here.", "measurements": [{"command": ["/data/home/zhubaiyu/.local/bin/uv", "run", "--project", "/data3/zhubaiyu/fengheguai/campaigns/h200-claude/nodes/t0101", "python", "/data3/zhubaiyu/fengheguai/fengheguai/_audit_runner.py", "--target", "/data3/zhubaiyu/fengheguai/campaigns/h200-claude/nodes/t0101", "--nonce", "b4b40a2be9e4a5382b4c1f957c97eeb9c813fda91817af4a"], "errors": [], "evidence_path": "/data3/zhubaiyu/fengheguai/campaigns/h200-claude/evidence/t0101-r0/evidence.json", "evidence_sha256": "ae9ebd8b72af843a119b1f22a9d74e060d47438f29cd3ffd602f43488ff1834f", "log_path": "/data3/zhubaiyu/fengheguai/campaigns/h200-claude/evidence/t0101-r0/run.log", "log_sha256": "b3bbaab373eca930696832310f4bd8bd73fc41e27aa47423fc81d72f18f435ff", "metric": 0.968588974830216, "num_steps": 2869, "peak_vram_mb": 34168.4, "return_code": 0, "status": "valid", "timed_out": false, "train_sha256": "4151c40df861fe6bb12799e3da7568ce72d5cbf43cad2dc1c21a4ff20f2d3cef", "training_seconds": 300.0, "wall_seconds": 486.8152603060007}], "metric": 0.968588974830216, "parent_id": "t0096", "patch_path": "/data3/zhubaiyu/fengheguai/campaigns/h200-claude/artifacts/t0101/change.patch", "patch_sha256": "a6831700e15f5f110df60f559cb092c56791d7ff516389b05f6782b7ae40ab08", "promoted": false, "proposal": {"change_summary": "One constant changed on champion t0096: WARMDOWN_RATIO from 0.5 to 0.35, so the full rate is held until 65 percent of the time budget and the decay to the 0.1 floor occupies the final 35 percent. WARMUP_RATIO stays 0.0 and FINAL_LR_FRAC stays 0.1, which t0099 measured as non-binding at 0.2 and t0100 showed regresses by 0.001872 at 0.4. The averaging mechanism is unchanged and settled at EMA_START 0.7 with EMA_DECAY 0.99. Note that the averaging phase and the anneal now overlap differently: averaging still begins at 70 percent of the budget, which is now inside the decay rather than at its midpoint.", "command": ["/usr/bin/python3", "/data3/zhubaiyu/fengheguai/fengheguai/rendezvous_agent.py", "--trial", "/data3/zhubaiyu/fengheguai/campaigns/h200-claude/nodes/t0101", "--result", "/data3/zhubaiyu/fengheguai/campaigns/h200-claude/nodes/t0101/.fengheguai-agent-result.json", "--schema", "/data3/zhubaiyu/fengheguai/campaigns/h200-claude/control/agent_output.schema.json", "--campaign", "/data3/zhubaiyu/fengheguai/campaigns/h200-claude", "--inbox", "/data3/zhubaiyu/fengheguai/campaigns/h200-claude-rendezvous"], "errors": [], "expected_val_bpb_effect": "Expected between a 0.001 decrease and a 0.001 increase versus champion t0096 at 0.967286, with step count unchanged. The specific prediction is that the 0.000758 which this change cost before averaging existed should now be smaller or reversed; a result close to that original penalty would mean the anneal was never mainly about settling the endpoint and the EMA does not substitute for it.", "hypothesis": "The warmdown fraction was measured before weight averaging existed, and averaging is exactly what made its cost avoidable. t0026 shortened the anneal from 0.5 to 0.35 and lost 0.000758, and t0020 lengthened it to 0.8 and lost 0.001467, so 0.5 was bracketed. But the reason a short anneal costs is that the model reaches the end of training less settled, and t0096 introduced an EMA that settles it, with t0099 then showing the schedule endpoint no longer influences the locked score across a doubling of the floor. If the endpoint is now handled by the average, the anneal is buying less than it did and the budget it consumes is better spent at full rate: shortening to 0.35 returns 15 percent of the run, roughly 430 steps, to the flat phase. This recipe has also shown repeatedly that it is expensive to deprive of full-rate steps, since a 2 percent warmup cost 0.001875 in t0061, which is the same quantity being bought back here.", "log_path": "/data3/zhubaiyu/fengheguai/campaigns/h200-claude/artifacts/t0101/agent.log", "return_code": 0, "risk": "I pre-committed in t0100 to following a regression with FINAL_LR_FRAC 0.3, and I am not doing that. The reason is that every measurement on that axis has been a null or worse, so locating the exact edge of the flat region has no bearing on the champion; it is scientific tidiness with no expected value against the objective. This node spends the trial on the consequence of that finding instead. The real risk here is the overlap I noted above: with a 0.35 warmdown the EMA now starts at 70 percent of the budget, one third of the way into the decay rather than at its start, so the average is taken over a rate that is still falling steeply, and a regression could reflect that interaction rather than the anneal length itself.", "success": true, "timed_out": false}, "secondary_parent_id": null, "selection_reason": "The current line is stalled; make a structurally different bet.", "source_sha256": "4151c40df861fe6bb12799e3da7568ce72d5cbf43cad2dc1c21a4ff20f2d3cef", "stage": "explore", "status": "discard", "training_seconds": 300.0, "trial_id": "t0101", "workspace": "/data3/zhubaiyu/fengheguai/campaigns/h200-claude/nodes/t0101"}, "prev_hash": "f31113e245d3d2883ef27364ad863d18a3033233779bcc857da03c04c31f4b29", "seq": 204, "timestamp": "2026-08-21T06:32:30.496078+00:00"}
{"hash": "f6e2a2b70414276d21a2b34d1d895401c62b66d6a3d227bf0de6526bd4156e13", "kind": "trial_started", "payload": {"parent_id": "t0096", "reason": "The current line is stalled; make a structurally different bet.", "secondary_parent_id": null, "stage": "explore", "trial_id": "t0102"}, "prev_hash": "a9cc40edc66bb14f0e8d71c73ead734285699e7ab6c12ed8fc0287c92c3c0676", "seq": 205, "timestamp": "2026-08-21T06:32:30.553143+00:00"}
{"hash": "fbf2168faa54433ac0f218141775ed2d109bdc5b20de89e2427323079f241cd3", "kind": "trial_completed", "payload": {"champion_before": "t0096", "debug_depth": 0, "delta_vs_champion_before": 0.0007212267529373984, "delta_vs_parent": 0.0007212267529373984, "finding": "t0102 did not improve the prior champion: val_bpb=0.968007, delta=+0.000721. Hypothesis: The anneal has been measured for length but never for shape. Its fraction of the budget is bracketed at 0.5, with 0.35 costing 0.000758 before averaging and 0.001303 after, and 0.8 costing 0.001467; its endpoint is bracketed with 0.2 an exact null and 0.4 costing 0.001872. Throughout, the decay itself has been linear in elapsed time, which is a choice rather than a necessity, and this recipe has proved unusually sensitive to how full-rate time is spent: a 2 percent warmup cost 0.001875 in t0061. A cosine anneal between the same two endpoints keeps the rate near its peak for longer at the start of the decay and flattens again as it approaches the floor, front-loading rate where the model still benefits from it and settling more gently at the end. Given that t0101 just showed the anneal does real work beyond endpoint settling, changing how that work is distributed is the natural remaining question.", "measurements": [{"command": ["/data/home/zhubaiyu/.local/bin/uv", "run", "--project", "/data3/zhubaiyu/fengheguai/campaigns/h200-claude/nodes/t0102", "python", "/data3/zhubaiyu/fengheguai/fengheguai/_audit_runner.py", "--target", "/data3/zhubaiyu/fengheguai/campaigns/h200-claude/nodes/t0102", "--nonce", "43cfb8a531ec088cc28d8fcc817594ea7f5ee62090da90a4"], "errors": [], "evidence_path": "/data3/zhubaiyu/fengheguai/campaigns/h200-claude/evidence/t0102-r0/evidence.json", "evidence_sha256": "ef273032d99a38cf7492c07604929848081907328158a9b77c6b150011a180c2", "log_path": "/data3/zhubaiyu/fengheguai/campaigns/h200-claude/evidence/t0102-r0/run.log", "log_sha256": "8ff3cac2232ddc33f0637a0307b29c76ae5e089b7715c84ee047532a397de3d5", "metric": 0.9680071413007844, "num_steps": 2871, "peak_vram_mb": 34168.4, "return_code": 0, "status": "valid", "timed_out": false, "train_sha256": "95ab209efde8a3800fd9f890d6b24cb74b1f4133e203b53001ab4300e2c47a28", "training_seconds": 300.1, "wall_seconds": 486.73981041368097}], "metric": 0.9680071413007844, "parent_id": "t0096", "patch_path": "/data3/zhubaiyu/fengheguai/campaigns/h200-claude/artifacts/t0102/change.patch", "patch_sha256": "43b878cb52c4860701e1290af1f3e6b5587b58d100d18b038c4cf7532a8d2876", "promoted": false, "proposal": {"change_summary": "One expression changed on champion t0096: the warmdown segment of get_lr_multiplier from a linear interpolation to a cosine between the identical endpoints, 1.0 at the start of the decay and FINAL_LR_FRAC at its end. WARMDOWN_RATIO stays at its bracketed 0.5, WARMUP_RATIO stays 0.0 and FINAL_LR_FRAC stays 0.1, so the schedule occupies the same span and terminates at the same value; only the path between them differs. The averaging mechanism is unchanged at EMA_START 0.7 and EMA_DECAY 0.99, and because the warmdown length is unchanged the two remain independent, unlike in t0101. Everything else matches the champion, including the corrected value-embedding init, VALUE_EMBEDDING_LR 0.3, depth 12, the SSL pattern with a 256-token short span, document masking, output softcap 13, batch 2**17 and WEIGHT_DECAY 0.146.", "command": ["/usr/bin/python3", "/data3/zhubaiyu/fengheguai/fengheguai/rendezvous_agent.py", "--trial", "/data3/zhubaiyu/fengheguai/campaigns/h200-claude/nodes/t0102", "--result", "/data3/zhubaiyu/fengheguai/campaigns/h200-claude/nodes/t0102/.fengheguai-agent-result.json", "--schema", "/data3/zhubaiyu/fengheguai/campaigns/h200-claude/control/agent_output.schema.json", "--campaign", "/data3/zhubaiyu/fengheguai/campaigns/h200-claude", "--inbox", "/data3/zhubaiyu/fengheguai/campaigns/h200-claude-rendezvous"], "errors": [], "expected_val_bpb_effect": "Expected between a 0.001 decrease and a 0.001 increase versus champion t0096 at 0.967286, with step count unchanged since the schedule costs nothing to evaluate. Cosine spends more of the decay at high rate than linear does, which this recipe has consistently rewarded, and it also approaches the floor more gently, which suits a run whose endpoint is now averaged; those two effects point the same way, which is the reason to expect a gain rather than a wash.", "hypothesis": "The anneal has been measured for length but never for shape. Its fraction of the budget is bracketed at 0.5, with 0.35 costing 0.000758 before averaging and 0.001303 after, and 0.8 costing 0.001467; its endpoint is bracketed with 0.2 an exact null and 0.4 costing 0.001872. Throughout, the decay itself has been linear in elapsed time, which is a choice rather than a necessity, and this recipe has proved unusually sensitive to how full-rate time is spent: a 2 percent warmup cost 0.001875 in t0061. A cosine anneal between the same two endpoints keeps the rate near its peak for longer at the start of the decay and flattens again as it approaches the floor, front-loading rate where the model still benefits from it and settling more gently at the end. Given that t0101 just showed the anneal does real work beyond endpoint settling, changing how that work is distributed is the natural remaining question.", "log_path": "/data3/zhubaiyu/fengheguai/campaigns/h200-claude/artifacts/t0102/agent.log", "return_code": 0, "risk": "The weight-decay schedule is driven by the same progress variable but is not reshaped, so the effective decay term lr times wd now follows a different trajectory through the tail than it did when WEIGHT_DECAY was tuned to 0.146; that constant was derived by matching a cumulative integral and the integral changes here, which this node does not correct. A regression could therefore reflect a decay mismatch rather than the rate shape. If it regresses I will not reshape the decay schedule to match, since t0049 and t0050 already showed that coupling the two schedules costs more than it recovers.", "success": true, "timed_out": false}, "secondary_parent_id": null, "selection_reason": "The current line is stalled; make a structurally different bet.", "source_sha256": "95ab209efde8a3800fd9f890d6b24cb74b1f4133e203b53001ab4300e2c47a28", "stage": "explore", "status": "discard", "training_seconds": 300.1, "trial_id": "t0102", "workspace": "/data3/zhubaiyu/fengheguai/campaigns/h200-claude/nodes/t0102"}, "prev_hash": "f6e2a2b70414276d21a2b34d1d895401c62b66d6a3d227bf0de6526bd4156e13", "seq": 206, "timestamp": "2026-08-21T06:42:27.843933+00:00"}
{"hash": "70ad433240685068d81546b29daf43bbdf4c41a5ce97932f7ce5f4ef921ce143", "kind": "trial_started", "payload": {"parent_id": "t0096", "reason": "The current line is stalled; make a structurally different bet.", "secondary_parent_id": null, "stage": "explore", "trial_id": "t0103"}, "prev_hash": "fbf2168faa54433ac0f218141775ed2d109bdc5b20de89e2427323079f241cd3", "seq": 207, "timestamp": "2026-08-21T06:42:27.918801+00:00"}
{"hash": "3ef7f8b8f9b8e31e83f58912ff310191c04a7a14aad0a5bca55ae903fc8741f0", "kind": "trial_completed", "payload": {"champion_before": "t0096", "debug_depth": 0, "delta_vs_champion_before": 0.0072038376481259325, "delta_vs_parent": 0.0072038376481259325, "finding": "t0103 did not improve the prior champion: val_bpb=0.974490, delta=+0.007204. Hypothesis: Averaging the endpoint of the trajectory paid 0.001103 in t0096, and the natural question is whether averaging the trajectory itself pays too. Lookahead does that: a slow copy of the weights follows the fast ones by a fraction alpha every k steps, and the fast weights are then reset onto the slow copy, so the optimizer explores from a point that is itself an average of recent iterates rather than from the latest one. It is a different intervention from the EMA, which only changes what is evaluated and never influences training, whereas this changes the path. The conditions here favour it: the run takes about 2870 steps at a batch of 2**17, which is the noisiest per-step gradient this campaign has used, and t0096 established that this model reaches its end as a noisy draw rather than a converged point. The cost is small and checkable, roughly 1GB of traffic every five steps against a 105ms step.", "measurements": [{"command": ["/data/home/zhubaiyu/.local/bin/uv", "run", "--project", "/data3/zhubaiyu/fengheguai/campaigns/h200-claude/nodes/t0103", "python", "/data3/zhubaiyu/fengheguai/fengheguai/_audit_runner.py", "--target", "/data3/zhubaiyu/fengheguai/campaigns/h200-claude/nodes/t0103", "--nonce", "9aa89018b68e73ed0e044177a2b3adbd82004fbc3301b313"], "errors": [], "evidence_path": "/data3/zhubaiyu/fengheguai/campaigns/h200-claude/evidence/t0103-r0/evidence.json", "evidence_sha256": "f804c95061d9b2cee33f48785f1cde4cc3ae17584e65352f50fc59507e191469", "log_path": "/data3/zhubaiyu/fengheguai/campaigns/h200-claude/evidence/t0103-r0/run.log", "log_sha256": "cabb907a1d8f073f5fa808d56bbc6398f5c506b71f18ae7d8a0ac1fb47e2473f", "metric": 0.9744897521959729, "num_steps": 2861, "peak_vram_mb": 34536.4, "return_code": 0, "status": "valid", "timed_out": false, "train_sha256": "5527c46818034dae2a022f6c3c9c709c07376982a0bee7828a8377282394733f", "training_seconds": 300.1, "wall_seconds": 486.2922847541049}], "metric": 0.9744897521959729, "parent_id": "t0096", "patch_path": "/data3/zhubaiyu/fengheguai/campaigns/h200-claude/artifacts/t0103/change.patch", "patch_sha256": "242ccc4e8feb89185f07b8db63893c7d9b55ec710a48c928081d7742855f0bf3", "promoted": false, "proposal": {"change_summary": "Lookahead added to champion t0096, with LOOKAHEAD_K of 5 and LOOKAHEAD_ALPHA of 0.5. Every fifth optimizer step, an fp32 slow copy of every parameter is moved halfway toward the live weights and the live weights are copied back from it. The existing endpoint EMA is retained unchanged at EMA_START 0.7 and EMA_DECAY 0.99, so the two mechanisms coexist: Lookahead shapes the trajectory during training, the EMA denoises what is finally evaluated. Everything else matches the champion, including the linear anneal that t0102 confirmed beats cosine, WARMDOWN_RATIO 0.5, FINAL_LR_FRAC 0.1, the corrected value-embedding init, VALUE_EMBEDDING_LR 0.3, depth 12, the SSL pattern with a 256-token short span, document masking, output softcap 13, batch 2**17 and WEIGHT_DECAY 0.146.", "command": ["/usr/bin/python3", "/data3/zhubaiyu/fengheguai/fengheguai/rendezvous_agent.py", "--trial", "/data3/zhubaiyu/fengheguai/campaigns/h200-claude/nodes/t0103", "--result", "/data3/zhubaiyu/fengheguai/campaigns/h200-claude/nodes/t0103/.fengheguai-agent-result.json", "--schema", "/data3/zhubaiyu/fengheguai/campaigns/h200-claude/control/agent_output.schema.json", "--campaign", "/data3/zhubaiyu/fengheguai/campaigns/h200-claude", "--inbox", "/data3/zhubaiyu/fengheguai/campaigns/h200-claude-rendezvous"], "errors": [], "expected_val_bpb_effect": "Expected between a 0.002 decrease and a 0.003 increase versus champion t0096 at 0.967286, with step count falling by perhaps one percent from 2870. The range is wide in both directions because this is the first change in many trials that alters the optimisation path rather than a coefficient in it, and because it interacts with two optimizers at once: the Muon groups carry their own momentum and NorMuon variance buffers, and resetting the parameters underneath those buffers every five steps is not something either was designed for.", "hypothesis": "Averaging the endpoint of the trajectory paid 0.001103 in t0096, and the natural question is whether averaging the trajectory itself pays too. Lookahead does that: a slow copy of the weights follows the fast ones by a fraction alpha every k steps, and the fast weights are then reset onto the slow copy, so the optimizer explores from a point that is itself an average of recent iterates rather than from the latest one. It is a different intervention from the EMA, which only changes what is evaluated and never influences training, whereas this changes the path. The conditions here favour it: the run takes about 2870 steps at a batch of 2**17, which is the noisiest per-step gradient this campaign has used, and t0096 established that this model reaches its end as a noisy draw rather than a converged point. The cost is small and checkable, roughly 1GB of traffic every five steps against a 105ms step.", "log_path": "/data3/zhubaiyu/fengheguai/campaigns/h200-claude/artifacts/t0103/agent.log", "return_code": 0, "risk": "That interaction is the main hazard and it is specific. Muon maintains a momentum buffer and a second-moment buffer keyed to the parameters it is updating, and Adam maintains exp_avg and exp_avg_sq likewise; Lookahead rewrites the parameters without touching any of that state, so for five steps after each sync the optimizers are correcting a trajectory that no longer exists. Standard Lookahead accepts this, but standard Lookahead is usually paired with plain SGD or Adam rather than with an orthogonalised update whose scale is set by a running variance estimate. If it regresses sharply, that mismatch is the likeliest cause rather than the averaging idea, and the informative follow-up would be a larger k rather than a different alpha.", "success": true, "timed_out": false}, "secondary_parent_id": null, "selection_reason": "The current line is stalled; make a structurally different bet.", "source_sha256": "5527c46818034dae2a022f6c3c9c709c07376982a0bee7828a8377282394733f", "stage": "explore", "status": "discard", "training_seconds": 300.1, "trial_id": "t0103", "workspace": "/data3/zhubaiyu/fengheguai/campaigns/h200-claude/nodes/t0103"}, "prev_hash": "70ad433240685068d81546b29daf43bbdf4c41a5ce97932f7ce5f4ef921ce143", "seq": 208, "timestamp": "2026-08-21T06:51:48.744054+00:00"}
{"hash": "9ac39a6fec7ba388c7301e28bd3fdf220a0608df11b529b055e049a840583399", "kind": "trial_started", "payload": {"parent_id": "t0096", "reason": "The current line is stalled; make a structurally different bet.", "secondary_parent_id": null, "stage": "explore", "trial_id": "t0104"}, "prev_hash": "3ef7f8b8f9b8e31e83f58912ff310191c04a7a14aad0a5bca55ae903fc8741f0", "seq": 209, "timestamp": "2026-08-21T06:51:48.802053+00:00"}
