{"hash": "9b1ed6383b812fdc7cabfa82871c13fdc30da6831064c3a4d2e07f633e0b0c7c", "kind": "trial_completed", "payload": {"champion_before": "t0089", "debug_depth": 0, "delta_vs_champion_before": 0.012428615107652474, "delta_vs_parent": 0.012428615107652474, "finding": "t0095 did not improve the prior champion: val_bpb=0.980817, delta=+0.012429. Hypothesis: The MLP nonlinearity is the last untouched component of the transformer block. Every other part has been measured: attention span and pattern, head width and count, value embeddings and their gate, the residual and skip scalars, depth, width and the MLP expansion ratio. The activation is squared ReLU, which is the modded-nanogpt lineage choice and is plausibly tuned, but it has never been tested here and it sits on the path carrying two thirds of the matrix FLOPs. GELU is the natural comparison: same parameter count, same FLOP count to within a rounding error, no change to any other quantity, and a materially different shape, being smooth and slightly negative near zero rather than exactly zero below the origin and quadratic above it. If squared ReLU is load-bearing rather than incidental this should regress and the block is then fully characterised.", "measurements": [{"command": ["/data/home/zhubaiyu/.local/bin/uv", "run", "--project", "/data3/zhubaiyu/fengheguai/campaigns/h200-claude/nodes/t0095", "python", "/data3/zhubaiyu/fengheguai/fengheguai/_audit_runner.py", "--target", "/data3/zhubaiyu/fengheguai/campaigns/h200-claude/nodes/t0095", "--nonce", "6514e262a1fc71b234df80bd0a7d5237b5f549751c598efd"], "errors": [], "evidence_path": "/data3/zhubaiyu/fengheguai/campaigns/h200-claude/evidence/t0095-r0/evidence.json", "evidence_sha256": "7999eb3c1b48f94bfd5e223bffae874528eb94bacf41e9cc24d7ed6b946690a7", "log_path": "/data3/zhubaiyu/fengheguai/campaigns/h200-claude/evidence/t0095-r0/run.log", "log_sha256": "0434200dd4096f846c35aaa6e32063e288c2e01c9bbd370c93ee34c431728931", "metric": 0.9808173537010051, "num_steps": 2710, "peak_vram_mb": 33800.4, "return_code": 0, "status": "valid", "timed_out": false, "train_sha256": "051c13fa5f008e36d5fbdec61401114f99f5b962fe357442433dd602706d437c", "training_seconds": 300.1, "wall_seconds": 563.0717317676172}], "metric": 0.9808173537010051, "parent_id": "t0089", "patch_path": "/data3/zhubaiyu/fengheguai/campaigns/h200-claude/artifacts/t0095/change.patch", "patch_sha256": "3397de2859469444556aeaf5b734e513103732026fcee4f9cd728b0f680ff871", "promoted": false, "proposal": {"change_summary": "One expression changed on champion t0089: the MLP activation from F.relu(x).square() to F.gelu(x). Parameter count and per-token FLOPs are unchanged, and no other component moves. CORRECTION TO THE t0092 RECORD, carried here because the ledger is append-only: that node claimed fp32 value embeddings improved quality per step, citing loss 3.013 at step 1000 against the champion 3.029. That comparison was invalid. The learning-rate schedule is driven by elapsed training time, not step index, so at step 1000 the slower t0092 had consumed 55 percent of its budget and was already annealing at lrm 0.90 while the champion was still at full rate with lrm 1.00; lower loss at equal step count is what annealing produces. t0094 settles it: with fp32 moments the step count is preserved at 2871 against 2875 and the loss at step 1000 is 3.029348 against 3.029267, identical. There was no precision effect on this path. t0092 had a throughput cost and no quality benefit, and the precision direction is abandoned rather than relocated again, as pre-committed in t0094.", "command": ["/usr/bin/python3", "/data3/zhubaiyu/fengheguai/fengheguai/rendezvous_agent.py", "--trial", "/data3/zhubaiyu/fengheguai/campaigns/h200-claude/nodes/t0095", "--result", "/data3/zhubaiyu/fengheguai/campaigns/h200-claude/nodes/t0095/.fengheguai-agent-result.json", "--schema", "/data3/zhubaiyu/fengheguai/campaigns/h200-claude/control/agent_output.schema.json", "--campaign", "/data3/zhubaiyu/fengheguai/campaigns/h200-claude", "--inbox", "/data3/zhubaiyu/fengheguai/campaigns/h200-claude-rendezvous"], "errors": [], "expected_val_bpb_effect": "Expected between a 0.001 decrease and a 0.003 increase versus champion t0089 at 0.968389, with step count essentially unchanged. Squared ReLU was chosen deliberately upstream and seventeen of the eighteen inherited defaults tested in this campaign have proved optimal, so a regression is the likely outcome; the value is in closing the last unmeasured component of the block rather than in an expected gain.", "hypothesis": "The MLP nonlinearity is the last untouched component of the transformer block. Every other part has been measured: attention span and pattern, head width and count, value embeddings and their gate, the residual and skip scalars, depth, width and the MLP expansion ratio. The activation is squared ReLU, which is the modded-nanogpt lineage choice and is plausibly tuned, but it has never been tested here and it sits on the path carrying two thirds of the matrix FLOPs. GELU is the natural comparison: same parameter count, same FLOP count to within a rounding error, no change to any other quantity, and a materially different shape, being smooth and slightly negative near zero rather than exactly zero below the origin and quadratic above it. If squared ReLU is load-bearing rather than incidental this should regress and the block is then fully characterised.", "log_path": "/data3/zhubaiyu/fengheguai/campaigns/h200-claude/artifacts/t0095/agent.log", "return_code": 0, "risk": "GELU saturates smoothly toward zero for negative inputs while squared ReLU is exactly zero there, so the two differ most in how much of the hidden layer stays active, and the zero-initialised c_proj means the block starts contributing nothing either way, which delays any divergence rather than preventing it. A regression will not distinguish between the shape of the nonlinearity and its effect on effective width, and I do not intend to spend a second node separating those given how consistently the inherited defaults have measured optimal.", "success": true, "timed_out": false}, "secondary_parent_id": null, "selection_reason": "The current line is stalled; make a structurally different bet.", "source_sha256": "051c13fa5f008e36d5fbdec61401114f99f5b962fe357442433dd602706d437c", "stage": "explore", "status": "discard", "training_seconds": 300.1, "trial_id": "t0095", "workspace": "/data3/zhubaiyu/fengheguai/campaigns/h200-claude/nodes/t0095"}, "prev_hash": "7f9fb244f222c072de57ab3fdf39a614a32ac6f4712a7cfdabf2b5dc131f2f3d", "seq": 192, "timestamp": "2026-08-21T05:31:50.715069+00:00"}
{"hash": "c72ef5cf37a456fe4e93176354e31440ab464f731e937e466b5886d5c52b5e14", "kind": "trial_started", "payload": {"parent_id": "t0089", "reason": "The current line is stalled; make a structurally different bet.", "secondary_parent_id": null, "stage": "explore", "trial_id": "t0096"}, "prev_hash": "9b1ed6383b812fdc7cabfa82871c13fdc30da6831064c3a4d2e07f633e0b0c7c", "seq": 193, "timestamp": "2026-08-21T05:31:50.771641+00:00"}
{"hash": "9e8b8e11905f235632cb1cf87ffacc4a7707babcec92f1bdad39c4eec0eeaa4e", "kind": "trial_completed", "payload": {"champion_before": "t0089", "debug_depth": 0, "delta_vs_champion_before": -0.001102824045505657, "delta_vs_parent": -0.001102824045505657, "finding": "t0096 improved the prior champion: val_bpb=0.967286, delta=-0.001103. Hypothesis: Weight averaging was dismissed early in this campaign on a premise that has since become false. The argument then was that the schedule anneals the rate to zero, so the final weights are already settled and Polyak averaging has nothing to denoise. That stopped being true at t0048, which introduced FINAL_LR_FRAC of 0.1 and was promoted: the model now finishes training at a tenth of peak rate, still taking meaningful steps, so its final parameters are a single noisy draw from a distribution rather than a converged point. Averaging the tail of the trajectory should land closer to the centre of that distribution than any individual endpoint. The cost is small and can be checked rather than assumed: the averaged copy is about 96M parameters, so each update moves roughly 1GB of memory traffic against a 105ms step, which is well under one percent.", "measurements": [{"command": ["/data/home/zhubaiyu/.local/bin/uv", "run", "--project", "/data3/zhubaiyu/fengheguai/campaigns/h200-claude/nodes/t0096", "python", "/data3/zhubaiyu/fengheguai/fengheguai/_audit_runner.py", "--target", "/data3/zhubaiyu/fengheguai/campaigns/h200-claude/nodes/t0096", "--nonce", "16c4437b80be6dd6a298ddabb38c465fafcf94e47e0210d6"], "errors": [], "evidence_path": "/data3/zhubaiyu/fengheguai/campaigns/h200-claude/evidence/t0096-r0/evidence.json", "evidence_sha256": "8518af68ba38c36b02b4429faaba6018fa2f6c98486eeefd11e4433339d65936", "log_path": "/data3/zhubaiyu/fengheguai/campaigns/h200-claude/evidence/t0096-r0/run.log", "log_sha256": "acfbfdc4a4a275342f31e20ef27c7123e85d8babb77c100978e428cbb097e53d", "metric": 0.9672627308435461, "num_steps": 2869, "peak_vram_mb": 34168.4, "return_code": 0, "status": "valid", "timed_out": false, "train_sha256": "5220624e530e75f08d67477e7b7561d4dc555cd26d079a3486938bf463556adf", "training_seconds": 300.0, "wall_seconds": 486.6355797601864}, {"command": ["/data/home/zhubaiyu/.local/bin/uv", "run", "--project", "/data3/zhubaiyu/fengheguai/campaigns/h200-claude/nodes/t0096", "python", "/data3/zhubaiyu/fengheguai/fengheguai/_audit_runner.py", "--target", "/data3/zhubaiyu/fengheguai/campaigns/h200-claude/nodes/t0096", "--nonce", "a3c25f1843c0fb0151c573f4ecf8577ed79d249be1dda42b"], "errors": [], "evidence_path": "/data3/zhubaiyu/fengheguai/campaigns/h200-claude/evidence/t0096-r1/evidence.json", "evidence_sha256": "39c6b1b83fc76baaf2f92e420e0807bfb683622a2f27d39ab2079b159a283e76", "log_path": "/data3/zhubaiyu/fengheguai/campaigns/h200-claude/evidence/t0096-r1/run.log", "log_sha256": "6ffd14ac577e1d55ae7cb7f31e214536b9a8083f702f29cb1fe0d7ced4a50737", "metric": 0.9673090982521477, "num_steps": 2872, "peak_vram_mb": 34168.4, "return_code": 0, "status": "valid", "timed_out": false, "train_sha256": "5220624e530e75f08d67477e7b7561d4dc555cd26d079a3486938bf463556adf", "training_seconds": 300.0, "wall_seconds": 481.3544411351904}], "metric": 0.967285914547847, "parent_id": "t0089", "patch_path": "/data3/zhubaiyu/fengheguai/campaigns/h200-claude/artifacts/t0096/change.patch", "patch_sha256": "1b255eccd2a81d000478f0392f59f07f0ecfc9e48ddd2861bbd55082ae18eafc", "promoted": true, "proposal": {"change_summary": "Polyak weight averaging added to champion t0089. Two constants are introduced, EMA_START at 0.7 and EMA_DECAY at 0.99. After each optimizer step past 70 percent of the time budget, an fp32 running average of every parameter is updated by lerp, and immediately before the single locked evaluate_bpb call the averaged weights are copied into the model. With about 2875 steps and 30 percent of the budget in the averaging phase, the window covers roughly 860 steps at a decay of 0.99, an effective horizon near 100 steps. Nothing else changes: the averaging is computed purely from training parameters, touches no validation data, and the evaluation remains exactly one ordinary call to the immutable evaluator, which scores whatever weights the model holds at that moment.", "command": ["/usr/bin/python3", "/data3/zhubaiyu/fengheguai/fengheguai/rendezvous_agent.py", "--trial", "/data3/zhubaiyu/fengheguai/campaigns/h200-claude/nodes/t0096", "--result", "/data3/zhubaiyu/fengheguai/campaigns/h200-claude/nodes/t0096/.fengheguai-agent-result.json", "--schema", "/data3/zhubaiyu/fengheguai/campaigns/h200-claude/control/agent_output.schema.json", "--campaign", "/data3/zhubaiyu/fengheguai/campaigns/h200-claude", "--inbox", "/data3/zhubaiyu/fengheguai/campaigns/h200-claude-rendezvous"], "errors": [], "expected_val_bpb_effect": "Expected between a 0.002 decrease and a 0.001 increase versus champion t0089 at 0.968389. The averaging happens inside the timed region so its cost is charged honestly to the 300 seconds, and num_steps should fall by well under one percent from 2875 if the traffic estimate is right; a larger fall would mean the estimate was wrong, which is a live possibility given that t0092 slowed by 100ms per step for reasons my memory-traffic arithmetic did not predict.", "hypothesis": "Weight averaging was dismissed early in this campaign on a premise that has since become false. The argument then was that the schedule anneals the rate to zero, so the final weights are already settled and Polyak averaging has nothing to denoise. That stopped being true at t0048, which introduced FINAL_LR_FRAC of 0.1 and was promoted: the model now finishes training at a tenth of peak rate, still taking meaningful steps, so its final parameters are a single noisy draw from a distribution rather than a converged point. Averaging the tail of the trajectory should land closer to the centre of that distribution than any individual endpoint. The cost is small and can be checked rather than assumed: the averaged copy is about 96M parameters, so each update moves roughly 1GB of memory traffic against a 105ms step, which is well under one percent.", "log_path": "/data3/zhubaiyu/fengheguai/campaigns/h200-claude/artifacts/t0096/agent.log", "return_code": 0, "risk": "The decay and the start point are guesses rather than measurements, and they interact: a 0.99 decay over an 860-step window averages over roughly the last 100 steps, which may be too short to denoise or long enough to drag in weights from a materially higher learning rate. The deeper risk is that averaging fights the annealing schedule, since the whole point of a decaying rate is to settle the model, and if the last 30 percent is already settled then the average is over a stationary point and this measures nothing. If it regresses I will not tune the two constants; the honest reading would be that the schedule already does this job.", "success": true, "timed_out": false}, "secondary_parent_id": null, "selection_reason": "The current line is stalled; make a structurally different bet.", "source_sha256": "5220624e530e75f08d67477e7b7561d4dc555cd26d079a3486938bf463556adf", "stage": "explore", "status": "keep", "training_seconds": 300.0, "trial_id": "t0096", "workspace": "/data3/zhubaiyu/fengheguai/campaigns/h200-claude/nodes/t0096"}, "prev_hash": "c72ef5cf37a456fe4e93176354e31440ab464f731e937e466b5886d5c52b5e14", "seq": 194, "timestamp": "2026-08-21T05:49:19.576373+00:00"}
{"hash": "f2788687c1abb11b38e2b8e501d0880f205672df74fe901589317343436358b7", "kind": "trial_started", "payload": {"parent_id": "t0096", "reason": "Exploit a top-K branch selected by quality plus an under-exploration bonus.", "secondary_parent_id": null, "stage": "refine", "trial_id": "t0097"}, "prev_hash": "9e8b8e11905f235632cb1cf87ffacc4a7707babcec92f1bdad39c4eec0eeaa4e", "seq": 195, "timestamp": "2026-08-21T05:49:19.632718+00:00"}
{"hash": "910e66a1905b5a72be4c3498f7235d1a2901818b59c024fba65c081120884ec8", "kind": "trial_completed", "payload": {"champion_before": "t0096", "debug_depth": 0, "delta_vs_champion_before": 0.00015900375292610125, "delta_vs_parent": 0.00015900375292610125, "finding": "t0097 did not improve the prior champion: val_bpb=0.967445, delta=+0.000159. Hypothesis: Weight averaging gained 0.001103, the largest single improvement in the last forty trials, and its window has not been tuned. The mechanism is specific: FINAL_LR_FRAC of 0.1 means the model never fully anneals, so its final parameters are one noisy draw rather than a converged point, and averaging the tail lands nearer the centre of that distribution. The averaging cost almost nothing in throughput, 2870 steps against the champion 2875, so the trade is nearly free and the only question is the window length. The decay sets that window: at 0.99 the effective horizon is about 100 steps, roughly the last 3 percent of a 2870-step run. If the endpoint noise is what is being removed, a longer horizon should remove more of it, up to the point where the average starts including weights from a materially higher learning rate. Raising the decay to 0.995 doubles the horizon to about 200 steps and tests that.", "measurements": [{"command": ["/data/home/zhubaiyu/.local/bin/uv", "run", "--project", "/data3/zhubaiyu/fengheguai/campaigns/h200-claude/nodes/t0097", "python", "/data3/zhubaiyu/fengheguai/fengheguai/_audit_runner.py", "--target", "/data3/zhubaiyu/fengheguai/campaigns/h200-claude/nodes/t0097", "--nonce", "434a67c4ee6a30be469ea021c0f6cc7fbfc362db471363cf"], "errors": [], "evidence_path": "/data3/zhubaiyu/fengheguai/campaigns/h200-claude/evidence/t0097-r0/evidence.json", "evidence_sha256": "ed6cebe0fdaf8b627e401c8490165541f39504e8f7c0a2c2e12d681227392bee", "log_path": "/data3/zhubaiyu/fengheguai/campaigns/h200-claude/evidence/t0097-r0/run.log", "log_sha256": "a7bfc4421371a24c0b636183cf1ebac9698256c9967bfd34205dd75cbd98bea9", "metric": 0.9674449183007731, "num_steps": 2868, "peak_vram_mb": 34168.4, "return_code": 0, "status": "valid", "timed_out": false, "train_sha256": "40903151b2762cddecfdbd4c0e70e60a8875ca0f599fa62364835ad5d275e08e", "training_seconds": 300.1, "wall_seconds": 355.66998925991356}], "metric": 0.9674449183007731, "parent_id": "t0096", "patch_path": "/data3/zhubaiyu/fengheguai/campaigns/h200-claude/artifacts/t0097/change.patch", "patch_sha256": "df0151ab9726f1855b34bb95979e15fc3e755f40d61e3c8f840bbbaac63dc735", "promoted": false, "proposal": {"change_summary": "One constant changed on champion t0096: EMA_DECAY from 0.99 to 0.995, doubling the effective averaging horizon from roughly 100 to roughly 200 steps. EMA_START stays 0.7, which is not the binding parameter: with about 860 steps in the averaging phase and a horizon of 200, the average has long since forgotten its starting point, so the decay alone sets the window. Everything else matches the champion, including the corrected value-embedding init, the decoupled VALUE_EMBEDDING_LR of 0.3, depth 12, the SSL pattern with a 256-token short span, document masking, output softcap 13, batch 2**17 and WEIGHT_DECAY 0.146.", "command": ["/usr/bin/python3", "/data3/zhubaiyu/fengheguai/fengheguai/rendezvous_agent.py", "--trial", "/data3/zhubaiyu/fengheguai/campaigns/h200-claude/nodes/t0097", "--result", "/data3/zhubaiyu/fengheguai/campaigns/h200-claude/nodes/t0097/.fengheguai-agent-result.json", "--schema", "/data3/zhubaiyu/fengheguai/campaigns/h200-claude/control/agent_output.schema.json", "--campaign", "/data3/zhubaiyu/fengheguai/campaigns/h200-claude", "--inbox", "/data3/zhubaiyu/fengheguai/campaigns/h200-claude-rendezvous"], "errors": [], "expected_val_bpb_effect": "Expected between a 0.0008 decrease and a 0.0005 increase versus champion t0096 at 0.967286, with step count unchanged since the update cost does not depend on the decay. The asymmetry reflects that the first application of averaging paid handsomely, so the axis is live, but a longer window necessarily reaches back into the run when the learning rate multiplier was higher and those weights are further from the endpoint the average is meant to estimate.", "hypothesis": "Weight averaging gained 0.001103, the largest single improvement in the last forty trials, and its window has not been tuned. The mechanism is specific: FINAL_LR_FRAC of 0.1 means the model never fully anneals, so its final parameters are one noisy draw rather than a converged point, and averaging the tail lands nearer the centre of that distribution. The averaging cost almost nothing in throughput, 2870 steps against the champion 2875, so the trade is nearly free and the only question is the window length. The decay sets that window: at 0.99 the effective horizon is about 100 steps, roughly the last 3 percent of a 2870-step run. If the endpoint noise is what is being removed, a longer horizon should remove more of it, up to the point where the average starts including weights from a materially higher learning rate. Raising the decay to 0.995 doubles the horizon to about 200 steps and tests that.", "log_path": "/data3/zhubaiyu/fengheguai/campaigns/h200-claude/artifacts/t0097/agent.log", "return_code": 0, "risk": "The two constants are not independent in principle even though they are here in practice: if a much longer horizon were tested it would eventually run past EMA_START and become clipped by it rather than by the decay, which would make the result about the start point rather than the window. At 0.995 that is not yet the case. The more likely failure is simply that 200 steps reaches into the part of the trajectory where the rate multiplier is still well above its floor, so the average is contaminated by weights the schedule was deliberately moving away from.", "success": true, "timed_out": false}, "secondary_parent_id": null, "selection_reason": "Exploit a top-K branch selected by quality plus an under-exploration bonus.", "source_sha256": "40903151b2762cddecfdbd4c0e70e60a8875ca0f599fa62364835ad5d275e08e", "stage": "refine", "status": "discard", "training_seconds": 300.1, "trial_id": "t0097", "workspace": "/data3/zhubaiyu/fengheguai/campaigns/h200-claude/nodes/t0097"}, "prev_hash": "f2788687c1abb11b38e2b8e501d0880f205672df74fe901589317343436358b7", "seq": 196, "timestamp": "2026-08-21T05:56:03.782967+00:00"}
{"hash": "37fef66f82d5f2a5589c3ba6bbbf6f442fd35832a7b03b9fb443d0242399d24e", "kind": "trial_started", "payload": {"parent_id": "t0096", "reason": "Recombine two independently strong branches at the scheduled synthesis step.", "secondary_parent_id": "t0097", "stage": "recombine", "trial_id": "t0098"}, "prev_hash": "910e66a1905b5a72be4c3498f7235d1a2901818b59c024fba65c081120884ec8", "seq": 197, "timestamp": "2026-08-21T05:56:03.837483+00:00"}
