{"hash": "c72b8d2b409488945f9530ca3f22a7019b0ee230eae58fb442ec1c812b6b83c7", "kind": "trial_completed", "payload": {"champion_before": "t0004", "debug_depth": 0, "delta_vs_champion_before": 0.0020900855291835496, "delta_vs_parent": 0.0019890616704237862, "finding": "t0006 did not improve the prior champion: val_bpb=0.983237, delta=+0.002090. Hypothesis: Attention head count, not head width, is the under-provisioned quantity in this configuration. With model_dim 512 and HEAD_DIM 128 the model runs only 4 attention heads, well below the 8 or more typical at this width. Because c_q, c_k, c_v and c_proj are all dim-to-dim projections, halving HEAD_DIM to 64 doubles the head count to 8 at exactly the same parameter count, and the FLOP model 12*n_head*head_dim*window is likewise unchanged because n_head*head_dim stays 512. This should buy strictly more attention expressivity for free and lower val_bpb.", "measurements": [{"command": ["/data/home/zhubaiyu/.local/bin/uv", "run", "--project", "/data3/zhubaiyu/fengheguai/campaigns/h200-claude/nodes/t0006", "python", "/data3/zhubaiyu/fengheguai/fengheguai/_audit_runner.py", "--target", "/data3/zhubaiyu/fengheguai/campaigns/h200-claude/nodes/t0006", "--nonce", "b2e9d6facd708f2634d96b33af5e9826faddfab6b0c79db9"], "errors": [], "evidence_path": "/data3/zhubaiyu/fengheguai/campaigns/h200-claude/evidence/t0006-r0/evidence.json", "evidence_sha256": "6f23347e19fdc6b125229a91fa8251f04439ef060e05b3d783255d96723c79b6", "log_path": "/data3/zhubaiyu/fengheguai/campaigns/h200-claude/evidence/t0006-r0/run.log", "log_sha256": "a8bc51867eeb8f459c6fd114282881e7561d400f8035e6fec25257f7a030de23", "metric": 0.983236733080541, "num_steps": 3957, "peak_vram_mb": 22749.7, "return_code": 0, "status": "valid", "timed_out": false, "train_sha256": "7af3aadbe280d21ec6e180bd3453b05bc62fc8e8adf13a51462382d9eadf9a2c", "training_seconds": 300.1, "wall_seconds": 476.5129504976794}], "metric": 0.983236733080541, "parent_id": "t0005", "patch_path": "/data3/zhubaiyu/fengheguai/campaigns/h200-claude/artifacts/t0006/change.patch", "patch_sha256": "be67e0a41deb278794b3ada0ec2f75aa96f5396061d8570923177d022d7eb8b0", "promoted": false, "proposal": {"change_summary": "Single-constant architectural change on elite branch t0005: HEAD_DIM 128 -> 64, which makes build_model_config produce n_head = n_kv_head = 8 instead of 4 at an unchanged model_dim of 512. Parameter count, estimated FLOPs per token, batch size 2**17, the halved learning rates, the 512-token short window, depth 8 and every schedule are unchanged.", "command": ["/usr/bin/python3", "/data3/zhubaiyu/fengheguai/fengheguai/rendezvous_agent.py", "--trial", "/data3/zhubaiyu/fengheguai/campaigns/h200-claude/nodes/t0006", "--result", "/data3/zhubaiyu/fengheguai/campaigns/h200-claude/nodes/t0006/.fengheguai-agent-result.json", "--schema", "/data3/zhubaiyu/fengheguai/campaigns/h200-claude/control/agent_output.schema.json", "--campaign", "/data3/zhubaiyu/fengheguai/campaigns/h200-claude", "--inbox", "/data3/zhubaiyu/fengheguai/campaigns/h200-claude-rendezvous"], "errors": [], "expected_val_bpb_effect": "Expected decrease of roughly 0.001-0.004 bpb versus parent t0005 at 0.981248, which would also put it below champion t0004 at 0.981147. Throughput should be close to neutral, and flash-attention-3 often runs a 64-wide head slightly faster than a 128-wide one, so any step-count change should be small and non-negative. If val_bpb rises, per-head capacity rather than head count is the binding constraint at this width.", "hypothesis": "Attention head count, not head width, is the under-provisioned quantity in this configuration. With model_dim 512 and HEAD_DIM 128 the model runs only 4 attention heads, well below the 8 or more typical at this width. Because c_q, c_k, c_v and c_proj are all dim-to-dim projections, halving HEAD_DIM to 64 doubles the head count to 8 at exactly the same parameter count, and the FLOP model 12*n_head*head_dim*window is likewise unchanged because n_head*head_dim stays 512. This should buy strictly more attention expressivity for free and lower val_bpb.", "log_path": "/data3/zhubaiyu/fengheguai/campaigns/h200-claude/artifacts/t0006/agent.log", "return_code": 0, "risk": "Rotary embeddings are now computed over 32 channel pairs instead of 64, and the per-head RMS norm applied to q and k acts on shorter vectors, so each head is individually less expressive. The ve_gate projection widens from 4 to 8 outputs, a negligible parameter change. There is a small chance the flash-attention-3 kernel is less efficient at head_dim 64 on this GPU, which would cost steps and confound the quality comparison; the reported num_steps will show this directly.", "success": true, "timed_out": false}, "secondary_parent_id": null, "selection_reason": "Exploit a top-K branch selected by quality plus an under-exploration bonus.", "source_sha256": "7af3aadbe280d21ec6e180bd3453b05bc62fc8e8adf13a51462382d9eadf9a2c", "stage": "refine", "status": "discard", "training_seconds": 300.1, "trial_id": "t0006", "workspace": "/data3/zhubaiyu/fengheguai/campaigns/h200-claude/nodes/t0006"}, "prev_hash": "9831eead3e1804c6d594142170b5e1132082d4bcdde3a58a313594ce3367e65e", "seq": 14, "timestamp": "2026-08-20T12:31:18.693894+00:00"}
{"hash": "2fbb86bdaa1eccdcb6b9a79ec6fcc079334cb5eb29b9033d9651e70b516fdc0c", "kind": "trial_started", "payload": {"parent_id": "t0004", "reason": "Recombine two independently strong branches at the scheduled synthesis step.", "secondary_parent_id": "t0005", "stage": "recombine", "trial_id": "t0007"}, "prev_hash": "c72b8d2b409488945f9530ca3f22a7019b0ee230eae58fb442ec1c812b6b83c7", "seq": 15, "timestamp": "2026-08-20T12:31:18.700191+00:00"}
{"hash": "4635640b52c58f6ecfc43bee49d1c3e56801cdd97e15b9e28a76c0f3d6915036", "kind": "trial_completed", "payload": {"champion_before": "t0004", "debug_depth": 0, "delta_vs_champion_before": 0.005992232112561058, "delta_vs_parent": 0.005992232112561058, "finding": "t0007 did not improve the prior champion: val_bpb=0.987139, delta=+0.005992. Hypothesis: The two elite branches differ only in where they sit on the batch-versus-learning-rate line, and they score within noise of each other, so the line is flat but its correct slope is still unknown. Three points now constrain it at batch 2**17: full 2**19 rates gave 0.986688, half rates gave 0.981248, and the champion at batch 2**18 with 1/sqrt(2) rates gave 0.981147. Because halving the rates recovered almost the entire t0003 penalty, the optimum at a 4x smaller batch may lie below the square-root prescription. This node combines the batch of t0005 with the rate-rescaling mechanism of t0004 pushed from square-root to linear scaling: batch 2**17 with all three rates at 1/4 of their 2**19 values. If linear scaling is the correct law for these orthogonalised Muon updates, this beats both elites.", "measurements": [{"command": ["/data/home/zhubaiyu/.local/bin/uv", "run", "--project", "/data3/zhubaiyu/fengheguai/campaigns/h200-claude/nodes/t0007", "python", "/data3/zhubaiyu/fengheguai/fengheguai/_audit_runner.py", "--target", "/data3/zhubaiyu/fengheguai/campaigns/h200-claude/nodes/t0007", "--nonce", "25adecc32ef9aaf616701d981da7f26240fc963170af5df4"], "errors": [], "evidence_path": "/data3/zhubaiyu/fengheguai/campaigns/h200-claude/evidence/t0007-r0/evidence.json", "evidence_sha256": "b6cc587567c38d1658b1aeb4716f39498f564cf304765198a820a808fed74573", "log_path": "/data3/zhubaiyu/fengheguai/campaigns/h200-claude/evidence/t0007-r0/run.log", "log_sha256": "ab5f930aa1b7e4cfc0a4756bed85f6b13146e80ed1bdd6d9d0827de81df54ee7", "metric": 0.9871388796639186, "num_steps": 4069, "peak_vram_mb": 22701.2, "return_code": 0, "status": "valid", "timed_out": false, "train_sha256": "c1c9ca8df16b705dfcf1d541b2cade7a1d569e83570aee80dbf0ac0dc527ebf0", "training_seconds": 300.1, "wall_seconds": 460.57437737379223}], "metric": 0.9871388796639186, "parent_id": "t0004", "patch_path": "/data3/zhubaiyu/fengheguai/campaigns/h200-claude/artifacts/t0007/change.patch", "patch_sha256": "e5b37a35adce9ca7baed5dbbd34d65d0d5b8755d45c9f6610f3c57a27a17c4f5", "promoted": false, "proposal": {"change_summary": "Recombination of the two elite lines along their single shared axis. From t0005 it takes TOTAL_BATCH_SIZE 2**17 with DEVICE_BATCH_SIZE 64 and gradient accumulation 1; from t0004 it takes the principle that rates must be rescaled to the batch, extended from the 1/sqrt(2) exponent to full linear scaling: EMBEDDING_LR 0.15, UNEMBEDDING_LR 0.001, MATRIX_LR 0.01, each 1/4 of the original 2**19-batch value. Capacity, HEAD_DIM 128, the 512-token short window, depth 8 and all schedules are unchanged.", "command": ["/usr/bin/python3", "/data3/zhubaiyu/fengheguai/fengheguai/rendezvous_agent.py", "--trial", "/data3/zhubaiyu/fengheguai/campaigns/h200-claude/nodes/t0007", "--result", "/data3/zhubaiyu/fengheguai/campaigns/h200-claude/nodes/t0007/.fengheguai-agent-result.json", "--schema", "/data3/zhubaiyu/fengheguai/campaigns/h200-claude/control/agent_output.schema.json", "--campaign", "/data3/zhubaiyu/fengheguai/campaigns/h200-claude", "--inbox", "/data3/zhubaiyu/fengheguai/campaigns/h200-claude-rendezvous"], "errors": [], "expected_val_bpb_effect": "Diagnostic and two-sided. If linear scaling holds, expect roughly 0.0005-0.002 below champion t0004 at 0.981147, and the same exponent would then predict a further gain on the champion branch by moving its batch 2**18 rates from 1/sqrt(2) to 1/2. If square-root scaling was already correct, expect 0.0005-0.003 above t0005 at 0.981248, which fixes the exponent at 1/2 and closes this axis entirely.", "hypothesis": "The two elite branches differ only in where they sit on the batch-versus-learning-rate line, and they score within noise of each other, so the line is flat but its correct slope is still unknown. Three points now constrain it at batch 2**17: full 2**19 rates gave 0.986688, half rates gave 0.981248, and the champion at batch 2**18 with 1/sqrt(2) rates gave 0.981147. Because halving the rates recovered almost the entire t0003 penalty, the optimum at a 4x smaller batch may lie below the square-root prescription. This node combines the batch of t0005 with the rate-rescaling mechanism of t0004 pushed from square-root to linear scaling: batch 2**17 with all three rates at 1/4 of their 2**19 values. If linear scaling is the correct law for these orthogonalised Muon updates, this beats both elites.", "log_path": "/data3/zhubaiyu/fengheguai/campaigns/h200-claude/artifacts/t0007/agent.log", "return_code": 0, "risk": "Rates a quarter of the tuned values may simply be too small to make enough progress inside 300 seconds, in which case the loss is dominated by underfitting rather than by the scaling law and the node teaches less than intended. The result is also read against the 0.0001 repeat-noise level, and the expected effects here are only a few multiples of that, so a near-tie would leave the exponent genuinely undetermined between 1/2 and 1/4 rather than resolving it.", "success": true, "timed_out": false}, "secondary_parent_id": "t0005", "selection_reason": "Recombine two independently strong branches at the scheduled synthesis step.", "source_sha256": "c1c9ca8df16b705dfcf1d541b2cade7a1d569e83570aee80dbf0ac0dc527ebf0", "stage": "recombine", "status": "discard", "training_seconds": 300.1, "trial_id": "t0007", "workspace": "/data3/zhubaiyu/fengheguai/campaigns/h200-claude/nodes/t0007"}, "prev_hash": "2fbb86bdaa1eccdcb6b9a79ec6fcc079334cb5eb29b9033d9651e70b516fdc0c", "seq": 16, "timestamp": "2026-08-20T12:40:15.712833+00:00"}
{"hash": "7b7e25754f0a6eeb912d69cbdb84d0b0985a803d2a53bf498268a86ae3ceb624", "kind": "trial_started", "payload": {"parent_id": "t0004", "reason": "The current line is stalled; make a structurally different bet.", "secondary_parent_id": null, "stage": "explore", "trial_id": "t0008"}, "prev_hash": "4635640b52c58f6ecfc43bee49d1c3e56801cdd97e15b9e28a76c0f3d6915036", "seq": 17, "timestamp": "2026-08-20T12:40:15.719601+00:00"}
{"hash": "f2309677bbddca7773afc4f4e552eba71cdf151c22bfc2b05b77e84de8ad87ea", "kind": "trial_completed", "payload": {"champion_before": "t0004", "debug_depth": 0, "delta_vs_champion_before": -0.0009017787125644716, "delta_vs_parent": -0.0009017787125644716, "finding": "t0008 improved the prior champion: val_bpb=0.980245, delta=-0.000902. Hypothesis: This run is data-limited rather than compute-limited: the loader reports epoch 2, so the 550M training tokens are roughly two passes over the same corpus, while MFU is already 40.6 percent. In that regime the binding constraint is how much of the corpus the model can commit to accessible memory, and the value-embedding path is exactly that mechanism, injecting a per-token learned value directly into the attention value stream. It currently runs on only 4 of the 8 layers. Extending it to every layer should give the model denser token-indexed memory and lower val_bpb, at almost no FLOP cost because value embeddings are gathers rather than matmuls and are excluded from the per-token FLOP model.", "measurements": [{"command": ["/data/home/zhubaiyu/.local/bin/uv", "run", "--project", "/data3/zhubaiyu/fengheguai/campaigns/h200-claude/nodes/t0008", "python", "/data3/zhubaiyu/fengheguai/fengheguai/_audit_runner.py", "--target", "/data3/zhubaiyu/fengheguai/campaigns/h200-claude/nodes/t0008", "--nonce", "4c386f50328f7b5b89c46d5340bcd518bab52c3ad156fa6b"], "errors": [], "evidence_path": "/data3/zhubaiyu/fengheguai/campaigns/h200-claude/evidence/t0008-r0/evidence.json", "evidence_sha256": "0375754a5cfc298e103da0c373e179ce6edf42bb2de8d6f9efb00f5dd05758a4", "log_path": "/data3/zhubaiyu/fengheguai/campaigns/h200-claude/evidence/t0008-r0/run.log", "log_sha256": "4dea81411c221637a9fef4720ce50e5bba21738ea20f0a3194d72c3cf6c00379", "metric": 0.9802750862743486, "num_steps": 2062, "peak_vram_mb": 46036.2, "return_code": 0, "status": "valid", "timed_out": false, "train_sha256": "80ef537ab620998c79feb86499f64219dd9fc79e488981744ac670ade473a03f", "training_seconds": 300.1, "wall_seconds": 482.186591505073}, {"command": ["/data/home/zhubaiyu/.local/bin/uv", "run", "--project", "/data3/zhubaiyu/fengheguai/campaigns/h200-claude/nodes/t0008", "python", "/data3/zhubaiyu/fengheguai/fengheguai/_audit_runner.py", "--target", "/data3/zhubaiyu/fengheguai/campaigns/h200-claude/nodes/t0008", "--nonce", "bc2d113a9f109b0c83720ca12e04122f2da40f6a706b1b14"], "errors": [], "evidence_path": "/data3/zhubaiyu/fengheguai/campaigns/h200-claude/evidence/t0008-r1/evidence.json", "evidence_sha256": "f0f840d83718023e346c58e667f1d9d7e10f9eaefe22a04e062275ba55614cef", "log_path": "/data3/zhubaiyu/fengheguai/campaigns/h200-claude/evidence/t0008-r1/run.log", "log_sha256": "4c45b960695ca949979c879fdebf58b53baaee5a6560cc7aa45196ae039a5600", "metric": 0.9802146514032376, "num_steps": 2058, "peak_vram_mb": 46036.2, "return_code": 0, "status": "valid", "timed_out": false, "train_sha256": "80ef537ab620998c79feb86499f64219dd9fc79e488981744ac670ade473a03f", "training_seconds": 300.1, "wall_seconds": 456.9136754432693}], "metric": 0.980244868838793, "parent_id": "t0004", "patch_path": "/data3/zhubaiyu/fengheguai/campaigns/h200-claude/artifacts/t0008/change.patch", "patch_sha256": "2e5ca97bf2f9bf43de916b5c7212603c7962d1febad7c774b205e2a7ff9e231c", "promoted": true, "proposal": {"change_summary": "One structural change on champion t0004: has_ve now returns True for every layer instead of only alternating layers, so all 8 blocks carry a value embedding and a ve_gate rather than 4. This roughly doubles value-embedding parameters from 16.8M to 33.5M (vocab 8192 by kv_dim 512 per layer). Depth, model_dim, HEAD_DIM 128, batch 2**18, the rescaled learning rates, the 512-token short window and all schedules are unchanged.", "command": ["/usr/bin/python3", "/data3/zhubaiyu/fengheguai/fengheguai/rendezvous_agent.py", "--trial", "/data3/zhubaiyu/fengheguai/campaigns/h200-claude/nodes/t0008", "--result", "/data3/zhubaiyu/fengheguai/campaigns/h200-claude/nodes/t0008/.fengheguai-agent-result.json", "--schema", "/data3/zhubaiyu/fengheguai/campaigns/h200-claude/control/agent_output.schema.json", "--campaign", "/data3/zhubaiyu/fengheguai/campaigns/h200-claude", "--inbox", "/data3/zhubaiyu/fengheguai/campaigns/h200-claude-rendezvous"], "errors": [], "expected_val_bpb_effect": "Expected decrease of roughly 0.001-0.005 bpb versus champion t0004 at 0.981147 if token-indexed memory is the binding constraint under data repetition. The step count should fall only slightly, by a few percent, from the extra gathers and the larger AdamW optimizer state; if instead it falls sharply, the mechanism is bandwidth-bound and the comparison is confounded, which num_steps will reveal.", "hypothesis": "This run is data-limited rather than compute-limited: the loader reports epoch 2, so the 550M training tokens are roughly two passes over the same corpus, while MFU is already 40.6 percent. In that regime the binding constraint is how much of the corpus the model can commit to accessible memory, and the value-embedding path is exactly that mechanism, injecting a per-token learned value directly into the attention value stream. It currently runs on only 4 of the 8 layers. Extending it to every layer should give the model denser token-indexed memory and lower val_bpb, at almost no FLOP cost because value embeddings are gathers rather than matmuls and are excluded from the per-token FLOP model.", "log_path": "/data3/zhubaiyu/fengheguai/campaigns/h200-claude/artifacts/t0008/agent.log", "return_code": 0, "risk": "Doubling value-embedding parameters doubles their AdamW moment memory and gather bandwidth, so the step cost may exceed the quality gain. There is also a real chance the alternating pattern is deliberate and near-optimal, with dense value residuals over-constraining the value stream and raising val_bpb; that outcome would say the mechanism is already saturated at 4 layers and would redirect the search toward reducing rather than extending it.", "success": true, "timed_out": false}, "secondary_parent_id": null, "selection_reason": "The current line is stalled; make a structurally different bet.", "source_sha256": "80ef537ab620998c79feb86499f64219dd9fc79e488981744ac670ade473a03f", "stage": "explore", "status": "keep", "training_seconds": 300.1, "trial_id": "t0008", "workspace": "/data3/zhubaiyu/fengheguai/campaigns/h200-claude/nodes/t0008"}, "prev_hash": "7b7e25754f0a6eeb912d69cbdb84d0b0985a803d2a53bf498268a86ae3ceb624", "seq": 18, "timestamp": "2026-08-20T13:01:21.859200+00:00"}
{"hash": "a26d9cfd25445e079b277b57011bf85d45f0a9280f53f71abff2b22ce49ded07", "kind": "trial_started", "payload": {"parent_id": "t0008", "reason": "Exploit a top-K branch selected by quality plus an under-exploration bonus.", "secondary_parent_id": null, "stage": "refine", "trial_id": "t0009"}, "prev_hash": "f2309677bbddca7773afc4f4e552eba71cdf151c22bfc2b05b77e84de8ad87ea", "seq": 19, "timestamp": "2026-08-20T13:01:21.866193+00:00"}
