{"hash": "3fc1fd0ba31f55d541c37bcb5882e6540602216b8f8853400d828a8c2dcf849d", "kind": "trial_started", "payload": {"parent_id": "t0069", "reason": "Exploit a top-K branch selected by quality plus an under-exploration bonus.", "secondary_parent_id": null, "stage": "refine", "trial_id": "t0072"}, "prev_hash": "1e38f406ff748c4a5b14131442369ce803c574e21011323177d5bdc5c540af90", "seq": 145, "timestamp": "2026-08-21T00:55:19.382193+00:00"}
{"hash": "4ff76baf6be04381788894e0419925a49a6a97d7da3832d0781c2afd21e0e3c1", "kind": "trial_completed", "payload": {"champion_before": "t0069", "debug_depth": 0, "delta_vs_champion_before": 9.984442617572142e-06, "delta_vs_parent": 9.984442617572142e-06, "finding": "t0072 did not improve the prior champion: val_bpb=0.971081, delta=+0.000010. Hypothesis: The embedding skip is a per-layer quantity whose total was silently increased when depth changed, in exactly the way weight decay was when the batch changed. In GPT.forward each layer computes x as resid_lambdas[i] times x plus x0_lambdas[i] times x0, so the normalised token embedding is re-injected once per layer and the total injection across the stack is the sum of those scalars. At depth 8, where the recipe was tuned, that sum is 8 times 0.1 or 0.8; at the champion depth of 12 it is 1.2, half again as much, and no node has ever revisited the initialisation. The same cumulative reasoning corrected weight decay at t0065 for a gain of 0.000345, and the correction there was validated by t0066 finding the translated value optimal. Scaling the initialisation by 8/12 to 0.067 restores the tuned total and should lower val_bpb.", "measurements": [{"command": ["/data/home/zhubaiyu/.local/bin/uv", "run", "--project", "/data3/zhubaiyu/fengheguai/campaigns/h200-claude/nodes/t0072", "python", "/data3/zhubaiyu/fengheguai/fengheguai/_audit_runner.py", "--target", "/data3/zhubaiyu/fengheguai/campaigns/h200-claude/nodes/t0072", "--nonce", "54fe74455f692293d1a9df7be606bd89cb760564e9c919cf"], "errors": [], "evidence_path": "/data3/zhubaiyu/fengheguai/campaigns/h200-claude/evidence/t0072-r0/evidence.json", "evidence_sha256": "8c58783b2d5b7ea3c2d4175258bad4388ab9be33ce5bf96cb6e047969e643505", "log_path": "/data3/zhubaiyu/fengheguai/campaigns/h200-claude/evidence/t0072-r0/run.log", "log_sha256": "f57abf79418eddd255b59438c48f622e9b56fde4f6b38f7fe95fb13e543fd94a", "metric": 0.9710810929854847, "num_steps": 2842, "peak_vram_mb": 33800.4, "return_code": 0, "status": "valid", "timed_out": false, "train_sha256": "968e8ed5a06d3464411230fc7d215d9a30c8c79165424d86719bf7871d18280e", "training_seconds": 300.0, "wall_seconds": 486.105884520337}], "metric": 0.9710810929854847, "parent_id": "t0069", "patch_path": "/data3/zhubaiyu/fengheguai/campaigns/h200-claude/artifacts/t0072/change.patch", "patch_sha256": "6808a685c3fa7a80fa8717da0ae1b88f832053f26e45de25e28dcedaa068f538", "promoted": false, "proposal": {"change_summary": "One initialisation changed on champion t0069: x0_lambdas filled with 0.067 instead of 0.1 in init_weights, which matters because the model is built on the meta device and materialised by to_empty, so this call is what actually sets the values. resid_lambdas stays at 1.0 and SCALAR_LR stays 0.5, so the group still learns at the rate bracketed in t0062 and t0063. The GQA change from t0071 is not carried forward, having cost 0.005427. Depth 12, width 512, HEAD_DIM 128, document masking, dense value embeddings with the 128-channel gate, output softcap 13, rotary base 30000, batch 2**17, the three settled learning rates, ADAM_BETAS 0.8 and 0.95, WEIGHT_DECAY 0.146, FINAL_LR_FRAC 0.1 and WARMDOWN_RATIO 0.5 are unchanged.", "command": ["/usr/bin/python3", "/data3/zhubaiyu/fengheguai/fengheguai/rendezvous_agent.py", "--trial", "/data3/zhubaiyu/fengheguai/campaigns/h200-claude/nodes/t0072", "--result", "/data3/zhubaiyu/fengheguai/campaigns/h200-claude/nodes/t0072/.fengheguai-agent-result.json", "--schema", "/data3/zhubaiyu/fengheguai/campaigns/h200-claude/control/agent_output.schema.json", "--campaign", "/data3/zhubaiyu/fengheguai/campaigns/h200-claude", "--inbox", "/data3/zhubaiyu/fengheguai/campaigns/h200-claude-rendezvous"], "errors": [], "expected_val_bpb_effect": "Expected between a 0.0005 decrease and a 0.0005 increase versus champion t0069 at 0.971071, with step count unchanged. The effect should be smaller than the weight-decay correction because these scalars are learned rather than fixed, and they learn fast: at SCALAR_LR 0.5 an Adam step can move one by five times its own initialisation, so the initial value governs only the first few steps of a 2841-step run rather than the whole trajectory.", "hypothesis": "The embedding skip is a per-layer quantity whose total was silently increased when depth changed, in exactly the way weight decay was when the batch changed. In GPT.forward each layer computes x as resid_lambdas[i] times x plus x0_lambdas[i] times x0, so the normalised token embedding is re-injected once per layer and the total injection across the stack is the sum of those scalars. At depth 8, where the recipe was tuned, that sum is 8 times 0.1 or 0.8; at the champion depth of 12 it is 1.2, half again as much, and no node has ever revisited the initialisation. The same cumulative reasoning corrected weight decay at t0065 for a gain of 0.000345, and the correction there was validated by t0066 finding the translated value optimal. Scaling the initialisation by 8/12 to 0.067 restores the tuned total and should lower val_bpb.", "log_path": "/data3/zhubaiyu/fengheguai/campaigns/h200-claude/artifacts/t0072/agent.log", "return_code": 0, "risk": "That fast learning is the main reason this may measure nothing: if the scalars reach their preferred values within a handful of steps then the initialisation is nearly irrelevant and the result is a null that says the cumulative argument does not apply to learned quantities. The argument also assumes the useful invariant is the plain sum of the scalars, but the contributions are not independent since each layer multiplies the accumulated stream by resid_lambdas before adding its own, so the true weighting depends on those values and 8/12 is an approximation rather than a derivation as clean as the weight-decay integral was.", "success": true, "timed_out": false}, "secondary_parent_id": null, "selection_reason": "Exploit a top-K branch selected by quality plus an under-exploration bonus.", "source_sha256": "968e8ed5a06d3464411230fc7d215d9a30c8c79165424d86719bf7871d18280e", "stage": "refine", "status": "discard", "training_seconds": 300.0, "trial_id": "t0072", "workspace": "/data3/zhubaiyu/fengheguai/campaigns/h200-claude/nodes/t0072"}, "prev_hash": "3fc1fd0ba31f55d541c37bcb5882e6540602216b8f8853400d828a8c2dcf849d", "seq": 146, "timestamp": "2026-08-21T01:04:21.968739+00:00"}
{"hash": "e40cb31a2e95ed758f1509fa8dba1a816a978380e869ffa1d5f9b154dfe34e58", "kind": "trial_started", "payload": {"parent_id": "t0069", "reason": "The current line is stalled; make a structurally different bet.", "secondary_parent_id": null, "stage": "explore", "trial_id": "t0073"}, "prev_hash": "4ff76baf6be04381788894e0419925a49a6a97d7da3832d0781c2afd21e0e3c1", "seq": 147, "timestamp": "2026-08-21T01:04:22.008816+00:00"}
{"hash": "99e422c66bba978e3782b68f21eec38af41212d87942b259a3298294d84b7bdf", "kind": "trial_completed", "payload": {"champion_before": "t0069", "debug_depth": 0, "delta_vs_champion_before": -0.000481871692473268, "delta_vs_parent": -0.000481871692473268, "finding": "t0073 improved the prior champion: val_bpb=0.970589, delta=-0.000482. Hypothesis: Full-context layers are worth more than their cost, and the pattern that decides how many of them exist has never been tested at the current depth. The only measurement is t0011, which at depth 8 replaced SSSL with S, cutting the two full-context layers to one, and lost 0.000519 while gaining just 0.8 percent in steps: removing a long layer was a bad trade. That says long layers carry value the FLOP model understates, but it was measured with 8 layers and the champion now has 12, where SSSL places long layers at indices 3, 7 and 11. Moving to SSL places them at 2, 5, 8 and 11, adding a fourth. If the t0011 direction holds, adding a long layer should pay for its roughly 3 percent FLOP cost. This also probes something the campaign has otherwise found consistently: attention span reductions kept helping until they did not, and this is the opposite end of that same axis at a depth where it was never examined.", "measurements": [{"command": ["/data/home/zhubaiyu/.local/bin/uv", "run", "--project", "/data3/zhubaiyu/fengheguai/campaigns/h200-claude/nodes/t0073", "python", "/data3/zhubaiyu/fengheguai/fengheguai/_audit_runner.py", "--target", "/data3/zhubaiyu/fengheguai/campaigns/h200-claude/nodes/t0073", "--nonce", "0cde3c7d335c9f1836a19435ab07d4147ab093e5ead277c2"], "errors": [], "evidence_path": "/data3/zhubaiyu/fengheguai/campaigns/h200-claude/evidence/t0073-r0/evidence.json", "evidence_sha256": "4b8bdb430e137e4a5bc60131e9ab2de0cbc5d0086f4a9644e118ea20bd7407a4", "log_path": "/data3/zhubaiyu/fengheguai/campaigns/h200-claude/evidence/t0073-r0/run.log", "log_sha256": "4ceada278bb127632ef7232be7a2d742ba1c6aecf93c791542befe8baddc0bb8", "metric": 0.9705591022147332, "num_steps": 2833, "peak_vram_mb": 33800.4, "return_code": 0, "status": "valid", "timed_out": false, "train_sha256": "02a4170487e6e53478d6bdca168e3ee633d814ed6e20011f626ce7cdea22921d", "training_seconds": 300.1, "wall_seconds": 565.7877711746842}, {"command": ["/data/home/zhubaiyu/.local/bin/uv", "run", "--project", "/data3/zhubaiyu/fengheguai/campaigns/h200-claude/nodes/t0073", "python", "/data3/zhubaiyu/fengheguai/fengheguai/_audit_runner.py", "--target", "/data3/zhubaiyu/fengheguai/campaigns/h200-claude/nodes/t0073", "--nonce", "dc7b19924d212a0fb95564050137105f2f6181ac717c77bf"], "errors": [], "evidence_path": "/data3/zhubaiyu/fengheguai/campaigns/h200-claude/evidence/t0073-r1/evidence.json", "evidence_sha256": "17833fc79aadbeaab596c1af0732273d339e98daf6bfd3e4e3155e894b0d42ac", "log_path": "/data3/zhubaiyu/fengheguai/campaigns/h200-claude/evidence/t0073-r1/run.log", "log_sha256": "ecef735bdc090c4cb7fa977ae21fb0999b5440516f8c28c8f233b289620a2372", "metric": 0.9706193714860545, "num_steps": 2836, "peak_vram_mb": 33800.4, "return_code": 0, "status": "valid", "timed_out": false, "train_sha256": "02a4170487e6e53478d6bdca168e3ee633d814ed6e20011f626ce7cdea22921d", "training_seconds": 300.1, "wall_seconds": 479.98992098961025}], "metric": 0.9705892368503939, "parent_id": "t0069", "patch_path": "/data3/zhubaiyu/fengheguai/campaigns/h200-claude/artifacts/t0073/change.patch", "patch_sha256": "90e996114ee940ee14755d381d3cdf8cd96455f0c3283c9d65818b01b3524dc2", "promoted": true, "proposal": {"change_summary": "One constant changed on champion t0069: WINDOW_PATTERN from SSSL to SSL. Because _compute_window_sizes cycles the pattern across layers and forces the final layer to full context, this yields eight 512-token short layers and four full-context layers at depth 12, instead of nine and three. The short window itself stays at sequence_len // 4, unchanged. Depth 12, width 512, HEAD_DIM 128, document masking, dense value embeddings with the 128-channel gate, output softcap 13, rotary base 30000, batch 2**17, the three settled learning rates, SCALAR_LR 0.5, ADAM_BETAS 0.8 and 0.95, WEIGHT_DECAY 0.146, FINAL_LR_FRAC 0.1 and WARMDOWN_RATIO 0.5 are unchanged.", "command": ["/usr/bin/python3", "/data3/zhubaiyu/fengheguai/fengheguai/rendezvous_agent.py", "--trial", "/data3/zhubaiyu/fengheguai/campaigns/h200-claude/nodes/t0073", "--result", "/data3/zhubaiyu/fengheguai/campaigns/h200-claude/nodes/t0073/.fengheguai-agent-result.json", "--schema", "/data3/zhubaiyu/fengheguai/campaigns/h200-claude/control/agent_output.schema.json", "--campaign", "/data3/zhubaiyu/fengheguai/campaigns/h200-claude", "--inbox", "/data3/zhubaiyu/fengheguai/campaigns/h200-claude-rendezvous"], "errors": [], "expected_val_bpb_effect": "Expected between a 0.001 decrease and a 0.001 increase versus champion t0069 at 0.971071, with the step count falling by roughly 2 to 3 percent from 2841 to about 2770. The FLOP arithmetic is that swapping one short layer for a long one adds about 9.4M per-token FLOPs against a total near 317M, and t0011 showed the realised step cost of attention changes runs well below what that model predicts, so the step penalty should be small.", "hypothesis": "Full-context layers are worth more than their cost, and the pattern that decides how many of them exist has never been tested at the current depth. The only measurement is t0011, which at depth 8 replaced SSSL with S, cutting the two full-context layers to one, and lost 0.000519 while gaining just 0.8 percent in steps: removing a long layer was a bad trade. That says long layers carry value the FLOP model understates, but it was measured with 8 layers and the champion now has 12, where SSSL places long layers at indices 3, 7 and 11. Moving to SSL places them at 2, 5, 8 and 11, adding a fourth. If the t0011 direction holds, adding a long layer should pay for its roughly 3 percent FLOP cost. This also probes something the campaign has otherwise found consistently: attention span reductions kept helping until they did not, and this is the opposite end of that same axis at a depth where it was never examined.", "log_path": "/data3/zhubaiyu/fengheguai/campaigns/h200-claude/artifacts/t0073/agent.log", "return_code": 0, "risk": "The t0011 evidence points the right way but is thin, a single measurement of 0.000519 at a different depth, and it is contradicted in spirit by the rest of this campaign: narrowing the short window gained 0.001882 at t0002, widening it back lost 0.001186 at t0030, and document masking gained by restricting attention further still. Every one of those says this model prefers less attention reach, not more, so adding a full-context layer runs against the dominant trend and the honest expectation is a regression. If it regresses, the pattern is confirmed optimal at SSSL and the attention-span axis is closed at both ends.", "success": true, "timed_out": false}, "secondary_parent_id": null, "selection_reason": "The current line is stalled; make a structurally different bet.", "source_sha256": "02a4170487e6e53478d6bdca168e3ee633d814ed6e20011f626ce7cdea22921d", "stage": "explore", "status": "keep", "training_seconds": 300.1, "trial_id": "t0073", "workspace": "/data3/zhubaiyu/fengheguai/campaigns/h200-claude/nodes/t0073"}, "prev_hash": "e40cb31a2e95ed758f1509fa8dba1a816a978380e869ffa1d5f9b154dfe34e58", "seq": 148, "timestamp": "2026-08-21T01:22:52.599819+00:00"}
{"hash": "023e662365eb27d7dda2cf283e8b3418463a81b6d86c23356f544fd28ef363f3", "kind": "trial_started", "payload": {"parent_id": "t0073", "reason": "Spend the configured search share on a distinct architectural or recipe direction.", "secondary_parent_id": null, "stage": "explore", "trial_id": "t0074"}, "prev_hash": "99e422c66bba978e3782b68f21eec38af41212d87942b259a3298294d84b7bdf", "seq": 149, "timestamp": "2026-08-21T01:22:52.641698+00:00"}
{"hash": "921d6d7c0c6a77f9a4b746d14546aca2dc9d864bcaab9be4393a11f1dcd06051", "kind": "trial_completed", "payload": {"champion_before": "t0073", "debug_depth": 0, "delta_vs_champion_before": 0.0003733756091254259, "delta_vs_parent": 0.0003733756091254259, "finding": "t0074 did not improve the prior champion: val_bpb=0.970963, delta=+0.000373. Hypothesis: The count of full-context layers is a live axis and it moved in the direction I predicted against. Going from SSSL to SSL at depth 12, three long layers to four, gained 0.000482 while costing only 5 steps out of 2841. That is a correction to the reading I had been carrying: this model prefers a narrow short-window span, which t0002 and t0030 both established, but it does not prefer fewer global layers, and those are separate questions about attention that the campaign had been treating as one. The remaining question is where the count saturates. Moving to SL places long layers at indices 1, 3, 5, 7, 9 and 11, giving six full-context layers against six short ones, and roughly doubles the share of attention spent at full context. If global layers keep paying at their measured rate this should gain again; if four was near the optimum this brackets the axis.", "measurements": [{"command": ["/data/home/zhubaiyu/.local/bin/uv", "run", "--project", "/data3/zhubaiyu/fengheguai/campaigns/h200-claude/nodes/t0074", "python", "/data3/zhubaiyu/fengheguai/fengheguai/_audit_runner.py", "--target", "/data3/zhubaiyu/fengheguai/campaigns/h200-claude/nodes/t0074", "--nonce", "5767e28c8af9c6f97e4af10fc7a88434cbb2f127bdf0f29d"], "errors": [], "evidence_path": "/data3/zhubaiyu/fengheguai/campaigns/h200-claude/evidence/t0074-r0/evidence.json", "evidence_sha256": "5f9ab5a855d453d45da15bddff46994099feb25d1b4a201f0c90c18a3065a37d", "log_path": "/data3/zhubaiyu/fengheguai/campaigns/h200-claude/evidence/t0074-r0/run.log", "log_sha256": "b536cb7c9bbb9c80788658931f222962c222411cc6af49a7cb3ce03367f19130", "metric": 0.9709626124595193, "num_steps": 2822, "peak_vram_mb": 33800.4, "return_code": 0, "status": "valid", "timed_out": false, "train_sha256": "edf72a25b49447d76633f763d9cb45bee1f93941c6f12778da8155ea78a8aecc", "training_seconds": 300.1, "wall_seconds": 564.4818753460422}], "metric": 0.9709626124595193, "parent_id": "t0073", "patch_path": "/data3/zhubaiyu/fengheguai/campaigns/h200-claude/artifacts/t0074/change.patch", "patch_sha256": "8b882655301a307929ca37f3f7231a475f32f8ba0e6087a6ed4cfa75137b8ed9", "promoted": false, "proposal": {"change_summary": "One constant changed on champion t0073: WINDOW_PATTERN from SSL to SL. At depth 12 the pattern cycles to place full-context layers at every odd index, six in total, with the remaining six at the 512-token short window; the final layer is forced to full context as before and already was. The short window itself stays at sequence_len // 4. Depth 12, width 512, HEAD_DIM 128, document masking, dense value embeddings with the 128-channel gate, output softcap 13, rotary base 30000, batch 2**17, the three settled learning rates, SCALAR_LR 0.5, ADAM_BETAS 0.8 and 0.95, WEIGHT_DECAY 0.146, FINAL_LR_FRAC 0.1 and WARMDOWN_RATIO 0.5 are unchanged.", "command": ["/usr/bin/python3", "/data3/zhubaiyu/fengheguai/fengheguai/rendezvous_agent.py", "--trial", "/data3/zhubaiyu/fengheguai/campaigns/h200-claude/nodes/t0074", "--result", "/data3/zhubaiyu/fengheguai/campaigns/h200-claude/nodes/t0074/.fengheguai-agent-result.json", "--schema", "/data3/zhubaiyu/fengheguai/campaigns/h200-claude/control/agent_output.schema.json", "--campaign", "/data3/zhubaiyu/fengheguai/campaigns/h200-claude", "--inbox", "/data3/zhubaiyu/fengheguai/campaigns/h200-claude-rendezvous"], "errors": [], "expected_val_bpb_effect": "Expected between a 0.001 decrease and a 0.002 increase versus champion t0073 at 0.970589, with the step count falling to roughly 2700 from 2836. Swapping two more short layers for long ones adds about 19M per-token FLOPs against a total near 326M, so about 6 percent, and the realised step cost of attention changes has consistently run below the FLOP prediction in this campaign, most starkly at t0011 where a 4 percent FLOP cut returned only 0.8 percent in steps. The step penalty here is therefore likely nearer 2 to 3 percent than 6.", "hypothesis": "The count of full-context layers is a live axis and it moved in the direction I predicted against. Going from SSSL to SSL at depth 12, three long layers to four, gained 0.000482 while costing only 5 steps out of 2841. That is a correction to the reading I had been carrying: this model prefers a narrow short-window span, which t0002 and t0030 both established, but it does not prefer fewer global layers, and those are separate questions about attention that the campaign had been treating as one. The remaining question is where the count saturates. Moving to SL places long layers at indices 1, 3, 5, 7, 9 and 11, giving six full-context layers against six short ones, and roughly doubles the share of attention spent at full context. If global layers keep paying at their measured rate this should gain again; if four was near the optimum this brackets the axis.", "log_path": "/data3/zhubaiyu/fengheguai/campaigns/h200-claude/artifacts/t0074/agent.log", "return_code": 0, "risk": "This is the second step in a direction supported by two measurements, and doubling the number of long layers is a larger jump than the increment that produced the gain, so it may overshoot an optimum sitting at four or five. There is also a mechanism reason to expect saturation: with document masking active, attention cannot cross document boundaries in any layer, so a full-context layer only sees more than a 512-token window when the enclosing document is longer than that, and the marginal value of each additional global layer should fall once enough of them exist to route document-level information.", "success": true, "timed_out": false}, "secondary_parent_id": null, "selection_reason": "Spend the configured search share on a distinct architectural or recipe direction.", "source_sha256": "edf72a25b49447d76633f763d9cb45bee1f93941c6f12778da8155ea78a8aecc", "stage": "explore", "status": "discard", "training_seconds": 300.1, "trial_id": "t0074", "workspace": "/data3/zhubaiyu/fengheguai/campaigns/h200-claude/nodes/t0074"}, "prev_hash": "023e662365eb27d7dda2cf283e8b3418463a81b6d86c23356f544fd28ef363f3", "seq": 150, "timestamp": "2026-08-21T01:33:01.589342+00:00"}
{"hash": "3b2e567c1b518a5f96d3d478e2b46416f6a36522ca42da4d3da0a16c0377903a", "kind": "trial_started", "payload": {"parent_id": "t0073", "reason": "Spend the configured search share on a distinct architectural or recipe direction.", "secondary_parent_id": null, "stage": "explore", "trial_id": "t0075"}, "prev_hash": "921d6d7c0c6a77f9a4b746d14546aca2dc9d864bcaab9be4393a11f1dcd06051", "seq": 151, "timestamp": "2026-08-21T01:33:01.631294+00:00"}
