{"hash": "62fb00fa09068344474122aaf3f4a58665d8274fd7be2f9ce977d16b191bd640", "kind": "trial_completed", "payload": {"champion_before": "t0065", "debug_depth": 0, "delta_vs_champion_before": 0.00017936081258751457, "delta_vs_parent": 0.00017936081258751457, "finding": "t0066 did not improve the prior champion: val_bpb=0.971465, delta=+0.000179. Hypothesis: Rescaling weight decay to hold cumulative decay constant across the batch change gained 0.000345, which confirms that the relevant quantity is the integral of lr times wd over the run rather than its per-step magnitude, since the correction was derived from exactly that assumption. What it does not establish is that the previously optimal cumulative amount is still optimal. The batch halving changed more than the arithmetic of decay: gradients per step are noisier, there are 1.94 times as many updates, and the model now sees each parameter shrunk more often but by less each time. The old bracket found 0.2 optimal against 0.1 and 0.3 at the previous operating point, and the matched value 0.146 is the translation of that optimum, not a fresh measurement. Testing 0.11, roughly a further factor of 1.33 down, asks whether the optimum in cumulative terms has itself moved lower now that decay is applied more frequently and more gently.", "measurements": [{"command": ["/data/home/zhubaiyu/.local/bin/uv", "run", "--project", "/data3/zhubaiyu/fengheguai/campaigns/h200-claude/nodes/t0066", "python", "/data3/zhubaiyu/fengheguai/fengheguai/_audit_runner.py", "--target", "/data3/zhubaiyu/fengheguai/campaigns/h200-claude/nodes/t0066", "--nonce", "3f5b50f844909be9f3d5ca7e653f7d668c3a518b34627ea3"], "errors": [], "evidence_path": "/data3/zhubaiyu/fengheguai/campaigns/h200-claude/evidence/t0066-r0/evidence.json", "evidence_sha256": "35fea7790000e1de6ddb9079ffff4575d71c13ff0a029f572b902d097faa650d", "log_path": "/data3/zhubaiyu/fengheguai/campaigns/h200-claude/evidence/t0066-r0/run.log", "log_sha256": "70cc54a75cc5118be1c0dc17a86394b5ff48d1756e338540fbbe9468a26fa177", "metric": 0.9714648175165073, "num_steps": 2836, "peak_vram_mb": 33800.4, "return_code": 0, "status": "valid", "timed_out": false, "train_sha256": "ccd05787fc436228bebebf7b5bfd975cddcd91ca31659187b7b27a9b950109de", "training_seconds": 300.1, "wall_seconds": 484.99550396576524}], "metric": 0.9714648175165073, "parent_id": "t0065", "patch_path": "/data3/zhubaiyu/fengheguai/campaigns/h200-claude/artifacts/t0066/change.patch", "patch_sha256": "b815e967dc5ff83d780ac8985109a40a0f93e8ec39a6b91076f12d95585fea27", "promoted": false, "proposal": {"change_summary": "One constant changed on champion t0065: WEIGHT_DECAY from 0.146 to 0.11, keeping the declining schedule shape of WEIGHT_DECAY times one minus progress. Only the Muon matrix groups are affected. Batch 2**17 with DEVICE_BATCH_SIZE 64, depth 12, width 512, HEAD_DIM 128, document masking, dense value embeddings with the 128-channel gate, output softcap 10, rotary base 30000, EMBEDDING_LR 0.6, UNEMBEDDING_LR 0.002, MATRIX_LR 0.0163, SCALAR_LR 0.5, FINAL_LR_FRAC 0.1 and WARMDOWN_RATIO 0.5 are unchanged.", "command": ["/usr/bin/python3", "/data3/zhubaiyu/fengheguai/fengheguai/rendezvous_agent.py", "--trial", "/data3/zhubaiyu/fengheguai/campaigns/h200-claude/nodes/t0066", "--result", "/data3/zhubaiyu/fengheguai/campaigns/h200-claude/nodes/t0066/.fengheguai-agent-result.json", "--schema", "/data3/zhubaiyu/fengheguai/campaigns/h200-claude/control/agent_output.schema.json", "--campaign", "/data3/zhubaiyu/fengheguai/campaigns/h200-claude", "--inbox", "/data3/zhubaiyu/fengheguai/campaigns/h200-claude-rendezvous"], "errors": [], "expected_val_bpb_effect": "Expected between a 0.0005 decrease and a 0.001 increase versus champion t0065 at 0.971285, with step count unchanged. Together with the 0.2 measurement, which is now the same configuration at 1.37 times the matched decay and scored 0.971630, this brackets the axis at the current operating point from both sides regardless of outcome. A regression fixes the optimum at the translated value and would be a clean confirmation that the cumulative-decay law transfers exactly.", "hypothesis": "Rescaling weight decay to hold cumulative decay constant across the batch change gained 0.000345, which confirms that the relevant quantity is the integral of lr times wd over the run rather than its per-step magnitude, since the correction was derived from exactly that assumption. What it does not establish is that the previously optimal cumulative amount is still optimal. The batch halving changed more than the arithmetic of decay: gradients per step are noisier, there are 1.94 times as many updates, and the model now sees each parameter shrunk more often but by less each time. The old bracket found 0.2 optimal against 0.1 and 0.3 at the previous operating point, and the matched value 0.146 is the translation of that optimum, not a fresh measurement. Testing 0.11, roughly a further factor of 1.33 down, asks whether the optimum in cumulative terms has itself moved lower now that decay is applied more frequently and more gently.", "log_path": "/data3/zhubaiyu/fengheguai/campaigns/h200-claude/artifacts/t0066/agent.log", "return_code": 0, "risk": "The original bracket was asymmetric in a way that argues against this direction: at the old operating point 0.1 cost 0.001012 while 0.3 cost only 0.000176, so the curve was steep below the optimum and shallow above it, and 0.11 is a step onto the steep side of that shape if it transfers. The counterargument is that the shape may not transfer, which is precisely what this node measures. This is also the third node spent on weight decay in this campaign, so if it regresses I will treat the axis as settled at 0.146 rather than refine further.", "success": true, "timed_out": false}, "secondary_parent_id": null, "selection_reason": "Exploit a top-K branch selected by quality plus an under-exploration bonus.", "source_sha256": "ccd05787fc436228bebebf7b5bfd975cddcd91ca31659187b7b27a9b950109de", "stage": "refine", "status": "discard", "training_seconds": 300.1, "trial_id": "t0066", "workspace": "/data3/zhubaiyu/fengheguai/campaigns/h200-claude/nodes/t0066"}, "prev_hash": "6a433b5fa29b462cc97629a0866873b502af6b8335934649e437ae679ed0f87b", "seq": 134, "timestamp": "2026-08-21T00:00:13.772493+00:00"}
{"hash": "3e88c1e97a6570c3394376d47998deafedd14069c06fa26aff04379b9de9c037", "kind": "trial_started", "payload": {"parent_id": "t0065", "reason": "Exploit a top-K branch selected by quality plus an under-exploration bonus.", "secondary_parent_id": null, "stage": "refine", "trial_id": "t0067"}, "prev_hash": "62fb00fa09068344474122aaf3f4a58665d8274fd7be2f9ce977d16b191bd640", "seq": 135, "timestamp": "2026-08-21T00:00:13.810433+00:00"}
{"hash": "45407725873a0507237082b4490dc9c23dc1dc2ba55c17daed17c273a3967ed3", "kind": "trial_completed", "payload": {"champion_before": "t0065", "debug_depth": 0, "delta_vs_champion_before": 0.0002368660051063065, "delta_vs_parent": 0.0002368660051063065, "finding": "t0067 did not improve the prior champion: val_bpb=0.971522, delta=+0.000237. Hypothesis: Adam beta1 has never been tested in this campaign and it is set unusually low. The recipe uses betas of 0.8 and 0.95, and while t0027 probed beta2 and measured a null, the first moment was left alone. A beta1 of 0.8 averages gradients over roughly 5 steps against the conventional 0.9 which averages over about 10, and that choice is defensible at the batch the recipe was written for, 2**19, where each gradient is already well averaged across many tokens. The champion now trains at 2**17, a quarter of that, so each per-step gradient carries roughly twice the noise it did at the tuned setting, and the natural compensation for noisier gradients is more temporal averaging rather than less. This mirrors the correction that just paid off at t0065, where a constant tuned at the old batch had to be rescaled for the new one. Raising beta1 to 0.9 should lower val_bpb.", "measurements": [{"command": ["/data/home/zhubaiyu/.local/bin/uv", "run", "--project", "/data3/zhubaiyu/fengheguai/campaigns/h200-claude/nodes/t0067", "python", "/data3/zhubaiyu/fengheguai/fengheguai/_audit_runner.py", "--target", "/data3/zhubaiyu/fengheguai/campaigns/h200-claude/nodes/t0067", "--nonce", "96c83db7b7cf2587e084a0da844f4c2df1b57cc74c391179"], "errors": [], "evidence_path": "/data3/zhubaiyu/fengheguai/campaigns/h200-claude/evidence/t0067-r0/evidence.json", "evidence_sha256": "f72f6d44fa28bc3b4b74a1951d499c8a9c790b268e45af51451377c96f600a9a", "log_path": "/data3/zhubaiyu/fengheguai/campaigns/h200-claude/evidence/t0067-r0/run.log", "log_sha256": "6e60c42b28f117999d040efe4bdac066ec8b2e80a88c9b6ed7af426b0490e9f1", "metric": 0.971522322709026, "num_steps": 2839, "peak_vram_mb": 33800.4, "return_code": 0, "status": "valid", "timed_out": false, "train_sha256": "c876ab7995229bb8a12f2c39c0513d38828e5e625c2662dc6f1c8afe2904e97a", "training_seconds": 300.1, "wall_seconds": 486.6067886976525}], "metric": 0.971522322709026, "parent_id": "t0065", "patch_path": "/data3/zhubaiyu/fengheguai/campaigns/h200-claude/artifacts/t0067/change.patch", "patch_sha256": "791b4e26d471bcd4e007a06241e93fb672219a98a020d5d508f0345ec4bf5024", "promoted": false, "proposal": {"change_summary": "One constant changed on champion t0065: the first element of ADAM_BETAS from 0.8 to 0.9, leaving beta2 at 0.95. This affects the four groups that pass adam_betas through setup_optimizer, namely lm_head, wte, the twelve value embeddings and resid_lambdas. The x0_lambdas group is unaffected because it hardcodes its own betas of 0.96 and 0.95, and the Muon groups have their own separate momentum which is bracketed at 0.95. Batch 2**17, depth 12, width 512, HEAD_DIM 128, document masking, dense value embeddings with the 128-channel gate, output softcap 10, rotary base 30000, the three settled learning rates, SCALAR_LR 0.5, WEIGHT_DECAY 0.146, FINAL_LR_FRAC 0.1 and WARMDOWN_RATIO 0.5 are unchanged.", "command": ["/usr/bin/python3", "/data3/zhubaiyu/fengheguai/fengheguai/rendezvous_agent.py", "--trial", "/data3/zhubaiyu/fengheguai/campaigns/h200-claude/nodes/t0067", "--result", "/data3/zhubaiyu/fengheguai/campaigns/h200-claude/nodes/t0067/.fengheguai-agent-result.json", "--schema", "/data3/zhubaiyu/fengheguai/campaigns/h200-claude/control/agent_output.schema.json", "--campaign", "/data3/zhubaiyu/fengheguai/campaigns/h200-claude", "--inbox", "/data3/zhubaiyu/fengheguai/campaigns/h200-claude-rendezvous"], "errors": [], "expected_val_bpb_effect": "Expected between a 0.001 decrease and a 0.001 increase versus champion t0065 at 0.971285, with step count unchanged since the moment update is the same elementwise cost either way. The bias correction in adamw_step_fused divides by 1 - beta1**step, so the longer horizon is properly compensated at the start of training and should not distort early steps.", "hypothesis": "Adam beta1 has never been tested in this campaign and it is set unusually low. The recipe uses betas of 0.8 and 0.95, and while t0027 probed beta2 and measured a null, the first moment was left alone. A beta1 of 0.8 averages gradients over roughly 5 steps against the conventional 0.9 which averages over about 10, and that choice is defensible at the batch the recipe was written for, 2**19, where each gradient is already well averaged across many tokens. The champion now trains at 2**17, a quarter of that, so each per-step gradient carries roughly twice the noise it did at the tuned setting, and the natural compensation for noisier gradients is more temporal averaging rather than less. This mirrors the correction that just paid off at t0065, where a constant tuned at the old batch had to be rescaled for the new one. Raising beta1 to 0.9 should lower val_bpb.", "log_path": "/data3/zhubaiyu/fengheguai/campaigns/h200-claude/artifacts/t0067/agent.log", "return_code": 0, "risk": "More first-moment averaging also means slower response when the loss surface changes, which matters most during the warmdown phase that occupies half this budget and is where the model should be settling rather than tracking stale directions. The same tension appeared on the Muon momentum axis, where raising the terminal value from 0.95 to 0.98 cost 0.002361, so this recipe has already shown it prefers less averaging rather than more in its other momentum-like control. That is the strongest argument against this node and makes a regression the outcome I would not be surprised by.", "success": true, "timed_out": false}, "secondary_parent_id": null, "selection_reason": "Exploit a top-K branch selected by quality plus an under-exploration bonus.", "source_sha256": "c876ab7995229bb8a12f2c39c0513d38828e5e625c2662dc6f1c8afe2904e97a", "stage": "refine", "status": "discard", "training_seconds": 300.1, "trial_id": "t0067", "workspace": "/data3/zhubaiyu/fengheguai/campaigns/h200-claude/nodes/t0067"}, "prev_hash": "3e88c1e97a6570c3394376d47998deafedd14069c06fa26aff04379b9de9c037", "seq": 136, "timestamp": "2026-08-21T00:09:24.944173+00:00"}
{"hash": "a6a8a44a0b1b9c737f80334ca1ce184a8032fb4f5772fbc8c510f27763619061", "kind": "trial_started", "payload": {"parent_id": "t0065", "reason": "Spend the configured search share on a distinct architectural or recipe direction.", "secondary_parent_id": null, "stage": "explore", "trial_id": "t0068"}, "prev_hash": "45407725873a0507237082b4490dc9c23dc1dc2ba55c17daed17c273a3967ed3", "seq": 137, "timestamp": "2026-08-21T00:09:24.982116+00:00"}
{"hash": "7d52efd87f4d803dfd293dfb180698d1fe41d751594b808283fd13ffee2f6e3f", "kind": "trial_completed", "payload": {"champion_before": "t0065", "debug_depth": 0, "delta_vs_champion_before": 0.0007985639845629056, "delta_vs_parent": 0.0007985639845629056, "finding": "t0068 did not improve the prior champion: val_bpb=0.972084, delta=+0.000799. Hypothesis: Two independent momentum-like controls in this recipe have now each rejected more temporal averaging, and this node tests whether that is a principle or a coincidence. Raising the Muon terminal momentum from 0.95 to 0.98 cost 0.002361 while lowering it to 0.92 cost only 0.001053, an asymmetry favouring less averaging, and raising Adam beta1 from 0.8 to 0.9 just cost 0.000237. A coherent explanation is that within a 300-second budget the loss surface moves quickly relative to any averaging window, so stale gradient directions are worth less here than responsiveness, and the recipe compensates by keeping every averaging horizon short. If that is right, beta1 should have room below its inherited 0.8, which is already low by convention. Lowering it to 0.7, roughly a 3-step horizon, tests the principle where it is cheapest to test and brackets the axis either way.", "measurements": [{"command": ["/data/home/zhubaiyu/.local/bin/uv", "run", "--project", "/data3/zhubaiyu/fengheguai/campaigns/h200-claude/nodes/t0068", "python", "/data3/zhubaiyu/fengheguai/fengheguai/_audit_runner.py", "--target", "/data3/zhubaiyu/fengheguai/campaigns/h200-claude/nodes/t0068", "--nonce", "b749c99c45a9ef0a39a34053894534026573c74498590fe8"], "errors": [], "evidence_path": "/data3/zhubaiyu/fengheguai/campaigns/h200-claude/evidence/t0068-r0/evidence.json", "evidence_sha256": "d80fafd6a325f9de5dadc84104e4b36023438812ec130cd14847581eb50bc46b", "log_path": "/data3/zhubaiyu/fengheguai/campaigns/h200-claude/evidence/t0068-r0/run.log", "log_sha256": "af60241d23522534f09a7513ba4bc108a1317a434ffde2493407a9f76e691d0d", "metric": 0.9720840206884827, "num_steps": 2836, "peak_vram_mb": 33800.4, "return_code": 0, "status": "valid", "timed_out": false, "train_sha256": "61db1374d16b9565066692273ec06ef8523b8df4f4959b32ddff4fb063ec7d6b", "training_seconds": 300.1, "wall_seconds": 486.7477605249733}], "metric": 0.9720840206884827, "parent_id": "t0065", "patch_path": "/data3/zhubaiyu/fengheguai/campaigns/h200-claude/artifacts/t0068/change.patch", "patch_sha256": "9ede588838cc02191484e2f2bd5919782db03832f7404efd5d890225c225b8c6", "promoted": false, "proposal": {"change_summary": "One constant changed on champion t0065: the first element of ADAM_BETAS from 0.8 to 0.7, leaving beta2 at 0.95. It affects the four groups that receive adam_betas through setup_optimizer, lm_head, wte, the twelve value embeddings and resid_lambdas; the x0_lambdas group hardcodes its own betas and the Muon groups use their own momentum schedule. Batch 2**17, depth 12, width 512, HEAD_DIM 128, document masking, dense value embeddings with the 128-channel gate, output softcap 10, rotary base 30000, the three settled learning rates, SCALAR_LR 0.5, WEIGHT_DECAY 0.146, FINAL_LR_FRAC 0.1 and WARMDOWN_RATIO 0.5 are unchanged.", "command": ["/usr/bin/python3", "/data3/zhubaiyu/fengheguai/fengheguai/rendezvous_agent.py", "--trial", "/data3/zhubaiyu/fengheguai/campaigns/h200-claude/nodes/t0068", "--result", "/data3/zhubaiyu/fengheguai/campaigns/h200-claude/nodes/t0068/.fengheguai-agent-result.json", "--schema", "/data3/zhubaiyu/fengheguai/campaigns/h200-claude/control/agent_output.schema.json", "--campaign", "/data3/zhubaiyu/fengheguai/campaigns/h200-claude", "--inbox", "/data3/zhubaiyu/fengheguai/campaigns/h200-claude-rendezvous"], "errors": [], "expected_val_bpb_effect": "Expected between a 0.0005 decrease and a 0.001 increase versus champion t0065 at 0.971285, with step count unchanged. Together with the 0.9 measurement this brackets beta1 regardless of outcome. The value of the node is mostly in what it says about the principle: if less averaging keeps paying across a third control, that is a compact description of this recipe worth carrying into any future work on it, and if it does not, then 0.8 is simply a tuned optimum and the two earlier results were about their own axes rather than a shared cause.", "hypothesis": "Two independent momentum-like controls in this recipe have now each rejected more temporal averaging, and this node tests whether that is a principle or a coincidence. Raising the Muon terminal momentum from 0.95 to 0.98 cost 0.002361 while lowering it to 0.92 cost only 0.001053, an asymmetry favouring less averaging, and raising Adam beta1 from 0.8 to 0.9 just cost 0.000237. A coherent explanation is that within a 300-second budget the loss surface moves quickly relative to any averaging window, so stale gradient directions are worth less here than responsiveness, and the recipe compensates by keeping every averaging horizon short. If that is right, beta1 should have room below its inherited 0.8, which is already low by convention. Lowering it to 0.7, roughly a 3-step horizon, tests the principle where it is cheapest to test and brackets the axis either way.", "log_path": "/data3/zhubaiyu/fengheguai/campaigns/h200-claude/artifacts/t0068/agent.log", "return_code": 0, "risk": "A 3-step first-moment horizon is short enough that the update becomes close to a raw normalised gradient, which is exactly the regime where Adam loses its advantage over plain sign descent, and at batch 2**17 the per-step gradient is already the noisiest this campaign has run with. The likeliest failure is therefore that this crosses from useful responsiveness into simply tracking noise, and because beta1 also enters the bias correction as 1 - beta1**step, the early steps are affected differently than the late ones, so a regression would not cleanly separate an early-training effect from a steady-state one.", "success": true, "timed_out": false}, "secondary_parent_id": null, "selection_reason": "Spend the configured search share on a distinct architectural or recipe direction.", "source_sha256": "61db1374d16b9565066692273ec06ef8523b8df4f4959b32ddff4fb063ec7d6b", "stage": "explore", "status": "discard", "training_seconds": 300.1, "trial_id": "t0068", "workspace": "/data3/zhubaiyu/fengheguai/campaigns/h200-claude/nodes/t0068"}, "prev_hash": "a6a8a44a0b1b9c737f80334ca1ce184a8032fb4f5772fbc8c510f27763619061", "seq": 138, "timestamp": "2026-08-21T00:18:48.243734+00:00"}
{"hash": "9118931a875e7058f5d8127f85842be3293a6ebd279e67f0c9415b0b2ab8ccdb", "kind": "trial_started", "payload": {"parent_id": "t0065", "reason": "The current line is stalled; make a structurally different bet.", "secondary_parent_id": null, "stage": "explore", "trial_id": "t0069"}, "prev_hash": "7d52efd87f4d803dfd293dfb180698d1fe41d751594b808283fd13ffee2f6e3f", "seq": 139, "timestamp": "2026-08-21T00:18:48.281662+00:00"}
