{"hash": "b9ee88320634b24a361fc6381345f7fdc36afb30de4d6bee7dbce06ebf2c37ab", "kind": "trial_completed", "payload": {"champion_before": "t0076", "debug_depth": 0, "delta_vs_champion_before": 0.002619512049971573, "delta_vs_parent": 0.002619512049971573, "finding": "t0078 did not improve the prior champion: val_bpb=0.972754, delta=+0.002620. Hypothesis: The short-window span is a live axis with a measured gradient and its next point is untested. Narrowing from 1024 to 512 gained 0.001882 at depth 8 and narrowing from 512 to 256 gained 0.000452 at the current configuration, with the step count confirming the mechanism by rising from 2836 to 2874. Halving again to 128 tokens is the next point on that curve. The returns are clearly diminishing, 0.0019 then 0.0005, so a smaller gain or the first regression is expected, and either outcome brackets the axis. t0077 also just showed that the span effect and the global-layer count are close to additive rather than coupled, since narrowing the span was worth 0.000452 at four long layers and 0.000377 at five, which means this can be read as a clean single-axis measurement rather than an interaction.", "measurements": [{"command": ["/data/home/zhubaiyu/.local/bin/uv", "run", "--project", "/data3/zhubaiyu/fengheguai/campaigns/h200-claude/nodes/t0078", "python", "/data3/zhubaiyu/fengheguai/fengheguai/_audit_runner.py", "--target", "/data3/zhubaiyu/fengheguai/campaigns/h200-claude/nodes/t0078", "--nonce", "f89be678a0abaed55b642e6ce80c7f872e2674091fcd9f3a"], "errors": [], "evidence_path": "/data3/zhubaiyu/fengheguai/campaigns/h200-claude/evidence/t0078-r0/evidence.json", "evidence_sha256": "e790fd32db0f5900e88307eb867c80c99ba85a9ff36a94e054da829a6a9d2f1c", "log_path": "/data3/zhubaiyu/fengheguai/campaigns/h200-claude/evidence/t0078-r0/run.log", "log_sha256": "62bde2ce74e6972d451e5cc4c67c391bbac5fc72fbfa2e74779fac350f57a953", "metric": 0.9694694880804149, "num_steps": 2905, "peak_vram_mb": 33800.4, "return_code": 0, "status": "valid", "timed_out": false, "train_sha256": "81c5e436b01e40d5fd02e3bc72cff879da28bb1fd5c485947facfb716fa3bb98", "training_seconds": 300.0, "wall_seconds": 566.9151334920898}, {"command": ["/data/home/zhubaiyu/.local/bin/uv", "run", "--project", "/data3/zhubaiyu/fengheguai/campaigns/h200-claude/nodes/t0078", "python", "/data3/zhubaiyu/fengheguai/fengheguai/_audit_runner.py", "--target", "/data3/zhubaiyu/fengheguai/campaigns/h200-claude/nodes/t0078", "--nonce", "65e64cd123bca82a24d9c32fe0b74634887aab8dcb58e5eb"], "errors": [], "evidence_path": "/data3/zhubaiyu/fengheguai/campaigns/h200-claude/evidence/t0078-r1/evidence.json", "evidence_sha256": "d515d8d838cdd92952193edb1d4abfd5bff8e5090d744a30f57e986650d12d81", "log_path": "/data3/zhubaiyu/fengheguai/campaigns/h200-claude/evidence/t0078-r1/run.log", "log_sha256": "44a079f9b096906b8fef5f597798f7ad4eea50d84a2e660585b21cbdd42cf922", "metric": 0.9760393583502471, "num_steps": 2593, "peak_vram_mb": 33800.4, "return_code": 0, "status": "valid", "timed_out": false, "train_sha256": "81c5e436b01e40d5fd02e3bc72cff879da28bb1fd5c485947facfb716fa3bb98", "training_seconds": 300.0, "wall_seconds": 481.56788951717317}], "metric": 0.972754423215331, "parent_id": "t0076", "patch_path": "/data3/zhubaiyu/fengheguai/campaigns/h200-claude/artifacts/t0078/change.patch", "patch_sha256": "9ee63040fef27859414739d9275cc035282b3385883394dee3ed200a01edeb68", "promoted": false, "proposal": {"change_summary": "One expression changed on champion t0076: short_window in GPT._compute_window_sizes from long_window // 8 to long_window // 16, so the eight short layers of the SSL pattern attend over 128 tokens instead of 256. The four full-context layers at indices 2, 5, 8 and 11 keep the full 2048 span and the pattern is unchanged. The fifth global layer tested in t0077 is not carried forward, having cost 0.000456. Depth 12, width 512, HEAD_DIM 128, document masking, dense value embeddings with the 128-channel gate, output softcap 13, rotary base 30000, batch 2**17, the three settled learning rates, SCALAR_LR 0.5, ADAM_BETAS 0.8 and 0.95, WEIGHT_DECAY 0.146, FINAL_LR_FRAC 0.1 and WARMDOWN_RATIO 0.5 are unchanged.", "command": ["/usr/bin/python3", "/data3/zhubaiyu/fengheguai/fengheguai/rendezvous_agent.py", "--trial", "/data3/zhubaiyu/fengheguai/campaigns/h200-claude/nodes/t0078", "--result", "/data3/zhubaiyu/fengheguai/campaigns/h200-claude/nodes/t0078/.fengheguai-agent-result.json", "--schema", "/data3/zhubaiyu/fengheguai/campaigns/h200-claude/control/agent_output.schema.json", "--campaign", "/data3/zhubaiyu/fengheguai/campaigns/h200-claude", "--inbox", "/data3/zhubaiyu/fengheguai/campaigns/h200-claude-rendezvous"], "errors": [], "expected_val_bpb_effect": "Expected between a 0.0003 decrease and a 0.001 increase versus champion t0076 at 0.970135, with the step count rising by perhaps 1 percent from 2874. The FLOPs freed shrink each time this halves, since the short layers now contribute only about 12.6M per-token FLOPs out of roughly 320M, so at most half of that is recoverable and the quality cost of a 128-token context grows as the span approaches the scale of a sentence.", "hypothesis": "The short-window span is a live axis with a measured gradient and its next point is untested. Narrowing from 1024 to 512 gained 0.001882 at depth 8 and narrowing from 512 to 256 gained 0.000452 at the current configuration, with the step count confirming the mechanism by rising from 2836 to 2874. Halving again to 128 tokens is the next point on that curve. The returns are clearly diminishing, 0.0019 then 0.0005, so a smaller gain or the first regression is expected, and either outcome brackets the axis. t0077 also just showed that the span effect and the global-layer count are close to additive rather than coupled, since narrowing the span was worth 0.000452 at four long layers and 0.000377 at five, which means this can be read as a clean single-axis measurement rather than an interaction.", "log_path": "/data3/zhubaiyu/fengheguai/campaigns/h200-claude/artifacts/t0078/agent.log", "return_code": 0, "risk": "A 128-token window is short enough that the eight short layers can no longer see a full paragraph, and because document masking already truncates attention at document starts, positions early in a document would see far less than 128 tokens. The mechanism that made previous narrowings pay was converting attention FLOPs into steps, and that conversion has been consistently poor in this campaign, roughly a quarter of what the FLOP model predicts, so the remaining upside is small while the context loss is real. This is the last untested point in the direction that has been productive, and if it regresses the span is settled at 256.", "success": true, "timed_out": false}, "secondary_parent_id": null, "selection_reason": "Exploit a top-K branch selected by quality plus an under-exploration bonus.", "source_sha256": "81c5e436b01e40d5fd02e3bc72cff879da28bb1fd5c485947facfb716fa3bb98", "stage": "refine", "status": "discard", "training_seconds": 300.0, "trial_id": "t0078", "workspace": "/data3/zhubaiyu/fengheguai/campaigns/h200-claude/nodes/t0078"}, "prev_hash": "d6e566fb62f9d940a357a75425e9ffc75860d510bbbff7072d1ecfa806beb1d8", "seq": 158, "timestamp": "2026-08-21T02:30:34.436960+00:00"}
{"hash": "5fa5ad9d18d68885e76b468ce032c0d59254866853857610fba8ab701c7d912a", "kind": "trial_started", "payload": {"parent_id": "t0076", "reason": "Exploit a top-K branch selected by quality plus an under-exploration bonus.", "secondary_parent_id": null, "stage": "refine", "trial_id": "t0079"}, "prev_hash": "b9ee88320634b24a361fc6381345f7fdc36afb30de4d6bee7dbce06ebf2c37ab", "seq": 159, "timestamp": "2026-08-21T02:30:34.481308+00:00"}
{"hash": "0165a32dc31f1e419722a2de9b99bf5cf74f9d3da8b02d22acb3253df5cb02fc", "kind": "trial_completed", "payload": {"champion_before": "t0076", "debug_depth": 0, "delta_vs_champion_before": 0.000288486547868394, "delta_vs_parent": 0.000288486547868394, "finding": "t0079 did not improve the prior champion: val_bpb=0.970423, delta=+0.000288. Hypothesis: The short-window curve is now bracketed on both sides and its shape says the minimum is not exactly at the point measured. At the current configuration 512 costs 0.000454, 256 is the champion and 128 costs 0.002619, so the penalty for halving below the champion is roughly six times the penalty for doubling above it. A curve that steep on one side and shallow on the other has its true minimum displaced toward the shallow side, which here means above 256 rather than below. The span has only ever been sampled at powers of two because the expression is a divisor of the 2048 long window, but nothing requires that: setting it to long_window times 3 over 16 gives 384, the midpoint in log space between 256 and 512, and tests whether the optimum sits between the two sampled points.", "measurements": [{"command": ["/data/home/zhubaiyu/.local/bin/uv", "run", "--project", "/data3/zhubaiyu/fengheguai/campaigns/h200-claude/nodes/t0079", "python", "/data3/zhubaiyu/fengheguai/fengheguai/_audit_runner.py", "--target", "/data3/zhubaiyu/fengheguai/campaigns/h200-claude/nodes/t0079", "--nonce", "15dd9e645faf347248be46a6aebbc17f54fd1e333a403bc4"], "errors": [], "evidence_path": "/data3/zhubaiyu/fengheguai/campaigns/h200-claude/evidence/t0079-r0/evidence.json", "evidence_sha256": "5c0b47305f19941362ee15fcd6eb2752d1dd7b497a10eb688e3cbb084881dd5f", "log_path": "/data3/zhubaiyu/fengheguai/campaigns/h200-claude/evidence/t0079-r0/run.log", "log_sha256": "6b8bb068c169ab5154f36d7c95db0de2772b708cf8f16d7c01de0956fbbb98ec", "metric": 0.9704233977132278, "num_steps": 2851, "peak_vram_mb": 33800.4, "return_code": 0, "status": "valid", "timed_out": false, "train_sha256": "be43b08fba2dfb4864facf3b49600ae4f995d545bc4ed816fbcf70fbccc82c27", "training_seconds": 300.1, "wall_seconds": 564.8185558663681}], "metric": 0.9704233977132278, "parent_id": "t0076", "patch_path": "/data3/zhubaiyu/fengheguai/campaigns/h200-claude/artifacts/t0079/change.patch", "patch_sha256": "690313c14d97d52861aab4b9ccb523e6616b31366127d12d0f2d9f93883eeba1", "promoted": false, "proposal": {"change_summary": "One expression changed on champion t0076: short_window in GPT._compute_window_sizes from long_window // 8 to long_window * 3 // 16, so the eight short layers of the SSL pattern attend over 384 tokens instead of 256. Integer arithmetic keeps the result exact at 384 for a 2048 long window. The four full-context layers at indices 2, 5, 8 and 11 are unchanged, as is the pattern. Depth 12, width 512, HEAD_DIM 128, document masking, dense value embeddings with the 128-channel gate, output softcap 13, rotary base 30000, batch 2**17, the three settled learning rates, SCALAR_LR 0.5, ADAM_BETAS 0.8 and 0.95, WEIGHT_DECAY 0.146, FINAL_LR_FRAC 0.1 and WARMDOWN_RATIO 0.5 are unchanged.", "command": ["/usr/bin/python3", "/data3/zhubaiyu/fengheguai/fengheguai/rendezvous_agent.py", "--trial", "/data3/zhubaiyu/fengheguai/campaigns/h200-claude/nodes/t0079", "--result", "/data3/zhubaiyu/fengheguai/campaigns/h200-claude/nodes/t0079/.fengheguai-agent-result.json", "--schema", "/data3/zhubaiyu/fengheguai/campaigns/h200-claude/control/agent_output.schema.json", "--campaign", "/data3/zhubaiyu/fengheguai/campaigns/h200-claude", "--inbox", "/data3/zhubaiyu/fengheguai/campaigns/h200-claude-rendezvous"], "errors": [], "expected_val_bpb_effect": "Expected between a 0.0003 decrease and a 0.0004 increase versus champion t0076 at 0.970135, with the step count falling by well under one percent since the short layers contribute only about 12.6M of roughly 314M per-token FLOPs at 256 and this adds about 6M. The case for a gain rests entirely on the asymmetry of the measured curve rather than on any new mechanism, so the effect if real should be small, and a null would mean the minimum is flat between 256 and 384.", "hypothesis": "The short-window curve is now bracketed on both sides and its shape says the minimum is not exactly at the point measured. At the current configuration 512 costs 0.000454, 256 is the champion and 128 costs 0.002619, so the penalty for halving below the champion is roughly six times the penalty for doubling above it. A curve that steep on one side and shallow on the other has its true minimum displaced toward the shallow side, which here means above 256 rather than below. The span has only ever been sampled at powers of two because the expression is a divisor of the 2048 long window, but nothing requires that: setting it to long_window times 3 over 16 gives 384, the midpoint in log space between 256 and 512, and tests whether the optimum sits between the two sampled points.", "log_path": "/data3/zhubaiyu/fengheguai/campaigns/h200-claude/artifacts/t0079/agent.log", "return_code": 0, "risk": "Reading a minimum off three points assumes the curve is smooth and single-peaked, which is plausible for a context-length axis but not guaranteed, and the asymmetry could instead reflect that 128 crosses a threshold where the span stops covering typical local structure rather than that the optimum lies above 256. This is also a small expected effect against a 0.00013 repeat noise level, so a near-tie is a likely outcome and I would treat the span as settled at 256 rather than sample a fourth point.", "success": true, "timed_out": false}, "secondary_parent_id": null, "selection_reason": "Exploit a top-K branch selected by quality plus an under-exploration bonus.", "source_sha256": "be43b08fba2dfb4864facf3b49600ae4f995d545bc4ed816fbcf70fbccc82c27", "stage": "refine", "status": "discard", "training_seconds": 300.1, "trial_id": "t0079", "workspace": "/data3/zhubaiyu/fengheguai/campaigns/h200-claude/nodes/t0079"}, "prev_hash": "5fa5ad9d18d68885e76b468ce032c0d59254866853857610fba8ab701c7d912a", "seq": 160, "timestamp": "2026-08-21T02:40:59.824611+00:00"}
{"hash": "57c4f8a42ff4331f4eb03da87eb31f3823a81fd7f1a952ba10f174d274e590fa", "kind": "trial_started", "payload": {"parent_id": "t0076", "reason": "The current line is stalled; make a structurally different bet.", "secondary_parent_id": null, "stage": "explore", "trial_id": "t0080"}, "prev_hash": "0165a32dc31f1e419722a2de9b99bf5cf74f9d3da8b02d22acb3253df5cb02fc", "seq": 161, "timestamp": "2026-08-21T02:40:59.869028+00:00"}
{"hash": "507b4891aa865a99abd019286ba1f2da69de7e783d890d8fb6bcfae41ed4e027", "kind": "trial_completed", "payload": {"champion_before": "t0076", "debug_depth": 0, "delta_vs_champion_before": 0.00033267347049503737, "delta_vs_parent": 0.00033267347049503737, "finding": "t0080 did not improve the prior champion: val_bpb=0.970468, delta=+0.000333. Hypothesis: Every short layer is forced to the same span, and the span results suggest that is the wrong constraint rather than the wrong value. Uniform 256 beats uniform 512 by 0.000454 and uniform 128 by 0.002619, so the optimum is sharp, but it is an optimum over a single number applied to eight layers at very different depths. Early layers build local features from raw token embeddings and plausibly need little context, while later short layers operate on representations that have already been mixed by the global layers below them and may want more. A graded schedule tests that directly: the eight short layers take spans rising linearly from 128 to 384 instead of all sitting at 256. The mean span is held at exactly 256 by construction, so this isolates the distribution of context across depth from the amount of it, and any difference is attributable to grading rather than to spending more or less attention overall.", "measurements": [{"command": ["/data/home/zhubaiyu/.local/bin/uv", "run", "--project", "/data3/zhubaiyu/fengheguai/campaigns/h200-claude/nodes/t0080", "python", "/data3/zhubaiyu/fengheguai/fengheguai/_audit_runner.py", "--target", "/data3/zhubaiyu/fengheguai/campaigns/h200-claude/nodes/t0080", "--nonce", "d63a41dbe7da58eabdc53a67db2caeddfab4df380a7e3e51"], "errors": [], "evidence_path": "/data3/zhubaiyu/fengheguai/campaigns/h200-claude/evidence/t0080-r0/evidence.json", "evidence_sha256": "9b5eb08f8d11295da0d84a194888a1ca83cb373ed3485c2272a29ebdbd4b861a", "log_path": "/data3/zhubaiyu/fengheguai/campaigns/h200-claude/evidence/t0080-r0/run.log", "log_sha256": "e534c57366ceb211f8e9a3513858db313c0bab632c7406d15ee0d6710f2e516b", "metric": 0.9704675846358545, "num_steps": 2869, "peak_vram_mb": 33800.4, "return_code": 0, "status": "valid", "timed_out": false, "train_sha256": "559a6729885086789271cdd128bc66981aace7501afc3b9f8904ca9342a07af7", "training_seconds": 300.1, "wall_seconds": 562.9667771859095}], "metric": 0.9704675846358545, "parent_id": "t0076", "patch_path": "/data3/zhubaiyu/fengheguai/campaigns/h200-claude/artifacts/t0080/change.patch", "patch_sha256": "b4e3b2e56d96059348f2bd45d07e5e9bfdd1555f5b9383a55923062d1e00d2a0", "promoted": false, "proposal": {"change_summary": "Structural change to GPT._compute_window_sizes on champion t0076. Instead of mapping every S in the pattern to a single short_window, the short layers now receive spans interpolated linearly from short_window//2 to short_window*3//2, which is 128 to 384 for the current 256 setting, in order of appearance down the stack. Long layers and the forced full-context final layer are untouched, so the SSL pattern still places 2048-token layers at indices 2, 5, 8 and 11. The verified layout is 128, 164, 2048, 237, 274, 2048, 347, 384, 2048, 201, 310, 2048 across the twelve layers, with the eight short spans averaging exactly 256. Depth 12, width 512, HEAD_DIM 128, document masking, dense value embeddings with the 128-channel gate, output softcap 13, rotary base 30000, batch 2**17, the three settled learning rates, SCALAR_LR 0.5, ADAM_BETAS 0.8 and 0.95, WEIGHT_DECAY 0.146, FINAL_LR_FRAC 0.1 and WARMDOWN_RATIO 0.5 are unchanged.", "command": ["/usr/bin/python3", "/data3/zhubaiyu/fengheguai/fengheguai/rendezvous_agent.py", "--trial", "/data3/zhubaiyu/fengheguai/campaigns/h200-claude/nodes/t0080", "--result", "/data3/zhubaiyu/fengheguai/campaigns/h200-claude/nodes/t0080/.fengheguai-agent-result.json", "--schema", "/data3/zhubaiyu/fengheguai/campaigns/h200-claude/control/agent_output.schema.json", "--campaign", "/data3/zhubaiyu/fengheguai/campaigns/h200-claude", "--inbox", "/data3/zhubaiyu/fengheguai/campaigns/h200-claude-rendezvous"], "errors": [], "expected_val_bpb_effect": "Expected between a 0.001 decrease and a 0.001 increase versus champion t0076 at 0.970135, with step count essentially unchanged since the mean span and therefore the attention FLOP total are held constant by construction. This is a genuine structural question rather than a coordinate: if a single span really is optimal for all depths then the grading costs nothing and gains nothing, whereas if receptive field should grow with depth the same FLOP budget buys a better allocation.", "hypothesis": "Every short layer is forced to the same span, and the span results suggest that is the wrong constraint rather than the wrong value. Uniform 256 beats uniform 512 by 0.000454 and uniform 128 by 0.002619, so the optimum is sharp, but it is an optimum over a single number applied to eight layers at very different depths. Early layers build local features from raw token embeddings and plausibly need little context, while later short layers operate on representations that have already been mixed by the global layers below them and may want more. A graded schedule tests that directly: the eight short layers take spans rising linearly from 128 to 384 instead of all sitting at 256. The mean span is held at exactly 256 by construction, so this isolates the distribution of context across depth from the amount of it, and any difference is attributable to grading rather than to spending more or less attention overall.", "log_path": "/data3/zhubaiyu/fengheguai/campaigns/h200-claude/artifacts/t0080/agent.log", "return_code": 0, "risk": "The grading direction is a guess. It is equally arguable that early layers need wide context to disambiguate tokens while later ones can rely on the global layers below them, in which case the correct schedule is descending and this node measures the wrong sign; a regression would therefore be informative but would not distinguish between grading being useless and grading being backwards. The interpolation also interacts with the pattern in a way the layout shows plainly: because the short layers are not contiguous, the spans do not increase monotonically down the stack, and the layer at index 9 gets 201 tokens after index 7 received 384.", "success": true, "timed_out": false}, "secondary_parent_id": null, "selection_reason": "The current line is stalled; make a structurally different bet.", "source_sha256": "559a6729885086789271cdd128bc66981aace7501afc3b9f8904ca9342a07af7", "stage": "explore", "status": "discard", "training_seconds": 300.1, "trial_id": "t0080", "workspace": "/data3/zhubaiyu/fengheguai/campaigns/h200-claude/nodes/t0080"}, "prev_hash": "57c4f8a42ff4331f4eb03da87eb31f3823a81fd7f1a952ba10f174d274e590fa", "seq": 162, "timestamp": "2026-08-21T02:51:33.335414+00:00"}
{"hash": "852d786f67a4dc222abee400e4527abe81a6939ae1d87fe20a1daedf78a270f0", "kind": "trial_started", "payload": {"parent_id": "t0076", "reason": "The current line is stalled; make a structurally different bet.", "secondary_parent_id": null, "stage": "explore", "trial_id": "t0081"}, "prev_hash": "507b4891aa865a99abd019286ba1f2da69de7e783d890d8fb6bcfae41ed4e027", "seq": 163, "timestamp": "2026-08-21T02:51:33.381199+00:00"}
