{"hash": "333480304be21b155f35265c7c85c84b2c436345c4a1d454ab1a755dcb2e9df8", "kind": "trial_completed", "payload": {"champion_before": "t0087", "debug_depth": 0, "delta_vs_champion_before": -0.0008884319552485698, "delta_vs_parent": -0.0008884319552485698, "finding": "t0089 improved the prior champion: val_bpb=0.968389, delta=-0.000888. Hypothesis: Correcting the value-embedding initialisation changed what learning rate that path should want, and the earlier measurement of its rate was taken under the broken init. t0087 rescaled the tables from element RMS 0.044 to 1.0, matching the v stream, and gained 0.000858; t0088 then showed the axis is flat above parity, so the scale is right. Under the old init the tables began 22.6 times too small and had to grow into relevance inside 300 seconds, which is a condition that rewards a fast rate. That is the regime in which t0023 tested a decoupled value-embedding rate of 0.9 and found it slightly worse than the shared 0.6, and in which every other embedding-rate result was collected. Now that the path starts at the scale it needs, the rate no longer has to fund growth and can instead be tuned for stability, so a lower rate should help. This node decouples the two groups again and halves the value-embedding rate to 0.3 while wte keeps 0.6.", "measurements": [{"command": ["/data/home/zhubaiyu/.local/bin/uv", "run", "--project", "/data3/zhubaiyu/fengheguai/campaigns/h200-claude/nodes/t0089", "python", "/data3/zhubaiyu/fengheguai/fengheguai/_audit_runner.py", "--target", "/data3/zhubaiyu/fengheguai/campaigns/h200-claude/nodes/t0089", "--nonce", "bcdb786fa994dcb1f44e1052c1d70dafb936b6447e1c0da1"], "errors": [], "evidence_path": "/data3/zhubaiyu/fengheguai/campaigns/h200-claude/evidence/t0089-r0/evidence.json", "evidence_sha256": "7f1b2693aecc4faf78ada727a88adae1c6919b4c1d0755285236c82d1aeeab91", "log_path": "/data3/zhubaiyu/fengheguai/campaigns/h200-claude/evidence/t0089-r0/run.log", "log_sha256": "7b1f4a8d33b6d9e90dacbbdfb78ae35037d7020080eb6792e3a23501a11b82c4", "metric": 0.968342122518829, "num_steps": 2875, "peak_vram_mb": 33800.4, "return_code": 0, "status": "valid", "timed_out": false, "train_sha256": "33a9c7466e6ee0bb5b0a368c7bfaec7f4048746105a3a91ed464b0b244093ed7", "training_seconds": 300.1, "wall_seconds": 484.60215871874243}, {"command": ["/data/home/zhubaiyu/.local/bin/uv", "run", "--project", "/data3/zhubaiyu/fengheguai/campaigns/h200-claude/nodes/t0089", "python", "/data3/zhubaiyu/fengheguai/fengheguai/_audit_runner.py", "--target", "/data3/zhubaiyu/fengheguai/campaigns/h200-claude/nodes/t0089", "--nonce", "9604a7128b75ccda7d2763c7a4ee039d0dbc14a9af912973"], "errors": [], "evidence_path": "/data3/zhubaiyu/fengheguai/campaigns/h200-claude/evidence/t0089-r1/evidence.json", "evidence_sha256": "f05557f48c5820098edb20cf47d4387259fa31ec604bb73ec46887da2c08731f", "log_path": "/data3/zhubaiyu/fengheguai/campaigns/h200-claude/evidence/t0089-r1/run.log", "log_sha256": "9c14eb667a9d88c5cfe5a9a2d23de1247ed9edb3d1e556a922f170fb2f10adc1", "metric": 0.9684353546678762, "num_steps": 2873, "peak_vram_mb": 33800.4, "return_code": 0, "status": "valid", "timed_out": false, "train_sha256": "33a9c7466e6ee0bb5b0a368c7bfaec7f4048746105a3a91ed464b0b244093ed7", "training_seconds": 300.1, "wall_seconds": 479.69692409504205}], "metric": 0.9683887385933526, "parent_id": "t0087", "patch_path": "/data3/zhubaiyu/fengheguai/campaigns/h200-claude/artifacts/t0089/change.patch", "patch_sha256": "11a83b1066a949a699674099290e8db39974c1f5d371ec30a6c9554690f826d8", "promoted": true, "proposal": {"change_summary": "Optimizer change on champion t0087, reintroducing the plumbing first tried in t0023: setup_optimizer gains a value_embedding_lr argument defaulting to embedding_lr, so behaviour is unchanged unless supplied, and the existing separate value_embeds parameter group uses it. A new VALUE_EMBEDDING_LR constant of 0.3 is passed at the call site while EMBEDDING_LR stays 0.6 for transformer.wte. The corrected value-embedding init of uniform plus or minus sqrt(3) from t0087 is retained; the doubling from t0088 is not, having measured null. Depth 12, width 512, HEAD_DIM 128, the SSL pattern with a 256-token short span, document masking, dense value embeddings with the 128-channel gate, output softcap 13, rotary base 30000, batch 2**17, UNEMBEDDING_LR 0.002, MATRIX_LR 0.0163, SCALAR_LR 0.5, ADAM_BETAS 0.8 and 0.95, WEIGHT_DECAY 0.146, FINAL_LR_FRAC 0.1 and WARMDOWN_RATIO 0.5 are unchanged.", "command": ["/usr/bin/python3", "/data3/zhubaiyu/fengheguai/fengheguai/rendezvous_agent.py", "--trial", "/data3/zhubaiyu/fengheguai/campaigns/h200-claude/nodes/t0089", "--result", "/data3/zhubaiyu/fengheguai/campaigns/h200-claude/nodes/t0089/.fengheguai-agent-result.json", "--schema", "/data3/zhubaiyu/fengheguai/campaigns/h200-claude/control/agent_output.schema.json", "--campaign", "/data3/zhubaiyu/fengheguai/campaigns/h200-claude", "--inbox", "/data3/zhubaiyu/fengheguai/campaigns/h200-claude-rendezvous"], "errors": [], "expected_val_bpb_effect": "Expected between a 0.001 decrease and a 0.001 increase versus champion t0087 at 0.969277, with step count unchanged. The argument is an interaction rather than a fresh axis: the init fix removed the reason the rate needed to be fast, so this tests whether the previously measured preference was conditional on a defect that has since been repaired. A regression would mean the rate preference is independent of the starting scale, which is also worth knowing since it would close the embedding-rate question for good.", "hypothesis": "Correcting the value-embedding initialisation changed what learning rate that path should want, and the earlier measurement of its rate was taken under the broken init. t0087 rescaled the tables from element RMS 0.044 to 1.0, matching the v stream, and gained 0.000858; t0088 then showed the axis is flat above parity, so the scale is right. Under the old init the tables began 22.6 times too small and had to grow into relevance inside 300 seconds, which is a condition that rewards a fast rate. That is the regime in which t0023 tested a decoupled value-embedding rate of 0.9 and found it slightly worse than the shared 0.6, and in which every other embedding-rate result was collected. Now that the path starts at the scale it needs, the rate no longer has to fund growth and can instead be tuned for stability, so a lower rate should help. This node decouples the two groups again and halves the value-embedding rate to 0.3 while wte keeps 0.6.", "log_path": "/data3/zhubaiyu/fengheguai/campaigns/h200-claude/artifacts/t0089/agent.log", "return_code": 0, "risk": "The value embeddings hold roughly 50M parameters and are the most load-bearing mechanism measured here, so halving their rate is a large intervention on a sensitive path and could simply underfit them within the budget. The reasoning is also indirect: t0023 measured 0.9 against 0.6 and found 0.9 slightly worse, which establishes that faster was not better even under the broken init, and does not by itself imply that slower is better now. If this regresses, the correct reading is that 0.6 suits the group at either scale rather than that decoupling is pointless.", "success": true, "timed_out": false}, "secondary_parent_id": null, "selection_reason": "Spend the configured search share on a distinct architectural or recipe direction.", "source_sha256": "33a9c7466e6ee0bb5b0a368c7bfaec7f4048746105a3a91ed464b0b244093ed7", "stage": "explore", "status": "keep", "training_seconds": 300.1, "trial_id": "t0089", "workspace": "/data3/zhubaiyu/fengheguai/campaigns/h200-claude/nodes/t0089"}, "prev_hash": "564f45ab8ebf3124a61e185564f9a41da70d4195e982be535b79f1062fa61c5b", "seq": 180, "timestamp": "2026-08-21T04:34:58.851536+00:00"}
{"hash": "1673857ad8c97933f98338d915054bc19751a721642b0754c10266b64c9ef7bb", "kind": "trial_started", "payload": {"parent_id": "t0089", "reason": "Exploit a top-K branch selected by quality plus an under-exploration bonus.", "secondary_parent_id": null, "stage": "refine", "trial_id": "t0090"}, "prev_hash": "333480304be21b155f35265c7c85c84b2c436345c4a1d454ab1a755dcb2e9df8", "seq": 181, "timestamp": "2026-08-21T04:34:58.902762+00:00"}
{"hash": "5a2baebd4e9a30f3ea45e1aeb2e892368825a01212af5b06d02584d31603ba38", "kind": "trial_completed", "payload": {"champion_before": "t0089", "debug_depth": 0, "delta_vs_champion_before": 0.0001390164972965291, "delta_vs_parent": 0.0001390164972965291, "finding": "t0090 did not improve the prior champion: val_bpb=0.968528, delta=+0.000139. Hypothesis: The value-embedding rate is a live axis with a large measured gradient and only one side explored. Halving it from the shared 0.6 to a decoupled 0.3 gained 0.000888, one of the largest single gains in this campaign and about seven times the repeat noise. The mechanism behind it is specific: t0087 fixed an initialisation that had these tables starting 22.6 times smaller than the v stream they feed, and a path that no longer has to grow into relevance does not need a rate sized for growth. That argument does not stop at 0.3. If the rate was funding growth that the init now supplies, the correct rate is whatever suits a table already at the right scale, and nothing measured so far locates it. Halving again to 0.15 tests whether the gradient continues or whether 0.3 is the turning point, and either result brackets the axis against the 0.6 measurement.", "measurements": [{"command": ["/data/home/zhubaiyu/.local/bin/uv", "run", "--project", "/data3/zhubaiyu/fengheguai/campaigns/h200-claude/nodes/t0090", "python", "/data3/zhubaiyu/fengheguai/fengheguai/_audit_runner.py", "--target", "/data3/zhubaiyu/fengheguai/campaigns/h200-claude/nodes/t0090", "--nonce", "8e4fc44b5fc2ad41184e15ee7bd2edbefd4ccefa44453cf3"], "errors": [], "evidence_path": "/data3/zhubaiyu/fengheguai/campaigns/h200-claude/evidence/t0090-r0/evidence.json", "evidence_sha256": "45117c08559885a001b0094a88a127d1f7b70e5bc041a70061f1473dc3c4da4f", "log_path": "/data3/zhubaiyu/fengheguai/campaigns/h200-claude/evidence/t0090-r0/run.log", "log_sha256": "154add64d0224a1631b543e0ef38c1d281bbf9820f4e4a8ece866fbd3527ffc3", "metric": 0.9685277550906491, "num_steps": 2875, "peak_vram_mb": 33800.4, "return_code": 0, "status": "valid", "timed_out": false, "train_sha256": "6e0981daec322ffc9b6b6db218466a3765c329aaa431a98d0a458b4a963bb4b6", "training_seconds": 300.0, "wall_seconds": 485.84329506289214}], "metric": 0.9685277550906491, "parent_id": "t0089", "patch_path": "/data3/zhubaiyu/fengheguai/campaigns/h200-claude/artifacts/t0090/change.patch", "patch_sha256": "d4617c41ada6146215f2459eb3d11de5d228503e77032232bdca2da51f555c56", "promoted": false, "proposal": {"change_summary": "One learning rate changed on champion t0089: VALUE_EMBEDDING_LR from 0.3 to 0.15, affecting only the value-embedding AdamW group, roughly 50M parameters across twelve tables. EMBEDDING_LR stays 0.6 for transformer.wte, UNEMBEDDING_LR stays 0.002 and MATRIX_LR stays 0.0163. The corrected value-embedding init of uniform plus or minus sqrt(3) is retained. Depth 12, width 512, HEAD_DIM 128, the SSL pattern with a 256-token short span, document masking, dense value embeddings with the 128-channel gate, output softcap 13, rotary base 30000, batch 2**17, SCALAR_LR 0.5, ADAM_BETAS 0.8 and 0.95, WEIGHT_DECAY 0.146, FINAL_LR_FRAC 0.1 and WARMDOWN_RATIO 0.5 are unchanged.", "command": ["/usr/bin/python3", "/data3/zhubaiyu/fengheguai/fengheguai/rendezvous_agent.py", "--trial", "/data3/zhubaiyu/fengheguai/campaigns/h200-claude/nodes/t0090", "--result", "/data3/zhubaiyu/fengheguai/campaigns/h200-claude/nodes/t0090/.fengheguai-agent-result.json", "--schema", "/data3/zhubaiyu/fengheguai/campaigns/h200-claude/control/agent_output.schema.json", "--campaign", "/data3/zhubaiyu/fengheguai/campaigns/h200-claude", "--inbox", "/data3/zhubaiyu/fengheguai/campaigns/h200-claude-rendezvous"], "errors": [], "expected_val_bpb_effect": "Expected between a 0.001 decrease and a 0.001 increase versus champion t0089 at 0.968389, with step count unchanged. The prior favours a smaller gain than the last step or a first regression, since a rate this low starts to limit how much the tables can adapt within 2874 steps, but the gradient from 0.6 to 0.3 was steep enough that the optimum is unlikely to sit exactly at 0.3.", "hypothesis": "The value-embedding rate is a live axis with a large measured gradient and only one side explored. Halving it from the shared 0.6 to a decoupled 0.3 gained 0.000888, one of the largest single gains in this campaign and about seven times the repeat noise. The mechanism behind it is specific: t0087 fixed an initialisation that had these tables starting 22.6 times smaller than the v stream they feed, and a path that no longer has to grow into relevance does not need a rate sized for growth. That argument does not stop at 0.3. If the rate was funding growth that the init now supplies, the correct rate is whatever suits a table already at the right scale, and nothing measured so far locates it. Halving again to 0.15 tests whether the gradient continues or whether 0.3 is the turning point, and either result brackets the axis against the 0.6 measurement.", "log_path": "/data3/zhubaiyu/fengheguai/campaigns/h200-claude/artifacts/t0090/agent.log", "return_code": 0, "risk": "These tables are the largest parameter block in the model and their content is what the mechanism contributes, so too low a rate means they stay near their random initialisation and the path degenerates into fixed random noise added to the value stream, gated per token. That failure would look like a clean regression rather than instability. The interaction with the corrected init also cuts the other way at some point: an init at the right scale reduces how much the rate must do, but it does not eliminate the need to learn useful content, and 0.15 is a quarter of the value every other embedding measurement in this campaign was taken at.", "success": true, "timed_out": false}, "secondary_parent_id": null, "selection_reason": "Exploit a top-K branch selected by quality plus an under-exploration bonus.", "source_sha256": "6e0981daec322ffc9b6b6db218466a3765c329aaa431a98d0a458b4a963bb4b6", "stage": "refine", "status": "discard", "training_seconds": 300.0, "trial_id": "t0090", "workspace": "/data3/zhubaiyu/fengheguai/campaigns/h200-claude/nodes/t0090"}, "prev_hash": "1673857ad8c97933f98338d915054bc19751a721642b0754c10266b64c9ef7bb", "seq": 182, "timestamp": "2026-08-21T04:43:59.293468+00:00"}
{"hash": "309bd5b9df9e2f1dbd2e501ca66efe9cb5da47775c4e6d0a6142fa740dbf0aa7", "kind": "trial_started", "payload": {"parent_id": "t0089", "reason": "Recombine two independently strong branches at the scheduled synthesis step.", "secondary_parent_id": "t0090", "stage": "recombine", "trial_id": "t0091"}, "prev_hash": "5a2baebd4e9a30f3ea45e1aeb2e892368825a01212af5b06d02584d31603ba38", "seq": 183, "timestamp": "2026-08-21T04:43:59.344705+00:00"}
{"hash": "afb314d3cc5b99901196be08e0ddaacf7409d6462b89b4c7630ed16b1bc84045", "kind": "trial_completed", "payload": {"champion_before": "t0089", "debug_depth": 0, "delta_vs_champion_before": 0.000509058012909569, "delta_vs_parent": 0.000509058012909569, "finding": "t0091 did not improve the prior champion: val_bpb=0.968898, delta=+0.000509. Hypothesis: Both elite lines are consequences of one repair, and they point at a third quantity that was measured under the same defect. t0087 corrected a value-embedding initialisation that started the tables 22.6 times weaker than the v stream, and t0089 then showed that the learning rate for that group had been sized to fund the growth the init now supplies, gaining 0.000888 by halving it; t0090 bracketed that rate at 0.3. The gate is the remaining control on the same path and it was tuned in exactly the broken regime. Its width was bracketed across four points in t0031, t0032 and t0035, settling at 128 channels, but every one of those runs had the gate modulating a signal of element RMS 0.044 against a value stream of RMS 1.0, so the gate was deciding how much of an almost invisible contribution to admit. It now modulates a contribution at parity with v, which is a materially harder decision and plausibly one that wants more context. Widening to 256, the value that lost by 0.000668 under the old scale, tests whether that loss was conditional on the defect.", "measurements": [{"command": ["/data/home/zhubaiyu/.local/bin/uv", "run", "--project", "/data3/zhubaiyu/fengheguai/campaigns/h200-claude/nodes/t0091", "python", "/data3/zhubaiyu/fengheguai/fengheguai/_audit_runner.py", "--target", "/data3/zhubaiyu/fengheguai/campaigns/h200-claude/nodes/t0091", "--nonce", "2ed311280000f449592f674bf5afe3693586041b68043607"], "errors": [], "evidence_path": "/data3/zhubaiyu/fengheguai/campaigns/h200-claude/evidence/t0091-r0/evidence.json", "evidence_sha256": "37a1fa8ec0a9baa88e5d8ab7717c42135116831682133a46e7e2dedab40e1cbf", "log_path": "/data3/zhubaiyu/fengheguai/campaigns/h200-claude/evidence/t0091-r0/run.log", "log_sha256": "7f841b0fd9bcc5b5020cc0adb2a184b1f7c335b6a362cd4baf52a273c7e00f77", "metric": 0.9688977966062622, "num_steps": 2858, "peak_vram_mb": 33800.4, "return_code": 0, "status": "valid", "timed_out": false, "train_sha256": "3b1c1604f2c5eda0d72d0e08b17929ddf0451d1b6e1d69c49d7a65216aaca088", "training_seconds": 300.0, "wall_seconds": 572.7177026905119}], "metric": 0.9688977966062622, "parent_id": "t0089", "patch_path": "/data3/zhubaiyu/fengheguai/campaigns/h200-claude/artifacts/t0091/change.patch", "patch_sha256": "8cae6a8b595014078fcdddfbd0bbacb8bdbc90636fd6f64d39820905d86bd6c1", "promoted": false, "proposal": {"change_summary": "One constant changed on champion t0089: ve_gate_channels from 128 to 256, so each of the twelve value-embedding gates reads the first 256 residual channels instead of 128 when computing its per-head 2*sigmoid factor. Both elite contributions are retained: the corrected init of uniform plus or minus sqrt(3) from t0087 and the decoupled VALUE_EMBEDDING_LR of 0.3 confirmed by t0089 and bracketed by t0090. Depth 12, width 512, HEAD_DIM 128, the SSL pattern with a 256-token short span, document masking, output softcap 13, rotary base 30000, batch 2**17, EMBEDDING_LR 0.6, UNEMBEDDING_LR 0.002, MATRIX_LR 0.0163, SCALAR_LR 0.5, ADAM_BETAS 0.8 and 0.95, WEIGHT_DECAY 0.146, FINAL_LR_FRAC 0.1 and WARMDOWN_RATIO 0.5 are unchanged.", "command": ["/usr/bin/python3", "/data3/zhubaiyu/fengheguai/fengheguai/rendezvous_agent.py", "--trial", "/data3/zhubaiyu/fengheguai/campaigns/h200-claude/nodes/t0091", "--result", "/data3/zhubaiyu/fengheguai/campaigns/h200-claude/nodes/t0091/.fengheguai-agent-result.json", "--schema", "/data3/zhubaiyu/fengheguai/campaigns/h200-claude/control/agent_output.schema.json", "--campaign", "/data3/zhubaiyu/fengheguai/campaigns/h200-claude", "--inbox", "/data3/zhubaiyu/fengheguai/campaigns/h200-claude-rendezvous"], "errors": [], "expected_val_bpb_effect": "Expected between a 0.001 decrease and a 0.001 increase versus champion t0089 at 0.968389, with step count essentially unchanged since the gate projection grows by only 128 by 4 weights per layer. The same class of reasoning has now paid twice in a row on this path, which is the reason to spend the node, but each success also removes one more thing the defect was distorting, so the returns should stop somewhere and this may be where.", "hypothesis": "Both elite lines are consequences of one repair, and they point at a third quantity that was measured under the same defect. t0087 corrected a value-embedding initialisation that started the tables 22.6 times weaker than the v stream, and t0089 then showed that the learning rate for that group had been sized to fund the growth the init now supplies, gaining 0.000888 by halving it; t0090 bracketed that rate at 0.3. The gate is the remaining control on the same path and it was tuned in exactly the broken regime. Its width was bracketed across four points in t0031, t0032 and t0035, settling at 128 channels, but every one of those runs had the gate modulating a signal of element RMS 0.044 against a value stream of RMS 1.0, so the gate was deciding how much of an almost invisible contribution to admit. It now modulates a contribution at parity with v, which is a materially harder decision and plausibly one that wants more context. Widening to 256, the value that lost by 0.000668 under the old scale, tests whether that loss was conditional on the defect.", "log_path": "/data3/zhubaiyu/fengheguai/campaigns/h200-claude/artifacts/t0091/agent.log", "return_code": 0, "risk": "The gate-width curve was sharply asymmetric when measured, with 512 costing 0.002143 against 128, so this axis punishes excess control capacity even at the old scale and there is no guarantee the corrected init changes that. A regression would mean the 128 optimum was a property of the gate rather than of what it was gating, which would close the value-embedding path entirely: init, rate and gate all then measured at their correct settings with nothing left conditional on the defect.", "success": true, "timed_out": false}, "secondary_parent_id": "t0090", "selection_reason": "Recombine two independently strong branches at the scheduled synthesis step.", "source_sha256": "3b1c1604f2c5eda0d72d0e08b17929ddf0451d1b6e1d69c49d7a65216aaca088", "stage": "recombine", "status": "discard", "training_seconds": 300.0, "trial_id": "t0091", "workspace": "/data3/zhubaiyu/fengheguai/campaigns/h200-claude/nodes/t0091"}, "prev_hash": "309bd5b9df9e2f1dbd2e501ca66efe9cb5da47775c4e6d0a6142fa740dbf0aa7", "seq": 184, "timestamp": "2026-08-21T04:54:34.602998+00:00"}
