{"hash": "432b7b9d63b94f287c03346acd1441206fe8b116513213373c61f31970b3b5f8", "kind": "campaign_initialized", "payload": {"config_sha256": "1867c2785912ae0d0be1da47f0754daf390cbc0a98e8c0a6f37b8ba4d27d73db", "created_at": "2026-08-20T10:57:18.771089+00:00", "immutable_manifest": {"prepare.py": "4f2ba9cbb8ba8c4a3d35be405a913e2f3be3af9aea103ed52ef7b2a662058150", "pyproject.toml": "675c150a9e0769f0e39a43eb7d836934266fa348d6e2403521f1ff99f9b9f1af", "uv.lock": "03174c5cce6387418c5b6cc9bbe8f71ad0ae1e1d6fedeaecae5cdcf7321da0a3"}, "name": "h200-claude", "objective": "minimize val_bpb within 300 seconds", "program_sha256": "9f16164597a9f8d9e4905c699497a6f8208dedc8f99ea5e19316ead73811f847", "seed_train_sha256": "2954175f4ac42ad65164aef40910ef953789abcd05a5cc886ac9ba5a00814414", "source_files": ["train.py", "prepare.py", "pyproject.toml", "uv.lock"], "source_target": "/data3/zhubaiyu/fengheguai_target/autoresearch", "training_contract_sha256": "84327e237d5fb35c0fa0c893f0845ed8228c6c3a3fe016afd667ea40835c8b2f"}, "prev_hash": "0000000000000000000000000000000000000000000000000000000000000000", "seq": 0, "timestamp": "2026-08-20T10:57:18.771245+00:00"}
{"hash": "b1199c8e3053f5f9e2e56d2e0e3d089e17632cd6112a6c4f142a68a2960f9153", "kind": "trial_started", "payload": {"parent_id": null, "stage": "baseline", "trial_id": "b0000"}, "prev_hash": "432b7b9d63b94f287c03346acd1441206fe8b116513213373c61f31970b3b5f8", "seq": 1, "timestamp": "2026-08-20T10:58:06.953806+00:00"}
{"hash": "95b85efb8e9e286e0ea64f0944db7af3d0f2664c6dbb0e6cc676a69bbb074548", "kind": "trial_completed", "payload": {"debug_depth": 0, "delta_vs_champion_before": null, "delta_vs_parent": null, "finding": "Locked baseline established at val_bpb=0.991068.", "measurements": [{"command": ["/data/home/zhubaiyu/.local/bin/uv", "run", "--project", "/data3/zhubaiyu/fengheguai/campaigns/h200-claude/nodes/b0000", "python", "/data3/zhubaiyu/fengheguai/fengheguai/_audit_runner.py", "--target", "/data3/zhubaiyu/fengheguai/campaigns/h200-claude/nodes/b0000", "--nonce", "18519dcdd9b12b2f2f19e354a98f07165ec819050f0ca0ee"], "errors": [], "evidence_path": "/data3/zhubaiyu/fengheguai/campaigns/h200-claude/evidence/b0000-r0/evidence.json", "evidence_sha256": "4edc627bf4f2398c63b0116c4ba626f244fd5821bd865454c3618b229b510296", "log_path": "/data3/zhubaiyu/fengheguai/campaigns/h200-claude/evidence/b0000-r0/run.log", "log_sha256": "2492e55b0955e023b48073566152cf990656a9ee77b0d59b2d4e3c0ac062c576", "metric": 0.9911224837720779, "num_steps": 1019, "peak_vram_mb": 45060.2, "return_code": 0, "status": "valid", "timed_out": false, "train_sha256": "2954175f4ac42ad65164aef40910ef953789abcd05a5cc886ac9ba5a00814414", "training_seconds": 300.2, "wall_seconds": 463.98836871795356}, {"command": ["/data/home/zhubaiyu/.local/bin/uv", "run", "--project", "/data3/zhubaiyu/fengheguai/campaigns/h200-claude/nodes/b0000", "python", "/data3/zhubaiyu/fengheguai/fengheguai/_audit_runner.py", "--target", "/data3/zhubaiyu/fengheguai/campaigns/h200-claude/nodes/b0000", "--nonce", "f61eff77c89ba1d97c2bab6f7942c14fdb327d7aa15644da"], "errors": [], "evidence_path": "/data3/zhubaiyu/fengheguai/campaigns/h200-claude/evidence/b0000-r1/evidence.json", "evidence_sha256": "7da3f0ed16622c9d9d5996e32c042d44c961c20857360b112d4e664d15a73a9a", "log_path": "/data3/zhubaiyu/fengheguai/campaigns/h200-claude/evidence/b0000-r1/run.log", "log_sha256": "5d6ca68daf2372f90c6f81ac710993c9fb871d48d8b8815bccfc7788ad4f797a", "metric": 0.9910131229489929, "num_steps": 1019, "peak_vram_mb": 45060.2, "return_code": 0, "status": "valid", "timed_out": false, "train_sha256": "2954175f4ac42ad65164aef40910ef953789abcd05a5cc886ac9ba5a00814414", "training_seconds": 300.1, "wall_seconds": 456.9315778464079}], "metric": 0.9910678033605353, "parent_id": null, "promoted": true, "proposal": {"change_summary": "unaltered baseline"}, "secondary_parent_id": null, "source_sha256": "2954175f4ac42ad65164aef40910ef953789abcd05a5cc886ac9ba5a00814414", "stage": "baseline", "status": "baseline", "training_seconds": 300.15, "trial_id": "b0000", "workspace": "/data3/zhubaiyu/fengheguai/campaigns/h200-claude/nodes/b0000"}, "prev_hash": "b1199c8e3053f5f9e2e56d2e0e3d089e17632cd6112a6c4f142a68a2960f9153", "seq": 2, "timestamp": "2026-08-20T11:13:28.449789+00:00"}
{"hash": "f38def3b16cb2c436b7249378f76f6d11985927f3c76ab1016018e508c1dd2e8", "kind": "trial_started", "payload": {"parent_id": "b0000", "reason": "Exploit a top-K branch selected by quality plus an under-exploration bonus.", "secondary_parent_id": null, "stage": "refine", "trial_id": "t0001"}, "prev_hash": "95b85efb8e9e286e0ea64f0944db7af3d0f2664c6dbb0e6cc676a69bbb074548", "seq": 3, "timestamp": "2026-08-20T11:13:28.452809+00:00"}
{"hash": "27540e7bbb020c8b5851b5f690d25c4944a50e842315eca83906770ce5e99dae", "kind": "trial_completed", "payload": {"champion_before": "b0000", "debug_depth": 0, "delta_vs_champion_before": -0.007556587830085504, "delta_vs_parent": -0.007556587830085504, "finding": "t0001 improved the prior champion: val_bpb=0.983511, delta=-0.007557. Hypothesis: At 50M params and ~1019 optimizer steps, the 2**19-token (524K) batch sits above the critical batch size for this loss regime, so gradient tokens are spent widening each batch instead of taking more Muon/AdamW steps; halving TOTAL_BATCH_SIZE to 2**18 should roughly double the step count at the same token throughput and reach a lower val_bpb within the same 300 seconds.", "measurements": [{"command": ["/data/home/zhubaiyu/.local/bin/uv", "run", "--project", "/data3/zhubaiyu/fengheguai/campaigns/h200-claude/nodes/t0001", "python", "/data3/zhubaiyu/fengheguai/fengheguai/_audit_runner.py", "--target", "/data3/zhubaiyu/fengheguai/campaigns/h200-claude/nodes/t0001", "--nonce", "458b813764fdb8d927b4e4dc70a42bcbd7d7fe1c0a726034"], "errors": [], "evidence_path": "/data3/zhubaiyu/fengheguai/campaigns/h200-claude/evidence/t0001-r0/evidence.json", "evidence_sha256": "fd2ca57d80a25d7ffc799d95ce8483d667344126eb953376bdb754add1326ed4", "log_path": "/data3/zhubaiyu/fengheguai/campaigns/h200-claude/evidence/t0001-r0/run.log", "log_sha256": "dbdaab2b45f9b9b961c176f8e59154e7574fdb1a271ef925f70195cf6d2944fd", "metric": 0.9835986878951766, "num_steps": 2020, "peak_vram_mb": 44908.2, "return_code": 0, "status": "valid", "timed_out": false, "train_sha256": "64cfdd8651b68a1fda84b17967fa8145847fc4a8143c13fd1a53ef0e6a6c4f2c", "training_seconds": 300.1, "wall_seconds": 460.2347092879936}, {"command": ["/data/home/zhubaiyu/.local/bin/uv", "run", "--project", "/data3/zhubaiyu/fengheguai/campaigns/h200-claude/nodes/t0001", "python", "/data3/zhubaiyu/fengheguai/fengheguai/_audit_runner.py", "--target", "/data3/zhubaiyu/fengheguai/campaigns/h200-claude/nodes/t0001", "--nonce", "dcec5651dbc7af0d6d17912da5108cec63f71d504282d367"], "errors": [], "evidence_path": "/data3/zhubaiyu/fengheguai/campaigns/h200-claude/evidence/t0001-r1/evidence.json", "evidence_sha256": "eebbbf0ea55390899cba9901434cebbc3d1d8afdc62d9c5b5cb49f9f192d780f", "log_path": "/data3/zhubaiyu/fengheguai/campaigns/h200-claude/evidence/t0001-r1/run.log", "log_sha256": "a7cadcb2ea76c40fced7c287591bf20ae1e8a5ef8ee84789a43834af18145b31", "metric": 0.9834237431657231, "num_steps": 2020, "peak_vram_mb": 44908.2, "return_code": 0, "status": "valid", "timed_out": false, "train_sha256": "64cfdd8651b68a1fda84b17967fa8145847fc4a8143c13fd1a53ef0e6a6c4f2c", "training_seconds": 300.0, "wall_seconds": 455.07407539803535}], "metric": 0.9835112155304498, "parent_id": "b0000", "patch_path": "/data3/zhubaiyu/fengheguai/campaigns/h200-claude/artifacts/t0001/change.patch", "patch_sha256": "a9c16964b0a31bc7f0c08953b6a309cebf02e4790b0cab746fb61e37888a772f", "promoted": true, "proposal": {"change_summary": "Single-variable hyperparameter change: TOTAL_BATCH_SIZE 2**19 -> 2**18. This also drops gradient accumulation from 2 micro-steps to 1 (DEVICE_BATCH_SIZE stays 128, sequence length stays 2048). No architecture, optimizer, schedule, or learning-rate change.", "command": ["/usr/bin/python3", "/data3/zhubaiyu/fengheguai/fengheguai/rendezvous_agent.py", "--trial", "/data3/zhubaiyu/fengheguai/campaigns/h200-claude/nodes/t0001", "--result", "/data3/zhubaiyu/fengheguai/campaigns/h200-claude/nodes/t0001/.fengheguai-agent-result.json", "--schema", "/data3/zhubaiyu/fengheguai/campaigns/h200-claude/control/agent_output.schema.json", "--campaign", "/data3/zhubaiyu/fengheguai/campaigns/h200-claude", "--inbox", "/data3/zhubaiyu/fengheguai/campaigns/h200-claude-rendezvous"], "errors": [], "expected_val_bpb_effect": "Expected decrease of roughly 0.005-0.02 bpb versus the 0.991068 baseline. If the baseline batch was already at or below the critical size, the smaller batch adds gradient noise and val_bpb rises slightly instead; either direction is an informative measurement of where the critical batch size sits.", "hypothesis": "At 50M params and ~1019 optimizer steps, the 2**19-token (524K) batch sits above the critical batch size for this loss regime, so gradient tokens are spent widening each batch instead of taking more Muon/AdamW steps; halving TOTAL_BATCH_SIZE to 2**18 should roughly double the step count at the same token throughput and reach a lower val_bpb within the same 300 seconds.", "log_path": "/data3/zhubaiyu/fengheguai/campaigns/h200-claude/artifacts/t0001/agent.log", "return_code": 0, "risk": "Learning rates were tuned at 2**19 tokens per step, so the effective LR-to-noise ratio changes; too much gradient noise could destabilise Muon early in training. The Muon momentum warmup (get_muon_momentum over 300 steps) now completes at a smaller fraction of the run. No OOM or contract risk: peak memory is unchanged or lower since grad accumulation only decreases.", "success": true, "timed_out": false}, "secondary_parent_id": null, "selection_reason": "Exploit a top-K branch selected by quality plus an under-exploration bonus.", "source_sha256": "64cfdd8651b68a1fda84b17967fa8145847fc4a8143c13fd1a53ef0e6a6c4f2c", "stage": "refine", "status": "keep", "training_seconds": 300.05, "trial_id": "t0001", "workspace": "/data3/zhubaiyu/fengheguai/campaigns/h200-claude/nodes/t0001"}, "prev_hash": "f38def3b16cb2c436b7249378f76f6d11985927f3c76ab1016018e508c1dd2e8", "seq": 4, "timestamp": "2026-08-20T11:30:26.549099+00:00"}
{"hash": "77956c20d48c502e17bcb01725e9b2c4d48e8c38e3c41fe59abae68406f2ef9a", "kind": "trial_started", "payload": {"parent_id": "t0001", "reason": "Spend the configured search share on a distinct architectural or recipe direction.", "secondary_parent_id": null, "stage": "explore", "trial_id": "t0002"}, "prev_hash": "27540e7bbb020c8b5851b5f690d25c4944a50e842315eca83906770ce5e99dae", "seq": 5, "timestamp": "2026-08-20T11:30:26.552787+00:00"}
{"hash": "d75e67ce392e15a623c11fe119ed922759bbda8258240bd55247168f4d922795", "kind": "trial_completed", "payload": {"champion_before": "t0001", "debug_depth": 0, "delta_vs_champion_before": -0.0018821502332936335, "delta_vs_parent": -0.0018821502332936335, "finding": "t0002 improved the prior champion: val_bpb=0.981629, delta=-0.001882. Hypothesis: Attention accounts for about 26 percent of the estimated FLOPs per token in this 8-layer SSSL configuration (six short layers at a 1024 window plus two full-context layers at 2048). Because every fourth layer is already full-context, the short layers are doing local work that a 512-token span can still cover, so halving the short window from sequence_len//2 to sequence_len//4 should cut roughly 8 percent of per-token FLOPs and convert that directly into additional optimizer steps inside the fixed 300 seconds, lowering val_bpb.", "measurements": [{"command": ["/data/home/zhubaiyu/.local/bin/uv", "run", "--project", "/data3/zhubaiyu/fengheguai/campaigns/h200-claude/nodes/t0002", "python", "/data3/zhubaiyu/fengheguai/fengheguai/_audit_runner.py", "--target", "/data3/zhubaiyu/fengheguai/campaigns/h200-claude/nodes/t0002", "--nonce", "98a0a36009b90aa725af0b2f8886cfa67c101652dd5f6b9a"], "errors": [], "evidence_path": "/data3/zhubaiyu/fengheguai/campaigns/h200-claude/evidence/t0002-r0/evidence.json", "evidence_sha256": "bf8d2746ff0f77b4b5d99ad01f6f63546b53dc8e61f9cb0b0718c560800feb58", "log_path": "/data3/zhubaiyu/fengheguai/campaigns/h200-claude/evidence/t0002-r0/run.log", "log_sha256": "4248b853c35b5511610f7fbafcb5a55c856cd1ca5554e35d081f222416e15897", "metric": 0.9815288864765508, "num_steps": 2099, "peak_vram_mb": 44908.2, "return_code": 0, "status": "valid", "timed_out": false, "train_sha256": "af91086de6dd5e62da6935cafb3fb95986e2ab9f7b2cf361cc9966ef8a634402", "training_seconds": 300.1, "wall_seconds": 474.6484486507252}, {"command": ["/data/home/zhubaiyu/.local/bin/uv", "run", "--project", "/data3/zhubaiyu/fengheguai/campaigns/h200-claude/nodes/t0002", "python", "/data3/zhubaiyu/fengheguai/fengheguai/_audit_runner.py", "--target", "/data3/zhubaiyu/fengheguai/campaigns/h200-claude/nodes/t0002", "--nonce", "e1fba44150307f895e4ddaa2c814562526baeaac9004fc64"], "errors": [], "evidence_path": "/data3/zhubaiyu/fengheguai/campaigns/h200-claude/evidence/t0002-r1/evidence.json", "evidence_sha256": "d7e8f84e1371fd3daaa827d7df12de2fec2823bb3dbd11c9f3febcf62d039511", "log_path": "/data3/zhubaiyu/fengheguai/campaigns/h200-claude/evidence/t0002-r1/run.log", "log_sha256": "8c36b4bc6861716554b0c1dcd421fed0b858904adeda0b1b7a0fcc124773b1b1", "metric": 0.9817292441177615, "num_steps": 2098, "peak_vram_mb": 44908.2, "return_code": 0, "status": "valid", "timed_out": false, "train_sha256": "af91086de6dd5e62da6935cafb3fb95986e2ab9f7b2cf361cc9966ef8a634402", "training_seconds": 300.1, "wall_seconds": 456.48219585232437}], "metric": 0.9816290652971562, "parent_id": "t0001", "patch_path": "/data3/zhubaiyu/fengheguai/campaigns/h200-claude/artifacts/t0002/change.patch", "patch_sha256": "edd9977fc40624cf8fe4902eb467b0f8b2868716c60b6bd1222496aafbe27efd", "promoted": true, "proposal": {"change_summary": "One-line architectural change in GPT._compute_window_sizes: short_window = long_window // 2 becomes long_window // 4, so the S layers of the SSSL pattern attend over 512 tokens instead of 1024. The L layers, the forced full-context last layer, the pattern itself, model capacity, optimizer, batch size and schedules are all unchanged from champion t0001.", "command": ["/usr/bin/python3", "/data3/zhubaiyu/fengheguai/fengheguai/rendezvous_agent.py", "--trial", "/data3/zhubaiyu/fengheguai/campaigns/h200-claude/nodes/t0002", "--result", "/data3/zhubaiyu/fengheguai/campaigns/h200-claude/nodes/t0002/.fengheguai-agent-result.json", "--schema", "/data3/zhubaiyu/fengheguai/campaigns/h200-claude/control/agent_output.schema.json", "--campaign", "/data3/zhubaiyu/fengheguai/campaigns/h200-claude", "--inbox", "/data3/zhubaiyu/fengheguai/campaigns/h200-claude-rendezvous"], "errors": [], "expected_val_bpb_effect": "Expected decrease of roughly 0.001-0.004 bpb versus champion t0001 at 0.983511, driven by a step-count increase of about 8 percent. If local context between 512 and 1024 tokens is genuinely load-bearing for this corpus, the quality loss per step will outweigh the extra steps and val_bpb will rise instead, which cleanly falsifies the hypothesis and bounds the useful span.", "hypothesis": "Attention accounts for about 26 percent of the estimated FLOPs per token in this 8-layer SSSL configuration (six short layers at a 1024 window plus two full-context layers at 2048). Because every fourth layer is already full-context, the short layers are doing local work that a 512-token span can still cover, so halving the short window from sequence_len//2 to sequence_len//4 should cut roughly 8 percent of per-token FLOPs and convert that directly into additional optimizer steps inside the fixed 300 seconds, lowering val_bpb.", "log_path": "/data3/zhubaiyu/fengheguai/campaigns/h200-claude/artifacts/t0002/agent.log", "return_code": 0, "risk": "The estimate_flops accounting changes with the window, so reported MFU is not comparable across nodes; only val_bpb is being optimised, so this is a diagnostic caveat rather than a scoring risk. The real risk is representational: a 512-token span may be too narrow for the model to route information to the full-context layers, which would show up as a higher val_bpb despite more steps.", "success": true, "timed_out": false}, "secondary_parent_id": null, "selection_reason": "Spend the configured search share on a distinct architectural or recipe direction.", "source_sha256": "af91086de6dd5e62da6935cafb3fb95986e2ab9f7b2cf361cc9966ef8a634402", "stage": "explore", "status": "keep", "training_seconds": 300.1, "trial_id": "t0002", "workspace": "/data3/zhubaiyu/fengheguai/campaigns/h200-claude/nodes/t0002"}, "prev_hash": "77956c20d48c502e17bcb01725e9b2c4d48e8c38e3c41fe59abae68406f2ef9a", "seq": 6, "timestamp": "2026-08-20T11:47:22.455385+00:00"}
{"hash": "3939ca0285ff1207f6ff7f88e3da8fcd5a475579885e07e747223870e4704228", "kind": "trial_started", "payload": {"parent_id": "t0002", "reason": "Exploit a top-K branch selected by quality plus an under-exploration bonus.", "secondary_parent_id": null, "stage": "refine", "trial_id": "t0003"}, "prev_hash": "d75e67ce392e15a623c11fe119ed922759bbda8258240bd55247168f4d922795", "seq": 7, "timestamp": "2026-08-20T11:47:22.459650+00:00"}
