{"hash": "a2f62f71c12eed989fab781e7f758397e324f45fc05fa79940588bb3fdb6c29a", "kind": "trial_completed", "payload": {"champion_before": "t0096", "debug_depth": 0, "delta_vs_champion_before": 0.0002415778782182132, "delta_vs_parent": 0.0002415778782182132, "finding": "t0098 did not improve the prior champion: val_bpb=0.967527, delta=+0.000242. Hypothesis: The two elite lines are the same mechanism at two window lengths, and together they say the optimum lies at or below the shorter one. Weight averaging at a decay of 0.99, an effective horizon near 100 steps, gained 0.001103 over the unaveraged champion; widening it to 0.995 and roughly 200 steps gave back 0.000159. The reading that fits both is that what averaging removes is genuine endpoint noise from a model that never fully anneals, and that reaching further back mixes in weights from a materially higher learning rate which the schedule was deliberately moving away from. If that is right the optimum is short rather than long, and the untested direction is shorter still. A decay of 0.98 halves the horizon to about 50 steps and, with the 0.995 measurement, brackets the axis from both sides.", "measurements": [{"command": ["/data/home/zhubaiyu/.local/bin/uv", "run", "--project", "/data3/zhubaiyu/fengheguai/campaigns/h200-claude/nodes/t0098", "python", "/data3/zhubaiyu/fengheguai/fengheguai/_audit_runner.py", "--target", "/data3/zhubaiyu/fengheguai/campaigns/h200-claude/nodes/t0098", "--nonce", "650e2558e5b6cdafce98db9777ac6c6e9c8ca28a97f029ce"], "errors": [], "evidence_path": "/data3/zhubaiyu/fengheguai/campaigns/h200-claude/evidence/t0098-r0/evidence.json", "evidence_sha256": "92268d5417ae0d8a773e2b0befd8c0e8ad7d9842718b5b9b106790d133eab992", "log_path": "/data3/zhubaiyu/fengheguai/campaigns/h200-claude/evidence/t0098-r0/run.log", "log_sha256": "e07dfc4d3c2e1dbc5c3563792c798a45868dbd51827fd3bee79967617f20e016", "metric": 0.9675274924260652, "num_steps": 2872, "peak_vram_mb": 34168.4, "return_code": 0, "status": "valid", "timed_out": false, "train_sha256": "4531a30dbd6e597e31bed48943f47e6232dad56ea6aa9434f1d7060d71e9a079", "training_seconds": 300.0, "wall_seconds": 484.8226113682613}], "metric": 0.9675274924260652, "parent_id": "t0096", "patch_path": "/data3/zhubaiyu/fengheguai/campaigns/h200-claude/artifacts/t0098/change.patch", "patch_sha256": "611a203883280b6c1513f29c75f1a68fb137de084893444ec4d21e54711c4b7e", "promoted": false, "proposal": {"change_summary": "One constant changed on champion t0096: EMA_DECAY from 0.99 to 0.98, halving the effective averaging horizon from roughly 100 to roughly 50 steps. EMA_START stays 0.7 and remains non-binding, since the averaging phase spans about 860 steps and a 50-step horizon forgets its start point many times over. Both elite lines contribute their settled content: the averaging mechanism itself from t0096 and the finding from t0097 that the window should not be widened. Everything else matches the champion, including the corrected value-embedding init, VALUE_EMBEDDING_LR 0.3, depth 12, the SSL pattern with a 256-token short span, document masking, output softcap 13, batch 2**17, WEIGHT_DECAY 0.146 and FINAL_LR_FRAC 0.1.", "command": ["/usr/bin/python3", "/data3/zhubaiyu/fengheguai/fengheguai/rendezvous_agent.py", "--trial", "/data3/zhubaiyu/fengheguai/campaigns/h200-claude/nodes/t0098", "--result", "/data3/zhubaiyu/fengheguai/campaigns/h200-claude/nodes/t0098/.fengheguai-agent-result.json", "--schema", "/data3/zhubaiyu/fengheguai/campaigns/h200-claude/control/agent_output.schema.json", "--campaign", "/data3/zhubaiyu/fengheguai/campaigns/h200-claude", "--inbox", "/data3/zhubaiyu/fengheguai/campaigns/h200-claude-rendezvous"], "errors": [], "expected_val_bpb_effect": "Expected between a 0.0004 decrease and a 0.0005 increase versus champion t0096 at 0.967286, with step count unchanged since the update cost is independent of the decay. The 0.995 measurement moved only 0.000159, so the curve is shallow on that side and the optimum is probably near 0.99 rather than far from it; this node is about locating it rather than expecting a large gain.", "hypothesis": "The two elite lines are the same mechanism at two window lengths, and together they say the optimum lies at or below the shorter one. Weight averaging at a decay of 0.99, an effective horizon near 100 steps, gained 0.001103 over the unaveraged champion; widening it to 0.995 and roughly 200 steps gave back 0.000159. The reading that fits both is that what averaging removes is genuine endpoint noise from a model that never fully anneals, and that reaching further back mixes in weights from a materially higher learning rate which the schedule was deliberately moving away from. If that is right the optimum is short rather than long, and the untested direction is shorter still. A decay of 0.98 halves the horizon to about 50 steps and, with the 0.995 measurement, brackets the axis from both sides.", "log_path": "/data3/zhubaiyu/fengheguai/campaigns/h200-claude/artifacts/t0098/agent.log", "return_code": 0, "risk": "A 50-step horizon at roughly 105ms per step averages over the final five seconds of training, which may be too few samples to cancel the noise it is meant to cancel, in which case the average is nearly the endpoint itself and the result collapses toward the unaveraged behaviour rather than improving on it. This is also the third node on the averaging mechanism; if it lands within noise I will treat the window as settled at 0.99 rather than sample a fourth point, since the measured differences on this axis are now the same size as the repeat noise.", "success": true, "timed_out": false}, "secondary_parent_id": "t0097", "selection_reason": "Recombine two independently strong branches at the scheduled synthesis step.", "source_sha256": "4531a30dbd6e597e31bed48943f47e6232dad56ea6aa9434f1d7060d71e9a079", "stage": "recombine", "status": "discard", "training_seconds": 300.0, "trial_id": "t0098", "workspace": "/data3/zhubaiyu/fengheguai/campaigns/h200-claude/nodes/t0098"}, "prev_hash": "37fef66f82d5f2a5589c3ba6bbbf6f442fd35832a7b03b9fb443d0242399d24e", "seq": 198, "timestamp": "2026-08-21T06:05:07.171129+00:00"}
{"hash": "0e144b8e3185dbc135f60a7aa24a41153048491432f0680719fd8f9e86dc20fe", "kind": "trial_started", "payload": {"parent_id": "t0096", "reason": "Spend the configured search share on a distinct architectural or recipe direction.", "secondary_parent_id": null, "stage": "explore", "trial_id": "t0099"}, "prev_hash": "a2f62f71c12eed989fab781e7f758397e324f45fc05fa79940588bb3fdb6c29a", "seq": 199, "timestamp": "2026-08-21T06:05:07.225327+00:00"}
{"hash": "5e71eaa1b39f2275eb923dbc4fd78b97fcebb5f992951450248e4b7635d6cdbf", "kind": "trial_completed", "payload": {"champion_before": "t0096", "debug_depth": 0, "delta_vs_champion_before": 3.882010500833033e-06, "delta_vs_parent": 3.882010500833033e-06, "finding": "t0099 did not improve the prior champion: val_bpb=0.967290, delta=+0.000004. Hypothesis: Averaging changes what the schedule endpoint is for, and the endpoint has not been re-measured since averaging arrived. FINAL_LR_FRAC was raised from 0.0 to 0.1 in t0048, where it measured within noise and was promoted on a strict median; the reason a floor is normally costly is that the model stops settling and its final weights are left noisy. Weight averaging removes exactly that cost, and t0096 proved it does so here, gaining 0.001103 by averaging the tail of a run that never fully anneals. With the noise now absorbed by the average, a higher floor should be affordable and should buy real progress: the run spends its last 30 percent at a rate that decays toward the floor, so doubling the floor to 0.2 keeps the model learning materially faster through roughly 860 steps whose endpoint noise the EMA is already cleaning up. The two settings are complements rather than independent knobs.", "measurements": [{"command": ["/data/home/zhubaiyu/.local/bin/uv", "run", "--project", "/data3/zhubaiyu/fengheguai/campaigns/h200-claude/nodes/t0099", "python", "/data3/zhubaiyu/fengheguai/fengheguai/_audit_runner.py", "--target", "/data3/zhubaiyu/fengheguai/campaigns/h200-claude/nodes/t0099", "--nonce", "a7930afc7d8e8ee18b3927deac182989687c91815071cd00"], "errors": [], "evidence_path": "/data3/zhubaiyu/fengheguai/campaigns/h200-claude/evidence/t0099-r0/evidence.json", "evidence_sha256": "4f5ebc23056a04d9857a359fe7a1851f5c642e4b17ea56982fd479a6ae34023b", "log_path": "/data3/zhubaiyu/fengheguai/campaigns/h200-claude/evidence/t0099-r0/run.log", "log_sha256": "3e0eb834cc1d7f0c0e391db718e2a8138cfa875d34647038f734695c179e3052", "metric": 0.9672897965583478, "num_steps": 2869, "peak_vram_mb": 34168.4, "return_code": 0, "status": "valid", "timed_out": false, "train_sha256": "bbb05361e411cce12b3ca19c975fb53171e8c8e3457584695bf5d006f6da8493", "training_seconds": 300.1, "wall_seconds": 486.67530805431306}], "metric": 0.9672897965583478, "parent_id": "t0096", "patch_path": "/data3/zhubaiyu/fengheguai/campaigns/h200-claude/artifacts/t0099/change.patch", "patch_sha256": "fd353967344555e17711fa23e34f87be51edcb78f8872f6a9fe25284ef660b48", "promoted": false, "proposal": {"change_summary": "One constant changed on champion t0096: FINAL_LR_FRAC from 0.1 to 0.2, so get_lr_multiplier decays to a fifth of peak rather than a tenth across the warmdown. WARMDOWN_RATIO stays at its bracketed 0.5 and WARMUP_RATIO stays 0.0. The averaging mechanism is retained exactly as promoted, EMA_START 0.7 and EMA_DECAY 0.99, the latter now bracketed by t0097 at 0.995 and t0098 at 0.98 and settled. Everything else matches the champion: the corrected value-embedding init, VALUE_EMBEDDING_LR 0.3, depth 12, the SSL pattern with a 256-token short span, document masking, output softcap 13, batch 2**17 and WEIGHT_DECAY 0.146.", "command": ["/usr/bin/python3", "/data3/zhubaiyu/fengheguai/fengheguai/rendezvous_agent.py", "--trial", "/data3/zhubaiyu/fengheguai/campaigns/h200-claude/nodes/t0099", "--result", "/data3/zhubaiyu/fengheguai/campaigns/h200-claude/nodes/t0099/.fengheguai-agent-result.json", "--schema", "/data3/zhubaiyu/fengheguai/campaigns/h200-claude/control/agent_output.schema.json", "--campaign", "/data3/zhubaiyu/fengheguai/campaigns/h200-claude", "--inbox", "/data3/zhubaiyu/fengheguai/campaigns/h200-claude-rendezvous"], "errors": [], "expected_val_bpb_effect": "Expected between a 0.001 decrease and a 0.001 increase versus champion t0096 at 0.967286, with step count unchanged. This is an interaction test of the kind that has paid three times in this campaign, where a promoted change altered the conditions under which an earlier setting had been measured; here the earlier setting was measured as a near-null, so the interaction has room to turn it into a gain rather than merely shifting an optimum.", "hypothesis": "Averaging changes what the schedule endpoint is for, and the endpoint has not been re-measured since averaging arrived. FINAL_LR_FRAC was raised from 0.0 to 0.1 in t0048, where it measured within noise and was promoted on a strict median; the reason a floor is normally costly is that the model stops settling and its final weights are left noisy. Weight averaging removes exactly that cost, and t0096 proved it does so here, gaining 0.001103 by averaging the tail of a run that never fully anneals. With the noise now absorbed by the average, a higher floor should be affordable and should buy real progress: the run spends its last 30 percent at a rate that decays toward the floor, so doubling the floor to 0.2 keeps the model learning materially faster through roughly 860 steps whose endpoint noise the EMA is already cleaning up. The two settings are complements rather than independent knobs.", "log_path": "/data3/zhubaiyu/fengheguai/campaigns/h200-claude/artifacts/t0099/agent.log", "return_code": 0, "risk": "The weight-decay schedule is driven by the same progress variable and is not floored, so raising the rate floor increases the effective decay term lr times wd through the tail while leaving nothing to compensate, which is a real coupling this node cannot separate. There is also a ceiling on the argument: averaging can absorb endpoint noise but it cannot substitute for annealing, since a model held at a fifth of peak rate is exploring a wider basin than one held at a tenth and the average of a wider basin is not automatically a better point than the centre of a narrower one. If this regresses, the correct reading is that annealing does more than reduce noise and the floor belongs where it is.", "success": true, "timed_out": false}, "secondary_parent_id": null, "selection_reason": "Spend the configured search share on a distinct architectural or recipe direction.", "source_sha256": "bbb05361e411cce12b3ca19c975fb53171e8c8e3457584695bf5d006f6da8493", "stage": "explore", "status": "discard", "training_seconds": 300.1, "trial_id": "t0099", "workspace": "/data3/zhubaiyu/fengheguai/campaigns/h200-claude/nodes/t0099"}, "prev_hash": "0e144b8e3185dbc135f60a7aa24a41153048491432f0680719fd8f9e86dc20fe", "seq": 200, "timestamp": "2026-08-21T06:14:20.448000+00:00"}
{"hash": "c3d35d290467dbe30782815043778effe677f92040f2216a43b91453c63f4ab1", "kind": "trial_started", "payload": {"parent_id": "t0096", "reason": "The current line is stalled; make a structurally different bet.", "secondary_parent_id": null, "stage": "explore", "trial_id": "t0100"}, "prev_hash": "5e71eaa1b39f2275eb923dbc4fd78b97fcebb5f992951450248e4b7635d6cdbf", "seq": 201, "timestamp": "2026-08-21T06:14:20.503745+00:00"}
{"hash": "a0dc610bf1b840f5a7036a483d466192a67b0bcc8477a4fdbdfc39e0da1c2c23", "kind": "trial_completed", "payload": {"champion_before": "t0096", "debug_depth": 0, "delta_vs_champion_before": 0.0018724956590672193, "delta_vs_parent": 0.0018724956590672193, "finding": "t0100 did not improve the prior champion: val_bpb=0.969158, delta=+0.001872. Hypothesis: t0099 returned a null so exact it is a measurement in its own right: doubling the schedule floor from 0.1 to 0.2 changed val_bpb by four parts in a million, against a repeat noise of 1.3e-4. The reading is that weight averaging has decoupled final quality from where the schedule ends. Annealing normally serves two purposes, making progress at a useful rate and settling the model so its endpoint is not a noisy draw; the EMA introduced in t0096 now performs the second, and t0099 shows the first is insensitive to the floor across a factor of two. If the floor is genuinely not binding, the schedule is giving away rate for no return, and a much higher floor should let the model keep learning through the entire warmdown while the average absorbs the extra endpoint noise. Raising it to 0.4 tests where that stops being true.", "measurements": [{"command": ["/data/home/zhubaiyu/.local/bin/uv", "run", "--project", "/data3/zhubaiyu/fengheguai/campaigns/h200-claude/nodes/t0100", "python", "/data3/zhubaiyu/fengheguai/fengheguai/_audit_runner.py", "--target", "/data3/zhubaiyu/fengheguai/campaigns/h200-claude/nodes/t0100", "--nonce", "21975acf6bab3501dd01f08167732e9941eb12372666c196"], "errors": [], "evidence_path": "/data3/zhubaiyu/fengheguai/campaigns/h200-claude/evidence/t0100-r0/evidence.json", "evidence_sha256": "34a9811ef6e23b67692cc7d5bef1ca826d569100c6ca037f53908605a7d977e2", "log_path": "/data3/zhubaiyu/fengheguai/campaigns/h200-claude/evidence/t0100-r0/run.log", "log_sha256": "a024ff4dc3a65b48bf240e2d6627c5d2c48a024d61a2bb69e66cf9bef42d5b9d", "metric": 0.9691584102069142, "num_steps": 2868, "peak_vram_mb": 34168.4, "return_code": 0, "status": "valid", "timed_out": false, "train_sha256": "0edace51b62051192175c901120c53f550c11f1a123937fb65888dc9394df710", "training_seconds": 300.1, "wall_seconds": 486.10636440943927}], "metric": 0.9691584102069142, "parent_id": "t0096", "patch_path": "/data3/zhubaiyu/fengheguai/campaigns/h200-claude/artifacts/t0100/change.patch", "patch_sha256": "1163d7ff826e29fb5df862f4a35985cae9bd5954eef35ff020f0c90d8bb77e07", "promoted": false, "proposal": {"change_summary": "One constant changed on champion t0096: FINAL_LR_FRAC from 0.1 to 0.4, so get_lr_multiplier decays only to two fifths of peak across the warmdown instead of a tenth. WARMDOWN_RATIO stays at its bracketed 0.5 and WARMUP_RATIO stays 0.0. The averaging mechanism is unchanged and settled: EMA_START 0.7 with EMA_DECAY 0.99, bracketed at 0.98 and 0.995. Everything else matches the champion, including the corrected value-embedding init, VALUE_EMBEDDING_LR 0.3, depth 12, the SSL pattern with a 256-token short span, document masking, output softcap 13, batch 2**17 and WEIGHT_DECAY 0.146.", "command": ["/usr/bin/python3", "/data3/zhubaiyu/fengheguai/fengheguai/rendezvous_agent.py", "--trial", "/data3/zhubaiyu/fengheguai/campaigns/h200-claude/nodes/t0100", "--result", "/data3/zhubaiyu/fengheguai/campaigns/h200-claude/nodes/t0100/.fengheguai-agent-result.json", "--schema", "/data3/zhubaiyu/fengheguai/campaigns/h200-claude/control/agent_output.schema.json", "--campaign", "/data3/zhubaiyu/fengheguai/campaigns/h200-claude", "--inbox", "/data3/zhubaiyu/fengheguai/campaigns/h200-claude-rendezvous"], "errors": [], "expected_val_bpb_effect": "Expected between a 0.002 decrease and a 0.003 increase versus champion t0096 at 0.967286, with step count unchanged. This is a deliberately larger step than the last one because the last one measured nothing: a factor of two produced a four-in-a-million difference, so a factor of four is the smallest move likely to locate the edge of the flat region rather than confirm it again.", "hypothesis": "t0099 returned a null so exact it is a measurement in its own right: doubling the schedule floor from 0.1 to 0.2 changed val_bpb by four parts in a million, against a repeat noise of 1.3e-4. The reading is that weight averaging has decoupled final quality from where the schedule ends. Annealing normally serves two purposes, making progress at a useful rate and settling the model so its endpoint is not a noisy draw; the EMA introduced in t0096 now performs the second, and t0099 shows the first is insensitive to the floor across a factor of two. If the floor is genuinely not binding, the schedule is giving away rate for no return, and a much higher floor should let the model keep learning through the entire warmdown while the average absorbs the extra endpoint noise. Raising it to 0.4 tests where that stops being true.", "log_path": "/data3/zhubaiyu/fengheguai/campaigns/h200-claude/artifacts/t0100/agent.log", "return_code": 0, "risk": "This is the point where the argument could invert. A floor of 0.4 means the model never anneals in any meaningful sense, spending the entire second half of the budget at close to full rate, and averaging over the final hundred steps cannot substitute for a trajectory that has actually descended into a basin. If the flat region ends anywhere between 0.2 and 0.4 this will regress, possibly sharply, and the informative follow-up would be 0.3 rather than abandoning the direction. The weight-decay coupling also grows with the floor, since get_weight_decay shares the progress variable and the effective decay term is lr times wd, so a regression cannot be attributed to the rate alone.", "success": true, "timed_out": false}, "secondary_parent_id": null, "selection_reason": "The current line is stalled; make a structurally different bet.", "source_sha256": "0edace51b62051192175c901120c53f550c11f1a123937fb65888dc9394df710", "stage": "explore", "status": "discard", "training_seconds": 300.1, "trial_id": "t0100", "workspace": "/data3/zhubaiyu/fengheguai/campaigns/h200-claude/nodes/t0100"}, "prev_hash": "c3d35d290467dbe30782815043778effe677f92040f2216a43b91453c63f4ab1", "seq": 202, "timestamp": "2026-08-21T06:23:23.137977+00:00"}
{"hash": "f31113e245d3d2883ef27364ad863d18a3033233779bcc857da03c04c31f4b29", "kind": "trial_started", "payload": {"parent_id": "t0096", "reason": "The current line is stalled; make a structurally different bet.", "secondary_parent_id": null, "stage": "explore", "trial_id": "t0101"}, "prev_hash": "a0dc610bf1b840f5a7036a483d466192a67b0bcc8477a4fdbdfc39e0da1c2c23", "seq": 203, "timestamp": "2026-08-21T06:23:23.194294+00:00"}
