{"hash": "4231549411dc22a217385cd3c5f36f4e6cb07d268644f936e2c7c58417447200", "kind": "trial_completed", "payload": {"champion_before": "t0008", "debug_depth": 0, "delta_vs_champion_before": null, "delta_vs_parent": null, "finding": "t0009 ended as failed. Hypothesis: Attention currently reads across document boundaries. The loader packs multiple whole documents into every 2048-token row and starts each row with BOS, so within a 512-token short window a large fraction of queries attend to tokens from a preceding, unrelated document. That cross-document context is pure noise for next-token prediction. Restricting attention to the enclosing document, by deriving cu_seqlens from BOS positions and switching to the flash-attention-3 varlen kernel, should remove that noise and lower val_bpb. This is the first node to change what attention may see rather than how much compute it costs.. Evidence: expected one nonce-bound locked evaluation, found 0; training process exited with code 1; training_seconds is missing from output", "measurements": [{"command": ["/data/home/zhubaiyu/.local/bin/uv", "run", "--project", "/data3/zhubaiyu/fengheguai/campaigns/h200-claude/nodes/t0009", "python", "/data3/zhubaiyu/fengheguai/fengheguai/_audit_runner.py", "--target", "/data3/zhubaiyu/fengheguai/campaigns/h200-claude/nodes/t0009", "--nonce", "17300338081382e13b0c7a40c3fccf3ff354488758a23101"], "errors": ["expected one nonce-bound locked evaluation, found 0", "training process exited with code 1", "training_seconds is missing from output"], "evidence_path": "/data3/zhubaiyu/fengheguai/campaigns/h200-claude/evidence/t0009-r0/evidence.json", "evidence_sha256": "c9e7fc42f1723c9072f8ec17e39ac4c2a6be42ae432a7afa9de84f4d598e162e", "log_path": "/data3/zhubaiyu/fengheguai/campaigns/h200-claude/evidence/t0009-r0/run.log", "log_sha256": "03c1f77df4cac47a082bbff6875e4909f8733af5f35cab703523d770049c1c39", "metric": null, "num_steps": null, "peak_vram_mb": null, "return_code": 1, "status": "failed", "timed_out": false, "train_sha256": "d803c2bd874168c300627c2de2581bb2baee5f77b24eb2dc01be20ad350f0577", "training_seconds": null, "wall_seconds": 143.5277573140338}], "metric": null, "parent_id": "t0008", "patch_path": "/data3/zhubaiyu/fengheguai/campaigns/h200-claude/artifacts/t0009/change.patch", "patch_sha256": "5b1b11349e39e9cbd14cea776bb8071fa5723a75cc06e2a92505beb217417bc5", "promoted": false, "proposal": {"change_summary": "Document-boundary masking on champion t0008. GPT.forward derives document starts from BOS positions in the flattened batch and builds a cu_seqlens tensor; CausalSelfAttention and Block thread that descriptor through, and attention calls flash_attn_varlen_func with per-document sequence boundaries instead of flash_attn_func over whole rows. The sliding-window sizes, causality, capacity, dense value embeddings, batch 2**18, learning rates and all schedules are unchanged, so only the attention support set differs.", "command": ["/usr/bin/python3", "/data3/zhubaiyu/fengheguai/fengheguai/rendezvous_agent.py", "--trial", "/data3/zhubaiyu/fengheguai/campaigns/h200-claude/nodes/t0009", "--result", "/data3/zhubaiyu/fengheguai/campaigns/h200-claude/nodes/t0009/.fengheguai-agent-result.json", "--schema", "/data3/zhubaiyu/fengheguai/campaigns/h200-claude/control/agent_output.schema.json", "--campaign", "/data3/zhubaiyu/fengheguai/campaigns/h200-claude", "--inbox", "/data3/zhubaiyu/fengheguai/campaigns/h200-claude-rendezvous"], "errors": [], "expected_val_bpb_effect": "Expected decrease of roughly 0.003-0.010 bpb versus champion t0008 at 0.980245, since document masking is one of the larger known corrections for packed-sequence pretraining and no earlier node has touched this mechanism. A smaller gain would indicate documents in this corpus are long relative to the 512-token short window, so few windows actually straddle a boundary.", "hypothesis": "Attention currently reads across document boundaries. The loader packs multiple whole documents into every 2048-token row and starts each row with BOS, so within a 512-token short window a large fraction of queries attend to tokens from a preceding, unrelated document. That cross-document context is pure noise for next-token prediction. Restricting attention to the enclosing document, by deriving cu_seqlens from BOS positions and switching to the flash-attention-3 varlen kernel, should remove that noise and lower val_bpb. This is the first node to change what attention may see rather than how much compute it costs.", "log_path": "/data3/zhubaiyu/fengheguai/campaigns/h200-claude/artifacts/t0009/agent.log", "return_code": 0, "risk": "The main risk is throughput, not correctness. The BOS scan uses nonzero, which forces one device synchronisation per forward pass and a torch.compile graph break, and cu_seqlens has a batch-varying length that is marked dynamic to avoid endless recompilation; if the varlen kernel is slower than the dense one at this shape, the step count will drop and could erase the quality gain, which num_steps will show directly. If the kernel rejects the call outright the node fails and the bounded debug stage repairs it from the traceback.", "success": true, "timed_out": false}, "secondary_parent_id": null, "selection_reason": "Exploit a top-K branch selected by quality plus an under-exploration bonus.", "source_sha256": "d803c2bd874168c300627c2de2581bb2baee5f77b24eb2dc01be20ad350f0577", "stage": "refine", "status": "failed", "training_seconds": null, "trial_id": "t0009", "workspace": "/data3/zhubaiyu/fengheguai/campaigns/h200-claude/nodes/t0009"}, "prev_hash": "a26d9cfd25445e079b277b57011bf85d45f0a9280f53f71abff2b22ce49ded07", "seq": 20, "timestamp": "2026-08-20T13:04:45.877094+00:00"}
{"hash": "d66eb67b3129c17bb0f67c6e94777dc77d63c29fc25619083f7b89d06582be60", "kind": "trial_started", "payload": {"parent_id": "t0009", "reason": "Repair the most recent executable failure before abandoning its hypothesis.", "secondary_parent_id": null, "stage": "debug", "trial_id": "t0010"}, "prev_hash": "4231549411dc22a217385cd3c5f36f4e6cb07d268644f936e2c7c58417447200", "seq": 21, "timestamp": "2026-08-20T13:04:45.884353+00:00"}
{"hash": "443133d88e5e107a408ab838ac4637f99d1dd1a77f1f123535bf102212e32ad0", "kind": "trial_completed", "payload": {"champion_before": "t0008", "debug_depth": 1, "delta_vs_champion_before": -0.0020800568911238937, "delta_vs_parent": null, "finding": "t0010 improved the prior champion: val_bpb=0.978165, delta=-0.002080. Hypothesis: Unchanged from t0009: attention reads across document boundaries inside each packed 2048-token row, and confining it to the enclosing document should remove that noise and lower val_bpb. t0009 did not test this hypothesis at all; it aborted during compilation because torch._dynamo.mark_dynamic was called from inside GPT.forward, which dynamo traces, raising AssertionError on a forbidden callable. The repair moves that call into eager code so the same masking mechanism can actually run.", "measurements": [{"command": ["/data/home/zhubaiyu/.local/bin/uv", "run", "--project", "/data3/zhubaiyu/fengheguai/campaigns/h200-claude/nodes/t0010", "python", "/data3/zhubaiyu/fengheguai/fengheguai/_audit_runner.py", "--target", "/data3/zhubaiyu/fengheguai/campaigns/h200-claude/nodes/t0010", "--nonce", "2fdb9201898028e18fb7a8d30ba41eff99e5e1364fc86f38"], "errors": [], "evidence_path": "/data3/zhubaiyu/fengheguai/campaigns/h200-claude/evidence/t0010-r0/evidence.json", "evidence_sha256": "87ba84270a37637ef9c72663df4703c272bc94c76260f1ff5d07477210fcc54c", "log_path": "/data3/zhubaiyu/fengheguai/campaigns/h200-claude/evidence/t0010-r0/run.log", "log_sha256": "7660127edb1aa0ae649bb61f960765eca9e78c6e843e482ea6d5abac907831dc", "metric": 0.9781779135001519, "num_steps": 2097, "peak_vram_mb": 46036.2, "return_code": 0, "status": "valid", "timed_out": false, "train_sha256": "321603252ff064a004c48dc56ca4c1774ec59d781de9e2d810386458dd331ff0", "training_seconds": 300.0, "wall_seconds": 530.9586141528562}, {"command": ["/data/home/zhubaiyu/.local/bin/uv", "run", "--project", "/data3/zhubaiyu/fengheguai/campaigns/h200-claude/nodes/t0010", "python", "/data3/zhubaiyu/fengheguai/fengheguai/_audit_runner.py", "--target", "/data3/zhubaiyu/fengheguai/campaigns/h200-claude/nodes/t0010", "--nonce", "1a3415acd65b224508e1d9e55fba35fd244be85ac1e340b0"], "errors": [], "evidence_path": "/data3/zhubaiyu/fengheguai/campaigns/h200-claude/evidence/t0010-r1/evidence.json", "evidence_sha256": "f3074e6fd6867c972309f7fb1eee8319c2e14526024a6c92f5c6bbdcde6ed9f7", "log_path": "/data3/zhubaiyu/fengheguai/campaigns/h200-claude/evidence/t0010-r1/run.log", "log_sha256": "0ee7099a182cac746ae76fcc8e42addd1c8190616f35ba1f2a56637ac78909f3", "metric": 0.9781517103951864, "num_steps": 2102, "peak_vram_mb": 46036.2, "return_code": 0, "status": "valid", "timed_out": false, "train_sha256": "321603252ff064a004c48dc56ca4c1774ec59d781de9e2d810386458dd331ff0", "training_seconds": 300.1, "wall_seconds": 470.2344491966069}], "metric": 0.9781648119476691, "parent_id": "t0009", "patch_path": "/data3/zhubaiyu/fengheguai/campaigns/h200-claude/artifacts/t0010/change.patch", "patch_sha256": "541614643501f49edc68711adda722f7e15e09eafb5fa3b4155ad177c3d722e1", "promoted": true, "proposal": {"change_summary": "Debug repair of t0009 with the mechanism intact. The cu_seqlens construction moves into a module-level build_varlen helper; the training loop calls it eagerly, applies torch._dynamo.mark_dynamic to the varying dimension there, and passes the descriptor into the compiled model through a new trailing varlen keyword on GPT.forward. When varlen is not supplied, forward still builds it internally, which keeps the locked evaluator path document-masked since prepare.evaluate_bpb calls model(x, y, reduction=none) and cannot pass the extra argument. Attention still uses flash_attn_varlen_func with per-document boundaries; capacity, dense value embeddings, batch, learning rates, windows and schedules are untouched.", "command": ["/usr/bin/python3", "/data3/zhubaiyu/fengheguai/fengheguai/rendezvous_agent.py", "--trial", "/data3/zhubaiyu/fengheguai/campaigns/h200-claude/nodes/t0010", "--result", "/data3/zhubaiyu/fengheguai/campaigns/h200-claude/nodes/t0010/.fengheguai-agent-result.json", "--schema", "/data3/zhubaiyu/fengheguai/campaigns/h200-claude/control/agent_output.schema.json", "--campaign", "/data3/zhubaiyu/fengheguai/campaigns/h200-claude", "--inbox", "/data3/zhubaiyu/fengheguai/campaigns/h200-claude-rendezvous"], "errors": [], "expected_val_bpb_effect": "Same prediction as t0009: a decrease of roughly 0.003-0.010 bpb versus champion t0008 at 0.980245. The repair changes only where the descriptor is built, not what attention is allowed to see, so if the mechanism is real the gain should appear now.", "hypothesis": "Unchanged from t0009: attention reads across document boundaries inside each packed 2048-token row, and confining it to the enclosing document should remove that noise and lower val_bpb. t0009 did not test this hypothesis at all; it aborted during compilation because torch._dynamo.mark_dynamic was called from inside GPT.forward, which dynamo traces, raising AssertionError on a forbidden callable. The repair moves that call into eager code so the same masking mechanism can actually run.", "log_path": "/data3/zhubaiyu/fengheguai/campaigns/h200-claude/artifacts/t0010/agent.log", "return_code": 0, "risk": "Throughput remains the main risk: the BOS scan uses nonzero, forcing one device synchronisation per micro-step, and marking cu_seqlens dynamic yields a dynamic-shape graph that may compile to slower kernels; a drop in num_steps would offset the quality gain. The evaluator path builds the descriptor inside the traced region without a dynamic mark, so it may recompile a few times and then fall back to eager, which costs wall-clock but not training_seconds and cannot affect the locked score.", "success": true, "timed_out": false}, "secondary_parent_id": null, "selection_reason": "Repair the most recent executable failure before abandoning its hypothesis.", "source_sha256": "321603252ff064a004c48dc56ca4c1774ec59d781de9e2d810386458dd331ff0", "stage": "debug", "status": "keep", "training_seconds": 300.05, "trial_id": "t0010", "workspace": "/data3/zhubaiyu/fengheguai/campaigns/h200-claude/nodes/t0010"}, "prev_hash": "d66eb67b3129c17bb0f67c6e94777dc77d63c29fc25619083f7b89d06582be60", "seq": 22, "timestamp": "2026-08-20T13:23:43.882017+00:00"}
{"hash": "1fc74f119e27e73df5e26c851c6e8438c1f5e150f3de1f2c09483b4a52861ecb", "kind": "trial_started", "payload": {"parent_id": "t0010", "reason": "Spend the configured search share on a distinct architectural or recipe direction.", "secondary_parent_id": null, "stage": "explore", "trial_id": "t0011"}, "prev_hash": "443133d88e5e107a408ab838ac4637f99d1dd1a77f1f123535bf102212e32ad0", "seq": 23, "timestamp": "2026-08-20T13:23:43.889946+00:00"}
{"hash": "4b37404eff1343689bfeb776a0c4cb4ced8a09dfb452b4643149baf86a822e4c", "kind": "trial_completed", "payload": {"champion_before": "t0010", "debug_depth": 0, "delta_vs_champion_before": 0.0005190019874113938, "delta_vs_parent": 0.0005190019874113938, "finding": "t0011 did not improve the prior champion: val_bpb=0.978684, delta=+0.000519. Hypothesis: This model needs far less long-range attention than the recipe provides. Two independent measurements point the same way: halving the short window from 1024 to 512 in t0002 gained 0.001882, and document masking in t0010 gained 0.002083 by forbidding attention outside the current document. Both say the useful support of attention is local. The SSSL pattern still spends two of eight layers at the full 2048 context, and those two layers cost 12.6M of the 44.1M attention FLOPs per token. Dropping to a single full-context layer, which the code already forces as the last layer, should convert that into roughly 4 percent more optimizer steps at little quality cost.", "measurements": [{"command": ["/data/home/zhubaiyu/.local/bin/uv", "run", "--project", "/data3/zhubaiyu/fengheguai/campaigns/h200-claude/nodes/t0011", "python", "/data3/zhubaiyu/fengheguai/fengheguai/_audit_runner.py", "--target", "/data3/zhubaiyu/fengheguai/campaigns/h200-claude/nodes/t0011", "--nonce", "a3ff32e4911a6a56075bdfd34a3f3e7d699a46630fa353e6"], "errors": [], "evidence_path": "/data3/zhubaiyu/fengheguai/campaigns/h200-claude/evidence/t0011-r0/evidence.json", "evidence_sha256": "b99a3cceb7f2ee8b56348724bc0ef1672fcdc383e199ecdde4c170947d1c22a6", "log_path": "/data3/zhubaiyu/fengheguai/campaigns/h200-claude/evidence/t0011-r0/run.log", "log_sha256": "68663184f6f89df43283172bade95b9200a9e57d99fe0a2d6f0897112118a446", "metric": 0.9786838139350805, "num_steps": 2114, "peak_vram_mb": 46036.2, "return_code": 0, "status": "valid", "timed_out": false, "train_sha256": "f04fdb2dc551ced6bb7884823b2b246725884a17c24a4af074000fac7d3087ef", "training_seconds": 300.1, "wall_seconds": 529.3885415447876}], "metric": 0.9786838139350805, "parent_id": "t0010", "patch_path": "/data3/zhubaiyu/fengheguai/campaigns/h200-claude/artifacts/t0011/change.patch", "patch_sha256": "acaa869863ed1fc5d92f8b71c3b2fe5135c869b9b15b4896f6ebe90e98cb1de1", "promoted": false, "proposal": {"change_summary": "One constant changed on champion t0010: WINDOW_PATTERN from SSSL to S. Because _compute_window_sizes cycles the pattern across layers and then unconditionally forces the final layer to the full window, this yields seven 512-token short layers plus one full-context layer, instead of six short and two full. Capacity, HEAD_DIM, dense value embeddings, document masking, batch 2**18, learning rates and every schedule are unchanged.", "command": ["/usr/bin/python3", "/data3/zhubaiyu/fengheguai/fengheguai/rendezvous_agent.py", "--trial", "/data3/zhubaiyu/fengheguai/campaigns/h200-claude/nodes/t0011", "--result", "/data3/zhubaiyu/fengheguai/campaigns/h200-claude/nodes/t0011/.fengheguai-agent-result.json", "--schema", "/data3/zhubaiyu/fengheguai/campaigns/h200-claude/control/agent_output.schema.json", "--campaign", "/data3/zhubaiyu/fengheguai/campaigns/h200-claude", "--inbox", "/data3/zhubaiyu/fengheguai/campaigns/h200-claude-rendezvous"], "errors": [], "expected_val_bpb_effect": "Expected decrease of roughly 0.000-0.002 bpb versus champion t0010 at 0.978165, driven by about 4 percent more steps. This is a deliberately marginal bet: if a single global layer is insufficient to route document-level context, val_bpb will rise by a similar amount, which would mark the end of the attention-reduction direction that has paid off twice.", "hypothesis": "This model needs far less long-range attention than the recipe provides. Two independent measurements point the same way: halving the short window from 1024 to 512 in t0002 gained 0.001882, and document masking in t0010 gained 0.002083 by forbidding attention outside the current document. Both say the useful support of attention is local. The SSSL pattern still spends two of eight layers at the full 2048 context, and those two layers cost 12.6M of the 44.1M attention FLOPs per token. Dropping to a single full-context layer, which the code already forces as the last layer, should convert that into roughly 4 percent more optimizer steps at little quality cost.", "log_path": "/data3/zhubaiyu/fengheguai/campaigns/h200-claude/artifacts/t0011/agent.log", "return_code": 0, "risk": "The direction has been pushed three times now and must saturate somewhere; one full-context layer may be too few for the model to aggregate information across a document, and unlike the earlier window reductions this removes a qualitatively distinct layer type rather than shrinking a span. The gain is also small enough that it must clear the 0.0001 repeat-noise level to be trusted, which the confirmation run will decide.", "success": true, "timed_out": false}, "secondary_parent_id": null, "selection_reason": "Spend the configured search share on a distinct architectural or recipe direction.", "source_sha256": "f04fdb2dc551ced6bb7884823b2b246725884a17c24a4af074000fac7d3087ef", "stage": "explore", "status": "discard", "training_seconds": 300.1, "trial_id": "t0011", "workspace": "/data3/zhubaiyu/fengheguai/campaigns/h200-claude/nodes/t0011"}, "prev_hash": "1fc74f119e27e73df5e26c851c6e8438c1f5e150f3de1f2c09483b4a52861ecb", "seq": 24, "timestamp": "2026-08-20T13:34:29.807029+00:00"}
{"hash": "97fcd00a95df4fc653fcff806412dd40f6bedb0e909ef471199f62307aff101c", "kind": "trial_started", "payload": {"parent_id": "t0010", "reason": "Exploit a top-K branch selected by quality plus an under-exploration bonus.", "secondary_parent_id": null, "stage": "refine", "trial_id": "t0012"}, "prev_hash": "4b37404eff1343689bfeb776a0c4cb4ced8a09dfb452b4643149baf86a822e4c", "seq": 25, "timestamp": "2026-08-20T13:34:29.819844+00:00"}
