{"hash": "33d545563992d66c854cddd5985e280649a7a17f6fd8fa394188eee5a8f9c832", "kind": "trial_completed", "payload": {"champion_before": "t0037", "debug_depth": 0, "delta_vs_champion_before": -4.2526664929321e-05, "delta_vs_parent": -4.2526664929321e-05, "finding": "t0048 improved the prior champion: val_bpb=0.972662, delta=-0.000043. Hypothesis: The schedule endpoint is the last untouched part of the learning-rate trajectory. The warmdown fraction is bracketed at 0.5, with 0.35 costing 0.000758 and 0.8 costing 0.001467, but every one of those runs decayed to exactly zero because FINAL_LR_FRAC is 0.0. That endpoint has a real consequence at this operating point: the run takes about 1465 steps and the decay occupies the final half, so the last hundred or so steps operate below five percent of peak rate and contribute almost nothing to the weights while still consuming their share of the 300-second budget. Holding a floor at ten percent of peak keeps those steps productive. The competing consideration is that annealing to zero is what converts optimisation progress into a low final loss, which is why the recipe does it, so this is a genuine trade rather than free steps.", "measurements": [{"command": ["/data/home/zhubaiyu/.local/bin/uv", "run", "--project", "/data3/zhubaiyu/fengheguai/campaigns/h200-claude/nodes/t0048", "python", "/data3/zhubaiyu/fengheguai/fengheguai/_audit_runner.py", "--target", "/data3/zhubaiyu/fengheguai/campaigns/h200-claude/nodes/t0048", "--nonce", "7fdba6db9582cad80c29dc1eea4ecdf0b2138cbb15ccc61b"], "errors": [], "evidence_path": "/data3/zhubaiyu/fengheguai/campaigns/h200-claude/evidence/t0048-r0/evidence.json", "evidence_sha256": "05232209603d857b5fef5599743263ef4fdd33f88508beafbbdeaff36d9088b8", "log_path": "/data3/zhubaiyu/fengheguai/campaigns/h200-claude/evidence/t0048-r0/run.log", "log_sha256": "48387e02b4478685eacfa8773c148645e78abafd41e90ce63a9380d300309095", "metric": 0.972668710947403, "num_steps": 1464, "peak_vram_mb": 66795.4, "return_code": 0, "status": "valid", "timed_out": false, "train_sha256": "1732ab0c310474189caaeab5d3fdfc6b6768b99ecf2781df2f07885b20b4a904", "training_seconds": 300.0, "wall_seconds": 486.3352684825659}, {"command": ["/data/home/zhubaiyu/.local/bin/uv", "run", "--project", "/data3/zhubaiyu/fengheguai/campaigns/h200-claude/nodes/t0048", "python", "/data3/zhubaiyu/fengheguai/fengheguai/_audit_runner.py", "--target", "/data3/zhubaiyu/fengheguai/campaigns/h200-claude/nodes/t0048", "--nonce", "70a1a8abbba8fc5ba0d2bcec5a174989be8336d199fb109d"], "errors": [], "evidence_path": "/data3/zhubaiyu/fengheguai/campaigns/h200-claude/evidence/t0048-r1/evidence.json", "evidence_sha256": "977bc5693854af1c4ed561d07edaf8963655ed7ff80eabc58fb6f67d05c0ddc1", "log_path": "/data3/zhubaiyu/fengheguai/campaigns/h200-claude/evidence/t0048-r1/run.log", "log_sha256": "95d1ba495b0938a95bcf60995b5cce14a3b4fd3051a141cab7cfc145bdb93479", "metric": 0.9726551924668327, "num_steps": 1465, "peak_vram_mb": 66795.4, "return_code": 0, "status": "valid", "timed_out": false, "train_sha256": "1732ab0c310474189caaeab5d3fdfc6b6768b99ecf2781df2f07885b20b4a904", "training_seconds": 300.1, "wall_seconds": 479.5907624270767}], "metric": 0.9726619517071179, "parent_id": "t0037", "patch_path": "/data3/zhubaiyu/fengheguai/campaigns/h200-claude/artifacts/t0048/change.patch", "patch_sha256": "b2571a53afeb423710fb6f0849eb317e56ce9956a2b5dd1dcf7b963a25c6fc39", "promoted": true, "proposal": {"change_summary": "One constant changed on champion t0037: FINAL_LR_FRAC from 0.0 to 0.1, so get_lr_multiplier interpolates from full rate down to a tenth of it across the warmdown phase instead of down to zero. WARMDOWN_RATIO stays at its bracketed optimum of 0.5 and WARMUP_RATIO stays 0.0. The MLP expansion from t0047, the attention gate from t0046 and the per-head scales from t0045 are not carried forward. Output softcap 10, value-embedding gate 128, rotary base 30000, depth 12, width 512, document masking, dense value embeddings, batch 2**18, all learning rates, WEIGHT_DECAY 0.2 and the weight-decay schedule are unchanged.", "command": ["/usr/bin/python3", "/data3/zhubaiyu/fengheguai/fengheguai/rendezvous_agent.py", "--trial", "/data3/zhubaiyu/fengheguai/campaigns/h200-claude/nodes/t0048", "--result", "/data3/zhubaiyu/fengheguai/campaigns/h200-claude/nodes/t0048/.fengheguai-agent-result.json", "--schema", "/data3/zhubaiyu/fengheguai/campaigns/h200-claude/control/agent_output.schema.json", "--campaign", "/data3/zhubaiyu/fengheguai/campaigns/h200-claude", "--inbox", "/data3/zhubaiyu/fengheguai/campaigns/h200-claude-rendezvous"], "errors": [], "expected_val_bpb_effect": "Expected between a 0.0005 decrease and a 0.0015 increase versus champion t0037 at 0.972704, with step count unchanged since the schedule costs nothing to evaluate. The honest prior favours a regression: sixteen of seventeen inherited defaults tested in this campaign have proved to sit at their own optimum, and a nonzero floor means the model finishes training at a rate where it is still moving rather than settled, which usually shows up directly in final loss.", "hypothesis": "The schedule endpoint is the last untouched part of the learning-rate trajectory. The warmdown fraction is bracketed at 0.5, with 0.35 costing 0.000758 and 0.8 costing 0.001467, but every one of those runs decayed to exactly zero because FINAL_LR_FRAC is 0.0. That endpoint has a real consequence at this operating point: the run takes about 1465 steps and the decay occupies the final half, so the last hundred or so steps operate below five percent of peak rate and contribute almost nothing to the weights while still consuming their share of the 300-second budget. Holding a floor at ten percent of peak keeps those steps productive. The competing consideration is that annealing to zero is what converts optimisation progress into a low final loss, which is why the recipe does it, so this is a genuine trade rather than free steps.", "log_path": "/data3/zhubaiyu/fengheguai/campaigns/h200-claude/artifacts/t0048/agent.log", "return_code": 0, "risk": "The weight-decay schedule is coupled to the same progress variable but is not changed by this node, so at the end of the run the model would train at ten percent of peak rate with essentially zero weight decay, a combination the recipe never intended and which could allow late drift in the matrix parameters. That interaction, rather than the rate floor itself, is the most likely reason for this to regress, and it would not be visible from val_bpb alone.", "success": true, "timed_out": false}, "secondary_parent_id": null, "selection_reason": "The current line is stalled; make a structurally different bet.", "source_sha256": "1732ab0c310474189caaeab5d3fdfc6b6768b99ecf2781df2f07885b20b4a904", "stage": "explore", "status": "keep", "training_seconds": 300.05, "trial_id": "t0048", "workspace": "/data3/zhubaiyu/fengheguai/campaigns/h200-claude/nodes/t0048"}, "prev_hash": "0634214f9aeb46051c2c5b4b5fe47aebd7f74f17858d3706dcd1a60c045de1ac", "seq": 98, "timestamp": "2026-08-20T20:40:31.452215+00:00"}
{"hash": "96af8a6acf6a9fc5a2733ea0e231646deaba8913fcb9d3388a07cc1c7977e677", "kind": "trial_started", "payload": {"parent_id": "t0048", "reason": "Recombine two independently strong branches at the scheduled synthesis step.", "secondary_parent_id": "t0037", "stage": "recombine", "trial_id": "t0049"}, "prev_hash": "33d545563992d66c854cddd5985e280649a7a17f6fd8fa394188eee5a8f9c832", "seq": 99, "timestamp": "2026-08-20T20:40:31.480296+00:00"}
{"hash": "42685a7e7b1f4e492b6b087deda11bf006de1fba3c495efdbcd845b3f992f0ca", "kind": "trial_completed", "payload": {"champion_before": "t0048", "debug_depth": 0, "delta_vs_champion_before": 0.00249214903883066, "delta_vs_parent": 0.00249214903883066, "finding": "t0049 did not improve the prior champion: val_bpb=0.975154, delta=+0.002492. Hypothesis: The two elite lines differ only in the schedule endpoint, 0.0 in t0037 against 0.1 in t0048, and that difference measured 0.000043, well below the 0.00013 repeat noise, so the floor by itself is inert. The t0048 risk note predicted why: weight decay is driven by the same progress variable but was not given the same floor, so the run now ends at ten percent of peak rate with essentially zero weight decay, a combination the recipe never intended. In muon_step_fused the decay term is lr times wd times the parameter, so effective decay is the product of two independently decaying schedules and vanishes quadratically while the update itself vanishes linearly. Making weight decay track the rate multiplier keeps that ratio fixed across the whole run and is the coherent completion of the floor the two elites bracket.", "measurements": [{"command": ["/data/home/zhubaiyu/.local/bin/uv", "run", "--project", "/data3/zhubaiyu/fengheguai/campaigns/h200-claude/nodes/t0049", "python", "/data3/zhubaiyu/fengheguai/fengheguai/_audit_runner.py", "--target", "/data3/zhubaiyu/fengheguai/campaigns/h200-claude/nodes/t0049", "--nonce", "09c6ca386c56ea97879c8578d82d2d1cf41e58cd39526a8f"], "errors": [], "evidence_path": "/data3/zhubaiyu/fengheguai/campaigns/h200-claude/evidence/t0049-r0/evidence.json", "evidence_sha256": "21329bebd8dc9175b7dded05055ddc69e96711ae836c746c9102743a9d20eee7", "log_path": "/data3/zhubaiyu/fengheguai/campaigns/h200-claude/evidence/t0049-r0/run.log", "log_sha256": "b29207b095df0f58f96719e35c08c8bb529863b3a81886ca9efc5d872d8c5602", "metric": 0.9751541007459485, "num_steps": 1465, "peak_vram_mb": 66795.4, "return_code": 0, "status": "valid", "timed_out": false, "train_sha256": "c2bbfab256403ac378344b75ea7c5255736d887bcbd27f65ed6102b9e10bad5d", "training_seconds": 300.2, "wall_seconds": 486.09832216706127}], "metric": 0.9751541007459485, "parent_id": "t0048", "patch_path": "/data3/zhubaiyu/fengheguai/campaigns/h200-claude/artifacts/t0049/change.patch", "patch_sha256": "51da3b0ee69b4d61f73137b5a0ccaf7b7c20acb3489710f66ffb88f14589c0e1", "promoted": false, "proposal": {"change_summary": "One function changed on champion t0048: get_weight_decay now returns WEIGHT_DECAY times get_lr_multiplier(progress) instead of WEIGHT_DECAY times (1 - progress). Because the rate multiplier is flat at 1.0 through the first half of the budget and then decays to the 0.1 floor, decay now holds at 0.2 during the stable phase and falls to 0.02 at the end, rather than declining linearly from 0.2 to 0 from the first step. Only the Muon matrix groups are affected since the AdamW groups run at weight_decay 0. WEIGHT_DECAY stays at its bracketed optimum of 0.2, FINAL_LR_FRAC stays 0.1, WARMDOWN_RATIO stays 0.5, and depth 12, width 512, document masking, dense value embeddings with the 128-channel gate, output softcap 10, rotary base 30000, batch 2**18 and all learning rates are unchanged.", "command": ["/usr/bin/python3", "/data3/zhubaiyu/fengheguai/fengheguai/rendezvous_agent.py", "--trial", "/data3/zhubaiyu/fengheguai/campaigns/h200-claude/nodes/t0049", "--result", "/data3/zhubaiyu/fengheguai/campaigns/h200-claude/nodes/t0049/.fengheguai-agent-result.json", "--schema", "/data3/zhubaiyu/fengheguai/campaigns/h200-claude/control/agent_output.schema.json", "--campaign", "/data3/zhubaiyu/fengheguai/campaigns/h200-claude", "--inbox", "/data3/zhubaiyu/fengheguai/campaigns/h200-claude-rendezvous"], "errors": [], "expected_val_bpb_effect": "Expected between a 0.001 decrease and a 0.002 increase versus champion t0048 at 0.972662, with step count unchanged. The upside is that late training is no longer unconstrained; the downside is that this raises weight decay across the entire first half of the run, which is a larger change than the endpoint fix it was motivated by.", "hypothesis": "The two elite lines differ only in the schedule endpoint, 0.0 in t0037 against 0.1 in t0048, and that difference measured 0.000043, well below the 0.00013 repeat noise, so the floor by itself is inert. The t0048 risk note predicted why: weight decay is driven by the same progress variable but was not given the same floor, so the run now ends at ten percent of peak rate with essentially zero weight decay, a combination the recipe never intended. In muon_step_fused the decay term is lr times wd times the parameter, so effective decay is the product of two independently decaying schedules and vanishes quadratically while the update itself vanishes linearly. Making weight decay track the rate multiplier keeps that ratio fixed across the whole run and is the coherent completion of the floor the two elites bracket.", "log_path": "/data3/zhubaiyu/fengheguai/campaigns/h200-claude/artifacts/t0049/agent.log", "return_code": 0, "risk": "This is not a pure endpoint correction and I want that on the record: holding decay at 0.2 through the stable phase means the first half of training now sees more cumulative decay than any node that has scored well, and the WEIGHT_DECAY bracket of 0.1, 0.2 and 0.3 was measured under the old linearly declining schedule, so 0.2 is not necessarily still the right constant under this one. A regression would most likely mean the constant needs re-tuning downward rather than that coupling the schedules is wrong, and the informative follow-up in that case is this same coupling with WEIGHT_DECAY reduced to about 0.1.", "success": true, "timed_out": false}, "secondary_parent_id": "t0037", "selection_reason": "Recombine two independently strong branches at the scheduled synthesis step.", "source_sha256": "c2bbfab256403ac378344b75ea7c5255736d887bcbd27f65ed6102b9e10bad5d", "stage": "recombine", "status": "discard", "training_seconds": 300.2, "trial_id": "t0049", "workspace": "/data3/zhubaiyu/fengheguai/campaigns/h200-claude/nodes/t0049"}, "prev_hash": "96af8a6acf6a9fc5a2733ea0e231646deaba8913fcb9d3388a07cc1c7977e677", "seq": 100, "timestamp": "2026-08-20T20:49:56.114601+00:00"}
{"hash": "911b3d078cd8a1744fd1d76d3e82b899614dde0372ffe223e44507ff56ea1667", "kind": "trial_started", "payload": {"parent_id": "t0048", "reason": "Exploit a top-K branch selected by quality plus an under-exploration bonus.", "secondary_parent_id": null, "stage": "refine", "trial_id": "t0050"}, "prev_hash": "42685a7e7b1f4e492b6b087deda11bf006de1fba3c495efdbcd845b3f992f0ca", "seq": 101, "timestamp": "2026-08-20T20:49:56.143179+00:00"}
{"hash": "aa6c937d93ffef374874d3ed5a6509b771c6383fc6871bb3df8511a06269a548", "kind": "trial_completed", "payload": {"champion_before": "t0048", "debug_depth": 0, "delta_vs_champion_before": 0.0011101298715914254, "delta_vs_parent": 0.0011101298715914254, "finding": "t0050 did not improve the prior champion: val_bpb=0.973772, delta=+0.001110. Hypothesis: t0049 changed two things at once and lost 0.002492: it coupled the weight-decay schedule to the rate multiplier, and in doing so it raised the total amount of decay applied. Those are separable and only the first is the idea worth testing. In muon_step_fused the decay term is lr times wd times the parameter, so the quantity that matters is the integral of their product over the run. For the original schedule that integral is the integral of lrm times 0.2 times (1 - progress), which evaluates to 0.0925 in units of peak rate; for the coupled form it is WEIGHT_DECAY times the integral of lrm squared, which evaluates to 0.685 times WEIGHT_DECAY. Setting WEIGHT_DECAY to 0.135 equates them. This node therefore tests the shape of the coupling at matched total decay: if the coupling is right, holding decay in fixed proportion to update magnitude should beat the champion; if it is not, the axis closes and the t0049 loss is explained entirely by the extra decay rather than by the shape.", "measurements": [{"command": ["/data/home/zhubaiyu/.local/bin/uv", "run", "--project", "/data3/zhubaiyu/fengheguai/campaigns/h200-claude/nodes/t0050", "python", "/data3/zhubaiyu/fengheguai/fengheguai/_audit_runner.py", "--target", "/data3/zhubaiyu/fengheguai/campaigns/h200-claude/nodes/t0050", "--nonce", "e9a8db264dfbb6c150ed8b5d5b72fe77a32635e05141445a"], "errors": [], "evidence_path": "/data3/zhubaiyu/fengheguai/campaigns/h200-claude/evidence/t0050-r0/evidence.json", "evidence_sha256": "faafed02fc20ef2ecab52c2081e98b87b5ae83d1e8bcf18ac98e7724abe8b891", "log_path": "/data3/zhubaiyu/fengheguai/campaigns/h200-claude/evidence/t0050-r0/run.log", "log_sha256": "fafd7d7d4d5b08a7c5e4f0c803b553cc8c09cc83301455ce0c7651d8fda0fdfd", "metric": 0.9737720815787093, "num_steps": 1465, "peak_vram_mb": 66795.4, "return_code": 0, "status": "valid", "timed_out": false, "train_sha256": "9d6a3753b551a6c8ac270f2b78fe8e7cd105b5b638402a0bdfc526d1e3606822", "training_seconds": 300.1, "wall_seconds": 484.43710148055106}], "metric": 0.9737720815787093, "parent_id": "t0048", "patch_path": "/data3/zhubaiyu/fengheguai/campaigns/h200-claude/artifacts/t0050/change.patch", "patch_sha256": "d24e979067c82a75171f1b39823c5daf8f19b4a39e0860f1eeef53ca75460791", "promoted": false, "proposal": {"change_summary": "Two coordinated edits on champion t0048 that together express one change of schedule shape at constant total decay: get_weight_decay returns WEIGHT_DECAY times get_lr_multiplier(progress) instead of WEIGHT_DECAY times (1 - progress), and WEIGHT_DECAY moves from 0.2 to 0.135, the value computed to equate the integral of lr times wd across the two schedules. Only the Muon matrix groups are affected. FINAL_LR_FRAC stays 0.1, WARMDOWN_RATIO stays 0.5, and depth 12, width 512, document masking, dense value embeddings with the 128-channel gate, output softcap 10, rotary base 30000, batch 2**18 and all learning rates are unchanged.", "command": ["/usr/bin/python3", "/data3/zhubaiyu/fengheguai/fengheguai/rendezvous_agent.py", "--trial", "/data3/zhubaiyu/fengheguai/campaigns/h200-claude/nodes/t0050", "--result", "/data3/zhubaiyu/fengheguai/campaigns/h200-claude/nodes/t0050/.fengheguai-agent-result.json", "--schema", "/data3/zhubaiyu/fengheguai/campaigns/h200-claude/control/agent_output.schema.json", "--campaign", "/data3/zhubaiyu/fengheguai/campaigns/h200-claude", "--inbox", "/data3/zhubaiyu/fengheguai/campaigns/h200-claude-rendezvous"], "errors": [], "expected_val_bpb_effect": "Expected between a 0.001 decrease and a 0.001 increase versus champion t0048 at 0.972662, with step count unchanged. This is a deliberately controlled retry rather than a fresh direction: the previous attempt at this idea regressed, and the entire purpose here is to determine whether that regression was about shape or about amount, which the earlier node could not distinguish.", "hypothesis": "t0049 changed two things at once and lost 0.002492: it coupled the weight-decay schedule to the rate multiplier, and in doing so it raised the total amount of decay applied. Those are separable and only the first is the idea worth testing. In muon_step_fused the decay term is lr times wd times the parameter, so the quantity that matters is the integral of their product over the run. For the original schedule that integral is the integral of lrm times 0.2 times (1 - progress), which evaluates to 0.0925 in units of peak rate; for the coupled form it is WEIGHT_DECAY times the integral of lrm squared, which evaluates to 0.685 times WEIGHT_DECAY. Setting WEIGHT_DECAY to 0.135 equates them. This node therefore tests the shape of the coupling at matched total decay: if the coupling is right, holding decay in fixed proportion to update magnitude should beat the champion; if it is not, the axis closes and the t0049 loss is explained entirely by the extra decay rather than by the shape.", "log_path": "/data3/zhubaiyu/fengheguai/campaigns/h200-claude/artifacts/t0050/agent.log", "return_code": 0, "risk": "The matching is exact only for the integral, not pointwise, so the coupled schedule still applies more decay early and less late than the original even at matched total, and if the timing of decay matters more than its total this will regress for a reason the correction does not address. The WEIGHT_DECAY bracket that established 0.2 was also measured under the declining schedule, so 0.135 is justified by the integral argument rather than by direct measurement under this shape; a small regression would leave open whether a nearby constant does better, and I would close the axis at that point rather than tune it further, since three nodes on one schedule detail is already more than its measured leverage justifies.", "success": true, "timed_out": false}, "secondary_parent_id": null, "selection_reason": "Exploit a top-K branch selected by quality plus an under-exploration bonus.", "source_sha256": "9d6a3753b551a6c8ac270f2b78fe8e7cd105b5b638402a0bdfc526d1e3606822", "stage": "refine", "status": "discard", "training_seconds": 300.1, "trial_id": "t0050", "workspace": "/data3/zhubaiyu/fengheguai/campaigns/h200-claude/nodes/t0050"}, "prev_hash": "911b3d078cd8a1744fd1d76d3e82b899614dde0372ffe223e44507ff56ea1667", "seq": 102, "timestamp": "2026-08-20T20:59:07.074374+00:00"}
{"hash": "f21d9072392a16e263f3d00cee8a6598eebcbfd678aceb8d89ff3c40dd728fd7", "kind": "trial_started", "payload": {"parent_id": "t0048", "reason": "Exploit a top-K branch selected by quality plus an under-exploration bonus.", "secondary_parent_id": null, "stage": "refine", "trial_id": "t0051"}, "prev_hash": "aa6c937d93ffef374874d3ed5a6509b771c6383fc6871bb3df8511a06269a548", "seq": 103, "timestamp": "2026-08-20T20:59:07.106038+00:00"}
