{"hash": "89cd3f9d95bbd6d309397dfbb09ed682325071acd5f2739533c39604a97acedb", "kind": "trial_completed", "payload": {"champion_before": "t0096", "debug_depth": 0, "delta_vs_champion_before": 0.0023942686474588415, "delta_vs_parent": 0.0023942686474588415, "finding": "t0104 did not improve the prior champion: val_bpb=0.969680, delta=+0.002394. Hypothesis: t0103 tested Lookahead on every parameter and lost 0.007204, and its risk note named the likely cause in advance: Muon maintains a momentum buffer and a NorMuon per-row variance estimate keyed to the parameters it is updating, and Lookahead rewrites those parameters without touching either, so for five steps after each sync the orthogonalised update is correcting a trajectory that no longer exists. The pre-registered follow-up was a larger k, but that only makes the disruption rarer rather than testing the diagnosis. Restricting Lookahead to the AdamW groups tests it directly: those moments are plain per-coordinate exponential averages of gradients, which tolerate a parameter being moved under them far better than an orthogonalisation whose scale comes from a running variance estimate. The groups this covers are also the ones worth covering, since they hold wte, lm_head and the twelve value-embedding tables, roughly 58M parameters and the path this campaign has repeatedly found load-bearing.", "measurements": [{"command": ["/data/home/zhubaiyu/.local/bin/uv", "run", "--project", "/data3/zhubaiyu/fengheguai/campaigns/h200-claude/nodes/t0104", "python", "/data3/zhubaiyu/fengheguai/fengheguai/_audit_runner.py", "--target", "/data3/zhubaiyu/fengheguai/campaigns/h200-claude/nodes/t0104", "--nonce", "c9968f1a361066894f366b2aef428b4cc3565f12fefbe038"], "errors": [], "evidence_path": "/data3/zhubaiyu/fengheguai/campaigns/h200-claude/evidence/t0104-r0/evidence.json", "evidence_sha256": "b3d24934dd547ba850e8bfb6759ef1871f3bc2959f6d9ce2dcf2a900858718f7", "log_path": "/data3/zhubaiyu/fengheguai/campaigns/h200-claude/evidence/t0104-r0/run.log", "log_sha256": "14a7071771aaa428477982f2d2b1a1815dc9d893a694226b32b3825e7052aabe", "metric": 0.9696801831953058, "num_steps": 2873, "peak_vram_mb": 34392.4, "return_code": 0, "status": "valid", "timed_out": false, "train_sha256": "3ad1048b765a5531eca8205b68907d93065c7c737e173ad86d652504713705d8", "training_seconds": 300.0, "wall_seconds": 486.82091369107366}], "metric": 0.9696801831953058, "parent_id": "t0096", "patch_path": "/data3/zhubaiyu/fengheguai/campaigns/h200-claude/artifacts/t0104/change.patch", "patch_sha256": "79ae8b7bb48680711182c001b086fa3e262431cf581f61388d7eac7719a81be9", "promoted": false, "proposal": {"change_summary": "Lookahead added to champion t0096 but scoped to the AdamW parameter groups only, selected at first use by filtering optimizer.param_groups on kind. LOOKAHEAD_K is 5 and LOOKAHEAD_ALPHA is 0.5, as in t0103. The Muon matrix groups are left entirely alone, so their momentum and variance buffers stay consistent with the parameters they describe. The endpoint EMA is retained unchanged at EMA_START 0.7 and EMA_DECAY 0.99. Everything else matches the champion: the linear anneal confirmed over cosine in t0102, WARMDOWN_RATIO 0.5, FINAL_LR_FRAC 0.1, the corrected value-embedding init, VALUE_EMBEDDING_LR 0.3, depth 12, the SSL pattern with a 256-token short span, document masking, output softcap 13, batch 2**17 and WEIGHT_DECAY 0.146.", "command": ["/usr/bin/python3", "/data3/zhubaiyu/fengheguai/fengheguai/rendezvous_agent.py", "--trial", "/data3/zhubaiyu/fengheguai/campaigns/h200-claude/nodes/t0104", "--result", "/data3/zhubaiyu/fengheguai/campaigns/h200-claude/nodes/t0104/.fengheguai-agent-result.json", "--schema", "/data3/zhubaiyu/fengheguai/campaigns/h200-claude/control/agent_output.schema.json", "--campaign", "/data3/zhubaiyu/fengheguai/campaigns/h200-claude", "--inbox", "/data3/zhubaiyu/fengheguai/campaigns/h200-claude-rendezvous"], "errors": [], "expected_val_bpb_effect": "Expected between a 0.002 decrease and a 0.003 increase versus champion t0096 at 0.967286. The informative comparison is against t0103 rather than against the champion: if the loss shrinks substantially from 0.007204 the diagnosis was right and the mechanism was being destroyed by the Muon interaction, and if it stays close to that figure the mechanism itself is wrong for this recipe regardless of which optimiser it touches.", "hypothesis": "t0103 tested Lookahead on every parameter and lost 0.007204, and its risk note named the likely cause in advance: Muon maintains a momentum buffer and a NorMuon per-row variance estimate keyed to the parameters it is updating, and Lookahead rewrites those parameters without touching either, so for five steps after each sync the orthogonalised update is correcting a trajectory that no longer exists. The pre-registered follow-up was a larger k, but that only makes the disruption rarer rather than testing the diagnosis. Restricting Lookahead to the AdamW groups tests it directly: those moments are plain per-coordinate exponential averages of gradients, which tolerate a parameter being moved under them far better than an orthogonalisation whose scale comes from a running variance estimate. The groups this covers are also the ones worth covering, since they hold wte, lm_head and the twelve value-embedding tables, roughly 58M parameters and the path this campaign has repeatedly found load-bearing.", "log_path": "/data3/zhubaiyu/fengheguai/campaigns/h200-claude/artifacts/t0104/agent.log", "return_code": 0, "risk": "Scoping by optimizer group is the right partition for the state argument but not necessarily for the model: the AdamW groups are almost entirely embeddings, and averaging embedding trajectories may simply matter less than averaging the matrices that do the computation, in which case a null here would understate what a state-aware Lookahead on Muon could do. I am not planning to build that; two failures on this mechanism would be enough to close it. There is also a smaller risk that filtering param_groups picks up the resid and x0 scalar groups, which are tiny and learn at very different rates, though at 24 scalars against 58M parameters they cannot move the result.", "success": true, "timed_out": false}, "secondary_parent_id": null, "selection_reason": "The current line is stalled; make a structurally different bet.", "source_sha256": "3ad1048b765a5531eca8205b68907d93065c7c737e173ad86d652504713705d8", "stage": "explore", "status": "discard", "training_seconds": 300.0, "trial_id": "t0104", "workspace": "/data3/zhubaiyu/fengheguai/campaigns/h200-claude/nodes/t0104"}, "prev_hash": "9ac39a6fec7ba388c7301e28bd3fdf220a0608df11b529b055e049a840583399", "seq": 210, "timestamp": "2026-08-21T07:01:04.168731+00:00"}
{"hash": "a905c1e31f96cc1b1a1be68f551ead8189713db16666ef89fbf91ffeb3786496", "kind": "trial_started", "payload": {"parent_id": "t0096", "reason": "Recombine two independently strong branches at the scheduled synthesis step.", "secondary_parent_id": "t0099", "stage": "recombine", "trial_id": "t0105"}, "prev_hash": "89cd3f9d95bbd6d309397dfbb09ed682325071acd5f2739533c39604a97acedb", "seq": 211, "timestamp": "2026-08-21T07:01:04.227892+00:00"}
{"hash": "c841088d75ac5d07dc47b8e17b9b1c8c05357edd36cb44717deafb40093dfa49", "kind": "trial_completed", "payload": {"champion_before": "t0096", "debug_depth": 0, "delta_vs_champion_before": 0.0009627548447237455, "delta_vs_parent": 0.0009627548447237455, "finding": "t0105 did not improve the prior champion: val_bpb=0.968249, delta=+0.000963. Hypothesis: Logit magnitude is the most sensitive quantity this campaign has found, and only one instrument controls it. The output softcap is the single inherited default that proved suboptimal, and its curve is steep in both directions: 7 costs 0.005206, 10 was the optimum at the old batch, 13 is the optimum now, 30 costs 0.004637. Both failures converge on the same mechanism, damping the gradient into lm_head, and t0039 showed that a uniform learning-rate reduction cannot substitute for it because the cap acts selectively on tokens whose logits have grown large. A z-loss is the other selective instrument for the same quantity: it penalises the log-partition, so it pushes back on exactly the examples whose logits are collectively large, and it does so through the loss rather than by clipping the function. If softcapping this model is worth several thousandths of a bpb, a second, smoother control on the same quantity is the most promising remaining lever.", "measurements": [{"command": ["/data/home/zhubaiyu/.local/bin/uv", "run", "--project", "/data3/zhubaiyu/fengheguai/campaigns/h200-claude/nodes/t0105", "python", "/data3/zhubaiyu/fengheguai/fengheguai/_audit_runner.py", "--target", "/data3/zhubaiyu/fengheguai/campaigns/h200-claude/nodes/t0105", "--nonce", "0778769204e4e3547a9c48a4b79fb123573e31459177f581"], "errors": [], "evidence_path": "/data3/zhubaiyu/fengheguai/campaigns/h200-claude/evidence/t0105-r0/evidence.json", "evidence_sha256": "df71699ab2f635652b4a87f03aacd30b59ec946f252008ee00ee1c2762e4ba6d", "log_path": "/data3/zhubaiyu/fengheguai/campaigns/h200-claude/evidence/t0105-r0/run.log", "log_sha256": "fad2ca3cbbbbf53f7fce03659a4c00678d5606d8c0438795cb98882785132781", "metric": 0.9682486693925707, "num_steps": 2826, "peak_vram_mb": 36210.0, "return_code": 0, "status": "valid", "timed_out": false, "train_sha256": "f5bc57a0bd9591dd25363e12c1073b2d425880c669f3e59235df27b7948f13dc", "training_seconds": 300.1, "wall_seconds": 503.9576267115772}], "metric": 0.9682486693925707, "parent_id": "t0096", "patch_path": "/data3/zhubaiyu/fengheguai/campaigns/h200-claude/artifacts/t0105/change.patch", "patch_sha256": "fb739b1152d8d0ffa8e016bc9a34294bbc4df5eea8c626cebf17052554052cc3", "promoted": false, "proposal": {"change_summary": "Auxiliary z-loss added to champion t0096. GPT.forward gains a z_loss keyword defaulting to 0.0; when positive it adds the coefficient times the mean squared log-sum-exp of the logits over non-ignored targets. The training loop passes Z_LOSS of 1e-4. The default of 0.0 is what makes this safe for the contract: prepare.evaluate_bpb calls the model as model(x, y, reduction=none) and cannot pass the keyword, so the locked metric is computed from cross-entropy alone and the penalty exists only in the training objective. The output softcap of 13 is retained rather than replaced, since the two act differently, one clipping the function and one shaping the loss. Everything else matches the champion, including the endpoint EMA, the linear anneal, depth 12, the SSL pattern with a 256-token short span, document masking, batch 2**17 and WEIGHT_DECAY 0.146.", "command": ["/usr/bin/python3", "/data3/zhubaiyu/fengheguai/fengheguai/rendezvous_agent.py", "--trial", "/data3/zhubaiyu/fengheguai/campaigns/h200-claude/nodes/t0105", "--result", "/data3/zhubaiyu/fengheguai/campaigns/h200-claude/nodes/t0105/.fengheguai-agent-result.json", "--schema", "/data3/zhubaiyu/fengheguai/campaigns/h200-claude/control/agent_output.schema.json", "--campaign", "/data3/zhubaiyu/fengheguai/campaigns/h200-claude", "--inbox", "/data3/zhubaiyu/fengheguai/campaigns/h200-claude-rendezvous"], "errors": [], "expected_val_bpb_effect": "Expected between a 0.002 decrease and a 0.002 increase versus champion t0096 at 0.967286, with the step count falling by perhaps one percent from the extra logsumexp over a vocabulary of 8192 in fp32. A coefficient of 1e-4 is the conventional starting point and is deliberately small: the point of this node is to establish the sign of the effect on an axis known to be steep, not to tune the coefficient.", "hypothesis": "Logit magnitude is the most sensitive quantity this campaign has found, and only one instrument controls it. The output softcap is the single inherited default that proved suboptimal, and its curve is steep in both directions: 7 costs 0.005206, 10 was the optimum at the old batch, 13 is the optimum now, 30 costs 0.004637. Both failures converge on the same mechanism, damping the gradient into lm_head, and t0039 showed that a uniform learning-rate reduction cannot substitute for it because the cap acts selectively on tokens whose logits have grown large. A z-loss is the other selective instrument for the same quantity: it penalises the log-partition, so it pushes back on exactly the examples whose logits are collectively large, and it does so through the loss rather than by clipping the function. If softcapping this model is worth several thousandths of a bpb, a second, smoother control on the same quantity is the most promising remaining lever.", "log_path": "/data3/zhubaiyu/fengheguai/campaigns/h200-claude/artifacts/t0105/agent.log", "return_code": 0, "risk": "The softcap already bounds every logit at 13, so the log-partition cannot grow without limit and the z-loss may be pushing against a constraint that is no longer binding, which would make this a null. If it instead regresses, the likely reading is that the two controls fight: tanh saturation shapes large logits selectively while the z-loss penalises their aggregate, so a model already capped may be paying twice for the same behaviour. There is also a real chance the coefficient is simply mis-scaled for a vocabulary this small, since 1e-4 is conventional at vocabularies in the tens of thousands where the log-partition is correspondingly larger.", "success": true, "timed_out": false}, "secondary_parent_id": "t0099", "selection_reason": "Recombine two independently strong branches at the scheduled synthesis step.", "source_sha256": "f5bc57a0bd9591dd25363e12c1073b2d425880c669f3e59235df27b7948f13dc", "stage": "recombine", "status": "discard", "training_seconds": 300.1, "trial_id": "t0105", "workspace": "/data3/zhubaiyu/fengheguai/campaigns/h200-claude/nodes/t0105"}, "prev_hash": "a905c1e31f96cc1b1a1be68f551ead8189713db16666ef89fbf91ffeb3786496", "seq": 212, "timestamp": "2026-08-21T07:10:56.685131+00:00"}
{"hash": "9328c8726299345950d441ed2a42fcf8024646980963149bf70873506c29cd71", "kind": "trial_started", "payload": {"parent_id": "t0096", "reason": "The current line is stalled; make a structurally different bet.", "secondary_parent_id": null, "stage": "explore", "trial_id": "t0106"}, "prev_hash": "c841088d75ac5d07dc47b8e17b9b1c8c05357edd36cb44717deafb40093dfa49", "seq": 213, "timestamp": "2026-08-21T07:10:56.747050+00:00"}
{"hash": "059507ba87e2c48ad795f5fddfeded0d1106c68f6a7fd21d69b45875fe58863a", "kind": "trial_completed", "payload": {"champion_before": "t0096", "debug_depth": 0, "delta_vs_champion_before": null, "delta_vs_parent": null, "finding": "t0106 ended as failed. Hypothesis: The training context length has never been varied, and document masking has made most of it unused. Attention now costs about 62.9M of the roughly 314M per-token FLOPs, and 50.3M of that sits in the four full-context layers spanning 2048 tokens; the other eight layers see only 256. Since t0010 those full-context layers cannot read across a document boundary anyway, so the span they actually exploit is the length of the enclosing document rather than the row. Halving the training context to 1024 halves the cost of those four layers, removing about 25M FLOPs per token or 8 percent of the total, which should convert into roughly 6 to 8 percent more optimizer steps. Evaluation is untouched: prepare.evaluate_bpb builds its own loader at MAX_SEQ_LEN and the model handles a longer input at eval because the rotary table is precomputed for ten times the configured length.. Evidence: expected one nonce-bound locked evaluation, found 0; training process exited with code 1; training_seconds is missing from output", "measurements": [{"command": ["/data/home/zhubaiyu/.local/bin/uv", "run", "--project", "/data3/zhubaiyu/fengheguai/campaigns/h200-claude/nodes/t0106", "python", "/data3/zhubaiyu/fengheguai/fengheguai/_audit_runner.py", "--target", "/data3/zhubaiyu/fengheguai/campaigns/h200-claude/nodes/t0106", "--nonce", "60728567a4c8e091525a205f3008b5c0e8ebb53a2a6b83f2"], "errors": ["expected one nonce-bound locked evaluation, found 0", "training process exited with code 1", "training_seconds is missing from output"], "evidence_path": "/data3/zhubaiyu/fengheguai/campaigns/h200-claude/evidence/t0106-r0/evidence.json", "evidence_sha256": "558d55c3cc1f181cdf98a333da3c794c387e6cfea860c79512cba0e018ae8a9d", "log_path": "/data3/zhubaiyu/fengheguai/campaigns/h200-claude/evidence/t0106-r0/run.log", "log_sha256": "9fe822c80c4120505837c3857854cc903324a4cb6f172d4d5b321a22eaef3216", "metric": null, "num_steps": null, "peak_vram_mb": null, "return_code": 1, "status": "failed", "timed_out": false, "train_sha256": "02474bea38b038a065950c26b7a660546d36e70917334eef6e6c5b7916acb402", "training_seconds": null, "wall_seconds": 138.2296849861741}], "metric": null, "parent_id": "t0096", "patch_path": "/data3/zhubaiyu/fengheguai/campaigns/h200-claude/artifacts/t0106/change.patch", "patch_sha256": "45a7d4fa5b64262f798d85a94242bc8646a00ba7058e2c4914e57da092b67293", "promoted": false, "proposal": {"change_summary": "Training context reduced on champion t0096: a new TRAIN_SEQ_LEN of 1024 replaces MAX_SEQ_LEN in both the model config and the training dataloader, and DEVICE_BATCH_SIZE doubles from 64 to 128 so tokens per forward-backward stays at exactly 2**17 and gradient accumulation stays at 1. The window sizes derive from config.sequence_len, so the four full-context layers now span 1024 and the eight short layers keep their 256-token span. Evaluation is unchanged and remains exact: prepare.evaluate_bpb divides EVAL_TOKENS by batch times MAX_SEQ_LEN, which at 128 by 2048 gives exactly 80 steps over the same 20,971,520 validation tokens as every previous trial. Everything else matches the champion, including the endpoint EMA, the linear anneal, document masking, depth 12, batch 2**17 and WEIGHT_DECAY 0.146.", "command": ["/usr/bin/python3", "/data3/zhubaiyu/fengheguai/fengheguai/rendezvous_agent.py", "--trial", "/data3/zhubaiyu/fengheguai/campaigns/h200-claude/nodes/t0106", "--result", "/data3/zhubaiyu/fengheguai/campaigns/h200-claude/nodes/t0106/.fengheguai-agent-result.json", "--schema", "/data3/zhubaiyu/fengheguai/campaigns/h200-claude/control/agent_output.schema.json", "--campaign", "/data3/zhubaiyu/fengheguai/campaigns/h200-claude", "--inbox", "/data3/zhubaiyu/fengheguai/campaigns/h200-claude-rendezvous"], "errors": [], "expected_val_bpb_effect": "Expected between a 0.002 decrease and a 0.003 increase versus champion t0096 at 0.967286, with the step count rising to roughly 3050 from 2870. The case for a gain is that the freed FLOPs are real and the context they buy is largely unused after masking; the case against is that documents longer than 1024 tokens do exist and the full-context layers currently serve them, so this trades a genuine capability for throughput.", "hypothesis": "The training context length has never been varied, and document masking has made most of it unused. Attention now costs about 62.9M of the roughly 314M per-token FLOPs, and 50.3M of that sits in the four full-context layers spanning 2048 tokens; the other eight layers see only 256. Since t0010 those full-context layers cannot read across a document boundary anyway, so the span they actually exploit is the length of the enclosing document rather than the row. Halving the training context to 1024 halves the cost of those four layers, removing about 25M FLOPs per token or 8 percent of the total, which should convert into roughly 6 to 8 percent more optimizer steps. Evaluation is untouched: prepare.evaluate_bpb builds its own loader at MAX_SEQ_LEN and the model handles a longer input at eval because the rotary table is precomputed for ten times the configured length.", "log_path": "/data3/zhubaiyu/fengheguai/campaigns/h200-claude/artifacts/t0106/agent.log", "return_code": 0, "risk": "This introduces a train-evaluate mismatch, which no previous node has done: the model trains on 1024-token rows and is scored on 2048-token rows. That is safe mechanically, since rotary is precomputed for ten times the configured length and the window sizes cap attention below the input length, but it means the four global layers are asked at evaluation to attend over a span twice anything they saw in training. If the result regresses sharply that mismatch is the likeliest cause rather than the lost context itself, and the clean way to separate them would be a node that also evaluates at 1024, which the locked evaluator does not permit.", "success": true, "timed_out": false}, "secondary_parent_id": null, "selection_reason": "The current line is stalled; make a structurally different bet.", "source_sha256": "02474bea38b038a065950c26b7a660546d36e70917334eef6e6c5b7916acb402", "stage": "explore", "status": "failed", "training_seconds": null, "trial_id": "t0106", "workspace": "/data3/zhubaiyu/fengheguai/campaigns/h200-claude/nodes/t0106"}, "prev_hash": "9328c8726299345950d441ed2a42fcf8024646980963149bf70873506c29cd71", "seq": 214, "timestamp": "2026-08-21T07:14:41.489000+00:00"}
{"hash": "1f60b5f803ec40216ab9ed87c19a9d9ba32208355ec90a0654158985642b1f8c", "kind": "trial_started", "payload": {"parent_id": "t0106", "reason": "Repair the most recent executable failure before abandoning its hypothesis.", "secondary_parent_id": null, "stage": "debug", "trial_id": "t0107"}, "prev_hash": "059507ba87e2c48ad795f5fddfeded0d1106c68f6a7fd21d69b45875fe58863a", "seq": 215, "timestamp": "2026-08-21T07:14:41.548925+00:00"}
