{"hash": "a8404920ffda3a73fb9e829e4649e7f33a1bd12d7d40dccfa418318e62273d5d", "kind": "trial_completed", "payload": {"champion_before": "t0076", "debug_depth": 0, "delta_vs_champion_before": 0.0021004096909835734, "delta_vs_parent": 0.0021004096909835734, "finding": "t0084 did not improve the prior champion: val_bpb=0.972235, delta=+0.002100. Hypothesis: The within-block allocation of capacity has been measured in one direction only. t0047 raised the MLP expansion from 4 to 5 and lost 0.001595, almost exactly matching the 0.001519 that adding two layers cost, which established that capacity is saturated regardless of how it is bought. The downward direction was never tested and is not symmetric with the upward one: reducing the MLP frees FLOPs that convert into steps, and steps have proven valuable at this operating point, since halving the batch to gain them was worth 0.000718 and narrowing the attention span to gain them was worth 0.000452. Reducing the expansion from 4 to 3 removes about 17 percent of matrix FLOPs and should raise the step count from 2874 toward roughly 3300. The two elite lines agree that the optimizer is exhausted as a source of gains, since t0082 measured the last untested Muon control as null, so what remains is the compute budget itself and how it is spent.", "measurements": [{"command": ["/data/home/zhubaiyu/.local/bin/uv", "run", "--project", "/data3/zhubaiyu/fengheguai/campaigns/h200-claude/nodes/t0084", "python", "/data3/zhubaiyu/fengheguai/fengheguai/_audit_runner.py", "--target", "/data3/zhubaiyu/fengheguai/campaigns/h200-claude/nodes/t0084", "--nonce", "25db7d47fafc4f01128ca098e5ece5723e65ac0db0445161"], "errors": [], "evidence_path": "/data3/zhubaiyu/fengheguai/campaigns/h200-claude/evidence/t0084-r0/evidence.json", "evidence_sha256": "132fb3ccecfc454ec6c699cb08ef51ebc3a696bc7baa856de516d19d9c3f4577", "log_path": "/data3/zhubaiyu/fengheguai/campaigns/h200-claude/evidence/t0084-r0/run.log", "log_sha256": "aad5b702acd68a949dd288b9d28ad1a7834d84503654923b741f52f7225d1295", "metric": 0.972235320856343, "num_steps": 3122, "peak_vram_mb": 30673.3, "return_code": 0, "status": "valid", "timed_out": false, "train_sha256": "23a0b2b574d313ec3f08271e6b1bbecec6b307e3001fa48dab30959b4c847389", "training_seconds": 300.0, "wall_seconds": 566.6668335571885}], "metric": 0.972235320856343, "parent_id": "t0076", "patch_path": "/data3/zhubaiyu/fengheguai/campaigns/h200-claude/artifacts/t0084/change.patch", "patch_sha256": "3c5ad0e411d56714083f8c1550532023d2ee8397bca40a7ee234d078e097e0c1", "promoted": false, "proposal": {"change_summary": "MLP expansion reduced from 4 to 3 on champion t0076, changing both projections so c_fc maps 512 to 1536 and c_proj maps 1536 back to 512. Depth stays 12 and width stays 512, so this isolates the attention-to-MLP allocation at fixed depth and is the mirror of t0047. Correction to the t0080 record, carried here because extra JSON keys are dropped by the controller and my attempt to record it in t0081 did not persist: the t0080 change_summary listed the computed windows as 128, 164, 2048, 237, 274, 2048, 347, 384, 2048, 201, 310, 2048, but the actual layout was 128, 164, 2048, 201, 237, 2048, 274, 310, 2048, 347, 384, 2048; its risk note claimed the spans were not monotonic down the stack and that index 9 got 201 after index 7 got 384, which is false since seen_short increments in stack order; and it said the mean span was exactly 256 when it was 255.6. The t0080 code was correct and its measurement of 0.970468 stands; only the description was wrong.", "command": ["/usr/bin/python3", "/data3/zhubaiyu/fengheguai/fengheguai/rendezvous_agent.py", "--trial", "/data3/zhubaiyu/fengheguai/campaigns/h200-claude/nodes/t0084", "--result", "/data3/zhubaiyu/fengheguai/campaigns/h200-claude/nodes/t0084/.fengheguai-agent-result.json", "--schema", "/data3/zhubaiyu/fengheguai/campaigns/h200-claude/control/agent_output.schema.json", "--campaign", "/data3/zhubaiyu/fengheguai/campaigns/h200-claude", "--inbox", "/data3/zhubaiyu/fengheguai/campaigns/h200-claude-rendezvous"], "errors": [], "expected_val_bpb_effect": "Expected between a 0.0005 decrease and a 0.0015 increase versus champion t0076 at 0.970135, with the step count rising by roughly 12 to 15 percent. Every capacity reduction tested so far has lost, depth 10 by 0.000807 and the value-embedding narrowing in t0071 by 0.005427, so a regression is the likely outcome; the case for spending the node is that those reductions removed parameters from paths this campaign showed to be load-bearing, whereas the MLP is the one large block never probed downward.", "hypothesis": "The within-block allocation of capacity has been measured in one direction only. t0047 raised the MLP expansion from 4 to 5 and lost 0.001595, almost exactly matching the 0.001519 that adding two layers cost, which established that capacity is saturated regardless of how it is bought. The downward direction was never tested and is not symmetric with the upward one: reducing the MLP frees FLOPs that convert into steps, and steps have proven valuable at this operating point, since halving the batch to gain them was worth 0.000718 and narrowing the attention span to gain them was worth 0.000452. Reducing the expansion from 4 to 3 removes about 17 percent of matrix FLOPs and should raise the step count from 2874 toward roughly 3300. The two elite lines agree that the optimizer is exhausted as a source of gains, since t0082 measured the last untested Muon control as null, so what remains is the compute budget itself and how it is spent.", "log_path": "/data3/zhubaiyu/fengheguai/campaigns/h200-claude/artifacts/t0084/agent.log", "return_code": 0, "risk": "The step gain may not materialise at the predicted rate, since attention and matrix FLOP reductions have consistently converted into steps at well below what the FLOP model implies in this campaign, most starkly at t0011 where a 4 percent cut returned 0.8 percent. If steps rise by only a few percent while capacity falls 17 percent, this regresses for a reason that says nothing new about allocation. The zero-initialised c_proj and the uniform init on c_fc also both scale with n_embd rather than the hidden width, so the narrower layer starts with the same per-weight scale, a small departure from the tuned initialisation that this node does not correct.", "success": true, "timed_out": false}, "secondary_parent_id": "t0082", "selection_reason": "Recombine two independently strong branches at the scheduled synthesis step.", "source_sha256": "23a0b2b574d313ec3f08271e6b1bbecec6b307e3001fa48dab30959b4c847389", "stage": "recombine", "status": "discard", "training_seconds": 300.0, "trial_id": "t0084", "workspace": "/data3/zhubaiyu/fengheguai/campaigns/h200-claude/nodes/t0084"}, "prev_hash": "397141693a34c800a22f952b9425a2923a3d26ceda19c94f396310ace09d8316", "seq": 170, "timestamp": "2026-08-21T03:32:47.350351+00:00"}
{"hash": "2edf330b79ef9ffb069c0e0f444d1abf0e42056bed7a13af6dbfdaa3cf95bbcf", "kind": "trial_started", "payload": {"parent_id": "t0076", "reason": "The current line is stalled; make a structurally different bet.", "secondary_parent_id": null, "stage": "explore", "trial_id": "t0085"}, "prev_hash": "a8404920ffda3a73fb9e829e4649e7f33a1bd12d7d40dccfa418318e62273d5d", "seq": 171, "timestamp": "2026-08-21T03:32:47.397802+00:00"}
{"hash": "40266b5a1c5ac9578a072040ff2b004bcb751f2e3e669eb986c4d345b84b68f7", "kind": "trial_completed", "payload": {"champion_before": "t0076", "debug_depth": 0, "delta_vs_champion_before": 0.0007869238102874432, "delta_vs_parent": 0.0007869238102874432, "finding": "t0085 did not improve the prior champion: val_bpb=0.970922, delta=+0.000787. Hypothesis: The unembedding initialisation is the last untested quantity on the parameter this campaign found most sensitive. Three separate results say lm_head dynamics dominate the early run: the output softcap is the steepest axis measured, where 7 cost 0.005206 and 30 cost 0.004637 around an optimum that later shifted from 10 to 13, and its surviving mechanism is damping the gradient into lm_head; and the unembedding rate was sharply peaked at the old batch, where a 30 percent move cost 0.003152. The initialisation sits directly upstream of both. It is currently normal with standard deviation 0.001, which is near zero but not zero, so the model begins with small random logit structure that carries no information and must be unlearned before useful structure replaces it. Every other output projection in this architecture is initialised to exact zeros, including attn.c_proj and mlp.c_proj, so lm_head is the one inconsistency. Zeroing it starts the model at exactly uniform predictions and should lower val_bpb.", "measurements": [{"command": ["/data/home/zhubaiyu/.local/bin/uv", "run", "--project", "/data3/zhubaiyu/fengheguai/campaigns/h200-claude/nodes/t0085", "python", "/data3/zhubaiyu/fengheguai/fengheguai/_audit_runner.py", "--target", "/data3/zhubaiyu/fengheguai/campaigns/h200-claude/nodes/t0085", "--nonce", "04d11afb231dc576ac6f6f038cf73900f3003be025b8b648"], "errors": [], "evidence_path": "/data3/zhubaiyu/fengheguai/campaigns/h200-claude/evidence/t0085-r0/evidence.json", "evidence_sha256": "32895d6896588f8f8655c34b55eb6f82e86a3c6f913664ab67552e9a1dbf9744", "log_path": "/data3/zhubaiyu/fengheguai/campaigns/h200-claude/evidence/t0085-r0/run.log", "log_sha256": "afec42c0f35983d415f13d7d61ce7075f10fe1901e460ed4889da3b194499e72", "metric": 0.9709218349756469, "num_steps": 2873, "peak_vram_mb": 33800.4, "return_code": 0, "status": "valid", "timed_out": false, "train_sha256": "987f4c5a57f2c496c3a327bdbc22f2b665bb86eafa1e65dcbd05f03f3eac7275", "training_seconds": 300.1, "wall_seconds": 485.4195461422205}], "metric": 0.9709218349756469, "parent_id": "t0076", "patch_path": "/data3/zhubaiyu/fengheguai/campaigns/h200-claude/artifacts/t0085/change.patch", "patch_sha256": "bd2e5f1e2f765fedb2f4db2f5e5695b3950ef2620a5ecb5cf0243d51e4e3d2f2", "promoted": false, "proposal": {"change_summary": "One initialisation changed on champion t0076: lm_head.weight from normal with standard deviation 0.001 to exact zeros, matching how attn.c_proj and mlp.c_proj are already initialised in the same function. This matters because the model is built on the meta device and materialised by to_empty, so init_weights is what actually sets these values. The MLP reduction from t0084 is not carried forward, having cost 0.002100. Depth 12, width 512, HEAD_DIM 128, the SSL pattern with a uniform 256-token short span, document masking, dense value embeddings with the 128-channel gate, output softcap 13, rotary base 30000, batch 2**17, the three settled learning rates, SCALAR_LR 0.5, ADAM_BETAS 0.8 and 0.95, WEIGHT_DECAY 0.146, FINAL_LR_FRAC 0.1 and WARMDOWN_RATIO 0.5 are unchanged.", "command": ["/usr/bin/python3", "/data3/zhubaiyu/fengheguai/fengheguai/rendezvous_agent.py", "--trial", "/data3/zhubaiyu/fengheguai/campaigns/h200-claude/nodes/t0085", "--result", "/data3/zhubaiyu/fengheguai/campaigns/h200-claude/nodes/t0085/.fengheguai-agent-result.json", "--schema", "/data3/zhubaiyu/fengheguai/campaigns/h200-claude/control/agent_output.schema.json", "--campaign", "/data3/zhubaiyu/fengheguai/campaigns/h200-claude", "--inbox", "/data3/zhubaiyu/fengheguai/campaigns/h200-claude-rendezvous"], "errors": [], "expected_val_bpb_effect": "Expected between a 0.0005 decrease and a 0.0005 increase versus champion t0076 at 0.970135, with step count unchanged. The honest expectation is small: a standard deviation of 0.001 against a 512-wide normalised input already produces logits of order 0.02, which the softcap and cross-entropy barely distinguish from zero, so the change is closer to a consistency fix than a mechanism.", "hypothesis": "The unembedding initialisation is the last untested quantity on the parameter this campaign found most sensitive. Three separate results say lm_head dynamics dominate the early run: the output softcap is the steepest axis measured, where 7 cost 0.005206 and 30 cost 0.004637 around an optimum that later shifted from 10 to 13, and its surviving mechanism is damping the gradient into lm_head; and the unembedding rate was sharply peaked at the old batch, where a 30 percent move cost 0.003152. The initialisation sits directly upstream of both. It is currently normal with standard deviation 0.001, which is near zero but not zero, so the model begins with small random logit structure that carries no information and must be unlearned before useful structure replaces it. Every other output projection in this architecture is initialised to exact zeros, including attn.c_proj and mlp.c_proj, so lm_head is the one inconsistency. Zeroing it starts the model at exactly uniform predictions and should lower val_bpb.", "log_path": "/data3/zhubaiyu/fengheguai/campaigns/h200-claude/artifacts/t0085/agent.log", "return_code": 0, "risk": "Exact zeros make every logit identical at step one, so the first gradient into lm_head is the same for every vocabulary row up to the target term, and with weight decay disabled on this group there is nothing to break that symmetry except the data itself; that is fine for an output layer, where the target supplies the asymmetry, but it does mean the very first update is degenerate in a way the small random init avoids. If this measures null, which is the most likely single outcome, the correct reading is that the initialisation was never a live axis rather than that zero and 0.001 are equivalent in principle.", "success": true, "timed_out": false}, "secondary_parent_id": null, "selection_reason": "The current line is stalled; make a structurally different bet.", "source_sha256": "987f4c5a57f2c496c3a327bdbc22f2b665bb86eafa1e65dcbd05f03f3eac7275", "stage": "explore", "status": "discard", "training_seconds": 300.1, "trial_id": "t0085", "workspace": "/data3/zhubaiyu/fengheguai/campaigns/h200-claude/nodes/t0085"}, "prev_hash": "2edf330b79ef9ffb069c0e0f444d1abf0e42056bed7a13af6dbfdaa3cf95bbcf", "seq": 172, "timestamp": "2026-08-21T03:41:53.336835+00:00"}
{"hash": "dc592570c37500aafd835664d237ef8edc9f69a9a5090c928e453ee6da5b2a25", "kind": "trial_started", "payload": {"parent_id": "t0076", "reason": "The current line is stalled; make a structurally different bet.", "secondary_parent_id": null, "stage": "explore", "trial_id": "t0086"}, "prev_hash": "40266b5a1c5ac9578a072040ff2b004bcb751f2e3e669eb986c4d345b84b68f7", "seq": 173, "timestamp": "2026-08-21T03:41:53.385304+00:00"}
{"hash": "e51e19c42d30baa18a7322c79085811a553919f6e465071b7bcc9a2c44de7391", "kind": "trial_completed", "payload": {"champion_before": "t0076", "debug_depth": 0, "delta_vs_champion_before": 0.0015802516998966176, "delta_vs_parent": 0.0015802516998966176, "finding": "t0086 did not improve the prior champion: val_bpb=0.971715, delta=+0.001580. Hypothesis: The unembedding initialisation turned out to be a live axis rather than a formality, and only one side of it has been measured. t0085 replaced the standard deviation of 0.001 with exact zeros, expecting a null or a small gain on the argument that random logit structure carries no information and must be unlearned, and it cost 0.000787. That refutes the argument: the small random init is doing something useful, most plausibly breaking the symmetry among vocabulary rows so that the first updates differentiate them rather than moving every row identically. If asymmetry at initialisation is what matters, more of it should help, and the inherited 0.001 is not obviously the right magnitude since it produces logits of order 0.02 against a softcap of 13. Raising it tenfold to 0.01 tests that and, with the zero measurement, brackets the axis.", "measurements": [{"command": ["/data/home/zhubaiyu/.local/bin/uv", "run", "--project", "/data3/zhubaiyu/fengheguai/campaigns/h200-claude/nodes/t0086", "python", "/data3/zhubaiyu/fengheguai/fengheguai/_audit_runner.py", "--target", "/data3/zhubaiyu/fengheguai/campaigns/h200-claude/nodes/t0086", "--nonce", "dee24ac065ea3e4046a8c089f77eb5aa13ce5140dd760c64"], "errors": [], "evidence_path": "/data3/zhubaiyu/fengheguai/campaigns/h200-claude/evidence/t0086-r0/evidence.json", "evidence_sha256": "11adc3f921bacc7ace3fb87d83b34e0a2ebfd9bb50d899fe6275ebd6cecc327a", "log_path": "/data3/zhubaiyu/fengheguai/campaigns/h200-claude/evidence/t0086-r0/run.log", "log_sha256": "6f57f8aba3e66667c180cff257aeba8ac96b501a05e68625b95da4c36a5adda4", "metric": 0.971715162865256, "num_steps": 2875, "peak_vram_mb": 33800.4, "return_code": 0, "status": "valid", "timed_out": false, "train_sha256": "a873b57794bae41717e431c1e8f3b38a15b6a70961cb526c254007b0ddc1b9ad", "training_seconds": 300.0, "wall_seconds": 486.1179099790752}], "metric": 0.971715162865256, "parent_id": "t0076", "patch_path": "/data3/zhubaiyu/fengheguai/campaigns/h200-claude/artifacts/t0086/change.patch", "patch_sha256": "5f54e030a64333eeea91371b8700b17b3a151c3936dfcda3cf3fa181747d87eb", "promoted": false, "proposal": {"change_summary": "One initialisation changed on champion t0076: the standard deviation of the normal init on lm_head.weight from 0.001 to 0.01, a tenfold increase, in init_weights where the meta-device model is materialised. Everything else is the champion: depth 12, width 512, HEAD_DIM 128, the SSL pattern with a uniform 256-token short span, document masking, dense value embeddings with the 128-channel gate, output softcap 13, rotary base 30000, batch 2**17, EMBEDDING_LR 0.6, UNEMBEDDING_LR 0.002, MATRIX_LR 0.0163, SCALAR_LR 0.5, ADAM_BETAS 0.8 and 0.95, WEIGHT_DECAY 0.146, FINAL_LR_FRAC 0.1 and WARMDOWN_RATIO 0.5.", "command": ["/usr/bin/python3", "/data3/zhubaiyu/fengheguai/fengheguai/rendezvous_agent.py", "--trial", "/data3/zhubaiyu/fengheguai/campaigns/h200-claude/nodes/t0086", "--result", "/data3/zhubaiyu/fengheguai/campaigns/h200-claude/nodes/t0086/.fengheguai-agent-result.json", "--schema", "/data3/zhubaiyu/fengheguai/campaigns/h200-claude/control/agent_output.schema.json", "--campaign", "/data3/zhubaiyu/fengheguai/campaigns/h200-claude", "--inbox", "/data3/zhubaiyu/fengheguai/campaigns/h200-claude-rendezvous"], "errors": [], "expected_val_bpb_effect": "Expected between a 0.0005 decrease and a 0.001 increase versus champion t0076 at 0.970135, with step count unchanged. The direction is supported only by the sign of the t0085 result, which establishes that less asymmetry is worse without saying that more is better, so the optimum may sit at or very near the inherited 0.001 with the curve rising in both directions, the shape that has held for most constants in this recipe.", "hypothesis": "The unembedding initialisation turned out to be a live axis rather than a formality, and only one side of it has been measured. t0085 replaced the standard deviation of 0.001 with exact zeros, expecting a null or a small gain on the argument that random logit structure carries no information and must be unlearned, and it cost 0.000787. That refutes the argument: the small random init is doing something useful, most plausibly breaking the symmetry among vocabulary rows so that the first updates differentiate them rather than moving every row identically. If asymmetry at initialisation is what matters, more of it should help, and the inherited 0.001 is not obviously the right magnitude since it produces logits of order 0.02 against a softcap of 13. Raising it tenfold to 0.01 tests that and, with the zero measurement, brackets the axis.", "log_path": "/data3/zhubaiyu/fengheguai/campaigns/h200-claude/artifacts/t0086/agent.log", "return_code": 0, "risk": "A tenfold larger init produces initial logits of order 0.2 rather than 0.02, which is still far below the softcap but no longer negligible against early cross-entropy, so the model starts with genuinely wrong predictions it must correct rather than near-uniform ones it must sharpen. Given that this campaign found lm_head to be the most damping-sensitive parameter in the model, where both loosening and tightening the softcap cost more than 0.004, starting it further from uniform is a plausible way to lose. If this regresses, the initialisation is settled at 0.001 and I would close the axis rather than sample between.", "success": true, "timed_out": false}, "secondary_parent_id": null, "selection_reason": "The current line is stalled; make a structurally different bet.", "source_sha256": "a873b57794bae41717e431c1e8f3b38a15b6a70961cb526c254007b0ddc1b9ad", "stage": "explore", "status": "discard", "training_seconds": 300.0, "trial_id": "t0086", "workspace": "/data3/zhubaiyu/fengheguai/campaigns/h200-claude/nodes/t0086"}, "prev_hash": "dc592570c37500aafd835664d237ef8edc9f69a9a5090c928e453ee6da5b2a25", "seq": 174, "timestamp": "2026-08-21T03:50:46.011647+00:00"}
{"hash": "6b977188a29b7f26fb429bf6f7b7be32613a6d6db9d764fae0d91dc46f274e06", "kind": "trial_started", "payload": {"parent_id": "t0076", "reason": "The current line is stalled; make a structurally different bet.", "secondary_parent_id": null, "stage": "explore", "trial_id": "t0087"}, "prev_hash": "e51e19c42d30baa18a7322c79085811a553919f6e465071b7bcc9a2c44de7391", "seq": 175, "timestamp": "2026-08-21T03:50:46.060112+00:00"}
