{"hash": "4bd44a7dc68b4e76546e3b2528f850dcc33b2649ba275a2b9761a4da71bb6ee7", "kind": "trial_completed", "payload": {"champion_before": "t0031", "debug_depth": 0, "delta_vs_champion_before": 0.0038153462023627904, "delta_vs_parent": 0.0038153462023627904, "finding": "t0033 did not improve the prior champion: val_bpb=0.976978, delta=+0.003815. Hypothesis: The rotary frequency spectrum is tuned for a context this model never sees. RoPE with base 10000 spreads inverse frequencies so the slowest channels have wavelengths of order 60000 positions, which is appropriate when attention spans thousands of tokens. This model attends over 512 tokens in nine of its twelve layers and at most 2048 in the other three, and document masking cuts many spans shorter still. Across a 512-token window the low-frequency channels rotate by a tiny fraction of a cycle and are therefore nearly constant, so a large part of the head dimension carries almost no positional information. Two independent results in this campaign say the model genuinely wants local attention rather than merely tolerating it: narrowing the window to 512 gained 0.001882 in t0002, and widening it back to 1024 lost 0.001186 in t0030 while costing only 1.2 percent of steps, so it was a quality preference and not a throughput trade. Lowering the base to 1000 matches the spectrum to the span actually used and should give finer positional resolution where the model is looking, lowering val_bpb.", "measurements": [{"command": ["/data/home/zhubaiyu/.local/bin/uv", "run", "--project", "/data3/zhubaiyu/fengheguai/campaigns/h200-claude/nodes/t0033", "python", "/data3/zhubaiyu/fengheguai/fengheguai/_audit_runner.py", "--target", "/data3/zhubaiyu/fengheguai/campaigns/h200-claude/nodes/t0033", "--nonce", "49ad208666061ef13e14a7f32339947cd194110aa7ab67eb"], "errors": [], "evidence_path": "/data3/zhubaiyu/fengheguai/campaigns/h200-claude/evidence/t0033-r0/evidence.json", "evidence_sha256": "21c923eeef7be81e3e98ddc6715328aa6f08555b9b642ffdb4b349345794ac46", "log_path": "/data3/zhubaiyu/fengheguai/campaigns/h200-claude/evidence/t0033-r0/run.log", "log_sha256": "34a8c15c4f368461a8b7df8529f7c6c5b81baaa76e039dc374ede0f1c6e630e9", "metric": 0.976977895423817, "num_steps": 1468, "peak_vram_mb": 66795.4, "return_code": 0, "status": "valid", "timed_out": false, "train_sha256": "e044046ff15c976b9745116a1efc7613d1a8e266c8545e38c35b8bb4bace341c", "training_seconds": 300.1, "wall_seconds": 485.99052247591317}], "metric": 0.976977895423817, "parent_id": "t0031", "patch_path": "/data3/zhubaiyu/fengheguai/campaigns/h200-claude/artifacts/t0033/change.patch", "patch_sha256": "d264524e776a3ddb1c110e70242511018925cb9422d66eb5f6e5d0070e2251fe", "promoted": false, "proposal": {"change_summary": "One default changed on champion t0031: the base argument of GPT._precompute_rotary_embeddings from 10000 to 1000. Both call sites, in __init__ and in init_weights, use the default, so the whole rotary table is rebuilt at the new base. The slowest wavelength is still about 6283 positions, comfortably longer than the 2048 maximum context, so no position wraps within a sequence. Head dimension 128, the 512-token short window, the SSSL pattern, document masking, dense value embeddings with the 128-channel gate, depth 12, width 512, batch 2**18, all learning rates and every schedule are unchanged.", "command": ["/usr/bin/python3", "/data3/zhubaiyu/fengheguai/fengheguai/rendezvous_agent.py", "--trial", "/data3/zhubaiyu/fengheguai/campaigns/h200-claude/nodes/t0033", "--result", "/data3/zhubaiyu/fengheguai/campaigns/h200-claude/nodes/t0033/.fengheguai-agent-result.json", "--schema", "/data3/zhubaiyu/fengheguai/campaigns/h200-claude/control/agent_output.schema.json", "--campaign", "/data3/zhubaiyu/fengheguai/campaigns/h200-claude", "--inbox", "/data3/zhubaiyu/fengheguai/campaigns/h200-claude-rendezvous"], "errors": [], "expected_val_bpb_effect": "Expected between a 0.002 decrease and a 0.001 increase versus champion t0031 at 0.973163, with step count unchanged since the rotary table is precomputed and the per-step cost is identical. A decrease would say positional resolution inside the window was the constraint; an increase would say the low-frequency channels are doing useful near-constant work, for instance acting as a coarse absolute-position signal that the three full-context layers rely on.", "hypothesis": "The rotary frequency spectrum is tuned for a context this model never sees. RoPE with base 10000 spreads inverse frequencies so the slowest channels have wavelengths of order 60000 positions, which is appropriate when attention spans thousands of tokens. This model attends over 512 tokens in nine of its twelve layers and at most 2048 in the other three, and document masking cuts many spans shorter still. Across a 512-token window the low-frequency channels rotate by a tiny fraction of a cycle and are therefore nearly constant, so a large part of the head dimension carries almost no positional information. Two independent results in this campaign say the model genuinely wants local attention rather than merely tolerating it: narrowing the window to 512 gained 0.001882 in t0002, and widening it back to 1024 lost 0.001186 in t0030 while costing only 1.2 percent of steps, so it was a quality preference and not a throughput trade. Lowering the base to 1000 matches the spectrum to the span actually used and should give finer positional resolution where the model is looking, lowering val_bpb.", "log_path": "/data3/zhubaiyu/fengheguai/campaigns/h200-claude/artifacts/t0033/agent.log", "return_code": 0, "risk": "The three full-context layers still attend across 2048 tokens and a lower base compresses their usable positional range, so this trades resolution in the nine local layers against discrimination in the three global ones, and the node cannot separate those effects. Base 1000 is also a single sizeable step rather than a scan, so a regression would not distinguish an overshoot from a wrong direction; if it regresses, the informative follow-up is base 3000 rather than abandoning the axis.", "success": true, "timed_out": false}, "secondary_parent_id": null, "selection_reason": "Spend the configured search share on a distinct architectural or recipe direction.", "source_sha256": "e044046ff15c976b9745116a1efc7613d1a8e266c8545e38c35b8bb4bace341c", "stage": "explore", "status": "discard", "training_seconds": 300.1, "trial_id": "t0033", "workspace": "/data3/zhubaiyu/fengheguai/campaigns/h200-claude/nodes/t0033"}, "prev_hash": "6d206d44a834ed6b456a4e074335443b713729e238488735dec798f6014e19db", "seq": 68, "timestamp": "2026-08-20T17:54:25.177317+00:00"}
{"hash": "826002adece3d5066d3f08bae48a740980fd939096f9cb846090d82e827754c8", "kind": "trial_started", "payload": {"parent_id": "t0031", "reason": "Spend the configured search share on a distinct architectural or recipe direction.", "secondary_parent_id": null, "stage": "explore", "trial_id": "t0034"}, "prev_hash": "4bd44a7dc68b4e76546e3b2528f850dcc33b2649ba275a2b9761a4da71bb6ee7", "seq": 69, "timestamp": "2026-08-20T17:54:25.197479+00:00"}
{"hash": "d5e81ff7e0b2ae19f6c386a88044076cfefbb203a85dd1e5dbb4ecb3eeb793b8", "kind": "trial_completed", "payload": {"champion_before": "t0031", "debug_depth": 0, "delta_vs_champion_before": -6.504930125994512e-05, "delta_vs_parent": -6.504930125994512e-05, "finding": "t0034 improved the prior champion: val_bpb=0.973097, delta=-0.000065. Hypothesis: t0033 falsified the local-resolution reading of the rotary spectrum and did so with a large effect: lowering the base from 10000 to 1000 cost 0.003815, roughly thirty times the repeat noise. The low-frequency channels that barely rotate inside a 512-token window are therefore not wasted capacity but load-bearing, most plausibly as a slowly varying absolute-position signal that the three full-context layers and the document-masked spans can exploit. If that reading is right the preference is monotonic in base over the range tested, and the untested side is above 10000. Raising the base to 30000 flattens the spectrum further, dedicating even more of the head dimension to slow position signal, and should lower val_bpb if the mechanism that made 1000 so costly continues to pay.", "measurements": [{"command": ["/data/home/zhubaiyu/.local/bin/uv", "run", "--project", "/data3/zhubaiyu/fengheguai/campaigns/h200-claude/nodes/t0034", "python", "/data3/zhubaiyu/fengheguai/fengheguai/_audit_runner.py", "--target", "/data3/zhubaiyu/fengheguai/campaigns/h200-claude/nodes/t0034", "--nonce", "d85a0e46aaff9f0afbe4a1ec8d451a2ee534234cd218b317"], "errors": [], "evidence_path": "/data3/zhubaiyu/fengheguai/campaigns/h200-claude/evidence/t0034-r0/evidence.json", "evidence_sha256": "0c0ed25e7134852ea9309dfb550a759ab26ee714bcc9c29734ce8c90555e24aa", "log_path": "/data3/zhubaiyu/fengheguai/campaigns/h200-claude/evidence/t0034-r0/run.log", "log_sha256": "e499b01b7b0e9ea1b8cd3e1a9a98d88eadfecd090b07fc74872af36b0c435eaf", "metric": 0.9731394978372424, "num_steps": 1468, "peak_vram_mb": 66795.4, "return_code": 0, "status": "valid", "timed_out": false, "train_sha256": "a4e6c02f24f386905db6b8147b0e1382457079bce3bb8ca943c71a454e456cde", "training_seconds": 300.1, "wall_seconds": 486.6916809268296}, {"command": ["/data/home/zhubaiyu/.local/bin/uv", "run", "--project", "/data3/zhubaiyu/fengheguai/campaigns/h200-claude/nodes/t0034", "python", "/data3/zhubaiyu/fengheguai/fengheguai/_audit_runner.py", "--target", "/data3/zhubaiyu/fengheguai/campaigns/h200-claude/nodes/t0034", "--nonce", "7c3d67b2fd9d34f9022123cc3b181abcc12deaab2b8f9792"], "errors": [], "evidence_path": "/data3/zhubaiyu/fengheguai/campaigns/h200-claude/evidence/t0034-r1/evidence.json", "evidence_sha256": "1ffa9c8360ef8365deb61532ff166fee4388a486ae317eeab7eb13a8df8bd322", "log_path": "/data3/zhubaiyu/fengheguai/campaigns/h200-claude/evidence/t0034-r1/run.log", "log_sha256": "678b918323d0dad605d6e68a5cf84c8ce2b43f0952485309e3e0448dcbfc8a42", "metric": 0.9730555020031461, "num_steps": 1469, "peak_vram_mb": 66795.4, "return_code": 0, "status": "valid", "timed_out": false, "train_sha256": "a4e6c02f24f386905db6b8147b0e1382457079bce3bb8ca943c71a454e456cde", "training_seconds": 300.2, "wall_seconds": 479.62884393241256}], "metric": 0.9730974999201942, "parent_id": "t0031", "patch_path": "/data3/zhubaiyu/fengheguai/campaigns/h200-claude/artifacts/t0034/change.patch", "patch_sha256": "3b5d791dd9fb20fc0bb0934dddb0a40dc4f4e5032e4c8723bc1afcdba111288a", "promoted": true, "proposal": {"change_summary": "One default changed on champion t0031: the base argument of GPT._precompute_rotary_embeddings from 10000 to 30000, rebuilding the rotary table at both call sites. Everything else matches the champion: head dimension 128, the 512-token short window with the SSSL pattern, document masking, dense value embeddings with the 128-channel gate, depth 12, width 512, batch 2**18, all learning rates, WEIGHT_DECAY 0.2 and every schedule.", "command": ["/usr/bin/python3", "/data3/zhubaiyu/fengheguai/fengheguai/rendezvous_agent.py", "--trial", "/data3/zhubaiyu/fengheguai/campaigns/h200-claude/nodes/t0034", "--result", "/data3/zhubaiyu/fengheguai/campaigns/h200-claude/nodes/t0034/.fengheguai-agent-result.json", "--schema", "/data3/zhubaiyu/fengheguai/campaigns/h200-claude/control/agent_output.schema.json", "--campaign", "/data3/zhubaiyu/fengheguai/campaigns/h200-claude", "--inbox", "/data3/zhubaiyu/fengheguai/campaigns/h200-claude-rendezvous"], "errors": [], "expected_val_bpb_effect": "Expected between a 0.001 decrease and a 0.001 increase versus champion t0031 at 0.973163, with step count unchanged since the table is precomputed. Together with 1000 and 10000 this brackets the axis either way, which is the outcome shape that settled weight decay, warmdown, momentum and gate width. A decrease would also suggest testing 100000 next.", "hypothesis": "t0033 falsified the local-resolution reading of the rotary spectrum and did so with a large effect: lowering the base from 10000 to 1000 cost 0.003815, roughly thirty times the repeat noise. The low-frequency channels that barely rotate inside a 512-token window are therefore not wasted capacity but load-bearing, most plausibly as a slowly varying absolute-position signal that the three full-context layers and the document-masked spans can exploit. If that reading is right the preference is monotonic in base over the range tested, and the untested side is above 10000. Raising the base to 30000 flattens the spectrum further, dedicating even more of the head dimension to slow position signal, and should lower val_bpb if the mechanism that made 1000 so costly continues to pay.", "log_path": "/data3/zhubaiyu/fengheguai/campaigns/h200-claude/artifacts/t0034/agent.log", "return_code": 0, "risk": "I said in t0033 that the informative follow-up on a regression would be base 3000, and this node deliberately does not do that; the reason is that the regression was large and consistent with monotonicity rather than with overshoot, so 3000 would most likely land between 1000 and 10000 and confirm a trend already visible while leaving the unexplored side untested. That judgement could be wrong: if the true optimum sits between 3000 and 10000, this node will miss it and report only that 30000 is worse. The countervailing risk on the mechanism side is that too flat a spectrum removes the high-frequency discrimination needed to distinguish adjacent tokens, which would show up as a regression comparable to the one t0033 produced.", "success": true, "timed_out": false}, "secondary_parent_id": null, "selection_reason": "Spend the configured search share on a distinct architectural or recipe direction.", "source_sha256": "a4e6c02f24f386905db6b8147b0e1382457079bce3bb8ca943c71a454e456cde", "stage": "explore", "status": "keep", "training_seconds": 300.15, "trial_id": "t0034", "workspace": "/data3/zhubaiyu/fengheguai/campaigns/h200-claude/nodes/t0034"}, "prev_hash": "826002adece3d5066d3f08bae48a740980fd939096f9cb846090d82e827754c8", "seq": 70, "timestamp": "2026-08-20T18:11:28.336902+00:00"}
{"hash": "76917fd0851552fab025c75f142e445e43d90e41b38cc1da5b4ff91df5431e9f", "kind": "trial_started", "payload": {"parent_id": "t0034", "reason": "Recombine two independently strong branches at the scheduled synthesis step.", "secondary_parent_id": "t0031", "stage": "recombine", "trial_id": "t0035"}, "prev_hash": "d5e81ff7e0b2ae19f6c386a88044076cfefbb203a85dd1e5dbb4ecb3eeb793b8", "seq": 71, "timestamp": "2026-08-20T18:11:28.357533+00:00"}
{"hash": "2d98f52d1cd09ef8ce5e735861582876de9f48d7795f5b266f503feb99a74cb3", "kind": "trial_completed", "payload": {"champion_before": "t0034", "debug_depth": 0, "delta_vs_champion_before": 0.0006678266780316688, "delta_vs_parent": 0.0006678266780316688, "finding": "t0035 did not improve the prior champion: val_bpb=0.973765, delta=+0.000668. Hypothesis: The two elite lines are nested and differ only by the rotary base, 10000 in t0031 against 30000 in t0034, a difference of 0.000065 that sits below the 0.00013 repeat-noise level. Their joint content is therefore that the rotary axis is inert above 10000 while the value-embedding gate is the live mechanism both share, since widening it from 32 to 128 channels is the only change to have improved the champion in the last twenty nodes. That mechanism has a measured optimum with steep asymmetry: 32 costs 0.000208 relative to 128, and 512 costs 0.002143, so the curve turns sharply somewhere between 128 and 512 and its minimum has only been located to within a factor of four. Testing 256 resolves the bracket at the finest resolution that matters and is the one remaining question on the mechanism the two elites hold in common.", "measurements": [{"command": ["/data/home/zhubaiyu/.local/bin/uv", "run", "--project", "/data3/zhubaiyu/fengheguai/campaigns/h200-claude/nodes/t0035", "python", "/data3/zhubaiyu/fengheguai/fengheguai/_audit_runner.py", "--target", "/data3/zhubaiyu/fengheguai/campaigns/h200-claude/nodes/t0035", "--nonce", "2c6fe5bad425123db376c404a282b759237d947ab4ea4f8b"], "errors": [], "evidence_path": "/data3/zhubaiyu/fengheguai/campaigns/h200-claude/evidence/t0035-r0/evidence.json", "evidence_sha256": "ccd8363d0a6eb87b3cece170c96d6e2a383c81f6372383f43ddfffa4d27bb678", "log_path": "/data3/zhubaiyu/fengheguai/campaigns/h200-claude/evidence/t0035-r0/run.log", "log_sha256": "ea395bc124c13f8f6279add5acba9dc57c5b27baba8ddfebc1dcbec8ff19b148", "metric": 0.9737653265982259, "num_steps": 1465, "peak_vram_mb": 66795.4, "return_code": 0, "status": "valid", "timed_out": false, "train_sha256": "a017f4886b4ca2e8b1aafc260b205ca665e469eb604a2d3e77af760550f322ff", "training_seconds": 300.1, "wall_seconds": 575.8011209834367}], "metric": 0.9737653265982259, "parent_id": "t0034", "patch_path": "/data3/zhubaiyu/fengheguai/campaigns/h200-claude/artifacts/t0035/change.patch", "patch_sha256": "f331d51b3f78bb1ba4dde12883179bfa06779486730703e74f9d640db2d1612a", "promoted": false, "proposal": {"change_summary": "One constant changed on champion t0034: ve_gate_channels from 128 to 256, so each of the twelve value-embedding gates reads the first 256 residual channels instead of 128. The rotary base stays at the champion value of 30000, which the elites jointly show to be equivalent to 10000. Dense value embeddings, depth 12, width 512, document masking, the 512-token short window, batch 2**18, all learning rates, WEIGHT_DECAY 0.2 and every schedule are unchanged.", "command": ["/usr/bin/python3", "/data3/zhubaiyu/fengheguai/fengheguai/rendezvous_agent.py", "--trial", "/data3/zhubaiyu/fengheguai/campaigns/h200-claude/nodes/t0035", "--result", "/data3/zhubaiyu/fengheguai/campaigns/h200-claude/nodes/t0035/.fengheguai-agent-result.json", "--schema", "/data3/zhubaiyu/fengheguai/campaigns/h200-claude/control/agent_output.schema.json", "--campaign", "/data3/zhubaiyu/fengheguai/campaigns/h200-claude", "--inbox", "/data3/zhubaiyu/fengheguai/campaigns/h200-claude-rendezvous"], "errors": [], "expected_val_bpb_effect": "Expected between a 0.0003 decrease and a 0.001 increase versus champion t0034 at 0.973097, and I record openly that a regression is the more likely outcome. Interpolating the measured curve, the rise from 128 to 512 is steep enough that 256 probably already sits above 128, in which case this fixes the gate width at 128 with a three-point bracket rather than the current two-point one. The value is in locating the optimum precisely on the only mechanism still paying, not in an expected gain.", "hypothesis": "The two elite lines are nested and differ only by the rotary base, 10000 in t0031 against 30000 in t0034, a difference of 0.000065 that sits below the 0.00013 repeat-noise level. Their joint content is therefore that the rotary axis is inert above 10000 while the value-embedding gate is the live mechanism both share, since widening it from 32 to 128 channels is the only change to have improved the champion in the last twenty nodes. That mechanism has a measured optimum with steep asymmetry: 32 costs 0.000208 relative to 128, and 512 costs 0.002143, so the curve turns sharply somewhere between 128 and 512 and its minimum has only been located to within a factor of four. Testing 256 resolves the bracket at the finest resolution that matters and is the one remaining question on the mechanism the two elites hold in common.", "log_path": "/data3/zhubaiyu/fengheguai/campaigns/h200-claude/artifacts/t0035/agent.log", "return_code": 0, "risk": "This is a low-expected-value node by construction and its justification is that it is the question the two elites actually pose; the alternative was another unrelated knob, and the recipe has now returned every inherited default to its own optimum across thirteen such tests. The measurement is also near the resolution limit, since the difference between 128 and its neighbours may be only two or three times the repeat noise, so a near-tie would leave the optimum undetermined between 128 and 256 rather than resolved.", "success": true, "timed_out": false}, "secondary_parent_id": "t0031", "selection_reason": "Recombine two independently strong branches at the scheduled synthesis step.", "source_sha256": "a017f4886b4ca2e8b1aafc260b205ca665e469eb604a2d3e77af760550f322ff", "stage": "recombine", "status": "discard", "training_seconds": 300.1, "trial_id": "t0035", "workspace": "/data3/zhubaiyu/fengheguai/campaigns/h200-claude/nodes/t0035"}, "prev_hash": "76917fd0851552fab025c75f142e445e43d90e41b38cc1da5b4ff91df5431e9f", "seq": 72, "timestamp": "2026-08-20T18:22:36.663367+00:00"}
{"hash": "c85df331e328d9109b4c867c09e82d5bc52f3e6ab67471d5265484dd9549f99d", "kind": "trial_started", "payload": {"parent_id": "t0034", "reason": "Spend the configured search share on a distinct architectural or recipe direction.", "secondary_parent_id": null, "stage": "explore", "trial_id": "t0036"}, "prev_hash": "2d98f52d1cd09ef8ce5e735861582876de9f48d7795f5b266f503feb99a74cb3", "seq": 73, "timestamp": "2026-08-20T18:22:36.684438+00:00"}
