{"hash": "97516f7c1723471e78b445f53076c329ed3bdadb1ec20c29d22c3d21fba6c96d", "kind": "trial_completed", "payload": {"champion_before": "t0013", "debug_depth": 0, "delta_vs_champion_before": 0.0037977888973429463, "delta_vs_parent": 0.0037977888973429463, "finding": "t0015 did not improve the prior champion: val_bpb=0.978027, delta=+0.003798. Hypothesis: t0013 proved that capacity is underprovisioned but only measured one way of spending it. It bought 0.003705 bpb for an 18 percent step cost by adding depth at fixed width. The open question is whether width returns more or less per step spent, which decides how all remaining capacity should be allocated. Because HEAD_DIM is 128 and build_model_config rounds model_dim up to a multiple of it, the smallest honest width increment is 512 to 640, giving 5 heads instead of 4. If width and depth were equivalent ways to buy capacity, this should land near t0013 after accounting for its larger step cost; if width is the better axis it should beat 0.974229 outright.", "measurements": [{"command": ["/data/home/zhubaiyu/.local/bin/uv", "run", "--project", "/data3/zhubaiyu/fengheguai/campaigns/h200-claude/nodes/t0015", "python", "/data3/zhubaiyu/fengheguai/fengheguai/_audit_runner.py", "--target", "/data3/zhubaiyu/fengheguai/campaigns/h200-claude/nodes/t0015", "--nonce", "7b5d7bb891d6abc92ba87e151f546062009b3ceab99fcfc4"], "errors": [], "evidence_path": "/data3/zhubaiyu/fengheguai/campaigns/h200-claude/evidence/t0015-r0/evidence.json", "evidence_sha256": "d98acf7b73d0c0862cf85db8596c2e4db38c862a6029e67f0eb4881ae4696eea", "log_path": "/data3/zhubaiyu/fengheguai/campaigns/h200-claude/evidence/t0015-r0/run.log", "log_sha256": "6e418708654208d040b2f0b9350e43824973f369b7dc38d67db56060ac07cd70", "metric": 0.978027068598594, "num_steps": 1259, "peak_vram_mb": 69567.8, "return_code": 0, "status": "valid", "timed_out": false, "train_sha256": "583e572302c1449a3ea2a2fa1e57c27a622822295d9687b8d2c67cc6ac4146b4", "training_seconds": 300.0, "wall_seconds": 564.67531640362}], "metric": 0.978027068598594, "parent_id": "t0013", "patch_path": "/data3/zhubaiyu/fengheguai/campaigns/h200-claude/artifacts/t0015/change.patch", "patch_sha256": "d97617825826b3253d3d8864c0745c350b1a00fef44f7f7807facd82a2a70508", "promoted": false, "proposal": {"change_summary": "One constant changed on champion t0013: ASPECT_RATIO 51 to 64, so at DEPTH 10 the model_dim becomes exactly 640 with 5 heads of width 128 rather than 512 with 4 heads. Depth stays 10, and document masking, dense value embeddings, HEAD_DIM, batch 2**18, the learning rates and every schedule are unchanged. Matrix parameters rise about 56 percent to roughly 49M and per-layer attention cost rises with the wider residual stream.", "command": ["/usr/bin/python3", "/data3/zhubaiyu/fengheguai/fengheguai/rendezvous_agent.py", "--trial", "/data3/zhubaiyu/fengheguai/campaigns/h200-claude/nodes/t0015", "--result", "/data3/zhubaiyu/fengheguai/campaigns/h200-claude/nodes/t0015/.fengheguai-agent-result.json", "--schema", "/data3/zhubaiyu/fengheguai/campaigns/h200-claude/control/agent_output.schema.json", "--campaign", "/data3/zhubaiyu/fengheguai/campaigns/h200-claude", "--inbox", "/data3/zhubaiyu/fengheguai/campaigns/h200-claude-rendezvous"], "errors": [], "expected_val_bpb_effect": "Genuinely two-sided and wide, between a 0.003 decrease and a 0.004 increase versus champion t0013 at 0.974229. The step count should fall to roughly 1150-1250 from 1725, about 30 percent, so this asks whether the marginal value of capacity is still steep enough to survive a step cost nearly twice what depth charged. A loss here is not a verdict against capacity, only against buying it with width, and would direct the next capacity node back to depth 12.", "hypothesis": "t0013 proved that capacity is underprovisioned but only measured one way of spending it. It bought 0.003705 bpb for an 18 percent step cost by adding depth at fixed width. The open question is whether width returns more or less per step spent, which decides how all remaining capacity should be allocated. Because HEAD_DIM is 128 and build_model_config rounds model_dim up to a multiple of it, the smallest honest width increment is 512 to 640, giving 5 heads instead of 4. If width and depth were equivalent ways to buy capacity, this should land near t0013 after accounting for its larger step cost; if width is the better axis it should beat 0.974229 outright.", "log_path": "/data3/zhubaiyu/fengheguai/campaigns/h200-claude/artifacts/t0015/agent.log", "return_code": 0, "risk": "This is the largest step-cost change attempted, and unlike t0013 the learning rates now sit further from where they were tuned, since setup_optimizer scales Adam rates by 1/sqrt(model_dim/768) and that factor moves from 1.2247 to 1.0954 when width changes, altering three groups implicitly rather than by my choice. That coupling means a regression could reflect rate mismatch rather than a genuine verdict on width, and disentangling it would need a follow-up node holding the effective rates fixed. Peak VRAM also rises above the 56GB t0013 used, on a shared box.", "success": true, "timed_out": false}, "secondary_parent_id": null, "selection_reason": "Spend the configured search share on a distinct architectural or recipe direction.", "source_sha256": "583e572302c1449a3ea2a2fa1e57c27a622822295d9687b8d2c67cc6ac4146b4", "stage": "explore", "status": "discard", "training_seconds": 300.0, "trial_id": "t0015", "workspace": "/data3/zhubaiyu/fengheguai/campaigns/h200-claude/nodes/t0015"}, "prev_hash": "217e9bbd9b7cece7f464bfa2c2ec5f1bb85255a28a3ab53bd752d8ca3e07836d", "seq": 32, "timestamp": "2026-08-20T14:30:01.526353+00:00"}
{"hash": "739028006abba528fe7bce8852e9378d983601fd8afa9b9dc8570a10cf820ccc", "kind": "trial_started", "payload": {"parent_id": "t0013", "reason": "Exploit a top-K branch selected by quality plus an under-exploration bonus.", "secondary_parent_id": null, "stage": "refine", "trial_id": "t0016"}, "prev_hash": "97516f7c1723471e78b445f53076c329ed3bdadb1ec20c29d22c3d21fba6c96d", "seq": 33, "timestamp": "2026-08-20T14:30:01.537258+00:00"}
{"hash": "ba0066cdd9e888c53d24f6b566307c75c8a21e947a3a2696b39ca812dc432dda", "kind": "trial_completed", "payload": {"champion_before": "t0013", "debug_depth": 0, "delta_vs_champion_before": -0.0008070598927376604, "delta_vs_parent": -0.0008070598927376604, "finding": "t0016 improved the prior champion: val_bpb=0.973422, delta=-0.000807. Hypothesis: Depth is the productive capacity axis and it has not yet been pushed to its turning point. The two capacity nodes now bracket the question: depth 8 to 10 cost 18 percent of steps and gained 0.003705, while width 512 to 640 at depth 10 cost 27 percent of steps and lost 0.003798. Depth therefore buys quality per step spent and width does not, at least at this operating point. Extending depth to 12 at unchanged width should gain again, though by less than the first increment as the step cost compounds. Holding width at 512 also keeps this test clean, since model_dim is what drives the implicit 1/sqrt(model_dim/768) Adam rate scaling that confounded the width node.", "measurements": [{"command": ["/data/home/zhubaiyu/.local/bin/uv", "run", "--project", "/data3/zhubaiyu/fengheguai/campaigns/h200-claude/nodes/t0016", "python", "/data3/zhubaiyu/fengheguai/fengheguai/_audit_runner.py", "--target", "/data3/zhubaiyu/fengheguai/campaigns/h200-claude/nodes/t0016", "--nonce", "34b8b96f76a562583f7dafe1a8c989deaf010aefc2f98fb1"], "errors": [], "evidence_path": "/data3/zhubaiyu/fengheguai/campaigns/h200-claude/evidence/t0016-r0/evidence.json", "evidence_sha256": "3cdb1e4b28a7f0d8cd53e5f08e15810d57cb88d84832916e01e723fcf381be76", "log_path": "/data3/zhubaiyu/fengheguai/campaigns/h200-claude/evidence/t0016-r0/run.log", "log_sha256": "33a29c4bb7cbc6e8ef669f02f04ccce135b7426e848ad1222d7f2c0844f6e293", "metric": 0.9734873393965007, "num_steps": 1472, "peak_vram_mb": 66795.3, "return_code": 0, "status": "valid", "timed_out": false, "train_sha256": "8874366219d7c1d26438fd11c5fa220200462a0108fe6c974ae45b190ddfebcf", "training_seconds": 300.0, "wall_seconds": 577.7925394345075}, {"command": ["/data/home/zhubaiyu/.local/bin/uv", "run", "--project", "/data3/zhubaiyu/fengheguai/campaigns/h200-claude/nodes/t0016", "python", "/data3/zhubaiyu/fengheguai/fengheguai/_audit_runner.py", "--target", "/data3/zhubaiyu/fengheguai/campaigns/h200-claude/nodes/t0016", "--nonce", "1bf35c2bd74c539147baf49afedbce050bdcc97c0de44f1c"], "errors": [], "evidence_path": "/data3/zhubaiyu/fengheguai/campaigns/h200-claude/evidence/t0016-r1/evidence.json", "evidence_sha256": "17349b673266ba7894e480d5ef735530b5f6327b3b02895a9972ccc0c3f283a0", "log_path": "/data3/zhubaiyu/fengheguai/campaigns/h200-claude/evidence/t0016-r1/run.log", "log_sha256": "bceb6b71305b6e1fa514e9f4058f06fdd6c0ad0150a37c9c9aa828788ee1cce9", "metric": 0.9733571002205261, "num_steps": 1472, "peak_vram_mb": 66795.6, "return_code": 0, "status": "valid", "timed_out": false, "train_sha256": "8874366219d7c1d26438fd11c5fa220200462a0108fe6c974ae45b190ddfebcf", "training_seconds": 300.2, "wall_seconds": 480.9369202647358}], "metric": 0.9734222198085134, "parent_id": "t0013", "patch_path": "/data3/zhubaiyu/fengheguai/campaigns/h200-claude/artifacts/t0016/change.patch", "patch_sha256": "ce5f5ee9e7479dae58571287e6fd6f38d4b446815df5510e20ba7486e714ef34", "promoted": true, "proposal": {"change_summary": "Capacity increase on champion t0013 along the axis that paid: DEPTH 10 to 12 with ASPECT_RATIO 51 to 42, chosen so build_model_config still rounds to a model_dim of exactly 512 with 4 heads of width 128. Width, HEAD_DIM, document masking, dense value embeddings (now 12 tables), batch 2**18, the learning rates and every schedule are unchanged, so depth is again the only variable. Matrix parameters rise about 20 percent and the value-embedding block grows to roughly 50M.", "command": ["/usr/bin/python3", "/data3/zhubaiyu/fengheguai/fengheguai/rendezvous_agent.py", "--trial", "/data3/zhubaiyu/fengheguai/campaigns/h200-claude/nodes/t0016", "--result", "/data3/zhubaiyu/fengheguai/campaigns/h200-claude/nodes/t0016/.fengheguai-agent-result.json", "--schema", "/data3/zhubaiyu/fengheguai/campaigns/h200-claude/control/agent_output.schema.json", "--campaign", "/data3/zhubaiyu/fengheguai/campaigns/h200-claude", "--inbox", "/data3/zhubaiyu/fengheguai/campaigns/h200-claude-rendezvous"], "errors": [], "expected_val_bpb_effect": "Expected decrease of roughly 0.001-0.002 bpb versus champion t0013 at 0.974229, smaller than the 0.003705 the 8 to 10 step delivered because returns to depth diminish while the step cost stays proportional. Steps should fall to about 1430-1450 from 1725. An increase would locate the turning point between depth 10 and 12 and close the capacity axis with a bracket rather than a guess.", "hypothesis": "Depth is the productive capacity axis and it has not yet been pushed to its turning point. The two capacity nodes now bracket the question: depth 8 to 10 cost 18 percent of steps and gained 0.003705, while width 512 to 640 at depth 10 cost 27 percent of steps and lost 0.003798. Depth therefore buys quality per step spent and width does not, at least at this operating point. Extending depth to 12 at unchanged width should gain again, though by less than the first increment as the step cost compounds. Holding width at 512 also keeps this test clean, since model_dim is what drives the implicit 1/sqrt(model_dim/768) Adam rate scaling that confounded the width node.", "log_path": "/data3/zhubaiyu/fengheguai/campaigns/h200-claude/artifacts/t0016/agent.log", "return_code": 0, "risk": "MATRIX_LR was tuned at depth 8 and is now two increments away, and deeper residual stacks generally prefer smaller matrix rates, so a regression here could reflect rate mismatch rather than exhausted capacity. That is the same confound that made t0003 look like a critical batch size when it was really an unscaled rate, so if this node regresses the correct follow-up is a depth-12 run with a reduced MATRIX_LR before concluding anything about depth itself. Peak VRAM also rises from 56GB toward roughly 65GB on a shared box.", "success": true, "timed_out": false}, "secondary_parent_id": null, "selection_reason": "Exploit a top-K branch selected by quality plus an under-exploration bonus.", "source_sha256": "8874366219d7c1d26438fd11c5fa220200462a0108fe6c974ae45b190ddfebcf", "stage": "refine", "status": "keep", "training_seconds": 300.1, "trial_id": "t0016", "workspace": "/data3/zhubaiyu/fengheguai/campaigns/h200-claude/nodes/t0016"}, "prev_hash": "739028006abba528fe7bce8852e9378d983601fd8afa9b9dc8570a10cf820ccc", "seq": 34, "timestamp": "2026-08-20T14:48:45.066927+00:00"}
{"hash": "abe44e510d59d2449114751c8579babb32f55bbc11e57903c1e80142c1a50d98", "kind": "trial_started", "payload": {"parent_id": "t0016", "reason": "Exploit a top-K branch selected by quality plus an under-exploration bonus.", "secondary_parent_id": null, "stage": "refine", "trial_id": "t0017"}, "prev_hash": "ba0066cdd9e888c53d24f6b566307c75c8a21e947a3a2696b39ca812dc432dda", "seq": 35, "timestamp": "2026-08-20T14:48:45.078424+00:00"}
{"hash": "f57dd0a9380ffa1ee249d9732b45e49cdaf3cd8f4d4087c056a612a34967086d", "kind": "trial_completed", "payload": {"champion_before": "t0016", "debug_depth": 0, "delta_vs_champion_before": -5.1401961689401254e-05, "delta_vs_parent": -5.1401961689401254e-05, "finding": "t0017 improved the prior champion: val_bpb=0.973371, delta=-0.000051. Hypothesis: The depth gains are decaying, 0.003705 for 8 to 10 and 0.000807 for 10 to 12, and there are two competing explanations that imply opposite next moves: genuine diminishing returns to depth, or a matrix learning rate that is increasingly mismatched as depth grows. MATRIX_LR was tuned at depth 8. Muon normalises each matrix update to roughly unit scale, so every layer contributes a similar-magnitude change to the residual stream and a 12-layer stack accumulates about 1.5 times the per-step residual movement that 8 layers did at the same rate. Scaling the matrix rate by sqrt(8/12) should restore the tuned per-step movement. If this wins, the recent depth increments were understated by rate mismatch and depth is worth pushing further; if it loses, depth really is saturating and the axis closes.", "measurements": [{"command": ["/data/home/zhubaiyu/.local/bin/uv", "run", "--project", "/data3/zhubaiyu/fengheguai/campaigns/h200-claude/nodes/t0017", "python", "/data3/zhubaiyu/fengheguai/fengheguai/_audit_runner.py", "--target", "/data3/zhubaiyu/fengheguai/campaigns/h200-claude/nodes/t0017", "--nonce", "0f7d659770c0934c35b352ce3099c20f65905794c1afda74"], "errors": [], "evidence_path": "/data3/zhubaiyu/fengheguai/campaigns/h200-claude/evidence/t0017-r0/evidence.json", "evidence_sha256": "cd13504fa975e177c2450fd18e23f6027b3a13662c24a4b4eb95f77651a66e68", "log_path": "/data3/zhubaiyu/fengheguai/campaigns/h200-claude/evidence/t0017-r0/run.log", "log_sha256": "71dd3b2aab38d45178d1c2ba0230e03bd0b6f00970247dad614a889744433e2e", "metric": 0.973348407030287, "num_steps": 1470, "peak_vram_mb": 66795.6, "return_code": 0, "status": "valid", "timed_out": false, "train_sha256": "c9d4459b9b74815486896e6493368152573edb328ab428f71b1ec4584d3c7040", "training_seconds": 300.1, "wall_seconds": 485.70324234105647}, {"command": ["/data/home/zhubaiyu/.local/bin/uv", "run", "--project", "/data3/zhubaiyu/fengheguai/campaigns/h200-claude/nodes/t0017", "python", "/data3/zhubaiyu/fengheguai/fengheguai/_audit_runner.py", "--target", "/data3/zhubaiyu/fengheguai/campaigns/h200-claude/nodes/t0017", "--nonce", "cd3475e106856412b22b2febb8968a592d2b02ae13a29f71"], "errors": [], "evidence_path": "/data3/zhubaiyu/fengheguai/campaigns/h200-claude/evidence/t0017-r1/evidence.json", "evidence_sha256": "1b84b8c2d267576b2d7bf6d3f097831c285c9bdaafbe24e63b86b53ec341e322", "log_path": "/data3/zhubaiyu/fengheguai/campaigns/h200-claude/evidence/t0017-r1/run.log", "log_sha256": "ea5c620eb5da9975c642e4e5452b4d1a62652330db0ef39e57360bf3ca16119e", "metric": 0.973393228663361, "num_steps": 1470, "peak_vram_mb": 66795.6, "return_code": 0, "status": "valid", "timed_out": false, "train_sha256": "c9d4459b9b74815486896e6493368152573edb328ab428f71b1ec4584d3c7040", "training_seconds": 300.2, "wall_seconds": 479.80092330649495}], "metric": 0.973370817846824, "parent_id": "t0016", "patch_path": "/data3/zhubaiyu/fengheguai/campaigns/h200-claude/artifacts/t0017/change.patch", "patch_sha256": "8b7837dc13cb3ed11010c082ccef1cb0d407b41d21bf066da6ca90cc15630b55", "promoted": true, "proposal": {"change_summary": "One learning rate changed on champion t0016: MATRIX_LR 0.02828 to 0.0231, which is the existing 1/sqrt(2) batch rescale multiplied by a further sqrt(8/12) depth correction. EMBEDDING_LR stays 0.6, UNEMBEDDING_LR stays 0.002828, and depth 12, width 512, document masking, dense value embeddings, batch 2**18 and every schedule are unchanged, so the Muon rate is the only variable.", "command": ["/usr/bin/python3", "/data3/zhubaiyu/fengheguai/fengheguai/rendezvous_agent.py", "--trial", "/data3/zhubaiyu/fengheguai/campaigns/h200-claude/nodes/t0017", "--result", "/data3/zhubaiyu/fengheguai/campaigns/h200-claude/nodes/t0017/.fengheguai-agent-result.json", "--schema", "/data3/zhubaiyu/fengheguai/campaigns/h200-claude/control/agent_output.schema.json", "--campaign", "/data3/zhubaiyu/fengheguai/campaigns/h200-claude", "--inbox", "/data3/zhubaiyu/fengheguai/campaigns/h200-claude-rendezvous"], "errors": [], "expected_val_bpb_effect": "Expected decrease of roughly 0.000-0.002 bpb versus champion t0016 at 0.973422. The value of this node is diagnostic more than incremental: it decides whether the next capacity node should be depth 14, which is only worth spending if rate mismatch rather than saturation explains the decay. An increase would mean the inherited rate was already right for depth 12 and would close both the matrix-rate and the depth axes together.", "hypothesis": "The depth gains are decaying, 0.003705 for 8 to 10 and 0.000807 for 10 to 12, and there are two competing explanations that imply opposite next moves: genuine diminishing returns to depth, or a matrix learning rate that is increasingly mismatched as depth grows. MATRIX_LR was tuned at depth 8. Muon normalises each matrix update to roughly unit scale, so every layer contributes a similar-magnitude change to the residual stream and a 12-layer stack accumulates about 1.5 times the per-step residual movement that 8 layers did at the same rate. Scaling the matrix rate by sqrt(8/12) should restore the tuned per-step movement. If this wins, the recent depth increments were understated by rate mismatch and depth is worth pushing further; if it loses, depth really is saturating and the axis closes.", "log_path": "/data3/zhubaiyu/fengheguai/campaigns/h200-claude/artifacts/t0017/agent.log", "return_code": 0, "risk": "The sqrt-of-depth-ratio correction is a heuristic, not a derived law for orthogonalised updates, so the true optimum may lie at linear 8/12 scaling or not exist at all, and a null result would be ambiguous between a wrong exponent and a genuinely flat axis. The measured effect must also clear the roughly 0.0001 repeat-noise level, and the two t0016 runs differed by 0.00013, so a change smaller than that would be undecidable rather than negative.", "success": true, "timed_out": false}, "secondary_parent_id": null, "selection_reason": "Exploit a top-K branch selected by quality plus an under-exploration bonus.", "source_sha256": "c9d4459b9b74815486896e6493368152573edb328ab428f71b1ec4584d3c7040", "stage": "refine", "status": "keep", "training_seconds": 300.15, "trial_id": "t0017", "workspace": "/data3/zhubaiyu/fengheguai/campaigns/h200-claude/nodes/t0017"}, "prev_hash": "abe44e510d59d2449114751c8579babb32f55bbc11e57903c1e80142c1a50d98", "seq": 36, "timestamp": "2026-08-20T15:05:59.368731+00:00"}
{"hash": "9ea8382514f09bc7e9effcd46315895743bf5f2a801fdaa946e432d893a6f106", "kind": "trial_started", "payload": {"parent_id": "t0017", "reason": "Exploit a top-K branch selected by quality plus an under-exploration bonus.", "secondary_parent_id": null, "stage": "refine", "trial_id": "t0018"}, "prev_hash": "f57dd0a9380ffa1ee249d9732b45e49cdaf3cd8f4d4087c056a612a34967086d", "seq": 37, "timestamp": "2026-08-20T15:05:59.380340+00:00"}
