{"hash": "f3dc5842d1058ae4154ad43be6e2870ba6ec7f9bc8f4e2efd158aff09b6a4962", "kind": "trial_completed", "payload": {"champion_before": "t0037", "debug_depth": 0, "delta_vs_champion_before": 0.0031514097881978342, "delta_vs_parent": 0.0031514097881978342, "finding": "t0039 did not improve the prior champion: val_bpb=0.975856, delta=+0.003151. Hypothesis: The softcap results identify lm_head dynamics as a binding constraint, and the same conclusion implies an untested lever. Across four points the cap has a sharp optimum at 10, with 7 costing 0.005206 and 30 costing 0.004637, and the reading that survives both sides is gradient control: tanh saturation damps the gradient reaching lm_head once logits grow, and that damping is worth real bpb in a 300-second run. If lm_head is being driven too hard, its learning rate is the direct lever on the same quantity, and it is the one parameter group from the t0004 bundle never decomposed. t0012 decomposed the embedding group and found it wanted its original faster rate; the softcap evidence predicts the opposite for the unembedding group, that it wants a slower one. Lowering UNEMBEDDING_LR from 0.002828 to 0.002 tests that prediction directly.", "measurements": [{"command": ["/data/home/zhubaiyu/.local/bin/uv", "run", "--project", "/data3/zhubaiyu/fengheguai/campaigns/h200-claude/nodes/t0039", "python", "/data3/zhubaiyu/fengheguai/fengheguai/_audit_runner.py", "--target", "/data3/zhubaiyu/fengheguai/campaigns/h200-claude/nodes/t0039", "--nonce", "78c6f367b6688a96d9158b3a8b5c9e8889065443edb3c184"], "errors": [], "evidence_path": "/data3/zhubaiyu/fengheguai/campaigns/h200-claude/evidence/t0039-r0/evidence.json", "evidence_sha256": "f7627e460ad5ff56b589a6cdcb1a511cbbcecb6ee3e212e7b3d99fbea8823652", "log_path": "/data3/zhubaiyu/fengheguai/campaigns/h200-claude/evidence/t0039-r0/run.log", "log_sha256": "aefa631dac8dabc2915b1414dcada1bdf0a3103d26226b1df1023fbff040718a", "metric": 0.975855888160245, "num_steps": 1465, "peak_vram_mb": 66795.4, "return_code": 0, "status": "valid", "timed_out": false, "train_sha256": "70c05e9264a629edb0f74814c07f19a18ae9da0c7f9c4c19da29b63038e72a4c", "training_seconds": 300.1, "wall_seconds": 355.29349886532873}], "metric": 0.975855888160245, "parent_id": "t0037", "patch_path": "/data3/zhubaiyu/fengheguai/campaigns/h200-claude/artifacts/t0039/change.patch", "patch_sha256": "2d62ebc5818517989f050c89e6fc712e402b75da652800849c84085ed5033d30", "promoted": false, "proposal": {"change_summary": "One learning rate changed on champion t0037: UNEMBEDDING_LR from 0.002828 to 0.002, affecting only the lm_head AdamW group. EMBEDDING_LR stays 0.6, MATRIX_LR stays 0.0231 and the value-embedding group is untouched. The softcap stays at its measured optimum of 10, the value-embedding gate at 128 channels, rotary base at 30000, and depth 12, width 512, document masking, dense value embeddings, batch 2**18, WEIGHT_DECAY 0.2 and every schedule are unchanged.", "command": ["/usr/bin/python3", "/data3/zhubaiyu/fengheguai/fengheguai/rendezvous_agent.py", "--trial", "/data3/zhubaiyu/fengheguai/campaigns/h200-claude/nodes/t0039", "--result", "/data3/zhubaiyu/fengheguai/campaigns/h200-claude/nodes/t0039/.fengheguai-agent-result.json", "--schema", "/data3/zhubaiyu/fengheguai/campaigns/h200-claude/control/agent_output.schema.json", "--campaign", "/data3/zhubaiyu/fengheguai/campaigns/h200-claude", "--inbox", "/data3/zhubaiyu/fengheguai/campaigns/h200-claude-rendezvous"], "errors": [], "expected_val_bpb_effect": "Expected between a 0.001 decrease and a 0.001 increase versus champion t0037 at 0.972704, with step count unchanged. This is a genuine prediction rather than a scan: the softcap evidence says damping lm_head helps, so if the two levers act on the same underlying problem, slowing its rate should help too. A regression would be informative in the opposite direction, indicating that what the softcap provides is specifically nonlinear saturation on large logits rather than a uniform reduction in step size, which a learning rate cannot reproduce.", "hypothesis": "The softcap results identify lm_head dynamics as a binding constraint, and the same conclusion implies an untested lever. Across four points the cap has a sharp optimum at 10, with 7 costing 0.005206 and 30 costing 0.004637, and the reading that survives both sides is gradient control: tanh saturation damps the gradient reaching lm_head once logits grow, and that damping is worth real bpb in a 300-second run. If lm_head is being driven too hard, its learning rate is the direct lever on the same quantity, and it is the one parameter group from the t0004 bundle never decomposed. t0012 decomposed the embedding group and found it wanted its original faster rate; the softcap evidence predicts the opposite for the unembedding group, that it wants a slower one. Lowering UNEMBEDDING_LR from 0.002828 to 0.002 tests that prediction directly.", "log_path": "/data3/zhubaiyu/fengheguai/campaigns/h200-claude/artifacts/t0039/agent.log", "return_code": 0, "risk": "lm_head is only 4.2M parameters against 96M, so even a correct prediction may move val_bpb by less than the measurement can resolve, and a null would leave the connection between the two levers untested rather than refuted. The prediction also rests on the two mechanisms being interchangeable, which they are not exactly: the softcap acts selectively on tokens whose logits have grown large while a learning rate acts uniformly on every row of the table, so the softcap could be doing something a rate change cannot, which is itself the most likely reason for this to fail.", "success": true, "timed_out": false}, "secondary_parent_id": null, "selection_reason": "Spend the configured search share on a distinct architectural or recipe direction.", "source_sha256": "70c05e9264a629edb0f74814c07f19a18ae9da0c7f9c4c19da29b63038e72a4c", "stage": "explore", "status": "discard", "training_seconds": 300.1, "trial_id": "t0039", "workspace": "/data3/zhubaiyu/fengheguai/campaigns/h200-claude/nodes/t0039"}, "prev_hash": "216f44e21ac26f5c3aa3e97a34f3c9762e046113c1ee8372d733129615fe6493", "seq": 80, "timestamp": "2026-08-20T19:06:07.865362+00:00"}
{"hash": "f4db6261d0dcd20f422ca160124f04654174451071001b60d36779c4b040c24c", "kind": "trial_started", "payload": {"parent_id": "t0037", "reason": "Exploit a top-K branch selected by quality plus an under-exploration bonus.", "secondary_parent_id": null, "stage": "refine", "trial_id": "t0040"}, "prev_hash": "f3dc5842d1058ae4154ad43be6e2870ba6ec7f9bc8f4e2efd158aff09b6a4962", "seq": 81, "timestamp": "2026-08-20T19:06:07.888700+00:00"}
{"hash": "63f9b2cf8f7561eccc374b8897a5275c856c49d4dfe4d6853492499a84c64473", "kind": "trial_completed", "payload": {"champion_before": "t0037", "debug_depth": 0, "delta_vs_champion_before": 0.0012643357566596292, "delta_vs_parent": 0.0012643357566596292, "finding": "t0040 did not improve the prior champion: val_bpb=0.973969, delta=+0.001264. Hypothesis: t0039 falsified the idea that the softcap and the unembedding rate act on the same quantity: lowering UNEMBEDDING_LR from 0.002828 to 0.002 cost 0.003152, roughly twenty-four times the repeat noise, so the cap earns its keep through selective saturation of large logits rather than through any uniform reduction in step size, and lm_head in fact wants to move faster rather than slower. That reopens a question this campaign has already answered once for a neighbouring group. The t0004 bundle divided three rates by sqrt(2) together and won, but t0012 later showed that gain did not belong to the embedding group, which preferred its original 0.6 over the rescaled 0.4243. The unembedding group is the last member of that bundle still carrying the rescale it may never have wanted, and the steep penalty for damping it further now argues the same way. Restoring UNEMBEDDING_LR to its original 0.004 should lower val_bpb.", "measurements": [{"command": ["/data/home/zhubaiyu/.local/bin/uv", "run", "--project", "/data3/zhubaiyu/fengheguai/campaigns/h200-claude/nodes/t0040", "python", "/data3/zhubaiyu/fengheguai/fengheguai/_audit_runner.py", "--target", "/data3/zhubaiyu/fengheguai/campaigns/h200-claude/nodes/t0040", "--nonce", "b8791dc31e0698b0e57be02e3c013f61f7e26cb2f9e7d165"], "errors": [], "evidence_path": "/data3/zhubaiyu/fengheguai/campaigns/h200-claude/evidence/t0040-r0/evidence.json", "evidence_sha256": "6903c2fb082ccc200f072399ce5922f54efc840fdf50024dff546b0ffb14cdfc", "log_path": "/data3/zhubaiyu/fengheguai/campaigns/h200-claude/evidence/t0040-r0/run.log", "log_sha256": "72a8782fd5b842a719f41062a80b7520b5651bed6e46a3eb484f1248f16d9ca3", "metric": 0.9739688141287068, "num_steps": 1465, "peak_vram_mb": 66795.4, "return_code": 0, "status": "valid", "timed_out": false, "train_sha256": "117801b0f18aad9646fe677ae4347526e39ce29b5bdc3d5d0d58500ea1040c35", "training_seconds": 300.1, "wall_seconds": 484.73619995452464}], "metric": 0.9739688141287068, "parent_id": "t0037", "patch_path": "/data3/zhubaiyu/fengheguai/campaigns/h200-claude/artifacts/t0040/change.patch", "patch_sha256": "2bfa250afdcf8bf6b94fb32dd8961a6bb0ac21b87262e1f2b0e45cd43b234f5d", "promoted": false, "proposal": {"change_summary": "One learning rate changed on champion t0037: UNEMBEDDING_LR from 0.002828 back to 0.004, the value the recipe shipped with, affecting only the lm_head AdamW group. EMBEDDING_LR stays 0.6, MATRIX_LR stays 0.0231, and the softcap stays at its measured optimum of 10, the value-embedding gate at 128 channels, rotary base at 30000, with depth 12, width 512, document masking, dense value embeddings, batch 2**18, WEIGHT_DECAY 0.2 and every schedule unchanged. This completes the decomposition of the t0004 bundle: all three rates will then have been tested individually at the current operating point.", "command": ["/usr/bin/python3", "/data3/zhubaiyu/fengheguai/fengheguai/rendezvous_agent.py", "--trial", "/data3/zhubaiyu/fengheguai/campaigns/h200-claude/nodes/t0040", "--result", "/data3/zhubaiyu/fengheguai/campaigns/h200-claude/nodes/t0040/.fengheguai-agent-result.json", "--schema", "/data3/zhubaiyu/fengheguai/campaigns/h200-claude/control/agent_output.schema.json", "--campaign", "/data3/zhubaiyu/fengheguai/campaigns/h200-claude", "--inbox", "/data3/zhubaiyu/fengheguai/campaigns/h200-claude-rendezvous"], "errors": [], "expected_val_bpb_effect": "Expected between a 0.0015 decrease and a 0.0005 increase versus champion t0037 at 0.972704, with step count unchanged. The asymmetry follows from the measured gradient, since moving from 0.002828 down to 0.002 cost 0.003152 and the curve through those two points slopes steeply upward toward faster rates. If it wins, the batch-rescale finding from t0004 will have been shown to apply only to the matrix group, which is the one it was theoretically motivated for.", "hypothesis": "t0039 falsified the idea that the softcap and the unembedding rate act on the same quantity: lowering UNEMBEDDING_LR from 0.002828 to 0.002 cost 0.003152, roughly twenty-four times the repeat noise, so the cap earns its keep through selective saturation of large logits rather than through any uniform reduction in step size, and lm_head in fact wants to move faster rather than slower. That reopens a question this campaign has already answered once for a neighbouring group. The t0004 bundle divided three rates by sqrt(2) together and won, but t0012 later showed that gain did not belong to the embedding group, which preferred its original 0.6 over the rescaled 0.4243. The unembedding group is the last member of that bundle still carrying the rescale it may never have wanted, and the steep penalty for damping it further now argues the same way. Restoring UNEMBEDDING_LR to its original 0.004 should lower val_bpb.", "log_path": "/data3/zhubaiyu/fengheguai/campaigns/h200-claude/artifacts/t0040/agent.log", "return_code": 0, "risk": "Extrapolating past the champion on a curve measured only below it can overshoot, and 0.004 is a 41 percent increase rather than a small step, so the optimum could lie between 0.002828 and 0.004 and be missed by landing beyond it. A faster unembedding rate also interacts with the softcap that is now tighter at 10, since both act on lm_head, and if the tighter cap was compensating for an over-fast rate the two changes could partly cancel; a null result would most likely mean exactly that rather than a genuinely flat axis.", "success": true, "timed_out": false}, "secondary_parent_id": null, "selection_reason": "Exploit a top-K branch selected by quality plus an under-exploration bonus.", "source_sha256": "117801b0f18aad9646fe677ae4347526e39ce29b5bdc3d5d0d58500ea1040c35", "stage": "refine", "status": "discard", "training_seconds": 300.1, "trial_id": "t0040", "workspace": "/data3/zhubaiyu/fengheguai/campaigns/h200-claude/nodes/t0040"}, "prev_hash": "f4db6261d0dcd20f422ca160124f04654174451071001b60d36779c4b040c24c", "seq": 82, "timestamp": "2026-08-20T19:15:11.169472+00:00"}
{"hash": "d3a03f008633244b54134d9ad6b574f34549c56bae2eb58baf9573df6f9d1221", "kind": "trial_started", "payload": {"parent_id": "t0037", "reason": "The current line is stalled; make a structurally different bet.", "secondary_parent_id": null, "stage": "explore", "trial_id": "t0041"}, "prev_hash": "63f9b2cf8f7561eccc374b8897a5275c856c49d4dfe4d6853492499a84c64473", "seq": 83, "timestamp": "2026-08-20T19:15:11.193259+00:00"}
{"hash": "7a738f75766c7ddb35a25aa15873439a7d530023299688af8dfceed055afe7b3", "kind": "trial_completed", "payload": {"champion_before": "t0037", "debug_depth": 0, "delta_vs_champion_before": 0.00010657810765013487, "delta_vs_parent": 0.00010657810765013487, "finding": "t0041 did not improve the prior champion: val_bpb=0.972811, delta=+0.000107. Hypothesis: The NorMuon variance-reduction horizon is the last untouched control inside the optimizer that trains most of the model. muon_step_fused maintains a second-moment buffer over the orthogonalised update, per row or per column depending on matrix orientation, and rescales by its inverse square root; that buffer uses beta2 of 0.95, a roughly 20-step horizon, and it is a distinct quantity from the Muon momentum of 0.95 that t0028 and t0029 already bracketed. The horizon matters because the quantity being averaged is the squared magnitude of an orthogonalised update, which is far more stationary than a raw gradient, so a longer window should estimate it more precisely at little cost in adaptivity. Raising beta2 to 0.98 should give steadier per-row scaling and lower val_bpb.", "measurements": [{"command": ["/data/home/zhubaiyu/.local/bin/uv", "run", "--project", "/data3/zhubaiyu/fengheguai/campaigns/h200-claude/nodes/t0041", "python", "/data3/zhubaiyu/fengheguai/fengheguai/_audit_runner.py", "--target", "/data3/zhubaiyu/fengheguai/campaigns/h200-claude/nodes/t0041", "--nonce", "0439a825e5ccc35b4cf4906d768d1c3ca04db05c5e27f148"], "errors": [], "evidence_path": "/data3/zhubaiyu/fengheguai/campaigns/h200-claude/evidence/t0041-r0/evidence.json", "evidence_sha256": "4f68b74dbbfc86aaca1782114a994e6f828de6b2bd3f5761fb56b4ec39d2d275", "log_path": "/data3/zhubaiyu/fengheguai/campaigns/h200-claude/evidence/t0041-r0/run.log", "log_sha256": "62f9f6414118c0f0625fa369d7ccf1f55c4f405153e2781fa7bb131519b44825", "metric": 0.9728110564796973, "num_steps": 1464, "peak_vram_mb": 66795.4, "return_code": 0, "status": "valid", "timed_out": false, "train_sha256": "f935d3c569d0ddfd61d4823c5df26985e5713dc98c236d0c5474420f1f0c659c", "training_seconds": 300.0, "wall_seconds": 486.2390042282641}], "metric": 0.9728110564796973, "parent_id": "t0037", "patch_path": "/data3/zhubaiyu/fengheguai/campaigns/h200-claude/artifacts/t0041/change.patch", "patch_sha256": "75d01f2b5efb7a0d263dd14eb1b0db546ad88d02adfeeb775d4b302def0442a9", "promoted": false, "proposal": {"change_summary": "One argument changed on champion t0037: the beta2 passed to the Muon parameter groups in setup_optimizer from 0.95 to 0.98, which feeds second_momentum_buffer.lerp_ inside muon_step_fused. The Muon momentum stays at its bracketed optimum of 0.95 and ns_steps stays 5, so only the variance-reduction horizon moves. The AdamW betas are a separate constant and are unchanged, as are the softcap of 10, the 128-channel value-embedding gate, rotary base 30000, depth 12, width 512, document masking, dense value embeddings, batch 2**18, all learning rates, WEIGHT_DECAY 0.2 and every schedule.", "command": ["/usr/bin/python3", "/data3/zhubaiyu/fengheguai/fengheguai/rendezvous_agent.py", "--trial", "/data3/zhubaiyu/fengheguai/campaigns/h200-claude/nodes/t0041", "--result", "/data3/zhubaiyu/fengheguai/campaigns/h200-claude/nodes/t0041/.fengheguai-agent-result.json", "--schema", "/data3/zhubaiyu/fengheguai/campaigns/h200-claude/control/agent_output.schema.json", "--campaign", "/data3/zhubaiyu/fengheguai/campaigns/h200-claude", "--inbox", "/data3/zhubaiyu/fengheguai/campaigns/h200-claude-rendezvous"], "errors": [], "expected_val_bpb_effect": "Expected between a 0.001 decrease and a 0.001 increase versus champion t0037 at 0.972704, with step count unchanged since the buffer update is the same elementwise cost either way. The comparison to Muon momentum is instructive rather than predictive: that axis proved steep and already optimal at its inherited value, and this one may well behave the same, in which case the result closes the last optimizer control with a null or a small regression.", "hypothesis": "The NorMuon variance-reduction horizon is the last untouched control inside the optimizer that trains most of the model. muon_step_fused maintains a second-moment buffer over the orthogonalised update, per row or per column depending on matrix orientation, and rescales by its inverse square root; that buffer uses beta2 of 0.95, a roughly 20-step horizon, and it is a distinct quantity from the Muon momentum of 0.95 that t0028 and t0029 already bracketed. The horizon matters because the quantity being averaged is the squared magnitude of an orthogonalised update, which is far more stationary than a raw gradient, so a longer window should estimate it more precisely at little cost in adaptivity. Raising beta2 to 0.98 should give steadier per-row scaling and lower val_bpb.", "log_path": "/data3/zhubaiyu/fengheguai/campaigns/h200-claude/artifacts/t0041/agent.log", "return_code": 0, "risk": "Fifteen inherited defaults have now each been measured at or very near their own optimum, so the base rate for this one differing is low and the honest expectation is a null. There is also a specific interaction this node cannot separate: the second-moment buffer is initialised at zero and there is no bias correction in muon_step_fused, unlike adamw_step_fused which divides by 1 - beta2**step, so a longer horizon leaves the buffer underestimated for longer at the start of training and the clamp_min of 1e-10 makes the early steps effectively larger. A regression could therefore reflect that missing bias correction rather than the horizon itself being wrong.", "success": true, "timed_out": false}, "secondary_parent_id": null, "selection_reason": "The current line is stalled; make a structurally different bet.", "source_sha256": "f935d3c569d0ddfd61d4823c5df26985e5713dc98c236d0c5474420f1f0c659c", "stage": "explore", "status": "discard", "training_seconds": 300.0, "trial_id": "t0041", "workspace": "/data3/zhubaiyu/fengheguai/campaigns/h200-claude/nodes/t0041"}, "prev_hash": "d3a03f008633244b54134d9ad6b574f34549c56bae2eb58baf9573df6f9d1221", "seq": 84, "timestamp": "2026-08-20T19:24:29.928967+00:00"}
{"hash": "2248579b3f6a346b01c8f764a2f31dd9a35ae86eeda9e4b208e05ac39f53aa8a", "kind": "trial_started", "payload": {"parent_id": "t0037", "reason": "Recombine two independently strong branches at the scheduled synthesis step.", "secondary_parent_id": "t0041", "stage": "recombine", "trial_id": "t0042"}, "prev_hash": "7a738f75766c7ddb35a25aa15873439a7d530023299688af8dfceed055afe7b3", "seq": 85, "timestamp": "2026-08-20T19:24:29.953308+00:00"}
