{"hash": "8bec203ed6197b5941cfa2597a173b3304bf6a8424536ebd908437bbf8a990dc", "kind": "trial_started", "payload": {"parent_id": "t0089", "reason": "Exploit a top-K branch selected by quality plus an under-exploration bonus.", "secondary_parent_id": null, "stage": "refine", "trial_id": "t0092"}, "prev_hash": "afb314d3cc5b99901196be08e0ddaacf7409d6462b89b4c7630ed16b1bc84045", "seq": 185, "timestamp": "2026-08-21T04:54:34.654805+00:00"}
{"hash": "58fec6d6fb70c41da514da7c8c48324a4ca9eb3ccdf13d6b704d983ad8ffd7cd", "kind": "trial_completed", "payload": {"champion_before": "t0089", "debug_depth": 0, "delta_vs_champion_before": 0.02798535699257576, "delta_vs_parent": 0.02798535699257576, "finding": "t0092 did not improve the prior champion: val_bpb=0.996374, delta=+0.027985. Hypothesis: The initialisation fix in t0087 improved the value-embedding path but simultaneously made its update quantisation 32 times coarser, and nothing has corrected for that. These tables are stored as bf16 parameters, cast in init_weights alongside wte. bf16 carries 8 mantissa bits, so its resolution scales with magnitude: near the old element scale of 0.044 the ulp was 0.00024, but at the corrected scale near 1.0 it is 0.0078. AdamW writes its update directly into that bf16 tensor, so any per-row update smaller than the ulp is silently rounded away. This bites hardest exactly where it matters: embedding gradients are sparse, so a given row is touched only when its token appears and its Adam update is often far below the nominal rate, and the warmdown drives the effective rate to a tenth of peak over the final half of the budget. Keeping the tables in fp32 while casting the gathered rows to the activation dtype preserves those small updates at no change to the forward computation.", "measurements": [{"command": ["/data/home/zhubaiyu/.local/bin/uv", "run", "--project", "/data3/zhubaiyu/fengheguai/campaigns/h200-claude/nodes/t0092", "python", "/data3/zhubaiyu/fengheguai/fengheguai/_audit_runner.py", "--target", "/data3/zhubaiyu/fengheguai/campaigns/h200-claude/nodes/t0092", "--nonce", "e54b5a5175c0a75b637c664649283475b9db4afa36ce3394"], "errors": [], "evidence_path": "/data3/zhubaiyu/fengheguai/campaigns/h200-claude/evidence/t0092-r0/evidence.json", "evidence_sha256": "8e60def105ecdeb07d3050bceda71e1ba4fb0198a097e082202de6305baa3343", "log_path": "/data3/zhubaiyu/fengheguai/campaigns/h200-claude/evidence/t0092-r0/run.log", "log_sha256": "24a2cdd8bd48a6dff1324c18c4c588c3b798f2bec68ab2bb2e0476b286e2d3b0", "metric": 0.9963740955859284, "num_steps": 1828, "peak_vram_mb": 34088.4, "return_code": 0, "status": "valid", "timed_out": false, "train_sha256": "7878bbab6ce66887252f8137355d3f1948340af58dc89ce28f0d51867a3e238d", "training_seconds": 300.1, "wall_seconds": 587.3932440252975}], "metric": 0.9963740955859284, "parent_id": "t0089", "patch_path": "/data3/zhubaiyu/fengheguai/campaigns/h200-claude/artifacts/t0092/change.patch", "patch_sha256": "fc1b4d93f906b25600acc25b7f32bbc0979fbc4edafd1642831d84431fabce99", "promoted": false, "proposal": {"change_summary": "Precision change on champion t0089: the value-embedding tables are no longer cast to bf16 in init_weights, so they remain fp32 parameters with fp32 AdamW moments, while GPT.forward casts each gathered row to x.dtype at the point of use so attention still receives bf16 and the fa3 kernel is unaffected. transformer.wte keeps its bf16 cast, since its elements sit near the scale where bf16 resolution is adequate and it is normalised immediately in forward. The corrected init of uniform plus or minus sqrt(3) and the decoupled VALUE_EMBEDDING_LR of 0.3 are retained; the 256-channel gate from t0091 is not, having cost 0.000509. Roughly 50M parameters move from bf16 to fp32, adding about 200MB of parameter and moment memory against the 35GB this configuration currently uses.", "command": ["/usr/bin/python3", "/data3/zhubaiyu/fengheguai/fengheguai/rendezvous_agent.py", "--trial", "/data3/zhubaiyu/fengheguai/campaigns/h200-claude/nodes/t0092", "--result", "/data3/zhubaiyu/fengheguai/campaigns/h200-claude/nodes/t0092/.fengheguai-agent-result.json", "--schema", "/data3/zhubaiyu/fengheguai/campaigns/h200-claude/control/agent_output.schema.json", "--campaign", "/data3/zhubaiyu/fengheguai/campaigns/h200-claude", "--inbox", "/data3/zhubaiyu/fengheguai/campaigns/h200-claude-rendezvous"], "errors": [], "expected_val_bpb_effect": "Expected between a 0.001 decrease and a 0.0005 increase versus champion t0089 at 0.968389. The step count is the diagnostic to watch: the gather now reads twice the bytes and the cast is an extra elementwise pass, so if throughput falls more than a percent or two the quality gain could be offset. The forward computation is numerically identical up to the cast, so any difference beyond that is attributable to updates that previously did not survive rounding.", "hypothesis": "The initialisation fix in t0087 improved the value-embedding path but simultaneously made its update quantisation 32 times coarser, and nothing has corrected for that. These tables are stored as bf16 parameters, cast in init_weights alongside wte. bf16 carries 8 mantissa bits, so its resolution scales with magnitude: near the old element scale of 0.044 the ulp was 0.00024, but at the corrected scale near 1.0 it is 0.0078. AdamW writes its update directly into that bf16 tensor, so any per-row update smaller than the ulp is silently rounded away. This bites hardest exactly where it matters: embedding gradients are sparse, so a given row is touched only when its token appears and its Adam update is often far below the nominal rate, and the warmdown drives the effective rate to a tenth of peak over the final half of the budget. Keeping the tables in fp32 while casting the gathered rows to the activation dtype preserves those small updates at no change to the forward computation.", "log_path": "/data3/zhubaiyu/fengheguai/campaigns/h200-claude/artifacts/t0092/agent.log", "return_code": 0, "risk": "The dtype cast at the gather is exactly the failure that broke t0044, where a bf16 tensor multiplied by an fp32 parameter promoted the product and the fa3 kernel rejected it; here the cast is applied at the gather so ve is bf16 before it reaches the attention module, which keeps v + gate * ve in bf16 throughout. The quantitative case is also weaker than it first appears: nominal late-training updates are about 0.03, which is still four ulps, so only the sub-nominal per-row updates are being recovered rather than all of them, and the size of that population is not something this node can measure directly.", "success": true, "timed_out": false}, "secondary_parent_id": null, "selection_reason": "Exploit a top-K branch selected by quality plus an under-exploration bonus.", "source_sha256": "7878bbab6ce66887252f8137355d3f1948340af58dc89ce28f0d51867a3e238d", "stage": "refine", "status": "discard", "training_seconds": 300.1, "trial_id": "t0092", "workspace": "/data3/zhubaiyu/fengheguai/campaigns/h200-claude/nodes/t0092"}, "prev_hash": "8bec203ed6197b5941cfa2597a173b3304bf6a8424536ebd908437bbf8a990dc", "seq": 186, "timestamp": "2026-08-21T05:06:04.531554+00:00"}
{"hash": "98019f9727a2ed1c95e4e890ec04df3f6e2d64b85f1b27cdddbf5e4f1b675778", "kind": "trial_started", "payload": {"parent_id": "t0089", "reason": "The current line is stalled; make a structurally different bet.", "secondary_parent_id": null, "stage": "explore", "trial_id": "t0093"}, "prev_hash": "58fec6d6fb70c41da514da7c8c48324a4ca9eb3ccdf13d6b704d983ad8ffd7cd", "seq": 187, "timestamp": "2026-08-21T05:06:04.583281+00:00"}
{"hash": "58483c020ee607b6ff77a2996b0b08260384db229b5d462f41be55fdcc7bf43f", "kind": "trial_completed", "payload": {"champion_before": "t0089", "debug_depth": 0, "delta_vs_champion_before": null, "delta_vs_parent": null, "finding": "t0093 ended as failed. Hypothesis: t0092 showed the value-embedding path is precision-limited but bought the fix in the most expensive place. Holding those tables in fp32 improved quality per step, loss 3.013 against the champion 3.029 at step 1000, yet throughput collapsed from 105ms to 211ms per step and the run lost 36 percent of its steps, finishing at 0.996374, worse than the original baseline. The cost came from tripling memory traffic on the largest parameter block, 50M parameters as fp32 weights plus fp32 moments. There is a cheaper place to spend that precision. _step_adamw allocates its moment buffers with torch.zeros_like(p), so a bf16 parameter silently receives bf16 moments, and the moments are where small updates must survive across steps: exp_avg holds a running average divided by the square root of exp_avg_sq, and both sit at an ulp of 0.0078 near the corrected embedding scale. Keeping parameters in bf16, so gathers and writes stay cheap, while allocating moments in fp32 should capture most of the quality effect at a fraction of the traffic.. Evidence: expected one nonce-bound locked evaluation, found 0; training process exited with code 1; training_seconds is missing from output", "measurements": [{"command": ["/data/home/zhubaiyu/.local/bin/uv", "run", "--project", "/data3/zhubaiyu/fengheguai/campaigns/h200-claude/nodes/t0093", "python", "/data3/zhubaiyu/fengheguai/fengheguai/_audit_runner.py", "--target", "/data3/zhubaiyu/fengheguai/campaigns/h200-claude/nodes/t0093", "--nonce", "65094861636e3c9bc8db88b342f16640f906a796b6067808"], "errors": ["expected one nonce-bound locked evaluation, found 0", "training process exited with code 1", "training_seconds is missing from output"], "evidence_path": "/data3/zhubaiyu/fengheguai/campaigns/h200-claude/evidence/t0093-r0/evidence.json", "evidence_sha256": "2f5f566d55b8a55b43f9df50af6c12a2871814433e23e0aaf681f7a5cbfc87de", "log_path": "/data3/zhubaiyu/fengheguai/campaigns/h200-claude/evidence/t0093-r0/run.log", "log_sha256": "71eb1c176115947529ddcad5da73a5e4f98d3b52dc5da558b43cd3363ae89439", "metric": null, "num_steps": null, "peak_vram_mb": null, "return_code": 1, "status": "failed", "timed_out": false, "train_sha256": "e4417def3904f46078e35c3060838db19f47ba7e9717c9fb0ab029a4680f4061", "training_seconds": null, "wall_seconds": 151.6951132491231}], "metric": null, "parent_id": "t0089", "patch_path": "/data3/zhubaiyu/fengheguai/campaigns/h200-claude/artifacts/t0093/change.patch", "patch_sha256": "d3034bc469d2cbd14495421f24e4fd7ed85b8e243f5af828e6ec5236b1ce1acc", "promoted": false, "proposal": {"change_summary": "Optimizer change on champion t0089: AdamW moment buffers are allocated as float32 regardless of parameter dtype instead of inheriting it through zeros_like. The value embeddings and wte keep their bf16 casts in init_weights, so the forward pass, the embedding gathers and the parameter writes are unchanged from the champion. This affects the four AdamW groups, of which only the value embeddings are large enough to matter, adding roughly 200MB of moment memory against the 34GB this configuration uses. adamw_step_fused is compiled with dynamic=False and will recompile once for the new dtype mix, at a step-zero cost excluded from the timed budget. The fp32 parameter experiment from t0092 is not carried forward.", "command": ["/usr/bin/python3", "/data3/zhubaiyu/fengheguai/fengheguai/rendezvous_agent.py", "--trial", "/data3/zhubaiyu/fengheguai/campaigns/h200-claude/nodes/t0093", "--result", "/data3/zhubaiyu/fengheguai/campaigns/h200-claude/nodes/t0093/.fengheguai-agent-result.json", "--schema", "/data3/zhubaiyu/fengheguai/campaigns/h200-claude/control/agent_output.schema.json", "--campaign", "/data3/zhubaiyu/fengheguai/campaigns/h200-claude", "--inbox", "/data3/zhubaiyu/fengheguai/campaigns/h200-claude-rendezvous"], "errors": [], "expected_val_bpb_effect": "Expected between a 0.001 decrease and a 0.001 increase versus champion t0089 at 0.968389. num_steps is the decisive diagnostic: the champion runs 2875 and t0092 ran 1828, so a count above roughly 2700 means the cheaper placement worked and the quality effect can be read directly, while a fall toward 2000 means moment precision carries most of the traffic cost as well and the direction closes.", "hypothesis": "t0092 showed the value-embedding path is precision-limited but bought the fix in the most expensive place. Holding those tables in fp32 improved quality per step, loss 3.013 against the champion 3.029 at step 1000, yet throughput collapsed from 105ms to 211ms per step and the run lost 36 percent of its steps, finishing at 0.996374, worse than the original baseline. The cost came from tripling memory traffic on the largest parameter block, 50M parameters as fp32 weights plus fp32 moments. There is a cheaper place to spend that precision. _step_adamw allocates its moment buffers with torch.zeros_like(p), so a bf16 parameter silently receives bf16 moments, and the moments are where small updates must survive across steps: exp_avg holds a running average divided by the square root of exp_avg_sq, and both sit at an ulp of 0.0078 near the corrected embedding scale. Keeping parameters in bf16, so gathers and writes stay cheap, while allocating moments in fp32 should capture most of the quality effect at a fraction of the traffic.", "log_path": "/data3/zhubaiyu/fengheguai/campaigns/h200-claude/artifacts/t0093/agent.log", "return_code": 0, "risk": "The mixed-dtype update inside adamw_step_fused is the specific hazard: p is bf16 while exp_avg, exp_avg_sq and the derived denominator are fp32, so p.add_ downcasts on write and lerp_ mixes dtypes on read. That is legal in PyTorch and should not raise, but it is the same class of silent promotion that broke t0044, and if inductor materialises fp32 intermediates for the whole update the traffic saving will not appear. It is also possible the precision that mattered in t0092 lived in the parameter rather than the moments, in which case this measures a null and the honest conclusion is that the effect cannot be bought inside the step budget.", "success": true, "timed_out": false}, "secondary_parent_id": null, "selection_reason": "The current line is stalled; make a structurally different bet.", "source_sha256": "e4417def3904f46078e35c3060838db19f47ba7e9717c9fb0ab029a4680f4061", "stage": "explore", "status": "failed", "training_seconds": null, "trial_id": "t0093", "workspace": "/data3/zhubaiyu/fengheguai/campaigns/h200-claude/nodes/t0093"}, "prev_hash": "98019f9727a2ed1c95e4e890ec04df3f6e2d64b85f1b27cdddbf5e4f1b675778", "seq": 188, "timestamp": "2026-08-21T05:11:38.853210+00:00"}
{"hash": "7a91f09280ad0c0f1636056cae44bfa27eb65108d00af31f9166bcb7328c84c1", "kind": "trial_started", "payload": {"parent_id": "t0093", "reason": "Repair the most recent executable failure before abandoning its hypothesis.", "secondary_parent_id": null, "stage": "debug", "trial_id": "t0094"}, "prev_hash": "58483c020ee607b6ff77a2996b0b08260384db229b5d462f41be55fdcc7bf43f", "seq": 189, "timestamp": "2026-08-21T05:11:38.907258+00:00"}
{"hash": "1f5070fbdfa282c071f5101804c5db5a6884e8e1d3712c912e46c5b99785805a", "kind": "trial_completed", "payload": {"champion_before": "t0089", "debug_depth": 1, "delta_vs_champion_before": 0.00012060190719243025, "delta_vs_parent": null, "finding": "t0094 did not improve the prior champion: val_bpb=0.968509, delta=+0.000121. Hypothesis: Unchanged from t0093: the value-embedding path is precision-limited, as t0092 demonstrated by improving loss per step from 3.029 to 3.013 at step 1000, and the cheap place to spend that precision is the AdamW moment buffers rather than the parameters, because _step_adamw allocates them with torch.zeros_like(p) and a bf16 parameter therefore receives bf16 moments with an ulp of 0.0078 near the corrected embedding scale. t0093 did not test this. It aborted during compilation of adamw_step_fused with a fake-tensor failure on exp_avg.lerp_(grad, 1 - beta1_t): the moment buffer is now fp32 while grad remains bf16, and an in-place operation cannot promote its own destination. The diagnosis is a dtype contract inside the fused step, not a defect in the idea.", "measurements": [{"command": ["/data/home/zhubaiyu/.local/bin/uv", "run", "--project", "/data3/zhubaiyu/fengheguai/campaigns/h200-claude/nodes/t0094", "python", "/data3/zhubaiyu/fengheguai/fengheguai/_audit_runner.py", "--target", "/data3/zhubaiyu/fengheguai/campaigns/h200-claude/nodes/t0094", "--nonce", "9dae9cd2531e037cadc6e08303333e7d13645e69e618eab0"], "errors": [], "evidence_path": "/data3/zhubaiyu/fengheguai/campaigns/h200-claude/evidence/t0094-r0/evidence.json", "evidence_sha256": "3cb5916df7e5190fc39affbe98bf2bdff1e32f2c0146f7d442a7cfa04e488093", "log_path": "/data3/zhubaiyu/fengheguai/campaigns/h200-claude/evidence/t0094-r0/run.log", "log_sha256": "5a33dbb5b69860dea67d87e476436230749003329285656d2c1eb1581c9fcec3", "metric": 0.968509340500545, "num_steps": 2871, "peak_vram_mb": 34008.4, "return_code": 0, "status": "valid", "timed_out": false, "train_sha256": "4ecb502c6d345f0231476528eb8783c658902d61989a364e646be6e5f7750966", "training_seconds": 300.0, "wall_seconds": 487.56122120283544}], "metric": 0.968509340500545, "parent_id": "t0093", "patch_path": "/data3/zhubaiyu/fengheguai/campaigns/h200-claude/artifacts/t0094/change.patch", "patch_sha256": "d4948ce22377feb6590205466127c74442bf53aed1123e2038f6ec7d452d434e", "promoted": false, "proposal": {"change_summary": "Debug repair of t0093 with the mechanism intact and the arithmetic unchanged. adamw_step_fused now states its dtypes explicitly for the mixed-precision case: the gradient is cast once to the moment dtype and reused for both lerp_ calls, and the parameter update folds the step size into the fp32 expression before a single cast back to the parameter dtype, since add_ likewise cannot write an fp32 result into a bf16 destination. For the fp32 parameter groups both casts are no-ops. The moment buffers stay float32 as in t0093, and the value embeddings and wte keep their bf16 casts, so gathers, the forward pass and parameter storage are exactly as in champion t0089.", "command": ["/usr/bin/python3", "/data3/zhubaiyu/fengheguai/fengheguai/rendezvous_agent.py", "--trial", "/data3/zhubaiyu/fengheguai/campaigns/h200-claude/nodes/t0094", "--result", "/data3/zhubaiyu/fengheguai/campaigns/h200-claude/nodes/t0094/.fengheguai-agent-result.json", "--schema", "/data3/zhubaiyu/fengheguai/campaigns/h200-claude/control/agent_output.schema.json", "--campaign", "/data3/zhubaiyu/fengheguai/campaigns/h200-claude", "--inbox", "/data3/zhubaiyu/fengheguai/campaigns/h200-claude-rendezvous"], "errors": [], "expected_val_bpb_effect": "Expected between a 0.001 decrease and a 0.001 increase versus champion t0089 at 0.968389, with num_steps the decisive quantity. The champion runs 2875 steps and the fp32-parameter version in t0092 ran 1828; anything above roughly 2700 means the precision was successfully relocated to somewhere cheap and the quality effect can be read directly, while a fall toward 2000 means the moment buffers carry most of the traffic cost too and the direction closes.", "hypothesis": "Unchanged from t0093: the value-embedding path is precision-limited, as t0092 demonstrated by improving loss per step from 3.029 to 3.013 at step 1000, and the cheap place to spend that precision is the AdamW moment buffers rather than the parameters, because _step_adamw allocates them with torch.zeros_like(p) and a bf16 parameter therefore receives bf16 moments with an ulp of 0.0078 near the corrected embedding scale. t0093 did not test this. It aborted during compilation of adamw_step_fused with a fake-tensor failure on exp_avg.lerp_(grad, 1 - beta1_t): the moment buffer is now fp32 while grad remains bf16, and an in-place operation cannot promote its own destination. The diagnosis is a dtype contract inside the fused step, not a defect in the idea.", "log_path": "/data3/zhubaiyu/fengheguai/campaigns/h200-claude/artifacts/t0094/agent.log", "return_code": 0, "risk": "Two casts now appear inside a fullgraph-compiled function, so inductor may materialise an extra fp32 temporary per parameter rather than fusing the cast into the existing kernel, which would reintroduce part of the traffic cost this node exists to avoid. The repair is also the third consecutive node on this thread, and the honest reading if it measures null is that the precision effect seen in t0092 cannot be separated from the cost of storing it, at which point the direction should be abandoned rather than relocated again.", "success": true, "timed_out": false}, "secondary_parent_id": null, "selection_reason": "Repair the most recent executable failure before abandoning its hypothesis.", "source_sha256": "4ecb502c6d345f0231476528eb8783c658902d61989a364e646be6e5f7750966", "stage": "debug", "status": "discard", "training_seconds": 300.0, "trial_id": "t0094", "workspace": "/data3/zhubaiyu/fengheguai/campaigns/h200-claude/nodes/t0094"}, "prev_hash": "7a91f09280ad0c0f1636056cae44bfa27eb65108d00af31f9166bcb7328c84c1", "seq": 190, "timestamp": "2026-08-21T05:21:17.024462+00:00"}
{"hash": "7f9fb244f222c072de57ab3fdf39a614a32ac6f4712a7cfdabf2b5dc131f2f3d", "kind": "trial_started", "payload": {"parent_id": "t0089", "reason": "The current line is stalled; make a structurally different bet.", "secondary_parent_id": null, "stage": "explore", "trial_id": "t0095"}, "prev_hash": "1f5070fbdfa282c071f5101804c5db5a6884e8e1d3712c912e46c5b99785805a", "seq": 191, "timestamp": "2026-08-21T05:21:17.077447+00:00"}
