{"hash": "aaae33cac0a32911c4db9f03250c79b9d0a0ccb767e5137617f8f0f71ac29f95", "kind": "trial_started", "payload": {"parent_id": "t0053", "reason": "Exploit a top-K branch selected by quality plus an under-exploration bonus.", "secondary_parent_id": null, "stage": "refine", "trial_id": "t0054"}, "prev_hash": "71010864ea6a319112bb0c8ec64c40b1f4e5a5b58f39b67f72b85ba4aa040129", "seq": 109, "timestamp": "2026-08-20T21:43:30.040595+00:00"}
{"hash": "43fae9c09d406149fe8d6316e88925eaf064539d2f293347f746d08abb59f477", "kind": "trial_completed", "payload": {"champion_before": "t0053", "debug_depth": 0, "delta_vs_champion_before": 6.014254222197479e-05, "delta_vs_parent": 6.014254222197479e-05, "finding": "t0054 did not improve the prior champion: val_bpb=0.971690, delta=+0.000060. Hypothesis: A sharper rule may govern the rates than the uniform square-root law currently in the champion. Two decompositions now point the same way for the embedding group: at batch 2**18 it preferred 0.6 over 0.4243 by 0.000208, and at batch 2**17 it again preferred 0.6 over 0.4243 by 0.000314, so its optimum did not move when the batch halved. The unembedding group has a precisely measured optimum at 2**18 as well, since t0039 and t0040 bracketed it at 0.002828 with 0.002 costing 0.003152 and 0.004 costing 0.001265, and that group is unusually sensitive. The champion currently runs it at 0.002, which is exactly the value measured to be badly wrong one batch size up. If the Adam groups have batch-invariant optima and only the orthogonalised Muon updates follow square-root scaling, restoring 0.002828 should lower val_bpb and would establish a much cleaner rule than the uniform one.", "measurements": [{"command": ["/data/home/zhubaiyu/.local/bin/uv", "run", "--project", "/data3/zhubaiyu/fengheguai/campaigns/h200-claude/nodes/t0054", "python", "/data3/zhubaiyu/fengheguai/fengheguai/_audit_runner.py", "--target", "/data3/zhubaiyu/fengheguai/campaigns/h200-claude/nodes/t0054", "--nonce", "9ddb7cfd74bba91962a7ffffb8de254ad6bdbf83da5bd313"], "errors": [], "evidence_path": "/data3/zhubaiyu/fengheguai/campaigns/h200-claude/evidence/t0054-r0/evidence.json", "evidence_sha256": "84868fc1b7ede46bd592faa1e105a8d5bf527a033795cfa20152ad38da639400", "log_path": "/data3/zhubaiyu/fengheguai/campaigns/h200-claude/evidence/t0054-r0/run.log", "log_sha256": "08dab8d7e73556a162d236db5012efb57a77beaf0e8a5fb2b813945b664f0ba3", "metric": 0.9716904522882974, "num_steps": 2840, "peak_vram_mb": 33800.4, "return_code": 0, "status": "valid", "timed_out": false, "train_sha256": "ac17ada8d13eb593cfac2ca8e0af3187a4aabe4036a3cc9b9f1f7c1911586550", "training_seconds": 300.0, "wall_seconds": 485.35763362795115}], "metric": 0.9716904522882974, "parent_id": "t0053", "patch_path": "/data3/zhubaiyu/fengheguai/campaigns/h200-claude/artifacts/t0054/change.patch", "patch_sha256": "250f6381a6e1391039589bd11de386a6ed0e9e6fc4f696a882da213ea475bfaa", "promoted": false, "proposal": {"change_summary": "One learning rate changed on champion t0053: UNEMBEDDING_LR from 0.002 back to 0.002828, the value bracketed as optimal at batch 2**18, affecting only the lm_head AdamW group. EMBEDDING_LR stays at its twice-confirmed 0.6 and MATRIX_LR stays at 0.0163, keeping the square-root rescale for the Muon group alone. TOTAL_BATCH_SIZE stays 2**17 with DEVICE_BATCH_SIZE 64, and depth 12, width 512, document masking, dense value embeddings with the 128-channel gate, output softcap 10, rotary base 30000, WEIGHT_DECAY 0.2, FINAL_LR_FRAC 0.1 and WARMDOWN_RATIO 0.5 are unchanged.", "command": ["/usr/bin/python3", "/data3/zhubaiyu/fengheguai/fengheguai/rendezvous_agent.py", "--trial", "/data3/zhubaiyu/fengheguai/campaigns/h200-claude/nodes/t0054", "--result", "/data3/zhubaiyu/fengheguai/campaigns/h200-claude/nodes/t0054/.fengheguai-agent-result.json", "--schema", "/data3/zhubaiyu/fengheguai/campaigns/h200-claude/control/agent_output.schema.json", "--campaign", "/data3/zhubaiyu/fengheguai/campaigns/h200-claude", "--inbox", "/data3/zhubaiyu/fengheguai/campaigns/h200-claude-rendezvous"], "errors": [], "expected_val_bpb_effect": "Expected between a 0.002 decrease and a 0.001 increase versus champion t0053 at 0.971630, with step count unchanged. The upside is larger than for the embedding decomposition because this group is measurably sharper: moving it by 30 percent cost 0.003152 at the previous batch, so if 0.002 is similarly wrong here the recovery should be clearly visible above noise. A regression would mean the unembedding group genuinely does scale with batch while the embedding group does not, which is a real asymmetry worth knowing rather than a null.", "hypothesis": "A sharper rule may govern the rates than the uniform square-root law currently in the champion. Two decompositions now point the same way for the embedding group: at batch 2**18 it preferred 0.6 over 0.4243 by 0.000208, and at batch 2**17 it again preferred 0.6 over 0.4243 by 0.000314, so its optimum did not move when the batch halved. The unembedding group has a precisely measured optimum at 2**18 as well, since t0039 and t0040 bracketed it at 0.002828 with 0.002 costing 0.003152 and 0.004 costing 0.001265, and that group is unusually sensitive. The champion currently runs it at 0.002, which is exactly the value measured to be badly wrong one batch size up. If the Adam groups have batch-invariant optima and only the orthogonalised Muon updates follow square-root scaling, restoring 0.002828 should lower val_bpb and would establish a much cleaner rule than the uniform one.", "log_path": "/data3/zhubaiyu/fengheguai/campaigns/h200-claude/artifacts/t0054/agent.log", "return_code": 0, "risk": "The two groups are not symmetric and the outcome is genuinely uncertain: lm_head is a dense 4.2M-parameter output projection receiving gradient on every token, whereas the embedding group is 54M parameters of sparse token-indexed lookups, so a batch-invariance result for one does not obviously transfer to the other. It is also possible that both the 2**18 bracket and the current setting are near a flat region for this group at the new batch, in which case the result lands within noise and the sharper rule stays unproven rather than refuted.", "success": true, "timed_out": false}, "secondary_parent_id": null, "selection_reason": "Exploit a top-K branch selected by quality plus an under-exploration bonus.", "source_sha256": "ac17ada8d13eb593cfac2ca8e0af3187a4aabe4036a3cc9b9f1f7c1911586550", "stage": "refine", "status": "discard", "training_seconds": 300.0, "trial_id": "t0054", "workspace": "/data3/zhubaiyu/fengheguai/campaigns/h200-claude/nodes/t0054"}, "prev_hash": "aaae33cac0a32911c4db9f03250c79b9d0a0ccb767e5137617f8f0f71ac29f95", "seq": 110, "timestamp": "2026-08-20T21:52:27.870237+00:00"}
{"hash": "008bf114616bf0602254e91f457de8cd3da93c77f0b4fb15833faf1e4f6fce6c", "kind": "trial_started", "payload": {"parent_id": "t0053", "reason": "Spend the configured search share on a distinct architectural or recipe direction.", "secondary_parent_id": null, "stage": "explore", "trial_id": "t0055"}, "prev_hash": "43fae9c09d406149fe8d6316e88925eaf064539d2f293347f746d08abb59f477", "seq": 111, "timestamp": "2026-08-20T21:52:27.901389+00:00"}
{"hash": "57f08e6118f4051d3c15955923a852fde4734ea9149a2d4372a55a8d783e8d6c", "kind": "trial_completed", "payload": {"champion_before": "t0053", "debug_depth": 0, "delta_vs_champion_before": 0.003157102480642271, "delta_vs_parent": 0.003157102480642271, "finding": "t0055 did not improve the prior champion: val_bpb=0.974787, delta=+0.003157. Hypothesis: One member of the t0051 bundle is still undecomposed, and it is the only one the square-root law was ever theoretically motivated for. The decompositions so far give a mixed picture: the embedding group prefers its unscaled 0.6 at both 2**18 and 2**17, twice confirmed, while the unembedding group turned out flat at 2**17, moving only 0.00006 between 0.002 and 0.002828 despite a 0.003152 penalty for the same move one batch size up. That leaves the Muon group, which is the one whose updates are orthogonalised to roughly unit scale and therefore the one where a noise-driven rate law should apply most cleanly. If square-root scaling is real and specific to Muon, then reverting MATRIX_LR to its unscaled 0.0231 should regress; if it does not regress, the t0051 gain came from step count alone and no group actually needed rescaling, which would simplify the recipe and contradict the reading this campaign has carried since t0004.", "measurements": [{"command": ["/data/home/zhubaiyu/.local/bin/uv", "run", "--project", "/data3/zhubaiyu/fengheguai/campaigns/h200-claude/nodes/t0055", "python", "/data3/zhubaiyu/fengheguai/fengheguai/_audit_runner.py", "--target", "/data3/zhubaiyu/fengheguai/campaigns/h200-claude/nodes/t0055", "--nonce", "da12b0903b8b38aec76a98eb24a5b8e9da9d23359b12df67"], "errors": [], "evidence_path": "/data3/zhubaiyu/fengheguai/campaigns/h200-claude/evidence/t0055-r0/evidence.json", "evidence_sha256": "0798e5022962bed34cc9aead888be2085ddc64211308e61005a1e974a95628d1", "log_path": "/data3/zhubaiyu/fengheguai/campaigns/h200-claude/evidence/t0055-r0/run.log", "log_sha256": "a94ada11c01b53918acb6b02095dd68b1ae17b1574253f124924a92ec3c34e9f", "metric": 0.9747874122267177, "num_steps": 2844, "peak_vram_mb": 33800.4, "return_code": 0, "status": "valid", "timed_out": false, "train_sha256": "546ec552c0367a648435bd18c66545827c49f30b23b419c83107aee74614dc8d", "training_seconds": 300.0, "wall_seconds": 486.31502801552415}], "metric": 0.9747874122267177, "parent_id": "t0053", "patch_path": "/data3/zhubaiyu/fengheguai/campaigns/h200-claude/artifacts/t0055/change.patch", "patch_sha256": "faccdd18c1eefe2ff12f7125e98bc2c57c5c4ab8b2c61fb849c0f81f85afcd18", "promoted": false, "proposal": {"change_summary": "One learning rate changed on champion t0053: MATRIX_LR from 0.0163 back to 0.0231, the value used at batch 2**18, affecting only the Muon matrix groups. EMBEDDING_LR stays at its twice-confirmed 0.6 and UNEMBEDDING_LR stays 0.002, which measured flat against 0.002828 at this batch. TOTAL_BATCH_SIZE stays 2**17 with DEVICE_BATCH_SIZE 64, and depth 12, width 512, document masking, dense value embeddings with the 128-channel gate, output softcap 10, rotary base 30000, WEIGHT_DECAY 0.2, FINAL_LR_FRAC 0.1 and WARMDOWN_RATIO 0.5 are unchanged.", "command": ["/usr/bin/python3", "/data3/zhubaiyu/fengheguai/fengheguai/rendezvous_agent.py", "--trial", "/data3/zhubaiyu/fengheguai/campaigns/h200-claude/nodes/t0055", "--result", "/data3/zhubaiyu/fengheguai/campaigns/h200-claude/nodes/t0055/.fengheguai-agent-result.json", "--schema", "/data3/zhubaiyu/fengheguai/campaigns/h200-claude/control/agent_output.schema.json", "--campaign", "/data3/zhubaiyu/fengheguai/campaigns/h200-claude", "--inbox", "/data3/zhubaiyu/fengheguai/campaigns/h200-claude-rendezvous"], "errors": [], "expected_val_bpb_effect": "Expected between a 0.001 decrease and a 0.003 increase versus champion t0053 at 0.971630, with step count unchanged. A regression is the outcome I expect and the one that would be most useful, because it would isolate the square-root law to the Muon group and explain every rate result in this campaign under a single rule: orthogonalised updates scale with batch, Adam groups do not. A gain would be more disruptive, implying the rescaling was never necessary and that three earlier nodes attributed their results to the wrong cause.", "hypothesis": "One member of the t0051 bundle is still undecomposed, and it is the only one the square-root law was ever theoretically motivated for. The decompositions so far give a mixed picture: the embedding group prefers its unscaled 0.6 at both 2**18 and 2**17, twice confirmed, while the unembedding group turned out flat at 2**17, moving only 0.00006 between 0.002 and 0.002828 despite a 0.003152 penalty for the same move one batch size up. That leaves the Muon group, which is the one whose updates are orthogonalised to roughly unit scale and therefore the one where a noise-driven rate law should apply most cleanly. If square-root scaling is real and specific to Muon, then reverting MATRIX_LR to its unscaled 0.0231 should regress; if it does not regress, the t0051 gain came from step count alone and no group actually needed rescaling, which would simplify the recipe and contradict the reading this campaign has carried since t0004.", "log_path": "/data3/zhubaiyu/fengheguai/campaigns/h200-claude/artifacts/t0055/agent.log", "return_code": 0, "risk": "This node deliberately tests a coordinate expected to lose, which is justified here because it is the last piece of a decomposition whose other two pieces are already measured and because the champion is unaffected either way. The specific ambiguity is that the t0003, t0005 and t0007 evidence for square-root scaling was gathered at depth 8 across a 4x batch range, and MATRIX_LR has since absorbed a separate sqrt(8/12) depth correction from t0017, so 0.0231 is not a pure unscaled value but a depth-corrected one; a null would therefore leave the law underdetermined rather than refuted.", "success": true, "timed_out": false}, "secondary_parent_id": null, "selection_reason": "Spend the configured search share on a distinct architectural or recipe direction.", "source_sha256": "546ec552c0367a648435bd18c66545827c49f30b23b419c83107aee74614dc8d", "stage": "explore", "status": "discard", "training_seconds": 300.0, "trial_id": "t0055", "workspace": "/data3/zhubaiyu/fengheguai/campaigns/h200-claude/nodes/t0055"}, "prev_hash": "008bf114616bf0602254e91f457de8cd3da93c77f0b4fb15833faf1e4f6fce6c", "seq": 112, "timestamp": "2026-08-20T22:01:24.701329+00:00"}
{"hash": "c84adcd7fb35b01bf69711459dbbf247fcbbfcb8b0353ea5d7a4f59a814b9d23", "kind": "trial_started", "payload": {"parent_id": "t0053", "reason": "Recombine two independently strong branches at the scheduled synthesis step.", "secondary_parent_id": "t0054", "stage": "recombine", "trial_id": "t0056"}, "prev_hash": "57f08e6118f4051d3c15955923a852fde4734ea9149a2d4372a55a8d783e8d6c", "seq": 113, "timestamp": "2026-08-20T22:01:24.733557+00:00"}
{"hash": "21c88bfacac1b58a71456c3b2a46ef667ef39f0ba3d9f3feaec8de5f527ae7b3", "kind": "trial_completed", "payload": {"champion_before": "t0053", "debug_depth": 0, "delta_vs_champion_before": 0.001070550989411334, "delta_vs_parent": 0.001070550989411334, "finding": "t0056 did not improve the prior champion: val_bpb=0.972701, delta=+0.001071. Hypothesis: Every schedule in this recipe is indexed by elapsed training time except one, and that one has silently drifted as the campaign changed the step count. get_lr_multiplier and get_weight_decay both take progress, which is total_training_time over TIME_BUDGET, so their shape is invariant to how many steps fit in 300 seconds. get_muon_momentum instead takes the raw step index and ramps momentum from 0.85 to 0.95 over the first 300 steps. At the original 1019 steps that warmup covered 29 percent of training; the champion now runs 2838 steps, so it covers 10.6 percent, and the model spends a far larger share of the run at high momentum than the recipe was tuned for. That matters because t0028 and t0029 showed momentum is one of the steepest axes here, with 0.98 costing 0.002361 and 0.92 costing 0.001053. Rescaling the warmup to 850 steps restores the original 30 percent fraction and should lower val_bpb.", "measurements": [{"command": ["/data/home/zhubaiyu/.local/bin/uv", "run", "--project", "/data3/zhubaiyu/fengheguai/campaigns/h200-claude/nodes/t0056", "python", "/data3/zhubaiyu/fengheguai/fengheguai/_audit_runner.py", "--target", "/data3/zhubaiyu/fengheguai/campaigns/h200-claude/nodes/t0056", "--nonce", "2c2903d0da00adb7e080a364568b2bf192cc0439aa59dd75"], "errors": [], "evidence_path": "/data3/zhubaiyu/fengheguai/campaigns/h200-claude/evidence/t0056-r0/evidence.json", "evidence_sha256": "53ddbc9eb5276f853304065a9941c322a0b6f5f9a505bc30dae43125e1b5068e", "log_path": "/data3/zhubaiyu/fengheguai/campaigns/h200-claude/evidence/t0056-r0/run.log", "log_sha256": "c2ad62236b3bc955268a577b76c2bf8226ba312e27de7d79a302c49a0f860b24", "metric": 0.9727008607354868, "num_steps": 2839, "peak_vram_mb": 33800.4, "return_code": 0, "status": "valid", "timed_out": false, "train_sha256": "d68dacc391a9b8f8cd022aa0defebd7f55fea9120b5e4fd3d576e41e0cca39a7", "training_seconds": 300.1, "wall_seconds": 484.293326549232}], "metric": 0.9727008607354868, "parent_id": "t0053", "patch_path": "/data3/zhubaiyu/fengheguai/campaigns/h200-claude/artifacts/t0056/change.patch", "patch_sha256": "4fc39625c1f26724e49265e9bfca4bc11131cd933a5e995685ad941e31217191", "promoted": false, "proposal": {"change_summary": "One constant changed on champion t0053: the divisor in get_muon_momentum from 300 to 850, so momentum still ramps from 0.85 to a terminal 0.95 but reaches it after 850 steps instead of 300, which is 30 percent of the current 2838-step run rather than 10.6 percent. The terminal value stays at its bracketed optimum of 0.95 and NorMuon beta2 stays 0.95. The two elite lines contribute their settled rates: EMBEDDING_LR 0.6 unscaled from the twice-confirmed decomposition, UNEMBEDDING_LR 0.002 which measured flat against 0.002828 in t0054, and MATRIX_LR 0.0163 which t0055 confirmed must carry the square-root rescale. Batch 2**17, depth 12, width 512, document masking, dense value embeddings with the 128-channel gate, output softcap 10, rotary base 30000, WEIGHT_DECAY 0.2, FINAL_LR_FRAC 0.1 and WARMDOWN_RATIO 0.5 are unchanged.", "command": ["/usr/bin/python3", "/data3/zhubaiyu/fengheguai/fengheguai/rendezvous_agent.py", "--trial", "/data3/zhubaiyu/fengheguai/campaigns/h200-claude/nodes/t0056", "--result", "/data3/zhubaiyu/fengheguai/campaigns/h200-claude/nodes/t0056/.fengheguai-agent-result.json", "--schema", "/data3/zhubaiyu/fengheguai/campaigns/h200-claude/control/agent_output.schema.json", "--campaign", "/data3/zhubaiyu/fengheguai/campaigns/h200-claude", "--inbox", "/data3/zhubaiyu/fengheguai/campaigns/h200-claude-rendezvous"], "errors": [], "expected_val_bpb_effect": "Expected between a 0.002 decrease and a 0.001 increase versus champion t0053 at 0.971630, with step count unchanged since momentum costs nothing to compute. The asymmetry reflects that the current setting is not a tuned choice at this operating point but an artefact of the step count having nearly tripled since the constant was written, and that the axis it sits on is known to be steep.", "hypothesis": "Every schedule in this recipe is indexed by elapsed training time except one, and that one has silently drifted as the campaign changed the step count. get_lr_multiplier and get_weight_decay both take progress, which is total_training_time over TIME_BUDGET, so their shape is invariant to how many steps fit in 300 seconds. get_muon_momentum instead takes the raw step index and ramps momentum from 0.85 to 0.95 over the first 300 steps. At the original 1019 steps that warmup covered 29 percent of training; the champion now runs 2838 steps, so it covers 10.6 percent, and the model spends a far larger share of the run at high momentum than the recipe was tuned for. That matters because t0028 and t0029 showed momentum is one of the steepest axes here, with 0.98 costing 0.002361 and 0.92 costing 0.001053. Rescaling the warmup to 850 steps restores the original 30 percent fraction and should lower val_bpb.", "log_path": "/data3/zhubaiyu/fengheguai/campaigns/h200-claude/artifacts/t0056/agent.log", "return_code": 0, "risk": "Restoring the original fraction assumes 30 percent was itself tuned rather than incidental, which is not established; 300 may simply have been a round number. A longer ramp also means more of training runs at lower momentum, and since t0029 showed a lower terminal momentum of 0.92 costs 0.001053, spending 30 percent of the run below 0.95 could cost for the same reason. If this regresses, the informative reading is that high momentum early is actively good here rather than that the fraction does not matter, and the follow-up would be a shorter warmup rather than a different terminal value.", "success": true, "timed_out": false}, "secondary_parent_id": "t0054", "selection_reason": "Recombine two independently strong branches at the scheduled synthesis step.", "source_sha256": "d68dacc391a9b8f8cd022aa0defebd7f55fea9120b5e4fd3d576e41e0cca39a7", "stage": "recombine", "status": "discard", "training_seconds": 300.1, "trial_id": "t0056", "workspace": "/data3/zhubaiyu/fengheguai/campaigns/h200-claude/nodes/t0056"}, "prev_hash": "c84adcd7fb35b01bf69711459dbbf247fcbbfcb8b0353ea5d7a4f59a814b9d23", "seq": 114, "timestamp": "2026-08-20T22:10:43.542936+00:00"}
{"hash": "12bbb33d87395e664f8fc5662a31620ac6b2b49ea136007528a6244a11947e33", "kind": "trial_started", "payload": {"parent_id": "t0053", "reason": "The current line is stalled; make a structurally different bet.", "secondary_parent_id": null, "stage": "explore", "trial_id": "t0057"}, "prev_hash": "21c88bfacac1b58a71456c3b2a46ef667ef39f0ba3d9f3feaec8de5f527ae7b3", "seq": 115, "timestamp": "2026-08-20T22:10:43.575253+00:00"}
