{"hash": "3606345618124eb5030b210950e2b7246b8f36ae034a454968caa706cd55dc33", "kind": "trial_completed", "payload": {"champion_before": "t0017", "debug_depth": 0, "delta_vs_champion_before": 0.009150523610341965, "delta_vs_parent": 0.009150523610341965, "finding": "t0024 did not improve the prior champion: val_bpb=0.982521, delta=+0.009151. Hypothesis: This recipe has short skips and embedding skips but no long skips. Every layer already reads the token embedding through x0_lambdas, and every block has its residual path, but nothing carries mid-network representations forward: layer 11 cannot see what layer 0 computed except through eleven successive transformations. U-net style long skips address exactly this, pairing decoder layer i with encoder layer n_layer-1-i through a learned scalar, and they are a known win in the modded-nanogpt lineage this file descends from. At depth 12 the model is deep enough for the gap to matter, and depth is where this campaign found its largest gains, so giving the second half of the stack direct access to the first half should lower val_bpb.", "measurements": [{"command": ["/data/home/zhubaiyu/.local/bin/uv", "run", "--project", "/data3/zhubaiyu/fengheguai/campaigns/h200-claude/nodes/t0024", "python", "/data3/zhubaiyu/fengheguai/fengheguai/_audit_runner.py", "--target", "/data3/zhubaiyu/fengheguai/campaigns/h200-claude/nodes/t0024", "--nonce", "84421f69fc2c483f5960b281fe4ba6f6bf17f937d5df2028"], "errors": [], "evidence_path": "/data3/zhubaiyu/fengheguai/campaigns/h200-claude/evidence/t0024-r0/evidence.json", "evidence_sha256": "b0283cf2b88bc932ff41344a12655912d127a1a0fb369398e2826ed953985085", "log_path": "/data3/zhubaiyu/fengheguai/campaigns/h200-claude/evidence/t0024-r0/run.log", "log_sha256": "e69b049093ce382bba04f231071d68049deba764f756ddd0b7491b3fc94da215", "metric": 0.982521341457166, "num_steps": 1465, "peak_vram_mb": 66795.3, "return_code": 0, "status": "valid", "timed_out": false, "train_sha256": "0e437fa50d19c72b3b007e930d3f576d18c45727c2c650520787db1f5cf669f6", "training_seconds": 300.2, "wall_seconds": 572.0372905218974}], "metric": 0.982521341457166, "parent_id": "t0017", "patch_path": "/data3/zhubaiyu/fengheguai/campaigns/h200-claude/artifacts/t0024/change.patch", "patch_sha256": "01f67547b24186e9cd3208311efeae3ed0fb4ffe2fc924080d147aa3088a4f93", "promoted": false, "proposal": {"change_summary": "Architectural change on champion t0017: a new skip_lambdas parameter of length n_layer//2, zero-initialised, added to the optimizer as its own AdamW scalar group with the same settings as x0_lambdas. GPT.forward stores the output of each of the first 6 layers and adds skip_lambdas[i - 6] times the paired encoder output into the input of each of the last 6 layers, pairing layer 6 with 5 through layer 11 with 0. The parameter-count assertion, FLOP estimate and scaling-parameter report are updated to include the new scalars. Depth 12, width 512, document masking, dense value embeddings, batch 2**18, all learning rates, WEIGHT_DECAY 0.2 and every schedule are unchanged.", "command": ["/usr/bin/python3", "/data3/zhubaiyu/fengheguai/fengheguai/rendezvous_agent.py", "--trial", "/data3/zhubaiyu/fengheguai/campaigns/h200-claude/nodes/t0024", "--result", "/data3/zhubaiyu/fengheguai/campaigns/h200-claude/nodes/t0024/.fengheguai-agent-result.json", "--schema", "/data3/zhubaiyu/fengheguai/campaigns/h200-claude/control/agent_output.schema.json", "--campaign", "/data3/zhubaiyu/fengheguai/campaigns/h200-claude", "--inbox", "/data3/zhubaiyu/fengheguai/campaigns/h200-claude-rendezvous"], "errors": [], "expected_val_bpb_effect": "Expected decrease of roughly 0.001-0.004 bpb versus champion t0017 at 0.973371. Zero initialisation means the network is mathematically identical to the champion at step 0 and can only depart from it if the optimizer finds the skips useful, so the mechanism has a floor near parity minus whatever the extra activations cost in steps. That floor is the main reason to prefer zero init over the ones init used upstream.", "hypothesis": "This recipe has short skips and embedding skips but no long skips. Every layer already reads the token embedding through x0_lambdas, and every block has its residual path, but nothing carries mid-network representations forward: layer 11 cannot see what layer 0 computed except through eleven successive transformations. U-net style long skips address exactly this, pairing decoder layer i with encoder layer n_layer-1-i through a learned scalar, and they are a known win in the modded-nanogpt lineage this file descends from. At depth 12 the model is deep enough for the gap to matter, and depth is where this campaign found its largest gains, so giving the second half of the stack direct access to the first half should lower val_bpb.", "log_path": "/data3/zhubaiyu/fengheguai/campaigns/h200-claude/artifacts/t0024/agent.log", "return_code": 0, "risk": "Holding six layer outputs alive across the stack extends activation lifetimes, so peak VRAM rises from the 66.8GB the champion used, and on a shared box that is the likeliest failure mode; it should cost a few percent of steps at most. The zero init is also a genuine design choice with a downside: if the useful skip scale is large, the scalar group may not travel far enough within 300 seconds to show the mechanism working, so a null result would be ambiguous between the mechanism not helping and the init being too conservative.", "success": true, "timed_out": false}, "secondary_parent_id": null, "selection_reason": "The current line is stalled; make a structurally different bet.", "source_sha256": "0e437fa50d19c72b3b007e930d3f576d18c45727c2c650520787db1f5cf669f6", "stage": "explore", "status": "discard", "training_seconds": 300.2, "trial_id": "t0024", "workspace": "/data3/zhubaiyu/fengheguai/campaigns/h200-claude/nodes/t0024"}, "prev_hash": "43b44cf78f1b925dc03c95b8f3716444f5129443b3963b3f17a3da831bda8b63", "seq": 50, "timestamp": "2026-08-20T16:17:17.469543+00:00"}
{"hash": "468bda3223bd8f275f7b43322293abdf42108a457da5cbca719731471761cd80", "kind": "trial_started", "payload": {"parent_id": "t0017", "reason": "The current line is stalled; make a structurally different bet.", "secondary_parent_id": null, "stage": "explore", "trial_id": "t0025"}, "prev_hash": "3606345618124eb5030b210950e2b7246b8f36ae034a454968caa706cd55dc33", "seq": 51, "timestamp": "2026-08-20T16:17:17.485035+00:00"}
{"hash": "db03d1275959546a4cb6b30813aff60b8693302bc4848ee47fa55d25a6c882f6", "kind": "trial_completed", "payload": {"champion_before": "t0017", "debug_depth": 0, "delta_vs_champion_before": 0.0007353503915812354, "delta_vs_parent": 0.0007353503915812354, "finding": "t0025 did not improve the prior champion: val_bpb=0.974106, delta=+0.000735. Hypothesis: t0024 did not test the U-net skip mechanism; it tested a mis-parameterised version of it. The evidence is unambiguous: steps were 1465 against the champion 1470 and peak VRAM was 66795.3MB against 66795.6MB, so the skips cost no compute and the entire 0.009150 regression was a quality effect. The cause is the optimizer group I chose. This recipe treats its two scalar groups very differently, giving x0_lambdas the full scalar_lr of 0.5 and resid_lambdas only scalar_lr times 0.01, or 0.005. I gave a zero-initialised parameter the aggressive 0.5 rate, and because Adam normalises its step, a scalar starting at zero moves roughly 0.5 per step and reaches a magnitude of order ten within a hundred steps, which corrupts the residual stream it is added into. Rerunning the identical mechanism at the conservative 0.005 rate used for resid_lambdas should let the skips settle at a useful scale and lower val_bpb.", "measurements": [{"command": ["/data/home/zhubaiyu/.local/bin/uv", "run", "--project", "/data3/zhubaiyu/fengheguai/campaigns/h200-claude/nodes/t0025", "python", "/data3/zhubaiyu/fengheguai/fengheguai/_audit_runner.py", "--target", "/data3/zhubaiyu/fengheguai/campaigns/h200-claude/nodes/t0025", "--nonce", "591795081817cb78777b4fd9c28c659e1b2829d274ecd78c"], "errors": [], "evidence_path": "/data3/zhubaiyu/fengheguai/campaigns/h200-claude/evidence/t0025-r0/evidence.json", "evidence_sha256": "f11269dfc82f0b81ce9acbdd49ecb862e4de87adebd3e5ff3357bdab4303ce71", "log_path": "/data3/zhubaiyu/fengheguai/campaigns/h200-claude/evidence/t0025-r0/run.log", "log_sha256": "56b88ba7bb4cc72eae59d936baee31725b6872687038c310085cb7977af07e80", "metric": 0.9741061682384052, "num_steps": 1465, "peak_vram_mb": 66795.3, "return_code": 0, "status": "valid", "timed_out": false, "train_sha256": "0f9df483b3ea59071b2a029af2eb51b90ac5929ba4aed2471463507d6549bd23", "training_seconds": 300.0, "wall_seconds": 486.9393015773967}], "metric": 0.9741061682384052, "parent_id": "t0017", "patch_path": "/data3/zhubaiyu/fengheguai/campaigns/h200-claude/artifacts/t0025/change.patch", "patch_sha256": "21f6d23f65727d9995933c4859bb2b290ae2faba504336b942664a0ebfd8d62d", "promoted": false, "proposal": {"change_summary": "Same architectural change as t0024, with one difference: the skip_lambdas AdamW group now uses lr = scalar_lr * 0.01, matching how resid_lambdas is treated, instead of the full scalar_lr that x0_lambdas gets. A zero-initialised skip_lambdas of length n_layer//2 is added, GPT.forward stores the first 6 layer outputs and adds skip_lambdas[i-6] times the paired encoder output into each of the last 6 layers, and the parameter-count assertion, FLOP estimate and scaling report are updated. Depth 12, width 512, document masking, dense value embeddings, batch 2**18, all learning rates, WEIGHT_DECAY 0.2 and every schedule are unchanged from champion t0017.", "command": ["/usr/bin/python3", "/data3/zhubaiyu/fengheguai/fengheguai/rendezvous_agent.py", "--trial", "/data3/zhubaiyu/fengheguai/campaigns/h200-claude/nodes/t0025", "--result", "/data3/zhubaiyu/fengheguai/campaigns/h200-claude/nodes/t0025/.fengheguai-agent-result.json", "--schema", "/data3/zhubaiyu/fengheguai/campaigns/h200-claude/control/agent_output.schema.json", "--campaign", "/data3/zhubaiyu/fengheguai/campaigns/h200-claude", "--inbox", "/data3/zhubaiyu/fengheguai/campaigns/h200-claude-rendezvous"], "errors": [], "expected_val_bpb_effect": "Expected between a 0.003 decrease and parity versus champion t0017 at 0.973371. Zero init plus a slow rate means the mechanism is now genuinely floored near the champion, because the skips can only depart from zero as fast as 0.005 per step, so the downside is small and bounded. Over 1470 steps that still permits a displacement of several units if the gradient consistently favours the skips, so the rate is conservative without being inert.", "hypothesis": "t0024 did not test the U-net skip mechanism; it tested a mis-parameterised version of it. The evidence is unambiguous: steps were 1465 against the champion 1470 and peak VRAM was 66795.3MB against 66795.6MB, so the skips cost no compute and the entire 0.009150 regression was a quality effect. The cause is the optimizer group I chose. This recipe treats its two scalar groups very differently, giving x0_lambdas the full scalar_lr of 0.5 and resid_lambdas only scalar_lr times 0.01, or 0.005. I gave a zero-initialised parameter the aggressive 0.5 rate, and because Adam normalises its step, a scalar starting at zero moves roughly 0.5 per step and reaches a magnitude of order ten within a hundred steps, which corrupts the residual stream it is added into. Rerunning the identical mechanism at the conservative 0.005 rate used for resid_lambdas should let the skips settle at a useful scale and lower val_bpb.", "log_path": "/data3/zhubaiyu/fengheguai/campaigns/h200-claude/artifacts/t0025/agent.log", "return_code": 0, "risk": "The obvious objection is that this repeats a coordinate that just lost badly, and the defence has to be the diagnosis rather than the intent: identical step count and identical peak VRAM rule out throughput and memory, leaving the scalar rate as the only thing that differs between a mechanism that should be inert at initialisation and one that cost 0.009150. If this node also regresses, the mechanism itself is wrong for this architecture, not its parameterisation, and the U-net direction should be abandoned rather than tuned a third time.", "success": true, "timed_out": false}, "secondary_parent_id": null, "selection_reason": "The current line is stalled; make a structurally different bet.", "source_sha256": "0f9df483b3ea59071b2a029af2eb51b90ac5929ba4aed2471463507d6549bd23", "stage": "explore", "status": "discard", "training_seconds": 300.0, "trial_id": "t0025", "workspace": "/data3/zhubaiyu/fengheguai/campaigns/h200-claude/nodes/t0025"}, "prev_hash": "468bda3223bd8f275f7b43322293abdf42108a457da5cbca719731471761cd80", "seq": 52, "timestamp": "2026-08-20T16:26:54.940623+00:00"}
{"hash": "234875af7bd5e2f2d10db8894c1ffaf272a1e4f36f0cc5b94f266d81814d5752", "kind": "trial_started", "payload": {"parent_id": "t0017", "reason": "The current line is stalled; make a structurally different bet.", "secondary_parent_id": null, "stage": "explore", "trial_id": "t0026"}, "prev_hash": "db03d1275959546a4cb6b30813aff60b8693302bc4848ee47fa55d25a6c882f6", "seq": 53, "timestamp": "2026-08-20T16:26:54.956712+00:00"}
{"hash": "ecaa7c568cee4d258930ab3b088397070cbff7af6712a1abbdf3445789f3966a", "kind": "trial_completed", "payload": {"champion_before": "t0017", "debug_depth": 0, "delta_vs_champion_before": 0.0007580285106724149, "delta_vs_parent": 0.0007580285106724149, "finding": "t0026 did not improve the prior champion: val_bpb=0.974129, delta=+0.000758. Hypothesis: The schedule has only been probed on one side. t0020 lengthened the anneal from 0.5 to 0.8 of the time budget and lost 0.001467, which establishes that the constant-rate phase is doing necessary work but says nothing about whether 0.5 is the optimum or merely better than 0.8. The untested direction is a shorter anneal, which spends more of the budget at full rate and compresses the decay. That direction is also the one favoured by everything else this campaign found: the run is now 1470 steps at depth 12, fewer than the 2101 it had at depth 8, so there are fewer optimizer steps in which to make progress before annealing begins, which argues for a later start to the decay. Shortening WARMDOWN_RATIO to 0.35 should lower val_bpb, and together with the 0.8 measurement it brackets the axis either way.", "measurements": [{"command": ["/data/home/zhubaiyu/.local/bin/uv", "run", "--project", "/data3/zhubaiyu/fengheguai/campaigns/h200-claude/nodes/t0026", "python", "/data3/zhubaiyu/fengheguai/fengheguai/_audit_runner.py", "--target", "/data3/zhubaiyu/fengheguai/campaigns/h200-claude/nodes/t0026", "--nonce", "cdf6423f5092617b9ad530035f30cd1f517d695f18eb977d"], "errors": [], "evidence_path": "/data3/zhubaiyu/fengheguai/campaigns/h200-claude/evidence/t0026-r0/evidence.json", "evidence_sha256": "422f76d516a2d95cd35910603d717c13bd55a454409ae7d7076fdcf21df4649d", "log_path": "/data3/zhubaiyu/fengheguai/campaigns/h200-claude/evidence/t0026-r0/run.log", "log_sha256": "7e35fe2c4d257070982167a78210c93217765fb9f8e058fc12dab254ba1bc403", "metric": 0.9741288463574964, "num_steps": 1470, "peak_vram_mb": 66795.6, "return_code": 0, "status": "valid", "timed_out": false, "train_sha256": "05df2f081599c7b216007029ada087eea5cef0e7adcc8484f136a9fbed85d345", "training_seconds": 300.1, "wall_seconds": 486.2478806953877}], "metric": 0.9741288463574964, "parent_id": "t0017", "patch_path": "/data3/zhubaiyu/fengheguai/campaigns/h200-claude/artifacts/t0026/change.patch", "patch_sha256": "255d23a267b379579275fbf0e9bf3357916416d85c21b65be07b9259591e31e8", "promoted": false, "proposal": {"change_summary": "One constant changed on champion t0017: WARMDOWN_RATIO 0.5 to 0.35, so get_lr_multiplier holds the full rate until 65 percent of the time budget and then decays linearly to zero over the final 35 percent. WARMUP_RATIO stays 0.0 and FINAL_LR_FRAC stays 0.0, so the trajectory still starts at full rate and ends at exactly zero. The U-net skip mechanism from t0024 and t0025 is not carried forward. Depth 12, width 512, document masking, dense value embeddings, batch 2**18, all learning rates and WEIGHT_DECAY 0.2 are unchanged.", "command": ["/usr/bin/python3", "/data3/zhubaiyu/fengheguai/fengheguai/rendezvous_agent.py", "--trial", "/data3/zhubaiyu/fengheguai/campaigns/h200-claude/nodes/t0026", "--result", "/data3/zhubaiyu/fengheguai/campaigns/h200-claude/nodes/t0026/.fengheguai-agent-result.json", "--schema", "/data3/zhubaiyu/fengheguai/campaigns/h200-claude/control/agent_output.schema.json", "--campaign", "/data3/zhubaiyu/fengheguai/campaigns/h200-claude", "--inbox", "/data3/zhubaiyu/fengheguai/campaigns/h200-claude-rendezvous"], "errors": [], "expected_val_bpb_effect": "Expected between a 0.0015 decrease and a 0.0015 increase versus champion t0017 at 0.973371. The axis is genuinely two-sided and the inherited 0.5 may already be the optimum, in which case this completes a bracket with 0.35 and 0.8 both worse, which is the same shape of result that settled weight decay at 0.2. Step count should be unchanged since no FLOPs move.", "hypothesis": "The schedule has only been probed on one side. t0020 lengthened the anneal from 0.5 to 0.8 of the time budget and lost 0.001467, which establishes that the constant-rate phase is doing necessary work but says nothing about whether 0.5 is the optimum or merely better than 0.8. The untested direction is a shorter anneal, which spends more of the budget at full rate and compresses the decay. That direction is also the one favoured by everything else this campaign found: the run is now 1470 steps at depth 12, fewer than the 2101 it had at depth 8, so there are fewer optimizer steps in which to make progress before annealing begins, which argues for a later start to the decay. Shortening WARMDOWN_RATIO to 0.35 should lower val_bpb, and together with the 0.8 measurement it brackets the axis either way.", "log_path": "/data3/zhubaiyu/fengheguai/campaigns/h200-claude/artifacts/t0026/agent.log", "return_code": 0, "risk": "A shorter anneal gives the model less time at low rate to settle into a minimum, and final-loss quality in short-budget runs is usually sensitive to exactly that phase, so this could regress by as much as the long-anneal test did. The weight-decay schedule is again coupled through progress, so its decay compresses in the same way, which means a result here is a verdict on the joint schedule shape rather than on the rate trajectory alone. This node also closes out the U-net direction: t0025 recovered almost all of the t0024 loss, from 0.009150 down to 0.000735, confirming the scalar-rate diagnosis, but it still did not beat the champion, so the mechanism is being abandoned as pre-committed rather than tuned again.", "success": true, "timed_out": false}, "secondary_parent_id": null, "selection_reason": "The current line is stalled; make a structurally different bet.", "source_sha256": "05df2f081599c7b216007029ada087eea5cef0e7adcc8484f136a9fbed85d345", "stage": "explore", "status": "discard", "training_seconds": 300.1, "trial_id": "t0026", "workspace": "/data3/zhubaiyu/fengheguai/campaigns/h200-claude/nodes/t0026"}, "prev_hash": "234875af7bd5e2f2d10db8894c1ffaf272a1e4f36f0cc5b94f266d81814d5752", "seq": 54, "timestamp": "2026-08-20T16:36:23.715838+00:00"}
{"hash": "6da20ece07f3ae2fad9f3f052bbfe6b1583ec92f5cf278394710ad191433cf2b", "kind": "trial_started", "payload": {"parent_id": "t0017", "reason": "The current line is stalled; make a structurally different bet.", "secondary_parent_id": null, "stage": "explore", "trial_id": "t0027"}, "prev_hash": "ecaa7c568cee4d258930ab3b088397070cbff7af6712a1abbdf3445789f3966a", "seq": 55, "timestamp": "2026-08-20T16:36:23.732444+00:00"}
