{"hash": "61297aaf391d5afa6a1277230321b33e73e4c131bc71be178da4e7ca90cd7757", "kind": "trial_completed", "payload": {"champion_before": "t0017", "debug_depth": 0, "delta_vs_champion_before": 0.0001286566596576666, "delta_vs_parent": 0.0001286566596576666, "finding": "t0027 did not improve the prior champion: val_bpb=0.973499, delta=+0.000129. Hypothesis: The AdamW second-moment horizon is mismatched to the gradients it estimates. ADAM_BETAS is (0.8, 0.95), so beta2 averages squared gradients over roughly 20 steps, and it governs four groups of which three are embedding-like: lm_head, wte and the twelve value-embedding tables. Embedding gradients are sparse in a way matrix gradients are not, since a given row is touched only when its token appears in the batch, so its squared-gradient estimate is built from a handful of sporadic observations rather than a dense signal. A 20-step horizon makes that estimate noisy, and a noisy denominator produces effectively random per-row step sizes. This matters more here than in the original recipe because t0022 measured the value-embedding path as the most load-bearing mechanism in the model, worth 0.001806 at depth 12. Lengthening beta2 to 0.98, a roughly 50-step horizon, should stabilise those updates and lower val_bpb.", "measurements": [{"command": ["/data/home/zhubaiyu/.local/bin/uv", "run", "--project", "/data3/zhubaiyu/fengheguai/campaigns/h200-claude/nodes/t0027", "python", "/data3/zhubaiyu/fengheguai/fengheguai/_audit_runner.py", "--target", "/data3/zhubaiyu/fengheguai/campaigns/h200-claude/nodes/t0027", "--nonce", "ae897f7d9048cc65dcf86eca9cb5fc928c1f771565419958"], "errors": [], "evidence_path": "/data3/zhubaiyu/fengheguai/campaigns/h200-claude/evidence/t0027-r0/evidence.json", "evidence_sha256": "1b4f8778f5dca378b2217113a581d5ae28da1cb361a11c169c54e742203190a2", "log_path": "/data3/zhubaiyu/fengheguai/campaigns/h200-claude/evidence/t0027-r0/run.log", "log_sha256": "4b434061e28c0aafebdad7d0e018b2b821eb7fde3892c8b9e1d0c1443ccc9ce3", "metric": 0.9734994745064817, "num_steps": 1471, "peak_vram_mb": 66795.6, "return_code": 0, "status": "valid", "timed_out": false, "train_sha256": "26713af713c4862176ac4a44096b107caec56a2e32c61f4d97e4d58b565d1a4f", "training_seconds": 300.0, "wall_seconds": 486.34276912361383}], "metric": 0.9734994745064817, "parent_id": "t0017", "patch_path": "/data3/zhubaiyu/fengheguai/campaigns/h200-claude/artifacts/t0027/change.patch", "patch_sha256": "bd40c873da0df577cd4e20d38b517af0aec1575b8c9a3b47a739fbdf9e544b21", "promoted": false, "proposal": {"change_summary": "One constant changed on champion t0017: ADAM_BETAS from (0.8, 0.95) to (0.8, 0.98), leaving beta1 untouched. This affects the four groups that pass adam_betas through setup_optimizer: lm_head, wte, the value embeddings and resid_lambdas. The x0_lambdas group is unaffected because it hardcodes its own (0.96, 0.95). Muon and its separate NorMuon beta2 of 0.95 are untouched, as are depth 12, width 512, document masking, dense value embeddings, batch 2**18, all learning rates, WEIGHT_DECAY 0.2 and every schedule.", "command": ["/usr/bin/python3", "/data3/zhubaiyu/fengheguai/fengheguai/rendezvous_agent.py", "--trial", "/data3/zhubaiyu/fengheguai/campaigns/h200-claude/nodes/t0027", "--result", "/data3/zhubaiyu/fengheguai/campaigns/h200-claude/nodes/t0027/.fengheguai-agent-result.json", "--schema", "/data3/zhubaiyu/fengheguai/campaigns/h200-claude/control/agent_output.schema.json", "--campaign", "/data3/zhubaiyu/fengheguai/campaigns/h200-claude", "--inbox", "/data3/zhubaiyu/fengheguai/campaigns/h200-claude-rendezvous"], "errors": [], "expected_val_bpb_effect": "Expected decrease of roughly 0.0005-0.002 bpb versus champion t0017 at 0.973371. The bias-correction term in adamw_step_fused divides by 1 - beta2**step, so the longer horizon is correctly compensated at the start of training and the change should not distort early steps. An increase would indicate the short horizon is deliberately tracking a fast-moving gradient scale, which would be informative given how much of this model is embedding parameters.", "hypothesis": "The AdamW second-moment horizon is mismatched to the gradients it estimates. ADAM_BETAS is (0.8, 0.95), so beta2 averages squared gradients over roughly 20 steps, and it governs four groups of which three are embedding-like: lm_head, wte and the twelve value-embedding tables. Embedding gradients are sparse in a way matrix gradients are not, since a given row is touched only when its token appears in the batch, so its squared-gradient estimate is built from a handful of sporadic observations rather than a dense signal. A 20-step horizon makes that estimate noisy, and a noisy denominator produces effectively random per-row step sizes. This matters more here than in the original recipe because t0022 measured the value-embedding path as the most load-bearing mechanism in the model, worth 0.001806 at depth 12. Lengthening beta2 to 0.98, a roughly 50-step horizon, should stabilise those updates and lower val_bpb.", "log_path": "/data3/zhubaiyu/fengheguai/campaigns/h200-claude/artifacts/t0027/agent.log", "return_code": 0, "risk": "Beta2 is shared across four groups rather than isolated to the embeddings, so a win would not be attributable to the sparse-gradient argument alone; lm_head is dense and might prefer the shorter horizon, and a null could be two effects cancelling. If this direction shows promise the clean follow-up is to give the value-embedding group its own betas, which is straightforward now that t0023 already added a per-group rate argument to setup_optimizer. Nine consecutive discards also mean the recipe is close to a strong local optimum, so the realistic expectation for any single remaining knob is small.", "success": true, "timed_out": false}, "secondary_parent_id": null, "selection_reason": "The current line is stalled; make a structurally different bet.", "source_sha256": "26713af713c4862176ac4a44096b107caec56a2e32c61f4d97e4d58b565d1a4f", "stage": "explore", "status": "discard", "training_seconds": 300.0, "trial_id": "t0027", "workspace": "/data3/zhubaiyu/fengheguai/campaigns/h200-claude/nodes/t0027"}, "prev_hash": "6da20ece07f3ae2fad9f3f052bbfe6b1583ec92f5cf278394710ad191433cf2b", "seq": 56, "timestamp": "2026-08-20T16:45:34.589789+00:00"}
{"hash": "9e47b249df603c2d5b654a499f2ead92d99714375dcc6f9d8e5176ef11c98e19", "kind": "trial_started", "payload": {"parent_id": "t0017", "reason": "Recombine two independently strong branches at the scheduled synthesis step.", "secondary_parent_id": "t0016", "stage": "recombine", "trial_id": "t0028"}, "prev_hash": "61297aaf391d5afa6a1277230321b33e73e4c131bc71be178da4e7ca90cd7757", "seq": 57, "timestamp": "2026-08-20T16:45:34.606788+00:00"}
{"hash": "622f3dd4334d6a80055acd3e40b2dedc1a8d55e0732388306d9e47be7470f30f", "kind": "trial_completed", "payload": {"champion_before": "t0017", "debug_depth": 0, "delta_vs_champion_before": 0.002361087721135635, "delta_vs_parent": 0.002361087721135635, "finding": "t0028 did not improve the prior champion: val_bpb=0.975732, delta=+0.002361. Hypothesis: The two elite lines jointly say that depth 12 is the right capacity and that the Muon learning rate is flat there, since t0016 at 0.02828 and t0017 at 0.0231 produced overlapping runs. That flatness is the useful part: it means step size is not what limits the Muon path, so if the optimizer for the bulk of the model can still be improved it has to be through its other knob, momentum, which no node has touched. Muon orthogonalises the momentum buffer rather than the raw gradient, so momentum directly sets how much gradient averaging happens before the update direction is computed, and a noisier buffer yields a less reliable orthogonal direction. The schedule ramps momentum from 0.85 to a terminal 0.95 over the first 300 steps and then holds it. Raising that terminal value to 0.98 lengthens the averaging window from roughly 20 to 50 gradients and should produce cleaner update directions and a lower val_bpb.", "measurements": [{"command": ["/data/home/zhubaiyu/.local/bin/uv", "run", "--project", "/data3/zhubaiyu/fengheguai/campaigns/h200-claude/nodes/t0028", "python", "/data3/zhubaiyu/fengheguai/fengheguai/_audit_runner.py", "--target", "/data3/zhubaiyu/fengheguai/campaigns/h200-claude/nodes/t0028", "--nonce", "7ee40dc6d79076f7a0be447c60e653f30c4f29fcb57e5155"], "errors": [], "evidence_path": "/data3/zhubaiyu/fengheguai/campaigns/h200-claude/evidence/t0028-r0/evidence.json", "evidence_sha256": "64d0cf8bf0faee366bde6529b3d05b41dbddc76a592ac662cf4e4e69d94294c7", "log_path": "/data3/zhubaiyu/fengheguai/campaigns/h200-claude/evidence/t0028-r0/run.log", "log_sha256": "5f896ca562793987332d33ea9ba2f34e4df533ba1b8c01ddee4a85ef2ca0d6cf", "metric": 0.9757319055679596, "num_steps": 1473, "peak_vram_mb": 66795.6, "return_code": 0, "status": "valid", "timed_out": false, "train_sha256": "c2daa341fada7f55088789e60f8d81a46d0914466b2df8cc0e9a9d667706ad6e", "training_seconds": 300.2, "wall_seconds": 486.44437720347196}], "metric": 0.9757319055679596, "parent_id": "t0017", "patch_path": "/data3/zhubaiyu/fengheguai/campaigns/h200-claude/artifacts/t0028/change.patch", "patch_sha256": "10fcac674422c22dfe83575c9e1ea031725e9644534f2232070e26fb1fc4bceb", "promoted": false, "proposal": {"change_summary": "One value changed on champion t0017: the terminal constant in get_muon_momentum from 0.95 to 0.98, so momentum still warms up from 0.85 across the first 300 steps but settles at 0.98 for the remainder of the run. The NorMuon second-moment beta2, which is a separate 0.95 set in setup_optimizer, is deliberately not touched, nor is MATRIX_LR at 0.0231. Depth 12, width 512, document masking, dense value embeddings, batch 2**18, the Adam betas, WEIGHT_DECAY 0.2 and every schedule are unchanged.", "command": ["/usr/bin/python3", "/data3/zhubaiyu/fengheguai/fengheguai/rendezvous_agent.py", "--trial", "/data3/zhubaiyu/fengheguai/campaigns/h200-claude/nodes/t0028", "--result", "/data3/zhubaiyu/fengheguai/campaigns/h200-claude/nodes/t0028/.fengheguai-agent-result.json", "--schema", "/data3/zhubaiyu/fengheguai/campaigns/h200-claude/control/agent_output.schema.json", "--campaign", "/data3/zhubaiyu/fengheguai/campaigns/h200-claude", "--inbox", "/data3/zhubaiyu/fengheguai/campaigns/h200-claude-rendezvous"], "errors": [], "expected_val_bpb_effect": "Expected between a 0.002 decrease and a 0.001 increase versus champion t0017 at 0.973371. Step count should be unchanged since momentum costs nothing extra to apply. The asymmetry in the expectation reflects that momentum is usually under-set rather than over-set in short runs, but 0.98 is a large jump and the honest possibility is that averaging over 50 gradients makes the direction stale during the anneal, when the loss surface is changing fastest.", "hypothesis": "The two elite lines jointly say that depth 12 is the right capacity and that the Muon learning rate is flat there, since t0016 at 0.02828 and t0017 at 0.0231 produced overlapping runs. That flatness is the useful part: it means step size is not what limits the Muon path, so if the optimizer for the bulk of the model can still be improved it has to be through its other knob, momentum, which no node has touched. Muon orthogonalises the momentum buffer rather than the raw gradient, so momentum directly sets how much gradient averaging happens before the update direction is computed, and a noisier buffer yields a less reliable orthogonal direction. The schedule ramps momentum from 0.85 to a terminal 0.95 over the first 300 steps and then holds it. Raising that terminal value to 0.98 lengthens the averaging window from roughly 20 to 50 gradients and should produce cleaner update directions and a lower val_bpb.", "log_path": "/data3/zhubaiyu/fengheguai/campaigns/h200-claude/artifacts/t0028/agent.log", "return_code": 0, "risk": "Higher momentum interacts with the annealing phase in a way this single node cannot separate: as the rate decays toward zero over the final half of the budget, a longer averaging window keeps the update direction anchored to older gradients precisely when the model should be settling, so a regression would be ambiguous between too much momentum overall and too much momentum late. If it regresses, the informative follow-up is a momentum schedule that decays late rather than a lower constant. Ten consecutive discards also mean the realistic expectation for any remaining single knob is small, and this node is being spent because it is the one Muon control never examined, not because a large gain is likely.", "success": true, "timed_out": false}, "secondary_parent_id": "t0016", "selection_reason": "Recombine two independently strong branches at the scheduled synthesis step.", "source_sha256": "c2daa341fada7f55088789e60f8d81a46d0914466b2df8cc0e9a9d667706ad6e", "stage": "recombine", "status": "discard", "training_seconds": 300.2, "trial_id": "t0028", "workspace": "/data3/zhubaiyu/fengheguai/campaigns/h200-claude/nodes/t0028"}, "prev_hash": "9e47b249df603c2d5b654a499f2ead92d99714375dcc6f9d8e5176ef11c98e19", "seq": 58, "timestamp": "2026-08-20T16:54:47.570502+00:00"}
{"hash": "499f20e142da0ab896af994b5af2fa95f2332b633db828b6ad9aa4bcba00f5bf", "kind": "trial_started", "payload": {"parent_id": "t0017", "reason": "The current line is stalled; make a structurally different bet.", "secondary_parent_id": null, "stage": "explore", "trial_id": "t0029"}, "prev_hash": "622f3dd4334d6a80055acd3e40b2dedc1a8d55e0732388306d9e47be7470f30f", "seq": 59, "timestamp": "2026-08-20T16:54:47.588051+00:00"}
{"hash": "dcda35ae906247e8cca863ab74f4bd0f0574e378233be036a2a151f0af45672c", "kind": "trial_completed", "payload": {"champion_before": "t0017", "debug_depth": 0, "delta_vs_champion_before": 0.0010519260716003176, "delta_vs_parent": 0.0010519260716003176, "finding": "t0029 did not improve the prior champion: val_bpb=0.974423, delta=+0.001052. Hypothesis: Muon momentum is one of the steepest axes measured in this campaign and only one side of it is known. Raising the terminal momentum from 0.95 to 0.98 in t0028 cost 0.002361, which is comparable to the weight-decay gradient and roughly eighteen times the repeat-noise level, so this control has real leverage even though the inherited value may already be near optimal. The same reasoning that worked for weight decay applies: when a single measurement shows a steep response, the opposite direction is worth one node because the optimum need not sit exactly at the inherited default. Lowering the terminal momentum to 0.92, a roughly 12-gradient averaging window instead of 20, tests whether shorter averaging suits a run whose loss surface changes quickly through a 300-second budget.", "measurements": [{"command": ["/data/home/zhubaiyu/.local/bin/uv", "run", "--project", "/data3/zhubaiyu/fengheguai/campaigns/h200-claude/nodes/t0029", "python", "/data3/zhubaiyu/fengheguai/fengheguai/_audit_runner.py", "--target", "/data3/zhubaiyu/fengheguai/campaigns/h200-claude/nodes/t0029", "--nonce", "281d8d89cb83693f550ed3c74b8d10ab4121bf5d6d4535d1"], "errors": [], "evidence_path": "/data3/zhubaiyu/fengheguai/campaigns/h200-claude/evidence/t0029-r0/evidence.json", "evidence_sha256": "2b987f7cabca5c02b498a4c61012679fb4b9ab6a2f3685b9adea5b83a4478cc1", "log_path": "/data3/zhubaiyu/fengheguai/campaigns/h200-claude/evidence/t0029-r0/run.log", "log_sha256": "73e59243403997166a4bc09e2219d79da0b437fbb87a6f7a68a1db28c09b0277", "metric": 0.9744227439184243, "num_steps": 1470, "peak_vram_mb": 66795.6, "return_code": 0, "status": "valid", "timed_out": false, "train_sha256": "7b2ecb06aff42e1e12b7866ee5d670d754b3f65db5509b80ece5300127a50acf", "training_seconds": 300.2, "wall_seconds": 485.139088450931}], "metric": 0.9744227439184243, "parent_id": "t0017", "patch_path": "/data3/zhubaiyu/fengheguai/campaigns/h200-claude/artifacts/t0029/change.patch", "patch_sha256": "48bfd3ac517bcafdaba308a9e847500f722aa512270c6ee4d4add803eb9f402d", "promoted": false, "proposal": {"change_summary": "One value changed on champion t0017: the terminal constant in get_muon_momentum from 0.95 to 0.92, with the 0.85 starting value and the 300-step warmup ramp untouched. The NorMuon second-moment beta2 of 0.95 in setup_optimizer is a separate quantity and is not changed, nor is MATRIX_LR at 0.0231. Depth 12, width 512, document masking, dense value embeddings, batch 2**18, Adam betas, WEIGHT_DECAY 0.2 and every schedule are unchanged.", "command": ["/usr/bin/python3", "/data3/zhubaiyu/fengheguai/fengheguai/rendezvous_agent.py", "--trial", "/data3/zhubaiyu/fengheguai/campaigns/h200-claude/nodes/t0029", "--result", "/data3/zhubaiyu/fengheguai/campaigns/h200-claude/nodes/t0029/.fengheguai-agent-result.json", "--schema", "/data3/zhubaiyu/fengheguai/campaigns/h200-claude/control/agent_output.schema.json", "--campaign", "/data3/zhubaiyu/fengheguai/campaigns/h200-claude", "--inbox", "/data3/zhubaiyu/fengheguai/campaigns/h200-claude-rendezvous"], "errors": [], "expected_val_bpb_effect": "Expected between a 0.001 decrease and a 0.002 increase versus champion t0017 at 0.973371. If momentum is simply under-set upward and the response is one-sided, this regresses and the axis closes with a bracket at 0.95, which is the same result shape that settled weight decay at 0.2 and the warmdown at 0.5. If the response is genuinely two-sided with a minimum below 0.95, this is one of the few remaining chances at a real gain.", "hypothesis": "Muon momentum is one of the steepest axes measured in this campaign and only one side of it is known. Raising the terminal momentum from 0.95 to 0.98 in t0028 cost 0.002361, which is comparable to the weight-decay gradient and roughly eighteen times the repeat-noise level, so this control has real leverage even though the inherited value may already be near optimal. The same reasoning that worked for weight decay applies: when a single measurement shows a steep response, the opposite direction is worth one node because the optimum need not sit exactly at the inherited default. Lowering the terminal momentum to 0.92, a roughly 12-gradient averaging window instead of 20, tests whether shorter averaging suits a run whose loss surface changes quickly through a 300-second budget.", "log_path": "/data3/zhubaiyu/fengheguai/campaigns/h200-claude/artifacts/t0029/agent.log", "return_code": 0, "risk": "Eleven consecutive discards say the recipe is at a strong local optimum and that the prior probability of any single remaining knob winning is low, so this node is justified by the steepness of the measured gradient rather than by optimism. A specific limitation is that the terminal momentum and the warmup ramp are coupled in one function: lowering the terminal value also flattens the ramp, since it starts at 0.85 and now climbs only to 0.92, so a result here is a verdict on the whole momentum trajectory rather than on its final value alone.", "success": true, "timed_out": false}, "secondary_parent_id": null, "selection_reason": "The current line is stalled; make a structurally different bet.", "source_sha256": "7b2ecb06aff42e1e12b7866ee5d670d754b3f65db5509b80ece5300127a50acf", "stage": "explore", "status": "discard", "training_seconds": 300.2, "trial_id": "t0029", "workspace": "/data3/zhubaiyu/fengheguai/campaigns/h200-claude/nodes/t0029"}, "prev_hash": "499f20e142da0ab896af994b5af2fa95f2332b633db828b6ad9aa4bcba00f5bf", "seq": 60, "timestamp": "2026-08-20T17:04:25.245384+00:00"}
{"hash": "ce7613e9dbe3e749167fbca1c94df02cb7f575901d91bf0a2ed822e5c6c44fb3", "kind": "trial_started", "payload": {"parent_id": "t0017", "reason": "The current line is stalled; make a structurally different bet.", "secondary_parent_id": null, "stage": "explore", "trial_id": "t0030"}, "prev_hash": "dcda35ae906247e8cca863ab74f4bd0f0574e378233be036a2a151f0af45672c", "seq": 61, "timestamp": "2026-08-20T17:04:25.263378+00:00"}
