{"hash": "2951b4f6c57492449f22e307bd0183bf40f7146aca39c915ecc06dfe1ca56548", "kind": "trial_completed", "payload": {"champion_before": "t0053", "debug_depth": 0, "delta_vs_champion_before": 0.0008733450689543121, "delta_vs_parent": 0.0008733450689543121, "finding": "t0063 did not improve the prior champion: val_bpb=0.972504, delta=+0.000873. Hypothesis: Both elite lines converge on one principle, that this recipe wants its per-layer control quantities to move fast and early, and the scalar rate is the one place that principle has only been tested downward. t0057 and its parent established the momentum half: stretching the Muon momentum warmup to 850 steps cost 0.001071 while the inherited 300 held, so reaching terminal momentum early is actively valuable. t0062 then established the scalar half from the other side: halving SCALAR_LR to 0.25 cost 0.002821, one of the larger single-knob regressions in this campaign, so the per-layer scalars are hurt by moving slower. The synthesis is that the axis is steep and has been probed on only one side, exactly the situation where t0036 and t0037 found this campaign its single suboptimal default. Doubling SCALAR_LR to 1.0 tests whether 0.5 is the optimum or merely better than 0.25.", "measurements": [{"command": ["/data/home/zhubaiyu/.local/bin/uv", "run", "--project", "/data3/zhubaiyu/fengheguai/campaigns/h200-claude/nodes/t0063", "python", "/data3/zhubaiyu/fengheguai/fengheguai/_audit_runner.py", "--target", "/data3/zhubaiyu/fengheguai/campaigns/h200-claude/nodes/t0063", "--nonce", "770e9a03e8893a2d60f6717bc3a24b8a1d916cc85e15a617"], "errors": [], "evidence_path": "/data3/zhubaiyu/fengheguai/campaigns/h200-claude/evidence/t0063-r0/evidence.json", "evidence_sha256": "cd33fae99eae975a6be95be58959dde0c16e2efc4b9b73c95dd9d3768d634305", "log_path": "/data3/zhubaiyu/fengheguai/campaigns/h200-claude/evidence/t0063-r0/run.log", "log_sha256": "84066bfd54e4b0cd8474f70aab300201535c02fbb5b733ff3a10adc8be890762", "metric": 0.9725036548150298, "num_steps": 2836, "peak_vram_mb": 33800.4, "return_code": 0, "status": "valid", "timed_out": false, "train_sha256": "c89f6e97faa63c89a740f68a02a216eedcc3fd9299db0d0a70dfe2c70f93e597", "training_seconds": 300.1, "wall_seconds": 488.1889707967639}], "metric": 0.9725036548150298, "parent_id": "t0053", "patch_path": "/data3/zhubaiyu/fengheguai/campaigns/h200-claude/artifacts/t0063/change.patch", "patch_sha256": "865a379ca0aa4b153a3c33239a06ae777f009948a19f8265dfdf1e642afa02b0", "promoted": false, "proposal": {"change_summary": "One constant changed on champion t0053: SCALAR_LR from 0.5 to 1.0, which doubles the rate for both scalar groups, x0_lambdas from 0.5 to 1.0 and resid_lambdas from 0.005 to 0.01 since the latter is defined as scalar_lr times 0.01. No other group moves: EMBEDDING_LR stays 0.6, UNEMBEDDING_LR 0.002, MATRIX_LR 0.0163. The momentum warmup stays at the inherited 300 steps that both elites support. Batch 2**17, depth 12, width 512, document masking, dense value embeddings with the 128-channel gate, output softcap 10, rotary base 30000, WEIGHT_DECAY 0.2, FINAL_LR_FRAC 0.1 and WARMDOWN_RATIO 0.5 are unchanged.", "command": ["/usr/bin/python3", "/data3/zhubaiyu/fengheguai/fengheguai/rendezvous_agent.py", "--trial", "/data3/zhubaiyu/fengheguai/campaigns/h200-claude/nodes/t0063", "--result", "/data3/zhubaiyu/fengheguai/campaigns/h200-claude/nodes/t0063/.fengheguai-agent-result.json", "--schema", "/data3/zhubaiyu/fengheguai/campaigns/h200-claude/control/agent_output.schema.json", "--campaign", "/data3/zhubaiyu/fengheguai/campaigns/h200-claude", "--inbox", "/data3/zhubaiyu/fengheguai/campaigns/h200-claude-rendezvous"], "errors": [], "expected_val_bpb_effect": "Expected between a 0.001 decrease and a 0.002 increase versus champion t0053 at 0.971630, with step count unchanged. Either result closes the axis with a three-point bracket, which is the shape that settled weight decay, warmdown, momentum and gate width. A gain would be the more surprising outcome and would suggest the x0 scalars are still rate-limited even at 0.5.", "hypothesis": "Both elite lines converge on one principle, that this recipe wants its per-layer control quantities to move fast and early, and the scalar rate is the one place that principle has only been tested downward. t0057 and its parent established the momentum half: stretching the Muon momentum warmup to 850 steps cost 0.001071 while the inherited 300 held, so reaching terminal momentum early is actively valuable. t0062 then established the scalar half from the other side: halving SCALAR_LR to 0.25 cost 0.002821, one of the larger single-knob regressions in this campaign, so the per-layer scalars are hurt by moving slower. The synthesis is that the axis is steep and has been probed on only one side, exactly the situation where t0036 and t0037 found this campaign its single suboptimal default. Doubling SCALAR_LR to 1.0 tests whether 0.5 is the optimum or merely better than 0.25.", "log_path": "/data3/zhubaiyu/fengheguai/campaigns/h200-claude/artifacts/t0063/agent.log", "return_code": 0, "risk": "I stated in t0062 that a regression there would settle this axis and that I would not test 1.0, and this node deliberately departs from that. The reason is that the stated basis for stopping was that the jitter argument only motivated the downward direction, and the measurement has since supplied an empirical motivation for the upward one that did not exist when I wrote it; I would rather record the revision than follow a commitment whose premise the evidence removed. The countervailing risk is real: at 1.0 an Adam step can move an x0 scalar by ten times its 0.1 initialisation, and if those scalars overshoot into large values the residual stream sees the token embedding injected far more strongly than the architecture intends, which would show up as a clear regression rather than a marginal one.", "success": true, "timed_out": false}, "secondary_parent_id": "t0057", "selection_reason": "Recombine two independently strong branches at the scheduled synthesis step.", "source_sha256": "c89f6e97faa63c89a740f68a02a216eedcc3fd9299db0d0a70dfe2c70f93e597", "stage": "recombine", "status": "discard", "training_seconds": 300.1, "trial_id": "t0063", "workspace": "/data3/zhubaiyu/fengheguai/campaigns/h200-claude/nodes/t0063"}, "prev_hash": "b8b8b249264ab9f00dee9a04664260e5fb7fc89ad027f3293afec6ac35793c37", "seq": 128, "timestamp": "2026-08-20T23:23:21.691624+00:00"}
{"hash": "5a8504b5448dd439a35972d75b8eeb52f2b7baa301b815f7d395b17da3e34f99", "kind": "trial_started", "payload": {"parent_id": "t0053", "reason": "The current line is stalled; make a structurally different bet.", "secondary_parent_id": null, "stage": "explore", "trial_id": "t0064"}, "prev_hash": "2951b4f6c57492449f22e307bd0183bf40f7146aca39c915ecc06dfe1ca56548", "seq": 129, "timestamp": "2026-08-20T23:23:21.727886+00:00"}
{"hash": "1e77efa270878caa8c1f0dc839df9ff200ea9273d86fd4748badd870931ed112", "kind": "trial_completed", "payload": {"champion_before": "t0053", "debug_depth": 0, "delta_vs_champion_before": 0.0069858627984346056, "delta_vs_parent": 0.0069858627984346056, "finding": "t0064 did not improve the prior champion: val_bpb=0.978616, delta=+0.006986. Hypothesis: The head-granularity axis was measured on one side only and the untested side is free. t0006 halved HEAD_DIM to 64, giving 8 heads instead of 4, and lost 0.001989 with the step count almost unchanged at 3957 against 4078, so the loss was quality rather than throughput and wider heads beat narrower ones at this width. The opposite direction has never been tried. Because build_model_config derives n_head as model_dim over HEAD_DIM, setting HEAD_DIM to 256 gives 2 heads of width 256 while n_head times head_dim stays 512, so every projection keeps its shape, the parameter count is unchanged, and the FLOP model 12*n_head*head_dim*window is identical. The only thing that changes is how the 512 channels are partitioned into attention subspaces. If the t0006 trend continues, fewer and wider heads should lower val_bpb at no cost.", "measurements": [{"command": ["/data/home/zhubaiyu/.local/bin/uv", "run", "--project", "/data3/zhubaiyu/fengheguai/campaigns/h200-claude/nodes/t0064", "python", "/data3/zhubaiyu/fengheguai/fengheguai/_audit_runner.py", "--target", "/data3/zhubaiyu/fengheguai/campaigns/h200-claude/nodes/t0064", "--nonce", "9a1f6f2fdb3fbd12db5ad9e04bb6b5539fea96f2ed44121e"], "errors": [], "evidence_path": "/data3/zhubaiyu/fengheguai/campaigns/h200-claude/evidence/t0064-r0/evidence.json", "evidence_sha256": "cf9202b7ad11488d8a0dc7ae17ea154ce8430807073848dd6cbb665140edd385", "log_path": "/data3/zhubaiyu/fengheguai/campaigns/h200-claude/evidence/t0064-r0/run.log", "log_sha256": "8305841e57a6f3ac8f9056acfbfdb6a776faf426593a07b0df5bfb9463cd9a12", "metric": 0.97861617254451, "num_steps": 2806, "peak_vram_mb": 33763.3, "return_code": 0, "status": "valid", "timed_out": false, "train_sha256": "274dc2c33b5780a2e224bef85bef5576889fcc43ff4abcb170d0c5eed721b5bc", "training_seconds": 300.1, "wall_seconds": 567.1444466952235}], "metric": 0.97861617254451, "parent_id": "t0053", "patch_path": "/data3/zhubaiyu/fengheguai/campaigns/h200-claude/artifacts/t0064/change.patch", "patch_sha256": "366bd3fe60bd6876a87a716dc8ee6aec2293cbc8ebd87a4cd0d9b89780493ca9", "promoted": false, "proposal": {"change_summary": "One constant changed on champion t0053: HEAD_DIM from 128 to 256, so build_model_config produces n_head = n_kv_head = 2 at an unchanged model_dim of 512. Parameter count, per-token FLOPs and the value-embedding width all stay the same, since kv_dim is n_kv_head times head_dim and remains 512. Rotary now covers 128 channel pairs per head instead of 64. Batch 2**17, depth 12, document masking, dense value embeddings with the 128-channel gate, output softcap 10, rotary base 30000, the three settled learning rates, SCALAR_LR 0.5, WEIGHT_DECAY 0.2, FINAL_LR_FRAC 0.1 and WARMDOWN_RATIO 0.5 are unchanged.", "command": ["/usr/bin/python3", "/data3/zhubaiyu/fengheguai/fengheguai/rendezvous_agent.py", "--trial", "/data3/zhubaiyu/fengheguai/campaigns/h200-claude/nodes/t0064", "--result", "/data3/zhubaiyu/fengheguai/campaigns/h200-claude/nodes/t0064/.fengheguai-agent-result.json", "--schema", "/data3/zhubaiyu/fengheguai/campaigns/h200-claude/control/agent_output.schema.json", "--campaign", "/data3/zhubaiyu/fengheguai/campaigns/h200-claude", "--inbox", "/data3/zhubaiyu/fengheguai/campaigns/h200-claude-rendezvous"], "errors": [], "expected_val_bpb_effect": "Expected between a 0.002 decrease and a 0.003 increase versus champion t0053 at 0.971630, with step count essentially unchanged. Two heads is few for a 12-layer model and the trend from a single point is weak evidence for extrapolation, so the honest reading is that this brackets the axis rather than that it is likely to win: 64 measured worse, and if 256 also measures worse then 128 is confirmed optimal and the partitioning question is closed.", "hypothesis": "The head-granularity axis was measured on one side only and the untested side is free. t0006 halved HEAD_DIM to 64, giving 8 heads instead of 4, and lost 0.001989 with the step count almost unchanged at 3957 against 4078, so the loss was quality rather than throughput and wider heads beat narrower ones at this width. The opposite direction has never been tried. Because build_model_config derives n_head as model_dim over HEAD_DIM, setting HEAD_DIM to 256 gives 2 heads of width 256 while n_head times head_dim stays 512, so every projection keeps its shape, the parameter count is unchanged, and the FLOP model 12*n_head*head_dim*window is identical. The only thing that changes is how the 512 channels are partitioned into attention subspaces. If the t0006 trend continues, fewer and wider heads should lower val_bpb at no cost.", "log_path": "/data3/zhubaiyu/fengheguai/campaigns/h200-claude/artifacts/t0064/agent.log", "return_code": 0, "risk": "The specific failure risk is kernel support rather than modelling: flash-attention-3 on Hopper supports head dimensions up to 256, so this should be at the edge of what the kernel accepts, and if it is unsupported the node fails with a kernel error rather than a regression, which the debug stage would then repair by reverting. There is also a real modelling concern that two heads cannot represent enough distinct attention patterns per layer, particularly given that nine of twelve layers use a 512-token window where several specialised local patterns are plausible.", "success": true, "timed_out": false}, "secondary_parent_id": null, "selection_reason": "The current line is stalled; make a structurally different bet.", "source_sha256": "274dc2c33b5780a2e224bef85bef5576889fcc43ff4abcb170d0c5eed721b5bc", "stage": "explore", "status": "discard", "training_seconds": 300.1, "trial_id": "t0064", "workspace": "/data3/zhubaiyu/fengheguai/campaigns/h200-claude/nodes/t0064"}, "prev_hash": "5a8504b5448dd439a35972d75b8eeb52f2b7baa301b815f7d395b17da3e34f99", "seq": 130, "timestamp": "2026-08-20T23:34:07.393800+00:00"}
{"hash": "1870497b4c467dec5264c019f5a0e9b8e348c0380d1c9a113adfa95067b03424", "kind": "trial_started", "payload": {"parent_id": "t0053", "reason": "The current line is stalled; make a structurally different bet.", "secondary_parent_id": null, "stage": "explore", "trial_id": "t0065"}, "prev_hash": "1e77efa270878caa8c1f0dc839df9ff200ea9273d86fd4748badd870931ed112", "seq": 131, "timestamp": "2026-08-20T23:34:07.430375+00:00"}
{"hash": "9de551047719442c2e5b534a473232c2ccebda261d0ec4c4c8e33d6fda2b14aa", "kind": "trial_completed", "payload": {"champion_before": "t0053", "debug_depth": 0, "delta_vs_champion_before": -0.00034485304215570167, "delta_vs_parent": -0.00034485304215570167, "finding": "t0065 improved the prior champion: val_bpb=0.971285, delta=-0.000345. Hypothesis: The batch halving silently increased the total weight decay this model receives, and the constant was never rescaled to compensate. In muon_step_fused the decay term is applied per optimizer step as lr times wd times the parameter, so cumulative decay across a run is the step count times the average of that product. Moving from batch 2**18 to 2**17 raised the step count from 1465 to 2838, a factor of 1.937, while the square-root rate law lowered MATRIX_LR from 0.0231 to 0.0163, a factor of 0.707. The net effect is 1.37 times more cumulative decay than the configuration in which WEIGHT_DECAY was bracketed at 0.2 against 0.1 and 0.3. That bracket was also asymmetric, with 0.1 costing 0.001012 and 0.3 costing only 0.000176, so the champion now sits on the expensive side of a curve it was tuned on. Dividing the constant by 1.37 to 0.146 restores the total decay that measured best and should lower val_bpb.", "measurements": [{"command": ["/data/home/zhubaiyu/.local/bin/uv", "run", "--project", "/data3/zhubaiyu/fengheguai/campaigns/h200-claude/nodes/t0065", "python", "/data3/zhubaiyu/fengheguai/fengheguai/_audit_runner.py", "--target", "/data3/zhubaiyu/fengheguai/campaigns/h200-claude/nodes/t0065", "--nonce", "50e0f2c6d19cbc0b4e4893ff76a733a92e54fa86691b5614"], "errors": [], "evidence_path": "/data3/zhubaiyu/fengheguai/campaigns/h200-claude/evidence/t0065-r0/evidence.json", "evidence_sha256": "2a1f500db07c7c52332890e08dc512bc1e182aacab87c57a08670a0a860515f7", "log_path": "/data3/zhubaiyu/fengheguai/campaigns/h200-claude/evidence/t0065-r0/run.log", "log_sha256": "027bc42dc34604186ff87ecb41e22d9de54030b56d2490fb66d85667bd21e35f", "metric": 0.9713301742380906, "num_steps": 2837, "peak_vram_mb": 33800.4, "return_code": 0, "status": "valid", "timed_out": false, "train_sha256": "8c7973e8216ca5fffb56d9d6e4b8939136a4c22804c00f7b06ef7513b6c43c95", "training_seconds": 300.0, "wall_seconds": 485.9959598770365}, {"command": ["/data/home/zhubaiyu/.local/bin/uv", "run", "--project", "/data3/zhubaiyu/fengheguai/campaigns/h200-claude/nodes/t0065", "python", "/data3/zhubaiyu/fengheguai/fengheguai/_audit_runner.py", "--target", "/data3/zhubaiyu/fengheguai/campaigns/h200-claude/nodes/t0065", "--nonce", "460e6ed95482784f5f36b16ada35c852d7c84cbb06921094"], "errors": [], "evidence_path": "/data3/zhubaiyu/fengheguai/campaigns/h200-claude/evidence/t0065-r1/evidence.json", "evidence_sha256": "9038345e98a6fba18bb71535b51ae5e2d402b19f112fc7241668201acc473c58", "log_path": "/data3/zhubaiyu/fengheguai/campaigns/h200-claude/evidence/t0065-r1/run.log", "log_sha256": "90a33499dd86e58d87628fb0332bd8dee3742690c78988377441b17f1b4f7c8c", "metric": 0.9712407391697488, "num_steps": 2839, "peak_vram_mb": 33800.4, "return_code": 0, "status": "valid", "timed_out": false, "train_sha256": "8c7973e8216ca5fffb56d9d6e4b8939136a4c22804c00f7b06ef7513b6c43c95", "training_seconds": 300.0, "wall_seconds": 480.05355345550925}], "metric": 0.9712854567039197, "parent_id": "t0053", "patch_path": "/data3/zhubaiyu/fengheguai/campaigns/h200-claude/artifacts/t0065/change.patch", "patch_sha256": "631847763a30b45d71efc6c078609111f2309160e7b5c78c11c376c77a0c578b", "promoted": true, "proposal": {"change_summary": "One constant changed on champion t0053: WEIGHT_DECAY from 0.2 to 0.146, chosen so the product of step count and per-step decay matches what the 2**18 configuration delivered at 0.2. The declining schedule shape is untouched, still WEIGHT_DECAY times one minus progress, since the coupled variant was tested and closed in t0049 and t0050. Only the Muon matrix groups are affected because the AdamW groups run at weight_decay 0. Batch 2**17, depth 12, HEAD_DIM 128, document masking, dense value embeddings with the 128-channel gate, output softcap 10, rotary base 30000, the three settled learning rates, SCALAR_LR 0.5, FINAL_LR_FRAC 0.1 and WARMDOWN_RATIO 0.5 are unchanged.", "command": ["/usr/bin/python3", "/data3/zhubaiyu/fengheguai/fengheguai/rendezvous_agent.py", "--trial", "/data3/zhubaiyu/fengheguai/campaigns/h200-claude/nodes/t0065", "--result", "/data3/zhubaiyu/fengheguai/campaigns/h200-claude/nodes/t0065/.fengheguai-agent-result.json", "--schema", "/data3/zhubaiyu/fengheguai/campaigns/h200-claude/control/agent_output.schema.json", "--campaign", "/data3/zhubaiyu/fengheguai/campaigns/h200-claude", "--inbox", "/data3/zhubaiyu/fengheguai/campaigns/h200-claude-rendezvous"], "errors": [], "expected_val_bpb_effect": "Expected between a 0.001 decrease and a 0.001 increase versus champion t0053 at 0.971630, with step count unchanged. This is the same class of reasoning that produced the campaign gain at t0051, where an axis measured at one operating point turned out to need re-measuring after the configuration moved, and it is quantitative rather than exploratory: the correction factor comes from the measured step counts and the rate law this campaign established, not from a guess.", "hypothesis": "The batch halving silently increased the total weight decay this model receives, and the constant was never rescaled to compensate. In muon_step_fused the decay term is applied per optimizer step as lr times wd times the parameter, so cumulative decay across a run is the step count times the average of that product. Moving from batch 2**18 to 2**17 raised the step count from 1465 to 2838, a factor of 1.937, while the square-root rate law lowered MATRIX_LR from 0.0231 to 0.0163, a factor of 0.707. The net effect is 1.37 times more cumulative decay than the configuration in which WEIGHT_DECAY was bracketed at 0.2 against 0.1 and 0.3. That bracket was also asymmetric, with 0.1 costing 0.001012 and 0.3 costing only 0.000176, so the champion now sits on the expensive side of a curve it was tuned on. Dividing the constant by 1.37 to 0.146 restores the total decay that measured best and should lower val_bpb.", "log_path": "/data3/zhubaiyu/fengheguai/campaigns/h200-claude/artifacts/t0065/agent.log", "return_code": 0, "risk": "The cumulative-decay argument assumes what matters is the integral of lr times wd over the run rather than its per-step magnitude, and those differ here: at the smaller batch each individual decay step is smaller even though there are more of them, so if the mechanism is about per-step shrinkage rather than total shrinkage the correction points the wrong way and this regresses. The asymmetry of the original bracket also cuts against a large effect, since 0.3 cost only 0.000176 while 0.1 cost 0.001012, which suggests the curve is shallow above 0.2 and steep below it, and 0.146 sits on the steep side.", "success": true, "timed_out": false}, "secondary_parent_id": null, "selection_reason": "The current line is stalled; make a structurally different bet.", "source_sha256": "8c7973e8216ca5fffb56d9d6e4b8939136a4c22804c00f7b06ef7513b6c43c95", "stage": "explore", "status": "keep", "training_seconds": 300.0, "trial_id": "t0065", "workspace": "/data3/zhubaiyu/fengheguai/campaigns/h200-claude/nodes/t0065"}, "prev_hash": "1870497b4c467dec5264c019f5a0e9b8e348c0380d1c9a113adfa95067b03424", "seq": 132, "timestamp": "2026-08-20T23:51:18.271643+00:00"}
{"hash": "6a433b5fa29b462cc97629a0866873b502af6b8335934649e437ae679ed0f87b", "kind": "trial_started", "payload": {"parent_id": "t0065", "reason": "Exploit a top-K branch selected by quality plus an under-exploration bonus.", "secondary_parent_id": null, "stage": "refine", "trial_id": "t0066"}, "prev_hash": "9de551047719442c2e5b534a473232c2ccebda261d0ec4c4c8e33d6fda2b14aa", "seq": 133, "timestamp": "2026-08-20T23:51:18.308640+00:00"}
