{"hash": "2811a9e99023f5fc96838ecb8d70baa922bfb7278f7e3bbf52fcea2511e3d1e9", "kind": "trial_completed", "payload": {"champion_before": "t0053", "debug_depth": 0, "delta_vs_champion_before": 0.0018007331766277668, "delta_vs_parent": 0.0018007331766277668, "finding": "t0060 did not improve the prior champion: val_bpb=0.973431, delta=+0.001801. Hypothesis: The depth bracket was measured at a batch size the champion no longer uses, and one specific mechanism argues the verdict should be re-checked rather than inherited. Depth 14 was rejected at batch 2**18 where it ran only 1278 optimizer steps, against 1465 for depth 12, and deeper residual stacks generally need more steps to reach a given loss because signal must propagate through more layers before the later ones receive useful gradient. At batch 2**17 the champion runs 2838 steps, so depth 14 should now get roughly 2426, nearly double what it had when it lost. The token count is essentially unchanged between the two operating points, 372M for the champion here against 384M at the old batch, so this is not a data-quantity question: it isolates whether the depth-14 loss of 0.001519 was about capacity being unaffordable or about there being too few steps to train it.", "measurements": [{"command": ["/data/home/zhubaiyu/.local/bin/uv", "run", "--project", "/data3/zhubaiyu/fengheguai/campaigns/h200-claude/nodes/t0060", "python", "/data3/zhubaiyu/fengheguai/fengheguai/_audit_runner.py", "--target", "/data3/zhubaiyu/fengheguai/campaigns/h200-claude/nodes/t0060", "--nonce", "940fdb8ccf58f0b6867e8e473a3ab6e8e1c79b3c191a2c1d"], "errors": [], "evidence_path": "/data3/zhubaiyu/fengheguai/campaigns/h200-claude/evidence/t0060-r0/evidence.json", "evidence_sha256": "b344318de3cef38b32e70be366750902b3b3f2a7a77e7a3171c448c0530527bb", "log_path": "/data3/zhubaiyu/fengheguai/campaigns/h200-claude/evidence/t0060-r0/run.log", "log_sha256": "ea1e1c85559ad5b9edd88fa95ad93012573267c7db5529552db7bb1e3cf45ac0", "metric": 0.9734310429227032, "num_steps": 2453, "peak_vram_mb": 39047.4, "return_code": 0, "status": "valid", "timed_out": false, "train_sha256": "9dbd1ce170da6324d50e1e4f1037c0bc061cfaf0409b99f43d7c7389061cac49", "training_seconds": 300.1, "wall_seconds": 591.9662703396752}], "metric": 0.9734310429227032, "parent_id": "t0053", "patch_path": "/data3/zhubaiyu/fengheguai/campaigns/h200-claude/artifacts/t0060/change.patch", "patch_sha256": "114b5de1d2fd3e443e4c2a25582743d2bad4e504e892bdda35b4093a5f9164e3", "promoted": false, "proposal": {"change_summary": "Capacity re-test on champion t0053 at the current operating point: DEPTH 12 to 14 with ASPECT_RATIO 42 to 36, chosen so build_model_config still rounds to model_dim 512 with 4 heads of width 128. Batch stays 2**17 with DEVICE_BATCH_SIZE 64, and the settled rates are unchanged, EMBEDDING_LR 0.6, UNEMBEDDING_LR 0.002 and MATRIX_LR 0.0163. The autotuning from t0058 and t0059 is not carried forward, having cost 162 seconds of wall clock for a step count of 2835 against the champion 2838. Document masking, dense value embeddings with the 128-channel gate, output softcap 10, rotary base 30000, WEIGHT_DECAY 0.2, FINAL_LR_FRAC 0.1 and WARMDOWN_RATIO 0.5 are unchanged.", "command": ["/usr/bin/python3", "/data3/zhubaiyu/fengheguai/fengheguai/rendezvous_agent.py", "--trial", "/data3/zhubaiyu/fengheguai/campaigns/h200-claude/nodes/t0060", "--result", "/data3/zhubaiyu/fengheguai/campaigns/h200-claude/nodes/t0060/.fengheguai-agent-result.json", "--schema", "/data3/zhubaiyu/fengheguai/campaigns/h200-claude/control/agent_output.schema.json", "--campaign", "/data3/zhubaiyu/fengheguai/campaigns/h200-claude", "--inbox", "/data3/zhubaiyu/fengheguai/campaigns/h200-claude-rendezvous"], "errors": [], "expected_val_bpb_effect": "Expected between a 0.002 decrease and a 0.002 increase versus champion t0053 at 0.971630, with steps falling to roughly 2400. This is a genuine re-test rather than a repeat: the same intervention already reversed once in this campaign when batch halving went from flat at depth 8 to a 0.000718 gain at depth 12, so operating-point dependence is established behaviour here rather than speculation. If it regresses by about the same 0.0015 it did before, capacity is confirmed saturated independently of step count and the axis closes for good.", "hypothesis": "The depth bracket was measured at a batch size the champion no longer uses, and one specific mechanism argues the verdict should be re-checked rather than inherited. Depth 14 was rejected at batch 2**18 where it ran only 1278 optimizer steps, against 1465 for depth 12, and deeper residual stacks generally need more steps to reach a given loss because signal must propagate through more layers before the later ones receive useful gradient. At batch 2**17 the champion runs 2838 steps, so depth 14 should now get roughly 2426, nearly double what it had when it lost. The token count is essentially unchanged between the two operating points, 372M for the champion here against 384M at the old batch, so this is not a data-quantity question: it isolates whether the depth-14 loss of 0.001519 was about capacity being unaffordable or about there being too few steps to train it.", "log_path": "/data3/zhubaiyu/fengheguai/campaigns/h200-claude/artifacts/t0060/agent.log", "return_code": 0, "risk": "MATRIX_LR still carries the sqrt(8/12) depth correction applied at t0017, which is now mismatched for a 14-layer stack, so a regression could partly reflect rate mismatch rather than capacity; that correction measured as a null when introduced, which is why I am not adjusting it here, but it does mean a loss is not a fully clean verdict. Peak VRAM also rises from roughly 35GB at the current smaller batch, which is comfortable on this GPU, so memory is not the constraint it was when depth 14 ran at the larger batch.", "success": true, "timed_out": false}, "secondary_parent_id": null, "selection_reason": "The current line is stalled; make a structurally different bet.", "source_sha256": "9dbd1ce170da6324d50e1e4f1037c0bc061cfaf0409b99f43d7c7389061cac49", "stage": "explore", "status": "discard", "training_seconds": 300.1, "trial_id": "t0060", "workspace": "/data3/zhubaiyu/fengheguai/campaigns/h200-claude/nodes/t0060"}, "prev_hash": "6d2859138929df855a8205d08f71141e18e32f41a74364b261b5c31490407ae0", "seq": 122, "timestamp": "2026-08-20T22:56:26.802353+00:00"}
{"hash": "5f00c93b787a06d9507309190cbc89c3aab4a3064ec7894f63a25a64f0cc36fb", "kind": "trial_started", "payload": {"parent_id": "t0053", "reason": "The current line is stalled; make a structurally different bet.", "secondary_parent_id": null, "stage": "explore", "trial_id": "t0061"}, "prev_hash": "2811a9e99023f5fc96838ecb8d70baa922bfb7278f7e3bbf52fcea2511e3d1e9", "seq": 123, "timestamp": "2026-08-20T22:56:26.836731+00:00"}
{"hash": "d1ab05d5f048c106121f207929e7b624c39cd63e3033f08f5f3e0671c8cb56fe", "kind": "trial_completed", "payload": {"champion_before": "t0053", "debug_depth": 0, "delta_vs_champion_before": 0.0018748973884911146, "delta_vs_parent": 0.0018748973884911146, "finding": "t0061 did not improve the prior champion: val_bpb=0.973505, delta=+0.001875. Hypothesis: Learning-rate warmup is the last schedule parameter never tested, and the operating point has moved into the regime where it should matter most. The recipe ships with WARMUP_RATIO at 0.0, so every group starts at full rate on step one, which is defensible at a large batch where the first gradients are already well averaged. The champion now trains at batch 2**17, a quarter of the 2**19 the recipe was written for, so early gradients are roughly twice as noisy per step as they were at the tuned setting, and the parameters least protected are the ones that start near zero: lm_head at standard deviation 0.001 and the zero-initialised output projections in every block. A short warmup over two percent of the budget, about 57 steps, lets those gradients average before full-rate updates begin and should lower val_bpb.", "measurements": [{"command": ["/data/home/zhubaiyu/.local/bin/uv", "run", "--project", "/data3/zhubaiyu/fengheguai/campaigns/h200-claude/nodes/t0061", "python", "/data3/zhubaiyu/fengheguai/fengheguai/_audit_runner.py", "--target", "/data3/zhubaiyu/fengheguai/campaigns/h200-claude/nodes/t0061", "--nonce", "fc892727a13541985b24205d968e83baaacf497df39c5d93"], "errors": [], "evidence_path": "/data3/zhubaiyu/fengheguai/campaigns/h200-claude/evidence/t0061-r0/evidence.json", "evidence_sha256": "ef17336fc523131e733cfdd5b7f095d5ed0650a25c8ae2ec03e4442c05fb9b4b", "log_path": "/data3/zhubaiyu/fengheguai/campaigns/h200-claude/evidence/t0061-r0/run.log", "log_sha256": "11af3e7c8aa59b148750e5e081b45a769ecd2576c0ed6b5a0f33dad9ef408a5e", "metric": 0.9735052071345666, "num_steps": 2840, "peak_vram_mb": 33800.4, "return_code": 0, "status": "valid", "timed_out": false, "train_sha256": "ff2a867263b6800396cf7e17382d7835517fff624d93aee8ba3fbb04b662842f", "training_seconds": 300.1, "wall_seconds": 484.9587392443791}], "metric": 0.9735052071345666, "parent_id": "t0053", "patch_path": "/data3/zhubaiyu/fengheguai/campaigns/h200-claude/artifacts/t0061/change.patch", "patch_sha256": "438f5f40756af0ccae4d0fadd388dff152ad500abcfe664639472559de164105", "promoted": false, "proposal": {"change_summary": "One constant changed on champion t0053: WARMUP_RATIO from 0.0 to 0.02, so get_lr_multiplier ramps linearly from zero to full rate across the first two percent of the time budget before the flat phase begins. WARMDOWN_RATIO stays at its bracketed optimum of 0.5 and FINAL_LR_FRAC stays 0.1. The depth-14 configuration from t0060 is not carried forward, having lost 0.001801. Batch 2**17, depth 12, width 512, document masking, dense value embeddings with the 128-channel gate, output softcap 10, rotary base 30000, the three settled learning rates, WEIGHT_DECAY 0.2 and the Muon momentum warmup at 300 steps are unchanged.", "command": ["/usr/bin/python3", "/data3/zhubaiyu/fengheguai/fengheguai/rendezvous_agent.py", "--trial", "/data3/zhubaiyu/fengheguai/campaigns/h200-claude/nodes/t0061", "--result", "/data3/zhubaiyu/fengheguai/campaigns/h200-claude/nodes/t0061/.fengheguai-agent-result.json", "--schema", "/data3/zhubaiyu/fengheguai/campaigns/h200-claude/control/agent_output.schema.json", "--campaign", "/data3/zhubaiyu/fengheguai/campaigns/h200-claude", "--inbox", "/data3/zhubaiyu/fengheguai/campaigns/h200-claude-rendezvous"], "errors": [], "expected_val_bpb_effect": "Expected between a 0.001 decrease and a 0.001 increase versus champion t0053 at 0.971630, with step count unchanged since the schedule costs nothing to evaluate. The honest prior favours a null or a small regression, because seventeen inherited defaults have now been measured at or near their own optimum and because this recipe already provides early damping through the Muon momentum ramp, which spends its first 300 steps below terminal momentum precisely to limit early update size.", "hypothesis": "Learning-rate warmup is the last schedule parameter never tested, and the operating point has moved into the regime where it should matter most. The recipe ships with WARMUP_RATIO at 0.0, so every group starts at full rate on step one, which is defensible at a large batch where the first gradients are already well averaged. The champion now trains at batch 2**17, a quarter of the 2**19 the recipe was written for, so early gradients are roughly twice as noisy per step as they were at the tuned setting, and the parameters least protected are the ones that start near zero: lm_head at standard deviation 0.001 and the zero-initialised output projections in every block. A short warmup over two percent of the budget, about 57 steps, lets those gradients average before full-rate updates begin and should lower val_bpb.", "log_path": "/data3/zhubaiyu/fengheguai/campaigns/h200-claude/artifacts/t0061/agent.log", "return_code": 0, "risk": "Warmup and the momentum ramp overlap in purpose, so if the momentum ramp is already doing this job the result is a null that says nothing about whether warmup would help a recipe without it. There is also a specific cost: two percent of the budget spent below full rate is about 57 steps of reduced progress in a run whose total is 2838, and the warmdown already gives up half the budget to annealing, so the flat full-rate phase shrinks from 50 to 48 percent. If this regresses by roughly the amount that shortening the warmdown cost in t0026, the correct reading is that this model is starved of full-rate steps rather than that warmup is harmful in principle.", "success": true, "timed_out": false}, "secondary_parent_id": null, "selection_reason": "The current line is stalled; make a structurally different bet.", "source_sha256": "ff2a867263b6800396cf7e17382d7835517fff624d93aee8ba3fbb04b662842f", "stage": "explore", "status": "discard", "training_seconds": 300.1, "trial_id": "t0061", "workspace": "/data3/zhubaiyu/fengheguai/campaigns/h200-claude/nodes/t0061"}, "prev_hash": "5f00c93b787a06d9507309190cbc89c3aab4a3064ec7894f63a25a64f0cc36fb", "seq": 124, "timestamp": "2026-08-20T23:05:26.284891+00:00"}
{"hash": "69d14ebacaa4de22cc3f4ed006eca6b4d093eff00861f84b165d62ec7025df8c", "kind": "trial_started", "payload": {"parent_id": "t0053", "reason": "The current line is stalled; make a structurally different bet.", "secondary_parent_id": null, "stage": "explore", "trial_id": "t0062"}, "prev_hash": "d1ab05d5f048c106121f207929e7b624c39cd63e3033f08f5f3e0671c8cb56fe", "seq": 125, "timestamp": "2026-08-20T23:05:26.322350+00:00"}
{"hash": "78ca5af2e844229a613c7e28535b40b437d8701951f0816c0644383224d69731", "kind": "trial_completed", "payload": {"champion_before": "t0053", "debug_depth": 0, "delta_vs_champion_before": 0.0028205062652929547, "delta_vs_parent": 0.0028205062652929547, "finding": "t0062 did not improve the prior champion: val_bpb=0.974451, delta=+0.002821. Hypothesis: SCALAR_LR is the last learning rate in the model never measured, and it sets a step size that looks large relative to the parameters it moves. It drives two groups through setup_optimizer: x0_lambdas at the full 0.5 and resid_lambdas at 0.005. The x0 group is the striking one. Those twelve scalars are initialised at 0.1 and control how much of the normalised token embedding is re-injected at each layer, and because Adam normalises its update to roughly the learning rate for a consistently signed gradient, a rate of 0.5 permits a single step to move a parameter by five times its own initial value. Once such a parameter reaches its optimum the same rate becomes steady-state jitter of comparable magnitude, so the quantity being learned may be permanently noisy rather than converged. Halving SCALAR_LR to 0.25 should reduce that jitter while leaving ample room to travel over 2838 steps, and should lower val_bpb.", "measurements": [{"command": ["/data/home/zhubaiyu/.local/bin/uv", "run", "--project", "/data3/zhubaiyu/fengheguai/campaigns/h200-claude/nodes/t0062", "python", "/data3/zhubaiyu/fengheguai/fengheguai/_audit_runner.py", "--target", "/data3/zhubaiyu/fengheguai/campaigns/h200-claude/nodes/t0062", "--nonce", "9dab71926c4b946859825939776523c5364c7aa42402a13a"], "errors": [], "evidence_path": "/data3/zhubaiyu/fengheguai/campaigns/h200-claude/evidence/t0062-r0/evidence.json", "evidence_sha256": "cf965f597764aa4803193f923b91a4f58b849d0cadea960ae61421a9d197d5cd", "log_path": "/data3/zhubaiyu/fengheguai/campaigns/h200-claude/evidence/t0062-r0/run.log", "log_sha256": "e15f1456ab88bbc26294807300fba7587916330e8e356a452a1c826b238854a9", "metric": 0.9744508160113684, "num_steps": 2840, "peak_vram_mb": 33800.4, "return_code": 0, "status": "valid", "timed_out": false, "train_sha256": "1dba79c0bf192cdd8c6e8d508edbbb1965bb28800b17e4c8397ce04d873f9804", "training_seconds": 300.0, "wall_seconds": 484.14598886854947}], "metric": 0.9744508160113684, "parent_id": "t0053", "patch_path": "/data3/zhubaiyu/fengheguai/campaigns/h200-claude/artifacts/t0062/change.patch", "patch_sha256": "ef99651775576d499aa544977559344ca23cc24c491e2d4cf3d8955a0df6fd2c", "promoted": false, "proposal": {"change_summary": "One constant changed on champion t0053: SCALAR_LR from 0.5 to 0.25. This halves the rate for both scalar groups, x0_lambdas from 0.5 to 0.25 and resid_lambdas from 0.005 to 0.0025, since the latter is defined as scalar_lr times 0.01. No other group is affected: EMBEDDING_LR stays 0.6, UNEMBEDDING_LR 0.002 and MATRIX_LR 0.0163. The warmup from t0061 is not carried forward, having cost 0.001875. Batch 2**17, depth 12, width 512, document masking, dense value embeddings with the 128-channel gate, output softcap 10, rotary base 30000, WEIGHT_DECAY 0.2, FINAL_LR_FRAC 0.1, WARMDOWN_RATIO 0.5 and the 300-step Muon momentum ramp are unchanged.", "command": ["/usr/bin/python3", "/data3/zhubaiyu/fengheguai/fengheguai/rendezvous_agent.py", "--trial", "/data3/zhubaiyu/fengheguai/campaigns/h200-claude/nodes/t0062", "--result", "/data3/zhubaiyu/fengheguai/campaigns/h200-claude/nodes/t0062/.fengheguai-agent-result.json", "--schema", "/data3/zhubaiyu/fengheguai/campaigns/h200-claude/control/agent_output.schema.json", "--campaign", "/data3/zhubaiyu/fengheguai/campaigns/h200-claude", "--inbox", "/data3/zhubaiyu/fengheguai/campaigns/h200-claude-rendezvous"], "errors": [], "expected_val_bpb_effect": "Expected between a 0.001 decrease and a 0.001 increase versus champion t0053 at 0.971630, with step count unchanged. The jitter argument is suggestive rather than conclusive, because Adam only approaches a step of size lr when the gradient sign is consistent, and for a scalar aggregating gradient from an entire layer the sign may flip often enough that the effective step is far smaller than 0.5.", "hypothesis": "SCALAR_LR is the last learning rate in the model never measured, and it sets a step size that looks large relative to the parameters it moves. It drives two groups through setup_optimizer: x0_lambdas at the full 0.5 and resid_lambdas at 0.005. The x0 group is the striking one. Those twelve scalars are initialised at 0.1 and control how much of the normalised token embedding is re-injected at each layer, and because Adam normalises its update to roughly the learning rate for a consistently signed gradient, a rate of 0.5 permits a single step to move a parameter by five times its own initial value. Once such a parameter reaches its optimum the same rate becomes steady-state jitter of comparable magnitude, so the quantity being learned may be permanently noisy rather than converged. Halving SCALAR_LR to 0.25 should reduce that jitter while leaving ample room to travel over 2838 steps, and should lower val_bpb.", "log_path": "/data3/zhubaiyu/fengheguai/campaigns/h200-claude/artifacts/t0062/agent.log", "return_code": 0, "risk": "This moves two groups at once, so a win would not attribute between the x0 and resid scalars, though the resid group is already at a hundredfold smaller rate and is unlikely to dominate. The stronger caution is the base rate: seventeen inherited defaults have now been measured and every one sat at or very near its own optimum, with the single exception of the output softcap, so the honest expectation here is a null or small regression rather than a gain. If it regresses I will treat the scalar rates as settled rather than testing 1.0, since the jitter argument only motivates the downward direction.", "success": true, "timed_out": false}, "secondary_parent_id": null, "selection_reason": "The current line is stalled; make a structurally different bet.", "source_sha256": "1dba79c0bf192cdd8c6e8d508edbbb1965bb28800b17e4c8397ce04d873f9804", "stage": "explore", "status": "discard", "training_seconds": 300.0, "trial_id": "t0062", "workspace": "/data3/zhubaiyu/fengheguai/campaigns/h200-claude/nodes/t0062"}, "prev_hash": "69d14ebacaa4de22cc3f4ed006eca6b4d093eff00861f84b165d62ec7025df8c", "seq": 126, "timestamp": "2026-08-20T23:14:20.949035+00:00"}
{"hash": "b8b8b249264ab9f00dee9a04664260e5fb7fc89ad027f3293afec6ac35793c37", "kind": "trial_started", "payload": {"parent_id": "t0053", "reason": "Recombine two independently strong branches at the scheduled synthesis step.", "secondary_parent_id": "t0057", "stage": "recombine", "trial_id": "t0063"}, "prev_hash": "78ca5af2e844229a613c7e28535b40b437d8701951f0816c0644383224d69731", "seq": 127, "timestamp": "2026-08-20T23:14:20.983768+00:00"}
