{"hash": "b38851ea4c1e0fb504e1f13db664f979714349efb6dd45b94616ca5c26fce1ff", "kind": "trial_completed", "payload": {"champion_before": "t0017", "debug_depth": 0, "delta_vs_champion_before": 0.001011880741138338, "delta_vs_parent": 0.001011880741138338, "finding": "t0018 did not improve the prior champion: val_bpb=0.974383, delta=+0.001012. Hypothesis: The capacity increases silently changed the data regime, and the regularisation was never revisited. At depth 8 the run consumed 549.7M tokens and the loader reported epoch 2, so every example was seen about twice; at depth 12 it consumes 385.4M tokens and reports epoch 1, a single pass over fresh data. Weight decay earns its keep by suppressing memorisation of repeated examples, and there is no longer any repetition to suppress, so the inherited WEIGHT_DECAY of 0.2 is now mostly a drag on fitting. Halving it to 0.1 should lower val_bpb. This also explains why the value-embedding mechanism, which is memory-like, paid off at depth 8 where data repeated but has not been retested since the regime moved.", "measurements": [{"command": ["/data/home/zhubaiyu/.local/bin/uv", "run", "--project", "/data3/zhubaiyu/fengheguai/campaigns/h200-claude/nodes/t0018", "python", "/data3/zhubaiyu/fengheguai/fengheguai/_audit_runner.py", "--target", "/data3/zhubaiyu/fengheguai/campaigns/h200-claude/nodes/t0018", "--nonce", "2822c6b2ad9b23d9e74b6c2c4783a10e9398db44c1f92ab1"], "errors": [], "evidence_path": "/data3/zhubaiyu/fengheguai/campaigns/h200-claude/evidence/t0018-r0/evidence.json", "evidence_sha256": "4f29e6052e47f3cf1a751ef929ae31caf4fddaf087cf66a5ea57158141d32791", "log_path": "/data3/zhubaiyu/fengheguai/campaigns/h200-claude/evidence/t0018-r0/run.log", "log_sha256": "20135270f3cefcbd79fc33b7ba13740ca65f398d8c5cf63d0ce7b9f31e0a25d6", "metric": 0.9743826985879623, "num_steps": 1469, "peak_vram_mb": 66795.6, "return_code": 0, "status": "valid", "timed_out": false, "train_sha256": "404374b81283a0599ef6b92201d1144d1851fae26f34a3eec4aecba08bd69b92", "training_seconds": 300.0, "wall_seconds": 486.5978091964498}], "metric": 0.9743826985879623, "parent_id": "t0017", "patch_path": "/data3/zhubaiyu/fengheguai/campaigns/h200-claude/artifacts/t0018/change.patch", "patch_sha256": "ad8d721eeee8d6c2020512922f944137b149bbdadd76a67c2533d532d3321ee6", "promoted": false, "proposal": {"change_summary": "One constant changed on champion t0017: WEIGHT_DECAY 0.2 to 0.1. It enters through get_weight_decay, which linearly decays it to zero across the run and applies it as the cautious decay term inside muon_step_fused, so only the Muon matrix groups are affected; the AdamW groups already run at weight_decay 0. Depth 12, width 512, document masking, dense value embeddings, batch 2**18, all three learning rates and every other schedule are unchanged.", "command": ["/usr/bin/python3", "/data3/zhubaiyu/fengheguai/fengheguai/rendezvous_agent.py", "--trial", "/data3/zhubaiyu/fengheguai/campaigns/h200-claude/nodes/t0018", "--result", "/data3/zhubaiyu/fengheguai/campaigns/h200-claude/nodes/t0018/.fengheguai-agent-result.json", "--schema", "/data3/zhubaiyu/fengheguai/campaigns/h200-claude/control/agent_output.schema.json", "--campaign", "/data3/zhubaiyu/fengheguai/campaigns/h200-claude", "--inbox", "/data3/zhubaiyu/fengheguai/campaigns/h200-claude-rendezvous"], "errors": [], "expected_val_bpb_effect": "Expected decrease of roughly 0.0005-0.002 bpb versus champion t0017 at 0.973371. If it wins, the follow-up is to test removing the decay entirely, since the argument implies the optimum is at or near zero once data stops repeating. An increase would mean the cautious decay is acting as a useful optimisation constraint on Muon rather than as an anti-memorisation regulariser, which would be a genuinely different reading of what that term does here.", "hypothesis": "The capacity increases silently changed the data regime, and the regularisation was never revisited. At depth 8 the run consumed 549.7M tokens and the loader reported epoch 2, so every example was seen about twice; at depth 12 it consumes 385.4M tokens and reports epoch 1, a single pass over fresh data. Weight decay earns its keep by suppressing memorisation of repeated examples, and there is no longer any repetition to suppress, so the inherited WEIGHT_DECAY of 0.2 is now mostly a drag on fitting. Halving it to 0.1 should lower val_bpb. This also explains why the value-embedding mechanism, which is memory-like, paid off at depth 8 where data repeated but has not been retested since the regime moved.", "log_path": "/data3/zhubaiyu/fengheguai/campaigns/h200-claude/artifacts/t0018/agent.log", "return_code": 0, "risk": "The single-epoch reading rests on an integer epoch counter, so epoch 1 could mean anything from a small fraction of a pass to just under two, and the true repetition factor is roughly 385M over the corpus size rather than exactly one; the argument weakens if the corpus is smaller than assumed. Cautious weight decay in this implementation is also masked by the sign agreement between update and parameter, so it is not a plain L2 term and may be doing optimisation work unrelated to generalisation, in which case reducing it costs stability rather than helping fit.", "success": true, "timed_out": false}, "secondary_parent_id": null, "selection_reason": "Exploit a top-K branch selected by quality plus an under-exploration bonus.", "source_sha256": "404374b81283a0599ef6b92201d1144d1851fae26f34a3eec4aecba08bd69b92", "stage": "refine", "status": "discard", "training_seconds": 300.0, "trial_id": "t0018", "workspace": "/data3/zhubaiyu/fengheguai/campaigns/h200-claude/nodes/t0018"}, "prev_hash": "9ea8382514f09bc7e9effcd46315895743bf5f2a801fdaa946e432d893a6f106", "seq": 38, "timestamp": "2026-08-20T15:15:38.463731+00:00"}
{"hash": "146dc306584d4fc36ea34b21826751f393bd34e424504d9aa8a71dca41744ce3", "kind": "trial_started", "payload": {"parent_id": "t0017", "reason": "Exploit a top-K branch selected by quality plus an under-exploration bonus.", "secondary_parent_id": null, "stage": "refine", "trial_id": "t0019"}, "prev_hash": "b38851ea4c1e0fb504e1f13db664f979714349efb6dd45b94616ca5c26fce1ff", "seq": 39, "timestamp": "2026-08-20T15:15:38.476414+00:00"}
{"hash": "e596eca83dd20802e4b36163add90c4b0f4c811c4812c01f78697dd9f24e0857", "kind": "trial_completed", "payload": {"champion_before": "t0017", "debug_depth": 0, "delta_vs_champion_before": 0.00017662735110934857, "delta_vs_parent": 0.00017662735110934857, "finding": "t0019 did not improve the prior champion: val_bpb=0.973547, delta=+0.000177. Hypothesis: t0018 tested the wrong direction for the right reason and produced a useful gradient. Halving WEIGHT_DECAY from 0.2 to 0.1 cost 0.001012 bpb, which falsifies the reading that this term suppresses memorisation of repeated data: the run is now single-epoch, so if that were its role, removing it should have been free or helpful. The surviving explanation is the one in the t0018 risk note, that cautious weight decay acts as an optimisation constraint on Muon, shrinking coordinates whose update agrees in sign with the parameter and keeping the orthogonalised updates well conditioned. Under that reading more of it should help, and the axis is steep, roughly 0.001 bpb per 0.1 of decay, which is a stronger local gradient than most knobs tested here. Raising it to 0.3 should lower val_bpb.", "measurements": [{"command": ["/data/home/zhubaiyu/.local/bin/uv", "run", "--project", "/data3/zhubaiyu/fengheguai/campaigns/h200-claude/nodes/t0019", "python", "/data3/zhubaiyu/fengheguai/fengheguai/_audit_runner.py", "--target", "/data3/zhubaiyu/fengheguai/campaigns/h200-claude/nodes/t0019", "--nonce", "7f628327944bcd106b560abf4cb63a2debd6c5cc4b07eb58"], "errors": [], "evidence_path": "/data3/zhubaiyu/fengheguai/campaigns/h200-claude/evidence/t0019-r0/evidence.json", "evidence_sha256": "9a0e7c09242c8d583b86a7f1bc8ca7ab2b78ab1e5a8ffbc99b1c6f9306e97485", "log_path": "/data3/zhubaiyu/fengheguai/campaigns/h200-claude/evidence/t0019-r0/run.log", "log_sha256": "be5977150eb445df2890900a321e91fcc938aea795e0180fdea0f32c95691bef", "metric": 0.9735474451979333, "num_steps": 1472, "peak_vram_mb": 66795.6, "return_code": 0, "status": "valid", "timed_out": false, "train_sha256": "661c238138bf607077b11aa987119d698162a4c4d4a18ab3124922bd43d60422", "training_seconds": 300.2, "wall_seconds": 485.8897833907977}], "metric": 0.9735474451979333, "parent_id": "t0017", "patch_path": "/data3/zhubaiyu/fengheguai/campaigns/h200-claude/artifacts/t0019/change.patch", "patch_sha256": "58634203874394a8ebc84ac625c67e1f5a179aef3c20f335f28f5e5b90e0a4bc", "promoted": false, "proposal": {"change_summary": "One constant changed on champion t0017: WEIGHT_DECAY 0.2 to 0.3, entering through get_weight_decay, which decays it linearly to zero over the run and applies it as the sign-masked cautious decay inside muon_step_fused. Only the Muon matrix groups are affected since the AdamW groups run at weight_decay 0. Depth 12, width 512, document masking, dense value embeddings, batch 2**18, all learning rates and every other schedule are unchanged.", "command": ["/usr/bin/python3", "/data3/zhubaiyu/fengheguai/fengheguai/rendezvous_agent.py", "--trial", "/data3/zhubaiyu/fengheguai/campaigns/h200-claude/nodes/t0019", "--result", "/data3/zhubaiyu/fengheguai/campaigns/h200-claude/nodes/t0019/.fengheguai-agent-result.json", "--schema", "/data3/zhubaiyu/fengheguai/campaigns/h200-claude/control/agent_output.schema.json", "--campaign", "/data3/zhubaiyu/fengheguai/campaigns/h200-claude", "--inbox", "/data3/zhubaiyu/fengheguai/campaigns/h200-claude-rendezvous"], "errors": [], "expected_val_bpb_effect": "Expected decrease of roughly 0.0005-0.0015 bpb versus champion t0017 at 0.973371 if the gradient measured between 0.1 and 0.2 extends past 0.2. An increase would place the optimum at or near the inherited 0.2 and close the axis with a proper bracket, 0.1 and 0.3 both worse than 0.2, which is a stronger result than the single-sided evidence available now.", "hypothesis": "t0018 tested the wrong direction for the right reason and produced a useful gradient. Halving WEIGHT_DECAY from 0.2 to 0.1 cost 0.001012 bpb, which falsifies the reading that this term suppresses memorisation of repeated data: the run is now single-epoch, so if that were its role, removing it should have been free or helpful. The surviving explanation is the one in the t0018 risk note, that cautious weight decay acts as an optimisation constraint on Muon, shrinking coordinates whose update agrees in sign with the parameter and keeping the orthogonalised updates well conditioned. Under that reading more of it should help, and the axis is steep, roughly 0.001 bpb per 0.1 of decay, which is a stronger local gradient than most knobs tested here. Raising it to 0.3 should lower val_bpb.", "log_path": "/data3/zhubaiyu/fengheguai/campaigns/h200-claude/artifacts/t0019/agent.log", "return_code": 0, "risk": "Extrapolating past the end of a two-point measurement assumes monotonicity that a tuned default argues against, since 0.2 was presumably chosen deliberately upstream; the likeliest outcome is a mild regression that brackets the optimum. Heavier cautious decay also interacts with the linear decay schedule, so the early steps now start from a substantially stronger constraint, and if it is too strong the effect should appear as slower early loss reduction rather than instability.", "success": true, "timed_out": false}, "secondary_parent_id": null, "selection_reason": "Exploit a top-K branch selected by quality plus an under-exploration bonus.", "source_sha256": "661c238138bf607077b11aa987119d698162a4c4d4a18ab3124922bd43d60422", "stage": "refine", "status": "discard", "training_seconds": 300.2, "trial_id": "t0019", "workspace": "/data3/zhubaiyu/fengheguai/campaigns/h200-claude/nodes/t0019"}, "prev_hash": "146dc306584d4fc36ea34b21826751f393bd34e424504d9aa8a71dca41744ce3", "seq": 40, "timestamp": "2026-08-20T15:24:38.825128+00:00"}
{"hash": "2a124b8bd7489daa9f06b00b551826c80bf643d2a256708f5214cae2caa02c1e", "kind": "trial_started", "payload": {"parent_id": "t0017", "reason": "Spend the configured search share on a distinct architectural or recipe direction.", "secondary_parent_id": null, "stage": "explore", "trial_id": "t0020"}, "prev_hash": "e596eca83dd20802e4b36163add90c4b0f4c811c4812c01f78697dd9f24e0857", "seq": 41, "timestamp": "2026-08-20T15:24:38.838113+00:00"}
{"hash": "0b7e87da485d603c9198aeb6902e354c01c4b00bbe90fdb2f720306aed986402", "kind": "trial_completed", "payload": {"champion_before": "t0017", "debug_depth": 0, "delta_vs_champion_before": 0.0014676284012146157, "delta_vs_parent": 0.0014676284012146157, "finding": "t0020 did not improve the prior champion: val_bpb=0.974838, delta=+0.001468. Hypothesis: The learning-rate schedule is the last untouched cluster in this recipe and it has never been questioned, unlike the rates themselves which have been rescaled three times. The current shape holds the rate constant for the first half of the time budget and then decays linearly to zero over the second half. Annealing is what converts optimisation progress into a low final loss, and at a fixed 300-second budget the anneal is the only phase whose length directly buys final-loss quality. Extending WARMDOWN_RATIO to 0.8 turns the trajectory into a short 20 percent stable phase followed by a long linear decay, close to a pure linear-decay-to-zero schedule, which should reach a lower val_bpb than a schedule that spends half the budget at full rate.", "measurements": [{"command": ["/data/home/zhubaiyu/.local/bin/uv", "run", "--project", "/data3/zhubaiyu/fengheguai/campaigns/h200-claude/nodes/t0020", "python", "/data3/zhubaiyu/fengheguai/fengheguai/_audit_runner.py", "--target", "/data3/zhubaiyu/fengheguai/campaigns/h200-claude/nodes/t0020", "--nonce", "f8b201e3946943a9faf0b4f67ace2e3a9c0419f98766bd8b"], "errors": [], "evidence_path": "/data3/zhubaiyu/fengheguai/campaigns/h200-claude/evidence/t0020-r0/evidence.json", "evidence_sha256": "475441fa77bbe112f85dbeb3ad22e0d4d4fd275e44debfb787b1412742d026ca", "log_path": "/data3/zhubaiyu/fengheguai/campaigns/h200-claude/evidence/t0020-r0/run.log", "log_sha256": "482825c445461c4948ea6fe3c056f46455d267ad7929d31f73729bc49ed63b95", "metric": 0.9748384462480386, "num_steps": 1471, "peak_vram_mb": 66795.6, "return_code": 0, "status": "valid", "timed_out": false, "train_sha256": "556ff082e3db0b01a88b0c9850df9512cbb385decf7aa67e66bc018ed11f83f8", "training_seconds": 300.2, "wall_seconds": 486.37298108264804}], "metric": 0.9748384462480386, "parent_id": "t0017", "patch_path": "/data3/zhubaiyu/fengheguai/campaigns/h200-claude/artifacts/t0020/change.patch", "patch_sha256": "0f224727fed60be290e10a27b0c6446a87c912ae2bd999216384b0c0ad783c7a", "promoted": false, "proposal": {"change_summary": "One constant changed on champion t0017: WARMDOWN_RATIO 0.5 to 0.8, reshaping get_lr_multiplier so the constant-rate phase runs to 20 percent of the time budget instead of 50 percent and the linear decay to zero occupies the remaining 80 percent. WARMUP_RATIO stays 0.0 and FINAL_LR_FRAC stays 0.0, so the schedule still starts at full rate and still ends at exactly zero. Depth 12, width 512, document masking, dense value embeddings, batch 2**18, all learning rates and WEIGHT_DECAY 0.2 are unchanged. Since the schedule is driven by elapsed training time rather than step index, the shape is unaffected by the step count.", "command": ["/usr/bin/python3", "/data3/zhubaiyu/fengheguai/fengheguai/rendezvous_agent.py", "--trial", "/data3/zhubaiyu/fengheguai/campaigns/h200-claude/nodes/t0020", "--result", "/data3/zhubaiyu/fengheguai/campaigns/h200-claude/nodes/t0020/.fengheguai-agent-result.json", "--schema", "/data3/zhubaiyu/fengheguai/campaigns/h200-claude/control/agent_output.schema.json", "--campaign", "/data3/zhubaiyu/fengheguai/campaigns/h200-claude", "--inbox", "/data3/zhubaiyu/fengheguai/campaigns/h200-claude-rendezvous"], "errors": [], "expected_val_bpb_effect": "Expected decrease of roughly 0.001-0.003 bpb versus champion t0017 at 0.973371. This is a shape change rather than a magnitude change, so it does not interact with the batch-versus-rate scaling already established, and the step count should be essentially unchanged since no FLOPs move. An increase would mean the long stable phase is doing necessary work before annealing and would point the follow-up toward a shorter warmdown instead.", "hypothesis": "The learning-rate schedule is the last untouched cluster in this recipe and it has never been questioned, unlike the rates themselves which have been rescaled three times. The current shape holds the rate constant for the first half of the time budget and then decays linearly to zero over the second half. Annealing is what converts optimisation progress into a low final loss, and at a fixed 300-second budget the anneal is the only phase whose length directly buys final-loss quality. Extending WARMDOWN_RATIO to 0.8 turns the trajectory into a short 20 percent stable phase followed by a long linear decay, close to a pure linear-decay-to-zero schedule, which should reach a lower val_bpb than a schedule that spends half the budget at full rate.", "log_path": "/data3/zhubaiyu/fengheguai/campaigns/h200-claude/artifacts/t0020/agent.log", "return_code": 0, "risk": "A much longer decay means the model spends most of the run at a reduced rate, which can underfit within a budget this short, and the effect is genuinely two-sided since 0.5 may already be the tuned optimum. The weight-decay schedule is also coupled to progress through get_weight_decay independently of the rate schedule, so both change together in effect even though only one constant moved; that coupling is inherent to the recipe rather than introduced here, but it means a win cannot be attributed purely to the rate trajectory.", "success": true, "timed_out": false}, "secondary_parent_id": null, "selection_reason": "Spend the configured search share on a distinct architectural or recipe direction.", "source_sha256": "556ff082e3db0b01a88b0c9850df9512cbb385decf7aa67e66bc018ed11f83f8", "stage": "explore", "status": "discard", "training_seconds": 300.2, "trial_id": "t0020", "workspace": "/data3/zhubaiyu/fengheguai/campaigns/h200-claude/nodes/t0020"}, "prev_hash": "2a124b8bd7489daa9f06b00b551826c80bf643d2a256708f5214cae2caa02c1e", "seq": 42, "timestamp": "2026-08-20T15:33:51.708278+00:00"}
{"hash": "eac41ad56720a78285cc324ed3e0e78b52cea07ec0e92e36dae794aef2b392d6", "kind": "trial_started", "payload": {"parent_id": "t0017", "reason": "Recombine two independently strong branches at the scheduled synthesis step.", "secondary_parent_id": "t0016", "stage": "recombine", "trial_id": "t0021"}, "prev_hash": "0b7e87da485d603c9198aeb6902e354c01c4b00bbe90fdb2f720306aed986402", "seq": 43, "timestamp": "2026-08-20T15:33:51.721670+00:00"}
