{"hash": "cf0bdf3749a7f70ff6a9158f582de9294c4cea8ad9aac4df1e6718d1679a8248", "kind": "trial_completed", "payload": {"champion_before": "t0073", "debug_depth": 0, "delta_vs_champion_before": 0.0003792120698757895, "delta_vs_parent": 0.0003792120698757895, "finding": "t0075 did not improve the prior champion: val_bpb=0.970968, delta=+0.000379. Hypothesis: The number of full-context layers is now bracketed and its optimum lies between the two tested values. At depth 12, three long layers scored 0.971071, four scored 0.970589 and six scored 0.970963, so the curve turns somewhere between four and six and the untested integer is five. The saturation has a mechanism behind it: document masking prevents attention from crossing document boundaries in every layer, so a full-context layer sees more than the 512-token short window only when the enclosing document is longer than that, and once enough global layers exist to route document-level information the rest buy little while still costing FLOPs. Five long layers tests whether the optimum sits just above four or exactly at it. A pattern of SSLSL cycled over twelve layers, with the last forced to full context, places long layers at indices 2, 4, 7, 9 and 11.", "measurements": [{"command": ["/data/home/zhubaiyu/.local/bin/uv", "run", "--project", "/data3/zhubaiyu/fengheguai/campaigns/h200-claude/nodes/t0075", "python", "/data3/zhubaiyu/fengheguai/fengheguai/_audit_runner.py", "--target", "/data3/zhubaiyu/fengheguai/campaigns/h200-claude/nodes/t0075", "--nonce", "fecc1900b083ed0781d47e6ae022c544b543db1abe21abcc"], "errors": [], "evidence_path": "/data3/zhubaiyu/fengheguai/campaigns/h200-claude/evidence/t0075-r0/evidence.json", "evidence_sha256": "a1d3514157cbf385e60b71560049e25d329af7390bae95a2968c3ea079661d8e", "log_path": "/data3/zhubaiyu/fengheguai/campaigns/h200-claude/evidence/t0075-r0/run.log", "log_sha256": "e195c381b9a2692a2f891539e2f2c2409de44b92c555f6347c6966c23c99a42b", "metric": 0.9709684489202697, "num_steps": 2827, "peak_vram_mb": 33800.4, "return_code": 0, "status": "valid", "timed_out": false, "train_sha256": "c82468ad30a09e65282891fcd9a5c38bb971f909cfa88f376da39586f05ed322", "training_seconds": 300.0, "wall_seconds": 564.2413112167269}], "metric": 0.9709684489202697, "parent_id": "t0073", "patch_path": "/data3/zhubaiyu/fengheguai/campaigns/h200-claude/artifacts/t0075/change.patch", "patch_sha256": "a53284006d1c9f931808f14af8c37d4fba645511a49583e150b1266e3ca4fd29", "promoted": false, "proposal": {"change_summary": "One constant changed on champion t0073: WINDOW_PATTERN from SSL to SSLSL. Cycling that length-5 pattern across depth 12 and forcing the final layer to full context yields the layout SSLSLSSLSLSL, five long layers and seven short ones, against the champion four and eight. The short window stays at sequence_len // 4 and no other structure changes: depth 12, width 512, HEAD_DIM 128, document masking, dense value embeddings with the 128-channel gate, output softcap 13, rotary base 30000, batch 2**17, the three settled learning rates, SCALAR_LR 0.5, ADAM_BETAS 0.8 and 0.95, WEIGHT_DECAY 0.146, FINAL_LR_FRAC 0.1 and WARMDOWN_RATIO 0.5 are unchanged.", "command": ["/usr/bin/python3", "/data3/zhubaiyu/fengheguai/fengheguai/rendezvous_agent.py", "--trial", "/data3/zhubaiyu/fengheguai/campaigns/h200-claude/nodes/t0075", "--result", "/data3/zhubaiyu/fengheguai/campaigns/h200-claude/nodes/t0075/.fengheguai-agent-result.json", "--schema", "/data3/zhubaiyu/fengheguai/campaigns/h200-claude/control/agent_output.schema.json", "--campaign", "/data3/zhubaiyu/fengheguai/campaigns/h200-claude", "--inbox", "/data3/zhubaiyu/fengheguai/campaigns/h200-claude-rendezvous"], "errors": [], "expected_val_bpb_effect": "Expected between a 0.0003 decrease and a 0.0005 increase versus champion t0073 at 0.970589, with the step count falling by roughly 1 to 2 percent from 2836. This is a one-integer refinement inside a measured bracket rather than a new direction, so the effect is small by construction and a null is a plausible outcome given the 0.00013 repeat noise; the value is in fixing the optimum precisely on an axis that has already produced a gain.", "hypothesis": "The number of full-context layers is now bracketed and its optimum lies between the two tested values. At depth 12, three long layers scored 0.971071, four scored 0.970589 and six scored 0.970963, so the curve turns somewhere between four and six and the untested integer is five. The saturation has a mechanism behind it: document masking prevents attention from crossing document boundaries in every layer, so a full-context layer sees more than the 512-token short window only when the enclosing document is longer than that, and once enough global layers exist to route document-level information the rest buy little while still costing FLOPs. Five long layers tests whether the optimum sits just above four or exactly at it. A pattern of SSLSL cycled over twelve layers, with the last forced to full context, places long layers at indices 2, 4, 7, 9 and 11.", "log_path": "/data3/zhubaiyu/fengheguai/campaigns/h200-claude/artifacts/t0075/agent.log", "return_code": 0, "risk": "The three measured points are close enough together that the curve between four and six may be flat rather than peaked, in which case five lands within noise and leaves the optimum undetermined between four and five rather than resolved. The uneven spacing of long layers in this pattern is also a confound the count alone does not capture: SSL distributes them evenly at every third layer while SSLSL clusters them at 2 and 4 then 7 and 9, so a difference here could reflect placement rather than count, and separating those would need a further node.", "success": true, "timed_out": false}, "secondary_parent_id": null, "selection_reason": "Spend the configured search share on a distinct architectural or recipe direction.", "source_sha256": "c82468ad30a09e65282891fcd9a5c38bb971f909cfa88f376da39586f05ed322", "stage": "explore", "status": "discard", "training_seconds": 300.0, "trial_id": "t0075", "workspace": "/data3/zhubaiyu/fengheguai/campaigns/h200-claude/nodes/t0075"}, "prev_hash": "3b2e567c1b518a5f96d3d478e2b46416f6a36522ca42da4d3da0a16c0377903a", "seq": 152, "timestamp": "2026-08-21T01:43:22.346208+00:00"}
{"hash": "d5a0aa6b63fdc85808bf0bb2108e75ed32f73e078d7c09ca670878a2d868c1dd", "kind": "trial_started", "payload": {"parent_id": "t0073", "reason": "Spend the configured search share on a distinct architectural or recipe direction.", "secondary_parent_id": null, "stage": "explore", "trial_id": "t0076"}, "prev_hash": "cf0bdf3749a7f70ff6a9158f582de9294c4cea8ad9aac4df1e6718d1679a8248", "seq": 153, "timestamp": "2026-08-21T01:43:22.388734+00:00"}
{"hash": "faebdcbb11e53d060cb3261662783acadae27b8afdb3b1b78536eb4e208b2ae7", "kind": "trial_completed", "payload": {"champion_before": "t0073", "debug_depth": 0, "delta_vs_champion_before": -0.00045432568503445125, "delta_vs_parent": -0.00045432568503445125, "finding": "t0076 improved the prior champion: val_bpb=0.970135, delta=-0.000454. Hypothesis: The short-window span and the number of global layers are coupled, and the span was fixed before the count changed. The 512-token span was chosen in t0002 at depth 8 and re-checked in t0030 at depth 12, but both were measured with the SSSL pattern, which places only three full-context layers. The champion now runs SSL with four, and t0073 showed that fourth global layer is worth 0.000482, which means more document-level routing capacity now exists than when the span was set. If the short layers were carrying medium-range context that the global layers can now absorb, the span can be narrowed further and the freed FLOPs converted into steps. Halving it to sequence_len // 8, or 256 tokens, removes about 12.6M per-token FLOPs from a total near 326M. This is also the one span setting never tested: 1024 and 512 have both been measured, 256 has not.", "measurements": [{"command": ["/data/home/zhubaiyu/.local/bin/uv", "run", "--project", "/data3/zhubaiyu/fengheguai/campaigns/h200-claude/nodes/t0076", "python", "/data3/zhubaiyu/fengheguai/fengheguai/_audit_runner.py", "--target", "/data3/zhubaiyu/fengheguai/campaigns/h200-claude/nodes/t0076", "--nonce", "c64cfdb76ba0925fa9f8687417a024ecc4899e3960eeac83"], "errors": [], "evidence_path": "/data3/zhubaiyu/fengheguai/campaigns/h200-claude/evidence/t0076-r0/evidence.json", "evidence_sha256": "9d70275c3483d95f8c0a74714b9d023797cad6c704077c056929c34bcfc9339d", "log_path": "/data3/zhubaiyu/fengheguai/campaigns/h200-claude/evidence/t0076-r0/run.log", "log_sha256": "9c965bd81b0df53636782cfdfcd099ad4c8193ff62deb114b5f7d00dd8a62a74", "metric": 0.9701421805168935, "num_steps": 2873, "peak_vram_mb": 33800.4, "return_code": 0, "status": "valid", "timed_out": false, "train_sha256": "da69af1e98de33a54962bd68b342c6f93068ec6f20b635bb9480b0b0a91f18ea", "training_seconds": 300.0, "wall_seconds": 564.503134037368}, {"command": ["/data/home/zhubaiyu/.local/bin/uv", "run", "--project", "/data3/zhubaiyu/fengheguai/campaigns/h200-claude/nodes/t0076", "python", "/data3/zhubaiyu/fengheguai/fengheguai/_audit_runner.py", "--target", "/data3/zhubaiyu/fengheguai/campaigns/h200-claude/nodes/t0076", "--nonce", "81f39a316e8a96a4a70bd6379a6811148d4e8c355f5cf3f2"], "errors": [], "evidence_path": "/data3/zhubaiyu/fengheguai/campaigns/h200-claude/evidence/t0076-r1/evidence.json", "evidence_sha256": "4ee04e6929875feb843447152d8ed6c41329fed53cf11328247564ad20e87735", "log_path": "/data3/zhubaiyu/fengheguai/campaigns/h200-claude/evidence/t0076-r1/run.log", "log_sha256": "d5bc10d54da7d302b6eb2d971c52bbd761df8b9eab4a5ac5f36562e1285ea9a3", "metric": 0.9701276418138255, "num_steps": 2875, "peak_vram_mb": 33800.4, "return_code": 0, "status": "valid", "timed_out": false, "train_sha256": "da69af1e98de33a54962bd68b342c6f93068ec6f20b635bb9480b0b0a91f18ea", "training_seconds": 300.1, "wall_seconds": 479.8018847415224}], "metric": 0.9701349111653594, "parent_id": "t0073", "patch_path": "/data3/zhubaiyu/fengheguai/campaigns/h200-claude/artifacts/t0076/change.patch", "patch_sha256": "806f3c29356dbbcfc552f909a3bb25f9d122f13fa3a2ff64b2724e43406235c5", "promoted": true, "proposal": {"change_summary": "One expression changed on champion t0073: short_window in GPT._compute_window_sizes from long_window // 4 to long_window // 8, so the eight short layers of the SSL pattern attend over 256 tokens instead of 512. The four full-context layers at indices 2, 5, 8 and 11 keep the full 2048 span and the pattern itself is unchanged. Depth 12, width 512, HEAD_DIM 128, document masking, dense value embeddings with the 128-channel gate, output softcap 13, rotary base 30000, batch 2**17, the three settled learning rates, SCALAR_LR 0.5, ADAM_BETAS 0.8 and 0.95, WEIGHT_DECAY 0.146, FINAL_LR_FRAC 0.1 and WARMDOWN_RATIO 0.5 are unchanged.", "command": ["/usr/bin/python3", "/data3/zhubaiyu/fengheguai/fengheguai/rendezvous_agent.py", "--trial", "/data3/zhubaiyu/fengheguai/campaigns/h200-claude/nodes/t0076", "--result", "/data3/zhubaiyu/fengheguai/campaigns/h200-claude/nodes/t0076/.fengheguai-agent-result.json", "--schema", "/data3/zhubaiyu/fengheguai/campaigns/h200-claude/control/agent_output.schema.json", "--campaign", "/data3/zhubaiyu/fengheguai/campaigns/h200-claude", "--inbox", "/data3/zhubaiyu/fengheguai/campaigns/h200-claude-rendezvous"], "errors": [], "expected_val_bpb_effect": "Expected between a 0.001 decrease and a 0.002 increase versus champion t0073 at 0.970589, with the step count rising by perhaps 1 to 2 percent from 2836. The direction has paid before, since narrowing 1024 to 512 gained 0.001882, but that gain came mostly from converting FLOPs into steps at a time when the model had 2099 steps and far fewer global layers, and both of those conditions have changed.", "hypothesis": "The short-window span and the number of global layers are coupled, and the span was fixed before the count changed. The 512-token span was chosen in t0002 at depth 8 and re-checked in t0030 at depth 12, but both were measured with the SSSL pattern, which places only three full-context layers. The champion now runs SSL with four, and t0073 showed that fourth global layer is worth 0.000482, which means more document-level routing capacity now exists than when the span was set. If the short layers were carrying medium-range context that the global layers can now absorb, the span can be narrowed further and the freed FLOPs converted into steps. Halving it to sequence_len // 8, or 256 tokens, removes about 12.6M per-token FLOPs from a total near 326M. This is also the one span setting never tested: 1024 and 512 have both been measured, 256 has not.", "log_path": "/data3/zhubaiyu/fengheguai/campaigns/h200-claude/artifacts/t0076/agent.log", "return_code": 0, "risk": "The realised step gain will probably be small, because t0011 and t0030 both showed attention FLOP changes convert into steps at roughly a quarter of what the FLOP model predicts, so this trades a definite loss of local context for an uncertain and modest gain in steps. A 256-token span is also short relative to typical document structure, and with document masking already truncating attention at boundaries the two restrictions compound, so the effective context for many positions would be well under 256. If it regresses, the span is confirmed optimal at 512 and the attention axes are closed in every direction tested.", "success": true, "timed_out": false}, "secondary_parent_id": null, "selection_reason": "Spend the configured search share on a distinct architectural or recipe direction.", "source_sha256": "da69af1e98de33a54962bd68b342c6f93068ec6f20b635bb9480b0b0a91f18ea", "stage": "explore", "status": "keep", "training_seconds": 300.05, "trial_id": "t0076", "workspace": "/data3/zhubaiyu/fengheguai/campaigns/h200-claude/nodes/t0076"}, "prev_hash": "d5a0aa6b63fdc85808bf0bb2108e75ed32f73e078d7c09ca670878a2d868c1dd", "seq": 154, "timestamp": "2026-08-21T02:01:53.492858+00:00"}
{"hash": "a7953676f0c8e8c353f7a70003690d220b1b9c32f33fa5809bd7c48f57e5f00c", "kind": "trial_started", "payload": {"parent_id": "t0076", "reason": "Recombine two independently strong branches at the scheduled synthesis step.", "secondary_parent_id": "t0073", "stage": "recombine", "trial_id": "t0077"}, "prev_hash": "faebdcbb11e53d060cb3261662783acadae27b8afdb3b1b78536eb4e208b2ae7", "seq": 155, "timestamp": "2026-08-21T02:01:53.536137+00:00"}
{"hash": "bf58bf710971e8973297510b55d3578a9788ff55fc57d5d63c362e5c51c32903", "kind": "trial_completed", "payload": {"champion_before": "t0076", "debug_depth": 0, "delta_vs_champion_before": 0.00045628812241194083, "delta_vs_parent": 0.00045628812241194083, "finding": "t0077 did not improve the prior champion: val_bpb=0.970591, delta=+0.000456. Hypothesis: The two elite lines are the two halves of a coupling this campaign discovered, and closing the loop is the synthesis they license. t0073 added a fourth full-context layer and gained 0.000482; t0076 then narrowed the short span from 512 to 256 and gained 0.000452, on the reasoning that the extra global layer had absorbed the medium-range context the short layers were carrying. The step counts confirm the mechanism, rising from 2836 to 2874. If the axes are genuinely coupled then the implication runs the other way too: a fifth global layer was tested at the 512 span in t0075 and lost 0.000379, but the short layers now cover half as much ground, so the document-level routing that the fifth layer would provide is worth more than it was. Testing SSLSL at the 256 span asks whether the earlier rejection was conditional on the span rather than final.", "measurements": [{"command": ["/data/home/zhubaiyu/.local/bin/uv", "run", "--project", "/data3/zhubaiyu/fengheguai/campaigns/h200-claude/nodes/t0077", "python", "/data3/zhubaiyu/fengheguai/fengheguai/_audit_runner.py", "--target", "/data3/zhubaiyu/fengheguai/campaigns/h200-claude/nodes/t0077", "--nonce", "ce8dadb49b4f1e558ffe9a7c67950bae2f7d06af8ee8fb80"], "errors": [], "evidence_path": "/data3/zhubaiyu/fengheguai/campaigns/h200-claude/evidence/t0077-r0/evidence.json", "evidence_sha256": "e1d643b814885b164a28f62880e7111446b2e6039eb68f29fe6a7b43012bcc80", "log_path": "/data3/zhubaiyu/fengheguai/campaigns/h200-claude/evidence/t0077-r0/run.log", "log_sha256": "9b39f92e015bd7beb506617e98cae2bda54a50f437e8fd2441f287421d9e559f", "metric": 0.9705911992877714, "num_steps": 2867, "peak_vram_mb": 33800.4, "return_code": 0, "status": "valid", "timed_out": false, "train_sha256": "66305b08b8d9335dd93d1cd01e293d5f79710ea4b8972ccc0f828d075b5b0250", "training_seconds": 300.1, "wall_seconds": 564.9981963215396}], "metric": 0.9705911992877714, "parent_id": "t0076", "patch_path": "/data3/zhubaiyu/fengheguai/campaigns/h200-claude/artifacts/t0077/change.patch", "patch_sha256": "e23fbe93bb82c0a5a03faff0cb3fc8ac41e9ef2dd17dbb2d54109948127939b1", "promoted": false, "proposal": {"change_summary": "One constant changed on champion t0076: WINDOW_PATTERN from SSL to SSLSL, giving five full-context layers at indices 2, 4, 7, 9 and 11 instead of four at 2, 5, 8 and 11. The short window stays at the champion value of long_window // 8, so the short layers keep their 256-token span. This is deliberately the same pattern t0075 tested at the 512 span, which makes the comparison direct in both directions: against the champion it measures the fifth layer at the new span, and against t0075 at 0.970968 it measures the span change at five layers. Depth 12, width 512, HEAD_DIM 128, document masking, dense value embeddings with the 128-channel gate, output softcap 13, rotary base 30000, batch 2**17, the three settled learning rates, SCALAR_LR 0.5, ADAM_BETAS 0.8 and 0.95, WEIGHT_DECAY 0.146, FINAL_LR_FRAC 0.1 and WARMDOWN_RATIO 0.5 are unchanged.", "command": ["/usr/bin/python3", "/data3/zhubaiyu/fengheguai/fengheguai/rendezvous_agent.py", "--trial", "/data3/zhubaiyu/fengheguai/campaigns/h200-claude/nodes/t0077", "--result", "/data3/zhubaiyu/fengheguai/campaigns/h200-claude/nodes/t0077/.fengheguai-agent-result.json", "--schema", "/data3/zhubaiyu/fengheguai/campaigns/h200-claude/control/agent_output.schema.json", "--campaign", "/data3/zhubaiyu/fengheguai/campaigns/h200-claude", "--inbox", "/data3/zhubaiyu/fengheguai/campaigns/h200-claude-rendezvous"], "errors": [], "expected_val_bpb_effect": "Expected between a 0.0005 decrease and a 0.0008 increase versus champion t0076 at 0.970135, with the step count falling by roughly 2 percent from 2874 as one short layer becomes a long one. The coupling argument makes a gain plausible where it was not before, but the fifth layer lost by 0.000379 at the wider span and the span change would have to be worth more than that to reverse it.", "hypothesis": "The two elite lines are the two halves of a coupling this campaign discovered, and closing the loop is the synthesis they license. t0073 added a fourth full-context layer and gained 0.000482; t0076 then narrowed the short span from 512 to 256 and gained 0.000452, on the reasoning that the extra global layer had absorbed the medium-range context the short layers were carrying. The step counts confirm the mechanism, rising from 2836 to 2874. If the axes are genuinely coupled then the implication runs the other way too: a fifth global layer was tested at the 512 span in t0075 and lost 0.000379, but the short layers now cover half as much ground, so the document-level routing that the fifth layer would provide is worth more than it was. Testing SSLSL at the 256 span asks whether the earlier rejection was conditional on the span rather than final.", "log_path": "/data3/zhubaiyu/fengheguai/campaigns/h200-claude/artifacts/t0077/agent.log", "return_code": 0, "risk": "The placement confound I recorded at t0075 still applies and is unresolved: SSL spaces its long layers evenly at every third index while SSLSL clusters them at 2 and 4 then 7 and 9, so any difference could reflect where the global layers sit rather than how many there are. That confound is now more troubling than before, because if this wins I would not know whether to attribute it to the count or the placement, and separating them would need a further node with five evenly spaced long layers, which twelve does not divide into cleanly.", "success": true, "timed_out": false}, "secondary_parent_id": "t0073", "selection_reason": "Recombine two independently strong branches at the scheduled synthesis step.", "source_sha256": "66305b08b8d9335dd93d1cd01e293d5f79710ea4b8972ccc0f828d075b5b0250", "stage": "recombine", "status": "discard", "training_seconds": 300.1, "trial_id": "t0077", "workspace": "/data3/zhubaiyu/fengheguai/campaigns/h200-claude/nodes/t0077"}, "prev_hash": "a7953676f0c8e8c353f7a70003690d220b1b9c32f33fa5809bd7c48f57e5f00c", "seq": 156, "timestamp": "2026-08-21T02:12:19.110643+00:00"}
{"hash": "d6e566fb62f9d940a357a75425e9ffc75860d510bbbff7072d1ecfa806beb1d8", "kind": "trial_started", "payload": {"parent_id": "t0076", "reason": "Exploit a top-K branch selected by quality plus an under-exploration bonus.", "secondary_parent_id": null, "stage": "refine", "trial_id": "t0078"}, "prev_hash": "bf58bf710971e8973297510b55d3578a9788ff55fc57d5d63c362e5c51c32903", "seq": 157, "timestamp": "2026-08-21T02:12:19.174733+00:00"}
