{"hash": "193199c4380e21d7746c4ddd82a50dc9cd79d5655be80b71ccabd18c5f939666", "kind": "trial_completed", "payload": {"champion_before": "t0017", "debug_depth": 0, "delta_vs_champion_before": 0.001186382451219048, "delta_vs_parent": 0.001186382451219048, "finding": "t0030 did not improve the prior champion: val_bpb=0.974557, delta=+0.001186. Hypothesis: The short attention window was set at a different operating point and has never been revisited. t0002 halved it from 1024 to 512 and gained 0.001882, but that measurement was taken at depth 8 with 2099 steps, before document masking existed, before value embeddings went dense, and before capacity moved to depth 12 with 1470 steps. Two things have changed that argue the trade may now reverse. Document masking already forbids attention from crossing into a neighbouring document, so a wider window no longer risks pulling in unrelated text and buys only genuine in-document context. And the earlier win came from converting attention FLOPs into steps, whereas t0011 later showed that FLOP cuts convert into steps very poorly here, only 0.8 percent of steps for a 4 percent FLOP cut, which means the step penalty for widening back to 1024 should be far smaller than the step gain that motivated narrowing it. Restoring the 1024 window should now lower val_bpb.", "measurements": [{"command": ["/data/home/zhubaiyu/.local/bin/uv", "run", "--project", "/data3/zhubaiyu/fengheguai/campaigns/h200-claude/nodes/t0030", "python", "/data3/zhubaiyu/fengheguai/fengheguai/_audit_runner.py", "--target", "/data3/zhubaiyu/fengheguai/campaigns/h200-claude/nodes/t0030", "--nonce", "9d5f027ce041f0aaff9851620209a6a2022ac80efb1844e5"], "errors": [], "evidence_path": "/data3/zhubaiyu/fengheguai/campaigns/h200-claude/evidence/t0030-r0/evidence.json", "evidence_sha256": "61ebd8454a0026845335f55a36abbe9b86c80bef023719b514f4988022ad4203", "log_path": "/data3/zhubaiyu/fengheguai/campaigns/h200-claude/evidence/t0030-r0/run.log", "log_sha256": "f8ad3f7026a26f66d01cdf568c8ced6fcfde9df8dc31a23b0d5e66babd2a5403", "metric": 0.974557200298043, "num_steps": 1452, "peak_vram_mb": 66795.6, "return_code": 0, "status": "valid", "timed_out": false, "train_sha256": "a1e538d9b06b9b6c47189549f99f9b00383201a0e6058828feaea4bd713dc14b", "training_seconds": 300.1, "wall_seconds": 564.1812037285417}], "metric": 0.974557200298043, "parent_id": "t0017", "patch_path": "/data3/zhubaiyu/fengheguai/campaigns/h200-claude/artifacts/t0030/change.patch", "patch_sha256": "445420fb2ade743eba479640daf19fd25fa2b788b10d151ec64e5ae610c8a97f", "promoted": false, "proposal": {"change_summary": "One expression changed on champion t0017: short_window in GPT._compute_window_sizes from long_window // 4 back to long_window // 2, so the nine S layers of the SSSL pattern at depth 12 attend over 1024 tokens instead of 512. The three L layers stay at the full 2048 context and the pattern itself is unchanged. Depth 12, width 512, document masking, dense value embeddings, batch 2**18, all learning rates, WEIGHT_DECAY 0.2 and every schedule are unchanged.", "command": ["/usr/bin/python3", "/data3/zhubaiyu/fengheguai/fengheguai/rendezvous_agent.py", "--trial", "/data3/zhubaiyu/fengheguai/campaigns/h200-claude/nodes/t0030", "--result", "/data3/zhubaiyu/fengheguai/campaigns/h200-claude/nodes/t0030/.fengheguai-agent-result.json", "--schema", "/data3/zhubaiyu/fengheguai/campaigns/h200-claude/control/agent_output.schema.json", "--campaign", "/data3/zhubaiyu/fengheguai/campaigns/h200-claude", "--inbox", "/data3/zhubaiyu/fengheguai/campaigns/h200-claude-rendezvous"], "errors": [], "expected_val_bpb_effect": "Expected between a 0.002 decrease and a 0.001 increase versus champion t0017 at 0.973371. The step count is the key diagnostic: widening the nine S layers adds about 28M FLOPs per token against a total near 317M, so the FLOP model predicts roughly 9 percent fewer steps, but the t0011 evidence says the realised step cost should be much smaller than that. If steps fall by only a few percent and quality improves, this is a genuine reversal driven by the operating point rather than by the original mechanism being wrong.", "hypothesis": "The short attention window was set at a different operating point and has never been revisited. t0002 halved it from 1024 to 512 and gained 0.001882, but that measurement was taken at depth 8 with 2099 steps, before document masking existed, before value embeddings went dense, and before capacity moved to depth 12 with 1470 steps. Two things have changed that argue the trade may now reverse. Document masking already forbids attention from crossing into a neighbouring document, so a wider window no longer risks pulling in unrelated text and buys only genuine in-document context. And the earlier win came from converting attention FLOPs into steps, whereas t0011 later showed that FLOP cuts convert into steps very poorly here, only 0.8 percent of steps for a 4 percent FLOP cut, which means the step penalty for widening back to 1024 should be far smaller than the step gain that motivated narrowing it. Restoring the 1024 window should now lower val_bpb.", "log_path": "/data3/zhubaiyu/fengheguai/campaigns/h200-claude/artifacts/t0030/agent.log", "return_code": 0, "risk": "This deliberately revisits a coordinate that already won in the opposite direction, which is only defensible because every relevant condition around it has changed; the same reasoning applied to value embeddings in t0022 and produced a clear answer. The honest possibility is that local context genuinely is all this model needs, in which case the extra FLOPs buy nothing and the lost steps cost about what the original change gained. If steps fall by the full 9 percent the FLOP model predicts, the result will be a throughput verdict rather than a context verdict, and num_steps will make that distinction visible.", "success": true, "timed_out": false}, "secondary_parent_id": null, "selection_reason": "The current line is stalled; make a structurally different bet.", "source_sha256": "a1e538d9b06b9b6c47189549f99f9b00383201a0e6058828feaea4bd713dc14b", "stage": "explore", "status": "discard", "training_seconds": 300.1, "trial_id": "t0030", "workspace": "/data3/zhubaiyu/fengheguai/campaigns/h200-claude/nodes/t0030"}, "prev_hash": "ce7613e9dbe3e749167fbca1c94df02cb7f575901d91bf0a2ed822e5c6c44fb3", "seq": 62, "timestamp": "2026-08-20T17:15:29.995478+00:00"}
{"hash": "b3f1836b1913ee1ba29733e96cc7d5701c712f6095a237bf8030d473d5404001", "kind": "trial_started", "payload": {"parent_id": "t0017", "reason": "The current line is stalled; make a structurally different bet.", "secondary_parent_id": null, "stage": "explore", "trial_id": "t0031"}, "prev_hash": "193199c4380e21d7746c4ddd82a50dc9cd79d5655be80b71ccabd18c5f939666", "seq": 63, "timestamp": "2026-08-20T17:15:30.014077+00:00"}
{"hash": "e36c07609588249cb8af47ce1ecdbd7bc63c592d065d685f3c7d4497fe57288c", "kind": "trial_completed", "payload": {"champion_before": "t0017", "debug_depth": 0, "delta_vs_champion_before": -0.00020826862536982294, "delta_vs_parent": -0.00020826862536982294, "finding": "t0031 improved the prior champion: val_bpb=0.973163, delta=-0.000208. Hypothesis: The value-embedding path is the most load-bearing mechanism in this model, worth 0.001806 at depth 12 by the t0022 measurement, yet the gate that controls it sees almost nothing. Each layer computes its gate as 2*sigmoid of a linear map applied to x[..., :32], the first 32 of 512 residual channels, so the decision of how much token-indexed memory to inject is made from six percent of the available context and from an arbitrary slice of it rather than a learned projection of the whole. Widening ve_gate_channels to 128 gives that decision four times the context at negligible cost, since the gate projection is only ve_gate_channels by n_kv_head, which grows from 32x4 to 128x4 weights per layer. If the gate is the bottleneck on a mechanism that is already the strongest in the recipe, this should lower val_bpb.", "measurements": [{"command": ["/data/home/zhubaiyu/.local/bin/uv", "run", "--project", "/data3/zhubaiyu/fengheguai/campaigns/h200-claude/nodes/t0031", "python", "/data3/zhubaiyu/fengheguai/fengheguai/_audit_runner.py", "--target", "/data3/zhubaiyu/fengheguai/campaigns/h200-claude/nodes/t0031", "--nonce", "bfc3f605990de964b1904111a9e509b1972bfdc59b21a45c"], "errors": [], "evidence_path": "/data3/zhubaiyu/fengheguai/campaigns/h200-claude/evidence/t0031-r0/evidence.json", "evidence_sha256": "22b1a3bc4f2ea44b4c25ff7386f53e5f92fc894bfc3addf8f78e90f8d5f1be64", "log_path": "/data3/zhubaiyu/fengheguai/campaigns/h200-claude/evidence/t0031-r0/run.log", "log_sha256": "0bbc147196670a0118ad15ad947114dd418a474227b594c7d07b84b5e4c2ad5a", "metric": 0.9731563453528105, "num_steps": 1470, "peak_vram_mb": 66795.4, "return_code": 0, "status": "valid", "timed_out": false, "train_sha256": "dced0b1c72f0db23a66ce4e5a6d96ad39d06e0cd46bdeba629875e99a466e856", "training_seconds": 300.0, "wall_seconds": 575.8538495413959}, {"command": ["/data/home/zhubaiyu/.local/bin/uv", "run", "--project", "/data3/zhubaiyu/fengheguai/campaigns/h200-claude/nodes/t0031", "python", "/data3/zhubaiyu/fengheguai/fengheguai/_audit_runner.py", "--target", "/data3/zhubaiyu/fengheguai/campaigns/h200-claude/nodes/t0031", "--nonce", "d49ad3c26b37d985a42a1be42457ddc2b95833f7b968dfc2"], "errors": [], "evidence_path": "/data3/zhubaiyu/fengheguai/campaigns/h200-claude/evidence/t0031-r1/evidence.json", "evidence_sha256": "03107937109078833b271a02645528ff6d5fccfa751e224b9e65cfa8217d4db9", "log_path": "/data3/zhubaiyu/fengheguai/campaigns/h200-claude/evidence/t0031-r1/run.log", "log_sha256": "51acaa5cc5dc8a994bb39f47c444cfd7a966a53890aa767f321c888ec56e2764", "metric": 0.9731687530900978, "num_steps": 1467, "peak_vram_mb": 66795.4, "return_code": 0, "status": "valid", "timed_out": false, "train_sha256": "dced0b1c72f0db23a66ce4e5a6d96ad39d06e0cd46bdeba629875e99a466e856", "training_seconds": 300.0, "wall_seconds": 479.788393560797}], "metric": 0.9731625492214542, "parent_id": "t0017", "patch_path": "/data3/zhubaiyu/fengheguai/campaigns/h200-claude/artifacts/t0031/change.patch", "patch_sha256": "5b9378c13a99abaf4d43a0632b728c184facf85555ea386626b2fc1d465e0b49", "promoted": true, "proposal": {"change_summary": "One constant changed on champion t0017: CausalSelfAttention.ve_gate_channels from 32 to 128, so each of the twelve ve_gate projections reads the first 128 residual channels instead of the first 32. Parameter count rises by 384 weights per gated layer, a rounding error against 96M, and the per-token FLOP change is negligible. The gate form, the doubling through sigmoid, dense value embeddings, depth 12, width 512, document masking, the 512-token short window, batch 2**18, all learning rates, WEIGHT_DECAY 0.2 and every schedule are unchanged.", "command": ["/usr/bin/python3", "/data3/zhubaiyu/fengheguai/fengheguai/rendezvous_agent.py", "--trial", "/data3/zhubaiyu/fengheguai/campaigns/h200-claude/nodes/t0031", "--result", "/data3/zhubaiyu/fengheguai/campaigns/h200-claude/nodes/t0031/.fengheguai-agent-result.json", "--schema", "/data3/zhubaiyu/fengheguai/campaigns/h200-claude/control/agent_output.schema.json", "--campaign", "/data3/zhubaiyu/fengheguai/campaigns/h200-claude", "--inbox", "/data3/zhubaiyu/fengheguai/campaigns/h200-claude-rendezvous"], "errors": [], "expected_val_bpb_effect": "Expected between a 0.002 decrease and a 0.0005 increase versus champion t0017 at 0.973371, with step count essentially unchanged since the added compute is negligible. The asymmetry reflects that this adds capacity to a control path rather than to the model proper, so the downside is bounded by mild overfitting of the gate while the upside is whatever the mechanism was being held back by.", "hypothesis": "The value-embedding path is the most load-bearing mechanism in this model, worth 0.001806 at depth 12 by the t0022 measurement, yet the gate that controls it sees almost nothing. Each layer computes its gate as 2*sigmoid of a linear map applied to x[..., :32], the first 32 of 512 residual channels, so the decision of how much token-indexed memory to inject is made from six percent of the available context and from an arbitrary slice of it rather than a learned projection of the whole. Widening ve_gate_channels to 128 gives that decision four times the context at negligible cost, since the gate projection is only ve_gate_channels by n_kv_head, which grows from 32x4 to 128x4 weights per layer. If the gate is the bottleneck on a mechanism that is already the strongest in the recipe, this should lower val_bpb.", "log_path": "/data3/zhubaiyu/fengheguai/campaigns/h200-claude/artifacts/t0031/agent.log", "return_code": 0, "risk": "The 32-channel slice may be a deliberate choice rather than an oversight, since restricting the gate to a narrow slice keeps it cheap and acts as a regulariser on a path that already carries 50M parameters, in which case widening it will mildly overfit. The wider slice also still uses the first 128 channels rather than a learned projection of all 512, so a null result would not distinguish between the gate having enough context already and the arbitrary slice being the real limitation. Thirteen consecutive discards mean the base rate for any single change here is low, and this one is chosen because it targets the mechanism with the strongest measured effect rather than because it is likely on its own.", "success": true, "timed_out": false}, "secondary_parent_id": null, "selection_reason": "The current line is stalled; make a structurally different bet.", "source_sha256": "dced0b1c72f0db23a66ce4e5a6d96ad39d06e0cd46bdeba629875e99a466e856", "stage": "explore", "status": "keep", "training_seconds": 300.0, "trial_id": "t0031", "workspace": "/data3/zhubaiyu/fengheguai/campaigns/h200-claude/nodes/t0031"}, "prev_hash": "b3f1836b1913ee1ba29733e96cc7d5701c712f6095a237bf8030d473d5404001", "seq": 64, "timestamp": "2026-08-20T17:34:36.532369+00:00"}
{"hash": "458b3e14413c7ed5cb3636cc51457da50bcf9d3248c6223bfbe0734a9ff68323", "kind": "trial_started", "payload": {"parent_id": "t0031", "reason": "Spend the configured search share on a distinct architectural or recipe direction.", "secondary_parent_id": null, "stage": "explore", "trial_id": "t0032"}, "prev_hash": "e36c07609588249cb8af47ce1ecdbd7bc63c592d065d685f3c7d4497fe57288c", "seq": 65, "timestamp": "2026-08-20T17:34:36.556978+00:00"}
{"hash": "44e248121e13237cd709c99ae2cc6c5955f2d3613f3677ed12a7465e4719946e", "kind": "trial_completed", "payload": {"champion_before": "t0031", "debug_depth": 0, "delta_vs_champion_before": 0.002143174904805756, "delta_vs_parent": 0.002143174904805756, "finding": "t0032 did not improve the prior champion: val_bpb=0.975306, delta=+0.002143. Hypothesis: Widening the value-embedding gate from 32 to 128 channels in t0031 gained 0.000208 at no step cost, 1470 and 1467 steps against the champion 1470, which is the first improvement in fourteen nodes and says the gate rather than the mechanism was the binding constraint. That node left one question open by construction: it still fed the gate an arbitrary prefix of the residual stream, so a gain could mean either that more context helps or merely that 128 arbitrary channels happen to carry more signal than 32. Setting ve_gate_channels to the full model width of 512 resolves both at once, since the slice then becomes the entire residual stream and the projection is a genuine learned map over all of it rather than over a prefix. If the trend from 32 to 128 continues, this should lower val_bpb again.", "measurements": [{"command": ["/data/home/zhubaiyu/.local/bin/uv", "run", "--project", "/data3/zhubaiyu/fengheguai/campaigns/h200-claude/nodes/t0032", "python", "/data3/zhubaiyu/fengheguai/fengheguai/_audit_runner.py", "--target", "/data3/zhubaiyu/fengheguai/campaigns/h200-claude/nodes/t0032", "--nonce", "c1dc28bcd3044a9d9beedfd9fb0a2ca147556798de94153b"], "errors": [], "evidence_path": "/data3/zhubaiyu/fengheguai/campaigns/h200-claude/evidence/t0032-r0/evidence.json", "evidence_sha256": "30a73029b29af2be83de65ec96c6e82cb6d8202bf5343db1b8724fe03060525c", "log_path": "/data3/zhubaiyu/fengheguai/campaigns/h200-claude/evidence/t0032-r0/run.log", "log_sha256": "42c796e6d69bd18669a1cc44aa73a9d82b32b1caba6d60d0daaf8733e29eab2e", "metric": 0.9753057241262599, "num_steps": 1459, "peak_vram_mb": 66795.5, "return_code": 0, "status": "valid", "timed_out": false, "train_sha256": "1f2c2e7d0573f96f84119bd035d0e91d6ccaf57074b88bcd0a8ab3bd137e513a", "training_seconds": 300.1, "wall_seconds": 569.5926834726706}], "metric": 0.9753057241262599, "parent_id": "t0031", "patch_path": "/data3/zhubaiyu/fengheguai/campaigns/h200-claude/artifacts/t0032/change.patch", "patch_sha256": "36d518b6e1ab4073749826b151d63b46522599f395e18f9a21a51edc8e8a326b", "promoted": false, "proposal": {"change_summary": "One expression changed on champion t0031: ve_gate_channels from the literal 128 to self.n_embd, which is 512 here, so each of the twelve ve_gate projections reads the whole residual vector instead of its first 128 channels and x[..., :self.ve_gate_channels] becomes the full x. Each gate projection grows from 128x4 to 512x4 weights, adding about 18K parameters across the model against 96M. Dense value embeddings, depth 12, width 512, document masking, the 512-token short window, batch 2**18, all learning rates, WEIGHT_DECAY 0.2 and every schedule are unchanged.", "command": ["/usr/bin/python3", "/data3/zhubaiyu/fengheguai/fengheguai/rendezvous_agent.py", "--trial", "/data3/zhubaiyu/fengheguai/campaigns/h200-claude/nodes/t0032", "--result", "/data3/zhubaiyu/fengheguai/campaigns/h200-claude/nodes/t0032/.fengheguai-agent-result.json", "--schema", "/data3/zhubaiyu/fengheguai/campaigns/h200-claude/control/agent_output.schema.json", "--campaign", "/data3/zhubaiyu/fengheguai/campaigns/h200-claude", "--inbox", "/data3/zhubaiyu/fengheguai/campaigns/h200-claude-rendezvous"], "errors": [], "expected_val_bpb_effect": "Expected between a 0.0005 decrease and a 0.0003 increase versus champion t0031 at 0.973163, with step count essentially unchanged. The 32 to 128 step bought 0.000208, so if the relationship is roughly logarithmic in gate width the 128 to 512 step should buy a similar amount again; if 128 already saturated the available signal, this lands within noise and fixes the gate width there.", "hypothesis": "Widening the value-embedding gate from 32 to 128 channels in t0031 gained 0.000208 at no step cost, 1470 and 1467 steps against the champion 1470, which is the first improvement in fourteen nodes and says the gate rather than the mechanism was the binding constraint. That node left one question open by construction: it still fed the gate an arbitrary prefix of the residual stream, so a gain could mean either that more context helps or merely that 128 arbitrary channels happen to carry more signal than 32. Setting ve_gate_channels to the full model width of 512 resolves both at once, since the slice then becomes the entire residual stream and the projection is a genuine learned map over all of it rather than over a prefix. If the trend from 32 to 128 continues, this should lower val_bpb again.", "log_path": "/data3/zhubaiyu/fengheguai/campaigns/h200-claude/artifacts/t0032/agent.log", "return_code": 0, "risk": "This is a small effect near the resolution limit of the measurement, since the t0031 gain of 0.000208 is only about 1.6 times the 0.00013 repeat noise, so a null here would be genuinely undecidable rather than a clean saturation verdict. Tying the gate width to n_embd also couples it to model width, which matters only if capacity is revisited, and capacity is already bracketed at depth 12 and width 512. The wider gate adds control-path capacity that could mildly overfit, the same bounded downside as t0031.", "success": true, "timed_out": false}, "secondary_parent_id": null, "selection_reason": "Spend the configured search share on a distinct architectural or recipe direction.", "source_sha256": "1f2c2e7d0573f96f84119bd035d0e91d6ccaf57074b88bcd0a8ab3bd137e513a", "stage": "explore", "status": "discard", "training_seconds": 300.1, "trial_id": "t0032", "workspace": "/data3/zhubaiyu/fengheguai/campaigns/h200-claude/nodes/t0032"}, "prev_hash": "458b3e14413c7ed5cb3636cc51457da50bcf9d3248c6223bfbe0734a9ff68323", "seq": 66, "timestamp": "2026-08-20T17:45:02.639565+00:00"}
{"hash": "6d206d44a834ed6b456a4e074335443b713729e238488735dec798f6014e19db", "kind": "trial_started", "payload": {"parent_id": "t0031", "reason": "Spend the configured search share on a distinct architectural or recipe direction.", "secondary_parent_id": null, "stage": "explore", "trial_id": "t0033"}, "prev_hash": "44e248121e13237cd709c99ae2cc6c5955f2d3613f3677ed12a7465e4719946e", "seq": 67, "timestamp": "2026-08-20T17:45:02.660494+00:00"}
