{"hash": "dc091558ece918e3d2d87cdb9e9e1b72bc20085db1d60617475cfa1946d28b08", "kind": "trial_completed", "payload": {"champion_before": "t0002", "debug_depth": 0, "delta_vs_champion_before": 0.005059144922740955, "delta_vs_parent": 0.005059144922740955, "finding": "t0003 did not improve the prior champion: val_bpb=0.986688, delta=+0.005059. Hypothesis: The batch-size lever is not yet saturated. Halving TOTAL_BATCH_SIZE from 2**19 to 2**18 in t0001 bought 0.007557 bpb by doubling optimizer steps, which means the previous batch was above the critical batch size for this loss regime. If the critical size is still below 2**18, a further halving to 2**17 (131K tokens per step, with DEVICE_BATCH_SIZE reduced to 64 so gradient accumulation stays at 1) should again convert batch width into steps and lower val_bpb; if the critical size has been crossed, the added gradient noise will make it rise, which locates the optimum.", "measurements": [{"command": ["/data/home/zhubaiyu/.local/bin/uv", "run", "--project", "/data3/zhubaiyu/fengheguai/campaigns/h200-claude/nodes/t0003", "python", "/data3/zhubaiyu/fengheguai/fengheguai/_audit_runner.py", "--target", "/data3/zhubaiyu/fengheguai/campaigns/h200-claude/nodes/t0003", "--nonce", "c44d087544d67b20f23fed22044f71620124aab42a99c5ca"], "errors": [], "evidence_path": "/data3/zhubaiyu/fengheguai/campaigns/h200-claude/evidence/t0003-r0/evidence.json", "evidence_sha256": "1cdae1684b1e30f03cf9a1bab0bb283682c965c3cf5d37009b9cc9e538da92d0", "log_path": "/data3/zhubaiyu/fengheguai/campaigns/h200-claude/evidence/t0003-r0/run.log", "log_sha256": "fbdedc0f182ab57ad45f6eb8f0856ec2e78e4affe9241a001418ac22dc24aa56", "metric": 0.9866882102198972, "num_steps": 4082, "peak_vram_mb": 22701.2, "return_code": 0, "status": "valid", "timed_out": false, "train_sha256": "1cb0adaee1b84c32a45e29924c3b4e1388491ebfafed7f1648f3bfae1f6dee7a", "training_seconds": 300.0, "wall_seconds": 476.3171529164538}], "metric": 0.9866882102198972, "parent_id": "t0002", "patch_path": "/data3/zhubaiyu/fengheguai/campaigns/h200-claude/artifacts/t0003/change.patch", "patch_sha256": "9d344c92afd2546bc2705d56c4572eb16e1ae92d24e987910964ac7103dc7abb", "promoted": false, "proposal": {"change_summary": "Batching-only change on champion t0002: TOTAL_BATCH_SIZE 2**18 -> 2**17 and DEVICE_BATCH_SIZE 128 -> 64, keeping gradient accumulation at exactly 1 micro-step. Sequence length 2048, the SSSL pattern with the 512-token short window from t0002, capacity, optimizer and all schedules are unchanged.", "command": ["/usr/bin/python3", "/data3/zhubaiyu/fengheguai/fengheguai/rendezvous_agent.py", "--trial", "/data3/zhubaiyu/fengheguai/campaigns/h200-claude/nodes/t0003", "--result", "/data3/zhubaiyu/fengheguai/campaigns/h200-claude/nodes/t0003/.fengheguai-agent-result.json", "--schema", "/data3/zhubaiyu/fengheguai/campaigns/h200-claude/control/agent_output.schema.json", "--campaign", "/data3/zhubaiyu/fengheguai/campaigns/h200-claude", "--inbox", "/data3/zhubaiyu/fengheguai/campaigns/h200-claude-rendezvous"], "errors": [], "expected_val_bpb_effect": "Expected decrease of roughly 0.002-0.006 bpb versus champion t0002 at 0.981629, i.e. a smaller gain than t0001 delivered because the step-count return diminishes as the critical batch size is approached. A rise instead would mean 2**18 was already at or below the critical size and would fix the batch lever at its current setting.", "hypothesis": "The batch-size lever is not yet saturated. Halving TOTAL_BATCH_SIZE from 2**19 to 2**18 in t0001 bought 0.007557 bpb by doubling optimizer steps, which means the previous batch was above the critical batch size for this loss regime. If the critical size is still below 2**18, a further halving to 2**17 (131K tokens per step, with DEVICE_BATCH_SIZE reduced to 64 so gradient accumulation stays at 1) should again convert batch width into steps and lower val_bpb; if the critical size has been crossed, the added gradient noise will make it rise, which locates the optimum.", "log_path": "/data3/zhubaiyu/fengheguai/campaigns/h200-claude/artifacts/t0003/agent.log", "return_code": 0, "risk": "Learning rates are inherited from a recipe tuned at 2**19 tokens per step and are now two halvings away from it, so the gradient-noise-to-LR ratio is the main failure mode; Muon could become unstable early. The smaller 64x2048 micro-batch may also reduce GPU efficiency slightly, partially offsetting the step gain. Evaluation remains comparable: EVAL_TOKENS divides exactly by both the old and new eval batch sizes, so the same 20,971,520 validation tokens are scored.", "success": true, "timed_out": false}, "secondary_parent_id": null, "selection_reason": "Exploit a top-K branch selected by quality plus an under-exploration bonus.", "source_sha256": "1cb0adaee1b84c32a45e29924c3b4e1388491ebfafed7f1648f3bfae1f6dee7a", "stage": "refine", "status": "discard", "training_seconds": 300.0, "trial_id": "t0003", "workspace": "/data3/zhubaiyu/fengheguai/campaigns/h200-claude/nodes/t0003"}, "prev_hash": "3939ca0285ff1207f6ff7f88e3da8fcd5a475579885e07e747223870e4704228", "seq": 8, "timestamp": "2026-08-20T11:56:25.295675+00:00"}
{"hash": "6344910bbdff39e6ab888532da62500a4f8d26fe50f5a1738d830d565ed04341", "kind": "trial_started", "payload": {"parent_id": "t0002", "reason": "Exploit a top-K branch selected by quality plus an under-exploration bonus.", "secondary_parent_id": null, "stage": "refine", "trial_id": "t0004"}, "prev_hash": "dc091558ece918e3d2d87cdb9e9e1b72bc20085db1d60617475cfa1946d28b08", "seq": 9, "timestamp": "2026-08-20T11:56:25.300456+00:00"}
{"hash": "c1312cc02e074e2dfbba07171865000c2b9e04971114d0b461c094e36c4a8913", "kind": "trial_completed", "payload": {"champion_before": "t0002", "debug_depth": 0, "delta_vs_champion_before": -0.0004824177457987133, "delta_vs_parent": -0.0004824177457987133, "finding": "t0004 improved the prior champion: val_bpb=0.981147, delta=-0.000482. Hypothesis: The learning rates in this recipe were tuned at TOTAL_BATCH_SIZE=2**19, but the champion now trains at 2**18 with those rates unchanged, so the update-size to gradient-noise ratio is roughly sqrt(2) too aggressive. This also offers a competing explanation for the t0003 failure: at 2**17 the inherited rates were about 2x too large, so t0003 may have measured a learning-rate mismatch rather than a true critical batch size. Rescaling the three main learning rates by 1/sqrt(2), the standard square-root batch scaling, should lower val_bpb below champion t0002.", "measurements": [{"command": ["/data/home/zhubaiyu/.local/bin/uv", "run", "--project", "/data3/zhubaiyu/fengheguai/campaigns/h200-claude/nodes/t0004", "python", "/data3/zhubaiyu/fengheguai/fengheguai/_audit_runner.py", "--target", "/data3/zhubaiyu/fengheguai/campaigns/h200-claude/nodes/t0004", "--nonce", "bde89ae35c8d173ced95c75879f332d027e0266b79884fe9"], "errors": [], "evidence_path": "/data3/zhubaiyu/fengheguai/campaigns/h200-claude/evidence/t0004-r0/evidence.json", "evidence_sha256": "b9062917db7f254c1ee51fcb9a0494cdec849ea158cb2dcc5efefcf0b830371b", "log_path": "/data3/zhubaiyu/fengheguai/campaigns/h200-claude/evidence/t0004-r0/run.log", "log_sha256": "188be184f366b4d6b1c9f4b5911c1eda64770ea12f04d2a7c71a74c8e72d066d", "metric": 0.9811028008803885, "num_steps": 2101, "peak_vram_mb": 44908.2, "return_code": 0, "status": "valid", "timed_out": false, "train_sha256": "df7cad00dae2364350819aee5b6bca89e4d0b4a3fbf004c6450a350010521ad2", "training_seconds": 300.1, "wall_seconds": 461.6848851945251}, {"command": ["/data/home/zhubaiyu/.local/bin/uv", "run", "--project", "/data3/zhubaiyu/fengheguai/campaigns/h200-claude/nodes/t0004", "python", "/data3/zhubaiyu/fengheguai/fengheguai/_audit_runner.py", "--target", "/data3/zhubaiyu/fengheguai/campaigns/h200-claude/nodes/t0004", "--nonce", "e3aea7bbade911120d9ad8ef55c374e0f44e9ea3fe516baa"], "errors": [], "evidence_path": "/data3/zhubaiyu/fengheguai/campaigns/h200-claude/evidence/t0004-r1/evidence.json", "evidence_sha256": "87aacca37a2bef9cdcfe54348fc4b2878e8edc32d8ac798d936b652367561e31", "log_path": "/data3/zhubaiyu/fengheguai/campaigns/h200-claude/evidence/t0004-r1/run.log", "log_sha256": "451833a8c1b652b1cc9c45b5afb1692d3167e5d9fcfc56347e4e7bf0ca047c9f", "metric": 0.9811904942223264, "num_steps": 2100, "peak_vram_mb": 44908.2, "return_code": 0, "status": "valid", "timed_out": false, "train_sha256": "df7cad00dae2364350819aee5b6bca89e4d0b4a3fbf004c6450a350010521ad2", "training_seconds": 300.1, "wall_seconds": 454.8761322144419}], "metric": 0.9811466475513575, "parent_id": "t0002", "patch_path": "/data3/zhubaiyu/fengheguai/campaigns/h200-claude/artifacts/t0004/change.patch", "patch_sha256": "e98d3311c545a3d8881fe4305849092ddf65defbaeb95d07086b867a3969bee1", "promoted": true, "proposal": {"change_summary": "One coherent recipe change on champion t0002: rescale the learning rates to match the batch size actually in use. EMBEDDING_LR 0.6 -> 0.4243, UNEMBEDDING_LR 0.004 -> 0.002828, MATRIX_LR 0.04 -> 0.02828, each divided by sqrt(2). SCALAR_LR, batch size, the 512-token short window, capacity, optimizer structure and all schedule shapes are unchanged.", "command": ["/usr/bin/python3", "/data3/zhubaiyu/fengheguai/fengheguai/rendezvous_agent.py", "--trial", "/data3/zhubaiyu/fengheguai/campaigns/h200-claude/nodes/t0004", "--result", "/data3/zhubaiyu/fengheguai/campaigns/h200-claude/nodes/t0004/.fengheguai-agent-result.json", "--schema", "/data3/zhubaiyu/fengheguai/campaigns/h200-claude/control/agent_output.schema.json", "--campaign", "/data3/zhubaiyu/fengheguai/campaigns/h200-claude", "--inbox", "/data3/zhubaiyu/fengheguai/campaigns/h200-claude-rendezvous"], "errors": [], "expected_val_bpb_effect": "Expected decrease of roughly 0.001-0.005 bpb versus champion t0002 at 0.981629. If val_bpb instead rises, the inherited rates were already correct or under-scaled at 2**18, which would mean the orthogonalised Muon updates are largely insensitive to batch noise here and would redirect the search away from the learning-rate axis entirely.", "hypothesis": "The learning rates in this recipe were tuned at TOTAL_BATCH_SIZE=2**19, but the champion now trains at 2**18 with those rates unchanged, so the update-size to gradient-noise ratio is roughly sqrt(2) too aggressive. This also offers a competing explanation for the t0003 failure: at 2**17 the inherited rates were about 2x too large, so t0003 may have measured a learning-rate mismatch rather than a true critical batch size. Rescaling the three main learning rates by 1/sqrt(2), the standard square-root batch scaling, should lower val_bpb below champion t0002.", "log_path": "/data3/zhubaiyu/fengheguai/campaigns/h200-claude/artifacts/t0004/agent.log", "return_code": 0, "risk": "Muon normalises its update direction, so square-root batch scaling borrowed from Adam-style analysis may not transfer; the rates could simply end up too small, producing slower progress and a worse loss at the 300-second cutoff. The three rates are moved together, so a win does not attribute the gain to a specific parameter group and would need a follow-up node to decompose.", "success": true, "timed_out": false}, "secondary_parent_id": null, "selection_reason": "Exploit a top-K branch selected by quality plus an under-exploration bonus.", "source_sha256": "df7cad00dae2364350819aee5b6bca89e4d0b4a3fbf004c6450a350010521ad2", "stage": "refine", "status": "keep", "training_seconds": 300.1, "trial_id": "t0004", "workspace": "/data3/zhubaiyu/fengheguai/campaigns/h200-claude/nodes/t0004"}, "prev_hash": "6344910bbdff39e6ab888532da62500a4f8d26fe50f5a1738d830d565ed04341", "seq": 10, "timestamp": "2026-08-20T12:13:22.624559+00:00"}
{"hash": "1d1844cf8754c36dad6d67448f9e8b72dba03abf24065c44bc4a31de0801216c", "kind": "trial_started", "payload": {"parent_id": "t0004", "reason": "Exploit a top-K branch selected by quality plus an under-exploration bonus.", "secondary_parent_id": null, "stage": "refine", "trial_id": "t0005"}, "prev_hash": "c1312cc02e074e2dfbba07171865000c2b9e04971114d0b461c094e36c4a8913", "seq": 11, "timestamp": "2026-08-20T12:13:22.629881+00:00"}
{"hash": "370f14b763328e23bdd8ad7d389fe16071c6da4095b243b5f0f37ca4387db9a1", "kind": "trial_completed", "payload": {"champion_before": "t0004", "debug_depth": 0, "delta_vs_champion_before": 0.00010102385875976339, "delta_vs_parent": 0.00010102385875976339, "finding": "t0005 did not improve the prior champion: val_bpb=0.981248, delta=+0.000101. Hypothesis: t0003 and t0004 offer competing explanations for the failure at TOTAL_BATCH_SIZE=2**17. Either 2**18 really is the critical batch size, or t0003 simply inherited learning rates that were 2x too large for the batch it ran. t0004 showed the learning-rate axis is live at 2**18, since a 1/sqrt(2) rescale bought 0.000482 bpb against a repeat noise level near 0.0001. This node moves batch and learning rate together along the square-root scaling line: batch 2**17 with all three main rates at half their original 2**19 values. If the t0003 failure was a rate mismatch, this should now beat champion t0004; if 2**18 is genuinely critical, it will lose even with matched rates, which settles the question.", "measurements": [{"command": ["/data/home/zhubaiyu/.local/bin/uv", "run", "--project", "/data3/zhubaiyu/fengheguai/campaigns/h200-claude/nodes/t0005", "python", "/data3/zhubaiyu/fengheguai/fengheguai/_audit_runner.py", "--target", "/data3/zhubaiyu/fengheguai/campaigns/h200-claude/nodes/t0005", "--nonce", "ff9ba026fd0277eb8e94a6258af5f3a5b59f8170cc110ac2"], "errors": [], "evidence_path": "/data3/zhubaiyu/fengheguai/campaigns/h200-claude/evidence/t0005-r0/evidence.json", "evidence_sha256": "7be9b157bf7f5fc3995deebb407940803ef84931f2531debe10709844f57e816", "log_path": "/data3/zhubaiyu/fengheguai/campaigns/h200-claude/evidence/t0005-r0/run.log", "log_sha256": "86e3d093f4d0ee4e4a99630e7684ced1d8688bde452f648c6f254ed9f5350cfb", "metric": 0.9812476714101173, "num_steps": 4078, "peak_vram_mb": 22701.2, "return_code": 0, "status": "valid", "timed_out": false, "train_sha256": "36e89821003667c879657feb6fd9392d57744fad6cb701530b2f687680e0ba41", "training_seconds": 300.0, "wall_seconds": 460.55091328918934}], "metric": 0.9812476714101173, "parent_id": "t0004", "patch_path": "/data3/zhubaiyu/fengheguai/campaigns/h200-claude/artifacts/t0005/change.patch", "patch_sha256": "f943d8a1b3f232baaed885734dea70c63ac3a3429303e13476fad1cd147f34e6", "promoted": false, "proposal": {"change_summary": "Coordinated move along the batch-versus-learning-rate scaling line on champion t0004: TOTAL_BATCH_SIZE 2**18 -> 2**17 and DEVICE_BATCH_SIZE 128 -> 64 (gradient accumulation stays at 1), with EMBEDDING_LR 0.4243 -> 0.3, UNEMBEDDING_LR 0.002828 -> 0.002 and MATRIX_LR 0.02828 -> 0.02, each a further 1/sqrt(2). Capacity, the 512-token short window, optimizer structure and all schedule shapes are unchanged.", "command": ["/usr/bin/python3", "/data3/zhubaiyu/fengheguai/fengheguai/rendezvous_agent.py", "--trial", "/data3/zhubaiyu/fengheguai/campaigns/h200-claude/nodes/t0005", "--result", "/data3/zhubaiyu/fengheguai/campaigns/h200-claude/nodes/t0005/.fengheguai-agent-result.json", "--schema", "/data3/zhubaiyu/fengheguai/campaigns/h200-claude/control/agent_output.schema.json", "--campaign", "/data3/zhubaiyu/fengheguai/campaigns/h200-claude", "--inbox", "/data3/zhubaiyu/fengheguai/campaigns/h200-claude-rendezvous"], "errors": [], "expected_val_bpb_effect": "Two-sided and diagnostic. If the rate mismatch caused the t0003 loss, expect a decrease of roughly 0.001-0.004 bpb below champion t0004 at 0.981147, since the step count roughly doubles to about 4100. If 2**18 is the true critical batch size, expect an increase of 0.002-0.005 bpb, though still well above the 0.986688 that t0003 scored with unscaled rates; that partial recovery alone would quantify how much of the t0003 penalty was rate mismatch.", "hypothesis": "t0003 and t0004 offer competing explanations for the failure at TOTAL_BATCH_SIZE=2**17. Either 2**18 really is the critical batch size, or t0003 simply inherited learning rates that were 2x too large for the batch it ran. t0004 showed the learning-rate axis is live at 2**18, since a 1/sqrt(2) rescale bought 0.000482 bpb against a repeat noise level near 0.0001. This node moves batch and learning rate together along the square-root scaling line: batch 2**17 with all three main rates at half their original 2**19 values. If the t0003 failure was a rate mismatch, this should now beat champion t0004; if 2**18 is genuinely critical, it will lose even with matched rates, which settles the question.", "log_path": "/data3/zhubaiyu/fengheguai/campaigns/h200-claude/artifacts/t0005/agent.log", "return_code": 0, "risk": "This node deliberately moves two coupled quantities at once, so a win is attributable to the joint scaling rather than to either factor alone. Square-root scaling is also only a heuristic for Muon, whose updates are orthogonalised, so the matched rate may be mis-specified in either direction. Throughput may dip slightly because the 64x2048 micro-batch uses the GPU less efficiently, as already seen in t0003 where doubling the step count returned only 4082 rather than 4200 steps.", "success": true, "timed_out": false}, "secondary_parent_id": null, "selection_reason": "Exploit a top-K branch selected by quality plus an under-exploration bonus.", "source_sha256": "36e89821003667c879657feb6fd9392d57744fad6cb701530b2f687680e0ba41", "stage": "refine", "status": "discard", "training_seconds": 300.0, "trial_id": "t0005", "workspace": "/data3/zhubaiyu/fengheguai/campaigns/h200-claude/nodes/t0005"}, "prev_hash": "1d1844cf8754c36dad6d67448f9e8b72dba03abf24065c44bc4a31de0801216c", "seq": 12, "timestamp": "2026-08-20T12:22:09.677956+00:00"}
{"hash": "9831eead3e1804c6d594142170b5e1132082d4bcdde3a58a313594ce3367e65e", "kind": "trial_started", "payload": {"parent_id": "t0005", "reason": "Exploit a top-K branch selected by quality plus an under-exploration bonus.", "secondary_parent_id": null, "stage": "refine", "trial_id": "t0006"}, "prev_hash": "370f14b763328e23bdd8ad7d389fe16071c6da4095b243b5f0f37ca4387db9a1", "seq": 13, "timestamp": "2026-08-20T12:22:09.683704+00:00"}
