trial	parent	stage	val_bpb	training_seconds	status	description
b0000		baseline	0.991068	300.150000	baseline	unaltered baseline
t0001	b0000	refine	0.983511	300.050000	keep	Single-variable hyperparameter change: TOTAL_BATCH_SIZE 2**19 -> 2**18. This also drops gradient accumulation from 2 micro-steps to 1 (DEVICE_BATCH_SIZE stays 128, sequence length stays 2048). No architecture, optimizer, schedule, or learning-rate change.
t0002	t0001	explore	0.981629	300.100000	keep	One-line architectural change in GPT._compute_window_sizes: short_window = long_window // 2 becomes long_window // 4, so the S layers of the SSSL pattern attend over 512 tokens instead of 1024. The L layers, the forced full-context last layer, the pattern itself, model capacity, optimizer, batch size and schedules are all unchanged from champion t0001.
t0003	t0002	refine	0.986688	300.000000	discard	Batching-only change on champion t0002: TOTAL_BATCH_SIZE 2**18 -> 2**17 and DEVICE_BATCH_SIZE 128 -> 64, keeping gradient accumulation at exactly 1 micro-step. Sequence length 2048, the SSSL pattern with the 512-token short window from t0002, capacity, optimizer and all schedules are unchanged.
t0004	t0002	refine	0.981147	300.100000	keep	One coherent recipe change on champion t0002: rescale the learning rates to match the batch size actually in use. EMBEDDING_LR 0.6 -> 0.4243, UNEMBEDDING_LR 0.004 -> 0.002828, MATRIX_LR 0.04 -> 0.02828, each divided by sqrt(2). SCALAR_LR, batch size, the 512-token short window, capacity, optimizer structure and all schedule shapes are unchanged.
t0005	t0004	refine	0.981248	300.000000	discard	Coordinated move along the batch-versus-learning-rate scaling line on champion t0004: TOTAL_BATCH_SIZE 2**18 -> 2**17 and DEVICE_BATCH_SIZE 128 -> 64 (gradient accumulation stays at 1), with EMBEDDING_LR 0.4243 -> 0.3, UNEMBEDDING_LR 0.002828 -> 0.002 and MATRIX_LR 0.02828 -> 0.02, each a further 1/sqrt(2). Capacity, the 512-token short window, optimizer structure and all schedule shapes are unchanged.
t0006	t0005	refine	0.983237	300.100000	discard	Single-constant architectural change on elite branch t0005: HEAD_DIM 128 -> 64, which makes build_model_config produce n_head = n_kv_head = 8 instead of 4 at an unchanged model_dim of 512. Parameter count, estimated FLOPs per token, batch size 2**17, the halved learning rates, the 512-token short window, depth 8 and every schedule are unchanged.
t0007	t0004	recombine	0.987139	300.100000	discard	Recombination of the two elite lines along their single shared axis. From t0005 it takes TOTAL_BATCH_SIZE 2**17 with DEVICE_BATCH_SIZE 64 and gradient accumulation 1; from t0004 it takes the principle that rates must be rescaled to the batch, extended from the 1/sqrt(2) exponent to full linear scaling: EMBEDDING_LR 0.15, UNEMBEDDING_LR 0.001, MATRIX_LR 0.01, each 1/4 of the original 2**19-batch value. Capacity, HEAD_DIM 128, the 512-token short window, depth 8 and all schedules are unchanged.
t0008	t0004	explore	0.980245	300.100000	keep	One structural change on champion t0004: has_ve now returns True for every layer instead of only alternating layers, so all 8 blocks carry a value embedding and a ve_gate rather than 4. This roughly doubles value-embedding parameters from 16.8M to 33.5M (vocab 8192 by kv_dim 512 per layer). Depth, model_dim, HEAD_DIM 128, batch 2**18, the rescaled learning rates, the 512-token short window and all schedules are unchanged.
t0009	t0008	refine	-	-	failed	Document-boundary masking on champion t0008. GPT.forward derives document starts from BOS positions in the flattened batch and builds a cu_seqlens tensor; CausalSelfAttention and Block thread that descriptor through, and attention calls flash_attn_varlen_func with per-document sequence boundaries instead of flash_attn_func over whole rows. The sliding-window sizes, causality, capacity, dense value embeddings, batch 2**18, learning rates and all schedules are unchanged, so only the attention support set differs.
t0010	t0009	debug	0.978165	300.050000	keep	Debug repair of t0009 with the mechanism intact. The cu_seqlens construction moves into a module-level build_varlen helper; the training loop calls it eagerly, applies torch._dynamo.mark_dynamic to the varying dimension there, and passes the descriptor into the compiled model through a new trailing varlen keyword on GPT.forward. When varlen is not supplied, forward still builds it internally, which keeps the locked evaluator path document-masked since prepare.evaluate_bpb calls model(x, y, reduction=none) and cannot pass the extra argument. Attention still uses flash_attn_varlen_func with per-document boundaries; capacity, dense value embeddings, batch, learning rates, windows and schedules are untouched.
t0011	t0010	explore	0.978684	300.100000	discard	One constant changed on champion t0010: WINDOW_PATTERN from SSSL to S. Because _compute_window_sizes cycles the pattern across layers and then unconditionally forces the final layer to the full window, this yields seven 512-token short layers plus one full-context layer, instead of six short and two full. Capacity, HEAD_DIM, dense value embeddings, document masking, batch 2**18, learning rates and every schedule are unchanged.
t0012	t0010	refine	0.977934	300.050000	keep	One learning rate changed on champion t0010: EMBEDDING_LR 0.4243 back to 0.6, which drives both transformer.wte and all eight value embeddings. UNEMBEDDING_LR stays 0.002828 and MATRIX_LR stays 0.02828, so the square-root rescale remains in force for the other two groups. Batch 2**18, document masking, dense value embeddings, the SSSL pattern with the 512-token short window, capacity and every schedule are unchanged.
t0013	t0012	explore	0.974229	300.050000	keep	Capacity increase on champion t0012: DEPTH 8 to 10 with ASPECT_RATIO 64 to 51, chosen so that build_model_config still rounds to a model_dim of exactly 512 with 4 heads of width 128. Width, HEAD_DIM, document masking, dense value embeddings (now on all ten layers), batch 2**18, the learning rates and every schedule are unchanged, so depth is the only variable. Matrix parameters rise about 25 percent to 31.5M and value embeddings to 41.9M.
t0014	t0013	recombine	0.974842	300.100000	discard	One learning rate changed on champion t0013: EMBEDDING_LR 0.6 to 0.8, driving transformer.wte and all ten value embeddings. UNEMBEDDING_LR stays 0.002828 and MATRIX_LR stays 0.02828. Depth 10, width 512, document masking, dense value embeddings, batch 2**18 and every schedule are unchanged, so the embedding rate is the only variable and the result is directly comparable to the 0.4243 versus 0.6 comparison at depth 8.
t0015	t0013	explore	0.978027	300.000000	discard	One constant changed on champion t0013: ASPECT_RATIO 51 to 64, so at DEPTH 10 the model_dim becomes exactly 640 with 5 heads of width 128 rather than 512 with 4 heads. Depth stays 10, and document masking, dense value embeddings, HEAD_DIM, batch 2**18, the learning rates and every schedule are unchanged. Matrix parameters rise about 56 percent to roughly 49M and per-layer attention cost rises with the wider residual stream.
t0016	t0013	refine	0.973422	300.100000	keep	Capacity increase on champion t0013 along the axis that paid: DEPTH 10 to 12 with ASPECT_RATIO 51 to 42, chosen so build_model_config still rounds to a model_dim of exactly 512 with 4 heads of width 128. Width, HEAD_DIM, document masking, dense value embeddings (now 12 tables), batch 2**18, the learning rates and every schedule are unchanged, so depth is again the only variable. Matrix parameters rise about 20 percent and the value-embedding block grows to roughly 50M.
t0017	t0016	refine	0.973371	300.150000	keep	One learning rate changed on champion t0016: MATRIX_LR 0.02828 to 0.0231, which is the existing 1/sqrt(2) batch rescale multiplied by a further sqrt(8/12) depth correction. EMBEDDING_LR stays 0.6, UNEMBEDDING_LR stays 0.002828, and depth 12, width 512, document masking, dense value embeddings, batch 2**18 and every schedule are unchanged, so the Muon rate is the only variable.
t0018	t0017	refine	0.974383	300.000000	discard	One constant changed on champion t0017: WEIGHT_DECAY 0.2 to 0.1. It enters through get_weight_decay, which linearly decays it to zero across the run and applies it as the cautious decay term inside muon_step_fused, so only the Muon matrix groups are affected; the AdamW groups already run at weight_decay 0. Depth 12, width 512, document masking, dense value embeddings, batch 2**18, all three learning rates and every other schedule are unchanged.
t0019	t0017	refine	0.973547	300.200000	discard	One constant changed on champion t0017: WEIGHT_DECAY 0.2 to 0.3, entering through get_weight_decay, which decays it linearly to zero over the run and applies it as the sign-masked cautious decay inside muon_step_fused. Only the Muon matrix groups are affected since the AdamW groups run at weight_decay 0. Depth 12, width 512, document masking, dense value embeddings, batch 2**18, all learning rates and every other schedule are unchanged.
t0020	t0017	explore	0.974838	300.200000	discard	One constant changed on champion t0017: WARMDOWN_RATIO 0.5 to 0.8, reshaping get_lr_multiplier so the constant-rate phase runs to 20 percent of the time budget instead of 50 percent and the linear decay to zero occupies the remaining 80 percent. WARMUP_RATIO stays 0.0 and FINAL_LR_FRAC stays 0.0, so the schedule still starts at full rate and still ends at exactly zero. Depth 12, width 512, document masking, dense value embeddings, batch 2**18, all learning rates and WEIGHT_DECAY 0.2 are unchanged. Since the schedule is driven by elapsed training time rather than step index, the shape is unaffected by the step count.
t0021	t0017	recombine	0.974941	300.000000	discard	Capacity increase synthesising both elite lines: DEPTH 12 to 14 with ASPECT_RATIO 42 to 36, so build_model_config still rounds to model_dim 512 with 4 heads of width 128. MATRIX_LR is held at the t0017 value of 0.0231 rather than re-corrected for the new depth, which is exactly what the flatness result licenses. Width, document masking, dense value embeddings (now 14 tables), batch 2**18, the other learning rates, WEIGHT_DECAY 0.2 and every schedule are unchanged.
t0022	t0017	explore	0.975177	300.000000	discard	One function body reverted on champion t0017: has_ve returns to the upstream alternating rule, layer_idx modulo 2 equal to (n_layer - 1) modulo 2, instead of returning True for every layer. At depth 12 this halves the value-embedding tables from 12 to 6 and removes their ve_gate projections, cutting roughly 25M parameters and their optimizer state. Depth 12, width 512, document masking, batch 2**18, all learning rates, WEIGHT_DECAY 0.2 and every schedule are unchanged.
t0023	t0017	explore	0.973534	300.200000	discard	Optimizer change on champion t0017: setup_optimizer gains a value_embedding_lr argument that defaults to embedding_lr, so behaviour is unchanged when it is not supplied, and the existing value_embeds parameter group now uses it instead of embedding_lr. A new VALUE_EMBEDDING_LR constant is set to 0.9 and passed at the call site, while EMBEDDING_LR stays 0.6 for wte. No architecture, capacity, batching, masking or schedule changes: depth 12, width 512, document masking, dense value embeddings, batch 2**18, MATRIX_LR 0.0231, UNEMBEDDING_LR 0.002828 and WEIGHT_DECAY 0.2 all remain as in the champion.
t0024	t0017	explore	0.982521	300.200000	discard	Architectural change on champion t0017: a new skip_lambdas parameter of length n_layer//2, zero-initialised, added to the optimizer as its own AdamW scalar group with the same settings as x0_lambdas. GPT.forward stores the output of each of the first 6 layers and adds skip_lambdas[i - 6] times the paired encoder output into the input of each of the last 6 layers, pairing layer 6 with 5 through layer 11 with 0. The parameter-count assertion, FLOP estimate and scaling-parameter report are updated to include the new scalars. Depth 12, width 512, document masking, dense value embeddings, batch 2**18, all learning rates, WEIGHT_DECAY 0.2 and every schedule are unchanged.
t0025	t0017	explore	0.974106	300.000000	discard	Same architectural change as t0024, with one difference: the skip_lambdas AdamW group now uses lr = scalar_lr * 0.01, matching how resid_lambdas is treated, instead of the full scalar_lr that x0_lambdas gets. A zero-initialised skip_lambdas of length n_layer//2 is added, GPT.forward stores the first 6 layer outputs and adds skip_lambdas[i-6] times the paired encoder output into each of the last 6 layers, and the parameter-count assertion, FLOP estimate and scaling report are updated. Depth 12, width 512, document masking, dense value embeddings, batch 2**18, all learning rates, WEIGHT_DECAY 0.2 and every schedule are unchanged from champion t0017.
t0026	t0017	explore	0.974129	300.100000	discard	One constant changed on champion t0017: WARMDOWN_RATIO 0.5 to 0.35, so get_lr_multiplier holds the full rate until 65 percent of the time budget and then decays linearly to zero over the final 35 percent. WARMUP_RATIO stays 0.0 and FINAL_LR_FRAC stays 0.0, so the trajectory still starts at full rate and ends at exactly zero. The U-net skip mechanism from t0024 and t0025 is not carried forward. Depth 12, width 512, document masking, dense value embeddings, batch 2**18, all learning rates and WEIGHT_DECAY 0.2 are unchanged.
t0027	t0017	explore	0.973499	300.000000	discard	One constant changed on champion t0017: ADAM_BETAS from (0.8, 0.95) to (0.8, 0.98), leaving beta1 untouched. This affects the four groups that pass adam_betas through setup_optimizer: lm_head, wte, the value embeddings and resid_lambdas. The x0_lambdas group is unaffected because it hardcodes its own (0.96, 0.95). Muon and its separate NorMuon beta2 of 0.95 are untouched, as are depth 12, width 512, document masking, dense value embeddings, batch 2**18, all learning rates, WEIGHT_DECAY 0.2 and every schedule.
t0028	t0017	recombine	0.975732	300.200000	discard	One value changed on champion t0017: the terminal constant in get_muon_momentum from 0.95 to 0.98, so momentum still warms up from 0.85 across the first 300 steps but settles at 0.98 for the remainder of the run. The NorMuon second-moment beta2, which is a separate 0.95 set in setup_optimizer, is deliberately not touched, nor is MATRIX_LR at 0.0231. Depth 12, width 512, document masking, dense value embeddings, batch 2**18, the Adam betas, WEIGHT_DECAY 0.2 and every schedule are unchanged.
t0029	t0017	explore	0.974423	300.200000	discard	One value changed on champion t0017: the terminal constant in get_muon_momentum from 0.95 to 0.92, with the 0.85 starting value and the 300-step warmup ramp untouched. The NorMuon second-moment beta2 of 0.95 in setup_optimizer is a separate quantity and is not changed, nor is MATRIX_LR at 0.0231. Depth 12, width 512, document masking, dense value embeddings, batch 2**18, Adam betas, WEIGHT_DECAY 0.2 and every schedule are unchanged.
t0030	t0017	explore	0.974557	300.100000	discard	One expression changed on champion t0017: short_window in GPT._compute_window_sizes from long_window // 4 back to long_window // 2, so the nine S layers of the SSSL pattern at depth 12 attend over 1024 tokens instead of 512. The three L layers stay at the full 2048 context and the pattern itself is unchanged. Depth 12, width 512, document masking, dense value embeddings, batch 2**18, all learning rates, WEIGHT_DECAY 0.2 and every schedule are unchanged.
t0031	t0017	explore	0.973163	300.000000	keep	One constant changed on champion t0017: CausalSelfAttention.ve_gate_channels from 32 to 128, so each of the twelve ve_gate projections reads the first 128 residual channels instead of the first 32. Parameter count rises by 384 weights per gated layer, a rounding error against 96M, and the per-token FLOP change is negligible. The gate form, the doubling through sigmoid, dense value embeddings, depth 12, width 512, document masking, the 512-token short window, batch 2**18, all learning rates, WEIGHT_DECAY 0.2 and every schedule are unchanged.
t0032	t0031	explore	0.975306	300.100000	discard	One expression changed on champion t0031: ve_gate_channels from the literal 128 to self.n_embd, which is 512 here, so each of the twelve ve_gate projections reads the whole residual vector instead of its first 128 channels and x[..., :self.ve_gate_channels] becomes the full x. Each gate projection grows from 128x4 to 512x4 weights, adding about 18K parameters across the model against 96M. Dense value embeddings, depth 12, width 512, document masking, the 512-token short window, batch 2**18, all learning rates, WEIGHT_DECAY 0.2 and every schedule are unchanged.
t0033	t0031	explore	0.976978	300.100000	discard	One default changed on champion t0031: the base argument of GPT._precompute_rotary_embeddings from 10000 to 1000. Both call sites, in __init__ and in init_weights, use the default, so the whole rotary table is rebuilt at the new base. The slowest wavelength is still about 6283 positions, comfortably longer than the 2048 maximum context, so no position wraps within a sequence. Head dimension 128, the 512-token short window, the SSSL pattern, document masking, dense value embeddings with the 128-channel gate, depth 12, width 512, batch 2**18, all learning rates and every schedule are unchanged.
t0034	t0031	explore	0.973097	300.150000	keep	One default changed on champion t0031: the base argument of GPT._precompute_rotary_embeddings from 10000 to 30000, rebuilding the rotary table at both call sites. Everything else matches the champion: head dimension 128, the 512-token short window with the SSSL pattern, document masking, dense value embeddings with the 128-channel gate, depth 12, width 512, batch 2**18, all learning rates, WEIGHT_DECAY 0.2 and every schedule.
t0035	t0034	recombine	0.973765	300.100000	discard	One constant changed on champion t0034: ve_gate_channels from 128 to 256, so each of the twelve value-embedding gates reads the first 256 residual channels instead of 128. The rotary base stays at the champion value of 30000, which the elites jointly show to be equivalent to 10000. Dense value embeddings, depth 12, width 512, document masking, the 512-token short window, batch 2**18, all learning rates, WEIGHT_DECAY 0.2 and every schedule are unchanged.
t0036	t0034	explore	0.977341	300.100000	discard	One constant changed on champion t0034: the softcap used in GPT.forward from 15 to 30, applied identically as softcap*tanh(logits/softcap) after the float32 cast. Nothing else moves: the value-embedding gate stays at its measured optimum of 128 channels, rotary base stays 30000, depth 12, width 512, document masking, dense value embeddings, the 512-token short window, batch 2**18, all learning rates, WEIGHT_DECAY 0.2 and every schedule are unchanged.
t0037	t0034	explore	0.972704	300.050000	keep	One constant changed on champion t0034: the softcap in GPT.forward from 15 to 10, keeping the same softcap*tanh(logits/softcap) form after the float32 cast. The value-embedding gate stays at its measured optimum of 128 channels, rotary base stays 30000, and depth 12, width 512, document masking, dense value embeddings, the 512-token short window, batch 2**18, all learning rates, WEIGHT_DECAY 0.2 and every schedule are unchanged.
t0038	t0037	refine	0.977910	300.000000	discard	One constant changed on champion t0037: the softcap in GPT.forward from 10 to 7, keeping the softcap*tanh(logits/softcap) form applied after the float32 cast. The value-embedding gate stays at 128 channels, rotary base at 30000, and depth 12, width 512, document masking, dense value embeddings, the 512-token short window, batch 2**18, all learning rates, WEIGHT_DECAY 0.2 and every schedule are unchanged.
t0039	t0037	explore	0.975856	300.100000	discard	One learning rate changed on champion t0037: UNEMBEDDING_LR from 0.002828 to 0.002, affecting only the lm_head AdamW group. EMBEDDING_LR stays 0.6, MATRIX_LR stays 0.0231 and the value-embedding group is untouched. The softcap stays at its measured optimum of 10, the value-embedding gate at 128 channels, rotary base at 30000, and depth 12, width 512, document masking, dense value embeddings, batch 2**18, WEIGHT_DECAY 0.2 and every schedule are unchanged.
t0040	t0037	refine	0.973969	300.100000	discard	One learning rate changed on champion t0037: UNEMBEDDING_LR from 0.002828 back to 0.004, the value the recipe shipped with, affecting only the lm_head AdamW group. EMBEDDING_LR stays 0.6, MATRIX_LR stays 0.0231, and the softcap stays at its measured optimum of 10, the value-embedding gate at 128 channels, rotary base at 30000, with depth 12, width 512, document masking, dense value embeddings, batch 2**18, WEIGHT_DECAY 0.2 and every schedule unchanged. This completes the decomposition of the t0004 bundle: all three rates will then have been tested individually at the current operating point.
t0041	t0037	explore	0.972811	300.000000	discard	One argument changed on champion t0037: the beta2 passed to the Muon parameter groups in setup_optimizer from 0.95 to 0.98, which feeds second_momentum_buffer.lerp_ inside muon_step_fused. The Muon momentum stays at its bracketed optimum of 0.95 and ns_steps stays 5, so only the variance-reduction horizon moves. The AdamW betas are a separate constant and are unchanged, as are the softcap of 10, the 128-channel value-embedding gate, rotary base 30000, depth 12, width 512, document masking, dense value embeddings, batch 2**18, all learning rates, WEIGHT_DECAY 0.2 and every schedule.
